"Export time:  2/12/2024, 6:37:24 PM","","ASIN","Product Name","Brand","Price","Monthly Units Sold","Daily Units Sold","Monthly Revenue","Date First Available","Net Revenue","Star Rating","Reviews","Amazon Fees","BSR","LQS","Seller Type","Sellers","Category","Product Tier","Dimensions","Weight","Link"
"","","B076KPCJL5","SMELLS BEGONE Air Freshener Pet Odor Absorber Gel - Made with Essential Oils - Absorbs and Eliminates Odor in Pet Areas, Bathrooms, Cars, & Boats - Calming Rain Scent - 15 Ounce - 2 Pack","SMELLS BEGONE","$16.95","1,500","50","$25,425","06/30/2017","$9.89","4","6,334","$7.06","16,496","6","FBA","2","Health & Household","Standard","3.9 x 3.8 x 7.5 in","15 oz","https://www.amazon.com/dp/B076KPCJL5"
"Odor Removal for Home & Pets","","B0BVGVCCDX","SilverWorks! Pet Odor Eliminator Spray For Home - Safe, Natural, Silver Ion Deodorizer - Cat, Dog Smell And Urine Odor Eliminator For Carpet, Furniture And Litter -16.9oz","SilverWorks!","$24.99","954","60","$23,840","12/15/2023","$16.10","4.8","22","$8.89","4,444","6","FBA","1","Pet Supplies","Standard","2 x 11 x 2 in","1.43 lb","https://www.amazon.com/dp/B0BVGVCCDX"
"Average Monthly Sales: 3,818","","B0CKGYMVYS","Thornell Odor Eliminator 128oz Concentrate  K.O.E. Apricot Odor Eliminator for Strong Odor for Cages, Runs & More  Pet Odor Eliminator for Home & Kennel w/Safe, Non-Enzymatic Formula","Odorcide","$89.95","","","","12/30/2023","","4.6","73","","","","FBA","1","","","","","https://www.amazon.com/dp/B0CKGYMVYS"
"Average Revenue: $106,480","","B06Y2GVCH1","SMELLS BEGONE Pet Odor Absorber Gel - Air Freshener & Odor Eliminator - Formulated for The Toughest Pet Odors - Fragrance Free - 15 Ounce - 2 Pack","AMERICAN KENNEL CLUB","$16.95","808","30","$13,696","04/03/2017","","4","946","","8,263","6","FBA","1","Pet Supplies","","","0.94 lb","https://www.amazon.com/dp/B06Y2GVCH1"
"Average Price: $20.94","","B08DTNC3VY","Arm & Hammer for Pets Air Care Pet Scents Deodorizing Gel Beads in Fresh Breeze | 12 oz Pet Odor Neutralizing Gel Beads with Baking Soda | Air Freshener Beads for Pet Odor Elimination (FF12689)","Arm & Hammer","$5.90","10,331","415","$60,953","07/27/2020","$0.50","4.1","4,351","$5.40","559","7","AMZ","2","Pet Supplies","Standard","3.5 x 3.5 x 4.3 in","12.8 oz","https://www.amazon.com/dp/B08DTNC3VY"
"Average No. of Ratings: 6,659","","B00OI20SXA","Angry Orange Pet Odor Eliminator for Home - 8oz Dog and Cat Pee Smell Remover for Carpet, Grass, Tile and Furniture - Citrus Concentrate, Makes 128oz of Liquid","ANGRY ORANGE","$22.07","45,074","1,721","$994,783","10/13/2014","$14.99","4.5","72,434","$7.08","67","6","FBA","1","Pet Supplies","Standard","2.3 x 2.3 x 4.6 in","8 oz","https://www.amazon.com/dp/B00OI20SXA"
"Average Sales Rank: 28,310","","B07643LGKT","Thornell Odor Eliminator Concentrate  K.O.E. Odor Eliminator for Strong Odor for Cages, Runs & More  Pet Odor Eliminator for Home & Kennel w/Safe, Non-Enzymatic Formula (Fresh Scent, 16 oz)","Odorcide","$24.95","5,368","180","$133,932","02/24/2013","$17.67","4.6","1,954","$7.28","1,500","7","FBA","7","Pet Supplies","Standard","1.75 x 8 x 4.25 in","0.01 oz","https://www.amazon.com/dp/B07643LGKT"
"Average Rating Number: 4.2","","B01G0FNOKQ","SMELLS BEGONE Pet Odor Absorber Gel - Air Freshener & Odor Eliminator - Made with Essential Oils - Fresh & Clean Scent - 15 Ounce","AMERICAN KENNEL CLUB","$9.95","768","30","$7,642","04/03/2017","$3.32","3.7","733","$6.63","8,263","6","FBA","1","Pet Supplies","Standard","3.583 x 3.74 x 3.583 in","1.049 lb","https://www.amazon.com/dp/B01G0FNOKQ"
"","","B08PJR6SVT","ANGRY ORANGE Pet Odor Eliminator for Strong - Citrus Deodorizer Dog or Cat Pee Smells on Carpet, Furniture & Indoor Outdoor Floors Puppy Supplies (24 Fl Oz + UV Flashlight)","ANGRY ORANGE","$28.99","3,463","90","$100,392","12/02/2020","$18.85","4.2","3,888","$10.14","3,055","6","FBA","1","Pet Supplies","Standard","8.15 x 3.66 x 11.54 in","1.94 lb","https://www.amazon.com/dp/B08PJR6SVT"
"","","B0723HRWJW","Nature's Miracle Advanced Dog Stain and Odor Eliminator Spray, Severe Mess Enzymatic Formula, 32 fl oz","Nature's Miracle","$13.55","16,114","583","$218,345","05/29/2017","$4.79","4.6","27,278","$8.76","356","6","AMZ","3","Pet Supplies","Standard","5.75 x 12.38 x 9.4 in","2.2 lb","https://www.amazon.com/dp/B0723HRWJW"
"","","B09RGLZTCQ","Enviroscent Non-Toxic Plug-in (2-Piece Set) Room & Home Air Freshener Kit Infused with Essential Oils | 1 Refillable Plug Hub & 1 Liquidless Scent Pods (Spring Water + Lotus)","Enviroscent","$13.99","4,368","124","$61,108","01/29/2022","$8.35","4","1,009","$5.64","7,372","6","FBA","1","Health & Household","Standard","8.5 x 2.83 x 10.08 in","5.61 oz","https://www.amazon.com/dp/B09RGLZTCQ"
"","","B0BSR9GQ3V","Fresh Wave Odor Removing Litter Box Gel, 7 oz. | Pack of 2 | Pet Odor Eliminator | Odor Absorbers for Home | Safer Odor Relief | Natural Plant-Based Odor Eliminator","Fresh Wave","$20.99","1,050","35","$22,040","01/19/2023","","4","197","","7,107","6","FBA","1","Pet Supplies","","","","https://www.amazon.com/dp/B0BSR9GQ3V"
"","","B0B3LSR3KQ","KLC Odor Eliminator for Pet Odor Home|Charcoal Stick-On Tag|2-pack|Deodorizer for Litter Box, Cat Box, Dog Crate|Cat Litter Area Air Freshener|Charcoal odor Absorber for Cat Odor & Dog Odor Home","Taiwan made","$12.95","74","3","$958.30","06/09/2022","$8.09","3.4","75","$4.86","41,485","7","FBA","2","Pet Supplies","Standard","2.36 x 0.12 x 3.94 in","0.01 oz","https://www.amazon.com/dp/B0B3LSR3KQ"
"","","B0CBNWFFBY","Kinderbean Dog and Cat Urine Stain and Odor Eliminator, Single 32 oz., Grapefruit & Thyme Scent, Enzyme Bio-Active Formula with Squeeze and Spray Top for Maximum Coverage & Performance","Kinderbean","$26.99","124","3","$3,347","12/07/2023","$17.15","4.4","65","$9.84","50,658","7","FBA","1","Pet Supplies","Standard","3 x 9 x 3 in","2.47 lb","https://www.amazon.com/dp/B0CBNWFFBY"
"","","B08D353QVL","CLEVAST Bamboo Charcoal Air Purifying Bags (Large, 4200g), Removes Odors and Moisture, Nature Fresh Air Purifier Bags, Odor Eliminator for Home, Car, Pets, Bathroom, Basement","CLEVAST","$13.98","4,890","139","$68,362","07/15/2020","$6.74","4.3","4,788","$7.24","6,597","7","FBA","3","Health & Household","Standard","1.57 x 5.59 x 6.81 in","1.85 lb","https://www.amazon.com/dp/B08D353QVL"
"","","B00F0LD7RM","Shout for Pets Turbo Oxy Urine Remover | Carpet Cleaner and Pet Odor Eliminator in Fresh Scent, 32 Oz | Fast, Easy, and Effective for Pet Odors in Homes","Shout","$7.99","511","18","$4,083","04/01/2014","$1.00","4.4","1,720","$6.99","12,678","7","AMZ","3","Pet Supplies","Standard","4 x 10 x 4 in","2.1 lb","https://www.amazon.com/dp/B00F0LD7RM"
"","","B079V68KY2","Bodhi Dog Natural Dog Odor Carpet Powder | Dry Pet Smell Eliminator | Remove Urine Smells | Plant Based and Biodegradable Room Powder | Loosens Fur and Dirt (Pack of 1)","Bodhi Dog","$14.99","4,843","122","$72,597","02/14/2018","$7.60","4.3","4,581","$7.39","7,458","7","FBA","1","Health & Household","Standard","2.87 x 2.87 x 7.76 in","1.03 lb","https://www.amazon.com/dp/B079V68KY2"
"","","B0CGQ44Y68","Avura Micro3 Ozone Generator Air Purifier for Cars - Car Odor Eliminator Air Freshener to Deodorize and Remove Odors from Cars, Trucks, RVs, UTVs, Boats","Avura","$33.99","77","4","$2,617","02/16/2023","$26.37","3.9","52","$7.62","60,762","6","FBA","1","Automotive","Standard","2 x 1.75 x 4 in","4.66 oz","https://www.amazon.com/dp/B0CGQ44Y68"
"","","B0C5TPJWT8","Furry Purr Reed Diffuser for Pet Odor Elimination, Pets Friendly Air Freshening Reed Diffuser for Pet Household, Catnip Calming Pet Deodorizer Reed Diffuser Set, Gift for Animal Lover, 6 oz","furrypurr","$29.99","60","2","$1,799","05/21/2023","","4.1","40","","50,975","7","FBA","1","Pet Supplies","","","","https://www.amazon.com/dp/B0C5TPJWT8"
"","","B093XQJSGJ","Nok Out Odor Remover, Pet Deodorizer and Cleaning Spray, 16 Fluid Ounce Spray, 2-Pack","NOK OUT","$34.99","10","","$349.90","04/29/2021","$24.06","3.5","40","$10.93","163,742","7","AMZ","2","Industrial & Scientific","Standard","5 x 12 x 10 in","2 lb","https://www.amazon.com/dp/B093XQJSGJ"
"","","B0002XJ11E","THORNELL Cat Odor-Off Concentrate Pet Smell Odor Eliminator  Cat Odor Eliminator Concentrate for Pet Urine Odor, Tomcat Spray for Cat Urine Smell, Feces on Carpet & Litter Boxes  16oz","Odorcide","$21.95","692","27","$15,189","10/04/2004","$13.52","4.5","2,225","$8.43","8,996","7","FBA","8","Pet Supplies","Standard","2 x 7.75 x 4.5 in","1.1 lb","https://www.amazon.com/dp/B0002XJ11E"
"","","B001AZNH3Q","ZORBX Unscented Odor Eliminator for Strong Odor - Used in Hospitals & Healthcare Facilities | Advanced Trusted Formula, Fast-Acting Odor Remover Spray for Dog, Cat, House & Carpet (16 oz)","ZORBX","$15.99","1,775","60","$28,382","06/10/2008","$8.45","4.1","3,024","$7.54","4,470","6","FBA","4","Pet Supplies","Standard","4.75 x 10.75 x 2.25 in","1 lb","https://www.amazon.com/dp/B001AZNH3Q"
"","","B0717BLT6V","Nature's Miracle Dog Stain and Odor Remover, Everyday Mess Enzymatic Formula, 24 fl oz","Nature's Miracle","$11.00","2,644","66","$29,084","05/29/2017","$4.21","4.6","6,116","$6.79","4,077","6","AMZ","2","Pet Supplies","Standard","2 x 11 x 3.75 in","1.67 lb","https://www.amazon.com/dp/B0717BLT6V"
"","","B08DL5KVWW","Arm & Hammer For Pets Pet Scents Solid Gel Deodorizer in Fresh Breeze Scent | Room Deodorizer Solution for Homes with Pets, Odor Removing Gel, 15 Ounces","Arm & Hammer","$8.99","2,203","78","$19,805","07/23/2020","$3.12","4","1,752","$5.87","3,525","7","AMZ","1","Pet Supplies","Standard","3.6 x 3.8 x 3.6 in","14.99 oz","https://www.amazon.com/dp/B08DL5KVWW"
"","","B08QXCRTCG","ANGRY ORANGE Odor Eliminator & Pet Stain Remover - Carpet Cleaner for Pets, Citrus Scented Dog Pee Deodorizing Spray and Enzyme Cleaner for Home with UV Flashlight","ANGRY ORANGE","$27.99","15,210","507","$425,728","02/28/2019","$19.20","4.3","26,023","$8.79","431","6","FBA","3","Pet Supplies","Standard","6.3 x 2.99 x 10.36 in","2.29 lb","https://www.amazon.com/dp/B08QXCRTCG"
"","","B0BP8C1SB9","Natural Elements Enzyme Odor Eliminator | Tough Odor Removal | Kitchen, Pet Areas, Musty Smells, Restrooms, Furniture | Pet and Family Safe Formula | 1 Gallon","Natural Elements","$21.99","90","5","$1,979","12/05/2022","$10.76","4.1","39","$11.23","98,950","7","FBA","1","Health & Household","Standard","7.2 x 6.69 x 12.83 in","8.42 lb","https://www.amazon.com/dp/B0BP8C1SB9"
"","","B0897868FG","Shout for Pets Odor and Urine Eliminator - Effective Way to Remove Puppy & Dog Odors and Stains from Carpets & Rugs - Stain & Odor Eliminator - Shout Pet Urine Destroyer, Shout Stain Remover for Pets","SHOUT","$8.99","302","11","$2,715","05/25/2020","$1.85","4.3","3,490","$7.14","18,429","6","AMZ","3","Pet Supplies","Standard","3.35 x 9.8 x 3.35 in","2.1 lb","https://www.amazon.com/dp/B0897868FG"
"","","B07NSYQ62X","FunkAway Odor Eliminating Beads, 12 oz., Supercharged Odor Absorbing Beads for the House, Car or Gym, Eliminate Smoke, Pet and Bathroom Odors for Long-Lasting Results","FunkAway","$5.98","4,941","160","$29,547","02/14/2019","$0.98","3.9","5,908","$5.00","5,726","7","AMZ","4","Health & Household","Standard","3.63 x 3.94 x 3.63 in","13.6 oz","https://www.amazon.com/dp/B07NSYQ62X"
"","","B0BT211M1R","Puracy Pet Stain and Odor Remover - Pet Odor Eliminator for Home - No Rinse Needed - Plant-Powered - Safe and Effective Carpet Pet Stain Remover, Cucumber and Mint 25oz 2pack","Puracy","$32.99","600","20","$19,794","12/10/2019","$27.55","","","$5.44","11,215","7","FBA","1","Pet Supplies","Standard","4.2 x 9 x 2.8 in","1.56 lb","https://www.amazon.com/dp/B0BT211M1R"
"","","B0BW9DX3VX","Nature's Miracle Air Care, Fabric and Surface Spray Lavender & Vanilla Scent Pet Odor Eliminator Deodorizer, 24 fl. oz.","Nature's Miracle","$13.22","844","28","$11,158","05/24/2022","$6.10","4.4","86","$7.12","8,666","7","AMZ","2","Pet Supplies","Standard","3.75 x 11 x 2 in","1.72 lb","https://www.amazon.com/dp/B0BW9DX3VX"
"","","B0C1HSPD9V","Odorcide Cat Attack Concentrate Odor Eliminator-Cat Odor Eliminator for Strong Odor - Cat Urine Odor Eliminator for Carpet & Upholstery-Cat Urine Remover for Home-Litter Box Odor Eliminator - 16 oz","Odorcide","$22.95","750","25","$17,213","04/30/2023","","4.3","130","","9,567","7","FBA","2","Pet Supplies","","","","https://www.amazon.com/dp/B0C1HSPD9V"
"","","B072FVZ1Z9","Nature's Miracle Dog Stain and Odor Remover, Everyday Mess Enzymatic Formula, Includes Continuous Power Sprayer, 1.33 gal","Nature's Miracle","$27.45","4,716","133","$129,454","05/29/2017","$15.70","4.7","6,370","$11.75","2,067","7","AMZ","1","Pet Supplies","Standard","6.56 x 11.65 x 7.72 in","7.72 lb","https://www.amazon.com/dp/B072FVZ1Z9"
"","","B0BSRBB1ML","Fresh Wave Odor Removing Litter Box Gel, 7 oz. | Pet Odor Eliminator | Odor Absorbers for Home | Safer Odor Relief | Natural Plant-Based Odor Eliminator","Fresh Wave","$11.99","1,050","35","$12,590","02/09/2023","","4","197","","7,107","6","FBA","1","Pet Supplies","","","","https://www.amazon.com/dp/B0BSRBB1ML"
"","","B01EB61TSK","Odorcide Odor Eliminator Concentrate: Odor Eliminator for Strong Odor on Carpets, Hardwood & More - Smoke, Sweat & Pet Odor Eliminator for Home w/Non-Enzymatic Formula, 64 oz","Odorcide","$46.60","654","27","$30,476","04/14/2016","$36.07","4.6","127","$10.53","9,030","7","FBA","5","Pet Supplies","Standard","4.75 x 9.5 x 4.75 in","0.01 oz","https://www.amazon.com/dp/B01EB61TSK"
"","","B000O3EG0S","Pet Odor Exterminator Candle, Cinnamon Apple, 13 oz","SPECIALTY PET PRODUCTS","$14.99","96","3","$1,439","03/24/2013","$7.60","4.4","467","$7.39","44,548","3","FBA","9","Pet Supplies","Standard","4.33 x 5.98 x 3.7 in","1.4 lb","https://www.amazon.com/dp/B000O3EG0S"
"","","B09B1QT2RP","Amazon Basics Gel Odor Eliminator, Charcoal, 1.06 Pound (Pack of 1)","Amazon Basics","$5.99","","","","06/20/2023","$0.37","4","838","$5.62","373","5","AMZ","1","Our Brands","Standard","3.63 x 3.94 x 3.63 in","1.19 lb","https://www.amazon.com/dp/B09B1QT2RP"
"","","B08JQFG63X","Lots of Lemon - Pet Odor Eliminator for Home - Professional Strength Citrus Infused Enzyme Powered Urine Odor Eliminator for Carpet, Furniture, Hardwood Floors & Rugs - Small Dogs","Lots of Lemon","$19.97","35","2","$698.95","02/28/2021","$13.33","4","511","$6.64","64,877","6","FBA","1","Pet Supplies","Standard","4 x 5.75 x 5.25 in","1.5 lb","https://www.amazon.com/dp/B08JQFG63X"
"","","B005MEJ23K","REMOVEURINE Pet Odor Eliminator for Home & Urine Destroyer - Pet Urine Odor Eliminator Spray - Urine Remover for Dogs and Cats - Pet Carpet Cleaner Solution","REMOVEURINE","$17.99","74","2","$1,331","09/16/2011","$11.75","4","1,733","$6.24","56,810","6","FBA","1","Pet Supplies","Standard","1.75 x 4.5 x 1.75 in","4.48 oz","https://www.amazon.com/dp/B005MEJ23K"
"","","B0CLH5N2GR","Morrerfresh Cat Litter Deodorizer 99% Pets Poof Odor Eliminator Cat Friendly Air Purifier Ozone Odor Removal Air Freshener for Home & Pets Litter Box Room Wardrobe Shoe Cabinet Toilet White","Morrerfresh","$39.98","30","1","$1,199","10/19/2023","$28.56","4.1","35","$11.42","84,931","6","FBA","1","Pet Supplies","Standard","8.98 x 1.85 x 9.84 in","14.08 oz","https://www.amazon.com/dp/B0CLH5N2GR"
"","","B0002XJ10K","Skunk Off Skunk Odor Eliminator Pet Spray (32oz) - Ready To Use Skunk Odor Remover For Dogs, Cats, Home, Carpet, Car, Clothes & More  Skunk Spray w/ Non-Enzymatic Formula Safe For Pets & People","Odorcide","$29.95","1,039","61","$31,118","07/14/2004","$20.46","4.1","2,634","$9.49","4,399","7","FBA","17","Pet Supplies","Standard","3.5 x 3.5 x 10.3 in","2 lb","https://www.amazon.com/dp/B0002XJ10K"
"","","B07PYHCC1K","Gonzo Natural Magic Odor Air-Magnet with Activated Charcoal - 14 Ounce (2 Pack) - Odor Eliminator for Car Closet Bathroom and Pet Area Captures and Absorbs Smoke Odors","Gonzo Natural Magic","$13.55","532","26","$7,209","03/19/2019","$5.93","4.1","3,105","$7.62","9,300","6","FBA","1","Pet Supplies","Standard","3.7 x 7.4 x 3.75 in","1.98 lb","https://www.amazon.com/dp/B07PYHCC1K"
"","","B07J64CG31","THORNELL Cat Odor-Off Concentrate Pet Smell Odor Eliminator  Cat Odor Eliminator Concentrate for Pet Urine Odor, Tomcat Spray for Cat Urine Smell, Feces on Carpet & Litter Boxes  Fresh Scent 16oz","Odorcide","$22.95","365","13","$8,377","10/03/2018","$14.37","4.3","1,035","$8.58","15,973","7","FBA","5","Pet Supplies","Standard","1.75 x 4 x 8 in","1 lb","https://www.amazon.com/dp/B07J64CG31"
"","","B08DSYZGVB","Activated Charcoal Odor Absorber 10x3.5oz w Hooks. Nature Fresh Bamboo Charcoal Air Purifying Bag Home Closet Air Freshener Deodorizer Odor Eliminator","Vergali","$18.97","9,690","382","$183,819","07/27/2020","$10.33","4.2","12,789","$8.64","2,256","7","FBA","2","Health & Household","Standard","7.77 x 3.49 x 10.67 in","2.73 lb","https://www.amazon.com/dp/B08DSYZGVB"
"","","B000QSLTX8","Citrus Magic Pet Odor Eliminator Solid Air Freshener, Fresh Citrus, 8-Ounce, Pack of 1","Citrus Magic","$7.87","2,924","102","$23,012","11/30/2010","$2.82","4","5,521","$5.05","2,696","6","AMZ","7","Pet Supplies","Standard","5 x 5 x 1.25 in","10.55 oz","https://www.amazon.com/dp/B000QSLTX8"
"","","B082KC4JT2","Bamboo Charcoal Air Purifying Bag, Activated Charcoal Bags Odor Absorber, Moisture Absorber, Natural Car Air Freshener, Shoe Deodorizer, Odor Eliminators For Home, Pet, Closet (Essential 12 Pack)","Vitscan","$22.97","4,856","142","$111,542","12/08/2019","$13.73","4.2","19,149","$9.24","6,476","7","FBA","1","Health & Household","Standard","7.99 x 3.19 x 11.3 in","2.65 lb","https://www.amazon.com/dp/B082KC4JT2"
"","","B09BP372YH","Pineapple & Papaya Enzyme Pet Stain & Odor Eliminator | Neutralize Tough Stains & Odors | Expert Cleaning Formula | Indoor Cats & Dogs | 2-pk. 20-oz bottles - Nuesta Pets","Nuesta","$29.95","213","3","$6,379","05/30/2022","$19.67","4.2","81","$10.28","49,282","7","FBA","1","Pet Supplies","Standard","4.41 x 4.09 x 11.26 in","2.98 lb","https://www.amazon.com/dp/B09BP372YH"
"","","B08CL39T78","NIYIKOW Charcoal Bags Odor Absorber (Large, 4Pack x 200g), Nature Fresh Bamboo Charcoal Air Purifying Bags, Activated Charcoal Odor Absorber for Home, Car, Closet, Pets, Basement Odor Eliminator -Grey","NIYIKOW","$12.98","1,168","43","$15,161","07/07/2020","$7.26","4.2","2,441","$5.72","18,756","7","FBA","2","Health & Household","Standard","11.02 x 1.18 x 7.09 in","7.05 oz","https://www.amazon.com/dp/B08CL39T78"
"","","B0BVGS3H72","Pet-Pourri Pet Odor Eliminator Candle, Pawsitively Fresh, 7.5 Oz - Jasmine, Fresh Air and Pear (Veterinarian Recommended)","Poo-Pourri","$15.39","3,188","114","$49,063","02/09/2023","","4.2","349","","2,419","7","AMZ","1","Pet Supplies","","","","https://www.amazon.com/dp/B0BVGS3H72"
"","","B0CCNVNW2H","Bamboo Charcoal Air Purifying Bag Activated Natural Home Odor Absorber,Deodorizer&Moisture Eliminator.Purifier Bag for Closet,Shoe,Pet,Car,large Room,Smoke Smell Remover (black cat)","VAYEEBO","$6.99","155","4","$1,083","08/01/2023","$2.66","","","$4.33","106,990","7","FBA","1","Health & Household","Standard","2 x 6 x 6 in","10.56 oz","https://www.amazon.com/dp/B0CCNVNW2H"
"","","B004H0JAZK","Cat Stain & Odor Remover - Enzyme Cleaner for Cat Urine, Feces, Blood, Vomit - 32oz","Simple Green","$8.02","332","9","$2,663","01/01/2011","$1.68","4.2","1,667","$6.34","21,504","5","AMZ","6","Pet Supplies","Standard","2.72 x 11.25 x 3.8 in","1 lb","https://www.amazon.com/dp/B004H0JAZK"
"","","B08J2M7HVB","Breathe Green Bamboo Charcoal Bags Odor Absorber (3-Pack) Activated Charcoal Odor Eliminator Bag, Natural Freshener Removes Odors and Moisture, Odor Eliminator for Home, Pets, Car, Closet, RV","Breathe Green","$14.99","36","","$539.64","09/13/2020","","4.4","124","","286,942","7","FBA","2","Health & Household","","","","https://www.amazon.com/dp/B08J2M7HVB"
"","","B01MRNDX1X","Apply Guard Professional Strength Pet Stain And Odor Eliminator for Dogs, Cats, and All Pets- Instantly Neutralize and Sanitize Tough Pet Odors and Pet Urine Stains 16oz. Cat Pee Odor Destroyer.","Apply Guard","$16.19","100","5","$1,619","11/20/2016","$1.78","4.3","256","$14.41","32,260","7","FBA","3","Pet Supplies","Oversize","22 x 4 x 14 in","1.34 lb","https://www.amazon.com/dp/B01MRNDX1X"
"","","B082L3QQCB","ANGRY ORANGE Pet Odor Eliminator for Strong Odor - Citrus Deodorizer for Dog Urine or Cat Pee Smells on Carpet, Furniture & Indoor Outdoor Floors - 128 Fluid Ounces - Puppy Supplies - 1 Gallon","ANGRY ORANGE","$59.99","46,299","1,721","$2.78M","01/17/2020","$43.06","4.3","117,954","$16.93","67","6","FBA","1","Pet Supplies","Standard","6.89 x 4.89 x 10.37 in","8.8 lb","https://www.amazon.com/dp/B082L3QQCB"
"","","B012CKSXOU","R86 Industrial All-Out Odor Eliminator, Removes Dead Animal Odor, Skunk Odor, Urine, Poop, Musty Basement & More  Natural Formula, Use Wet or Dry, Biodegradable","R86","$29.95","1,001","33","$29,980","07/22/2015","$19.67","4.3","2,951","$10.28","7,567","7","FBA","1","Pet Supplies","Standard","3.1 x 7.8 x 5.8 in","2.95 lb","https://www.amazon.com/dp/B012CKSXOU"
"","","B001EWH1PA","Arm & Hammer Home Care Pet Stain Odor Eliminator, 32 fl. oz, 32 FZ","Arm & Hammer","$13.55","30","1","$406.50","","$7.57","3.2","17","$5.98","69,227","3","FBA","1","Pet Supplies","Standard","4.7 x 2.8 x 10.6 undefined","1.95 undefined","https://www.amazon.com/dp/B001EWH1PA"
"","","B07DDLHC4G","NEWBEA Bamboo Charcoal Air Purifying Bag 12 Pack 65g Each, Charcoal Bags Odor Absorber, Shoe Deodorizer, Activated Charcoal Odor Absorber for Shoes, Home, Closet, Pet","NEWBEA","$12.99","432","14","$5,612","01/07/2018","$7.50","4.2","5,489","$5.49","45,986","6","FBA","3","Health & Household","Standard","6.26 x 2.91 x 13.15 in","2.72 oz","https://www.amazon.com/dp/B07DDLHC4G"
"","","B07KYXBNGZ","NonScents Skunk Odor Remover Head & Face Foam  Easily Eliminate Skunk Odor from Pets, Carpets, Clothing, Ready-To-Use for Dogs, Cats, Home, Carpet, Car, Clothes - Fragrance Free Freshener","NonScents","$13.97","523","33","$7,306","12/29/2018","$8.10","3.6","1,035","$5.87","7,637","7","FBA","1","Pet Supplies","Standard","2.01 x 2.01 x 7.83 in","10.41 oz","https://www.amazon.com/dp/B07KYXBNGZ"