"Export time:  2/5/2024, 5:19:38 PM","","ASIN","Product Name","Brand","Price","Monthly Units Sold","Daily Units Sold","Monthly Revenue","Date First Available","Net Revenue","Star Rating","Reviews","Amazon Fees","BSR","LQS","Seller Type","Sellers","Category","Product Tier","Dimensions","Weight","Link"
"","","B0CD8YG1TB","Skywin Laundry Pod Container Jar with Lid - Tall Laundry Pod Storage Container for Laundry Room Organization Laundry & Dishwasher Pod Laundry Container (Clear)","Skywin","$10.99","257","7","$2,824","10/31/2023","$4.82","4.8","29","$6.17","119,037","7","FBA","1","Home & Kitchen","Standard","4.92 x 7.87 x 4.92 in","15.2 oz","https://www.amazon.com/dp/B0CD8YG1TB"
"glass laundry detergent dispenser","","B0C57T4CHD","S&L Home Liquid Laundry Detergent Dispenser - 64 Oz Plastic Laundry Detergent Container, Fabric Softener Dispenser & Bleach Dispenser for Laundry Room","S&L Home","$23.99","228","6","$5,470","05/17/2023","$13.66","4.4","38","$10.33","83,344","7","FBA","1","Health & Household","Standard","4.5 x 10.3 x 13 in","1.31 lb","https://www.amazon.com/dp/B0C57T4CHD"
"Average Monthly Sales: 484","","B0C869CMKD","KIVY Glass Laundry Detergent Dispenser + Labels [Set of 2] Glass jars for Laundry Room Organization and Storage Decor - Laundry soap dispenser for liquid detergent dispenser - Scent booster container","KIVY","$29.90","562","24","$16,804","07/24/2023","","3.9","92","","29,600","6","FBA","2","Health & Household","","","","https://www.amazon.com/dp/B0C869CMKD"
"Average Revenue: $12,458","","B0CBBH9V1W","Arjust Glass Liquid Laundry Detergent Dispenser - Laundry Detergent Dispenser for Soap Bleach Softener - 2 Half Gallon Laundry Detergent Bottles - Includes Labels Funnel Cup Chalkboard and eBook","Arjust","$46.75","277","10","$12,950","07/06/2023","$36.20","4.4","149","$10.55","58,971","7","FBA","1","Health & Household","Standard","14.96 x 13.78 x 7.87 in","0.33 oz","https://www.amazon.com/dp/B0CBBH9V1W"
"Average Price: $31.67","","B0BLYDF78X","2 Pack Large Glass Laundry Detergent Dispenser 64 oz, Half Gallon Glass Jugs with Airtight Lids for Brewing, Fermenting, Gallon Glass Pump Dispenser Bottle for Softener","Sovietiep","$34.90","232","11","$8,097","11/09/2022","","4.5","37","","54,651","7","FBA","1","Health & Household","","","","https://www.amazon.com/dp/B0BLYDF78X"
"Average No. of Ratings: 610","","B0CJF9F9Q8","GADFISH Liquid Laundry Detergent Dispenser, Three 2.2L Laundry Detergent Dispenser Glass Jar for Liquid Detergent, Bleach, Fabric Softener- Laundry Soap Dispenser for Laundry Room Organization","GADFISH","$49.99","203","12","$10,148","09/19/2023","$34.26","4.4","35","$15.73","51,284","7","FBA","1","Health & Household","Standard","13.54 x 6.14 x 15.98 in","6.72 lb","https://www.amazon.com/dp/B0CJF9F9Q8"
"Average Sales Rank: 84,276","","B0BNBLCJYS","GMISUN Laundry Detergent Dispenser, Glass Liquid Laundry Soap Detergent Dispenser for Laundry Room Organization, Detergent Bleach Softener Dispenser for Laundry Room Decor, 3 Pack 64oz","GM GMISUN","$34.99","394","15","$13,786","07/19/2023","$23.31","4.6","98","$11.68","43,465","7","FBA","1","Health & Household","Standard","3.15 x 3.15 x 1.97 in","4 lb","https://www.amazon.com/dp/B0BNBLCJYS"
"Average Rating Number: 4.3","","B0BW3R6134","2 Pcs Glass Laundry Detergent Dispenser, Half Gallon Liquid Laundry Soap Dispenser for Laundry Room (64 oz. Each), Laundry Detergent Bottles with Pump Dispenser -Includes Labels, Funnel, Measuring Cup","TTDMK","$39.98","555","15","$22,189","02/16/2023","$26.05","4.6","63","$13.93","42,547","7","FBA","1","Health & Household","Standard","12.48 x 6.89 x 13.46 in","6.19 lb","https://www.amazon.com/dp/B0BW3R6134"
"","","B0B2WTTCXB","Laundry Detergent Dispenser - Fabric Softener Liquid Dispenser for Laundry Room - 64oz Plastic Soap Dispenser, Waterproof Labels, Collapsible Funnel, Extra Labels, Measuring Cup&Bamboo Tray - Set of 2","HappyHome","$28.95","1,054","25","$30,513","08/31/2022","$17.88","4.7","508","$11.07","29,113","7","FBA","1","Health & Household","Standard","9.65 x 5.87 x 12.05 in","1.83 lb","https://www.amazon.com/dp/B0B2WTTCXB"
"","","B0CL3WKTYM","Laundry Detergent Dispenser Set with Bamboo Lids, Shelf Stand, Spouts,8 Waterproof Labels,2 Glass Cups for Liquid Detergent - 2 Pack 120 oz Glass Containers for Laundry Room Organization and Decor","KitHero","$49.99","486","13","$24,295","10/30/2023","$34.86","1","1","$15.13","69,909","7","FBA","1","Home & Kitchen","Standard","2.75 x 8.26 x 12.99 in","7.09 lb","https://www.amazon.com/dp/B0CL3WKTYM"
"","","B0BZC4PM5S","Laundry Detergent Dispenser with Stainless-Steel Tap, Waterproof Labels for Liquid Detergent,Soap, Fabric Softener- 2 Pcs 1 Gallon Glass Jars Laundry Containers for Laundry Room Organization & Storage","KitHero","$39.99","280","11","$11,197","03/28/2023","","3.8","144","","52,384","6","FBA","1","Health & Household","","","","https://www.amazon.com/dp/B0BZC4PM5S"
"","","B0BG1WDCYV","Calindiana Modern Farmhouse Liquid Laundry Detergent and Fabric Softener Dispenser for Laundry Room Decor and Organization, PET Plastic Landry Soap Containers with Water Resistant Labels, Amber 64oz","Calindiana","$26.99","524","21","$14,143","01/05/2023","","4.6","110","","33,542","7","FBA","1","Health & Household","","","","https://www.amazon.com/dp/B0BG1WDCYV"
"","","B0BLX9STVJ","3 Pack Glass Bottles with Pump for Liquid Laundry Detergent Dispenser, Half Gallon Glass Jugs with Airtight Lids for Brewing, Softener Dispenser Containers, Extra Pumps, Labels and Funnel","Sovietiep","$29.99","188","8","$5,638","11/09/2022","","4.7","47","","32,303","7","FBA","1","Kitchen & Dining","","","","https://www.amazon.com/dp/B0BLX9STVJ"
"","","B09TBLSWK1","Half Gallon Glass Pump Dispenser Bottle, Large Jug with Pump for Laundry Soap Dispenser, Liquid Detergent, Fabric Softener, Syrup Pump - 64 oz Capacity - by Kitchentoolz","kitchentoolz","$18.99","1,012","34","$19,218","02/23/2022","$10.92","4.7","1,017","$8.07","3,956","6","FBA","4","Industrial & Scientific","Standard","5.47 x 11.34 x 5.43 in","2.121 lb","https://www.amazon.com/dp/B09TBLSWK1"
"","","B0C74JDR48","FastRack Laundry Detergent Dispenser | 1 G Clear Glass Dispenser with Pump for Commercial Soap Dispenser, Fabric Softener or Syrup Pump | 128 oz Capacity | Food Grade  ECO Friendly - Made in USA","FastRack","$17.99","423","15","$7,610","06/04/2023","$4.61","4.6","30","$13.38","9,394","7","AMZ","2","Industrial & Scientific","Oversize","9 x 11 x 9 in","3.37 lb","https://www.amazon.com/dp/B0C74JDR48"
"","","B0CQ52YLN4","Laundry Detergent Dispenser Glass Jars, 120 Oz / 3.5 L Fabric Softener Dispenser for Laundry Room Organization, Detergent Holder with Spigot for Laundry Decor, Glass Soap Container (2 Pack)","TIPGO","$42.99","759","47","$32,629","12/12/2023","$28.91","","","$14.08","17,596","6","FBA","1","Health & Household","Standard","9.29 x 7.83 x 14.65 in","4.44 lb","https://www.amazon.com/dp/B0CQ52YLN4"
"","","B0BY1JL3HQ","Mustry Glass Jars for Laundry Room Organization Jars Half Gallon Laundry Storage Glass Containers with Labels Organization with Lid for Laundry Detergent Laundry Pods Container, 2 Jars","mustry","$19.99","650","28","$12,993","02/14/2023","$9.96","4.6","442","$10.03","9,955","6","FBA","2","Kitchen & Dining","Standard","5.7 x 7.1 x 5.7 in","5.39 lb","https://www.amazon.com/dp/B0BY1JL3HQ"
"","","B09JWYL2TJ","GLADPURE Soap Dispenser - 2 Pack, 18 Oz Antique Design Thick Glass Hand Dispensers; with 304 Rust Proof Stainless Steel Pump, 6Pcs Clear Stickers, for Kitchen, Bathroom Black","GLADPURE","$16.99","4,614","136","$78,392","10/19/2021","$8.65","4.6","11,789","$8.34","5,296","7","FBA","1","Home & Kitchen","Standard","7.402 x 8.15 x 3.937 in","2.156 lb","https://www.amazon.com/dp/B09JWYL2TJ"
"","","B0BZTCXJPX","Glass Dispenser Bottle with Labels (2-Pack) - Half Gallon 64 oz. Jars with Leakproof Pump Perfect for Laundry, Fabric Softener, Kitchen Soap, Bleach, Shampoo, Syrup","HOMESPHERE","$29.99","266","8","$7,977","03/27/2023","","4.3","41","","110,655","7","FBA","1","Home & Kitchen","","","","https://www.amazon.com/dp/B0BZTCXJPX"
"","","B0792GXNSJ","32-Ounce Amber Glass Lotion Pump Bottles (2-Pack); Quart Size Brown Bottles w/Black Plastic Locking Pump Dispensers; Includes Chalk Labels","Cornucopia Brands","$24.99","186","6","$4,648","01/15/2018","$15.45","4.7","948","$9.54","68,192","6","FBA","1","Beauty & Personal Care","Standard","8 x 4.5 x 11 in","2.19 lb","https://www.amazon.com/dp/B0792GXNSJ"
"","","B0CJ4T8JJZ","[2 Pack] Laundry Detergent Dispenser for Laundry Room Organization and Storage, 1500ml Laundry Soap DispenserLiquid Laundry Detergent Dispenser with 4 Removable Labels, BPA Free & Pet Plastic, Clear","Akalin","$22.99","176","6","$4,046","09/13/2023","","4.5","2","","81,758","7","FBA","1","Health & Household","","","","https://www.amazon.com/dp/B0CJ4T8JJZ"
"","","B0CCP5P49P","Roetell 2 Sets 1 Gallon Laundry Detergent Dispenser with Stand, Measuring Cup, Glass Laundry Detergent Containr for Laundry Room Organization","Roetell","$44.99","154","5","$6,928","07/23/2023","","3.6","14","","98,519","6","FBA","1","Health & Household","","","","https://www.amazon.com/dp/B0CCP5P49P"
"","","B0CFVK8BLS","GMISUN Laundry Soap Dispenser, Glass Laundry Detergent Dispenser for Laundry Room Organization and Decor, Laundry Dispenser Container for Liquid Laundry Soap, Fabric Softener/Bleach/Powder/Beads","GM GMISUN","$24.99","268","9","$6,697","10/17/2023","","4.4","34","","62,761","7","FBA","1","Health & Household","","","","https://www.amazon.com/dp/B0CFVK8BLS"
"","","B0C18JFDY8","LIKAJON Glass Laundry Detergent Dispenser, Liquid Laundry Soap Dispenser for Laundry Room, 64oz Detergent Bleach Softener Dispenser for Farmhouse Decor, Includes Bamboo Pumps and Tray, Funnel, Labels","LIKAJON","$51.99","148","2","$7,695","04/01/2023","","4.2","44","","153,076","7","FBA","1","Health & Household","","","","https://www.amazon.com/dp/B0C18JFDY8"
"","","B0BXYXYL4F","Gallon Glass Pump Dispenser Bottle, Large Jug Laundry Liquid Detergent Dispenser with Pump for Laundry Room Organization, Soap, Fabric Softener, Commercial Condiment Dispenser- 128 oz by Kitchentoolz","kitchentoolz","$24.99","297","7","$7,422","03/08/2023","","4.7","147","","21,199","7","FBA","1","Industrial & Scientific","","","","https://www.amazon.com/dp/B0BXYXYL4F"
"","","B0BKR4NDWY","Laundry Detergent Dispenser for Laundry Room - Two Half Gallon Glass Jugs for Fabric Softener Dispenser, Liquid Laundry Soap Dispenser and Bleach - 64 oz. Black Commercial Liquid Pump Dispenser","ME Decor","$44.99","176","4","$7,918","02/21/2022","","4.8","71","","35,904","6","FBA","2","Industrial & Scientific","","","","https://www.amazon.com/dp/B0BKR4NDWY"
"","","B0C9V5YLJ1","KitHero Laundry Detergent Dispenser Set with Bamboo Lids and Handles - Easy Pour 2 Pack 50 oz Liquid Laundry Containers for Laundry Room Organization and Storage","KitHero","$25.99","505","10","$13,125","06/29/2023","","4.3","92","","59,645","7","FBA","1","Health & Household","","","","https://www.amazon.com/dp/B0C9V5YLJ1"
"","","B0C8DVY8FZ","GizmoWonders 32oz Stylish Glass Laundry Detergent Dispenser w/Bamboo Top: Perfect for Laundry Room Organization & Storage of Liquid Detergents, Softeners, Boosters, and Bleach. 4 Vintage Labels.","GizmoWonders","$21.99","294","8","$6,465","09/19/2023","","4.4","34","","68,388","6","FBA","1","Health & Household","","","","https://www.amazon.com/dp/B0C8DVY8FZ"
"","","B0BQMN33GW","LIKAJON Glass Laundry Detergent Dispenser, Liquid Laundry Soap Dispenser for Laundry Room, 64oz Detergent Bleach Softener Dispenser for Farmhouse Decor, Includes Pumps, Funnel, Labels and Bamboo Tray","LIKAJON","$37.98","109","4","$4,140","12/24/2022","","4.6","70","","115,981","7","FBA","1","Health & Household","","","","https://www.amazon.com/dp/B0BQMN33GW"
"","","B00BWC0E42","Anchor Hocking Heritage Hill Glass Drink Dispenser, 2 Gallon","Anchor Hocking","$39.99","356","9","$14,236","03/17/2013","$20.11","3.9","2,476","$19.88","30,880","6","AMZ","4","Kitchen & Dining","Oversize","13.307 x 14.016 x 10.394 in","10.715 lb","https://www.amazon.com/dp/B00BWC0E42"
"","","B0CNS15NQ9","2 Pack Laundry Detergent Dispenser with Pump and Lid, 64 Oz Glass Bottles for Laundry Room Organization and Storage, Fabric Softener Dispenser for Washer","YoenKtss","$24.99","208","11","$5,198","11/20/2023","","4.7","21","","13,129","6","FBA","1","Industrial & Scientific","","","","https://www.amazon.com/dp/B0CNS15NQ9"
"","","B0CG9B5G9B","Accguan 1-Gallon Drink Dispenser,Glass Drinking Dispenser with Glass Lid,Mason Drink Dispenser for Parties, Bar, Wedding, Homemade Juice, Laundry Detergent Dispenser,Picnics, Barbecues and Daily,1 pcs","Accguan","$18.99","281","10","$5,336","08/21/2023","","4.3","38","","26,506","7","FBA","2","Kitchen & Dining","","","","https://www.amazon.com/dp/B0CG9B5G9B"
"","","B0CJVBS6GD","2-Pack 1.25 Gallon Glass Laundry Detergent Dispensers with Faucets - Effortless Pouring, Screw Lid, Stand, Rubber Drip Mats - Laundry Room Upgrade for Fabric Softener, Liquid Detergent","TRBIHCX","$52.99","139","6","$7,366","09/25/2023","","4.1","14","","80,027","7","FBA","1","Health & Household","","","","https://www.amazon.com/dp/B0CJVBS6GD"
"","","B0BPKBQ6Z5","Arjust Glass Liquid Laundry Detergent Dispenser - Laundry Detergent Dispenser for Soap Bleach Softener - 1 Half Gallon Laundry Detergent Bottles - Includes Labels Funnel Measuring Cup and eBook","Arjust","$29.95","261","10","$7,817","02/13/2023","$21.92","4.4","149","$8.03","58,971","7","FBA","1","Health & Household","Standard","6.3 x 6.3 x 6.69 in","0.33 oz","https://www.amazon.com/dp/B0BPKBQ6Z5"
"","","B0BWX19C8C","Laundry Detergent Dispenser for Laundry Room - Two Half Gallon Amber Glass Jugs, Fabric Softener Dispenser, Liquid Laundry Soap Dispenser and Bleach - 64 oz. Black Commercial Liquid Pump Dispenser","ME Decor","$44.99","59","2","$2,654","02/25/2023","","4.7","25","","64,805","6","FBA","1","Industrial & Scientific","","","","https://www.amazon.com/dp/B0BWX19C8C"
"","","B0BJ7J39CW","AMEY Liquid Laundry Detergent Dispenser - Two 1 Gallon Glass Laundry Containers for Soap, Fabric Softener- Decorative Laundry room organization-22 Stickers-Stand-3 Wall Decals-Drip Mats-Spout-RoseGold","AMEY","$54.95","261","7","$14,342","06/01/2022","","4.2","433","","127,354","7","FBA","1","Home & Kitchen","","","","https://www.amazon.com/dp/B0BJ7J39CW"
"","","B0CJMBF53K","Glass Pump Liquid Detergent Dispenser for Laundry Room, 64oz Thick Glass Container - Ideal for Fabric Softener, Syrup, Juice, Shampoo - Pump Dispenser with Labels, Funnel, Measuring Cup","TTDMK","$35.98","106","3","$3,814","09/21/2023","","4.6","63","","49,067","7","FBA","1","Industrial & Scientific","","","","https://www.amazon.com/dp/B0CJMBF53K"
"","","B0C96JN751","TIPGO Glass Jars for Laundry Room Organization, Laundry Pods Container with 27 Labels, Detergent Holder with Bamboo Lid, Cute Storage Jars (Set of 2)","TIPGO","$27.99","872","33","$24,407","06/23/2023","$18.00","4.5","83","$9.99","8,393","6","FBA","1","Kitchen & Dining","Standard","5.5 x 5.5 x 7 in","2.53 lb","https://www.amazon.com/dp/B0C96JN751"
"","","B0CGXH1TVR","[3 Pack] 51oz Liquid Laundry Detergent Dispenser for Laundry Room Organization and Storage, Large Capacity Laundry Soap Containers with 18 Pre-Printed Labels,Glass Jars with Handles Bamboo Lids","TAAMOG","$32.99","272","6","$8,973","08/29/2023","$19.81","4.3","44","$13.18","79,990","7","FBA","1","Health & Household","Standard","13.03 x 7.52 x 13.82 in","3.19 lb","https://www.amazon.com/dp/B0CGXH1TVR"
"","","B07ZS1S4MM","FineDine Glass Drink Dispenser for Fridge - 1 Gallon Water, Laundry Detergent, Juice or Beverage Dispenser for Parties with Spigot - Serveware for BBQ, Picnic, Pool Party and Social Events","FineDine","$25.99","1,541","28","$40,051","10/29/2019","$15.06","4.3","8,343","$10.93","9,759","6","FBA","2","Kitchen & Dining","Standard","8.66 x 11.54 x 7.24 in","4.01 lb","https://www.amazon.com/dp/B07ZS1S4MM"
"","","B0C6V83JCC","Besuerte Liquid Detergent Dispenser for Laundry Room - Two 50oz Mason Jar Style Refillable & Reusable Glass Container Laundry Detergent Dispenser with Pump for Detergent, Softener, Bleach, Soap","Besuerte","$26.99","93","2","$2,510","05/31/2023","","4.4","68","","163,782","7","FBA","1","Health & Household","","","","https://www.amazon.com/dp/B0C6V83JCC"
"","","B0C74KQH6L","FastRack Laundry Detergent Dispenser | 0.5G Clear Glass Dispenser with Pump for Commercial Soap Dispenser, Fabric Softener or Syrup Pump | 64 oz Capacity | Food Grade  ECO Friendly - Made in USA","FastRack","$14.99","245","12","$3,673","06/04/2023","$6.16","4.3","14","$8.83","12,502","7","AMZ","1","Industrial & Scientific","Standard","5 x 10.44 x 13.5 in","2.05 lb","https://www.amazon.com/dp/B0C74KQH6L"
"","","B0C956978R","Laundry Detergent Dispenser for Laundry Room - Two One Gallon Glass Jugs, Fabric Softener Dispenser, Liquid Laundry Soap Dispenser or Bleach Dispenser, 128 oz - Black Liquid Pump, Includes 4 Labels","ME Decor","$59.99","107","2","$6,419","06/22/2023","","4.3","13","","61,999","7","FBA","1","Industrial & Scientific","","","","https://www.amazon.com/dp/B0C956978R"
"","","B0BXY5PW7M","HOMKO Glass Laundry Detergent Dispenser, Laundry Soap Dispenser for Laundry Room, 2PCS 50oz Mason Jar with Pump for Fabric Softener","HOMKO","$21.99","90","4","$1,979","03/08/2023","$11.66","4.7","39","$10.33","109,834","7","FBA","1","Health & Household","Standard","6 x 12 x 10 in","3.81 lb","https://www.amazon.com/dp/B0BXY5PW7M"
"","","B0CPP9WC4G","VOTUYB Laundry Detergent Dispenser, Laundry Detergent Glass Bottle Dispenser with Wooden Stopper, Large Capacity Detergent Dispenser, with Waterproof Label Laundry Soap Dispenser for Laundry Room","VOTUYB","$29.99","24","","$719.76","12/06/2023","","","","","343,928","6","FBA","1","Health & Household","","","","https://www.amazon.com/dp/B0CPP9WC4G"
"","","B0BPHBBWZG","LIVESGOODS 2 Pack Half Gallon Glass Pump Liquid Detergent Dispenser Bottle for Laundry Room, 64oz Thick Glass Container for Fabric Softener, Syrup Juice Liquid, Shampoo","LIVESGOODS","$28.99","24","1","$695.76","01/29/2023","","4.5","73","","208,382","7","FBA","1","Health & Household","","","","https://www.amazon.com/dp/B0BPHBBWZG"
"","","B0C8H6DF2S","Laundry Soap Dispenser Bottles  2-Pack 50fl oz Laundry Dispenser Bottles for Fabric Softener and Liquid Detergent  Glass Laundry Detergent Dispenser Jars with Pump for Laundry Room","GBtroo","$22.99","","","$1,379","07/09/2023","$12.81","4.3","84","$10.18","839,056","7","FBA","1","Home & Kitchen","Standard","4.6 x 11 x 4.6 in","4.06 lb","https://www.amazon.com/dp/B0C8H6DF2S"
"","","B0CN9CHS4M","Laundry Room Organization and Storage Jars: Large Capacity Acrylic Laundry Detergent Pods Container - Clear Laundry Powder Detergent Dispenser (2)","OKPOW","$24.89","360","12","$8,960","12/23/2023","","4.4","23","","51,726","","FBA","1","Health & Household","","","","https://www.amazon.com/dp/B0CN9CHS4M"
"","","B0C6QJN3P6","GMISUN Laundry Detergent Dispenser, Glass Liquid Laundry Detergent Dispenser, 1Gallon Laundry Soap Containers for Organizing Laundry Room, Laundry Storage Dispenser Jar for Liquid Detergent Fabric","GM GMISUN","$42.99","143","3","$6,148","08/01/2023","","3.7","55","","139,154","7","FBA","1","Health & Household","","","","https://www.amazon.com/dp/B0C6QJN3P6"
"","","B0BX4TV6L4","SHVEESY Half Gallon Jug with Pump Dispenser  64-Ounce Half Gallon Bottle  Glass Pump Bottle for Liquid Soap, Detergent, Fabric Softener, Syrups  Large Pump Dispenser Bottle for Kitchen, Laundry","Shveesy","$19.99","4,670","138","$93,353","02/27/2023","","4.5","3,592","","5,206","6","FBA","1","Home & Kitchen","","","","https://www.amazon.com/dp/B0BX4TV6L4"
"","","B097YWYCX4","Liquid Laundry Detergent Dispenser Set - Laundry Detergent Holder & Softener Dispenser (67.6 oz) - 2 Thick Plastic Liquid Dispensers for Laundry Organization with Pumps, Caps, Labels - WASHEE","WASHEE","$23.99","193","7","$4,630","11/07/2021","$16.62","4.4","687","$7.37","130,074","6","FBA","1","Home & Kitchen","Standard","9.843 x 11.811 x 4.961 in","0.717 lb","https://www.amazon.com/dp/B097YWYCX4"
"","","B0C8CD9H5T","GIXSEGIE Laundry Detergent Dispenser Bottle 40oz with Waterproof Label for Laundry Detergent Soap Fabric Softener Bleach Scent Booster Beads, Sturdy PET Bottle for Laundry Room Decor 2 Pack White","GIXSEGIE","$25.99","593","29","$15,412","06/16/2023","","4.5","161","","25,890","6","FBA","1","Health & Household","","","","https://www.amazon.com/dp/B0C8CD9H5T"
"","","B0C2223FKL","Skywin Gallon Pump Dispenser - 1 Gal Glass Laundry Detergent Dispenser for Laundry Room Good as Laundry Detergent Dispenser Glass Jar, Fabric Softener Dispenser, Liquid Laundry Soap Dispenser (White)","Skywin","$14.99","126","5","$1,889","04/09/2023","","2.7","16","","95,879","7","FBA","1","Health & Household","","","","https://www.amazon.com/dp/B0C2223FKL"
"","","B0CJ4SBB3K","[2 Pack] Laundry Detergent Dispenser for Laundry Room Organization and Storage,2000ml Laundry Soap DispenserLiquid Laundry Detergent Dispenser with 4 Removable Labels, BPA Free & Pet Plastic, Clear","Akalin","$23.99","166","6","$3,982","09/13/2023","","4.5","2","","81,758","7","FBA","1","Health & Household","","","","https://www.amazon.com/dp/B0CJ4SBB3K"
"","","B0BQZ713Q1","Half Gallon Glass Laundry Room Dispenser Pump Bottle for Detergent, Fabric Softener, and Soap with Waterproof Decal Stickers- 64 oz kitchentoolz - Pack of 2 Bottles","kitchentoolz","$35.99","68","1","$2,447","12/22/2022","","4.4","119","","203,670","6","FBA","2","Health & Household","","","","https://www.amazon.com/dp/B0BQZ713Q1"
"","","B09SH539BB","Laundry Detergent Dispenser for Laundry Room - Two Half Gallon Glass Jugs for Fabric Softener Dispenser, Liquid Laundry Soap Dispenser and Bleach - 64 oz. White Commercial Liquid Pump Dispenser","ME Decor","$44.97","73","2","$3,283","02/21/2022","$32.24","4.6","198","$12.73","75,297","6","FBA","1","Industrial & Scientific","Standard","10.39 x 12.17 x 6.77 in","4.449 lb","https://www.amazon.com/dp/B09SH539BB"