"Export time:  1/30/2024, 12:40:01 AM","","ASIN","Product Name","Brand","Price","Monthly Units Sold","Daily Units Sold","Monthly Revenue","Date First Available","Net Revenue","Star Rating","Reviews","Amazon Fees","BSR","LQS","Seller Type","Sellers","Category","Product Tier","Dimensions","Weight","Link"
"","","B0BXLJR6QW","WAVEWISE Sourdough Starter Jar Kit 1000ml - Large Glass Jar for Sourdough - Sourdough Starter Crock - Reusable Sour Dough Starter Jar With Thermometer, Silicone Scraper, Cloth Cover and Lid","WAVEWISE","$25.85","563","14","$14,554","03/05/2023","","4.5","67","","19,360","7","FBA","3","Kitchen & Dining","","","","https://www.amazon.com/dp/B0BXLJR6QW"
"sourdough container","","B0C78255TZ","KneadAce Pro Sourdough Bread Starter Kit- 34 oz Large Capacity Sourdough Starter Jar with 5 unique features for the perfect sour dough bread & sourdough starter kit- sourdough bread baking supplies","KNEADACE","$29.98","5,645","220","$169,237","07/21/2023","","4.7","536","","738","6","FBA","2","Kitchen & Dining","","","","https://www.amazon.com/dp/B0C78255TZ"
"Average Monthly Sales: 1,074","","B09SGDK43Y","KneadAce Sourdough Starter Jar With Date Marked Feeding Band, Thermometer, Sourdough Jar Scraper, Sourdough Container Sewn Cloth Cover & Metal Lid, Sourdough Starter Kit","KNEADACE","$25.98","4,372","225","$113,585","02/16/2022","$16.94","4.4","1,617","$9.04","715","7","FBA","1","Kitchen & Dining","Standard","4.88 x 9.09 x 4.84 in","1.39 lb","https://www.amazon.com/dp/B09SGDK43Y"
"Average Revenue: $26,509","","B0C9TD8R2W","Wissy&Konny Sourdough Starter Jar 2Pack 35OZ with Ounce Scale Line,Date Marked Feeding Band, Thermometer, Sourdough Jar Scraper, Cloth Cover & Wood Lid, Wide Mouth for Sourdough Bread Baking","Wissy&Konny","$32.99","1,431","31","$47,209","06/29/2023","$22.25","4.5","53","$10.74","8,737","7","FBA","1","Kitchen & Dining","Standard","4 x 4 x 7 in","2.8 lb","https://www.amazon.com/dp/B0C9TD8R2W"
"Average Price: $24.68","","B0C6ZZV1JG","Tyniaide Sourdough Starter Jar Kit 1000ML Wide Mouth Sourdough Starter Jar with Thermometer Scraper Cloth Cover and Aluminum Lid Sour Dough Starter Container for Sourdough Bread Baking Supplies","Tyniaide","$24.99","1,101","35","$27,514","06/02/2023","","4.6","445","","7,665","7","FBA","2","Kitchen & Dining","","","","https://www.amazon.com/dp/B0C6ZZV1JG"
"Average No. of Ratings: 439","","B0BR571P2Q","Tyniaide Sourdough Starter Kit, Sourdough Starter Jar 2 Pack (per jar 35 oz) - Glass Sourdough Crock Set. Reusable for DIY Homemade Sourdough Bread","Tyniaide","$42.99","1,292","44","$55,543","12/26/2022","","4.5","273","","6,066","7","FBA","2","Kitchen & Dining","","","","https://www.amazon.com/dp/B0BR571P2Q"
"Average Sales Rank: 41,989","","B0C112CXJM","zunmial Sourdough Starter Jar, Sourdough Starter Kit with Date Marked Feeding Band, Thermometer, Cloth Cover & Metal Lid, Reusable Sourdough Bread Baking Supplies, Home Baking Supplies","zunmial","$22.99","4,220","135","$97,018","03/29/2023","","4.3","261","","1,517","7","FBA","1","Kitchen & Dining","","","","https://www.amazon.com/dp/B0C112CXJM"
"Average Rating Number: 4.5","","B0C1RNVQ71","Sourdough Starter Jar Kit-1100ml/39Oz, Sourdough Starter Kit, Sour Dough Starter Jar With Stainless Steel Lid, Thermometer, Silicone Scraper, Cloth Cover And Date Marked Feeding Band (1 Pack)","SHTALHST","$19.99","1,149","27","$22,969","04/06/2023","$11.85","4.2","95","$8.14","10,372","7","FBA","1","Kitchen & Dining","Standard","4 x 9 x 4 in","1.01 lb","https://www.amazon.com/dp/B0C1RNVQ71"
"","","B08CF3WX5W","Large Glass Jars for Sourdough - Starter Jar with Glass Lid - Tulip Jar with Wide Mouth - Weck Jars 1 Liter Includes (Cork Lid & Keep Fresh Cover)","Weck Jars","$22.99","630","21","$14,484","07/16/2020","$14.40","4.8","917","$8.59","13,241","7","FBA","2","Kitchen & Dining","Standard","4.5 x 7 x 4.5 in","1 lb","https://www.amazon.com/dp/B08CF3WX5W"
"","","B0C3L3NJH4","Sourdough Starter Jar, 1000ML Wide Mouth Sourdough Starter Kit with Thermometer, Scraper, Cloth Cover and Metal Lid, Sour Dough Starter Jar Kit Use for Sourdough Bread Baking Supplies","Comfynest","$24.98","784","23","$19,584","04/23/2023","$16.09","4.3","88","$8.89","11,879","7","FBA","1","Kitchen & Dining","Standard","4.5 x 4.7 x 8.8 in","1 lb","https://www.amazon.com/dp/B0C3L3NJH4"
"","","B0C1RL8L5V","Sourdough Starter Jar Kit-1100ml/39Oz, Sourdough Starter Kit, Sour Dough Starter Jar With Stainless Steel Lid, Thermometer, Silicone Scraper, Cloth Cover And Date Marked Feeding Band (2 Pack)","SHTALHST","$35.99","1,099","27","$39,553","04/06/2023","$24.80","4.2","95","$11.19","10,372","7","FBA","1","Kitchen & Dining","Standard","4 x 9 x 8 in","2.12 lb","https://www.amazon.com/dp/B0C1RL8L5V"
"","","B07FLF3L62","Cambro RFS6PP190 6 Qt Round Container Wirh RFSC6PP190 Translucent Lid","Cambro","$14.45","1,583","50","$22,874","07/13/2018","$8.75","4.7","2,723","$5.70","5,285","3","FBM","21","Kitchen & Dining","Standard","7 x 8 x 10 in","2.4 oz","https://www.amazon.com/dp/B07FLF3L62"
"","","B0BRC4ZC49","Kmise Sourdough Starter Jar, 34 Oz DIY Pro Glass Sourdough Starter Jar Kit With Thermometer, Silicone Spatula, Blackboard Stickers and Cutter","Kmise","$17.99","1,823","65","$32,796","12/29/2022","$10.15","4.3","90","$7.84","3,871","7","AMZ","5","Kitchen & Dining","Standard","5.2 x 9.09 x 5.39 in","1.43 lb","https://www.amazon.com/dp/B0BRC4ZC49"
"","","B08P555DGH","Weck Tulip Jar - Sour Dough Starter Jars for Sourdough - 1 x WECK 745 Large Clear Jar with Wide Mouth - 1 Liter Includes Glass Lid, rubber seal and steel clips","WECK","$22.94","3,119","150","$71,550","11/24/2020","$14.50","4.7","1,523","$8.44","1,299","7","FBA","6","Kitchen & Dining","Standard","5 x 5 x 7 in","1 lb","https://www.amazon.com/dp/B08P555DGH"
"","","B08NPXX3WK","Weck Jars - 35.9 fl. oz Weck Tulip Jars 1 Liter - Sour Dough Starter Jars - Large Glass Jars for Sourdough - Suitable for Canning and Storage - (1 Jar, Glass Lid & Wooden Lid)","Weck Jars","$27.99","575","17","$16,094","11/22/2020","$18.65","4.7","515","$9.34","16,737","7","FBA","2","Kitchen & Dining","Standard","5 x 5 x 8 in","1.75 lb","https://www.amazon.com/dp/B08NPXX3WK"
"","","B0C2KWBMFG","Arbnic Sourdough Starter Kit with 2 Starter Jars, Sourdough Bread Baking Supplies Included Thermometer Band, Level Tracker (with 2 Jars)","Arbnic","$27.99","396","19","$11,084","04/14/2023","","4.4","78","","14,535","6","FBA","1","Kitchen & Dining","","","","https://www.amazon.com/dp/B0C2KWBMFG"
"","","B0CJDDBZM5","Hemlock Home Brewing Sourdough Starter Jar Kit, 36 oz, Sourdough Bread Baking Supplies, Sourdough Starter Jar, Glass Sourdough Starter Crock, Wide Mouth Sourdough Jar, Glass Sourdough Container","Hemlock Home Brewing","$22.95","684","9","$15,698","05/23/2022","$14.37","4.5","707","$8.58","30,879","6","FBA","2","Kitchen & Dining","Standard","5 x 5 x 5 in","1.59 lb","https://www.amazon.com/dp/B0CJDDBZM5"
"","","B08CFWDQX1","Weck Tulip Jars 1 Liter - Large Sour Dough Starter Jars with Wide Mouth - Suitable for Canning and Storage - 2 with Glass Lids","WECK","$28.98","2,994","86","$86,766","07/19/2020","$19.49","4.7","1,745","$9.49","2,754","7","FBA","7","Kitchen & Dining","Standard","4.5 x 7 x 4.5 in","1 lb","https://www.amazon.com/dp/B08CFWDQX1"
"","","B0CKVTSQM5","bd.Ai Sourdough Starter Jar Kit -Sourdough Jar with Marked Feeding Band, Thermometer, Scraper, Sewn Cloth Cover, Metal Lid, and Silicone Buckle (Starter Not Included)","bd.Ai","$18.99","270","6","$5,127","11/11/2023","$11.00","4.3","14","$7.99","45,871","6","FBA","1","Kitchen & Dining","Standard","3 x 6 x 3 in","1.08 lb","https://www.amazon.com/dp/B0CKVTSQM5"
"","","B09Y5WJLF8","Tyniaide Sourdough Starter Jar Kit, 650ml Sourdough Starter Jar With Thermometer, Silicone Scraper, Cloth Cover And Aluminum Lid. Reusable Sour Dough Starter Jar","Tyniaide","$19.99","1,122","35","$22,429","09/19/2022","$11.85","4.6","445","$8.14","7,665","7","FBA","1","Kitchen & Dining","Standard","4.882 x 9.646 x 4.724 in","1.195 lb","https://www.amazon.com/dp/B09Y5WJLF8"
"","","B09D9F1Q8M","10 Pieces Bowl Covers Reusable in 5 Size Stretch Cloth Fabric, Elastic Food Storage Covers Cotton Bread Bowl Covers Reusable Lids for Food, Fruits, Leftover (Simple Style)","Patelai","$18.99","1,344","44","$25,523","08/20/2021","$12.60","4.7","1,205","$6.39","6,126","6","FBA","1","Kitchen & Dining","Standard","6.89 x 0.91 x 12.44 in","5 oz","https://www.amazon.com/dp/B09D9F1Q8M"
"","","B0C24MY9V9","2 PCs Bread Sling - Specially Selected Platinum Silicone  Baking Mat for Dutch Oven  Sourdough Bread Baking Mat & 1 Storage Band","GUY.DRE.MAT","$19.96","3,938","170","$78,602","03/25/2023","","4.7","337","","1,093","7","FBA","1","Kitchen & Dining","","","","https://www.amazon.com/dp/B0C24MY9V9"
"","","B0BGL32S6M","Tyniaide Sourdough Starter Jar Kit, 35 Oz/1000ML Sourdough Starter Jar With Thermometer, Silicone Scraper, Cloth Cover And Lid. Reusable Sour Dough Starter Jar","Tyniaide","$21.99","1,321","44","$29,049","11/01/2022","","4.5","273","","6,066","7","FBA","1","Kitchen & Dining","","","","https://www.amazon.com/dp/B0BGL32S6M"
"","","B0CGLSZ6DN","Sourdough Starter Jar 24oz, Sourdough Starter Kit with Date Marked Feeding Band, Thermometer, Sourdough Fermentation Jar Scraper, Sewn Cloth Cover & Aluminum Lid,Sourdough Bread Baking Supplies","DWTS DANWEITESI","$19.97","264","36","$5,272","08/24/2023","","4.5","5","","7,641","7","FBA","1","Kitchen & Dining","","","","https://www.amazon.com/dp/B0CGLSZ6DN"
"","","B09HJCKGTC","Full Proof Baking Sourdough Starter Jars with Date Mark Thermometer Tracker Notes Bands - 2-Pc 10oz Small Glass Jars for Sourdough w/Lid - Sourdough Bread Starter Feeding Gift Set- Home Baking Kit","Full Proof Baking","$31.50","38","3","$1,197","09/29/2021","$23.01","4.5","81","$8.50","75,598","7","FBA","1","Kitchen & Dining","Standard","2.5 x 4 x 2.5 in","10 oz","https://www.amazon.com/dp/B09HJCKGTC"
"","","B07NYB8GSX","Cambro 4SFSPP190 4 Qt. Translucent Container with SFC2452 Kelly Green Lid, 4Quart","Cambro","$21.99","278","10","$6,113","02/21/2019","$12.83","4.7","155","$9.16","28,118","6","FBA","22","Kitchen & Dining","Standard","7.5 x 9.5 x 6.9 in","0.8 lb","https://www.amazon.com/dp/B07NYB8GSX"
"","","B0C2GQZFBM","Otuuz 11 Inch Acacia Wooden Sourdough Bread Mixing Stir Stick Spurtle Acacia Wooden Sourdough Bread Making Tools Wooden Paddle Stirring Stick for Kitchen Cooking","Otuuz","$18.99","287","13","$5,450","04/13/2023","","3.8","5","","20,857","7","FBA","1","Kitchen & Dining","","","","https://www.amazon.com/dp/B0C2GQZFBM"
"","","B0BGXVTY8D","Jonvin 4-Layer Food Storage Containers with Lids Dumpling Storage Box,Good Sealing,Stackable Food Containers","Jonvin","$28.99","414","11","$12,002","09/29/2022","$17.91","4.2","331","$11.08","24,581","6","FBA","3","Kitchen & Dining","Standard","9.1 x 5.9 x 12 in","1.92 lb","https://www.amazon.com/dp/B0BGXVTY8D"
"","","B09QXDPZK8","KEVJES Stackable Silicone Artisan Pizza Dough Proofing Boxes Proving Containers with Lids-2 pack-500ml portion (Green)","KEVJES","$13.99","482","16","$6,743","01/30/2022","$7.37","4.6","211","$6.62","16,937","6","FBA","1","Kitchen & Dining","Standard","5.67 x 5.75 x 3.23 in","0.88 lb","https://www.amazon.com/dp/B09QXDPZK8"
"","","B0CHN4PSBL","Cultures For Health Sourdough Starter Jar Kit | Easy DIY Breadmaking Kit for Sourdough Bread | Essential Baking Supplies for Homemade Bread | Glass Jar Kit With Spatula Baking Set | Fermentation Jar","Cultures For Health","$24.99","65","6","$1,624","09/07/2023","$16.10","3.7","28","$8.89","43,036","7","FBA","1","Kitchen & Dining","Standard","3.9 x 3.82 x 9.53 in","1.1 lb","https://www.amazon.com/dp/B0CHN4PSBL"
"","","B0B14V99HV","Glolaurge Sourdough Starter Jar, Sourdough Starter Kit with Thermometer, Labels, Spatula, Cloth Cover & Stainless Steel Lid, 24 Oz Wide Mouth Sourdough Starter Container","Glolaurge","$19.99","255","8","$5,097","05/11/2022","$8.05","4.4","142","$11.94","34,862","6","FBA","1","Kitchen & Dining","Oversize","11.02 x 11.02 x 11.02 in","14.1 oz","https://www.amazon.com/dp/B0B14V99HV"
"","","B0CM1WYMSM","VOXXO STORE 2 Pack - Sourdough Starter Jar Kit - Sourdough Jar Kit-Glass Jar for Sourdough Starter -Sourdough Starter Kit Beginners -Sourdough Bread Starter kit -Sour Dough Starter Jar -Sourdough Jars","VOXXO STORE","$22.79","147","2","$3,350","12/11/2023","$13.58","5","10","$9.21","100,658","7","FBA","1","Kitchen & Dining","Standard","7.56 x 3.86 x 9.49 in","2.42 lb","https://www.amazon.com/dp/B0CM1WYMSM"
"","","B0BXLHGRR2","WAVEWISE Sourdough Starter Jar with Thermometer Strip, Silicone Scraper, Cloth Cover and Aluminum Lid, 24 Oz Sourdough Starter Kit for Sourdough Bread Baking - Starter not included","WAVEWISE","$19.99","636","13","$12,714","03/05/2023","","4.3","128","","21,555","7","FBA","1","Kitchen & Dining","","","","https://www.amazon.com/dp/B0BXLHGRR2"
"","","B0CMQYP2FC","Xileanalee Pro Sourdough Starter Jar Kit 2 Packs-35 Oz Sourdough Bread Starter Jar Kit with Date Marked Feeding Band,Thermometer,Spatula,Cloth Cover& Lid for Sour Dough Bread Loaf (1)","Xileanalee","$18.99","193","3","$3,665","11/05/2023","$11.62","4.5","29","$7.37","80,024","7","FBA","1","Kitchen & Dining","Standard","3 x 6 x 3 in","16 oz","https://www.amazon.com/dp/B0CMQYP2FC"
"","","B0CM1X3TJT","VOXXO STORE - Sourdough Starter Jar Kit -Sourdough Jar Kit -Glass Jar for Sourdough Starter -Sourdough Starter Kit Beginners - Sourdough Bread Starter kit -Sour Dough Starter Jar -Sourdough Jars 24oz","VOXXO STORE","$19.99","146","2","$2,919","12/10/2023","$11.85","5","10","$8.14","100,658","7","FBA","1","Kitchen & Dining","Standard","3.3 x 3.3 x 9 in","1 lb","https://www.amazon.com/dp/B0CM1X3TJT"
"","","B08LMC76XX","Oscar's Bakery- Glass Sourdough starter Jar. Sourdough Starter kit contains 30 Oz Premium Sour dough Jar, Silicone Jar spatula, Chalkboard labels & accessories. Sourdough crock for Bread","Oscar's Bakery","$19.99","933","8","$18,651","10/20/2020","$11.20","4.2","677","$8.79","32,845","7","FBA","2","Kitchen & Dining","Standard","7.44 x 5.28 x 8.98 in","1.88 lb","https://www.amazon.com/dp/B08LMC76XX"
"","","B08JC5MTLF","Weck - Large Glass Jars for Sourdough - Starter Jar with Glass Lid - Tulip Jar with Wide Mouth - Weck Jars 1 Liter Includes (Keep Fresh Cover)","Weck Jars","$24.99","176","3","$4,398","09/16/2020","$14.21","4.8","209","$10.78","80,813","7","FBA","1","Kitchen & Dining","Standard","9.17 x 7.52 x 10.31 in","2.38 lb","https://www.amazon.com/dp/B08JC5MTLF"
"","","B07MVJNXL9","Cambro RFS6PP190 Camwear 6-Quart Round Food Storage Container with Lid","Cambro","$14.95","1,790","61","$26,761","01/15/2019","$3.91","4.8","2,720","$11.04","4,137","6","FBM","19","Kitchen & Dining","Oversize","9.37 x 8.74 x 13.35 in","12 oz","https://www.amazon.com/dp/B07MVJNXL9"
"","","B0CG9DWHQZ","Maxcheck 4 Sets Sourdough Starter Jar Sourdough Starter Kit with Thermometer Scraper, Cloth Cover and Metal Lid 24 oz Wide Mouth Sour Dough Starter Jar Container for Sourdough Bread Baking Supplies","Maxcheck","$36.99","300","11","$11,097","08/21/2023","","4.1","4","","23,991","7","FBA","1","Kitchen & Dining","","","","https://www.amazon.com/dp/B0CG9DWHQZ"
"","","B0CN6TVXWW","Sourdough Starter Kit with 32Oz Glass Jar, Sourdough Starter Jar Kit with Thermometer, Feeding Date Band, Silicone Tool, Reusable Sourdough Baking Supplies Perfect for Beginners Making Sourdough Bread","JinhzWin","$20.99","578","13","$12,132","11/12/2023","","4.5","25","","20,656","7","FBA","1","Kitchen & Dining","","","","https://www.amazon.com/dp/B0CN6TVXWW"
"","","B0CMPQGSW6","Sourdough Starter Kit - with Sourdough Starter Jar Glass & Sourdough Proofing Banneton Basket - Sourdough Bread Baking Supplies for Sourdough starter - Bread making kit for Sourdough bread Loaf","Happy Chipmunk Creations","$43.95","","","","11/05/2023","","","","","","7","FBA","1","","","","","https://www.amazon.com/dp/B0CMPQGSW6"
"","","B09N3M4BDJ","GRIN BY GRIN- 2 Packs Bread Bags to Keep Fresh, Reusable Zipper for Homemade Loaf, Freezer Storage Bag, Container, Fresh Keeping Extra Large Bags, Food Bag","GRIN BY GRIN","$23.99","3,496","95","$83,869","12/05/2021","$16.62","4.4","907","$7.37","2,409","7","FBA","1","Kitchen & Dining","Standard","12 x 0.5 x 17 in","6.1 oz","https://www.amazon.com/dp/B09N3M4BDJ"
"","","B0CN97S983","ZEAYEA Bread Box for Kitchen Countertop, Airtight Bread Storage Container, Time Recording Plastic Bread Keeper for Homemade Bread Bagel Loaf, Fresh Container for Vegetable Fruit Fridge Organizer","ZEAYEA","$21.99","221","5","$4,860","11/13/2023","$12.90","","","$9.09","50,369","6","FBA","1","Kitchen & Dining","Standard","5.5 x 6.1 x 11.4 in","1 lb","https://www.amazon.com/dp/B0CN97S983"
"","","B0C4DY4QF1","2 Pack 1 Gallon Large Fermentation Jars with 3 Airlocks and 2 SCREW Lids(100% Airtight Heavy Duty Lid w Silicone) - Wide Mouth Glass Jars w Scale Mark - Pickle Jars for Sauerkraut, Sourdough Starte","Qianfenie","$30.99","538","14","$16,673","06/27/2023","$18.71","4.7","82","$12.28","20,434","7","FBA","1","Kitchen & Dining","Standard","6.2 x 6.2 x 10.5 in","7.76 lb","https://www.amazon.com/dp/B0C4DY4QF1"
"","","B002C0G9A6","Bormioli Rocco Fido Jar - 1.5 Liter (50.75 oz.) - Blue Lid","Bormioli Rocco","$17.98","96","2","$1,726","03/09/2004","$8.51","4.7","678","$9.47","107,509","5","FBA","4","Kitchen & Dining","Standard","9.17 x 11.46 x 5.59 in","2.141 lb","https://www.amazon.com/dp/B002C0G9A6"
"","","B0CP4WS936","Sourdough Starter Jar, Sourdough Starter Kit with 35Oz /1000ML Wide Mouth Jar, Sour Dough Starter Container, Sourdough Bread Baking Supplies with Thermometer, Date Marked Feeding Band, Spatula, Spoon","JinhzWin","$19.99","150","5","$2,998","11/28/2023","$11.20","4.8","11","$8.79","50,612","7","FBA","1","Kitchen & Dining","Standard","6.3 x 5.24 x 9.88 in","1.23 lb","https://www.amazon.com/dp/B0CP4WS936"
"","","B0CM8KSRS3","ROCKSHEAT 600&900ml Sourdough Starter Jar Kit with Thermometer, Silicone Spatula, Feeding Bands & Stainless Steel Lid, Wide Mouth Sourdough Container for Bread Baking Supplies","","$19.99","30","1","$599.70","","","","","","548,030","","FBA","","Home & Kitchen","","","","https://www.amazon.com/dp/B0CM8KSRS3"
"","","B001E0KWDA","Cambro 4SFSCW135 CamSquare Square Food Storage Container (4-Quart, Polycarbonate, NSF)","Cambro","$7.99","2,587","104","$20,670","09/18/2004","$1.00","4.7","1,818","$6.99","2,155","5","AMZ","17","Kitchen & Dining","Standard","7.2 x 7.2 x 7.15 in","0.8 lb","https://www.amazon.com/dp/B001E0KWDA"
"","","B0CNVSXN5S","Yungyan 4 Sets Sourdough Starter Jar 34 oz Sourdough Starter Kit with Thermometer, Scraper, Cloth Cover and Bamboo Lid Wide Mouth Sour Dough Starter Jar Container for Sourdough Bread Baking","Yungyan","$39.99","60","3","$2,399","11/22/2023","","","","","74,452","7","FBA","1","Kitchen & Dining","","","","https://www.amazon.com/dp/B0CNVSXN5S"
"","","B0C3CNYYCF","Artcome Sourdough Starter Jar Kit - 24 Oz Sourdough Starter Jar with Aluminum Lid, Date Marked Feeding Band, Silicone Scraper, Cloth Cover and Thermometer Band, Sourdough Container for Making Bread","Artcome","$16.99","142","5","$2,413","04/23/2023","$8.65","4.3","15","$8.34","51,827","6","FBA","1","Kitchen & Dining","Standard","6.02 x 5.87 x 9.33 in","1.48 lb","https://www.amazon.com/dp/B0C3CNYYCF"
"","","B0CGV8B9LW","Lallisa 4 Pcs Food Storage Containers with Scales Square Containers with Lids and Handles Polycarbonate Air Tight Containers for Home Storage Kitchen Restaurant (4 Qt, 8 Qt)","","$47.99","90","3","$4,319","","","5","1","","88,390","","FBA","","Kitchen & Dining","","","","https://www.amazon.com/dp/B0CGV8B9LW"
"","","B08JQHVK8M","Weck Jars - 1 Liter - Large Sour Dough Starter Jars - Tulip Jar with Wide Mouth - Suitable for Canning and Storage - 2 Sourdough Jars with (Jars, Glass Lids & Keep Fresh Covers)","Weck Jars","$39.99","4,270","55","$170,757","10/08/2020","$27.56","4.7","776","$12.43","4,658","7","FBA","3","Kitchen & Dining","Standard","3.87 x 5.75 x 3.87 in","3.15 lb","https://www.amazon.com/dp/B08JQHVK8M"
"","","B0CBDKGW32","wookgreat Sourdough Starter Jar, 24 Oz Sourdough Starter Container, 4 Set Sourdough Starter Kit with Date Marked Feeding Band, Thermometer, Cloth Cover & Lid, Reusable Sourdough Bread Baking Supplies","wookgreat","$30.99","408","13","$12,644","11/16/2023","$18.71","4.6","18","$12.28","21,236","7","FBA","2","Kitchen & Dining","Standard","13.46 x 4.69 x 16.5 in","4.55 lb","https://www.amazon.com/dp/B0CBDKGW32"
"","","B0C84SZYMT","Sourdough Starter Jar Kit with 35 Oz/1000ml Sourdough Bread Baking Supplies with Thermometer, Feeding Date Band, Silicone Scraper, Silicone Spoon Cloth Cover & Wood Lid, Wide Mouth Dough Starter Jar","West Bay","$18.99","833","21","$15,819","06/14/2023","","4.3","72","","12,995","7","FBA","1","Grocery & Gourmet Food","","","","https://www.amazon.com/dp/B0C84SZYMT"
"","","B0CC9XRLGR","8INTHEAM 34oz Sourdough Jar, Sourdough Starter Jar, Sourdough Bread Starter Kit Glass Container Jars with Recipe Guide Cover Lid","8INTHEAM","$17.29","157","2","$2,715","07/18/2023","$9.56","4.7","33","$7.73","116,575","6","FBA","1","Kitchen & Dining","Standard","4.33 x 4.33 x 7.87 in","1.41 lb","https://www.amazon.com/dp/B0CC9XRLGR"
"","","B0CLP2VSS4","Suclain 4 Set Round Food Storage Containers with Lids Clear Proofing Container for Dough Bread with Scale Handle 4 Quart 6 Qt Home Restaurant Commercial Food Storage(Red)","Suclain","$41.99","60","2","$2,519","10/23/2023","$23.19","","","$18.80","102,425","7","FBA","1","Kitchen & Dining","Oversize","10.23 x 9.05 x 11.41 in","4.09 lb","https://www.amazon.com/dp/B0CLP2VSS4"
"","","B0BVRGNF39","Ameeze Effortless Sourdough Starter Jar Kit: 24oz Sourdough Jar for 3 Loaves - Smart Feeding Tracker - Thermometer - Superior Silicone Scraper - Dual Metal Lid","Ameeze","$20.97","401","8","$8,409","02/13/2023","$12.68","4.2","73","$8.29","31,873","7","FBA","1","Kitchen & Dining","Standard","3.15 x 6.7 x 3.15 in","1.41 lb","https://www.amazon.com/dp/B0BVRGNF39"
"","","B092DV1WF9","Cygnet Glass sourdough starter jar 50 Oz Fermentation tank with wood lid, fermentation tank, thermometer, silicone tank spatula, blackboard label and marking-used to store yeast starter","Cygnet","$23.99","58","1","$1,391","04/12/2021","$15.25","4.3","136","$8.74","175,370","7","FBA","1","Kitchen & Dining","Standard","3.93 x 7.08 x 3.93 in","1.34 lb","https://www.amazon.com/dp/B092DV1WF9"
"","","B07RBZ3TY3","Cambro RFSCW2135 Camwear 2-Quart Clear Round Food Storage Container with Cambro RFSCWC2135 Clear Round Lid","Cambro","$17.00","277","11","$4,709","04/29/2019","$10.78","4.2","190","$6.22","24,214","","FBA","16","Kitchen & Dining","Standard","7 x 7.7 x 4.4 in","0.701 lb","https://www.amazon.com/dp/B07RBZ3TY3"