"Export time:  2/4/2024, 6:33:45 PM","","ASIN","Product Name","Brand","Price","Monthly Units Sold","Daily Units Sold","Monthly Revenue","Date First Available","Net Revenue","Star Rating","Reviews","Amazon Fees","BSR","LQS","Seller Type","Sellers","Category","Product Tier","Dimensions","Weight","Link"
"","","B0CBK8MFBR","Tenceur 15 Pads Engineering Computation Pad Engineer Pad 8.5' x 11' Engineering Notebook Graph Paper 5 Squares Per Inch Evidence Engineering 100 Sheets Per Pad Engineering Paper 3 Hole Punched","Tenceur","$49.99","30","1","$1,500","07/09/2023","$32.31","","","$17.68","155,272","7","FBA","1","Office Products","Standard","9.06 x 4.53 x 11.42 in","14.96 lb","https://www.amazon.com/dp/B0CBK8MFBR"
"Engineering Computation Pad","","B0C4D3W2CG","12 Pads (1200 Sheets Total) Engineering Computation Pad, 8.5 x 11 Inches, 5 Squares Per Inch, Engineering Notebook Graph Paper, 3 Hole Punched Green Tint Graphing Paper","PerKoop","$35.99","12","","$431.88","05/04/2023","$27.05","3.2","6","$8.94","186,891","7","FBA","1","Office Products","Standard","9.25 x 4.49 x 11.3 in","3.53 oz","https://www.amazon.com/dp/B0C4D3W2CG"
"Average Monthly Sales: 650","","B0BYRKD54C","Seajan 5 Pack Engineering Computation Pad Engineer Pad 8.25x11 Inches Engineering Notebook Graph Paper Notebook, 5 Squares Per Inch Evidence Engineering Pad, 100 Sheets/Pack (3 Hole Punched)","Seajan","$30.99","511","8","$15,836","03/16/2023","$22.50","4.7","18","$8.49","28,044","6","FBA","1","Office Products","Standard","8.7 x 2.2 x 11.2 in","3.53 oz","https://www.amazon.com/dp/B0BYRKD54C"
"Average Revenue: $9,092","","B0C9DL1QN1","Fainne 10 Pads Engineering Computation Pad Engineer Pad 8.5' x 11' Engineering Notebook Graph Paper Notebook 5 Squares Per Inch 100 Sheets Per Pad Engineering Paper 3 Hole Punched (Cream White, Green)","Fainne","$37.99","235","5","$8,928","06/25/2023","$24.06","4.7","17","$13.93","46,810","7","FBA","1","Office Products","Standard","9.13 x 4.57 x 11.65 in","9.59 lb","https://www.amazon.com/dp/B0C9DL1QN1"
"Average Price: $22.41","","B0B3M27LNF","TOPS Engineering Computation Pads 3 Pk, 8-1/2' x 11', Glue, 5 x 5 Graph Rule on Back, Green Tint Paper, 3-Hole Punched, 100 Sheets per Pad (35507A)","Tops","$18.60","1,521","43","$28,291","06/08/2022","$9.37","4.6","93","$9.23","5,687","7","AMZ","2","Office Products","Standard","8.5 x 1.5 x 11 in","3.2 lb","https://www.amazon.com/dp/B0B3M27LNF"
"Average No. of Ratings: 465","","B001J87JTM","TOPS Engineering Computation Pad, 8-1/2' x 11', Glue Top, 5 x 5 Graph Rule on Back, Green Tint Paper, 3-Hole Punched, 100 Sheets (35500)","Tops","$8.75","4,207","90","$36,811","10/23/2008","$4.37","4.7","5,205","$4.38","2,480","7","FBA","18","Office Products","Standard","8.4 x 0.2 x 10.8 in","11.2 oz","https://www.amazon.com/dp/B001J87JTM"
"Average Sales Rank: 379,882","","B07TKXSJGV","Amazon Basics Engineering Computation Pad, 8.5' x 11', Quad/Margin Rule, 100 Sheets","Amazon Basics","$6.64","1,926","41","$12,789","10/04/2019","$2.57","4.7","2,234","$4.07","5,960","6","AMZ","1","Office Products","Standard","8.5 x 0.32 x 11 in","12 oz","https://www.amazon.com/dp/B07TKXSJGV"
"Average Rating Number: 4.5","","B000Q5Z5UO","Ampad Engineer Pad, 5 Squares per Inch, 8.5' x 11', 200 Sheet Pad, Green (22-144)","Ampad","$14.99","529","7","$7,930","05/09/2006","$7.60","4.7","728","$7.39","32,443","5","FBA","27","Office Products","Standard","0.75 x 11 x 8.5 in","1 lb","https://www.amazon.com/dp/B000Q5Z5UO"
"","","B0CKW6943F","Colarr Engineering Computation Pad 8.5' x 11' Engineering Wirebound Spiral Notebook Grid Pad 5 Squares Per Inch Graph Paper 100 Sheets Per Pad for Drafting Drawing Blueprint Sketching (Gold,3 Pads)","Colarr","$21.99","165","4","$3,628","10/10/2023","$12.26","","","$9.73","48,127","7","FBA","1","Office Products","Standard","11.42 x 1.97 x 13 in","3.88 lb","https://www.amazon.com/dp/B0CKW6943F"
"","","B0CGJ5CF3J","Zhanmai 5 Pads Engineering Computation Pad 5 Squares Per Inch 8.5' x 11' Engineering Graph Paper Notepad 100 Sheets Per Pad,3 Hole Punched (Beige, Brown)","Zhanmai","$24.99","69","1","$1,724","08/23/2023","$14.51","4.5","3","$10.48","109,518","7","FBA","1","Office Products","Standard","9.06 x 2.4 x 11.65 in","4.73 lb","https://www.amazon.com/dp/B0CGJ5CF3J"
"","","B0CNRRNCV4","PerKoop 8 Pack Colored Engineering Computation Pad, 8.5 x 11 Inches, 5 x 5 Graph Rule on Back Glue Top 3-hole Punched, 800 Sheets(Pastel Colors)","PerKoop","$33.99","94","2","$3,195","11/20/2023","$21.26","4","2","$12.73","80,326","7","FBA","1","Office Products","Standard","9.29 x 3.86 x 11.57 in","8 lb","https://www.amazon.com/dp/B0CNRRNCV4"
"","","B0C7864QVH","Eaasty 200 Sheets Engineering Graph Paper Grid Notepad Drafting Blueprint Engineering Paper Grid Paper Pad, 50 Sheets/Pad (8.5 x 11 Inch)","Eaasty","$16.99","90","2","$1,529","12/14/2022","$8.65","","","$8.34","99,150","7","FBA","1","Office Products","Standard","8.9 x 0.9 x 10.8 in","2.25 lb","https://www.amazon.com/dp/B0C7864QVH"
"","","B0CCNV228B","Tenceur 500 Sheets Engineering Pad 11''x17'' Double Sided Large Engineering Paper Graph Paper Grid Paper Drafting Pad 4''x4'' Grid Blueprint Sketching 10 Pads for Engineer Architect (Black)","Tenceur","$44.99","","","$0.00","07/23/2023","$29.11","5","1","$15.88","350,997","6","FBA","1","Office Products","Standard","11.93 x 3.54 x 17.36 in","12.7 lb","https://www.amazon.com/dp/B0CCNV228B"
"","","B001E6BXM8","TOPS Engineering Computation Pad, 8-1/2' x 11', Glue Top, 5 x 5 Graph Rule on Back, Green Tint Paper, 3-Hole Punched, 200 Sheets (35502)","Tops","$16.49","236","7","$3,892","08/07/2008","$8.88","4.7","1,216","$7.61","33,744","6","FBA","10","Office Products","Standard","8.5 x 0.5 x 11 in","1.52 lb","https://www.amazon.com/dp/B001E6BXM8"
"","","B000EFJ6VU","Ampad Engineers Computation Pad, Size 8-1/2 x 11, Greentint Paper, 5x5 Ruling, 3 Hole Punched, 100 Sheets Per Pad (22-142)","Ampad","$9.89","351","12","$3,471","04/18/2006","$4.82","4.4","323","$5.07","19,678","6","AMZ","14","Office Products","Standard","8.5 x 0.31 x 11 in","12.8 oz","https://www.amazon.com/dp/B000EFJ6VU"
"","","B0CG5QQLZ1","Lincia 12 Pcs Colored Legal Pad Writing Pads 8.5 x 11 Inch Wide Ruled 50 Sheets Per Notepad Micro Perforated Writing Pad for School, College, Office, Business (Pastel Colors)","Lincia","$35.99","147","6","$5,291","08/20/2023","$22.96","4.1","9","$13.03","39,666","6","FBA","1","Office Products","Standard","9.06 x 3.23 x 11.46 in","7.39 lb","https://www.amazon.com/dp/B0CG5QQLZ1"
"","","B0CNRNF4ZP","PerKoop 10 Pack Colored Legal Pads 8.5 x 11 60 Sheets Pastel Graph Paper 4 Squares Per Inch Grid Engineering Writing Pad Blueprint Paper for School Office College Business Supplies","PerKoop","$33.99","36","","$1,224","11/20/2023","$21.26","5","2","$12.73","202,345","7","FBA","1","Office Products","Standard","9.06 x 3.11 x 12.17 in","7.54 lb","https://www.amazon.com/dp/B0CNRNF4ZP"
"","","B0BZLTRG8H","GeekNavy 8.5' x 11' Quadrille Graph Paper 50 Sheets Portrait - 0.25' 4x4 Square Grid, Blueprint, High Brightness, Border-Outlined, Drafting (3-Pack)","GeekNavy","$26.99","170","6","$4,588","04/06/2023","$17.80","4.4","30","$9.19","37,080","6","FBA","2","Office Products","Standard","8.5 x 0.75 x 11 in","1.83 lb","https://www.amazon.com/dp/B0BZLTRG8H"
"","","B0BS8RZGBY","Honest Engineer's Notebook - 6x9in, 100 Page, Metric Grid: Dot-Grid Notebook for Practical Engineers","Honest Maker (Author)","$6.99","","","","12/18/2023","","","","","1,957,231","","AMZ","1","Books","","","","https://www.amazon.com/dp/B0BS8RZGBY"
"","","B07C28BKNX","Ampad Evidence Engineering Pad, 100 Sheets, 5 Squares Per Inch, Green Tint, 11' H x 8 1/2 W, Pack Of 5, 500 Sheets Total (22-142)","Ampad","$26.75","","","","04/08/2018","$13.16","4.3","44","$13.59","313,408","6","FBA","2","Books","Standard","10.315 x 11.535 x 2.126 in","4.231 lb","https://www.amazon.com/dp/B07C28BKNX"
"","","B005UOD4W2","ROARING SPRING 5x5 Grid Engineering Pad (Green, Enclosed Grid (200 Sheets))","ROARING SPRING","$13.29","230","6","$3,057","10/10/2011","$6.16","4.8","603","$7.13","34,803","6","FBA","1","Office Products","Standard","0.75 x 8.5 x 11 in","1.72 lb","https://www.amazon.com/dp/B005UOD4W2"
"","","B0CNRNXS7C","PerKoop 8 Pack Colored Engineering Computation Pad, 8.5 x 11 Inches, 5 x 5 Graph Rule on Back Glue Top 3-hole Punched, 800 Sheets(Fancy Colors)","PerKoop","$35.99","83","2","$2,987","11/20/2023","$22.96","4","2","$13.03","80,326","7","FBA","1","Office Products","Standard","9.06 x 3.43 x 11.57 in","7.89 lb","https://www.amazon.com/dp/B0CNRNXS7C"
"","","B004B3WJ0G","Ampad 42-142 Computation Pad, Greentint Paper, 8.5 x 11, 5 x 5 Rule, 3-Hole Punched, 100-Sheets, 1-Each","Ampad","$9.85","24","1","$236.40","08/08/2011","$4.78","4.4","37","$5.07","163,380","6","AMZ","1","Office Products","Standard","8.5 x 11 x 0.31 in","13.1 oz","https://www.amazon.com/dp/B004B3WJ0G"
"","","B006LQ9AXU","TOPS 35500 Engineering Comp Pads, 3HP,Rld,100 Sh,8-1/2-Inch x11-Inch ,GN","Tops","$11.99","","","","12/07/2011","$6.90","4.3","7","$5.09","543,116","4","FBA","9","Books","Standard","8.425 x 10.945 x 0.315 in","0.805 lb","https://www.amazon.com/dp/B006LQ9AXU"
"","","B0CNCVWXJB","suituts 6 Pads Engineering Paper Notebook, Engineering Computation Pad, 8.5X11 Inch Engineering Graph Paper,3-Hole Punched, Total 600 Sheets (Per Pad 100 Sheets)","suituts","$24.99","87","2","$2,174","11/14/2023","$13.91","3","2","$11.08","96,632","7","FBA","1","Office Products","Standard","8.78 x 2.83 x 11.14 in","6.49 lb","https://www.amazon.com/dp/B0CNCVWXJB"
"","","B08MMRBJF6","A4 Engineering Computation Pad: 100 Pages / 50 Sheets , 8.27 x 11.69 Inches | 5mm Grid Ruled Graph Paper | Blank A4 Computational Notepad | 5mm Quad ... for Engineers and Students| 80gsm Cream Paper","Tinuk Tinuk (Author)","$6.48","","","","10/27/2020","$0.64","5","2","$5.84","729,111","","AMZ","1","Books","Standard","0.25 x 11.69 x 8.27 in","11.68 oz","https://www.amazon.com/dp/B08MMRBJF6"
"","","B000DZEA2G","Ampad Computation Book, 4x4 Quad Ruled, 76 Sheets, 11-3/4' x 9-1/4'","Ampad","$21.00","582","13","$12,222","06/05/2007","$12.68","4.3","532","$8.32","18,867","5","AMZ","44","Office Products","Standard","9.25 x 2 x 11.75 in","1 lb","https://www.amazon.com/dp/B000DZEA2G"
"","","B07W5XC9FX","Mintra Office Engineer Notebooks and Pads (Engineer Notebook, 1 Pack)","Mintra Office","$14.99","120","4","$1,799","03/24/2019","","4.2","61","","55,227","5","FBA","1","Office Products","","","","https://www.amazon.com/dp/B07W5XC9FX"
"","","B0CJJKDR6Q","10 Pads Engineering Paper Notebook, Engineering Notebook, Graph Paper Notebook, 8.5 X 11inches, 5 Squares Per Inch, 100 Sheets Per Pad, Grid Paper 3 Hole Punched","Ruizhihu","$28.99","100","1","$2,899","09/19/2023","$16.11","3.8","29","$12.88","112,582","7","FBA","1","Office Products","Standard","8.5 x 0.4 x 11 in","10.82 lb","https://www.amazon.com/dp/B0CJJKDR6Q"
"","","B082H1CDSC","Mr. Pen- Engineering Paper Pad, Graph Paper, 5x5 (5 Squares per inch), 17'x11', 22 Sheets, Engineering Pad, Grid Paper, Computation Pads, Drafting Paper, Squared Paper, Blueprint Paper, Writing Paper","Mr. Pen","$8.85","7,089","230","$62,738","12/07/2019","$3.75","4.6","781","$5.10","710","6","FBA","1","Office Products","Standard","11 x 0.01 x 17 in","12 oz","https://www.amazon.com/dp/B082H1CDSC"
"","","B0017TMB64","National Computation Pad, 5 x 5 Quad Ruling and Unruled, 8.5' x 11', 200 Sheets (42389), Green","National","$16.20","208","5","$3,370","04/18/2006","$8.63","4.7","876","$7.57","45,315","6","AMZ","3","Office Products","Standard","0.63 x 8.5 x 11 in","1.65 lb","https://www.amazon.com/dp/B0017TMB64"
"","","B0006VPZ4Y","TOPS Engineering Computation Pad, 3-Hole Punched, 8.5 x 11 Inches, 5 Squares per Inch, 100 Sheets, Green, (35510)","Tops","$13.92","23","","$320.16","05/15/2005","$8.40","4.3","65","$5.52","230,095","6","AMZ","19","Office Products","Standard","8.5 x 0.31 x 11 in","12.8 oz","https://www.amazon.com/dp/B0006VPZ4Y"
"","","B001TJ5JZM","ROARING SPRING Engineering Pad, 8.5' x 11', 100 Sheets 15 Buff Paper, 5x5 Printed Back Enclosed Grid, Top Glued, 3-Hole Punched, Proudly Made in USA, Heavy Backing Board","ROARING SPRING","$11.99","180","6","$2,158","10/10/2011","$5.05","4.7","664","$6.94","37,073","6","FBA","3","Office Products","Standard","8.5 x 0.3 x 11 in","1 lb","https://www.amazon.com/dp/B001TJ5JZM"
"","","B0C658H19R","Seajan 20 Pads 2000 Sheets Engineering Computation Pad 8.5x11 Inches Engineering Notebook Graph Paper Notebook, 5 Squares Per Inch Engineering Pad Engineering Paper 3 Hole Punched","Seajan","$65.99","","","$0.00","05/23/2023","$52.55","","","$13.44","507,363","7","FBA","1","Office Products","Standard","11.2 x 4.6 x 17.7 in","3.53 oz","https://www.amazon.com/dp/B0C658H19R"
"","","B08MN5K3BD","A4 Engineering Computation Pad: 100 Pages / 50 Sheets , 8.27 x 11.69 Inches | Blank A4 Computational Notepad | 5mm Grid Ruled Graph Paper | 5mm Quad ... Architects, and Students | 90gsm White Paper","Tinuk Tinuk (Author)","$6.48","","","","10/27/2020","$0.64","5","4","$5.84","2,558,660","","AMZ","1","Books","Standard","0.23 x 11.69 x 8.27 in","10.55 oz","https://www.amazon.com/dp/B08MN5K3BD"
"","","B000R80QCW","Ampad Gold Fibre Computation Book, Red Cover, Ivory Paper, Letter Size, 4 Square Inch Rule, 76 Sheets, 1 Each (22-156)","Ampad","$24.99","110","2","$2,749","05/23/2007","$16.10","4.6","181","$8.89","86,560","6","AMZ","1","Office Products","Standard","8.5 x 0.63 x 2 in","1.15 lb","https://www.amazon.com/dp/B000R80QCW"
"","","B0072FAJOI","Ampad Oxford Engineering Computation Filler Paper, Greentint, 3-Hole Punched, Letter Size, 5 square inch ruling, 500-Sheets (26-145), Off-White","Ampad","$24.99","23","","$574.77","01/29/2012","$14.81","4.6","164","$10.18","185,713","5","FBA","1","Office Products","Standard","8.5 x 11 x 1.5 in","3.9 lb","https://www.amazon.com/dp/B0072FAJOI"
"","","B00007LV4B","National Brand Computation Notebook, 4 X 4 Quad, Brown, Green Paper, 11.75 x 9.25 Inches, 75 Sheets (43648)","National","$14.50","1,916","28","$27,782","04/17/2008","$9.30","4.7","1,988","$5.20","8,984","6","AMZ","31","Office Products","Standard","10.6 x 0.5 x 11.7 in","8 oz","https://www.amazon.com/dp/B00007LV4B"
"","","B005UOE160","Roaring Spring Engineering Loose Leaf Filler Paper, 8.5'x11', 500 Sheets Per Pack, 15 Green Tinted Paper, Computation Paper, Proudly Made in The USA, Heavyweight Backer Board","ROARING SPRING","$22.49","90","3","$2,024","10/10/2011","$12.69","4.6","281","$9.80","60,550","6","FBA","1","Office Products","Standard","1.5 x 11 x 8.5 in","3.9 lb","https://www.amazon.com/dp/B005UOE160"
"","","B085DTW21H","Roaring Spring Signature Collection 5x5 Grid Covered Engineering Pad, 20 Green, 3 Hole Punched, 8.5' x 11' 80 Sheets, Green Paper","ROARING SPRING","$16.65","","","$249.75","03/01/2020","$-5.05","4.6","22","$21.70","196,302","6","FBA","1","Office Products","Oversize","8.75 x 9.5 x 11.25 in","27.1 lb","https://www.amazon.com/dp/B085DTW21H"
"","","B0BQDX9TSN","CADMUSPRO Large Graph Paper Pad, 22'x17', 1/4' Quad Grid, 50 Sheets per pad, Great for Sketching, House & Commercial Buildings Plans & Drafting. for Architects, Engineers & Draftspersons (Pack of 1)","CADMUSPRO","$35.00","390","13","$13,650","11/16/2022","$19.21","4.6","22","$15.79","18,985","6","FBA","1","Office Products","Oversize","17 x 1 x 22 in","3.34 lb","https://www.amazon.com/dp/B0BQDX9TSN"
"","","B08Z4BFTMG","Roaring Spring Signature Collection 5x5 Grid Spiral Bound Engineering Pad, 20 Buff, 3 Hole Punched, 11' X 9' 80 Sheets, Buff Paper","ROARING SPRING","$17.77","163","6","$2,897","03/15/2021","$9.96","4.7","82","$7.81","38,916","6","FBA","1","Office Products","Standard","9 x 1 x 11.1 in","1.04 lb","https://www.amazon.com/dp/B08Z4BFTMG"
"","","B01M9DW5C6","ROARING SPRING Whitelines Engineering Pad, Digitally Download Your Notes with FREE App, Premium Gray Paper, 8.5' x 11' 80 Sheets","ROARING SPRING","$12.94","756","24","$9,783","10/18/2016","$7.93","4.6","2,699","$5.01","10,264","6","FBA","1","Office Products","Standard","8.5 x 10.7 x 0.4 in","12 oz","https://www.amazon.com/dp/B01M9DW5C6"
"","","B0C7TRWFLY","le vent 2 pack Grid Paper Large Spiral Notebook 8.5 x 11 with 100gsm Thick Paper - Square Graph Quad Ruled Notebooks for Math, Science, Engineering - 200 Pages of Lay Flat, Ink Proof Paper - A4","le vent","$24.97","155","8","$3,870","06/12/2023","$15.43","3.8","3","$9.54","28,384","6","FBA","1","Office Products","Standard","9.45 x 1.69 x 13.15 in","3 lb","https://www.amazon.com/dp/B0C7TRWFLY"
"","","B0C1N9699G","Fuutreo 4 Pack Computation Notebook 11.75 x 9.25 Inch 4 x 4 Quad Multicolor Computation Notebook Graph Paper Notebook for Writing Graphing Engineering Composition Work School, 75 Sheets Per Pad","Fuutreo","$20.99","18","","$377.82","04/05/2023","$11.41","3","4","$9.58","205,842","7","FBA","1","Office Products","Standard","9.57 x 1.5 x 11.93 in","3.29 lb","https://www.amazon.com/dp/B0C1N9699G"
"","","B08QDVRMMD","EMSHOI Graph Paper Spiral Notebook 5.7' x 8.22' - 4 Pack 640 Pages 100gsm Thick Grid Paper, A5 Graph Paper Notebook, Plastic Hardcover Journals for Writing Engineering Graphing Work School Supplies","EMSHOI","$17.95","4,703","116","$84,419","12/10/2020","$9.47","4.7","2,717","$8.48","1,804","7","FBA","2","Office Products","Standard","5.71 x 1.57 x 8.27 in","2.33 lb","https://www.amazon.com/dp/B08QDVRMMD"
"","","B0CCNR2YGZ","Tenceur 500 Sheets Engineering Pad 11''x17'' Double Sided Large Engineering Paper Graph Paper Grid Paper Drafting Pad 4''x4'' Grid Blueprint Sketching 10 Pads for Engineer Architect(Blue)","Tenceur","$44.99","9","","$404.91","07/23/2023","$29.11","5","1","$15.88","350,997","7","FBA","1","Office Products","Standard","11.26 x 2.91 x 17.17 in","12.76 lb","https://www.amazon.com/dp/B0CCNR2YGZ"
"","","B0144B9JHA","National Brand Computation Pad, Plain and 5 X 5 Quad On Back, Green Paper, 8.5 x 11 Inches, 200 Sheets (42389) (3, Green)","National Hardware","$41.95","15","1","$629.25","08/18/2015","$28.80","5","10","$13.15","166,696","4","FBA","2","Office Products","Standard","8.82 x 2.2 x 11.1 in","4.92 lb","https://www.amazon.com/dp/B0144B9JHA"
"","","B07281X3Z3","AdirPro Professional Engineers Field Surveying Book Standard Size - Engineering Computation - Grid Paper Notebook - Scientific Notebook - Graph Paper 4  x 7  (6 Books)","AdirPro","$31.46","30","1","$943.80","05/07/2017","$18.51","4.3","67","$12.95","140,151","6","FBA","1","Office Products","Standard","5.2 x 8 x 4.5 in","3.3 lb","https://www.amazon.com/dp/B07281X3Z3"
"","","B0CLH6DQZM","Fainne Large Engineering Graph Paper 22''x17'' Landscape 4' x 4'Grid Graph Paper Pad Giant Drafting Pad Sketching Graph Paper for Engineer Architect Designer Mathematician Draftsman (Beige and Green)","Fainne","$36.99","360","12","$13,316","12/23/2023","","5","2","","19,869","","FBA","1","Office Products","","","","https://www.amazon.com/dp/B0CLH6DQZM"
"","","B0B1ZKBBYC","Graph Paper With Scales: 1/4 Inch Grid Paper Notebook | 4 x 4 Ruled Architect & Engineering Graphing Pad, Computation Pad, Blueprint Paper, Drafting/Drawing Notepad - 8.5' x 11', 110 Pages /55 Sheets","Bamidel (Author)","$5.98","","","","05/25/2022","$-0.31","5","3","$6.29","572,692","","AMZ","1","Books","Standard","0.25 x 11 x 8.5 in","0.76 lb","https://www.amazon.com/dp/B0B1ZKBBYC"
"","","B0CPH1NDSH","WritePads Graph Paper Note Pads, Quad Ruled (4x4) Paper pad, 8.5x11 inch Grid Notebook Paper Pad, White Paper Graph Legal Pads, 2 Pads of 50 Sheets, Micro perforated Engineering Paper Notebook, Made","WritePads","$9.99","138","5","$1,379","12/03/2023","$4.90","4.5","17","$5.09","43,180","6","FBA","1","Office Products","Standard","8.5 x 0.4 x 11.75 in","15.8 oz","https://www.amazon.com/dp/B0CPH1NDSH"
"","","B08QS6923B","Technical Graph Paper Notebook: 1/4 Inch Grid Ruled Architectural & Engineering Graphing Pad, Computation Pad, Blueprint Paper, Drafting/Drawing Notepad - 8.5' x 11', 110 Pages /55 Sheets","Bamidel (Author)","$5.98","","","","02/10/2022","$-0.25","","","$6.23","2,639,988","","AMZ","1","Books","Standard","0.25 x 11 x 8.5 in","0.76 lb","https://www.amazon.com/dp/B08QS6923B"
"","","B08L8Y57S1","A4 Computation Notebook: 110 Pages/55 Sheets | Cream Paper | 5 Squares per Inch Engineering Computation Pad | 5 x 5 Graph Rule With Margin | ... Grid Ruled Computational Book - Blue Cover","RMB-Printing (Author)","$4.36","","","","04/17/2022","$-1.68","","","$6.04","6,769,611","","AMZ","1","Books","Standard","0.28 x 11.69 x 8.27 in","0.79 lb","https://www.amazon.com/dp/B08L8Y57S1"