"Export time:  2/8/2024, 3:53:32 PM","","ASIN","Product Name","Brand","Price","Monthly Units Sold","Daily Units Sold","Monthly Revenue","Date First Available","Net Revenue","Star Rating","Reviews","Amazon Fees","BSR","LQS","Seller Type","Sellers","Category","Product Tier","Dimensions","Weight","Link"
"","","B0C5MHJST1","Sheet Cube Foldable Bed Sheet Set Organizer with Window and Handle for bedding, Linen Closet Sheet Organizer can Storage Sheets, Duvet Cover, Pillowcase and Towels (2 Pack (Queen or King Size)","Lukeline","$29.99","57","1","$1,709","05/17/2023","","4.1","36","","639,675","7","FBA","1","Home & Kitchen","","","","https://www.amazon.com/dp/B0C5MHJST1"
"Foldable Bed Sheet Set Organizer","","B0CLM3X6NW","Karceyworth 4 Pack Bed Sheet Organizers and Storage, Foldable Sheet Set Organizer, Bedsheet Storage, Bed Sheet Organizers for for Queen and King Sheets, Duvet Covers, Pillowcases","Karceyworth","$32.99","","","","10/22/2023","","4.5","24","","","7","FBA","1","","","","","https://www.amazon.com/dp/B0CLM3X6NW"
"Average Monthly Sales: 1,008","","B0CGNNV5N6","SpaceAid 10 Pack Bed Sheet Organizers and Storage, Foldable Sheet Organizer for Linen Closet, Sheets Set Folder Keeper with Window XL (Queen & King Size) Organizing Bedding Container, White","SpaceAid","$99.98","","","","08/25/2023","","4.6","258","","","7","FBA","1","","","","","https://www.amazon.com/dp/B0CGNNV5N6"
"Average Revenue: $29,001","","B0CM37V25J","GODELAIF Bed Sheet Organizer and Storage, Foldable Sheet Set Organizer for Twin/Full/Queen/King Size, Linen Closet Organizers and Storage with Handle for Sheet Set Bedding Clothes Blanket","GODELAIF","$24.99","286","6","$7,147","10/29/2023","","4.8","87","","138,740","7","FBA","1","Home & Kitchen","","","","https://www.amazon.com/dp/B0CM37V25J"
"Average Price: $38.63","","B0C1BK6DCP","SheetCube Bed Sheet Organizers and Storage 6 Pack, Foldable Linen Closet Organizer with Window and Label, Bedding Folder Storage Box Container for Blanket, Duvet Cover Set, Bed Sheet Set - Beige","SUOCO","$49.99","2,261","41","$113,027","06/05/2023","$34.56","4.4","167","$15.43","22,231","7","FBA","2","Home & Kitchen","Standard","12.68 x 4.17 x 15.35 in","8.9 lb","https://www.amazon.com/dp/B0C1BK6DCP"
"Average No. of Ratings: 89","","B0C16JFJJN","SheetCube 4 Pack Bed Sheet Organizers and Storage, Foldable Bedding Storage Box Container with Window and Label, Linen Closet Organizer Folder for Blanket, Duvet Cover Set, Bed Sheet Set - Grey","SUOCO","$25.49","1,603","51","$40,860","06/05/2023","","4.2","573","","17,713","6","FBA","2","Home & Kitchen","","","","https://www.amazon.com/dp/B0C16JFJJN"
"Average Sales Rank: 336,288","","B0C5WL6CFL","KIMBORA Foldable Bed Sheet Organizer and Storage, 3 Pack King Size Sheet Set Organizer for Linen Closet With Clear PVC Sheet Storage for Bedding Sheets, Duvet Covers and Pillow cases","KIMBORA","$23.99","770","15","$18,472","05/21/2023","$13.06","4.3","127","$10.93","63,828","7","FBA","2","Home & Kitchen","Standard","4.5 x 13 x 15 in","1 lb","https://www.amazon.com/dp/B0C5WL6CFL"
"Average Rating Number: 4.5","","B0C9Q61MDQ","SpaceAid 6 Pack Bed Sheet Organizers and Storage, Foldable Sheet Organizer for Linen Closet, Sheets Set Folder Keeper with Window XL (Queen & King Size) Organizing Bedding Container, Black","SpaceAid","$49.98","934","23","$46,681","06/28/2023","","4.6","136","","40,694","6","FBA","3","Home & Kitchen","","","","https://www.amazon.com/dp/B0C9Q61MDQ"
"","","B0C4LFRYDR","GZOOGHOME 4 Pack Bed Sheet Organizers and Storage, Sheet Folder Organizer for Linen Closet, Foldable Sheets Set Keeper XL (Queen or King Size) Organizing Bedding Container (Circle Window, Black)","GZOOGHOME","$39.99","777","18","$31,072","05/07/2023","$26.66","4.2","147","$13.33","52,967","7","FBA","2","Home & Kitchen","Standard","4.5 x 12.8 x 15 in","3.1 lb","https://www.amazon.com/dp/B0C4LFRYDR"
"","","B0CFLRHS3Z","Doosela Bed Sheet Organizers and Storage, 4 Packs Foldable Storage Box with Zipper for Queen or King Sheets, Sheet Storage Cube for Duvet Cover Set, Bedding, Blanket Storage","Doosela","$89.99","723","15","$65,063","08/13/2023","","4.7","20","","62,063","6","FBA","1","Home & Kitchen","","","","https://www.amazon.com/dp/B0CFLRHS3Z"
"","","B0C758Q8MY","BIKTIC Foldable Bed Sheet Set Organizer,2-Pack with Zipper for Queen or King Sheets, Duvet Covers, and Pillowcases, Linen Closet Organizer for Bedding Clothes Towels","BIKTIC","$24.99","1,551","48","$38,759","06/04/2023","","4.8","372","","18,639","7","FBA","3","Home & Kitchen","","","","https://www.amazon.com/dp/B0C758Q8MY"
"","","B0CMJBYYYK","MLGOGO Bed Sheet Organizer 8 Pcs. Set (6+2) Foldable Linen Closet Storage Containers for King/Queen Size Sheets & 6 Elastic Bands. Bedding Storage Linen Closet Organizers w/Window & Handle (Black)","MLGOGO","$49.13","320","10","$15,722","11/02/2023","","4.7","20","","87,150","6","FBA","1","Home & Kitchen","","","","https://www.amazon.com/dp/B0CMJBYYYK"
"","","B0CGNPZVG5","SpaceAid 5 Pack Bed Sheet Organizers and Storage, Foldable Sheet Organizer for Linen Closet, Sheets Set Folder Keeper with Window XL (Queen & King Size) Organizing Bedding Container, White","SpaceAid","$46.98","","","","08/25/2023","","4.8","31","","","6","FBA","1","","","","","https://www.amazon.com/dp/B0CGNPZVG5"
"","","B0CKNKJMJ1","VAIVUSTO 4 Pack Bed Sheet Organizer and Storage,Foldable Bed Sheet Storage with Window and Double Handle,Linen Closet Organizer for Bedding Sheets Clothes Towels Pillowcase Duvet Cover(Black)","VAIVUSTO","$37.99","","","$0.00","10/06/2023","$24.81","5","3","$13.18","1,676,882","7","FBA","1","Home & Kitchen","Standard","12.5 x 4.7 x 15 in","2 lb","https://www.amazon.com/dp/B0CKNKJMJ1"
"","","B0CJQWBH4N","HUWAILE Sheet Organizers and Storage - 3 Pack Bed Sheet Organizers for All Sheet Sizes, Including Queen/King Size Blankets, Foldable Blanket Organizer/Sheet Storage for Linen Closet, Beige","HUWAILE","$32.99","268","7","$8,841","09/24/2023","$20.41","4.9","53","$12.58","119,943","6","FBA","1","Home & Kitchen","Standard","13 x 5.5 x 15 in","5.9 lb","https://www.amazon.com/dp/B0CJQWBH4N"
"","","B0CM3DVLCY","DIMJ Bed Sheet Organizers and Storage 6 Pack, Foldable Sheet Bedding Storage Organizer for Linen Closet, Sheet Set Organizersr (Queen & King Size) with Window Handle for Bed Sheets Duvet Covers.(Grey)","DIMJ","$55.99","533","11","$29,843","12/27/2023","","4.5","10","","80,728","7","FBA","1","Home & Kitchen","","","","https://www.amazon.com/dp/B0CM3DVLCY"
"","","B0C9QB47R2","SpaceAid 8 Pack Bed Sheet Organizers and Storage, Foldable Sheet Organizer for Linen Closet, Sheets Set Folder Keeper with Window XL (Queen & King Size) Organizing Bedding Container, Beige","SpaceAid","$62.98","1,278","35","$80,488","06/28/2023","","4.4","131","","26,606","6","FBA","2","Home & Kitchen","","","","https://www.amazon.com/dp/B0C9QB47R2"
"","","B0CJJHLSXQ","BigPonPon 3-Pack Foldable Bed Sheets Set Organizers and Storage(King & Queen Size),Linen Fabric Closet Organizers with Window,Folding Bedding Storage Box for Bedsheets and Pillow Cube Organizer","BigPonPon","$29.77","1,918","109","$57,099","09/20/2023","$17.97","4.6","67","$11.80","7,081","7","FBA","1","Home & Kitchen","Standard","12.5 x 4.7 x 15 in","5.13 lb","https://www.amazon.com/dp/B0CJJHLSXQ"
"","","B0CJTCKJH8","Advanvel Bed Sheet Organizers and Storage Foldable Box, Sheet Organizer for Linen Closet with 2 Windows, Zip Closed Sheet Storage Folder Cubes for Queen/King Bedding Clothes Blankets, 2 Pack Gray","Advanvel","$29.99","","","$0.00","09/27/2023","","4.7","20","","2,395,007","7","FBA","1","Home & Kitchen","","","","https://www.amazon.com/dp/B0CJTCKJH8"
"","","B0CKWYH31S","MTGSTOCL Foldable Bed Sheet Organizer, Sheet Organizer for Linen Closet, Sheet Organizers and Storage for Bedding, Duvet Cover Set, Blantkets, Pillowcases (2 Pack)","MTGSTOCL","$45.69","150","5","$6,854","10/12/2023","","4","1","","160,353","","FBA","1","Home & Kitchen","","","","https://www.amazon.com/dp/B0CKWYH31S"
"","","B0CNXF28CJ","CEDDEOS 4 Pack Bed Sheet Organizers and Storage,Foldable Sheet Organizer for Duvet Covers,Pillowcases,Linen Closet,Bedding Clothes,Blankets Folder Keeper with Zipper for Queen or King Sheets,Grey","CEDDEOS","$39.99","","","","12/29/2023","","","","","","","FBA","1","","","","","https://www.amazon.com/dp/B0CNXF28CJ"
"","","B0CL9G3WVY","Vasttron 2 Pack Foldable Sheet Organizer for Linen Closet, Bed Sheet Organizers and Storage Underbed Storage Containers for Bedding Sheets, Pillows, Clothes, Shoes","Vasttron","$36.99","","","$0.00","10/17/2023","","5","2","","1,685,528","6","FBA","1","Home & Kitchen","","","","https://www.amazon.com/dp/B0CL9G3WVY"
"","","B0C9X6TM6T","chinensis 6 Pack Sheet organizer,Bed Sheet Storage,Folding Organizers for Bed Sheets,Sheet Storage Organizer,Sheet Set Organizer,Sheet Storage for Closet,Grey","chinensis","$69.99","360","3","$25,196","07/02/2023","","4.7","68","","261,399","7","FBA","3","Home & Kitchen","","","","https://www.amazon.com/dp/B0C9X6TM6T"
"","","B0CFXX2BSH","Wesapor Foldable Bed Sheet Set Organizer, 2-Pack Sheet Set Organizer for Linen Closet,Sheet Organizer and Storage for Bedding Clothes Blankets, Bed Sheet Storage Box for Duvet Cover Set","Wesapor","$49.99","402","3","$20,096","08/16/2023","$37.35","5","4","$12.64","282,301","7","FBA","1","Home & Kitchen","Standard","1 x 1 x 1 in","1.83 lb","https://www.amazon.com/dp/B0CFXX2BSH"
"","","B0CF5DJ67N","DELLAN Bed Sheet Organizer, Linen Closet Organizers and Storage, Foldable Cube Sheet Set Organizer (4 Pack)","DELLAN","$39.99","573","19","$22,914","08/08/2023","","4.7","45","","48,212","6","FBA","1","Home & Kitchen","","","","https://www.amazon.com/dp/B0CF5DJ67N"
"","","B0BT74ZHXK","LINENMATE Queen/King Size (Ivory 2-Pack) - The Original 2-Pack Linen Storage Container with Sheet-Folding Assisted Panels | Bed Sheets | Duvet Covers | Pillowcases | Towels","LINENMATE","$64.97","886","19","$57,563","01/25/2023","$46.39","4.5","176","$18.58","49,237","6","FBA","6","Home & Kitchen","Standard","12 x 4 x 15 in","2.74 kg","https://www.amazon.com/dp/B0BT74ZHXK"
"","","B0CB4NSG16","DomiZen Bed Sheet Set Organizer, Foldable Bedding Organizer for Bed Sheets, Duvet Covers and Pillowcases, Closet Storage Container (Gtray4 Pack)","DomiZen","$34.99","93","2","$3,254","07/03/2023","","5","6","","394,516","6","FBA","1","Home & Kitchen","","","","https://www.amazon.com/dp/B0CB4NSG16"
"","","B0CF88MMKZ","IKOLYS Bed Sheet Set Organizer (Queen or King Size) 4 Packs, Foldable Storage Bins for Duvet Covers, Fabric Zipper Closet Organizers and Storage, Bedding Organizer for Blankets, Clothes - Grey","IKOLYS","$53.99","91","3","$4,913","08/09/2023","","4.7","39","","231,242","6","FBA","1","Home & Kitchen","","","","https://www.amazon.com/dp/B0CF88MMKZ"
"","","B0C9PVJ5Z8","BIORM Bed Sheet Set Organizer 4 Pack, Foldable Storage Box for Queen/King Size Duvet Cover Set, Grey Linen Closet Organizer for Bed Sheets, Duvet Covers and Pillowcases","BIORM","$39.99","58","","$2,319","07/27/2023","$26.66","4.3","5","$13.33","878,159","7","FBA","2","Home & Kitchen","Standard","4.5 x 12.75 x 15 in","6.23 lb","https://www.amazon.com/dp/B0C9PVJ5Z8"
"","","B0CFHVY4RZ","Foldable Bed Sheet Set Organizer - 2 Pack Sheet Cube Storage Container for Queen or King Size Sheets, Duvet Covers and Pillowcases Storage Box, Oxford Cloth Storage Bins for Bedding Blankets Towels","ylisen","$15.99","135","2","$2,159","09/29/2023","","4","59","","338,937","7","FBA","1","Home & Kitchen","","","","https://www.amazon.com/dp/B0CFHVY4RZ"
"","","B0CJJHZS33","Bed Sheet Organizers and Storage - 4 Pack (Queen or King Size),Foldable Storage Box for Duvet Cover Set, Linen Closet Organizer for Bedding Clothes Blankets, Grey","Aokeyee","$29.99","765","45","$22,942","09/20/2023","$18.16","4.7","95","$11.83","20,043","6","FBA","1","Home & Kitchen","Standard","12.9 x 5 x 15 in","4.85 lb","https://www.amazon.com/dp/B0CJJHZS33"
"","","B0CDLDW71R","Feverdes SheetCube Bed Sheet Set Organizer 4-Pack (Queen or King Size),Foldable Storage Box,Linen Closet Organizer for Bedding Sheets, Duvet Covers,Blankets and Pillow Cases (Grey)","Feverdes","$59.99","411","10","$24,656","08/02/2023","","4.4","50","","91,396","6","FBA","1","Home & Kitchen","","","","https://www.amazon.com/dp/B0CDLDW71R"
"","","B0CBLYJFM2","MuiiuM Bed Sheet Organizer and Storage 4 Pack (Queen or King Size), Linen Closet Organizer, Foldable Bedding Container for Duvet Cover Set, Clothes, Blankets and Pillow cases","MuiiuM","$37.99","131","2","$4,977","07/10/2023","","4.7","31","","353,334","6","FBA","1","Home & Kitchen","","","","https://www.amazon.com/dp/B0CBLYJFM2"
"","","B0CFQ7RHWF","NEW NOAM 6Pcs Bed Sheet Organizers and Storage Set, 4-pack Cube Storage, Foldable Sheet Set Organizer with 2-pack Clothes Storage, Linen Closet Organizer for Bed Sheets Set or Duvet Covers, Grey","NEW NOAM","$25.99","231","8","$6,004","08/14/2023","","3.8","30","","108,210","7","FBA","1","Home & Kitchen","","","","https://www.amazon.com/dp/B0CFQ7RHWF"
"","","B0CM397MB2","GODELAIF Bed Sheet Organizer and Storage, Foldable Sheet Set Organizer for Twin/Full/Queen/King Size, Linen Closet Organizers and Storage with Handle for Sheet Set Bedding Clothes Blanket","GODELAIF","$24.99","330","6","$8,247","10/29/2023","","4.8","87","","138,740","7","FBA","1","Home & Kitchen","","","","https://www.amazon.com/dp/B0CM397MB2"
"","","B0BR3H3Q44","Fixwal 3 Pack Bed Sheet Organizer, Foldable King or Queen Size Sheet Set Organizer Storage Box Containers, Linen Closet Organizer with Zipper for Bedding Sheet, Duvet Covers and Pillowcases(Grey)","Fixwal","$30.99","134","3","$4,153","12/25/2022","","4.5","137","","281,140","6","FBA","4","Home & Kitchen","","","","https://www.amazon.com/dp/B0BR3H3Q44"
"","","B0CJF6N9BT","KAKALGAME Bed Sheet Organizer for Linen Closet Organizers and Storage, 4 Pack (Queen or King Size) Foldable Sheet Storage Box for Bedding Clothes Blankets Duvet Cover Set - Grey","KAKALGAME","$35.99","187","6","$6,730","09/19/2023","","4.6","55","","142,723","6","FBA","1","Home & Kitchen","","","","https://www.amazon.com/dp/B0CJF6N9BT"
"","","B0CD1BR6F8","SLEEPING LAMB Sheet Organizers and Storage, 4 Pack Foldable Bed Sheet Organizers for Linen Closet With Sturdy Zippers Storage Queen or King Size Duvet Cover Set, Pillowcases and Quilt, Black","SLEEPING LAMB","$25.99","38","4","$987.62","09/12/2023","$14.46","4.5","42","$11.53","227,410","6","FBA","1","Home & Kitchen","Standard","5 x 15.5 x 13 in","5.06 lb","https://www.amazon.com/dp/B0CD1BR6F8"
"","","B0CHY2FL39","YUOROS Foldable Bed Sheet Set Organizer SheetCube(Queen or King Size), Fabric Storage Bins for Bed Sheets, Duvet Covers and Pillowcases, Linen Closet Organizer for Bedding(6 Pack, King Size)","YUOROS","$56.99","154","3","$8,776","09/14/2023","","4.6","54","","249,272","6","FBA","1","Home & Kitchen","","","","https://www.amazon.com/dp/B0CHY2FL39"
"","","B0CLVKJ9PY","Fokyfok Bed Sheet Organizer,4-Pack Sheet Organizers and Storage, Upgraded in 3 Aspects, Queen/King Size  A Full Bed Sheets Organizer for Linen Closet,Folding Cube Linen Organizer for Sheet Set,Grey","Fokyfok","$29.99","137","8","$4,109","12/17/2023","","4.5","9","","117,173","7","FBA","1","Home & Kitchen","","","","https://www.amazon.com/dp/B0CLVKJ9PY"
"","","B0C69TWZVC","HSFTEC Foldable Bedding Organizer, Fabric Storage Bins for Bed Sheets, Duvet Covers and Pillowcases, Closet Organizer, Storage Container Boxes for Blankets, Clothes (2 pack(Queen or King), Grey)","HSFTEC","$19.99","241","6","$4,818","05/24/2023","","4.5","259","","141,899","7","FBA","1","Home & Kitchen","","","","https://www.amazon.com/dp/B0C69TWZVC"
"","","B0CHVXV55M","smusei Bed Sheet Storage Organizer 2 Pack Bedsheet Organizers Folding Linen Closet Organizers and Storage Bedding Storage for Sheet Sets, Duvet Covers, Pillowcases and Quilt Covers, Grey","smusei","$29.98","480","16","$14,390","09/11/2023","","5","2","","57,745","6","FBA","1","Home & Kitchen","","","","https://www.amazon.com/dp/B0CHVXV55M"
"","","B0C9PQPX4D","Zaldia Sheet Cube Bed Sheet Organizers and Storage, Foldable Bedding Organizer 2 Pack, Sheet Set Container with Folding Board for Linen Closet, Duvet Covers (2 Pack, Grey)","Zaldia","$19.99","212","3","$4,238","06/29/2023","","4.4","41","","266,929","6","FBA","1","Home & Kitchen","","","","https://www.amazon.com/dp/B0C9PQPX4D"
"","","B0CHJBZJ4V","AxPower 5 Pack Foldable Bed Sheet Organizers and Storage, Sheet Folder Organizer with Window for Queen or King Sheets, Duvet Covers, and Pillowcases, Linen Closet Organizer for Bedding Clothes Towels","AxPower","$49.99","97","2","$4,849","09/06/2023","","4.3","38","","414,933","6","FBA","2","Home & Kitchen","","","","https://www.amazon.com/dp/B0CHJBZJ4V"
"","","B0CBM17SMD","LUVHOMEE Sheet Organizers and Storage, 2 Pack Bed Sheet Organizer for Linen Closet, Sheet Folding Container for Bedding, Foldable Bedsheet Set Cube Keeper for Queen/King Sheets, Duvet Cover, XL","LUVHOMEE","$29.99","35","3","$1,050","07/10/2023","","3.8","40","","280,600","7","FBA","1","Home & Kitchen","","","","https://www.amazon.com/dp/B0CBM17SMD"
"","","B0CFCY6G2J","YUOROS 4 Pack Foldable Bed Sheet Set Organizer (Queen or King Size), Duvet Covers and Pillowcases, Linen Closet Storage Organizer for Bedding (4 Pack, King Size)","YUOROS","$34.99","134","4","$4,689","08/10/2023","","4.6","19","","197,149","6","FBA","2","Home & Kitchen","","","","https://www.amazon.com/dp/B0CFCY6G2J"
"","","B0CBJJ3M6F","GoMaihe Bed Sheet Organizers and Storage: 2-Pack XXL Foldable Bedsheet Set Organizer for Linen Closet Bedding Blankets Organizing - Easy Pull-out & Identification with Clear Window and Handle","GoMaihe","$18.99","193","1","$3,665","09/18/2023","","4.7","27","","466,063","7","FBA","1","Home & Kitchen","","","","https://www.amazon.com/dp/B0CBJJ3M6F"
"","","B0CB3S75HL","Furnhome 6 Pack Bed Sheet Organizers and Storage, Sheet Organizer for Linen Closet, Foldable Sheet Set Organizer, Sheet Storage Cube for Beding Sheets, Duvet Covers and Pillowcases","Furnhome","$69.99","207","5","$14,488","07/03/2023","","4.5","70","","184,492","7","FBA","2","Home & Kitchen","","","","https://www.amazon.com/dp/B0CB3S75HL"
"","","B0CKZ4J9S8","MISSLO Bed Sheet Organizers and Storage Queen/King Size Sheet Folder 4 Pack Linen Closet Organizer with Clear Window Blanket Storage Bags for Bedsheets, Pillow Cases, Towels, Clothes","MISSLO","$17.99","305","9","$5,487","11/23/2023","$10.77","4.6","164","$7.22","100,465","6","FBA","3","Home & Kitchen","Standard","14 x 6.5 x 16 in","15.2 oz","https://www.amazon.com/dp/B0CKZ4J9S8"
"","","B0BZYDFLGY","Bed Sheet Organizer and Storage Size Label Bands | Sheets Set Organizers for Linen Closet - Labeled Elastic Bedding Sheet Keepers Straps for Organizing Foldable Bedsheet Sets (Twin 4PCs Pack | White)","ECOHomes","$12.99","10,859","276","$141,058","11/02/2022","","4.6","409","","1,876","7","FBA","1","Home & Kitchen","","","","https://www.amazon.com/dp/B0BZYDFLGY"
"","","B0CKSFKGCB","homfanseec Bed Sheet Organizers and Storage, 2 Pack Foldable Bed Sheet Set Organizer, Linen Closet Organizer for Bedding Clothes Blankets, Foldable Cube Sheet Set Organizer(Grey)","homfanseec","$9.99","","","$0.00","10/09/2023","$2.60","4","1","$7.39","914,590","7","FBA","1","Home & Kitchen","Standard","10.24 x 0.67 x 14.96 in","1.65 lb","https://www.amazon.com/dp/B0CKSFKGCB"
"","","B0CP5PTWN2","coastal rose 2-Pack Foldable Bed Sheet Set Organizer for Linen Closet, Sheet Cube Bed Sheet Organizers and Storage, Folding bedding Storage Box with Window & Label, Gray","coastal rose","$34.99","","","$0.00","11/28/2023","","4.7","7","","1,374,517","7","FBA","1","Home & Kitchen","","","","https://www.amazon.com/dp/B0CP5PTWN2"
"","","B0CN14LHFP","BigPonPon 6 Pack Bed Sheets Organizers And Storage (King Size),Foldable Sheet Organizer With Handle For Linen Closet,Bedding Organizer Storage For Sheets, Duvet Cover (Beige","BigPonPon","$59.99","489","21","$29,335","09/20/2023","","4.5","43","","44,813","7","FBA","2","Home & Kitchen","","","","https://www.amazon.com/dp/B0CN14LHFP"
"","","B0CFF9X6LY","MACADAM 4 Pack Bed Sheet Set Organizer, Foldable Storage Containers Bins, Linen Closet Organizers, Zippered Storage Box for Duvet Cover Set, Bedding, Clothes, Blankets (Queen or King Size/Grey)","MACADAM","$39.99","1","","$39.99","08/10/2023","","4.7","30","","1,732,779","7","FBA","1","Home & Kitchen","","","","https://www.amazon.com/dp/B0CFF9X6LY"
"","","B0CH4FJ19Y","2 Pack Bed Sheet Organizer for Queen or King, Includes 2 Bands [ FREE], Foldable Sheet Set Organizer With Zipper, Sheet Organizers and Storage, Foldable Sheet Organizer for Linen Closet (Beige)","Generic","$19.99","32","1","$639.68","09/01/2023","","4","4","","477,195","7","FBA","1","Home & Kitchen","","","","https://www.amazon.com/dp/B0CH4FJ19Y"
"","","B0CLSG7J54","Welyspix 4 Pack Bed Sheet Set OrganizerFoldable Closet Organizers and Storage for Bed Sheets, Bed Sheet Storage Organizer for Duvet Cover Bedding Clothes Pillowcases","Welyspix","$32.99","136","4","$4,487","12/15/2023","","4.5","24","","208,442","7","FBA","1","Home & Kitchen","","","","https://www.amazon.com/dp/B0CLSG7J54"
"","","B0C9QBRQB4","SpaceAid 4 Pack Bed Sheet Organizers and Storage, Foldable Sheet Organizer for Linen Closet, Sheets Set Folder Keeper with Window XL (Queen & King Size) Organizing Bedding Container, Gray","SpaceAid","$39.98","6,704","197","$268,026","06/28/2023","","4.6","258","","3,149","6","FBA","2","Home & Kitchen","","","","https://www.amazon.com/dp/B0C9QBRQB4"
"","","B0BZYC5Q47","Bed Sheet Organizer and Storage Size Label Bands | Sheets Set Organizers for Linen Closet - Labeled Elastic Bedding Sheet Keepers Straps for Organizing Foldable Bedsheet Sets (King 4PCs Pack | White)","ECOHomes","$12.99","11,471","276","$149,008","11/02/2022","","4.6","409","","1,876","7","FBA","1","Home & Kitchen","","","","https://www.amazon.com/dp/B0BZYC5Q47"
"","","B0CH2XNB9C","PHINOX Bed Sheet Organizers and Storage, 4-Pack Sheet Storage Organizer for Linen Closet, Foldable Sheet Set Organizer Zippers for Queen&King Sheets","PHINOX","$33.99","240","8","$8,158","08/31/2023","","4.6","61","","117,058","7","FBA","1","Home & Kitchen","","","","https://www.amazon.com/dp/B0CH2XNB9C"