"Export time:  2/1/2024, 1:43:20 PM","","ASIN","Product Name","Brand","Price","Monthly Units Sold","Daily Units Sold","Monthly Revenue","Date First Available","Net Revenue","Star Rating","Reviews","Amazon Fees","BSR","LQS","Seller Type","Sellers","Category","Product Tier","Dimensions","Weight","Link"
"","","B0CBM4W7NS","Memorial Gifts for Loss of Loved One, Unique Sympathy Gift Idea Clear Crystal Ball Window Suncatcher, Rainbow Bereavement Grief Gift Box for Loss of Mother Father Husband Son Daughter Dog","Mooncraftlogy","$23.99","1,351","53","$32,410","07/31/2023","","4.9","52","","3,222","7","FBA","1","Patio, Lawn & Garden","","","","https://www.amazon.com/dp/B0CBM4W7NS"
"bereavement gift","","B07YLWM89W","SOULSIO Soothe My Restless Soul Angel Prayer Cross- Faith Gifts For Women- Handheld, Comforting Design for Clutching, Clinging and Praying- Peaceful, Calming Bereavement Sympathy Gift- Marble Resin","SOULSIO","$15.99","373","16","$5,964","11/30/2019","$9.82","4.8","973","$6.17","59,449","7","FBA","1","Home & Kitchen","Standard","5 x 5.7 x 1.2 in","0.45 lb","https://www.amazon.com/dp/B07YLWM89W"
"Average Monthly Sales: 818","","B0B1MYWZHV","Sympathy Gift in Memory of Loved One Lavender Scented Candle Thoughtful Condolences Grief Gifts for Bereavement Funeral Remembrance Sorry for Your Loss Mother Father","MULCHUM","$15.99","245","9","$3,918","05/17/2022","$9.07","4.3","68","$6.92","95,483","7","FBA","1","Home & Kitchen","Standard","2.75 x 3.5 x 2.75 in","15.2 oz","https://www.amazon.com/dp/B0B1MYWZHV"
"Average Revenue: $22,140","","B0BDF7TBH5","HN HAIINAA Flameless Candle Real Wax LED Light with Timer Sympathy Gift for Loss of Loved One Memorial Gifts for Loss of Mother Father Bereavement Gifts Remembrance Gifts (6' x 4')","HN HAIINAA","$21.99","624","14","$13,722","09/06/2022","$13.55","4.8","140","$8.44","26,055","7","FBA","1","Tools & Home Improvement","Standard","4 x 6 x 4 in","1.48 lb","https://www.amazon.com/dp/B0BDF7TBH5"
"Average Price: $27.56","","B0BKSFP5P8","Memorial Gifts LED Shadow Box - Cardinal Gifts for Loss of Mother Father, Sympathy Gift in Memory of Loved One Gifts, Funeral Rememberance Condolences Bereavement Gift Ideas to Relieve Grief","Fabuday","$16.99","2,250","75","$38,228","12/21/2022","","4.8","516","","11,229","7","FBA","3","Home & Kitchen","","","","https://www.amazon.com/dp/B0BKSFP5P8"
"Average No. of Ratings: 420","","B0BY227QW6","Sympathy Gift Baskets - Condolences Gift Basket for Loss of Loved One/Mom/Dad/Husband - Bereavement Grief Gifts - Sorry for Your Loss Grieving Care Package Gift Box for Women Men Friend (Ivory Pillow)","Frerdui","$39.99","490","17","$19,595","03/09/2023","","4.7","18","","54,752","6","FBA","1","Home & Kitchen","","","","https://www.amazon.com/dp/B0BY227QW6"
"Average Sales Rank: 58,322","","B0C36R1XTZ","LESEN Sympathy Gift Baskets,Sorry for Your Loss of Mother Father Brother Husband Sister Friend Loved One,Bereavement Grief Grieving Gifts,Condolence Gifts Box","LESEN","$32.98","263","17","$8,674","06/10/2023","$22.24","4.6","23","$10.74","16,706","7","FBA","1","Kitchen & Dining","Standard","9.37 x 4.09 x 9.45 in","2.8 lb","https://www.amazon.com/dp/B0C36R1XTZ"
"Average Rating Number: 4.7","","B09NN2X3FH","Sympathy Gifts Memorial Bereavement Gifts Acrylic Heart Condolence Remembrance Gifts for Loss of Loved One Father Mother(Butterfly Style, 6 x 6 x 0.6 Inch)","Jetec","$9.99","1,090","82","$10,889","12/14/2021","$5.57","4.6","1,582","$4.42","10,102","7","FBA","1","Home & Kitchen","Standard","0.63 x 6.299 x 6.299 in","0.181 lb","https://www.amazon.com/dp/B09NN2X3FH"
"","","B0B2ZLDCC9","Sympathy Gift Memorial Heart Present for Loss of Loved One Wooden Remembrance Bereavement Gift Condolence Sign Loss of Father Mother Son Brother Decor 6.3 x 6 x 0.7 Inches (Cardinal Style)","Jetec","$9.99","647","26","$6,464","06/13/2022","$4.72","4.8","413","$5.27","35,317","7","FBA","1","Home & Kitchen","Standard","6.772 x 7.677 x 0.984 in","0.503 lb","https://www.amazon.com/dp/B0B2ZLDCC9"
"","","B003OSSKWK","Willow Tree Remembrance Angel (Lighter Skin), MemoriesHold Each one Safely in Your Heart, A Gift to Express Sympathy, Comfort, Remembrance and Healing, Sculpted Hand-Painted Figurine","Willow Tree","$35.95","3,519","137","$126,508","05/30/2010","$27.69","4.9","6,805","$8.26","5,236","6","AMZ","13","Home & Kitchen","Standard","4.92 x 3.39 x 6.5 in","0.56 lb","https://www.amazon.com/dp/B003OSSKWK"
"","","B00OPYWGB8","Pavilion Gift Company 02969 Sympathy Angel Figurine, 9-Inch, Ivory","Pavilion Gift Company","$29.90","466","17","$13,933","03/21/2015","$20.90","4.9","948","$9.00","55,543","5","AMZ","5","Home & Kitchen","Standard","6.6 x 4.2 x 10.5 in","0.75 lb","https://www.amazon.com/dp/B00OPYWGB8"
"","","B08XJQB7H3","HOPE LOVE SHINE Sympathy Gift for Loss of loved ones necklace memorial condolence gift for her","HOPE LOVE SHINE","$36.99","788","25","$29,148","06/27/2022","$26.67","4.8","496","$10.32","37,978","6","FBM","2","Clothing, Shoes & Jewelry","Standard","4 x 0.2 x 6 in","0.09 oz","https://www.amazon.com/dp/B08XJQB7H3"
"","","B0C6SSW8TG","Sympathy Gift Baskets, Condolences Gifts for Bereavement Grief - Sorry for Your Loss of Loved One/Mom/Dad/Husband, Thinking of You Box, Grieving Care Package for Women Men Friends(Ivory Pillow)","PuGez","$45.99","463","15","$21,293","05/31/2023","","4.8","16","","62,472","7","FBA","3","Home & Kitchen","","","","https://www.amazon.com/dp/B0C6SSW8TG"
"","","B09Z9X1XLY","WISHMEAD 50x60 Inch Modern Gray Micro-Fleece Blanket with Heartfelt Quote 'Forever in our Hearts', Ready-to-Gift","WISHMEAD","$24.99","970","17","$24,240","08/18/2022","$14.51","4.8","155","$10.48","55,568","6","FBA","1","Home & Kitchen","Standard","13.3 x 14.76 x 3.43 in","1.369 lb","https://www.amazon.com/dp/B09Z9X1XLY"
"","","B09967C644","UOKPT Scented Candles Lavender Memorial Gifts for Loss of Loved One Sympathy Gift Condolence Remembrance for Deceased Bereavement Keepsake","UOKPT","$15.99","556","25","$8,890","08/10/2021","$9.07","4.7","301","$6.92","37,566","7","FBA","1","Home & Kitchen","Standard","2.75 x 3.5 x 2.75 in","15.52 oz","https://www.amazon.com/dp/B09967C644"
"","","B0CB1FSXQL","Jexine 20 Pcs Memorial Cardinal Sign Pins Set Funeral Pocket Token Guardian Gifts Pocket Oil Dropped Religious Funeral Favors Celebration of Life Memorial Sympathy Gifts Cardinal Charms for Women Man","Jexine","$13.99","144","4","$2,015","07/02/2023","","4.7","31","","193,474","7","FBA","1","Home & Kitchen","","","","https://www.amazon.com/dp/B0CB1FSXQL"
"","","B08KY6Q1X5","YOUNTASY Sympathy Wind Chimes , Bereavement/Memorial /Sympathy Gift in Memory of Loved One Loss of Mother Father Condolence Remembrance 32 Inch","YOUNTASY","$24.99","1,310","53","$32,737","12/07/2020","$16.10","4.8","2,096","$8.89","3,176","7","FBA","1","Patio, Lawn & Garden","Standard","5.512 x 13.228 x 2.047 in","1.2 lb","https://www.amazon.com/dp/B08KY6Q1X5"
"","","B0C141C134","Self Care Gifts for Women, Get Well Gifts for Women, Sympathy Gift Baskets, Get Well Soon Care Package, Inspirational Gifts for Women, Encouragement Gifts Baskets for Women, Sending Hug Gifts (Ivory)","Frerdui","$39.99","1,885","94","$75,381","03/30/2023","","4.9","30","","8,533","7","FBA","1","Home & Kitchen","","","","https://www.amazon.com/dp/B0C141C134"
"","","B0B8F1G26X","Sympathy Gift Baskets, Condolences Basket, Sorry for Your Loss of Loved One, Grief Gifts, Bereavement Care Package, Grieving Box, Unique Thinking of You Ideas for Women, Men, Friend - Pillow & Candle","Boxzie","$39.95","400","12","$15,980","08/17/2022","$27.53","4.8","81","$12.42","78,930","6","FBA","1","Home & Kitchen","Standard","9.84 x 4.57 x 10.39 in","3.11 lb","https://www.amazon.com/dp/B0B8F1G26X"
"","","B0CG59WNML","HN HAIINAA Memorial Lantern Bereavement Gifts in Memory of Loved One Memorial Gifts for Loss of Mother Loss of Father Remembrance Sympathy Gifts for Loss of Loved One with LED Candle and Remote","","$32.99","1,650","55","$54,434","","","4.5","37","","16,101","","FBA","","Home & Kitchen","","","","https://www.amazon.com/dp/B0CG59WNML"
"","","B09PDTZCX5","Memorial Lantern -Thoughtful Bereavement Gifts - Sympathy Gifts for Loss of Loved One, Memorial Gifts, Remembrance Gifts for Loss of Mother Father Funeral Gifts There're Some Who Bring a Light","Homazing","$38.99","227","7","$8,851","12/28/2021","$26.41","4.7","172","$12.58","124,727","7","FBA","1","Home & Kitchen","Standard","6.89 x 13.032 x 6.535 in","2.632 lb","https://www.amazon.com/dp/B09PDTZCX5"
"","","B09T2239ML","Thinking of You Gift for Loss of Loved One - Sympathy Bereavement Memorial with Lavender, Quartz Crystal and Chamomile","Gill + Jill","$35.99","676","22","$24,329","05/26/2021","$27.52","4.7","338","$8.47","32,227","6","FBA","1","Health & Household","Standard","0.01 x 3.5 x 3 in","7.76 oz","https://www.amazon.com/dp/B09T2239ML"
"","","B0BLBF6JDD","A Limb Has Fallen from The Family Tree Sympathy Plaque with Wooden Stand In loving memory of loved Wall Decor Table Decor Bereavement Condolences Gifts","Generic","$19.99","640","33","$12,794","12/02/2022","","4.6","108","","28,399","7","FBA","1","Home & Kitchen","","","","https://www.amazon.com/dp/B0BLBF6JDD"
"","","B0BWRQ1DJH","BeauGift Memorial Gifts for Loss of Father,Refillable Travel Photo Diary Journal Bereavement Gift, Letters to My Dad in Heaven Those We Love Don't Go Away Sympathy Gifts for Loss of Dad","BeauGift","$15.99","779","31","$12,456","02/23/2023","$9.82","4.7","100","$6.17","8,113","7","FBA","1","Office Products","Standard","4.7 x 0.9 x 7.8 in","7.2 oz","https://www.amazon.com/dp/B0BWRQ1DJH"
"","","B0CFTWWT97","LESEN Sympathy Gift Baskets, Grief Gifts for Women, Condolence Gifts Bereavement Box Gift Sorry for Your Loss of Loved One Mother Father Husband Friend","LESEN","$28.98","326","12","$9,447","08/15/2023","$17.60","4.9","21","$11.38","77,314","6","FBA","1","Home & Kitchen","Standard","9.3 x 4 x 9.3 in","1.04 kg","https://www.amazon.com/dp/B0CFTWWT97"
"","","B0C1YC1V5J","WOODEXPE Sympathy Gift Memorial Gift for Loss of Loved One Memorial Lantern with Flickering LED Candle and Remote Control (Black)","WOODEXPE","$31.99","410","14","$13,116","04/09/2023","$22.05","4.4","45","$9.94","66,939","7","FBA","1","Home & Kitchen","Standard","4.4 x 11 x 5.5 in","1.81 lb","https://www.amazon.com/dp/B0C1YC1V5J"
"","","B0CLP4L7G8","Elivida Sympathy Gift Modern Grief Gift for Lose of Loved Ones, Hanging Ornament with 40mm Clear Crystal Ball Rainbow Maker, Bereavement Gift Idea Angel Wings Design","Elivida","$19.99","210","7","$4,198","12/20/2023","","4.8","10","","130,613","","FBA","1","Home & Kitchen","","","","https://www.amazon.com/dp/B0CLP4L7G8"
"","","B09QHV8Q7H","Sympathy Wind Chimes for Outside Deep Tone, Memorial for Loss of Loved One Prime, Bereavement Condolence Remembrance Funeral Gifts for Grieving Friends Loss of Mother Father","Synhonty","$29.99","4,467","160","$133,965","03/14/2022","$20.35","4.8","677","$9.64","698","7","FBA","1","Patio, Lawn & Garden","Standard","5.669 x 13.465 x 2.362 in","1.232 lb","https://www.amazon.com/dp/B09QHV8Q7H"
"","","B0CGZTYKDR","Sympathy Gift Baskets, Sympathy Gift, Sympathy Gifts For Loss Of Loved One, Bereavement Gifts, Sympathy Gifts, Grief Gifts, Sorry For Your Loss Gift Basket, Sympathy Gifts For Loss Of Mom, Friend","Ithmahco","$34.99","290","8","$10,147","08/30/2023","","4.8","25","","34,446","7","FBA","1","Kitchen & Dining","","","","https://www.amazon.com/dp/B0CGZTYKDR"
"","","B0C6GS22GV","ShiQiao Spl Sympathy Memorial Gifts for Loss of Mom Dad Grief Bereavement Remembrance Gift Pocket Hug Token for Women Men Those We Love Don't Go Away Keychain Double Sided Inspirational Gift","ShiQiao Spl","$7.90","1,610","69","$12,719","07/25/2023","$3.29","5","5","$4.61","12,504","7","FBA","1","Clothing, Shoes & Jewelry","Standard","2.48 x 0.43 x 3.31 in","0.63 oz","https://www.amazon.com/dp/B0C6GS22GV"
"","","B0CFKKTHST","HN HAIINAA Memorial Lantern - Bereavement Sympathy Gifts for Loss of Loved One Memorial Gifts for Loss of Father Remembrance Gifts Thoughtful Funeral Gifts for Loss of Dad with LED Candle and Remote","HN HAIINAA","$46.99","412","21","$19,360","08/13/2023","$33.51","4.5","41","$13.48","44,591","7","FBA","1","Home & Kitchen","Standard","5.9 x 14 x 5.9 in","2.35 lb","https://www.amazon.com/dp/B0CFKKTHST"
"","","B0C7MK26G8","Memorial Lantern, Sympathy Gifts for Loss of Mom/Dad/Loved One, Bereavement Gifts, in Memory of Loved One Lantern,Celebration of Life, Memorial Gifts, Funeral Lantern,There are Some who Bring a Light","liantudy","$46.99","730","22","$34,303","06/10/2023","","4.6","68","","43,428","7","FBA","1","Home & Kitchen","","","","https://www.amazon.com/dp/B0C7MK26G8"
"","","B09B2GRLN4","Soopau Wind Chimes for Outside, 30' Wooden Sympathy Wind Chimes Memorial Wind Chime for Loss of Loved One Mother Father, Sympathy Gift Home Decor Outdoor Garden Patio","Soopau","$23.98","5,582","326","$133,856","07/21/2021","$15.86","4.8","1,505","$8.12","208","7","FBA","1","Patio, Lawn & Garden","Standard","5.551 x 14.449 x 1.614 in","0.833 lb","https://www.amazon.com/dp/B09B2GRLN4"
"","","B0B8MSTKP2","Memorial Lantern, Sympathy Gifts for Loss of Mom/Dad/Loved One, Bereavement Gifts, in Memory of Loved One Gifts, Remembrance Gifts for Loss, Celebration of Life, Memorial Gifts, Funeral Gifts","HSENYEKUM","$32.99","60","2","$1,979","08/03/2022","$21.61","4.8","123","$11.38","141,415","7","FBA","1","Tools & Home Improvement","Standard","7.36 x 5.43 x 12.91 in","2.84 lb","https://www.amazon.com/dp/B0B8MSTKP2"
"","","B0B9XC3YSC","TRIROCKS Memorial Lantern 11'' High Walk Beside Us Remembrance Lantern With Automatic Timer LED Candle And Love Pattern Bereavement Sympathy Gifts For Funeral Memorial Service Loss of Loved One (Grey)","TRIROCKS","$29.99","142","5","$4,259","08/16/2022","","3.9","43","","181,132","7","FBA","1","Home & Kitchen","","","","https://www.amazon.com/dp/B0B9XC3YSC"
"","","B0BHWR6XD3","Memorial Wind Chimes for Outside,30' Large Deep Tone Sympathy Wind Chimes,Bereavement Gift for Loss of Loved One Prime Mother Father, Golden Wind Chimes Suitable for Outdoor, Garden, Patio Decoration","beboligh","$28.98","1,205","57","$34,921","10/10/2022","","4.8","373","","2,939","7","FBA","1","Patio, Lawn & Garden","","","","https://www.amazon.com/dp/B0BHWR6XD3"
"","","B07X3XBH4H","Celebration of Life Memorial Lantern with Flickering LED Candle-Thoughtful Bereavement Gift /Sympathy Gift for Loss of Mom/Dad/Loved One/ Cardinal Sympathy Gift/ Cardinal Memorial Gift (Black)","The Grandparent Gift Co.","$32.99","220","8","$7,258","08/26/2019","$21.31","4.7","1,919","$11.68","109,089","6","FBA","1","Home & Kitchen","Standard","7.09 x 6.89 x 12.44 in","1.96 lb","https://www.amazon.com/dp/B07X3XBH4H"
"","","B092CXZCQH","Sympathy Gifts Memorial Bereavement Gifts Acrylic Condolence Remembrance Gifts for Loss of Loved One Father Mother (Simple Style,6 x 6 x 0.6 Inch)","Jetec","$11.99","1,274","82","$15,275","04/12/2021","$7.12","4.6","1,582","$4.87","10,102","7","FBA","1","Home & Kitchen","Standard","7.1 x 7.1 x 0.7 in","0.701 lb","https://www.amazon.com/dp/B092CXZCQH"
"","","B08V1YV8NH","Mayamila Sympathy Gifts Memorial Moon Shaped Ornament Gifts in Memory of Loved One Bereavement Gifts Remembrance Gifts Condolence Gifts for Loss of Mother Loss of Father Christmas Home Decorations","Mayamila","$29.98","258","6","$7,735","01/25/2021","$21.71","4.7","699","$8.27","152,449","7","FBA","1","Home & Kitchen","Standard","7.362 x 11.969 x 4.606 in","0.648 lb","https://www.amazon.com/dp/B08V1YV8NH"
"","","B0BRC5QJH5","Memorial Lantern - Bereavement Sympathy Gifts for Loss of Mother Memorial Gifts for Loss of Mother Thoughtful Funeral Gifts for Loss of Mother Remembrance Gifts for Loss of Loved One","HN HAIINAA","$47.99","1,474","41","$70,737","12/29/2022","$34.36","4.8","190","$13.63","8,445","7","FBA","2","Tools & Home Improvement","Standard","5.8 x 14 x 5.8 in","2.29 lb","https://www.amazon.com/dp/B0BRC5QJH5"
"","","B098TPNKM4","Sympathy Gifts for The Loss Of Dad Mom, Bereavement Memorial Gifts-They Walk Beside Us Every Day","Aisity","$8.99","451","17","$4,054","10/26/2022","$3.24","4.8","50","$5.75","55,125","7","FBA","1","Clothing, Shoes & Jewelry","Standard","2.5 x 2.7 x 2.7 in","0.004 lb","https://www.amazon.com/dp/B098TPNKM4"
"","","B0CDF6LRCN","Boxzie Sympathy Gifts, Condolence Gift Box, Bereavement Basket, Sorry for Your Loss Care Package, Thinking of You Grief Boxes for Women, Men, Friend  Condolences Navy Pillow, Candle & Soap","Boxzie","$39.95","243","9","$9,708","07/31/2023","","4.8","26","","105,653","6","FBA","1","Home & Kitchen","","","","https://www.amazon.com/dp/B0CDF6LRCN"
"","","B0CJTK8K6F","Memorial Gifts for Loss of Dad Picture Frame,Bereavement Sympathy Gifts for Loss of Father Memorial Gifts for Loss of Father,Remembrance Gifts for Loss of Father","Fooyekep","$20.99","150","5","$3,148","11/19/2023","","5","4","","170,831","7","FBA","1","Home & Kitchen","","","","https://www.amazon.com/dp/B0CJTK8K6F"
"","","B0CHRPPKSC","Churika Sympathy Gift Baskets, Memorial Sympathy Wind Chimes for Loss of Loved One, Memorial Gift Sorry for Your Loss of Mother Father Husband Friend Loved One","Churika","$33.99","226","7","$7,682","10/06/2023","","4.7","5","","27,817","7","FBA","1","Patio, Lawn & Garden","","","","https://www.amazon.com/dp/B0CHRPPKSC"
"","","B09YWWM1HS","Memorial Lantern -Thoughtful Funeral Gifts for Loss of a Loved One, Gifts, Sympathy Gifts, Bereavement Gifts, Rememberance Gifts for Loss of Mother Father","SUJUN","$30.99","271","12","$8,398","04/26/2022","$19.31","4.5","126","$11.68","79,490","7","FBA","1","Home & Kitchen","Standard","7.284 x 13.898 x 7.126 in","2.95 lb","https://www.amazon.com/dp/B09YWWM1HS"
"","","B0BWK8JP5H","Memorial Wind Chimes Gift Box, Sympathy Wind Chimes for Loss of Loved One, Memorial Gifts for Loss of Mother, Sympathy Gifts for Loss of Mom Memorial Gifts for Loss of Father Bereavement Gifts","KEDRIAN","$19.99","222","9","$4,438","05/29/2023","","4.7","44","","22,624","7","FBA","1","Patio, Lawn & Garden","","","","https://www.amazon.com/dp/B0BWK8JP5H"
"","","B0BPY3BMSP","EYITUPC Loss of Father Sympathy Gift Memorial Gifts for Loss of Dad Picture Frame, In Memory Of Loved One Gifts Grief Gifts Bereavement Gifts","EYITUPC","$24.99","540","18","$13,495","01/31/2023","","4.7","166","","50,999","7","FBA","1","Home & Kitchen","","","","https://www.amazon.com/dp/B0BPY3BMSP"
"","","B09X38SG3S","Sympathy Gifts Heart Shape Memorial Bereavement Gifts Crystal Acrylic Paperweight Remembrance Decorations Funeral Grief Condolence Memorial Ornaments for Loss of Mother Loved One (Bird Style)","Yookeer","$11.99","717","25","$8,597","04/01/2022","$7.12","4.7","242","$4.87","37,577","6","FBA","1","Home & Kitchen","Standard","5.118 x 0.591 x 5.118 in","0.485 lb","https://www.amazon.com/dp/B09X38SG3S"
"","","B0BRP9FZKT","MUCHNEE Custom Loving Memory Blanket, 60'x50', Suede Polyester, In Loving Memory, Customizable","MUCHNEE","$37.99","248","11","$9,422","01/04/2023","","4.4","72","","82,097","7","FBA","1","Home & Kitchen","","","","https://www.amazon.com/dp/B0BRP9FZKT"
"","","B0C9FK1Y2B","Sympathy Gift Baskets - Unique Sorry for Your Loss Gifts, Sympathy Gifts for Loss of Loved One, Mom, Dad. In Loving Memory Condolences Gift Basket for Loss, Memorial, Bereavement &GrievingGifts","GOLDMUS","$29.99","162","6","$4,858","06/25/2023","$19.70","5","6","$10.29","145,027","7","FBA","2","Home & Kitchen","Standard","7.5 x 6.3 x 7.5 in","1.68 lb","https://www.amazon.com/dp/B0C9FK1Y2B"
"","","B0C2HG5SFL","Sympathy Wind Chimes for Loss of Loved One, Memorial Wind Chimes, Sympathy Gift Memorial Gifts Bereavement Gifts for Who Loss of Dad Mom Brother Husband Baby Daughter Friend","Lunekkh","$22.99","402","9","$9,242","04/13/2023","","4.5","27","","22,717","7","FBA","1","Patio, Lawn & Garden","","","","https://www.amazon.com/dp/B0C2HG5SFL"
"","","B0C1B9H8NP","kimilus Modern Grief Gift Memorial Gift for Loss of Loved One, Loss of Father, Loss of Mother Remembrance Gifts 40 mm Crystal Ball Rainbow Maker Best for Daily Remembrance","kimilus","$21.99","150","5","$3,298","07/05/2023","","4.4","9","","36,844","","FBA","","Patio, Lawn & Garden","","","","https://www.amazon.com/dp/B0C1B9H8NP"
"","","B0B8MFCQBS","Memorial Lantern with Picture Frame, LED Candle and Poem Card, Sympathy Lanterns for Loss of Loved One, Bereavement Memorial Gifts for Loss of Mother Father Grandmother, in Memory Lantern Cardinal","The Oriole Street Company","$39.99","80","6","$3,199","10/25/2022","","4.9","36","","151,807","7","FBA","1","Home & Kitchen","","","","https://www.amazon.com/dp/B0B8MFCQBS"
"","","B0CDR8XNXF","Thinking of You Gifts for Women Men, Get Well Soon Gifts for Women, Sympathy Feel Better Thoughtful Gifts for Friend, Divorce Cheer Up Friendship Gifts Lavender Scented Candle","CINGUE","$16.99","832","40","$14,136","08/04/2023","$10.67","4.9","51","$6.32","23,217","7","FBA","2","Home & Kitchen","Standard","2.8 x 3.7 x 2.8 in","7.05 oz","https://www.amazon.com/dp/B0CDR8XNXF"
"","","B0C3MPRZQK","Memorial Wind Chimes for Outside - Bereavement Sympathy Gift in Memory of Loved One, Memorial Wind Chimes for Loss of Loved One, Memorial Gifts for Loss of Mother Father Condolence Remembrance","Norimoru","$29.99","90","3","$2,699","04/25/2023","","5","3","","59,312","7","FBA","1","Patio, Lawn & Garden","","","","https://www.amazon.com/dp/B0C3MPRZQK"
"","","B09QX8M6MX","Sympathy Wind Chimes for Loss of Loved One, Memorial Windchimes for Lost Father Mother, Remembrance Bereavement Gift with Card, in Memory of Dad Mom Metal Funeral Decor for Garden Outdoor (39 Black)","Mooncraftlogy","$29.99","1,219","42","$36,558","02/21/2022","$20.35","4.8","210","$9.64","4,229","7","FBA","1","Patio, Lawn & Garden","Standard","5.591 x 13.78 x 2.205 in","1.25 lb","https://www.amazon.com/dp/B09QX8M6MX"
"","","B0C1TDZZYD","Mayamila Memorial Picture Frame 4X6, Sympathy Photo Frame for Loss of Loved One Gifts, Bereavement Frame for Picture with Angel Wings, Condolence Remembrance Grieving Gifts for Loss of Mom Dad","Mayamila","$21.99","132","5","$2,903","05/12/2023","","4.7","10","","172,318","7","FBA","1","Home & Kitchen","","","","https://www.amazon.com/dp/B0C1TDZZYD"