"Export time:  2/13/2024, 12:28:21 AM","","ASIN","Product Name","Brand","Price","Monthly Units Sold","Daily Units Sold","Monthly Revenue","Date First Available","Net Revenue","Star Rating","Reviews","Amazon Fees","BSR","LQS","Seller Type","Sellers","Category","Product Tier","Dimensions","Weight","Link"
"","","B07JGWSB8T","Amazon Basics Under Bed Fabric Storage Container Bags with Window and Handles - 2-Pack, 18 x 42 x 6 Inches, Gray","Amazon Basics","$15.75","","","","05/16/2019","$6.66","4.4","20,569","$9.09","575","6","AMZ","2","Our Brands","Standard","10.8 x 17.1 x 3.3 in","3.45 lb","https://www.amazon.com/dp/B07JGWSB8T"
"Under Bed Storage Containers","","B0922M88FJ","StorageWorks Underbed Storage Box, Under Bed Clothes Organizer With Sturdy Structure and Ultra Thick Fabric, Ivory White, Large, 2 pack","StorageWorks","$31.99","5,116","174","$163,661","04/07/2021","$20.16","4.8","1,228","$11.83","3,746","6","FBA","3","Home & Kitchen","Standard","13.071 x 17.323 x 3.661 in","5.445 lb","https://www.amazon.com/dp/B0922M88FJ"
"Average Monthly Sales: 2,314","","B0BY1MRHWB","StorageWorks Under Bed Shoe Storage Organizer, Underbed Shoes Container with Adjustable Dividers, Beige, 2-Pack, Fits 24 Pairs","StorageWorks","$41.99","1,254","33","$52,655","06/27/2023","","4.6","340","","28,073","6","FBA","1","Home & Kitchen","","","","https://www.amazon.com/dp/B0BY1MRHWB"
"Average Revenue: $152,937","","B0CJNNRG7R","TidyCorner Under Bed Storage Containers, Foldable Under Bed Storage Bags for Clothing, Blankets, Toys, Underbed Storage with Clear Window, Strong Zipper, 33' L x 17.5' W x 4.7' H, Beige, 2 Pack","TidyCorner","$22.99","637","23","$14,645","09/22/2023","","4","48","","41,617","6","FBA","1","Home & Kitchen","","","","https://www.amazon.com/dp/B0CJNNRG7R"
"Average Price: $43.65","","B09Q38H2J4","Budding Joy 90L Under Bed Storage Containers, Closet Organizers and Storage Bins, Collapsible Underbed Storage Bags for Blankets, Towels, Comforter, Sweaters, Linen Sheets, Wrapping Paper","Budding Joy","$25.99","12,932","308","$336,103","01/09/2022","$15.06","4.2","6,199","$10.93","1,573","7","FBA","1","Home & Kitchen","Standard","12.874 x 14.095 x 4.567 in","2.56 lb","https://www.amazon.com/dp/B09Q38H2J4"
"Average No. of Ratings: 2,687","","B01MRZE720","Sterilite 56 Qt Wheeled Latching Storage Box, Stackable Bin with Latch Lid, Organize Clothes, Blankets, Shoes Underbed, Clear with White Lid, (Pack of 4)","Sterilite","$71.09","8,900","275","$632,701","12/19/2016","$40.83","4.6","11,075","$30.26","1,888","7","AMZ","13","Home & Kitchen","Oversize","18.75 x 7 x 33.88 in","5.25 lb","https://www.amazon.com/dp/B01MRZE720"
"Average Sales Rank: 70,216","","B0B5WKNGBL","HAIXIN Storage Cabinet, Plastic Shelves Organizer, Folding Storage Box, Collapsible Totes Containers For Storage, 8.4 Gal Clear Storage Bins, Stackable Under Bed Storage Container, 6 Pack Bookshelf","HAIXIN","$259.99","8,892","195","$2.31M","07/05/2022","$207.03","4.5","3,591","$52.96","3,183","6","FBA","1","Home & Kitchen","Oversize","13 x 25 x 19 in","1 lb","https://www.amazon.com/dp/B0B5WKNGBL"
"Average Rating Number: 4.4","","B0B6FWSTR4","PHINOX Under Bed Storage, Under the Bed Storage Containers with Wheels, Under Bed Shoe Storage Organizer Drawer for Bedroom Clothes Shoes Blankets -2Pack","PHINOX","$49.88","2,703","65","$134,826","07/12/2022","$27.38","4.6","1,969","$22.50","13,232","7","FBA","6","Home & Kitchen","Oversize","15.7 x 6.22 x 23.6 in","8.77 lb","https://www.amazon.com/dp/B0B6FWSTR4"
"","","B078JJ3C61","Zober Under Bed Storage - Pack of 2 Under Bed Storage Containers for Clothes, Blankets, Winter Clothing, & Shoes - Under The Bed Storage with Handles, Dual Zippers, & Clear Top (Gray)","ZOBER","$13.99","7,037","196","$98,448","11/08/2016","$-9.21","4.3","22,325","$23.20","3,165","6","FBA","1","Home & Kitchen","Oversize","18 x 6 x 41.97 in","1.07 lb","https://www.amazon.com/dp/B078JJ3C61"
"","","B0CG7X2L76","Beainbox Under Bed Storage with Wheels, 2 Pack UnderBed Storage Containers Organizer, Dorm Room Under the Bed Storage with Clear Lid, 6 4/5' High","Beainbox","$29.99","675","16","$20,243","10/05/2023","$7.81","4.5","49","$22.18","59,767","7","FBA","1","Home & Kitchen","Oversize","16.2 x 6.8 x 30 in","10.65 lb","https://www.amazon.com/dp/B0CG7X2L76"
"","","B09L8BR9FP","punemi Under Bed Storage With Lids, 2 Pack Large Underbed Storage Containers Clothes W/ 3 Handles, Foldable Low Profile Stackable Drawer Organizer Bins Box for Blanket Shoe Bedroom, 31.1*15.7*6inch","punemi","$34.87","2,572","55","$89,686","11/14/2021","$22.01","4.4","1,053","$12.86","15,991","7","FBA","5","Home & Kitchen","Standard","12.48 x 17.68 x 4.76 in","4.559 lb","https://www.amazon.com/dp/B09L8BR9FP"
"","","B09KHBH229","Amazon Basics Fabric Underbed Storage Bag Organizer with Handles - Black, 30.2'L x 20.1'W x 5.7'H, Pack of 2","Amazon Basics","$28.49","","","","06/21/2022","$17.49","4.4","654","$11.00","3,519","6","AMZ","3","Our Brands","Standard","6.969 x 15.63 x 4.567 in","4.453 lb","https://www.amazon.com/dp/B09KHBH229"
"","","B0CJHPRF57","YheenLf Under Bed Storage Containers Bin with Lids Handle, Foldable Sturdy Storage Bags with Handles for Organizing Clothes, Shoes, Blankets, Pillows, Beige, 1-Pack, 23.6' L x 11.8' W x 5.9' H","YheenLf","$15.99","120","4","$1,919","12/22/2023","","3.8","8","","187,075","","FBA","1","Home & Kitchen","","","","https://www.amazon.com/dp/B0CJHPRF57"
"","","B0BKSJZ4J4","Yawinhe Under Bed Storage Containers with Handles, Sturdy Zipper und Label Holders, Foldable Blanket Storage Bags, for Comforter, Clothing, 23.6''Lx11.8''Wx6''H, 2-Pack, Beige SNH002BES-2","Yawinhe","$31.99","159","5","$5,086","10/27/2022","","4.3","74","","176,974","6","FBA","1","Home & Kitchen","","","","https://www.amazon.com/dp/B0BKSJZ4J4"
"","","B0B4G4X43M","HAIXIN Storage Bins with Lids, Collapsible Storage Bins, Wardrobe Closet Organizer, 19 Gal Stackable Toy Storage, Foldable Plastic Storage Container with Door, Crate for Book Storage (3 Pack)","HAIXIN","$199.99","8,833","195","$1.77M","07/28/2022","$106.22","4.5","3,591","$93.77","3,183","6","FBA","3","Home & Kitchen","Oversize","15 x 43 x 25 in","14 lb","https://www.amazon.com/dp/B0B4G4X43M"
"","","B004I8Q6RQ","IRIS USA 50 Qt Plastic Under Bed Storage Bin with Lids and Durable Buckles, Multi-Purpose Container Box for Clothes, Shoes, and Duvets, Clear","IRIS","$35.99","1,837","53","$66,114","06/29/2017","$11.85","4.1","1,655","$24.14","16,746","7","AMZ","11","Home & Kitchen","Oversize","17.8 x 32.5 x 6.3 in","4.101 lb","https://www.amazon.com/dp/B004I8Q6RQ"
"","","B07SK9TMWY","NestNeatly SmartCube Underbed Storage Bag, 3 Large Bins with Reinforced Handles Foldable Containers","NestNeatly","$22.88","4,198","117","$96,050","05/29/2019","$12.72","4.3","13,310","$10.16","6,456","6","FBA","2","Home & Kitchen","Standard","11.575 x 14.449 x 3.622 in","1.537 lb","https://www.amazon.com/dp/B07SK9TMWY"
"","","B0BNX9DW7X","Yoleduo Under Bed Storage With Wheels Under bed Storage Containers Large Metal Foldable Space-saving Under Bed Drawer Shoe Storage Organizer on Wheels for Clothes(2 pieces, Black)","Yoleduo","$35.99","2,733","108","$98,361","12/02/2022","$15.57","4.5","499","$20.42","7,203","6","FBA","4","Home & Kitchen","Oversize","15.7 x 6.22 x 23.6 in","3.86 lb","https://www.amazon.com/dp/B0BNX9DW7X"
"","","B0C7QLKC6L","LANDNEOO 2 Pack Under Bed Storage Containers Bins, Moisture-Proof Plastic Underbed Storage Bins, Clothes Storage and Organization Bags, Under the Bed Blanket Storage with Handles for Clothes, Bedroom","LANDNEOO","$9.99","1,822","62","$18,202","06/11/2023","","4.2","114","","14,072","6","FBA","1","Home & Kitchen","","","","https://www.amazon.com/dp/B0C7QLKC6L"
"","","B0C84TH2XH","foriy 2 Pack Under Bed Storage with Wheels Underbed Storage Containers Transparent Visual Tool-free Rolling Under Drawers Organizer Cart with Handle for Bedroom Clothes Shoes Blankets Black","foriy","$32.28","","","$0.00","06/14/2023","","5","1","","1,159,240","7","FBA","1","Home & Kitchen","","","","https://www.amazon.com/dp/B0C84TH2XH"
"","","B0BZPNKK87","Yawinhe Underbed Storage Box,2-Pack Foldable Storage Containers,With Transparent Windows and 4 Reinforced Handles,Used for Storing Clothes,Blankets,Pillows,23.6x11.8x5.9In,Beige","Yawinhe","$21.99","86","3","$1,891","03/26/2023","","4.2","51","","274,754","7","FBA","1","Home & Kitchen","","","","https://www.amazon.com/dp/B0BZPNKK87"
"","","B0B82Q7M2Q","Yawinhe Under Bed Storage Containers, 2 Pack Under Bed Clothes Organizer with Sturdy Zipper, Clear Window and Reinforced Handles, for Blanket, Bedding, 31.5''Lx15.7''Wx6''H, Beige SNH001BEL-2","Yawinhe","$29.99","176","5","$5,278","07/28/2022","","4.6","256","","174,189","7","FBA","1","Home & Kitchen","","","","https://www.amazon.com/dp/B0B82Q7M2Q"
"","","B0C3CX5W6J","3rd Generation Under Bed Storage with Wheels 2-in-1 Underbed Storage Bins Containers Label Shoe Storage Organizer Drawer Bag Clear Window Solid Fabric for Bedroom Clothes Shoe Blanket (two-grey)","JIYINGDUO","$33.99","1,392","45","$47,314","04/23/2023","","4.5","233","","20,088","7","FBA","1","Home & Kitchen","","","","https://www.amazon.com/dp/B0C3CX5W6J"
"","","B0C1Z145Y2","Fulpower Under Bed Storage with Wheels, 2 Pack Under Bed Storage Containers, Large Under Bed Rolling Storage with Lid, Bedroom Storage Organizer for Clothes, Shoes,Toys, Books, Blankets BLACK","Fulpower","$34.99","1,719","46","$60,148","04/09/2023","","4.4","385","","19,649","7","FBA","2","Home & Kitchen","","","","https://www.amazon.com/dp/B0C1Z145Y2"
"","","B0CC5MR9HP","BlissTotes Foldable Storage Bins - Durable Under Bed Containers for Clothing Organization, 75L/2 Pack/Grey","BlissTotes","$9.99","4,043","73","$40,390","09/11/2023","$3.35","3.9","107","$6.64","11,603","6","FBA","1","Home & Kitchen","Standard","6.34 x 2.95 x 7.8 in","1.78 lb","https://www.amazon.com/dp/B0CC5MR9HP"
"","","B0CGX2FTHR","Hoyula Deep Under Bed Storage Container, 2 Pack 10' High 31' Long Large Underbed Box Storage Bins with Lids and Hard Bottom, for Closet, Bedroom, Dorms, Clothes, Bed sheets, blankets, Dark Gray","Hoyula","$42.99","519","12","$22,312","08/29/2023","$13.92","4.1","70","$29.07","74,785","7","FBA","1","Home & Kitchen","Oversize","16 x 10 x 31.5 in","4 lb","https://www.amazon.com/dp/B0CGX2FTHR"
"","","B0CH3LRNJ8","oylik 2 Pack Under Bed Storage with Wheels, Under Bed Shoe Storage Larger Capacity with PVC Clear Window & Label, Under the Bed Storage Containers for Shoe Clothes Toy Book(Black)","oylik","$34.98","270","9","$9,445","10/19/2023","","4.2","52","","97,452","7","FBA","1","Home & Kitchen","","","","https://www.amazon.com/dp/B0CH3LRNJ8"
"","","B07ZCW9S5P","Onlyeasy Large Underbed Storage Bags Organizer Container (2 Pack) with 4 Handles and 2 Sturdy Zippers, Blankets Clothes Comforters Foldable Storage Bags with Clear Window, Herringbone Grey, MXRUBBP2","Onlyeasy","$10.62","5,259","183","$55,851","11/26/2019","$3.24","4.4","18,217","$7.38","3,500","7","FBA","1","Home & Kitchen","Standard","6.8 x 13.2 x 3.4 in","1.151 lb","https://www.amazon.com/dp/B07ZCW9S5P"
"","","B0BB7GCBVK","Under Bed Storage, Large Underbed Storage Containers with Lids, Foldable Clothes Storage Bins W/ Reinforced Handle for Bedroom Organization, Closet Organizers for Blanket, Shoe, Pillow -2 Pack, Black","boailydi","$26.99","886","25","$23,913","09/14/2022","","4.5","313","","37,864","7","FBA","1","Home & Kitchen","","","","https://www.amazon.com/dp/B0BB7GCBVK"
"","","B0C32S1J3F","Under Bed Storage Containers, Stackable Under Bed Rolling Storage Plastic Containers, 11.5Gal Storage Bins with Wheels, Multi-purpose Storage Bins with Lids for Clothes, Shoes, And Duvets","Luseba","$69.99","803","36","$56,202","04/29/2023","","4.5","141","","25,371","6","FBA","4","Home & Kitchen","","","","https://www.amazon.com/dp/B0C32S1J3F"
"","","B0060A06HG","Rubbermaid RMCC410001, 41-Quart, Clear, Modern Storage Box, Bamboo","Rubbermaid","$145.00","614","40","$89,030","07/04/2014","$109.27","4.4","301","$35.73","23,186","4","FBM","24","Home & Kitchen","Oversize","18.4 x 14.2 x 32.1 in","21.6 lb","https://www.amazon.com/dp/B0060A06HG"
"","","B09LM8KPYN","StorageRight Storage Bins,3-Pack Clothes Storage, Foldable Blanket Storage Bags, Under Bed Storage Containers for Organizing, Clothing, Bedroom, Comforter, Closet, Dorm, Quilts, Organizer,Grey","StorageRight","$16.99","3,924","93","$66,669","01/02/2022","$8.01","4.2","5,979","$8.98","8,650","6","FBA","3","Home & Kitchen","Standard","10.079 x 12.047 x 3.583 in","1.041 lb","https://www.amazon.com/dp/B09LM8KPYN"
"","","B0CBPR26J5","Under Bed Storage 2 Pack, Stackable Under Bed Storage Containers with Wheels, Folding Plastic Storage Box with LidUnder Bed Storage Bins Drawer for Clothes, Shoes,Blankets","Corbyles","$63.99","816","17","$52,216","08/21/2023","$36.71","4.4","118","$27.28","55,026","7","FBA","2","Home & Kitchen","Oversize","15.74 x 6.49 x 32.28 in","12.98 lb","https://www.amazon.com/dp/B0CBPR26J5"
"","","B0BWN4XJW9","Supowin Underbed Storage Containers 3 Pack, Large Under Bed Storage Bins with Lids, Foldable Sturdy Under the Bed Storage Drawer for Organizing Clothes, Shoes, Blankets, Pillows-Grey","Supowin","$39.99","570","17","$22,794","04/18/2023","","4.6","244","","53,967","7","FBA","1","Home & Kitchen","","","","https://www.amazon.com/dp/B0BWN4XJW9"
"","","B0BXX1PZV2","StorageRight Storage Bags,Under bed Storage Containers With Durable Handles,Large Capacity Bins,Foldable Storage Organizers For Clothes,Bedding and Toys-75L/6 Pack/Grey","StorageRight","$24.99","1,739","36","$43,458","05/02/2023","","4","927","","26,055","7","FBA","3","Home & Kitchen","","","","https://www.amazon.com/dp/B0BXX1PZV2"
"","","B0CJ2LZYNY","Under Bed Storage with Wheels, Under Bed Storage Containers Metal Foldable Space-Saving Under Bed Drawer Shoe Storage Bins Organizer on Wheels for Clothes Books (2 Pack Black)","DTUQYX","$25.99","458","8","$11,903","09/13/2023","$14.46","4.4","53","$11.53","115,512","7","FBA","1","Home & Kitchen","Standard","10 x 2 x 12 in","7.92 lb","https://www.amazon.com/dp/B0CJ2LZYNY"
"","","B08HR4K9Y5","Rubbermaid Cleverstore Clear 41 Qt/10.25 Gal, Pack of 4 Stackable Plastic Containers with Durable Latching Clear Lids, Visible, Great for Craft, Tool, and Toy Storage","Rubbermaid","$77.39","10,344","231","$800,522","09/08/2020","$39.74","4.3","15,564","$37.65","2,469","7","AMZ","9","Home & Kitchen","Oversize","18.4 x 29.3 x 11.7 in","17.099 lb","https://www.amazon.com/dp/B08HR4K9Y5"
"","","B0C2BQQ24Q","Under Bed Storage Containers,Underbed Storage 4.5 Inches Low Profile with Sturdy Sidewalls/Bottom for Clothes, Blanket, Pillows and Shoes,Storage Organizer with Lids, Under the Bed Storage Bags 2Pack","YearningHome","$29.99","621","14","$18,624","04/12/2023","","4.5","149","","65,718","7","FBA","1","Home & Kitchen","","","","https://www.amazon.com/dp/B0C2BQQ24Q"
"","","B0BZ8C9FM1","Under Bed Storage Containers with Lid - Closet Organizer with Wheels 57.5Qt Foldable Underbed Storage Plastic Under the Bed Storage Stackable Cube Storage Dorm Room Essentials for Clothes (2 Pack)","HAIXIN","$129.99","2,500","27","$324,975","03/21/2023","$83.31","4.5","82","$46.68","34,655","7","FBA","1","Home & Kitchen","Oversize","31.89 x 13.39 x 15.94 in","15.12 lb","https://www.amazon.com/dp/B0BZ8C9FM1"
"","","B0CGRXMYVW","Supowin Under Bed Storage with Wheels, Rolling Underbed Storage Containers with Lids, Under Bed Shoe Storage Bins Organizer with Reinforced Metal Bottom Support and Three Handles, 2 Pack Grey","Supowin","$49.99","1,123","24","$56,139","11/22/2023","","4.3","71","","39,839","7","FBA","1","Home & Kitchen","","","","https://www.amazon.com/dp/B0CGRXMYVW"
"","","B0CDQKBBT7","StorageExpert Closet Organizers and Storage - Maximize Space with Under Bed Storage Containers & Clothes Storage - Ideal Closet Storage, Toy Storage Organizer & Underbed Storage (Grey, 4 Pack)","StorageExpert","$39.99","1,077","6","$43,069","08/03/2023","","4.7","104","","150,418","6","FBA","2","Home & Kitchen","","","","https://www.amazon.com/dp/B0CDQKBBT7"
"","","B08B12DNP8","Under Bed Storage, 2 Pack Underbed Storage Container Bags With Lid, Foldable Sturdy Clothes Storage Drawer Organizer W/ 3 Handles, Ultra Thick Fabric Blanket Shoe Storage Box, 30x15x6.7inch, Grey","punemi","$28.99","1,962","56","$56,878","06/15/2020","$18.21","4.5","1,461","$10.78","15,776","7","FBA","1","Home & Kitchen","Standard","10.7 x 15.5 x 3.2 in","3.699 lb","https://www.amazon.com/dp/B08B12DNP8"
"","","B0CGD9QV3W","boailydi Under Bed Storage with Wheels & Lid, 2PCS Underbed Storage Container, 29.5 x 15.7 x 8.7 in Tall, Blankets Clothes Comforters Shoe Storage Bag Drawers, Rolling Zippered Organizer Bin -Black","boailydi","$39.99","332","9","$13,277","10/09/2023","$14.41","4.2","96","$25.58","95,413","7","FBA","1","Home & Kitchen","Oversize","15.7 x 8.7 x 29.5 in","8.5 lb","https://www.amazon.com/dp/B0CGD9QV3W"
"","","B07TXXSMVY","Mill & Mint  2 Large Underbed Storage Bags + 1 Organizer Bin  Foldable Under Bed Storage Containers for Clothes, Blankets, Toys & Shoes, Gray","Mill & Mint","$21.84","819","29","$17,887","07/05/2019","$12.77","4.3","4,058","$9.07","31,758","7","FBA","1","Home & Kitchen","Standard","9.2 x 13.1 x 3.4 in","1.301 lb","https://www.amazon.com/dp/B07TXXSMVY"
"","","B0C27X9PN1","ALPHA GOODS Under Bed Storage Containers with Wheels-55Qt.(2 Units).Multi Purpose Storage Bins with a 2-Side Latching Lid and Glide Wheels.Drawers for Clothes,Shoes,Toys and other Items.13,7Gal.","ALPHA GOODS","$79.99","192","10","$15,358","04/11/2023","","4.7","65","","93,420","7","FBA","1","Home & Kitchen","","","","https://www.amazon.com/dp/B0C27X9PN1"
"","","B09B2FCBNT","TidyCorner 2-Pack Under Bed Storage Containers, 4.5 Inches Tall Low Profile Underbed Clothes Storage Organizer Bin with Sturdy Sidewalls/Bottom, Underbed Storage Bins 2 Storage Thin Bins","TidyCorner","$31.99","2,587","96","$82,758","07/21/2021","$20.16","4.7","1,432","$11.83","8,344","7","FBA","8","Home & Kitchen","Standard","11.693 x 17.362 x 4.095 in","3.644 lb","https://www.amazon.com/dp/B09B2FCBNT"
"","","B002BA5F4I","Sterilite 41 Qt Underbed Storage Box, Stackable Bin with Lid, Plastic Container to Organize Bedroom, Clear Base and White Lid, 6-Pack","Sterilite","$67.19","9,872","331","$663,300","11/21/2007","$29.17","4.6","1,660","$38.02","1,392","5","AMZ","9","Home & Kitchen","Oversize","17.1 x 35.2 x 11.6 in","23.55 lb","https://www.amazon.com/dp/B002BA5F4I"
"","","B0C7KG76SZ","Under Bed Storage with Wheels and Lid, Under Bed Rolling Storage with XXL Large Capacity, Under the Bed Storage for Bedroom Under Bed Storage Containers for Clothes Shoe Blanket Toy Book byAUING,2Pack","AUING","$42.99","618","16","$26,568","06/13/2023","","4","126","","57,753","7","FBA","1","Home & Kitchen","","","","https://www.amazon.com/dp/B0C7KG76SZ"
"","","B08LPQLZTN","storageLAB Under Bed Storage Containers, Closet Organizers and Storage Bins, 2 Pack Underbed Clothes Storage Organizer with Sturdy Handles for use Under the Bed, End of Bed, Bed Accessories, Comforter","storageLAB","$29.65","2,012","63","$59,656","10/22/2020","$17.90","4.7","13,329","$11.75","13,780","7","FBA","1","Home & Kitchen","Standard","11.654 x 17.52 x 3.583 in","3.807 lb","https://www.amazon.com/dp/B08LPQLZTN"
"","","B08HYWQW8X","AMJ Foldable Under Bed Storage Basket Container [2 Pack] with Durable Fabric for Clothes, Shoes,Toys, Blanket, Comforter Organizers Bins, Black Grey","AMJ","$29.99","301","11","$9,027","09/07/2020","$18.46","4.7","779","$11.53","86,874","6","FBA","1","Home & Kitchen","Standard","11.575 x 17.441 x 3.937 in","3.94 lb","https://www.amazon.com/dp/B08HYWQW8X"
"","","B0CJ29LCXV","HUWAILE 60L Large Capacity Under Bed Storage with Wheels-Under Bed Storage Containers-Under Bed Storage Drawer-Under Bed Storage Organizer for Clothes, Blankets, Shoes, Books, and Toys (2 Pack)","HUWAILE","$39.99","330","11","$13,197","09/13/2023","$24.26","4.6","63","$15.73","82,900","7","FBA","1","Home & Kitchen","Standard","6 x 4 x 16 in","9.57 lb","https://www.amazon.com/dp/B0CJ29LCXV"
"","","B0CB82XRJX","GoMaihe Under Bed Storage with Wheels: XXL 48L Underbed Storage Containers with Lids - Rolling Drawers for Shoes Clothes in Dorm Bedroom - Space-Saving Easy Pull-out Grey 2-Pack","GoMaihe","$36.99","1,391","37","$51,453","07/05/2023","$13.38","4.4","248","$23.61","24,712","7","FBA","1","Home & Kitchen","Oversize","16.9 x 6.69 x 30.7 in","8.2 lb","https://www.amazon.com/dp/B0CB82XRJX"
"","","B0C6FB96QN","Fixwal Black Underbed Storage Bags with Clear Window and 2 Reinforced Handles Under Bed Storage Containers for Clothing, Bedding, Comforter2 Pack","Fixwal","$9.99","1,355","43","$13,536","05/22/2023","","4.2","937","","21,110","7","FBA","1","Home & Kitchen","","","","https://www.amazon.com/dp/B0C6FB96QN"
"","","B0C7K8GFL7","Innotic Under Bed Storage, Under Bed Storage with Wheels, Foldable Under Bed Shoe Storage Containers, Tool-free Assembly, Metal Underbed Storage Drawer For Clothes, Shoes, Books, Toys - 2 PACK","Innotic","$33.99","516","16","$17,539","06/06/2023","","4.9","10","","59,148","7","FBA","2","Home & Kitchen","","","","https://www.amazon.com/dp/B0C7K8GFL7"
"","","B0C7LB2KLZ","Supowin Under Bed Storage, 2 Pack Underbed Storage Containers with Three Handles, Foldable Underbed Clothes Organizer Bins, Under the Bed Storage Drawer with Durable Zipper, 24x 15.4 x 6inch, Grey","Supowin","$16.09","323","11","$5,197","06/08/2023","","4.4","87","","81,261","7","FBA","1","Home & Kitchen","","","","https://www.amazon.com/dp/B0C7LB2KLZ"
"","","B0BXRT2C28","Fixwal Underbed Storage Bags Foldable Clothes Storage Bins with Clear Window Sturdy Zippers Storage Containers for Organizing Clothing Bedroom, 4-Pack Grey Pattern","Fixwal","$13.99","524","10","$7,331","03/07/2023","","4.2","482","","89,512","6","FBA","1","Home & Kitchen","","","","https://www.amazon.com/dp/B0BXRT2C28"
"","","B0CLCZ5CHW","MixcMax Underbed Storage Containers with Wheels - Lengthen Under Bed Storage Bins With Lids, Large Capacity Metal Clothes Organizer for Bedroom, Storage Box for Clothing Shoes Blankets Sheet","MixcMax","$29.99","589","15","$17,664","10/18/2023","","4.7","32","","63,831","7","FBA","1","Home & Kitchen","","","","https://www.amazon.com/dp/B0CLCZ5CHW"
"","","B07JMZ4XNV","storageLAB Slim Under Bed Storage Containers, Closet Organizers and Storage Bins, 2 Pack Underbed Storage for Shoes, Adjustable Dividers, Use Under the Bed, End of Bed, Bed Accessories, Shoe Storage","storageLAB","$39.99","435","18","$17,396","10/23/2018","$26.06","4.8","6,871","$13.93","53,340","6","FBA","4","Home & Kitchen","Standard","12.71 x 15.47 x 6.14 in","7.5 lb","https://www.amazon.com/dp/B07JMZ4XNV"
"","","B0C4L23KL2","TUMUCUTE Under Bed Storage, Underbed Storage Containers with Wheels, Metal Under the Bed Storage, Under Bed Storage Organizer for Shoe, Clothes, Blankets, Bedding(4 Pack)","TUMUCUTE","$29.99","220","6","$6,598","05/07/2023","","3.7","71","","156,191","6","FBA","1","Home & Kitchen","","","","https://www.amazon.com/dp/B0C4L23KL2"
"","","B0BRF274B5","Luseba Under Bed Storage with Wheels, Drawer with Markable Nameplate, Under-Bed Shoe Storage Organizer for Clothes, Toy, Book, Blanket, Under Bed Storage Containers","Luseba","$29.99","228","11","$6,838","11/12/2022","$10.09","4.4","287","$19.90","80,778","7","FBA","4","Home & Kitchen","Oversize","16.14 x 6.3 x 24.02 in","4 lb","https://www.amazon.com/dp/B0BRF274B5"
"","","B0CKVP2MVH","Memobarco Under Bed Storage with Wheels and Lids, 2pcs Under Bed Storage Containers, Rolling Underbed Shoe Storage Organizer Metal Drawers, Under Bed Storage Basket & Cart with Bag Cover, Clear Window","Memobarco","$35.98","270","9","$9,715","","","4.2","40","","103,882","","FBA","","Home & Kitchen","","","","https://www.amazon.com/dp/B0CKVP2MVH"