"Export time:  1/28/2024, 4:43:25 PM","","ASIN","Product Name","Brand","Price","Monthly Units Sold","Daily Units Sold","Monthly Revenue","Date First Available","Net Revenue","Star Rating","Reviews","Amazon Fees","BSR","LQS","Seller Type","Sellers","Category","Product Tier","Dimensions","Weight","Link"
"","","B08C9QTG6H","WRITECH Retractable Highlighters Assorted Colors: Chisel Tip Click Aesthetic Highlighter Marker Pens Pack Multi Colored Ink No Bleed Smear for Highlighting Journaling (12ct Neon+Pastel)","WRITECH","$12.88","3,210","107","$41,345","07/01/2020","$8.16","4.7","4,254","$4.72","2,003","6","FBA","2","Office Products","Standard","5.91 x 0.75 x 6.1 in","5.6 oz","https://www.amazon.com/dp/B08C9QTG6H"
"retractable highlighters","","B08H1VGD2B","Dabo&Shobo Yellow highlighter, 60 Pack -bright color, chisel tip, for Adults Kids Highlighting in the Home School Office ","Dabo&Shobo","$16.99","1,477","37","$25,094","08/30/2020","$9.30","4.6","780","$7.69","6,685","7","FBA","1","Office Products","Standard","5.75 x 2.52 x 7.32 in","1.4 lb","https://www.amazon.com/dp/B08H1VGD2B"
"Average Monthly Sales: 3,017","","B086WYJC6D","Shuttle Art 70 Pack Highlighters, Yellow Highlighters with Versatile Chisel Tip, Highlighter Markers Bulk in Vibrant Color for Highlighting as Office, School Supplies","Shuttle Art","$18.99","867","20","$16,464","04/08/2020","$12.60","4.7","892","$6.39","12,498","7","FBA","1","Office Products","Standard","3.94 x 1.97 x 3.94 in","0.014 oz","https://www.amazon.com/dp/B086WYJC6D"
"Average Revenue: $34,332","","B07H1BT4X6","Tebik Gel Highlighter, 10 Colors Bible Safe Highlighter Study Kit, Highlighters Assorted Colors, Twistable Design, No Bleeding Great for Journaling, Highlighting and Study","Tebik","$8.49","180","6","$1,528","09/02/2018","$4.37","4.7","2,331","$4.12","36,854","7","FBA","1","Office Products","Standard","5.3 x 5.4 x 0.7 in","0.201 lb","https://www.amazon.com/dp/B07H1BT4X6"
"Average Price: $11.57","","B0002LD1M6","SHARPIE Retractable Highlighters, Chisel Tip, Fluorescent Yellow, 12 Count","SHARPIE","$13.75","2,075","61","$28,531","11/26/2004","$8.15","4.8","1,044","$5.60","3,892","6","AMZ","44","Office Products","Standard","1.25 x 3.37 x 6.37 in","0.48 oz","https://www.amazon.com/dp/B0002LD1M6"
"Average No. of Ratings: 2,793","","B015G83JI0","Sharpie 28101 Accent Retractable Highlighters Chisel Tip Assorted Colors 8/Set","SHARPIE","$15.09","938","32","$14,154","09/15/2015","$10.36","4.5","136","$4.73","7,740","6","FBA","23","Office Products","Standard","6.5 x 0.7 x 8.3 in","4.8 oz","https://www.amazon.com/dp/B015G83JI0"
"Average Sales Rank: 78,647","","B08XYRFL64","WRITECH Retractable Highlighters Assorted Colors: Chisel Tip Click Aesthetic Highlighter Marker Pens Pack Multi Colored Ink No Bleed Smear for Highlighting Journaling (12ct Neutral)","WRITECH","$12.88","3,081","107","$39,683","11/14/2021","$7.41","4.7","4,254","$5.47","2,003","6","FBA","1","Office Products","Standard","5.87 x 0.87 x 6.02 in","5.3 oz","https://www.amazon.com/dp/B08XYRFL64"
"Average Rating Number: 4.6","","B07Y9NFXRC","Shuttle Art Yellow Highlighters, 30 Pack Highlighters Bright Colors, Chisel Tip Dry-Quickly Non-Toxic Highlighter markers for Adults Kids Highlighting in Home School Office","Shuttle Art","$12.99","814","20","$10,574","09/22/2019","$8.12","4.7","892","$4.87","12,498","6","FBA","1","Office Products","Standard","8.9 x 0.71 x 11.54 in","0.014 oz","https://www.amazon.com/dp/B07Y9NFXRC"
"","","B086W4F9PJ","Shuttle Art Dry Erase Markers, 25 Pack Black Magnetic Whiteboard Markers with Erase, Fine Point Dry Erase Markers Perfect for Writing on Dry-Erase Whiteboards Mirrors Glasses for School Office Home","Shuttle Art","$12.99","867","27","$11,262","04/07/2020","$7.50","4.5","1,091","$5.49","9,087","7","FBA","1","Office Products","Standard","3.94 x 1.97 x 3.94 in","3.53 oz","https://www.amazon.com/dp/B086W4F9PJ"
"","","B086WXTVMP","Shuttle Art 144 Pack Highlighters, Highlighters Assorted Colors Set, 8 Bright Colors Chisel Tip Highlighter Markers Bulk for Kid and Adult Coloring, Highlighting as School Supplies","Shuttle Art","$32.99","178","6","$5,872","04/08/2020","$24.50","4.7","197","$8.49","37,707","7","FBA","1","Office Products","Standard","3.94 x 1.97 x 3.94 in","0.014 oz","https://www.amazon.com/dp/B086WXTVMP"
"","","B00443HDAY","Sharpie 28175PP Retractable Highlighters Chisel Tip Assorted Fluorescent Colors 5/Set","SHARPIE","$8.20","786","17","$6,445","09/21/2010","$3.99","4.6","72","$4.21","14,096","6","FBA","27","Office Products","Standard","4.2 x 8.2 x 0.6 in","2.39 oz","https://www.amazon.com/dp/B00443HDAY"
"","","B002ONCFP4","SHARPIE 1740822 Accent Retractable Highlighter, Chisel Tip, Fluorescent Yellow, 5-Count","SHARPIE","$8.62","1,440","46","$12,413","09/08/2009","$3.79","4.8","1,445","$4.83","5,348","5","FBA","9","Office Products","Standard","4.3 x 8.3 x 1 in","2.4 oz","https://www.amazon.com/dp/B002ONCFP4"
"","","B08BVZZHF2","Mr. Pen- Colorful Highlighters Set, 6 Pack, Assorted Colors, Retractable Colored Bible Markers","Mr. Pen","$6.99","1,386","45","$9,688","06/24/2020","$3.02","4.5","2,848","$3.97","5,476","5","FBA","1","Office Products","Standard","3.2 x 0.7 x 6 in","3.2 oz","https://www.amazon.com/dp/B08BVZZHF2"
"","","B0B9S8JW4N","BESARME 6 Pieces White Out Correction Tape Pen, Push Pull Protective, Easy to Use Applicator for Instant School Office Supplies, 1/5 X 236 Inch","BESARME","$9.99","355","13","$3,546","06/23/2022","$5.57","4.3","437","$4.42","18,070","6","FBA","1","Office Products","Standard","1.1 x 0.59 x 5.5 in","0.53 oz","https://www.amazon.com/dp/B0B9S8JW4N"
"","","B0CGZ8HWWP","Sliverdew 12 Rolls Highlighter Tapes, 0.24inx16.4ft Transparent Highlighter Tape Removable Highlighter Strips for Student Teachers to Take Notes for Classroom Home Office, Total 197ft","Sliverdew","$6.29","245","9","$1,541","08/30/2023","$2.43","4.3","59","$3.86","27,189","7","FBA","1","Office Products","Standard","1.38 x 0.24 x 1.38 in","1.45 oz","https://www.amazon.com/dp/B0CGZ8HWWP"
"","","B00PFEC8SI","Sharpie Accent Retractable Highlighters, Chisel Tip, Assorted Colros, 5ct","SHARPIE","$8.99","119","4","$1,070","11/09/2014","$4.72","4.2","60","$4.27","58,254","2","FBA","1","Office Products","Standard","4.21 x 0.63 x 8.15 in","2.39 oz","https://www.amazon.com/dp/B00PFEC8SI"
"","","B0141M4U2G","Sharpie 28025 Accent Retractable Highlighters Chisel Tip Fluorescent Yellow Dozen","SHARPIE","$15.46","84","2","$1,299","08/24/2015","$9.63","4.8","67","$5.83","84,922","6","FBA","22","Office Products","Standard","3.4 x 1.3 x 6.4 in","5.6 oz","https://www.amazon.com/dp/B0141M4U2G"
"","","B00094AGGU","SHARPIE SAN28175PP - Sharpie Retractable Highlighters","SHARPIE","$6.48","365","11","$2,365","01/02/2007","$2.59","4.6","530","$3.89","22,282","4","AMZ","14","Office Products","Standard","4.2 x 8.2 x 0.6 in","2.4 oz","https://www.amazon.com/dp/B00094AGGU"
"","","B001HA12M2","Pentel Handy-line S Retractable Highlighter, Chisel Tip, Assorted Ink Colors, 4/ Pack (SXS15BP4M)","Pentel","$8.20","161","4","$1,320","08/14/2007","$4.05","4.7","520","$4.15","53,811","6","FBA","12","Office Products","Standard","7.38 x 3.63 x 0.63 in","1.44 oz","https://www.amazon.com/dp/B001HA12M2"
"","","B09XHBMW6B","ZEYAR Gel Highlighters, Bible Highlighter Pens, No Bleed, Quick Dry, assorted colors, Bible Study and Bible Journaling Supplies, Bible highlighters for Tabs (8 Fluorescent colors)","ZEYAR","$3.99","1,151","138","$4,592","04/07/2022","$0.47","4.7","216","$3.52","1,442","6","FBA","1","Office Products","Standard","5.2 x 0.62 x 4.4 in","4.2 oz","https://www.amazon.com/dp/B09XHBMW6B"
"","","B08R71VS87","BANJI White Out Correction Tape Office Learning Easy to Use Applicator for Instant Correction, Learning Supplies and Office Products 9 Pack 1/5 in. x 39.3 ft. (5mm x 12m)","BANJI","$7.60","149","5","$1,132","12/22/2020","$3.39","4.2","552","$4.21","42,197","7","FBA","1","Office Products","Standard","8.7 x 0.5 x 12.6 in","6.7 oz","https://www.amazon.com/dp/B08R71VS87"
"","","B00V86BJU0","BIC Brite Liner Highlighters, Chisel Tip, 24-Count Pack of Highlighters Assorted Colors, Ideal Highlighter Set for Organizing and Coloring","BIC","$10.06","41,690","1,575","$419,401","07/25/2010","$4.78","4.8","34,094","$5.28","21","7","AMZ","40","Office Products","Standard","2.75 x 5.5 x 2.75 in","8.5 oz","https://www.amazon.com/dp/B00V86BJU0"
"","","B0CD7VT9R7","60 Pcs Mini Pens for Nurses Pen Badge Clip with Mini Highlighter Retractable Neon Nurse Pen LED Keychain Clip Flashlight Key Ring Nursing Ballpoint Pen for Nurse Kid Accessories (Black,Keychain)","Chinco","$20.99","210","7","$4,408","07/30/2023","$12.55","4.1","39","$8.44","33,766","7","FBA","1","Office Products","Standard","5 x 2.13 x 9.49 in","1.19 lb","https://www.amazon.com/dp/B0CD7VT9R7"
"","","B000789JTS","SHARPIE Accent Pen-Style Retractable Highlighters, 12 Fluorescent Pink Highlighters (28029)","SHARPIE","$15.10","125","2","$1,888","08/15/2007","$9.42","4.3","78","$5.68","103,012","5","FBA","27","Office Products","Standard","6.62 x 5.18 x 15.18 in","2.08 oz","https://www.amazon.com/dp/B000789JTS"
"","","B00HEQS69A","Pentel Handy-Line S Retractable and Refillable Chisel Tip Highlighter, Light Green Ink, Box of 12 (SXS15-K)","Pentel","$15.70","60","2","$942.00","11/07/2012","$9.56","4.4","29","$6.14","103,435","4","AMZ","2","Office Products","Standard","3.2 x 1.2 x 5.5 in","0.3 lb","https://www.amazon.com/dp/B00HEQS69A"
"","","B08ZSTYKM8","Sharpie Liquid Retractable Highlighters Assorted Colors, Chisel Tip Highlighter Pens, 1 Pack of 8 Count","SHARPIE","$17.49","36","1","$629.64","03/22/2021","$11.16","4.8","10,456","$6.33","122,151","5","FBA","8","Office Products","Standard","6 x 5 x 8 in","5.3 oz","https://www.amazon.com/dp/B08ZSTYKM8"
"","","B00125KHD2","Pentel Handy-line S Retractable and Refillable Highlighter, Yellow 12-Count (SXS15-G)","Pentel","$17.31","30","1","$519.30","06/21/2007","$11.17","4.5","42","$6.14","114,583","4","AMZ","3","Office Products","Standard","3.16 x 5.33 x 1.16 in","0.32 oz","https://www.amazon.com/dp/B00125KHD2"
"","","B0876QMQ5P","HiKin Cute Starfish Highlighters, Creative Multi Color Fluorescent Pens Markers, Non-Toxic & Odorless Watercolor, Great for Journal Planner Note Taking and Coloring Book.","HiKin","$5.99","105","4","$628.95","04/16/2020","$2.17","4.1","110","$3.82","58,149","7","FBA","1","Office Products","Standard","2.3 x 0.6 x 4 in","0.81 oz","https://www.amazon.com/dp/B0876QMQ5P"
"","","B014XTDB18","Diamond Peel-Off China Markers,Glass, Cellophane, Vinyl,Metal, Skin, Etc..Assorted - Pack of 12 (Color Mix - 26 Color)","Office 4 All","$7.99","600","27","$4,794","09/04/2015","$3.87","4.3","2,186","$4.12","9,047","6","FBA","3","Office Products","Standard","0.4 x 0.4 x 6.7 in","0.32 oz","https://www.amazon.com/dp/B014XTDB18"
"","","B0141N5O2A","Sharpie 28025 Accent Retractable Highlighters Chisel Tip Fluorescent Yellow Dozen","SHARPIE","$14.99","60","2","$899.40","12/12/2012","$9.16","4.4","20","$5.83","87,249","6","FBA","22","Office Products","Standard","6.62 x 5.18 x 15.18 in","2.08 oz","https://www.amazon.com/dp/B0141N5O2A"
"","","B07PDN2PZL","[6 Color] Assorted Retractable Design Highlighters, One Hand Operation","Tomorotec","$7.95","48","2","$381.60","03/05/2019","$3.84","4.5","190","$4.11","102,701","6","FBA","1","Office Products","Standard","2.99 x 0.67 x 5.83 in","2.39 oz","https://www.amazon.com/dp/B07PDN2PZL"
"","","B07XSDKRH8","Sharpie 28101 Accent Retractable Highlighters, Chisel Tip, Assorted Colors, 16 Markers","SHARPIE","$6.99","","","$0.00","09/10/2019","","","","","224,556","4","FBM","5","Office Products","","","","https://www.amazon.com/dp/B07XSDKRH8"
"","","B002JGP29C","Pentel Handy-line S Retractable Highlighter, Chisel Tip, Yellow Ink, 2/ Pack (SXS15BP2G)","Pentel","$3.98","131","5","$521.38","05/02/2006","$0.46","4.4","62","$3.52","40,306","4","AMZ","1","Office Products","Standard","7.38 x 2.38 x 0.63 in","0.8 oz","https://www.amazon.com/dp/B002JGP29C"
"","","B00822DXRA","Pentel Handy-Line S Retractable and Refillable Highlighter, Chisel Tip, Orange Ink, Box of 12 (SXS15-F)","Pentel","$5.99","130","2","$778.70","03/31/2012","$1.55","4.5","42","$4.44","80,437","5","AMZ","2","Office Products","Standard","1 x 3.25 x 5.5 in","4.2 oz","https://www.amazon.com/dp/B00822DXRA"
"","","B002PI4SJO","Pentel Handy-line S Retractable Highlighter, Chisel Tip, Yellow Ink, 4 /Pack (SXS15BP4G)","Pentel","$7.74","185","6","$1,432","09/16/2009","$3.68","4.5","208","$4.06","37,336","5","AMZ","2","Office Products","Standard","7.38 x 3.63 x 0.63 in","0.8 oz","https://www.amazon.com/dp/B002PI4SJO"
"","","B000BPGSAA","SHARPIE 28152PP Retractable Highlighter, Smearguard Technology, Vivid and High Contrast Colors, Pack of 1 Blister Including 2 Highlighters","SHARPIE","$7.89","90","3","$710.10","02/16/2007","$3.17","4.7","686","$4.73","73,827","4","FBA","2","Office Products","Standard","5.2 x 1.8 x 8 in","0.35 lb","https://www.amazon.com/dp/B000BPGSAA"
"","","B00DGN61QU","Promarx HS09-ALCB02-48 Glowline RT Retractable Highlighters, Yellow and Pink, 2 Count","Promarx","$4.78","30","1","$143.40","06/12/2013","$1.14","4.5","102","$3.64","106,632","6","AMZ","3","Office Products","Standard","3 x 7.5 x 0.5 in","1.44 oz","https://www.amazon.com/dp/B00DGN61QU"
"","","B0141NDHCO","Sharpie 28025 Accent Retractable Highlighters Chisel Tip Fluorescent Yellow Dozen","SHARPIE","$10.06","","","$0.00","03/29/2011","$4.23","4.7","9","$5.83","207,732","6","FBM","30","Office Products","Standard","3.4 x 1.3 x 6.4 in","5.8 oz","https://www.amazon.com/dp/B0141NDHCO"
"","","B00HEQS6D6","Pentel Handy-Line S Retractable and Refillable Chisel Tip Highlighter, Sky Blue Ink, Box of 12 (SXS15-S)","Pentel","$14.99","30","1","$449.70","11/30/2013","$9.40","5","15","$5.59","127,463","4","AMZ","2","Office Products","Standard","3.2 x 1.2 x 5.4 in","0.3 lb","https://www.amazon.com/dp/B00HEQS6D6"
"","","B0038DCZMW","Sharpie 28029 Accent Retractable Highlighters Chisel Tip Fluorescent Pink Dozen","SHARPIE","$14.99","60","3","$899.40","02/12/2010","$8.98","5","1","$6.01","69,445","5","FBM","26","Office Products","Standard","3.4 x 1.3 x 6.4 in","6.4 oz","https://www.amazon.com/dp/B0038DCZMW"
"","","B00NJRCMM0","Sharpie Smear Guard Retractable Highlighters","SHARPIE","$9.46","90","3","$851.40","02/14/2012","$5.12","4.6","179","$4.34","75,073","5","FBA","22","Office Products","Standard","6.1 x 0.7 x 7 in","5.1 oz","https://www.amazon.com/dp/B00NJRCMM0"
"","","B0BG67WKPM","Mr. Pen- Aesthetic Highlighters, 20 pcs, Chisel Tip, Pastel Colors, No Bleed Bible Highlighter Pastel, Highlighters Assorted Colors, Pastel Highlighter Set, Christmas Gifts","Mr. Pen","$12.99","39,163","1,069","$508,727","09/21/2022","$7.97","4.6","9,530","$5.02","48","6","FBA","1","Office Products","Standard","5.31 x 0.55 x 10.31 in","8.8 oz","https://www.amazon.com/dp/B0BG67WKPM"
"","","B0002LD14O","SHARPIE Liquid Highlighter, Chisel Tip Highlighters, Assorted Colors, 10 Count","SHARPIE","$11.73","8,816","199","$103,412","09/27/2007","$6.43","4.8","16,179","$5.30","875","6","AMZ","55","Office Products","Standard","8.87 x 6.75 x 9.67 in","3.52 oz","https://www.amazon.com/dp/B0002LD14O"
"","","B09Y2KJ2KX","SHARPIE Pocket Highlighters, Mild Pastel Colors, Great Stocking Stuffer and Holiday Gift for College Students, Teacher Gifts, Assorted, Chisel Tip, 12 Count","SHARPIE","$11.99","3,310","71","$39,687","04/14/2022","$6.65","4.7","915","$5.34","3,267","6","AMZ","28","Office Products","Standard","3.5 x 1.2 x 5.8 in","4.2 oz","https://www.amazon.com/dp/B09Y2KJ2KX"
"","","B019QROV9S","SHARPIE Highlighter, Clear View Highlighter with See-Through Chisel Tip, Stick Highlighter, Assorted, 8 Count","SHARPIE","$13.49","11,636","438","$156,970","01/15/2016","$8.55","4.7","11,638","$4.94","257","6","AMZ","16","Office Products","Standard","5.75 x 7.63 x 0.5 in","2.88 oz","https://www.amazon.com/dp/B019QROV9S"
"","","B015G8CHKG","Sharpie 24415PP Accent Liquid Pen Style Highlighter Chisel Tip Assorted 10/Set","SHARPIE","$13.60","617","17","$8,391","09/15/2015","$8.00","4.9","527","$5.60","14,113","6","FBA","27","Office Products","Standard","7.5 x 1 x 7.75 in","5 oz","https://www.amazon.com/dp/B015G8CHKG"
"","","B00HEQS6FO","Pentel Handy-Line S Retractable and Refillable Chisel Tip Highlighter, Violet Ink, Box of 12 (SXS15-V)","Pentel","$18.21","35","","$637.35","11/30/2013","$11.94","4.4","35","$6.27","191,414","5","AMZ","2","Office Products","Standard","3.25 x 1 x 5.5 in","4.2 oz","https://www.amazon.com/dp/B00HEQS6FO"
"","","B00HEQS6EA","Pentel Handy-Line S Retractable and Refillable Chisel Tip Highlighter, Pink Ink, Box of 12 (SXS15-P)","Pentel","$18.22","15","1","$273.30","11/30/2013","$11.95","4.5","41","$6.27","162,297","5","AMZ","3","Office Products","Standard","3.25 x 1 x 5.5 in","4.2 oz","https://www.amazon.com/dp/B00HEQS6EA"
"","","B0819FJLH7","BIC Brite Liner Grip Pastel Highlighter Set, Chisel Tip, 12-Count Pack of Pastel Highlighters in Assorted Colors (colors may vary)","BIC","$7.98","17,202","671","$137,272","11/09/2019","$3.24","4.8","21,221","$4.74","120","7","AMZ","18","Office Products","Standard","2.8 x 1.46 x 5.63 in","5 oz","https://www.amazon.com/dp/B0819FJLH7"
"","","B007QALB3W","Pentel Knock Highlighter, Handy Line, 5 Color Set (SXNS15-5)","Pentel","$8.45","35","","$295.75","08/08/2012","$4.26","4.3","1,064","$4.19","181,678","5","FBA","15","Office Products","Standard","5.71 x 0.67 x 2.36 in","1.76 oz","https://www.amazon.com/dp/B007QALB3W"
"","","B0CHYDC4GK","EOOUT Highlighters,18Pack,Highlighters Assorted Colors, Aesthetic Highlighters for Bible, Pastel Highlighters for Journal Planner School Office Supplies","EOOUT","$5.99","330","11","$1,977","09/12/2023","$1.57","5","3","$4.42","22,493","6","FBA","1","Office Products","Standard","5.87 x 0.55 x 9.21 in","7.9 oz","https://www.amazon.com/dp/B0CHYDC4GK"
"","","B0040R4E2O","SHARPIE Pocket Style Highlighters, Chisel Tip, Assorted Colors, 24 Count","SHARPIE","$14.82","4,461","120","$66,112","03/16/2010","$9.06","4.8","9,753","$5.76","1,738","6","AMZ","26","Office Products","Standard","6.2 x 1.3 x 6.3 in","1.59 oz","https://www.amazon.com/dp/B0040R4E2O"
"","","B018KGPKE6","Pilot, FriXion Light Pastel Erasable Highlighters, Chisel Tip, Pack of 5, Pastel Blue, Pink, Yellow, Green & Purple.","PILOT","$6.59","7,224","238","$47,606","11/25/2015","$2.68","4.6","19,993","$3.91","678","7","AMZ","27","Office Products","Standard","4.3 x 7.7 x 0.7 in","1.8 oz","https://www.amazon.com/dp/B018KGPKE6"
"","","B015G8CD32","Sharpie 28025 Accent Retractable Highlighters Chisel Tip Fluorescent Yellow Dozen","SHARPIE","$15.46","","","$0.00","09/15/2015","$9.40","3.1","2","$6.06","391,873","6","FBM","18","Office Products","Standard","3.4 x 1.3 x 6.4 in","6.4 oz","https://www.amazon.com/dp/B015G8CD32"
"","","B0BX1PNYCM","Mr. Pen- Glitter Highlighters, 8Pack, Metallic Colors, Chisel Tip Aesthetic Highlighters, Cute Highlighters for School, No Bleed Highlighters, Highlighters Aesthetic, School Highlighters, Cute Markers","Mr. Pen","$4.85","525","16","$2,546","02/26/2023","$1.20","4.6","12","$3.65","15,229","7","FBA","1","Office Products","Standard","3.94 x 0.67 x 9.41 in","5 oz","https://www.amazon.com/dp/B0BX1PNYCM"
"","","B0002LD1KI","Sharpie Accent Retractable Assorted 5 Pack","SHARPIE","$6.99","52","2","$363.48","02/12/2005","$2.87","4.7","2,556","$4.12","105,274","4","FBA","1","Office Products","Standard","5.37 x 8.06 x 0.62 in","2.39 oz","https://www.amazon.com/dp/B0002LD1KI"
"","","B08MBF61DH","SHARPIE Tank Highlighters, Chisel Tip, Assorted Color Highlighters, Value Pack, 36 Count","SHARPIE","$21.11","11,846","225","$250,069","11/02/2020","$12.96","4.8","5,672","$8.15","735","6","AMZ","30","Office Products","Standard","4.44 x 5 x 4.44 in","1.3 lb","https://www.amazon.com/dp/B08MBF61DH"
"","","B088F79T3D","STAPLES Hype Retractable Highlighters Chisel","STAPLES","$13.60","","","$145.50","05/09/2020","$9.95","3.9","3","$3.65","377,750","4","FBA","6","Office Products","Standard","3 x 0.5 x 7.5 in","0.12 lb","https://www.amazon.com/dp/B088F79T3D"
"","","B0C9JKGHCB","SHARPIE Accent Retractable Highlighters, Fluorescent Yellow, Pack Of 5","SHARPIE","$15.46","","","$0.00","06/26/2023","$12.24","","","$3.22","708,452","5","","20","Office Products","Standard","4.25 x 0.65 x 8.25 in","3.36 oz","https://www.amazon.com/dp/B0C9JKGHCB"
"","","B0141M4OMM","Sharpie 28029 Accent Retractable Highlighters Chisel Tip Fluorescent Pink Dozen","SHARPIE","$15.46","15","1","$231.90","08/22/2015","$9.02","4.5","31","$6.44","147,667","5","FBM","19","Office Products","Standard","3.4 x 1.3 x 6.4 in","6.4 oz","https://www.amazon.com/dp/B0141M4OMM"
"","","B0C1S7CHS9","18Pcs Bible Highlighters and Pens No Bleed Aesthetic Highlighters Cute Colored Gel Pens Highlighter Set Retractable Pastel Pens Bible Study Supplies Assorted Colors Dual Tip Highlighters","Lestp","$11.99","284","16","$3,405","04/06/2023","$7.12","4.5","60","$4.87","15,368","7","FBA","1","Office Products","Standard","6.1 x 0.75 x 8.62 in","9.6 oz","https://www.amazon.com/dp/B0C1S7CHS9"
"","","B07CNC9G7V","AbilityOne - NSN5548210 - Retractable Chisel Tip Highlighter - 12 Pack - Yellow Ink","AbilityOne","$14.40","","","$0.00","05/02/2018","$8.47","","","$5.93","565,202","5","FBM","12","Office Products","Standard","7.5 x 1 x 10 in","8 oz","https://www.amazon.com/dp/B07CNC9G7V"
"","","B0CKMTXXT9","ZEYAR Aesthetic Cute Highlighter Pens, Cream colors, Chisel Tip, Water Based, Quick Dry, No Bleed for bible, four seasons color series (8 Summer Colors)","ZEYAR","$6.39","5,610","187","$35,848","12/25/2023","","5","32","","955","","FBA","1","Office Products","","","","https://www.amazon.com/dp/B0CKMTXXT9"
"","","B09YGHF82J","ZEYAR Highlighter Pen, Cream Colors Chisel Tip, Aesthetic Highlighter Marker, Water Based, Quick Dry, No Bleed, for Bible Study Notes School Office (6 Youth Colors)","ZEYAR","$5.59","3,939","221","$22,019","04/20/2022","$1.83","4.7","2,680","$3.76","756","6","FBA","1","Office Products","Standard","5.5 x 0.7 x 5.8 in","5 oz","https://www.amazon.com/dp/B09YGHF82J"
"","","B0C287B4XR","AOROKI 12 Colored Curve Highlighter Pen Set, 10 Different Shapes Dual Tip Marker Highlighters for Journaling Drawing Note Taking,Curve Highlighter pens for Planner Scrapbook School Supplies","AOROKI","$12.99","2,068","60","$26,863","04/11/2023","$8.12","4.1","932","$4.87","3,935","7","FBA","1","Office Products","Standard","5.59 x 0.63 x 6.06 in","4.2 oz","https://www.amazon.com/dp/B0C287B4XR"
"","","B011UEXFY2","6Pcs Highlighter Marker Set - Colored Highlighters Premier Double Ended Set - Highlighters Assorted Colors for School Supplies, Journaling Supplies, Anime Stuff - Multicolor Highlighters Novelty Pens","The Little Green Change","$5.99","201","6","$1,204","07/16/2015","$2.17","4.7","1,838","$3.82","37,522","7","FBA","1","Office Products","Standard","3 x 0.5 x 5.8 in","2.4 oz","https://www.amazon.com/dp/B011UEXFY2"