"Export time:  2/2/2024, 12:12:29 PM","","ASIN","Product Name","Brand","Price","Monthly Units Sold","Daily Units Sold","Monthly Revenue","Date First Available","Net Revenue","Star Rating","Reviews","Amazon Fees","BSR","LQS","Seller Type","Sellers","Category","Product Tier","Dimensions","Weight","Link"
"","","B0CLCZH8FD","TRZZ Sheet Organizers and Storage, 4-Pack, Queen/King Size (Grey), Bed Sheet Organizer, Linen Closet Organizer and Storage for Bed Sheets, Duvet Covers and Pillowcases, 15' L13' W5' H","TRZZ","$49.99","516","17","$25,795","10/18/2023","","4.8","95","","55,087","6","FBA","2","Home & Kitchen","","","","https://www.amazon.com/dp/B0CLCZH8FD"
"linen closet organization","","B0CPHJFXGP","HEIBOSO Bed Sheet Organizers and Storage-Linen Closet Organizers and Storage Folding Bedding Storage Foldable Sheet Cube Box Closet Home Organization Box Clothes Blankets Grey(4Pack)","HEIBOSO","$39.90","60","2","$2,394","12/22/2023","","5","8","","386,703","","FBA","1","Home & Kitchen","","","","https://www.amazon.com/dp/B0CPHJFXGP"
"Average Monthly Sales: 5,239","","B0B67PCFLQ","23Qt Plastic Storage Bins Organizer 3 Tier, Stackable Storage Boxes with Lids, Storage Containers for Bedroom Living Room Kitchen Study Office, Folding Storage Boxes","CTSNSLH","$32.99","8,644","121","$285,166","08/24/2022","","4.5","1,901","","6,150","7","FBA","11","Home & Kitchen","","","","https://www.amazon.com/dp/B0B67PCFLQ"
"Average Revenue: $147,099","","B0BZYC5Q47","Bed Sheet Organizer and Storage Size Label Bands | Sheets Set Organizers for Linen Closet - Labeled Elastic Bedding Sheet Keepers Straps for Organizing Foldable Bedsheet Sets (King 4PCs Pack | White)","ECOHomes","$12.99","12,596","976","$163,622","11/02/2022","","4.6","398","","181","7","FBA","1","Home & Kitchen","","","","https://www.amazon.com/dp/B0BZYC5Q47"
"Average Price: $29.92","","B0BQC3SRHC","Fordonral 4 Pack Linen Storage Bins, Storage Containers for Organizing Clothing, Jeans, Toys, Books, Shelves, Closet, Wardrobe - Closet Organizers and Storage, Large Storage Boxes Baskets with Window","Fordonral","$20.98","2,196","72","$46,072","12/15/2022","$9.90","4.7","220","$11.08","11,739","6","FBA","3","Home & Kitchen","Standard","10.63 x 6.69 x 15.75 in","1 lb","https://www.amazon.com/dp/B0BQC3SRHC"
"Average No. of Ratings: 3,268","","B0BVB46NYX","BDZBREN 4Pack Linen Storage BinsStorage Containers for Organizing Clothing, Jeans, Toys, Shelves, Closet, Wardrobe - Closet Organizers and StorageFoldable Large Storage Boxes Baskets with Window","BDZBREN","$19.99","463","2","$9,255","02/19/2023","","4.6","88","","393,691","6","FBA","1","Home & Kitchen","","","","https://www.amazon.com/dp/B0BVB46NYX"
"Average Sales Rank: 51,741","","B0BR7MSWN2","homsorout Trapezoid Storage Bins, Foldable Closet Organization , Closet Storage Organizer for Shelves, Linen Closet Organizers and Storage for Toy, Clothes, 6 Packs (Blended)","homsorout","$39.99","1,558","47","$62,304","12/27/2022","","4.6","342","","19,405","6","FBA","1","Home & Kitchen","","","","https://www.amazon.com/dp/B0BR7MSWN2"
"Average Rating Number: 4.6","","B08BQBNXSQ","ClearSpace Plastic Storage Bins  Perfect Kitchen Organization or Pantry Storage  Fridge Organizer, Pantry Organization and Storage Bins, Cabinet Organizers","ClearSpace","$39.99","14,598","393","$583,774","06/22/2020","$25.46","4.8","10,431","$14.53","281","6","FBA","10","Kitchen & Dining","Standard","11.496 x 16.024 x 7.638 in","5.311 lb","https://www.amazon.com/dp/B08BQBNXSQ"
"","","B09TFVV1QB","ClearSpace X-Large Plastic Storage Bins With Lids - Perfect for Kitchen, Pantry, Fridge Organization and Storage","ClearSpace","$54.99","2,177","63","$119,713","02/24/2022","$37.01","4.6","1,645","$17.98","4,019","6","FBA","2","Kitchen & Dining","Standard","14 x 18 x 8 in","9.149 lb","https://www.amazon.com/dp/B09TFVV1QB"
"","","B0BXNNLG5C","Mirspt Storage bins,plastic storage bins with lids-76Quart large foldable storage containersDurable stackable storage drawers for bedroom, hall, kitchen, RV, office(3Packs)","Mirspt","$127.49","322","10","$41,052","03/06/2023","","4.7","155","","87,816","7","FBA","1","Home & Kitchen","","","","https://www.amazon.com/dp/B0BXNNLG5C"
"","","B09GW5ZXWR","CLEARSPACE Plastic Storage Bins With lids  Perfect Kitchen Organization or Pantry Storage  Fridge Organizer, Pantry Organization and Storage Bins, Cabinet Organizers - 4 Pack","ClearSpace","$39.99","4,308","105","$172,277","04/17/2022","$26.36","4.7","1,222","$13.63","2,114","6","FBA","4","Kitchen & Dining","Standard","11.3 x 11.73 x 7.99 in","5.95 lb","https://www.amazon.com/dp/B09GW5ZXWR"
"","","B0CD45XMBX","Linen Closet Organizers And Storage, 4 Pack Closet Storage Bins Linen Closet Baskets for Closet Organization Foldable Closet Organizer Bins with Clear Window For Organizing Clothing, Jeans, Shelves","Pradnel","$25.59","600","10","$15,354","07/28/2023","$15.32","4.2","80","$10.27","89,241","7","FBA","2","Home & Kitchen","Standard","8.46 x 4.72 x 10.98 in","2.25 lb","https://www.amazon.com/dp/B0CD45XMBX"
"","","B0BGHQ8D11","Yieach 4PCS Shelf Dividers,Clear Closets Shelf and Closet Separator for Organization in Bedroom,Kitchen Cabinets Shelf Storage and Office Shelves","Yieach","$17.99","1,383","50","$24,880","12/14/2022","","4.6","325","","17,949","6","FBA","1","Home & Kitchen","","","","https://www.amazon.com/dp/B0BGHQ8D11"
"","","B0CH2XNB9C","Phinox 4-Pack Queen or King Size Breathable Fabric Storage Boxes with Zippers for Linen Closet","PHINOX","$32.99","270","9","$8,907","08/31/2023","","4.6","60","","96,700","7","FBA","1","Home & Kitchen","","","","https://www.amazon.com/dp/B0CH2XNB9C"
"","","B0CNVR2DYT","Bed Sheet Organizers and Storage, 2 IN 1 Large Capacity Clothes Storage Bag Sheet Folding Organizer for Linen Closet (King&Queen Size), SheetCube Sheet Storage Organizer for Blankets Bedding,Beige","Jolensoy","$24.99","240","8","$5,998","12/19/2023","","4.6","35","","107,426","","FBA","1","Home & Kitchen","","","","https://www.amazon.com/dp/B0CNVR2DYT"
"","","B0CND5KBKS","Springfield Studios Stackable Bed Sheet Organizers and Storage, Each Canvas Bag holds 2 sets of Queen or King Sheet/Duvet, Upgrade your closet organizers and storage with trendy bedding storage bags","Springfield Studios","$19.99","120","4","$2,399","11/15/2023","","4.6","20","","197,448","","FBA","","Home & Kitchen","","","","https://www.amazon.com/dp/B0CND5KBKS"
"","","B0CJJHLSXQ","BigPonPon 3-Pack Foldable Bed Sheets Set Organizers and Storage(King & Queen Size),Linen Fabric Closet Organizers with Window,Folding Bedding Storage Box for Bedsheets and Pillow Cube Organizer","BigPonPon","$29.77","1,825","64","$54,330","09/20/2023","$18.78","4.5","61","$10.99","13,517","7","FBA","1","Home & Kitchen","Standard","12.5 x 4.7 x 15 in","5.13 lb","https://www.amazon.com/dp/B0CJJHLSXQ"
"","","B0CF9T764B","StorageWorks Shoe Organizer for Closet, Extra Large Fabric Shoe Storage Bins with Clear Cover, Adjustable Dividers for Shoe Storage, Beige, 1-Pack, Fits up to 20 Pairs","StorageWorks","$39.09","4,799","127","$187,593","10/22/2023","","4.8","255","","5,825","6","FBA","1","Home & Kitchen","","","","https://www.amazon.com/dp/B0CF9T764B"
"","","B0C9H8QK29","Fabspace Pull-out Home Organizer, 2 Pack 2 Tier Clear Bathroom Organizer with Dividers, Multipurpose Vanity Counter Tray, Kitchen, Closet Organizers, Cabinet & Storage Container Bins","Fabspace","$23.99","3,188","115","$76,480","08/12/2023","$13.06","4.3","420","$10.93","1,876","7","FBA","1","Kitchen & Dining","Standard","7 x 10.6 x 11.8 in","4.55 lb","https://www.amazon.com/dp/B0C9H8QK29"
"","","B0B825RMNF","CTSNSLH 4 Pack Folding Closet Organizers Storage Box, Stackable Plastic Drawer Basket for Clothing(White)","CTSNSLH","$37.99","5,387","89","$204,652","07/28/2022","","4.4","768","","9,083","7","FBA","4","Home & Kitchen","","","","https://www.amazon.com/dp/B0B825RMNF"
"","","B08R5BN6DH","Closet Organization And Storage Baskets (Set of 9) - Perfect Storage Baskets for Bathroom, Laundry, Baby Nursery Clothes, Linen Closet, Kitchen Pantry or Use As Baskets for Organizing (Dark Grey)","NEATERIZE","$38.96","1,984","54","$77,297","03/25/2021","$25.79","4.8","2,248","$13.17","16,365","7","FBA","1","Home & Kitchen","Standard","13.15 x 15.35 x 4.8 in","4.61 lb","https://www.amazon.com/dp/B08R5BN6DH"
"","","B092ZDHJMN","Fab totes 6 Pack Clothes Storage, Foldable Blanket Storage Bags, Storage Containers for Organizing Bedroom, Closet, Clothing, Comforter, Organization and Storage with Lids and Handle, Grey","Fab totes","$29.99","51,586","1,234","$1.55M","08/20/2021","","4.3","22,012","","109","6","FBA","8","Home & Kitchen","","","","https://www.amazon.com/dp/B092ZDHJMN"
"","","B0CH2X6NLY","PhinoX 4-Pack Black Minimalistic Breathable Fabric Storage Boxes with Zippers for Queen or King Sheets and Bedding","PHINOX","$32.99","446","9","$14,714","08/31/2023","","4.6","60","","96,700","7","FBA","1","Home & Kitchen","","","","https://www.amazon.com/dp/B0CH2X6NLY"
"","","B0CBJLCG78","GoMaihe Bed Sheet Organizers and Storage: 4-Pack XXL Foldable Bedsheet Set Organizer for Linen Closet Bedding Blankets Organizing - Easy Pull-out & Identification with Clear Window and Handle","GoMaihe","$35.99","233","5","$8,386","09/18/2023","$23.26","4.7","25","$12.73","170,605","7","FBA","1","Home & Kitchen","Standard","13.2 x 3.94 x 17.34 in","6.53 lb","https://www.amazon.com/dp/B0CBJLCG78"
"","","B0BVM2PXSW","StorageWorks Closet Storage Bins with Clear Window and 2 Handles, Foldable Storage Baskets for Shelves, Large Fabric Organizer, Brown and Beige, 3 Pack","StorageWorks","$19.99","1,742","72","$34,823","07/12/2023","","4.7","410","","11,776","6","FBA","1","Home & Kitchen","","","","https://www.amazon.com/dp/B0BVM2PXSW"
"","","B085ZV98JM","90L Large Storage Bags, 6 Pack Clothes Storage Bins Foldable Closet Organizers Storage Containers with Durable Handle for Clothing, Blanket, Comforters, Bed Sheets, Pillows and Toys (Gray)","Budding Joy","$24.99","51,020","1,239","$1.27M","03/16/2020","$13.31","4.3","44,789","$11.68","108","6","FBA","4","Home & Kitchen","Standard","11.54 x 14.45 x 6.77 in","2.69 lb","https://www.amazon.com/dp/B085ZV98JM"
"","","B00LM34YXS","Lynk Vela Shelf Dividers - Linen Closet Organizers and Storage - Linen Storage - Closet Organization - Towel Organizer for Closet (Set of 2) - Platinum","Lynk","$17.99","818","20","$14,716","10/08/2014","$9.50","4.2","5,720","$8.49","46,555","6","FBA","1","Home & Kitchen","Standard","8.661 x 14.173 x 2.362 in","1.014 lb","https://www.amazon.com/dp/B00LM34YXS"
"","","B0811PXNBJ","StorageWorks Storage Bins, Extra Large Closet Storage Bins for Organizing, Fabric Storage Baskets with Handles, Rectangle Storage Baskets for Closet, Natural Color, 2-Pack","StorageWorks","$22.39","9,276","322","$207,690","11/04/2019","$12.60","4.6","4,764","$9.79","1,460","6","FBA","1","Home & Kitchen","Standard","12.95 x 17.2 x 2.13 in","3.419 lb","https://www.amazon.com/dp/B0811PXNBJ"
"","","B07QB8NZJ1","DECOMOMO Storage Bins | Fabric Storage Baskets for Shelves for Organizing Closet Shelf Nursery Toy | Decorative Large Linen Closet Organizer Bins with Handles (Grey and White, Large - 3 Pack)","DECOMOMO","$25.99","3,584","27","$93,148","04/03/2019","$8.97","4.7","23,170","$17.02","34,996","7","FBA","1","Home & Kitchen","Oversize","11 x 9.5 x 15 in","2.88 lb","https://www.amazon.com/dp/B07QB8NZJ1"
"","","B0C9QBRQB4","SpaceAid 4 Pack Bed Sheet Organizers and Storage, Foldable Sheet Organizer for Linen Closet, Sheets Set Folder Keeper with Window XL (Queen & King Size) Organizing Bedding Container, Gray","SpaceAid","$33.98","6,400","279","$217,472","06/28/2023","","4.6","237","","1,846","6","FBA","1","Home & Kitchen","","","","https://www.amazon.com/dp/B0C9QBRQB4"
"","","B091F669MP","3Pack Foldable Storage Bins - Frame Storage Box Linen Fabric Stackable Clothes Container Organizer with Clear Window & Carry Handles Large Capacity (Small-22L, Light Grey)","CYhom","$29.99","678","19","$20,333","11/09/2021","$19.06","4.7","947","$10.93","49,369","7","FBA","1","Home & Kitchen","Standard","12 x 1.5 x 16 in","3.3 lb","https://www.amazon.com/dp/B091F669MP"
"","","B0C6JMSMHC","Siaomo Bed Sheet Organizer Bands, Sheet Set Storage Label Bands, Elastic Bedding Sheet Straps Wraps for Organizing Linen ClosetKing 4PCs | Gold","","$7.99","1,020","34","$8,150","","","4.3","46","","27,312","","FBA","","Home & Kitchen","","","","https://www.amazon.com/dp/B0C6JMSMHC"
"","","B0BN1CW61P","StorageWorks Closet Storage Bins,Storage Baskets with Cutout Window and 2 Handles, Foldable Fabric Clothes Organizer, Large, Beige, 2-Pack","StorageWorks","$21.99","973","29","$21,396","11/20/2022","$5.57","4.9","16","$16.42","32,669","6","FBA","1","Home & Kitchen","Oversize","12.75 x 10.25 x 12.75 in","1.94 lb","https://www.amazon.com/dp/B0BN1CW61P"
"","","B0BZYX9GTS","zjdbset 20 PiecesBed Sheet Organizer Bands Bed Sheet Keepers Closet Organization ElasticLinen Labels for Bed Sheet Sets(Queen,King,Full,Twin)","zjdbset","$15.49","2,954","105","$45,757","04/30/2023","","4.5","74","","7,418","6","FBA","3","Home & Kitchen","","","","https://www.amazon.com/dp/B0BZYX9GTS"
"","","B0BZCWPPD6","StorageTastic Storage Bin,Collapsible Storage Basket For Organizing,Large Storage Boxes With Rope Handles,Storage Containers,Clothes Organizer,Gradient Grey,Pack of 3","StorageTastic","$17.99","1,856","57","$33,389","03/22/2023","$2.55","4.4","427","$15.44","15,502","7","FBA","3","Home & Kitchen","Oversize","10 x 9.5 x 15 in","1 lb","https://www.amazon.com/dp/B0BZCWPPD6"
"","","B0BZCBJ7RL","Volnamal Legging Organizer for Closet, Metal Yoga Pants Hangers 2 Pack w/10 Clips Holds 20 Leggings, Space Saving Hanging Closet Organizer w/Rubber Coated Closet Organizers and Storage, Black","Volnamal","$15.99","14,890","430","$238,091","03/22/2023","","4.3","851","","889","7","FBA","2","Home & Kitchen","","","","https://www.amazon.com/dp/B0BZCBJ7RL"
"","","B0C9PL48DM","BIKTIC SheetCube Bed Sheet Organizers and Storage,4 Pack Sheet Folder Organizer (Queen or King Size), Linen Closet Organizer for Bedding Sheets,Duvet Covers and Pillow cases,Grey","BIKTIC","$49.99","1,602","42","$80,084","07/31/2023","","4.8","371","","21,514","7","FBA","4","Home & Kitchen","","","","https://www.amazon.com/dp/B0C9PL48DM"
"","","B09QKL4WSS","2 Tier Clear Organizer with Dividers for Cabinet / Counter, MultiUse Slide-Out Storage Container - Kitchen, Pantry, Medicine Cabinet Storage Bins - Bathroom, Vanity Makeup, Under Sink Organizing Tray","LANDNEOO","$19.99","5,650","165","$112,943","01/16/2022","$9.66","4.5","4,412","$10.33","1,133","7","FBA","4","Kitchen & Dining","Standard","7.5 x 9.1 x 12.4 in","2.95 lb","https://www.amazon.com/dp/B09QKL4WSS"
"","","B0CFQCLLZY","Huolewa Closet Storage Bins, 6 Pack Trapezoid Storage Bins, Linen Closet Organizers and Storage, Foldable Closet Baskets for Shelves with Handles, Fabric Storage Boxes for Clothes, Toys, Dvds, Grey","Huolewa","$39.99","225","7","$8,998","12/05/2023","","4.8","25","","121,344","7","FBA","1","Home & Kitchen","","","","https://www.amazon.com/dp/B0CFQCLLZY"
"","","B09TB8WFXC","HomeHacks Storage 3-Pack Clothes Organizer Storage Bags Foldable Storage Box with Large Clear Window Sturdy Handles for Closet, Dorm, Pillows, Bedding, Clothes, Stuffed Toys, Blankets, 35L, Grey","HomeHacks","$11.99","4,762","134","$57,096","04/09/2022","$4.40","4.4","1,169","$7.59","5,398","6","FBA","5","Home & Kitchen","Standard","9.84 x 9.92 x 3.82 in","0.86 lb","https://www.amazon.com/dp/B09TB8WFXC"
"","","B08P16KRQJ","Pinkpum Stackable Plastic Storage Basket-Foldable Closet Organizers and Storage Bins 4 Pack-Drawer Shelf Storage Container for Wardrobe Cupboard Kitchen Bathroom Office 4L","Pinkpum","$37.99","3,902","102","$148,237","11/22/2020","$24.66","4.4","2,312","$13.33","7,694","7","FBA","4","Home & Kitchen","Standard","5.1 x 16.5 x 12.6 in","6.65 lb","https://www.amazon.com/dp/B08P16KRQJ"
"","","B0CJ96WLV2","8 Pack Linen Closet Organizers and Storage, Foldable Closet Storage Bins with Clear Window, Linen Closet Baskets for Closet Organization, Suitable for Organizing Clothing, Jeans, Shelves, Toys","Rainmae","$26.99","150","5","$4,048","09/17/2023","$18.27","","","$8.72","165,315","7","FBA","1","Home & Kitchen","Standard","5 x 1 x 10 in","9.6 oz","https://www.amazon.com/dp/B0CJ96WLV2"
"","","B0B8LZZ133","Bed Sheet Organizer and Storage Size Label Bands | Sheets Set Organizers for Linen Closet - Labeled Elastic Bedding Sheet Keepers Straps for Organizing Foldable Bedsheet Sets (Queen 4PCs Pack | Cream)","ECOHomes","$9.99","11,254","976","$112,427","10/28/2022","","4.6","398","","181","7","FBA","1","Home & Kitchen","","","","https://www.amazon.com/dp/B0B8LZZ133"
"","","B0CCJ3GRKV","Storage Baskets for Shelves Closet Bins - Large Fabric Rectangle Storage Bin Basket for Organizing Decorative Linen Closet Organization Foldable Clothes Organizer Shelf Cube Totes Containers Boxes","Sodynee","$14.69","90","9","$1,322","07/20/2023","$-0.63","4.4","16","$15.32","95,449","7","FBA","2","Home & Kitchen","Oversize","11 x 9.5 x 15 in","1.92 lb","https://www.amazon.com/dp/B0CCJ3GRKV"
"","","B0C16JFJJN","SheetCube 4 Pack Bed Sheet Organizers and Storage, Foldable Bedding Storage Box Container with Window and Label, Linen Closet Organizer Folder for Blanket, Duvet Cover Set, Bed Sheet Set - Grey","SUOCO","$25.49","1,384","88","$35,278","06/05/2023","","4.1","553","","9,246","6","FBA","1","Home & Kitchen","","","","https://www.amazon.com/dp/B0C16JFJJN"
"","","B06XFYGRX7","STORi Audrey Stackable Clear Bin Plastic Organizer Drawers | 2 Piece Set | Organize Cosmetics and Beauty Supplies on a Vanity | Made in USA","STORi","$23.99","8,578","201","$205,786","05/20/2015","$13.36","4.6","20,962","$10.63","2,563","6","FBA","6","Beauty & Personal Care","Standard","8.98 x 13.39 x 6.18 in","3.75 lb","https://www.amazon.com/dp/B06XFYGRX7"
"","","B004FEGDY4","Lynk Tall White Shelf Dividers - Linen Closet Organizers and Storage - Linen Storage - Closet Organization - Towel Organizer for Closet (Set of 2)","Lynk","$14.99","433","12","$6,491","05/31/2012","$6.95","4.3","1,502","$8.04","77,227","6","FBA","3","Home & Kitchen","Standard","8.98 x 14.41 x 2.32 in","1.1 lb","https://www.amazon.com/dp/B004FEGDY4"
"","","B0C24N63FB","ZJCAHXJ 12pcs Bed Sheet Organizers and Storage Bands for Closet Organization Linen Labels King Twin Full Queen Bedding Bands Elastic Sheet Straps","ZJCAHXJ","$12.99","337","16","$4,378","04/18/2023","","4.4","35","","56,784","7","FBA","1","Home & Kitchen","","","","https://www.amazon.com/dp/B0C24N63FB"
"","","B08R7T5XXP","GRANNY SAYS Closet Storage Bins, Jumbo Closet Organizers and Storage, Fabric Storage Bin for Closet Organization, Clothing Storage Baskets for Organizing Linen Toy, White with Black Stripes, 3-Pack","GRANNY SAYS","$23.99","1,782","55","$42,750","12/22/2020","$6.51","4.7","8,404","$17.48","16,142","6","FBA","1","Home & Kitchen","Oversize","11.81 x 10.43 x 15.35 in","3.85 lb","https://www.amazon.com/dp/B08R7T5XXP"
"","","B01CZUJACQ","StorageWorks Large Storage Baskets for Organizing, Foldable Storage Baskets for Shelves, Fabric Storage Bins with Handles, Beige, White & Ivory, 3-Pack","StorageWorks","$25.99","5,804","156","$150,846","03/14/2016","$15.36","4.7","13,957","$10.63","4,389","6","AMZ","2","Home & Kitchen","Standard","11.06 x 15.59 x 2.72 in","4.539 lb","https://www.amazon.com/dp/B01CZUJACQ"
"","","B0CNK6DQVV","WINSTECK 4 Pack Linen Closet Organizers and Storage Bins, Storage Containers with Clear Window, Large Storage Boxes Baskets for Organizing Clothing, Jeans, Toys, Books, Shelves, Closet, Wardrobe","WINSTECK","$23.99","180","6","$4,318","01/02/2024","","4.3","18","","139,062","","FBA","1","Home & Kitchen","","","","https://www.amazon.com/dp/B0CNK6DQVV"
"","","B0C9QB47R2","SpaceAid 8 Pack Bed Sheet Organizers and Storage, Foldable Sheet Organizer for Linen Closet, Sheets Set Folder Keeper with Window XL (Queen & King Size) Organizing Bedding Container, Beige","SpaceAid","$62.98","1,274","43","$80,237","06/28/2023","","4.4","127","","21,151","6","FBA","2","Home & Kitchen","","","","https://www.amazon.com/dp/B0C9QB47R2"
"","","B0B1ZNVMR4","Recycled Wicker Storage Basket, Paper Rope Storage Baskets for Organizing Container Bins for Shelves Cupboards Drawer, Small Woven Basket Set of 4","PROLAND","$25.99","1,410","47","$36,646","05/22/2022","$15.66","4.5","285","$10.33","19,159","6","FBA","1","Home & Kitchen","Standard","7.76 x 4.84 x 11.81 in","1.8 lb","https://www.amazon.com/dp/B0B1ZNVMR4"
"","","B0B3JJYJSS","DEKAVA Under Sink Organizer 2 Pack, Bathroom Cabinet Organizer, 2 Tier Sliding Cabinet Basket Organizer Drawer, Multi-Purpose Bath Collection Baskets for Bathroom (Black)","DEKAVA","$36.99","7,156","210","$264,700","06/07/2022","$17.94","4.6","2,616","$19.05","796","6","FBA","23","Kitchen & Dining","Oversize","8.7 x 13 x 15.4 in","4.3 lb","https://www.amazon.com/dp/B0B3JJYJSS"
"","","B0B6TK767D","REALINN Under Sink Organizer, Pull Out Cabinet Organizer 2 Tier Slide Out Sink Shelf Cabinet Storage Shelves, Under Sink Storage for Kitchen Bathroom Cabinet","REALINN","$34.99","42,984","1,194","$1.50M","07/17/2022","","4.4","3,000","","30","7","FBA","7","Kitchen & Dining","","","","https://www.amazon.com/dp/B0B6TK767D"
"","","B0C48X4H9B","MHHA 2 Pack Bathroom Cabinet Organizer, 2 Tier Clear Under Sink Organizers and Storage Medicine Cabinet Organizer with Dividers, Pull Out Kitchen Pantry Shelf Cupboard Closet Vanity Organization Bins","MHHA","$26.99","1,737","35","$46,882","07/12/2023","","4.5","729","","7,732","7","FBA","1","Kitchen & Dining","","","","https://www.amazon.com/dp/B0C48X4H9B"
"","","B08JPVWLB8","WISELIFE Storage Bags [3 Pack/100L] Large Blanket Clothes Organization and Storage Containers for Comforters,Bedding, Foldable Organizer with Reinforced Handle, Clear Window, Sturdy Zippers,Gray","WISELIFE","$19.99","5,390","181","$107,746","11/25/2020","$10.56","4.6","10,679","$9.43","3,553","7","FBA","2","Home & Kitchen","Standard","11.614 x 11.89 x 3.976 in","1.636 lb","https://www.amazon.com/dp/B08JPVWLB8"
"","","B07KDY4R9K","TitanSecure 8 PK White Wire Shelf Dividers for Closets on 12' Wire Shelves - Sturdiest Closet Organizer Takes Seconds to Install. Organize Your Bedroom, Bathroom and Much More","TitanSecure","$29.99","838","32","$25,132","02/15/2019","$18.46","4.7","2,647","$11.53","29,033","6","FBA","1","Home & Kitchen","Standard","13.19 x 14.8 x 3.7 in","4.83 lb","https://www.amazon.com/dp/B07KDY4R9K"
"","","B09FFVLYH4","mDesign Large Modern Plastic Open Front Dip Storage Organizer Bin Basket for Bathroom Organization - Vanity Shelf, Cubby, Cabinet, and Closet Organizing Decor - Ligne Collection - 2 Pack - Clear","mDesign","$43.99","1,596","51","$70,208","11/04/2021","$28.56","4.6","375","$15.43","17,502","7","FBA","1","Home & Kitchen","Standard","12 x 8 x 16 in","2.33 lb","https://www.amazon.com/dp/B09FFVLYH4"
"","","B09VGBVHYH","Homsorout Closet Storage Bins, Trapezoid Storage Baskets with Handle, Closet Organizer Bins for Closet Organization, Storage Baskets for Organizing Shelves , Clothes, Books, Toys, 3 Packs, Blended","homsorout","$23.99","93","3","$2,231","03/13/2022","","4.6","237","","286,246","6","FBA","2","Home & Kitchen","","","","https://www.amazon.com/dp/B09VGBVHYH"
"","","B0C2HCW8V7","【Upgraded】Bed Sheet Organizer Bands 8 Pieces,Sheet Organizer for Linen Closet, Sheet Set Organizer, Sheet Keepers Closet Organization, King Twin Full Queen Sheet Straps, Elastic Bed Sheet Storage","ZUMRUKES","$11.99","426","21","$5,108","05/15/2023","","4.7","76","","44,427","6","FBA","3","Home & Kitchen","","","","https://www.amazon.com/dp/B0C2HCW8V7"
"","","B0C9Q61MDQ","SpaceAid 6 Pack Bed Sheet Organizers and Storage, Foldable Sheet Organizer for Linen Closet, Sheets Set Folder Keeper with Window XL (Queen & King Size) Organizing Bedding Container, Black","SpaceAid","$49.98","1,057","27","$52,829","06/28/2023","","4.6","131","","34,911","6","FBA","2","Home & Kitchen","","","","https://www.amazon.com/dp/B0C9Q61MDQ"