"Export time:  2/5/2024, 1:19:34 AM","","ASIN","Product Name","Brand","Price","Monthly Units Sold","Daily Units Sold","Monthly Revenue","Date First Available","Net Revenue","Star Rating","Reviews","Amazon Fees","BSR","LQS","Seller Type","Sellers","Category","Product Tier","Dimensions","Weight","Link"
"","","B0711RQMNF","Amazon Basics Collapsible Fabric Storage Cubes Organizer with Handles, 10.5'x10.5'x11', Beige - Pack of 6","Amazon Basics","$19.68","","","","11/13/2017","$9.70","4.7","100,106","$9.98","134","6","AMZ","9","Our Brands","Standard","10.94 x 11.61 x 4.61 in","5.56 lb","https://www.amazon.com/dp/B0711RQMNF"
"closet basket","","B07SCJTJ42","StorageWorks Extra Large Storage Bins, Fabric Storage Bins for Shelves, Storage Baskets with Metal Frame, Closet Baskets and Bins with Handles, Beige, 2-Pack","StorageWorks","$23.19","9,448","363","$219,099","05/23/2019","$13.28","4.6","4,771","$9.91","1,194","6","FBA","1","Home & Kitchen","Standard","13.1 x 17.9 x 2 in","3.4 lb","https://www.amazon.com/dp/B07SCJTJ42"
"Average Monthly Sales: 1,686","","B07G5C36H1","GRANNY SAYS Linen Closet Organizers and Storage Baskets for Organizing Shirts, Decorative Shelves Bins Wardrobe Cabinet, Gray, 3-Pack","GRANNY SAYS","$24.99","1,506","43","$37,635","09/10/2018","$7.74","4.7","5,846","$17.25","21,280","6","FBA","2","Home & Kitchen","Oversize","11 x 8 x 19.75 in","3.56 lb","https://www.amazon.com/dp/B07G5C36H1"
"Average Revenue: $45,530","","B09B73QXGC","GRANNY SAYS Storage Baskets and Bins for Closet Shelves, Gray Handles, Organize Closet, 2-Pack","GRANNY SAYS","$19.99","2,371","77","$47,396","07/25/2021","$11.20","4.7","1,335","$8.79","10,821","6","FBA","1","Home & Kitchen","Standard","10.83 x 15.47 x 1.85 in","2.359 lb","https://www.amazon.com/dp/B09B73QXGC"
"Average Price: $28.71","","B07QB8NZJ1","DECOMOMO Storage Bins | Fabric Storage Baskets for Shelves for Organizing Closet Shelf Nursery Toy | Decorative Large Linen Closet Organizer Bins with Handles (Grey and White, Large - 3 Pack)","DECOMOMO","$25.99","3,236","30","$84,104","04/03/2019","$8.97","4.7","23,174","$17.02","31,552","7","FBA","1","Home & Kitchen","Oversize","11 x 9.5 x 15 in","2.88 lb","https://www.amazon.com/dp/B07QB8NZJ1"
"Average No. of Ratings: 5,522","","B0BQC3SRHC","Fordonral 4 Pack Linen Storage Bins, Storage Containers for Organizing Clothing, Jeans, Toys, Books, Shelves, Closet, Wardrobe - Closet Organizers and Storage, Large Storage Boxes Baskets with Window","Fordonral","$20.98","2,156","84","$45,233","12/15/2022","$9.90","4.7","222","$11.08","9,854","6","FBA","4","Home & Kitchen","Standard","10.63 x 6.69 x 15.75 in","1 lb","https://www.amazon.com/dp/B0BQC3SRHC"
"Average Sales Rank: 50,679","","B09MK7KMP8","StorageWorks Large Storage Baskets for Shelves, Rectangular Closet Organizers with Handles, Foldable Closet Storage Baskets for Utility Room, 3-Pack, Beige Stripes","StorageWorks","$25.99","5,588","162","$145,232","06/06/2021","$15.36","4.7","13,967","$10.63","4,146","6","FBA","1","Home & Kitchen","Standard","9.13 x 10.67 x 4.88 in","4.169 lb","https://www.amazon.com/dp/B09MK7KMP8"
"Average Rating Number: 4.6","","B0C49M439F","6 Pack Closet Storage Bins for Shelves, Shelf Baskets for Organization, Closet Organizers and Storage, Trapezoid Storage Bin Closet Shelf Organizer for Clothes,Toy,Towel,Book,Baby Clothing (6PC-Gray)","Fordonral","$29.99","585","22","$17,544","05/03/2023","$17.26","4.4","49","$12.73","41,972","7","FBA","2","Home & Kitchen","Standard","11.4 x 7.9 x 15 in","4.65 lb","https://www.amazon.com/dp/B0C49M439F"
"","","B098B4V9XJ","Fab totes Storage Bins [3-Pack], Foldable Storage Baskets for Organizing Toys, Books, Shelves, Closet, Large Storage Box with Rope Handles, Sturdy Organizer Bins, White & Grey","Fab totes","$21.99","4,419","92","$97,174","06/29/2021","$12.26","4.6","2,082","$9.73","8,734","6","FBA","1","Home & Kitchen","Standard","10.24 x 15.43 x 2.48 in","3.569 lb","https://www.amazon.com/dp/B098B4V9XJ"
"","","B0C7V8NT35","CubesLand Toys Closet Storage Organizer Baskets Bins for Cube Ogranizer/Shelving,Woven Basket for Organizing,Decor Basket for Living Room,Bedroom,Perfect for Pet Toy&Food Storage,2pack Brick Red","CubesLand","$19.99","1,450","39","$28,985","08/15/2023","","4.6","118","","3,315","6","FBA","1","Baby","","","","https://www.amazon.com/dp/B0C7V8NT35"
"","","B0BLP79YPW","NaturalCozy Storage Cubes 11 Inch Cotton Rope Woven Baskets for Organizing, 3-Pack | Cube Storage Bin | Square Storage Baskets for Shelves Organizer, Classroom, Kids Toy Bins, Closet, Baby Nursery","NaturalCozy","$37.99","2,970","99","$112,830","11/06/2022","","4.7","287","","1,367","2","FBA","1","Baby","","","","https://www.amazon.com/dp/B0BLP79YPW"
"","","B0C3RH1KNW","Bagnizer Storage Bins Large Fabric Storage Baskets for Shelves 3 Pack, Decorative Linen Closet Baskets with Handles for Organizing, Shelf, Clothes, Home, Office, 15x11x9.5Inches (Grey&White)","Bagnizer","$25.99","2,746","70","$71,369","05/06/2023","$8.97","4.5","175","$17.02","12,208","7","FBA","1","Home & Kitchen","Oversize","11 x 9.5 x 15 in","3.03 lb","https://www.amazon.com/dp/B0C3RH1KNW"
"","","B0BDRCDPS8","StorageWorks Closet Storage Bins with Clear Window and 2 Handles, Foldable Clothing Bins for Shelves, Large Fabric Organizer, Beige, 3 Pack","StorageWorks","$20.79","1,788","78","$37,173","09/08/2022","","4.7","410","","10,741","6","FBA","1","Home & Kitchen","","","","https://www.amazon.com/dp/B0BDRCDPS8"
"","","B07TTTCGJ6","Amazon Basics Rectangular Wire Storage Baskets, Set of 3, Standard, Black","Amazon Basics","$28.93","","","","02/25/2020","$12.99","4.7","2,047","$15.94","4,690","6","AMZ","7","Our Brands","Oversize","10.315 x 12.835 x 8.15 in","3.27 lb","https://www.amazon.com/dp/B07TTTCGJ6"
"","","B0CP4D8BRX","MINTWOOD Design 3-Pack Storage Baskets for Shelves, Decorative Baskets for Organizing, Woven Baskets for Storage, Book Basket Cube Storage Bin Box, Pantry Closet and Shoe Organizers, Sky Blue","MINTWOOD Design","$36.95","540","18","$19,953","01/25/2024","$18.67","","","$18.28","6,298","7","FBA","1","Baby","Oversize","10 x 10 x 15 in","4 lb","https://www.amazon.com/dp/B0CP4D8BRX"
"","","B09Y5NZ4YZ","CubesLand Woven Basket for Organizing/Storage,Cube Shelf Closet Storage Baskets Bins Set 3,Long-Lasting &Skin-Friendly Toy Storage Basket Bin,Stylish Room Decor Basket,Woven Cotton Rope Cute Basket","CubesLand","$31.99","1,341","46","$42,899","01/03/2023","$20.16","4.6","828","$11.83","19,651","6","FBA","1","Home & Kitchen","Standard","8.74 x 17.68 x 4.84 in","3.419 lb","https://www.amazon.com/dp/B09Y5NZ4YZ"
"","","B0B7VP5Q97","OIAHOMY Cotton Rope Baskets, Woven Baskets for Storage, Nursery Storage Baskets, Rectangle Storage Basket with Handles, Storage Baskets for Shelves, Pack of 3, Brown Variegated","OIAHOMY","$29.99","923","34","$27,681","07/27/2022","$18.76","4.5","182","$11.23","27,491","7","FBA","1","Home & Kitchen","Standard","9.06 x 5.51 x 12.99 in","2.72 lb","https://www.amazon.com/dp/B0B7VP5Q97"
"","","B097MPKV1L","Storage Bins Closet Organizers and Storage 3 Pack, Rustic Stackable Metal Wire Basket for Clothes Toys Snacks, Open Pantry Baskets for Countertop Cabinet Living Room Black, 11.5x11.5x21inch","Sonyabecca","$29.99","344","12","$10,317","06/20/2021","$9.33","4.5","279","$20.66","79,473","7","FBA","4","Home & Kitchen","Oversize","11.5 x 11.5 x 21 in","5.68 lb","https://www.amazon.com/dp/B097MPKV1L"
"","","B0C1Z2LRL8","efluky Storage Baskets for Organizing, Fabric Storage Bins with Bamboo Handles, Collapsible Storage Baskets for Shelves and Closet, Grey Set of 2","efluky","$24.99","993","29","$24,815","05/13/2023","$13.31","4.7","194","$11.68","32,488","6","FBA","1","Home & Kitchen","Standard","10.24 x 7.87 x 14.96 in","2.2 lb","https://www.amazon.com/dp/B0C1Z2LRL8"
"","","B0BZMFVLGK","Pack of 3 Large Capacity Storage Bins Closet Organizer System, Sturdy Foldable Storage Boxes for Organizing Clothing, Sheets, Toys, Books - Shelf Organizer Shelves Basket Storage Bin","Fordonral","$21.98","2,386","49","$52,444","04/29/2023","$5.56","4.4","166","$16.42","18,377","7","FBA","4","Home & Kitchen","Oversize","11 x 7.9 x 18.9 in","1 lb","https://www.amazon.com/dp/B0BZMFVLGK"
"","","B0CPPJJ4GS","CubesLand Clothes Closet Organizing Basket Bins,Cubes Storage Bins for Shelves Woven Baskets for Organizing,Decorative Storage Baskets for Toys,Towels 4 Packs 11x11'' Mixed Black","CubesLand","$41.99","488","16","$20,491","01/31/2024","","4.7","561","","57,789","6","FBA","1","Home & Kitchen","","","","https://www.amazon.com/dp/B0CPPJJ4GS"
"","","B0CG5XJHYP","Kriitools Cubes Woven Baskets Bins for Shelf Storage &Organizing,Cotton Rope Cube Bins for Toys, Decor Woven Storage Bins, Rectangular Storage Basket for Living Room, 2 Packs Apricot-pink","Kriitools","$25.99","1,159","33","$30,122","08/20/2023","","4.7","27","","28,028","7","FBA","1","Home & Kitchen","","","","https://www.amazon.com/dp/B0CG5XJHYP"
"","","B0C9PVJ5Z8","BIORM Bed Sheet Set Organizer 4 Pack, Foldable Storage Box for Queen/King Size Duvet Cover Set, Grey Linen Closet Organizer for Bed Sheets, Duvet Covers and Pillowcases","BIORM","$39.99","83","","$3,319","07/27/2023","$26.66","4.3","5","$13.33","745,132","7","FBA","2","Home & Kitchen","Standard","4.5 x 12.75 x 15 in","6.23 lb","https://www.amazon.com/dp/B0C9PVJ5Z8"
"","","B06XWNXQD5","StorageWorks Closet Storage Bins, Trapezoid Storage Box, Fabric Bins and Baskets, 3-Pack, Jumbo, Mixing of Beige, White & Ivory","StorageWorks","$30.99","2,689","99","$83,332","03/26/2017","$19.61","4.7","6,178","$11.38","8,003","6","FBA","3","Home & Kitchen","Standard","10.94 x 11.61 x 4.02 in","4.98 lb","https://www.amazon.com/dp/B06XWNXQD5"
"","","B0CD45XMBX","Linen Closet Organizers And Storage, 4 Pack Closet Storage Bins Linen Closet Baskets for Closet Organization Foldable Closet Organizer Bins with Clear Window For Organizing Clothing, Jeans, Shelves","Pradnel","$25.59","570","16","$14,586","07/28/2023","$15.32","4.2","80","$10.27","58,843","7","FBA","2","Home & Kitchen","Standard","8.46 x 4.72 x 10.98 in","2.25 lb","https://www.amazon.com/dp/B0CD45XMBX"
"","","B0BVM156HL","StorageWorks Storage Baskets for Shelves, Fabric Closet Storage Bins with Handles, Rectangle Basket Organizer, Beige, White & Ivory, 4-Pack","StorageWorks","$34.99","313","6","$10,952","03/29/2023","","4.7","79","","144,460","6","FBA","1","Home & Kitchen","","","","https://www.amazon.com/dp/B0BVM156HL"
"","","B0BZ7BJYNL","TheWarmHome Storage Bins for Shelves - 13.8L9.8W6.7H inch 3 Pack Medium Collapsible Storage Baskets for Organizing | Fabric Storage Cubes for Linen Closet Toy Home (White&Grey)","TheWarmHome","$26.99","5,487","330","$148,094","07/14/2023","","4.6","18,596","","1,398","7","FBA","1","Home & Kitchen","","","","https://www.amazon.com/dp/B0BZ7BJYNL"
"","","B0C33MJHL3","4 PCS Linen Storage Baskets with Metal Frame, Shelf Organizer Bins, Fabric Baskets Foldable Storage Bin, Closet Organizers and Storage, Storage Basket for Organizing Wardrobe, Shelves, Bedroom","","$25.99","300","10","$7,797","06/20/2023","","4.6","15","","87,705","","FBA","","Home & Kitchen","","","","https://www.amazon.com/dp/B0C33MJHL3"
"","","B0CM5FL5DS","4 Pack Large Storage Baskets for Shelves | Fabric Closet Organizers and Storage Bins with Handles for Home Organization | Decorative Collapsible Baskets for Organizing Clothes Toy Nursery(14'x10'x9.5'","Criusia","$24.99","1,010","26","$25,240","12/15/2023","$8.88","4.9","31","$16.11","35,631","7","FBA","1","Home & Kitchen","Oversize","10 x 9.5 x 14 in","2.43 lb","https://www.amazon.com/dp/B0CM5FL5DS"
"","","B0BW11TGH2","OrganiHaus Large Fabric Storage Baskets for Shelves 3 Pack | 15x11in Closet Storage Bins for Shelves | Cloth Baskets for Organizing | Linen Closet Organizers | Fabric Basket - Gray/White","OrganiHaus","$32.99","6,411","179","$211,499","05/24/2023","","4.7","810","","3,597","6","FBA","1","Home & Kitchen","","","","https://www.amazon.com/dp/B0BW11TGH2"
"","","B0C778J26T","SIXDOVE Storage Basket, Woven Basket for Toys and Towels, Soft Cotton Rope Rectangle Woven Basket for Storage, Pack of 3, Jute and White, 15''L x 10''W x 9''H","SIXDOVE","$34.99","320","10","$11,197","06/04/2023","$17.38","4.9","26","$17.61","88,448","7","FBA","1","Home & Kitchen","Oversize","10 x 9 x 15 in","4.42 lb","https://www.amazon.com/dp/B0C778J26T"
"","","B08Q7QRPFC","StorageWorks Decorative Storage Boxes, Storage Basket with Lid and Handles, Gray and White Stripes, Large, 2-Pack","StorageWorks","$30.99","2,324","76","$72,021","12/09/2020","$19.61","4.7","1,399","$11.38","11,142","6","FBA","1","Home & Kitchen","Standard","11.181 x 15.787 x 2.756 in","4.7 lb","https://www.amazon.com/dp/B08Q7QRPFC"
"","","B08R5BN6DH","Closet Organization And Storage Baskets (Set of 9) - Perfect Storage Baskets for Bathroom, Laundry, Baby Nursery Clothes, Linen Closet, Kitchen Pantry or Use As Baskets for Organizing (Dark Grey)","NEATERIZE","$38.96","1,921","44","$74,842","03/25/2021","$25.79","4.8","2,252","$13.17","20,594","7","FBA","1","Home & Kitchen","Standard","13.15 x 15.35 x 4.8 in","4.61 lb","https://www.amazon.com/dp/B08R5BN6DH"
"","","B071225BBS","Amazon Basics Collapsible Fabric Storage Cubes Organizer with Handles, 10.5'x10.5'x11', Pack of 6, Gray","Amazon Basics","$18.90","","","","11/13/2017","$9.04","4.7","100,106","$9.86","134","6","AMZ","5","Our Brands","Standard","11.024 x 11.772 x 4.449 in","5.468 lb","https://www.amazon.com/dp/B071225BBS"
"","","B0C1ZGHSLS","Goodpick Woven Storage Basket for Shelves, Cotton Rope Dog Toy Bin, Empty Gift Basket with Handles, Square Baskets for Storage Shelves, Brown and White Storage Bin, 13.5 x 11 x 9.5 Inches","Goodpick","$12.99","950","39","$12,341","06/08/2023","","4.5","137","","3,282","7","FBA","1","Baby","","","","https://www.amazon.com/dp/B0C1ZGHSLS"
"","","B0B5DD4DNM","LoforHoney Home Collapsible Storage Bins with Metal Frames, Fabric Storage Baskets for Clothing, Shelf Baskets for Organizing, Closet Storage Bins for Organization, Large, Beige & Brown, 2-Pack","LoforHoney Home","$21.99","677","14","$14,887","06/28/2022","$15.15","4.6","376","$6.84","64,323","6","FBA","1","Home & Kitchen","Standard","9.4 x 7.6 x 13.7 in","0.634 oz","https://www.amazon.com/dp/B0B5DD4DNM"
"","","B0BLP3FQ2P","NaturalCozy Storage Cubes 11 Inch Cotton Rope Woven Baskets for Organizing 3-Pack | Cube Storage Bin, Square Storage Baskets for Shelves Organizer, Classroom Kids Toy Bins, Closet, Baby Nursery","NaturalCozy","$35.99","2,095","99","$75,399","11/06/2022","$21.65","4.7","287","$14.34","1,367","7","FBA","1","Baby","Oversize","11 x 11 x 11 in","7.5 oz","https://www.amazon.com/dp/B0BLP3FQ2P"
"","","B07G57FDFK","GRANNY SAYS Clothing Storage Bins for Closet with Handles, Foldable Rectangle Baskets, Fabric Containers Boxes for Organizing Shelves Bedroom, Gray, Large, 3-Pack","GRANNY SAYS","$19.99","1,781","50","$35,602","08/02/2018","$5.01","4.7","8,407","$14.98","17,776","6","FBA","2","Home & Kitchen","Oversize","10.04 x 8.46 x 14.37 in","2.88 lb","https://www.amazon.com/dp/B07G57FDFK"
"","","B098JSSRRD","DIMJ Trapezoid Storage Bins, Closet Storage Bins with Handle, Foldable Storage Bins for Closet, Closet Organizers and Storage Baskets for Toys, Books, Clothes, 6 Packs (Blended)","DIMJ","$27.99","510","21","$14,275","07/02/2021","$17.06","4.7","772","$10.93","44,149","6","FBA","1","Home & Kitchen","Standard","11.85 x 12.76 x 3.27 in","4.409 lb","https://www.amazon.com/dp/B098JSSRRD"
"","","B09Y3B4Y7H","KITCSTI Storage Basket for Organizing Fabric Storage Bins 16'x12'x10' Foldable Organizer Bins with Handle Large Storage Basket for Shelves Closet Toys Books (White & Grey, Pack of 3)","KITCSTI","$29.99","547","16","$16,405","04/16/2022","$19.06","4.7","876","$10.93","57,215","6","FBA","1","Home & Kitchen","Standard","10 x 2.5 x 16 in","3.4 lb","https://www.amazon.com/dp/B09Y3B4Y7H"
"","","B08Y8HB36D","HNZIGE Fabric Storage Baskets for Shelves(3 Pack) Large Collapsible Storage Baskets for Organizing, Decorative Baskets Bins Set with Handles for Closet, Clothes, Toy(White&Gray,15' x 11' x 9.5')","HNZIGE","$27.99","507","15","$14,191","03/07/2021","$10.67","4.5","3,850","$17.32","7,363","7","FBA","1","Baby","Oversize","11 x 9.5 x 15 in","2 lb","https://www.amazon.com/dp/B08Y8HB36D"
"","","B0CHB26MR1","PUPPYCUTE Stackable Wire Storage Baskets for Kitchen Closet Pantry, Hanging Closet Organizers Storage Shelves Organization, Wall Mount Metal Basket Bins, Clothing Vegetable & Fruit Organizer 3 pcs","PUPPYCUTE","$34.99","393","13","$13,751","09/04/2023","$18.14","4.6","37","$16.85","21,395","7","FBA","1","Kitchen & Dining","Oversize","9 x 9.1 x 12.8 in","7.02 lb","https://www.amazon.com/dp/B0CHB26MR1"
"","","B0BR7PT9D5","homsorout Trapezoid Storage Bins, 6 Pack Closet Storage Bins, Fabric Shelf Organizer Bins, Closet Organziers and Storage Bins with Handles, Storage Boxes for Clothes, Toys, DVDs, Grey","homsorout","$39.99","1,580","44","$63,184","12/27/2022","","4.6","342","","20,445","6","FBA","1","Home & Kitchen","","","","https://www.amazon.com/dp/B0BR7PT9D5"
"","","B095WTYQ8H","TENABORT 6 Pack Trapezoid Large Foldable Closet Storage Bins with Handle, Fabric Storage Organizer Cube Colth Containers Linen Box Shelf Baskets for Clothes Clothing Shelves Wardrobe","TENABORT","$47.99","122","3","$5,855","05/25/2021","$28.81","4.7","125","$19.18","264,378","7","FBA","1","Home & Kitchen","Oversize","11.4 x 5.1 x 19.9 in","7.68 lb","https://www.amazon.com/dp/B095WTYQ8H"
"","","B0CHVSML72","Uiifan 10 Pcs Collapsible Storage Bins Fabric Foldable Storage Basket with Handles Cloth Basket Organizer Linen Shelf Baskets for Shelves Home Closet Nursery Toys (Beige and White,16 x 12 x 10 Inch)","Uiifan","$54.99","143","7","$7,864","09/11/2023","$32.86","5","3","$22.13","119,472","7","FBA","1","Home & Kitchen","Oversize","12 x 10 x 16 in","7.7 lb","https://www.amazon.com/dp/B0CHVSML72"
"","","B0C8JTJXNG","AARAINBOW 4 Pcs Closet Clothes Organizer with Handle, Fabric Storage Box with Steel Frame Stackable Shelf Storage Baskets Foldable Wardrobe Organizer Baskets for Clothes Toys, 23L (4 Beige)","AARAINBOW","$26.79","822","23","$22,021","06/18/2023","$10.41","4.1","20","$16.38","40,411","6","FBA","3","Home & Kitchen","Oversize","10.6 x 8.3 x 15.7 in","2.6 lb","https://www.amazon.com/dp/B0C8JTJXNG"
"","","B0CFQCLLZY","Huolewa Closet Storage Bins, 6 Pack Trapezoid Storage Bins, Linen Closet Organizers and Storage, Foldable Closet Baskets for Shelves with Handles, Fabric Storage Boxes for Clothes, Toys, Dvds, Grey","Huolewa","$39.99","242","5","$9,678","12/05/2023","","4.8","25","","157,533","7","FBA","1","Home & Kitchen","","","","https://www.amazon.com/dp/B0CFQCLLZY"
"","","B08QD8MMMP","DIMJ Closet Storage Bins, Fabric Closet Organizer, Trapezoid Storage Bin, Foldable Closet Organizers and Storage for Clothes Toys Towel Books. (Light Grey)","DIMJ","$19.19","594","19","$11,399","12/10/2020","$7.78","4.7","3,545","$11.41","50,297","7","FBA","1","Home & Kitchen","Standard","11.02 x 7.87 x 16.54 in","3.1 lb","https://www.amazon.com/dp/B08QD8MMMP"
"","","B093BWWY4K","MaxGear Organization and Storage 3 Packs, Plastic Storage Bins Organizer Bins, Woven Baskets for Storage, Plastic Baskets with Handles Storage Baskets for Organizing, Basket Organizer for Home, Large","MaxGear","$26.99","2,475","93","$66,800","03/22/2021","$15.91","4.7","392","$11.08","8,694","7","FBA","5","Home & Kitchen","Standard","11.5 x 5.2 x 13.8 in","2.85 lb","https://www.amazon.com/dp/B093BWWY4K"
"","","B09DQ6X1S7","Lifewit Collapsible Storage Cubes 11 Inch Foldable Fabric Bins Multi-color Organizers Decorative Organizing Baskets for Shelves for Closet, Utility Room, Storage Room Set of 6 Grey","Lifewit","$19.99","2,726","96","$54,493","08/25/2021","$10.56","4.7","6,158","$9.43","8,281","6","FBA","3","Home & Kitchen","Standard","11.46 x 12.09 x 3.86 in","3.88 lb","https://www.amazon.com/dp/B09DQ6X1S7"
"","","B0BQYJS8CT","GRANNY SAYS Fabric Storage Boxes, Large Storage Bins with Lids, Storage Organizer, Closet Storage Baskets for Shelves Organizing Bookcase Entryway Wardrobe, White/Gray, 2-Pack","GRANNY SAYS","$21.99","1,043","29","$22,936","12/22/2022","","4.6","951","","32,125","6","FBA","1","Home & Kitchen","","","","https://www.amazon.com/dp/B0BQYJS8CT"
"","","B0C4QCK5CJ","Storage Basket for Organizing | 15'x11'x9.5' Large Woven Baskets for Storage| Cotton Rope Storage Basket for Books | Baby Organizing Baskets | Cotton Rope Baskets for Storage |Toy Storage Basket","ICERZCZ","$34.95","1,196","22","$41,800","05/08/2023","","4.5","80","","5,279","6","FBA","3","Baby","","","","https://www.amazon.com/dp/B0C4QCK5CJ"
"","","B0CHVKCWS7","4 Pack Folding Closet Organizers Storage Box, Stackable Plastic Storage Basket, Closet Organizers and Storage Drawer Shelf Storage, Storage Container for Cupboard Kitchen Bathroom Bedroom (4L) White","caktraie","$24.99","2,640","88","$65,974","09/11/2023","$9.26","4.8","44","$15.73","9,206","6","FBA","1","Home & Kitchen","Standard","5 x 5 x 5 in","6.58 lb","https://www.amazon.com/dp/B0CHVKCWS7"
"","","B0BZCWPPD6","StorageTastic Storage Bin,Collapsible Storage Basket For Organizing,Large Storage Boxes With Rope Handles,Storage Containers,Clothes Organizer,Gradient Grey,Pack of 3","StorageTastic","$17.99","1,779","51","$32,004","03/22/2023","$2.55","4.4","427","$15.44","17,425","7","FBA","3","Home & Kitchen","Oversize","10 x 9.5 x 15 in","1 lb","https://www.amazon.com/dp/B0BZCWPPD6"
"","","B0C776VQDL","Storage Baskets for Shelves, Storage Bins for Shelf, Canvas Cloth Storage Bins, Organizer Baskets with Metal Frame, Large Closet Baskets with Handles, Foldable (White 4 Pack, 16'L12'W10'H)","EEONDPU","$42.99","440","21","$18,916","06/05/2023","$22.28","4.9","59","$20.71","43,711","6","FBA","1","Home & Kitchen","Oversize","12 x 10 x 16.5 in","3.19 lb","https://www.amazon.com/dp/B0C776VQDL"
"","","B08HRTVHJ5","KEEGH Storage Bins for Closet Shelves Storage Baskets for Shelves Trapezoid Storage Bin Fabric Organizer Bins for Clothes with Handles,Beige,Set of 3","KEEGH","$29.99","181","8","$5,428","09/09/2020","$18.46","4.7","622","$11.53","111,512","6","FBA","1","Home & Kitchen","Standard","10.906 x 12.441 x 4.528 in","5.42 lb","https://www.amazon.com/dp/B08HRTVHJ5"
"","","B0CQ7XYR91","xianshengle Fabric Storage Basket for Shelves, Collapsible Storage Bins with wood Handles, Rectangle Closet Baskets, Wardrobe Organiser, for Sorting Clothes, Family Items (Black)","xianshengle","$15.99","150","5","$2,399","12/13/2023","$8.45","5","1","$7.54","177,427","7","FBA","1","Home & Kitchen","Standard","8 x 2.2 x 12 in","1.12 lb","https://www.amazon.com/dp/B0CQ7XYR91"
"","","B09Y5NX24G","CubesLand Cube Shelf Closet Storage Baskets Bins Set 3,Woven Basket for Organizing/Storage,Long-Lasting &Skin-Friendly Toy Storage Basket Bin,Stylish Room Decor Basket,Off White Cotton Rope Basket","CubesLand","$31.99","1,287","46","$41,171","04/17/2022","$20.16","4.6","828","$11.83","19,651","6","FBA","3","Home & Kitchen","Standard","8.819 x 17.953 x 5 in","3.86 lb","https://www.amazon.com/dp/B09Y5NX24G"