"Export time:  2/4/2024, 11:42:25 PM","","ASIN","Product Name","Brand","Price","Monthly Units Sold","Daily Units Sold","Monthly Revenue","Date First Available","Net Revenue","Star Rating","Reviews","Amazon Fees","BSR","LQS","Seller Type","Sellers","Category","Product Tier","Dimensions","Weight","Link"
"","","B09W42G796","Forzacx Floating Shoe Display Set of 5, Sturdy Levitating Acrylic Shelf , Easy to Install Sneaker Shelves Storage, for Bedroom, Hallways etc - Display Your Top Shoes Maximize Wall Space","Forzacx","$28.99","298","7","$8,639","03/21/2022","$19.50","4.6","202","$9.49","125,349","7","FBA","1","Home & Kitchen","Standard","3.82 x 9.69 x 2.91 in","1.57 lb","https://www.amazon.com/dp/B09W42G796"
"wall mount shoe rack","","B0BX91V3NX","RONGJIA 5-Tier Natural Bamboo Shoe Rack - Stackable Storage Shelf with Multi-Function Combinations - Free Standing Shoe Racks for Convenient Shoe OrganizationNatural 11' D x 27' W x 35' H","RONGJIA","$41.99","4,325","193","$181,607","03/01/2023","","4.3","1,266","","3,227","6","FBA","1","Home & Kitchen","","","","https://www.amazon.com/dp/B0BX91V3NX"
"Average Monthly Sales: 1,695","","B09BBCT5Y1","RahTune Shoe Shelves, Floating Sneaker Display, Acrylic Wall Shoe Rack, Show Shelf, Shoe Organizer Holder Wall Mount for Sneaker Collection, Shoe Box","RahTune","$18.99","65","1","$1,234","07/26/2021","$11.00","4.1","241","$7.99","562,761","7","FBA","1","Home & Kitchen","Standard","8.23 x 9.88 x 2.72 in","1.479 lb","https://www.amazon.com/dp/B09BBCT5Y1"
"Average Revenue: $37,458","","B0CJ2HSM8W","ZEW Rattan Bamboo Stackable 3-Tier Shoe Rack Organizer Free Stand Self Storage for Closet Entryway Hallway Bathroom","Statra","$39.44","","","$0.00","09/13/2023","","4.5","2","","1,583,568","6","AMZ","1","Home & Kitchen","","","","https://www.amazon.com/dp/B0CJ2HSM8W"
"Average Price: $36.44","","B0CHNR7GRS","PrimZooty Wall Mounted Shoe Rack 6Pack, with Sticky Hanging Strips, Metal Wall Shoe Storage, Hanging Shoe Organizer for Wall/RV/Door","PrimZooty","$24.99","360","12","$8,996","10/07/2023","","4.4","14","","75,495","6","FBA","1","Home & Kitchen","","","","https://www.amazon.com/dp/B0CHNR7GRS"
"Average No. of Ratings: 1,198","","B0B93R8PX7","DEYILIAN Wall Shoe Rack for RV Shoe Storage, 3 Pack Wall Mounted Shoe Rack with Sticky Hanging Mounts for Camper, Small Space Door Shoe Holder for Wall Shoe Organization Shelf No Drilling","DEYILIAN","$25.99","634","19","$16,478","08/07/2022","","4","297","","48,782","7","FBA","1","Home & Kitchen","","","","https://www.amazon.com/dp/B0B93R8PX7"
"Average Sales Rank: 303,620","","B08RP7ZWFS","Yocice Wall Mounted Shoes Rack 6Pack with Sticky Hanging Strips, Plastic Shoes Holder Storage Organizer,Door Shoe Hangers (SM03-White-6)","Yocice","$25.99","640","24","$16,634","12/29/2020","$16.95","4.4","1,241","$9.04","39,196","6","FBA","1","Home & Kitchen","Standard","8.661 x 10.079 x 2.953 in","1.521 lb","https://www.amazon.com/dp/B08RP7ZWFS"
"Average Rating Number: 4.4","","B0CJDSDR2T","Wall Mounted Shoe Rack w/ Removable Labels & Marker- Sturdy Mounted Shoe Storage- Adults/Kids Wall Shoe Rack for Wall Mount Shoe Storage- RV/Space Saver Wall Mount Shoe Rack- Shoe Rack Wall Mount","Fearlessly Simple","$18.98","148","8","$2,809","09/19/2023","","4.7","21","","115,421","7","FBA","1","Home & Kitchen","","","","https://www.amazon.com/dp/B0CJDSDR2T"
"","","B0CK59GY3N","SINKHANUN Boot Rack Shoe Organizer - Stainless Steel Boot Organizer Boots Stand for Tall Boots, Rain Boot for Outdoor, Entryway, Closet Floor","SINKHANUN","$29.99","346","18","$10,377","09/28/2023","$5.91","4.3","11","$24.08","52,470","6","FBA","1","Home & Kitchen","Oversize","23.5 x 17.9 x 9.5 in","4.38 lb","https://www.amazon.com/dp/B0CK59GY3N"
"","","B09L4P7VSM","Garden 4 you 4-Tiers Shoe Storage Freestanding Organizer Modern 25.2 in Tilting Adjustable Shoe Rack for High Heels, Entryways, Hallways, Closets, Dormitory Rooms, Industrial, Brown","Garden 4 you","$44.99","1,458","38","$65,595","11/04/2021","$27.02","4.6","1,117","$17.97","23,928","6","FBA","1","Home & Kitchen","Oversize","13 x 2.5 x 28 in","7 lb","https://www.amazon.com/dp/B09L4P7VSM"
"","","B0B3DBYLH9","pickpiff Free Standing Shoe Racks - Black Metal Boot Rack, Shoe Organizer for Dorm Room, Closet, Entryway, Bedroom, Patio Outdoor, Hallway, Black Shoe Rack Organizer, Shoe Storage Fit for 4 Pairs","pickpiff","$24.99","2,602","87","$65,024","06/06/2022","$15.45","4.1","604","$9.54","9,457","7","FBA","1","Home & Kitchen","Standard","13.5 x 17.17 x 1.46 in","2.56 lb","https://www.amazon.com/dp/B0B3DBYLH9"
"","","B09BP3BJXQ","Whitmor 36 Pair Door Shoe Organizer, White","Whitmor","$38.67","6,430","148","$248,648","08/01/2021","$15.57","4.4","2,720","$23.10","4,702","5","AMZ","11","Home & Kitchen","Oversize","9.5 x 9 x 24 in","22.8 lb","https://www.amazon.com/dp/B09BP3BJXQ"
"","","B0BHVBXQTH","Wall Mounted Shoe Rack - Wooden Entryway Shoe Rack - Hallway Stylish Shoe Rack Wall Mounted - Minimal Design Narrow Shoe Rack for entryway to Keep Any Shoes Off The Floor (Pine, 30 in. Wide)","PeachyModern","$47.99","168","6","$8,062","10/10/2022","","4.3","65","","144,867","6","FBA","1","Home & Kitchen","","","","https://www.amazon.com/dp/B0BHVBXQTH"
"","","B076463FV6","MyGift Wall Mounted Black Metal Shoe Organizer Rack, Boots, Slippers, Sneakers Hanging Vertical Heavy Duty Rack, Holds 18 Pairs of Shoes","MyGift","$109.99","75","2","$8,249","10/02/2017","$77.71","4.4","392","$32.28","376,964","6","FBA","1","Home & Kitchen","Oversize","28.1 x 3.1 x 29.3 in","11.7 lb","https://www.amazon.com/dp/B076463FV6"
"","","B0CFFF3BKD","aboxoo Hall Tree with Storage Bench, Coat Rack, 2-Tier Shelves, Fabric Storage Basket, 10 Hooks, Industrial 5 in 1 Large Organizer, Wood Look Accent Furniture-Sturdy Metal Frame (Rustic Brown)","aboxoo","$75.99","53","1","$4,027","08/10/2023","$-38.95","4.2","6","$114.94","470,711","7","FBA","1","Home & Kitchen","Oversize","71.5 x 12 x 33 in","29.1 lb","https://www.amazon.com/dp/B0CFFF3BKD"
"","","B0CKMZ1RXZ","Bamworld Coat Rack Bench Hall Tree Shoe Bench Bamboo Entryway Bench with Storage 3 in 1 Design with 5 Removable Hooks 32.8 x 13.3 x 65.5 Inches","Bamworld","$89.99","60","2","$5,399","12/23/2023","","5","1","","410,610","","FBA","1","Home & Kitchen","","","","https://www.amazon.com/dp/B0CKMZ1RXZ"
"","","B0CN67QZ51","Mifoci 2 Pcs Wall Mounted Shoe Rack Wooden Shoe Rack Organizer Wall Shoe Holder Modern Compact Wood Rv Shoe Storage for Sneaker Kid Footwear Slipper Boots Entryway Narrow Spaces Hallway (9.84'' Long)","Mifoci","$29.99","60","2","$1,799","11/12/2023","","5","1","","305,222","7","FBA","1","Home & Kitchen","","","","https://www.amazon.com/dp/B0CN67QZ51"
"","","B09FM4S97K","MyGift Set of 2 Solid Wooden Wall Mounted Shoe Rack Storage Organizer with Rustic Burnt Wood Finish, Hanging Footwear Holder for Closet, Mudroom, Entryway, Holds 4 Pairs","MyGift","$37.99","85","2","$3,229","09/06/2021","$22.59","4.2","31","$15.40","384,052","7","FBA","1","Home & Kitchen","Oversize","3.54 x 3.14 x 20.47 in","2.31 lb","https://www.amazon.com/dp/B09FM4S97K"
"","","B07Z9M7KLB","MyGift Premium Black Metal Hanging Wall Shoe Rack for Walk in Closet, Mudroom and Entryway, Wall Mounted Space Saving Boot and Shoe Rack Organizer, Holds 9 Pairs","MyGift","$69.99","70","2","$4,899","10/17/2019","$46.75","4.3","191","$23.24","306,098","6","FBA","1","Home & Kitchen","Oversize","13.77 x 29.52 x 3.54 in","7.721 lb","https://www.amazon.com/dp/B07Z9M7KLB"
"","","B0CLSCMNZD","Nirxxiy 6 Pack Adjustable Wall Mounted Shoes Rack, Plastic Shoes Holder Storage Organizer,RV Storage,Door Shoe Hangers,Hanging Shoe Organizer(White-6-Screw-stickers)","Nirxxiy","$24.99","118","4","$2,949","07/30/2022","","4.7","24","","188,439","6","FBA","1","Home & Kitchen","","","","https://www.amazon.com/dp/B0CLSCMNZD"
"","","B0C3R76MWB","ROMGUAR CRAFT 3 Tier Bamboo Shoe Rack for Closet Free Standing Wood Shoe Shelf Storage Organizer for Entryway Small Space Stackable 27'x11'x20' (Natural)","ROMGUAR CRAFT","$20.36","5,820","243","$118,495","04/26/2023","","4.4","1,869","","2,285","7","FBA","1","Home & Kitchen","","","","https://www.amazon.com/dp/B0C3R76MWB"
"","","B0B62K55RV","Z&L HOUSE 2-Tier Shoe Rack for Closet, Stackable Shoes Rack Organizer Free Standing Shoe Shelf for Entryway and Closet Hallway, Multifunctional Bamboo Rack in Different Combinations (2-Tier)","Z&L HOUSE","$18.99","7,445","285","$141,381","07/07/2022","","4.3","2,205","","1,780","7","FBA","4","Home & Kitchen","","","","https://www.amazon.com/dp/B0B62K55RV"
"","","B07M8DSJP4","mDesign Modern Metal Shoe Organizer Display & Storage Shelf Rack - Hang & Store Kicks, Running, Basketball, Trainers, Tennis Shoes - 2 Tier, Hold 4 Shoes on Each Wall Mount Unit, 2 Pack, Graphite Gray","mDesign","$18.99","30","1","$569.70","02/01/2019","$8.21","4.3","134","$10.78","471,591","7","FBA","1","Home & Kitchen","Standard","4.91 x 13.3 x 17.84 in","1.85 lb","https://www.amazon.com/dp/B07M8DSJP4"
"","","B0CJ2JMF92","ZEW Rattan Bamboo Stackable 4-Tier Shoe Rack Organizer Free Stand Self Storage for Closet Entryway Hallway Bathroom","Statra","$63.90","","","$0.00","09/13/2023","","5","1","","3,827,815","6","AMZ","1","Home & Kitchen","","","","https://www.amazon.com/dp/B0CJ2JMF92"
"","","B0C9R4TMKQ","HOMICKER Shoe Rack,10 Tier Shoe Organizer Large Shoe Storage with Hooks,Fit 40-50 Pairs Shoes,Mental Tall Shoe Shelf for Closet,Entryway,Garage,Bedroom","HOMICKER","$37.99","600","20","$22,794","","","4.5","53","","47,885","","FBA","","Home & Kitchen","","","","https://www.amazon.com/dp/B0C9R4TMKQ"
"","","B01D0JJZQC","MyGift Black Metal Shoe Organizer for Entryway, Wall Mounted Shoe Rack for Closet with 36 Hooks, Holds up to 18 Pair","MyGift","$84.99","70","","$5,949","03/14/2016","$57.22","4.4","199","$27.77","773,338","6","FBA","1","Home & Kitchen","Oversize","25.1 x 28.7 x 3.2 in","12.8 lb","https://www.amazon.com/dp/B01D0JJZQC"
"","","B09XTYSVCB","Yocice Wall Mounted Hanging Organizer 2Pack,Shoes Rack/Can Store 6Pairs of Plus-Size Sneakers,Also Stores Boots.with Sticky Hanging Mounts, Shoes Holder,Door Shoe Hangers (SM08-Black-2)","Yocice","$20.99","158","7","$3,316","04/12/2022","$-5.54","4.2","112","$26.53","128,943","6","FBA","1","Home & Kitchen","Oversize","13.39 x 30.71 x 13 in","1.2 lb","https://www.amazon.com/dp/B09XTYSVCB"
"","","B096BKRMDN","mDesign Modern Metal Shoe Display & Storage Rack - Perfect for Sneaker Heads - Store Your Collection of Kicks - 4 Tier, Wall Mount - Black","mDesign","$30.99","45","2","$1,395","05/31/2021","$18.41","4.5","498","$12.58","385,512","7","FBA","1","Home & Kitchen","Standard","5.35 x 12.95 x 17.44 in","3.02 lb","https://www.amazon.com/dp/B096BKRMDN"
"","","B0CM8XJG7T","MUOU 6 Tier Shoe rack Hanging Shoe Storage the door shoe rack for Closet Pantry Over The Door Shoe Organizer Wall Floating Shelves (Black, 6 Tier)","MUOU","$29.99","420","14","$12,596","10/31/2023","","3.9","24","","68,528","7","FBA","1","Home & Kitchen","","","","https://www.amazon.com/dp/B0CM8XJG7T"
"","","B0CG5XQJB3","THKKY 10 Tier Shoe rack Over The Door Shoe Organizer Hanging Shoe Storage the door shoe rack for Closet Pantry Wall Floating Shelves (10 Tier, Matte Black)","THKKY","$43.99","355","7","$15,616","07/19/2023","","4.7","49","","129,444","7","FBA","2","Home & Kitchen","","","","https://www.amazon.com/dp/B0CG5XQJB3"
"","","B0CBW5L7M8","MyGift Set of 4 Rustic Burnt Solid Wood Hanging Shoe Storage Organizer Racks, Wall Mounted Space Saving Footwear Holder for Closet, Mudroom, Entryway, Holds 8 Pairs","MyGift","$57.99","30","1","$1,740","07/13/2023","","5","2","","438,177","6","FBA","1","Home & Kitchen","","","","https://www.amazon.com/dp/B0CBW5L7M8"
"","","B0C3R6DYP7","ciecie 10 Tier Shoe Rack for Closet and Entryway Storage - Space Saving Organizer for 20-24 Pairs of Shoes and Boots With Anti-Tip Anchors Kit","ciecie","$19.99","3,045","49","$60,870","04/26/2023","","4.5","319","","18,317","7","FBA","1","Home & Kitchen","","","","https://www.amazon.com/dp/B0C3R6DYP7"
"","","B0CG941978","Ziliny 6 Pieces Wall Mounted Shoe Rack with Sticky Hanging Mounts Hanging Wall Shoe Rack Shoe Storage Shoe Holder Shoe Wall Organizer Wall Shoe Shelf Shoe Hanger for Closet Door (15.7 x 8.7 x 4.3'')","Ziliny","$37.99","110","2","$4,179","10/16/2023","$25.56","3.6","5","$12.43","358,625","7","FBA","1","Home & Kitchen","Standard","8.66 x 4.33 x 15.74 in","3.05 lb","https://www.amazon.com/dp/B0CG941978"
"","","B09SWL2VXG","MAGINELS 6 Tier Shoe Rack Organizer with Cover, Slim Shoe Storage Cabinet, Behind The Door, Narrow Shoe Shelf for Closet, entryway, Black","MAGINELS","$44.99","426","11","$19,166","02/18/2022","$29.41","3.7","990","$15.58","81,358","6","FBA","4","Home & Kitchen","Standard","13.11 x 17.95 x 4.92 in","11.109 lb","https://www.amazon.com/dp/B09SWL2VXG"
"","","B0CFDKD3XB","Therwen 4 Pieces Boot Rack Wader Hangers Wall Mount Boot Organizer Hanging Metal Tall Boot Holder for Cowboy Garage Boot Storage Closet Entryway Outdoor Drying (Black,24.2 x 9.7 x 2.3 Inch)","Therwen","$55.99","85","3","$4,759","08/10/2023","","3.1","4","","279,083","7","FBA","1","Home & Kitchen","","","","https://www.amazon.com/dp/B0CFDKD3XB"
"","","B089WJH8G7","Gorilla Grip Slip Resistant Breathable Space Saving Mesh Large 24 Pocket Shoe Organizer, Up to 40 Pounds, Over the Door, Sturdy Closet Storage Rack Hangs on Closets for Shoes, Sneakers, Black","Gorilla Grip","$11.99","31,353","1,112","$375,922","06/09/2020","$6.72","4.5","25,590","$5.27","137","7","FBA","1","Home & Kitchen","Standard","7.323 x 11.299 x 1.929 in","0.617 lb","https://www.amazon.com/dp/B089WJH8G7"
"","","B09N96GT39","MISSLO 28 Large Pockets Hanging Shoe Rack Door Shoe Organizer Hanging Shoe Storage Hanger for Closet Mesh Holder, Grey","MISSLO","$12.99","1,219","37","$15,835","01/13/2022","$7.27","4.7","4,015","$5.72","24,945","6","FBA","2","Home & Kitchen","Standard","9.92 x 12.48 x 2.13 in","0.659 lb","https://www.amazon.com/dp/B09N96GT39"
"","","B001F51ACQ","Honey-Can-Do 18 Pair OTD Shoe Rack SHO-01169 White, 30 lbs","Honey-Can-Do","$18.99","30","1","$569.70","09/22/2008","$6.06","4.2","678","$12.93","630,489","5","AMZ","2","Home & Kitchen","Oversize","7.2 x 2.2 x 23.9 in","3.65 lb","https://www.amazon.com/dp/B001F51ACQ"
"","","B08RP4VF7Q","Yocice Wall Mounted Shoes Rack 2Pack with Sticky Hanging Strips, Plastic Shoes Holder Storage Organizer,Door Shoe Hangers (SM03-Black-2)","Yocice","$12.99","308","11","$4,001","12/29/2020","$7.27","4.4","632","$5.72","81,484","6","FBA","1","Home & Kitchen","Standard","4.17 x 2.75 x 10.25 in","0.549 lb","https://www.amazon.com/dp/B08RP4VF7Q"
"","","B099YS7D6K","Lavezee Wall Mounted Shoe Rack Organizer 8 Pairs Sandals Slippers, Set of 2 Black Metal Shoe Storage Holder for Wall, Entryway, Bathroom","Lavezee","$20.99","77","3","$1,616","07/20/2021","$11.17","4.2","210","$9.82","230,827","6","FBA","1","Home & Kitchen","Standard","6.5 x 4.5 x 17.3 in","2.57 lb","https://www.amazon.com/dp/B099YS7D6K"
"","","B0B866SF9J","Nirxxiy Adjustable Wall Mounted Shoes Rack, Plastic Shoes Holder Storage Organizer,RV Storage,Door Shoe Hangers 4Pack with Sticky Hanging Strips (Black-4)","Nirxxiy","$18.99","174","7","$3,304","07/30/2022","","4.2","102","","121,265","6","FBA","1","Home & Kitchen","","","","https://www.amazon.com/dp/B0B866SF9J"
"","","B0BS1W1L2H","Maplefield Wader Hangers - 4 Pair Hanging Boot Rack - Great for Work Boots, Cowboy Boots, and Waders - Garage Shoe Storage - Shoe Organizer for Entryway (Stainless Steel)","Maplefield","$24.99","60","2","$1,499","06/05/2023","","4.4","32","","305,513","7","FBA","1","Home & Kitchen","","","","https://www.amazon.com/dp/B0BS1W1L2H"
"","","B0BCQ9BWKZ","FKUO 3 Tier Shoe rack for closet Mesh fabric narrow Metal shoe racks, Small Shoe Storage Organizer Shelf for Entryway, Hallway, Dorm Room (Black, 3 Tier)","FKUO","$23.99","683","15","$16,385","08/31/2022","","4.2","213","","63,463","6","FBA","1","Home & Kitchen","","","","https://www.amazon.com/dp/B0BCQ9BWKZ"
"","","B07CZY2CCP","Laugh Cat 4 Pack Hanging Plastic Shoe Rack Wall Mount Creative Folding Organizer Camper Shoes Storage Shelf Adhesive Shoe Holder For Door","Laugh Cat","$19.99","60","2","$1,199","05/10/2018","","3.5","478","","414,116","6","FBA","1","Home & Kitchen","","","1.102 lb","https://www.amazon.com/dp/B07CZY2CCP"
"","","B08NYPH215","Yocice Wall Mounted Shoes Rack 2Pack/Can Store 6Pairs of Sneakers,with Sticky Hanging Mounts, Shoes Holder Storage Organizer Shelf,Door Shoe Hangers (SM06-Gray-2)","Yocice","$14.99","210","7","$3,148","12/19/2020","$9.20","4.5","646","$5.79","133,454","6","FBA","1","Home & Kitchen","Standard","9.37 x 1.14 x 13.78 in","0.035 oz","https://www.amazon.com/dp/B08NYPH215"
"","","B09H2FTXBS","SONGMICS Shoe Rack, 10 Tier Shoe Shelf, Shoe Storage Organizer, Space-Saving, 11 x 17.7 x 68.1 Inches, Metal Frame, Non-Woven Fabric Shelves, for Entryway, Bedroom, Black ULSH010B02","SONGMICS","$19.99","6,124","220","$122,419","09/23/2021","$10.56","4.5","1,927","$9.43","2,661","6","FBA","3","Home & Kitchen","Standard","5.945 x 17.126 x 4.961 in","3.669 lb","https://www.amazon.com/dp/B09H2FTXBS"
"","","B0BVH6ZND2","Forzacx Floating Shoe Display Shelf with Lights Set of 5, Glow Color Changing Sneaker Shelf- Display Your Top Shoes, Sturdy Levitating Shoe Wall Shelf Easy to Install, for Bedroom, playroom etc","Forzacx","$39.99","211","8","$8,438","02/10/2023","","4.2","77","","108,815","7","FBA","1","Home & Kitchen","","","","https://www.amazon.com/dp/B0BVH6ZND2"
"","","B0BF5215XL","HAIXIN Shoe Racks for Bedroom Plastic Organizer for Closet 8 Tier Shoe Cubby Free Standing Shelves Cabinet Black Sneaker Storage For Entryway Vertical Tower","HAIXIN","$23.99","3,879","181","$93,057","09/12/2022","","4.1","1,094","","3,543","7","FBA","1","Home & Kitchen","","","","https://www.amazon.com/dp/B0BF5215XL"
"","","B09H29SW4W","SONGMICS Shoe Rack, 10 Tier Shoe Organizer for Closet Holds Up to 40 Pairs Shoes & Boots, Shoe Shelf with Metal Frame and Non-Woven Fabric Shelves, Stackable, for Entryway, Bedroom, Black ULSR210B02","SONGMICS","$23.99","922","16","$22,119","09/23/2021","$13.06","4.1","345","$10.93","57,620","6","FBA","2","Home & Kitchen","Standard","12.323 x 17.244 x 4.252 in","6.894 lb","https://www.amazon.com/dp/B09H29SW4W"
"","","B09Q678QVP","WEXCISE Narrow Shoe Rack 10 Tiers Tall Shoe Rack for Entryway 20 24 Pairs Shoe & Boots Organizer Storage Shelf Durable Black Metal Stackable Shoe Cabinet with Hooks, 17.1D x 11.8W x 78.7H in","WEXCISE","$21.98","5,734","215","$126,033","03/23/2022","$11.65","4.5","4,417","$10.33","2,759","7","FBA","1","Home & Kitchen","Standard","8.583 x 17.165 x 4.961 in","5.622 lb","https://www.amazon.com/dp/B09Q678QVP"
"","","B0BG7V29Q2","HOOBRO 12-Tier Shoe Rack, Large Capacity Shoe Storage Organizer, Holds 35-45 Pairs of Shoes, Metal Frame, Industrial, for Entryway, Closet, Hallway, Living Room, Rustic Brown and Black BF127XJ01","HOOBRO","$119.99","137","5","$16,439","09/22/2022","","4.8","34","","178,631","7","FBA","3","Home & Kitchen","","","","https://www.amazon.com/dp/B0BG7V29Q2"
"","","B0B1HLJQBB","J JACKCUBE DESIGN Black Metal Floating Shoe Display Shelves for Wall Mount, Set of 6 Sneaker Showcase Organizer Rack Display -MK1068A","J JACKCUBE DESIGN","$19.99","100","2","$1,999","05/16/2022","","4.9","30","","380,419","6","FBA","1","Home & Kitchen","","","","https://www.amazon.com/dp/B0B1HLJQBB"
"","","B09LS2G5GV","SONGMICS Shoe Rack, 8-Tier Shoe Organizer, Metal Shoe Storage for Garage, Entryway, Set of 2 4-Tier Stackable Shoe Shelf, with Adjustable Flat or Angled Shelves, Holds 32-40 Pairs, Black","SONGMICS","$79.99","1,226","37","$98,068","11/12/2021","$-30.81","4.7","3,380","$110.80","24,743","7","FBA","7","Home & Kitchen","Oversize","36.42 x 64.41 x 12.09 in","10.7 kg","https://www.amazon.com/dp/B09LS2G5GV"
"","","B09JC7KZYZ","MISSLO Door Shoe Rack with Deep Pockets for 12 Pairs of Shoe Organizer Over the Door Hanger for Closet and Dorm Narrow Storage, Grey","MISSLO","$13.99","747","32","$10,451","12/10/2021","$8.12","4.5","1,891","$5.87","28,699","6","FBA","4","Home & Kitchen","Standard","11.02 x 17.36 x 1.18 in","0.679 lb","https://www.amazon.com/dp/B09JC7KZYZ"
"","","B0CLSCS4WX","Nirxxiy 6 Pack Adjustable Wall Mounted Shoes Rack, Plastic Shoes Holder Storage Organizer,RV Storage,Door Shoe Hangers,Hanging Shoe Organizer(Black-6-Screw-stickers)","Nirxxiy","$24.99","15","1","$374.85","12/08/2022","","","","","512,748","6","FBA","1","Home & Kitchen","","","","https://www.amazon.com/dp/B0CLSCS4WX"
"","","B09WHHQLDP","Yocice Wall Mounted Shoes Rack 3Pack/Can Store 6Pairs Sneakers and 6Pairs Slide Sandal,with Sticky Hanging Mounts, Shoes Holder Storage Organizer Shelf,Door Shoe Hangers, SM07-17.5inch-3Pack(Black)","Yocice","$26.99","75","1","$2,024","03/24/2022","$17.15","3.9","123","$9.84","592,042","6","FBA","2","Home & Kitchen","Standard","5.67 x 17.63 x 3.39 in","2.43 lb","https://www.amazon.com/dp/B09WHHQLDP"
"","","B0CL94N45V","HANDSONIC Floating Shoe Display Shelves for Wall Mount,H-Type Sturdy Levitating Shoe Wall Shelf,Sneaker Holders Rack for Shoes Collectors Advertising Exhibition Shoe Store Show Shoe Shelf for Wall","HANDSONIC","$20.99","508","2","$10,663","10/17/2023","","5","4","","397,738","7","FBA","1","Home & Kitchen","","","","https://www.amazon.com/dp/B0CL94N45V"
"","","B09GL93Y1L","MyGift 5-Tier Wall Mounted Dark Brown Metal 18 Pair Boot and Shoe Storage Rack Organizer Stand","MyGift","$99.99","","","$0.00","09/16/2021","$62.14","4.1","16","$37.85","826,309","6","FBA","1","Home & Kitchen","Oversize","31.2 x 31.3 x 3.4 in","12.099 lb","https://www.amazon.com/dp/B09GL93Y1L"
"","","B08RP24XT6","Yocice Wall Mounted Shoes Rack 4Pack with Sticky Hanging Strips, Plastic Shoes Holder Storage Organizer,Door Shoe Hangers (SM03-White-4)","Yocice","$18.99","384","11","$7,292","12/29/2020","$12.60","4.4","778","$6.39","84,060","6","FBA","1","Home & Kitchen","Standard","6.46 x 3.11 x 10.12 in","0.035 oz","https://www.amazon.com/dp/B08RP24XT6"
"","","B0CQK2CBP6","DEYILIAN Hanging Shoe Rack for RV Organization and Storage, 3 Pack Wall Shoe Rack with Hook and Loop Adhesive Strips, Shoe Holder Space Saving Wall Mount Shoe Rack for Camper Shoe Shelf Storage White","DEYILIAN","$26.99","","","","","","","","","1,066,614","","FBA","","Home & Kitchen","","","","https://www.amazon.com/dp/B0CQK2CBP6"
"","","B084JVLK17","FIDUCIAL HOME 10 Tiers Shoe Rack 20-25 Pairs Sturdy Shoe Shelf","FIDUCIAL HOME","$19.99","5,742","175","$114,783","02/04/2020","$9.96","4.5","9,035","$10.03","3,717","5","FBA","23","Home & Kitchen","Standard","6.7 x 17 x 6.1 in","5.099 lb","https://www.amazon.com/dp/B084JVLK17"