"Export time:  1/30/2024, 12:39:21 AM","","ASIN","Product Name","Brand","Price","Monthly Units Sold","Daily Units Sold","Monthly Revenue","Date First Available","Net Revenue","Star Rating","Reviews","Amazon Fees","BSR","LQS","Seller Type","Sellers","Category","Product Tier","Dimensions","Weight","Link"
"","","B0B2QKS6Z7","Sonder Los Angeles, Modern Bamboo Fiber Bread Box for Kitchen Countertop with Reversible Wood Serving Lid, Homemade Bread Storage 14.25 x 9.25 x 7in, Storage Bin and Bread Container","Sonder Los Angeles","$59.95","1,000","39","$59,950","09/20/2022","$43.63","4.8","273","$16.32","6,955","7","FBA","1","Kitchen & Dining","Standard","9.25 x 7 x 14.25 in","5 lb","https://www.amazon.com/dp/B0B2QKS6Z7"
"homemade bread storage","","B094DYL1G8","2 X Bread Bags for Homemade Bread - Plastic Lined, Reusable Linen Cloth Saver Bag For Sourdough & Homemade Bread Storage - 17' x 13' XL","Balcove","$24.99","2,876","185","$71,871","03/23/2022","","4.6","1,647","","960","6","FBA","1","Kitchen & Dining","","","","https://www.amazon.com/dp/B094DYL1G8"
"Average Monthly Sales: 1,034","","B0893JQQ43","LARS NYSM Bread Box I Metal bread box with linen bread bag for long lasting freshness I Bread box with bamboo lid usable as cutting board I 13.4x7.3x5.3In (Sage)","LARS NYSM","$43.99","1,229","23","$54,064","08/04/2020","$30.96","4.5","5,377","$13.03","11,871","6","FBA","1","Kitchen & Dining","Standard","7.28 x 5.31 x 13.39 in","3.42 lb","https://www.amazon.com/dp/B0893JQQ43"
"Average Revenue: $23,210","","B001BB2LMM","Prep Solutions by Progressive Expandable Bread Keeper with Adjustable Air Vent (Pack of 1)","Progressive International","$22.03","724","23","$15,950","10/01/2001","$11.10","4.4","13,969","$10.93","12,322","6","AMZ","7","Kitchen & Dining","Standard","8.58 x 15.85 x 7.64 in","2.599 lb","https://www.amazon.com/dp/B001BB2LMM"
"Average Price: $26.51","","B07ZDKS37Q","LEAFICO Cotton Storage Bags with Drawstrings X-Large 14x17 Multipurpose 6 Pcs - Canvas Fabric Bread Bags - Bulk Food Produce - Reusable Muslin - Natural Potato Onion Storage Bags - Cloth Shoe Bags","LEAFICO","$24.97","1,435","46","$35,832","11/09/2022","$17.45","4.6","2,796","$7.52","5,765","5","FBA","1","Kitchen & Dining","Standard","8.543 x 11.378 x 1.85 in","0.701 lb","https://www.amazon.com/dp/B07ZDKS37Q"
"Average No. of Ratings: 1,594","","B083LKGT36","Think4Earth  Bread Bag - Reusable freezer bread bag for homemade bread maker gift giving - Bread Container for Sourdough Loafs Storage, Large Bread Bags for Homemade Bread with Double Lining","Think4Earth","$14.95","1,619","57","$24,204","01/06/2020","$9.17","4.1","2,093","$5.78","4,513","7","FBA","1","Kitchen & Dining","Standard","6.7 x 9.1 x 0.9 in","0.201 lb","https://www.amazon.com/dp/B083LKGT36"
"Average Sales Rank: 37,389","","B0C998GFHY","RISICULIS Bread Box for Kitchen Countertop, Airtight Loaf Bread Storage Container, Time Recording Bread Keeper with Lid, Bread Holder Bin for Homemade Bread, Bun, Bagel, Loaf","RISICULIS","$29.99","1,253","43","$37,577","06/24/2023","$19.06","4.5","74","$10.93","6,217","7","FBA","3","Kitchen & Dining","Standard","6.2 x 6.1 x 12 in","2.25 lb","https://www.amazon.com/dp/B0C998GFHY"
"Average Rating Number: 4.4","","B0CJ8SVCBV","GKOKG 2 PCS Bread Box for Kitchen Countertop, Large Airtight Bread Storage Container, Bread Keeper Storage with Lid, Bread Holder Bin for Homemade Bread and Bakery Loaf","GKOKG","$39.99","199","5","$7,958","09/17/2023","$27.26","4.3","8","$12.73","49,058","7","FBA","1","Kitchen & Dining","Standard","6.1 x 6.9 x 12.8 in","4.27 lb","https://www.amazon.com/dp/B0CJ8SVCBV"
"","","B0C3VFKGKZ","Tiawudi 2 Pack Bread Box, Plastic Bread Container, Large Sandwich Holder, Bread Storage Container for Kitchen Counter, Bread Keeper with Airtight Lid, Bread Saver, 9 Qt / 8.5L Each","Tiawudi","$24.99","716","38","$17,893","04/27/2023","$14.51","4.3","64","$10.48","7,151","7","FBA","1","Kitchen & Dining","Standard","7.25 x 6.25 x 15 in","3.08 lb","https://www.amazon.com/dp/B0C3VFKGKZ"
"","","B0CN95MYH5","Gifhomfix Bread Box Airtight Bread Boxes for Kitchen Counter, Time Recording Bread Storage Container with Lid, Bread Holder for Homemade Bread, Toast, Bagel, Donut and Cookies","Gifhomfix","$25.99","522","9","$13,567","11/13/2023","$17.16","4.5","16","$8.83","31,181","7","FBA","3","Kitchen & Dining","Standard","6.2 x 6.1 x 12 in","2.2 lb","https://www.amazon.com/dp/B0CN95MYH5"
"","","B09N3M4BDJ","GRIN BY GRIN- 2 Packs Bread Bags to Keep Fresh, Reusable Zipper for Homemade Loaf, Freezer Storage Bag, Container, Fresh Keeping Extra Large Bags, Food Bag","GRIN BY GRIN","$23.99","3,496","95","$83,869","12/05/2021","$16.62","4.4","907","$7.37","2,409","7","FBA","1","Kitchen & Dining","Standard","12 x 0.5 x 17 in","6.1 oz","https://www.amazon.com/dp/B09N3M4BDJ"
"","","B0BYPSH3N5","Triiter Bread Box With Bamboo Wood Cutting Board Lid & Bread Slicer Holder, Oval Cream Color Bread Container For Kitchen Countertop, 13.8 x 7.9 x 5.7in, Bread Storage Container","Triiter","$36.99","195","8","$7,213","03/15/2023","$24.71","4.5","15","$12.28","34,633","7","FBA","1","Kitchen & Dining","Standard","7.9 x 5.7 x 13.8 in","3.91 lb","https://www.amazon.com/dp/B0BYPSH3N5"
"","","B0C7P7L5HG","Li'l Things Eco-friendly Reusable Beeswax Bread bags | Set of 2 Sizes 13'x13' & 15x 9 | 6 Different Themes | Perfect Bag for Home-Baked | Store-Bought Bread | No Plastic | Japanese Seigaiha Waves","Li'l Things","$39.99","278","11","$11,117","06/10/2023","$23.91","4.1","18","$16.08","24,379","7","FBA","1","Kitchen & Dining","Oversize","25 x 14 x 25 in","7.1 oz","https://www.amazon.com/dp/B0C7P7L5HG"
"","","B0BNHZ1JSZ","200 Pcs Kraft Paper Bread Loaf Bag with Clear Window Large Paper Bread Bags for Homemade Bread Food Packaging Storage Bakery Bag and 500 Pcs Stickers for Sourdough Popcorn Cookies, 14 x 8.3 x 3.2 In","Gueevin","$35.99","297","12","$10,689","11/27/2022","$23.26","4.5","42","$12.73","23,707","6","FBA","1","Kitchen & Dining","Standard","9.13 x 3.86 x 14.72 in","6.03 lb","https://www.amazon.com/dp/B0BNHZ1JSZ"
"","","B0CDKFMQXG","Bread Box for Kitchen Countertop - No Assembly Required 2+ Loaves Bread Storage Container - Bread Container Wood Metal - Bread Holder for Kitchen Counter - Bread Bin - Bread Boxes for Kitchen Counter","HB Design Co","$39.99","90","3","$3,599","08/02/2023","$26.36","","","$13.63","72,125","7","FBA","1","Kitchen & Dining","Standard","9.84 x 7.09 x 15.04 in","4.84 lb","https://www.amazon.com/dp/B0CDKFMQXG"
"","","B08H5NRBWV","RoyalHouse Modern Metal Bread Box with Bamboo Cutting Board Lid, Bread Storage Container for Kitchen Counter, Vintage Kitchen Decor Organizer","RoyalHouse","$22.99","1,345","38","$30,922","08/31/2020","$12.81","4.6","5,688","$10.18","7,076","6","FBA","3","Kitchen & Dining","Standard","9.4 x 5.3 x 12 in","1 lb","https://www.amazon.com/dp/B08H5NRBWV"
"","","B08CR1G8CS","100 Reusable Clear Bread Bags With Ties - Adjustable for Homemade Loaves and Bakery Bread","Mantah","$12.97","2,619","94","$33,968","07/09/2020","$5.88","4.7","4,438","$7.09","2,458","6","FBA","1","Kitchen & Dining","Standard","7.362 x 8.976 x 1.496 in","1.338 lb","https://www.amazon.com/dp/B08CR1G8CS"
"","","B0BW6VM2VH","Triiter Bread Box With Bamboo Wood Cutting Board Lid & Bread Slicer Holder, Rectangular Cream Color Bread Container For Kitchen Countertop, 14.8 x 8.4 x 5.3in, Bread Storage Container","Triiter","$37.99","157","5","$5,964","02/18/2023","$25.56","4.6","16","$12.43","48,496","7","FBA","1","Kitchen & Dining","Standard","8.4 x 5.35 x 14.8 in","4.29 lb","https://www.amazon.com/dp/B0BW6VM2VH"
"","","B0CH7BBTBF","Tafura Bread Storage Container with Tray, Plastic Bread Box, Bread Container with Airtight Lid, Loaf Bread Keeper, Bread Holder for Homemade Bread, BPA Free","Tafura","$25.89","531","19","$13,748","12/25/2023","","5","6","","14,550","7","FBA","1","Kitchen & Dining","","","","https://www.amazon.com/dp/B0CH7BBTBF"
"","","B07TWY7CQ3","LARS NYSM Bread Box I Metal bread box with linen bread bag for long lasting freshness I Bread box with bamboo lid usable as cutting board I 13.4x7.3x5.3In (Cool Grey)","LARS NYSM","$36.99","1,245","23","$46,053","07/27/2020","$25.01","4.5","5,377","$11.98","11,871","6","FBA","1","Kitchen & Dining","Standard","7.68 x 5.31 x 13.39 in","3.42 lb","https://www.amazon.com/dp/B07TWY7CQ3"
"","","B0BBMG4X7X","Merysen 3 Tier Wooden Fruit Basket For Kitchen, Bread Vegetable Fruit Basket Bowl Stand, Farmhouse Fruit Bowl for Countertop, Large","Merysen","$34.99","720","21","$25,193","08/23/2021","","4.5","621","","13,000","6","FBA","2","Kitchen & Dining","","","","https://www.amazon.com/dp/B0BBMG4X7X"
"","","B0BZKZ3X9S","GOULIKFUL 50PCS Kraft Paper Bread Bags with Tin Tie Tab Lock, Loaf Bag with Clear Front Window, Storage Packaging Treat Bag for Bakery Cafe Homemade Bread 10.6* 4.3* 8.7","GOULIKFUL","$17.99","150","5","$2,698","03/24/2023","","5","11","","47,461","7","FBA","1","Kitchen & Dining","","","","https://www.amazon.com/dp/B0BZKZ3X9S"
"","","B0CFGRKLRM","ROYALNA 100ct (8'x4'x18') Large Bread Loaf Packing Bags with Ties, Reusable, Thick Clear Gusseted Grocery Bakery Bags (Large 100ct 8x4x18)","Generic","$9.29","557","8","$5,175","08/11/2023","","3.7","13","","34,551","6","FBA","2","Kitchen & Dining","","","","https://www.amazon.com/dp/B0CFGRKLRM"
"","","B0CDBWMKHL","Bread Bags with Ties, 30 Clear Bread Bags for Homemade Bread and 50 Ties, Adjustable Reusable Plastic Bread Bags, Bread Loaf Bags for Home Bakers and Bakery Owners","Reastar","$6.99","4,088","94","$28,575","07/31/2023","","4.8","198","","2,437","7","FBA","1","Kitchen & Dining","","","","https://www.amazon.com/dp/B0CDBWMKHL"
"","","B0CDY1RRHK","Royoroyi Bread Bags for Homemade Bread,2 Packs Reusable Bread Bag,Freezer Bread Storage Bag,Waterproof Zipper Bread Container to Keep Bread Fresh gift giving (beige Jewel Blue)","ROYOROYI","$16.99","549","20","$9,328","09/13/2023","$5.12","4","59","$11.87","13,753","7","FBA","1","Kitchen & Dining","Oversize","12 x 17 x 12 in","7.1 oz","https://www.amazon.com/dp/B0CDY1RRHK"
"","","B0BM492VBQ","Lesibag - 50 Packs Bread Bags to Keep Bread Fresh, Zippered Food Bag for Homemade Bread Loaf, Freezer Bread Storage Bag, Reusable Food Storage Bag","LESIBAG","$15.99","348","10","$5,565","11/10/2022","","4.4","70","","28,326","6","FBA","1","Kitchen & Dining","","","","https://www.amazon.com/dp/B0BM492VBQ"
"","","B0996B7L2H","LARS NYSM Bread Box I Metal bread box with linen bread bag for long lasting freshness I Bread box with bamboo lid usable as cutting board I 14.2x7.5x5.1 In (Sage)","LARS NYSM","$47.99","617","22","$29,610","10/07/2021","$34.36","4.5","779","$13.63","12,433","6","FBA","1","Kitchen & Dining","Standard","7.48 x 5.12 x 14.17 in","2.98 lb","https://www.amazon.com/dp/B0996B7L2H"
"","","B088DHGBZF","Baking & Beyond Space-Saving Bread Box with Bamboo Cutting Board Lid,13'x7.5'x5' for Kitchen Countertop, Bread Storage Container Holder, Bread Keeper Bin - Fresh Loaves","BB BAKING & BEYOND","$29.97","268","11","$8,032","08/31/2020","$18.74","4.6","1,432","$11.23","25,291","6","FBA","1","Kitchen & Dining","Standard","8 x 5.5 x 13.88 in","4.8 lb","https://www.amazon.com/dp/B088DHGBZF"
"","","B0CP3L9TZW","Goozii Corner Bread Box for Kitchen Countertop, Black Bread Storage Container for Homemade Bread, Two Layer Breadbox under Cabinet Mount, Large Bread Holder for Kitchen Counter, Panry Shelf","Goozii","$29.97","885","28","$26,523","11/27/2023","$10.83","","","$19.14","9,830","7","FBA","1","Kitchen & Dining","Oversize","12.6 x 13.5 x 12.6 in","7.98 lb","https://www.amazon.com/dp/B0CP3L9TZW"
"","","B0BGH2XV7X","Tiawudi 2 Pack Large Bread Box for Kitchen Countertop, Airtight Bread Storage Container for Homemade Bread and Bakery Loaf, Plastic Bread Keeper, 11.6 Qt / 11L Each","Tiawudi","$26.99","899","40","$24,264","09/25/2022","$15.61","4.5","327","$11.38","6,786","7","FBA","1","Kitchen & Dining","Standard","10 x 5.9 x 14.6 in","3.23 lb","https://www.amazon.com/dp/B0BGH2XV7X"
"","","B08NXS45NX","Think4Earth - (2 Pack) Bread Bag - Reusable freezer bread bag for homemade bread maker gift giving - Bread Container for Sourdough Loafs Storage, Large Bread Bags for Homemade Bread with Lining","Think4Earth","$21.95","1,620","57","$35,559","01/31/2020","$15.12","4.1","2,093","$6.83","4,513","7","FBA","1","Kitchen & Dining","Standard","7.874 x 1.89 x 4.724 in","0.088 lb","https://www.amazon.com/dp/B08NXS45NX"
"","","B08X1W3184","White Bread Box For Kitchen Countertop With Bamboo Wood Cutting Board Lid - Farmhouse White Metal Large Bread Box Modern Style To Extend Freshness - Bread Storage Container","Nicola Living","$36.99","344","13","$12,725","02/18/2021","$25.01","4.5","360","$11.98","20,506","7","FBA","1","Kitchen & Dining","Standard","7 x 4.8 x 13 in","2.71 lb","https://www.amazon.com/dp/B08X1W3184"
"","","B0BZBL8QFM","THINK4EARTH - 2 Packs Bread Bags, Bread Bags for Homemade Bread Loaf, Freezer Bread Storage Bag, Bread Container, Reusable Food Storage Bag, Large Bread Bags for Homemade Bread with Double Lining.","Think4Earth","$21.95","1,465","44","$32,157","03/22/2023","","3.8","188","","5,994","7","FBA","1","Kitchen & Dining","","","","https://www.amazon.com/dp/B0BZBL8QFM"
"","","B0BK2DP1QY","Bread Bags (100 Count) Bread Bags for Homemade Bread, Plastic Bread Bags with Twist Ties, 100 Clear Storage Bags, BPA Free","Tafura","$13.99","406","15","$5,680","10/31/2022","","4.4","236","","18,410","6","FBA","1","Kitchen & Dining","","","","https://www.amazon.com/dp/B0BK2DP1QY"
"","","B09FHZ5M55","Mantah Bread Bags with Ties, Reusable, 50 Clear Bags and 50 Ties, Bread Bag For Homemade Bread And Bakery Loaf Adjustable Reusable","Mantah","$8.99","1,491","44","$13,404","09/04/2021","$3.87","4.7","1,625","$5.12","6,109","6","FBA","1","Kitchen & Dining","Standard","8 x 9.5 x 1 in","0.6 lb","https://www.amazon.com/dp/B09FHZ5M55"
"","","B0BJMMYB54","Bread Bags for Homemade Bread Storage - Reusable Large Bread Bag - Freezer Safe Bread Saver - Sourdough Bread Making & Fresh Bread Storage Solution (black)","Ameeze","$14.95","90","3","$1,346","03/17/2023","","4.3","191","","88,580","7","FBA","1","Kitchen & Dining","","","","https://www.amazon.com/dp/B0BJMMYB54"
"","","B084HJLN4Z","Kitchen Discovery Plastic Bread Box Container Storage - Holder for Keeping Flavor and Freshness Preserve Up To 5 Days","Kitchen Discovery","$12.99","835","30","$10,847","02/04/2020","$7.50","3.8","738","$5.49","9,237","7","FBA","3","Kitchen & Dining","Standard","5.13 x 5.25 x 13.75 in","5.6 oz","https://www.amazon.com/dp/B084HJLN4Z"
"","","B0B1JNRV4C","Cezoyx 4 Piece Portable Bread Box with Handle, Rectangular Loaf Cake Containers with Lid, 4 Colors Bread Keeper for Carrying and Storing Banana Bread, Pumpkin Bread and Quick Bread","Cezoyx","$23.99","88","5","$2,111","05/16/2022","$13.96","4.4","174","$10.03","48,534","6","FBA","1","Kitchen & Dining","Standard","6.5 x 5.3 x 14.3 in","2.16 lb","https://www.amazon.com/dp/B0B1JNRV4C"
"","","B0CPDRZ927","Reusable Bread Bags for Homemade Bread, 3 Pack Sourdough Bread Bags with Sealed Zipper to Keep Fresh, Freezer Safe Bakery Bread Storage Bags with Window Extra Large Capacity 15x7.2x6.6 in","UPGENT","$16.99","298","5","$5,063","12/03/2023","$11.52","3.3","3","$5.47","48,062","7","FBA","1","Kitchen & Dining","Standard","2.5 x 0.5 x 3.5 in","3.84 oz","https://www.amazon.com/dp/B0CPDRZ927"
"","","B0C87VP9CZ","Simply H&K Linen Bread Bags [Pack of 3] with Inner Lining - Keeps Homemade Bread Fresh & Secure - Perfect for Sourdough & Gift Giving - Set of Reusable Bread Bags","Simply H&K","$26.99","136","7","$3,671","06/30/2023","","4.3","27","","36,985","6","FBA","1","Kitchen & Dining","","","","https://www.amazon.com/dp/B0C87VP9CZ"
"","","B09SNYBYFX","Tafura Bread Container | Plastic Bread Box | Bread Keeper with Airtight Lid | Bread Storage Loaf Container | Airtight Loaf Bread Saver, BPA Free, 5 Liter","Tafura","$17.89","1,075","30","$19,232","07/13/2022","$8.48","4.5","957","$9.41","9,327","6","FBA","1","Kitchen & Dining","Standard","6.8 x 6.8 x 13.25 in","1 lb","https://www.amazon.com/dp/B09SNYBYFX"
"","","B08KGZ4Q8Q","Barnyard Designs Large Bread Box for Kitchen Countertop, Bread Storage Container, Stainless Steel Metal Bread Box, White Farmhouse Rustic Vintage Bread Box, Farmhouse Bread Holder Bin, 13' x 4.75'","Barnyard Designs","$24.95","176","6","$4,391","09/30/2020","$14.78","4.6","118","$10.17","43,404","7","FBA","1","Kitchen & Dining","Standard","7.5 x 4.75 x 13 in","2.55 lb","https://www.amazon.com/dp/B08KGZ4Q8Q"
"","","B0C4987XCB","Li'l Things Eco-friendly Reusable Beeswax Bread bags | Set of 2 Sizes 13'x13' & 15x9 | 6 Different Themes | Perfect Bag for Home-Baked | Store-Bought Bread | No Plastic | Stripey Black","Li'l Things","$39.99","330","11","$13,197","05/03/2023","","4.1","18","","24,379","7","FBA","1","Kitchen & Dining","","","","https://www.amazon.com/dp/B0C4987XCB"
"","","B0CHFLXB14","Wowangce 4 Pcs Reusable Linen Bread Bags for Homemade Bread 17 x 13 Inches Drawstring Bread Storage Bags for Sourdough, Gift for Bread, Bakers, Housewarming, Wedding Gifts","Wowangce","$20.99","76","2","$1,595","09/05/2023","","4.5","2","","102,351","7","FBA","2","Kitchen & Dining","","","","https://www.amazon.com/dp/B0CHFLXB14"
"","","B0CR1H8QG9","SilTriangle 2 Pcs Reusable Bread Bags for Homemade Bread with Plastic Lined 17 x 13 Inch Bread Bags Bread Storage Bags Bread Saver Bag for Fresh and Soft Homemade Bread Sourdough Loaf Sandwich Food","SilTriangle","$16.99","","","","01/29/2024","","","","","","7","FBA","1","","","","","https://www.amazon.com/dp/B0CR1H8QG9"
"","","B077TK2H2B","Bambüsi Bamboo Bread Slicer with Knife - 3 Slice Thickness, Foldable Compact Cutting Guide with Crumb Tray, Stainless Steel Bread Knife for Homemade Bread, Cake, Bagels 5.5 Wide x 5 Tall","Bambüsi","$44.99","3,282","77","$147,657","11/28/2017","$31.81","4.3","14,153","$13.18","10,844","7","FBA","8","Home & Kitchen","Standard","9.173 x 14.095 x 2.52 in","3.131 lb","https://www.amazon.com/dp/B077TK2H2B"
"","","B0CPDRJV2Y","Noafocks Bread Bags for Homemade Bread 2 Pack Reusable Zipper Sourdough Bread Bags to Keep Fresh Extra Large Bakery Bread Bags with Window for Bread Storage (15x7.2x6.6 inch)","Noafocks","$12.99","360","12","$4,676","12/17/2023","","4.3","10","","76,521","","FBA","1","Home & Kitchen","","","","https://www.amazon.com/dp/B0CPDRJV2Y"
"","","B0CPLRHH9X","Woanger 6 Pcs Reusable Bread Bags for Homemade Bread Plastic Inside Lining to Keep Bread Fresh Linen Container Saver Bag for Sourdough & Homemade Bread Storage(Stylish)","Woanger","$26.99","60","2","$1,619","","","","","","92,916","","FBA","","Kitchen & Dining","","","","https://www.amazon.com/dp/B0CPLRHH9X"
"","","B08SLY7ZBK","Augshy Linen Bread Bags for Homemade Bread Container, 4 Pcs 17.5 X11.5 Inches Unbleached & Reusable Bread Storage, Natural Large Storage for Artisan Bread","Augshy","$14.95","749","32","$11,198","01/10/2021","$8.94","4.1","451","$6.01","8,460","6","FBA","1","Kitchen & Dining","Standard","6.77 x 1.89 x 6.93 in","8.3 oz","https://www.amazon.com/dp/B08SLY7ZBK"
"","","B00009Y351","LocknLock Easy Essentials Airtight Rectangular Tall Food Storage Container 152 oz / 18.8 Cup, Clear","LOCK & LOCK","$15.86","3,710","127","$58,841","06/06/2011","$7.78","4.7","13,962","$8.08","1,641","6","AMZ","6","Kitchen & Dining","Standard","6.93 x 9.53 x 5.94 in","0.88 lb","https://www.amazon.com/dp/B00009Y351"
"","","B0BT9JVVNC","Paper Bread Bags for Homemade Bread Sourdough Bread Bags Large Paper Bakery Bag with Window for Baked Food Packaging Storage,Label Seal Sticker Included Pack of 25(13.7x8.2x3.5 inch)","PONGHEI","$9.69","7,554","298","$73,198","01/27/2023","$-0.70","4.6","331","$10.39","453","7","FBA","1","Kitchen & Dining","Oversize","8.27 x 13.78 x 8.27 in","10.5 oz","https://www.amazon.com/dp/B0BT9JVVNC"
"","","B0BVM5Q39F","Liamee Modern Bread Box For Kitchen Countertop, Large metal Bread Keeper Storage Container With Bamboo Cutting BoardFarmhouse Bread Box For Homemade BreadBanana Bread Container For Loaf Cakes, White","LiaMeE","$28.99","142","6","$4,117","02/12/2023","$18.21","4","68","$10.78","45,091","6","FBA","1","Kitchen & Dining","Standard","7.2 x 5.6 x 13.1 in","3.9 lb","https://www.amazon.com/dp/B0BVM5Q39F"
"","","B0CPCNQVPY","salomayes Bread Box With Cutting Board, Kitchen Countertop Bread Storage Container with Reversible Bamboo Serving Lid, 13.8 X 7.8 X 5.6in, homemade bread storage container (Oval)","salomayes","$28.99","30","1","$869.70","12/02/2023","$17.91","5","2","$11.08","168,611","7","FBA","1","Kitchen & Dining","Standard","7.8 x 5.6 x 13.8 in","3.6 lb","https://www.amazon.com/dp/B0CPCNQVPY"
"","","B08Q7WJC3G","Reusable Plastic Bread Bags for Homemade - 100 Pack Clear Bag with Ties For An Airtight Moisture-free Preservation and Storage- Loaf Home Bakers Bakery Owners","FUNSTITUTION","$12.95","2,100","70","$27,195","11/24/2022","$5.11","4.7","2,586","$7.84","3,551","7","FBA","2","Kitchen & Dining","Standard","6.5 x 1 x 8.5 in","1 lb","https://www.amazon.com/dp/B08Q7WJC3G"
"","","B09YHCWV4K","RISICULIS 2PCS Large Bread Box for Countertop, Stackable Double Layer Storage Container, Clear Boxes for Kitchen Counter, Bread Keeper for Homemade Bread, Bagel, Muffins, Rolls","RISICULIS","$35.99","947","28","$34,083","04/20/2022","$21.27","4.4","1,057","$14.72","9,916","7","FBA","3","Kitchen & Dining","Oversize","14 x 11 x 17.2 in","1.45 oz","https://www.amazon.com/dp/B09YHCWV4K"
"","","B0CN97S983","ZEAYEA Bread Box for Kitchen Countertop, Airtight Bread Storage Container, Time Recording Plastic Bread Keeper for Homemade Bread Bagel Loaf, Fresh Container for Vegetable Fruit Fridge Organizer","ZEAYEA","$21.99","221","5","$4,860","11/13/2023","$12.90","","","$9.09","50,369","6","FBA","1","Kitchen & Dining","Standard","5.5 x 6.1 x 11.4 in","1 lb","https://www.amazon.com/dp/B0CN97S983"
"","","B0BKZJ376F","LOHASOK Double Layer Bamboo Bread Box for Kitchen Counter-Large Capacity Bread Storage Container Farmhouse Bread Box with Window Bread Holder (Black)","LOHASOK","$45.99","1,276","34","$58,683","10/30/2022","$24.83","4.2","831","$21.16","8,099","6","FBA","4","Kitchen & Dining","Oversize","9.85 x 12.99 x 15.75 in","8.25 lb","https://www.amazon.com/dp/B0BKZJ376F"
"","","B093P7YDBV","SOTECH Metal Bread Box for Kitchen Countertop black Bread Box With White Lid for Homemade Bread Farmhouse Style Bread Bin-Kitchen Food Bread Storage Container","SOTECH","$35.99","30","1","$1,080","04/27/2021","$22.96","4.7","421","$13.03","175,002","7","FBA","1","Kitchen & Dining","Standard","7.6 x 8.5 x 15.94 in","3.19 lb","https://www.amazon.com/dp/B093P7YDBV"
"","","B0C4144QPJ","Meraki Home Bread Storage Container with 2 Lids, Cotton Bread BagFarmhouse Bread Boxes for Kitchen Counter Airtight  Metal Box for Homemade Bread Storage (Matte Blue)","Meraki Home","$36.97","166","5","$6,137","04/30/2023","$23.79","4.6","706","$13.18","54,349","7","FBA","1","Kitchen & Dining","Standard","7.1 x 9.3 x 15.1 in","4.44 lb","https://www.amazon.com/dp/B0C4144QPJ"
"","","B0BWW6X1RX","DOITOOL Bread Box for Kitchen Countertop - Stainless Steel Bread Storage Container with Lid - Bread Holder Bread Containers Storage Airtight Loaf for Kitchen Counter, Homemade Bread","DOITOOL","$33.99","","","$0.00","02/25/2023","$14.17","4.1","5","$19.82","462,192","7","FBA","2","Kitchen & Dining","Oversize","13.26 x 13.26 x 13.26 in","1.4 lb","https://www.amazon.com/dp/B0BWW6X1RX"