"Export time:  2/1/2024, 11:11:41 AM","","ASIN","Product Name","Brand","Price","Monthly Units Sold","Daily Units Sold","Monthly Revenue","Date First Available","Net Revenue","Star Rating","Reviews","Amazon Fees","BSR","LQS","Seller Type","Sellers","Category","Product Tier","Dimensions","Weight","Link"
"","","B0CP3RFCVT","TOJNMAKE Reusable Grocery Bag On Wheels, Shopping Trolley, Rolling Tote with 8 Pockets and Zipper Cover, Foldable, Heavy Duty Handles, Carries Up to 46 LBS (Medium, Black)","","$100.99","180","6","$18,178","01/12/2024","","","","","42,791","","FBA","","Kitchen & Dining","","","","https://www.amazon.com/dp/B0CP3RFCVT"
"hulken bag with wheels","","B07VCN671J","Handy Sandy Fold Flat Travel Wagon Reusable Grocery/Laundry/Cruise/Travel/School Locker Bag and More on Wheels, Lightweight (Orange)","Handy Sandy","$64.99","","","$0.00","07/17/2019","$47.01","3.9","46","$17.98","825,873","7","FBA","3","Office Products","Standard","11 x 7.5 x 15.5 in","6 lb","https://www.amazon.com/dp/B07VCN671J"
"Average Monthly Sales: 1,410","","B098JNLJ16","Greencity Duffel Bag Wheels Rolling Deployment Wheeled Military Suitcase Heavy-Duty Trolley Bag Tactical Large Capacity 32 InchBlack Camo","Greencity","$97.90","288","10","$28,195","07/04/2021","","4.5","96","","95,990","6","FBA","1","Clothing, Shoes & Jewelry","","","","https://www.amazon.com/dp/B098JNLJ16"
"Average Revenue: $46,325","","B09PRNSQK8","BAG-THAT! 10 Black Moving Bags Extra Large Heavy Duty Storage Bags Zippered Top Handles Wrap Bag Totes For Storage Packing Bags Moving Supplies Packing Supplies for Moving Moving Boxes Plastic Tote","BAG-THAT!","$39.99","1,512","42","$60,465","01/04/2022","$19.73","4.7","1,375","$20.26","22,031","6","FBA","1","Home & Kitchen","Oversize","11.89 x 18.15 x 9.53 in","6.55 lb","https://www.amazon.com/dp/B09PRNSQK8"
"Average Price: $51.02","","B0CP9281WY","TOJNMAKE Reusable Grocery Bag On Wheels Shopping Trolley with 8 Pockets and Zipper Cover Foldable Rolling Tote, Heavy Duty Handles, Carries Up to 66LBS (Large, Black)","","$110.99","180","6","$19,978","01/07/2024","","","","","42,791","","FBA","","Kitchen & Dining","","","","https://www.amazon.com/dp/B0CP9281WY"
"Average No. of Ratings: 1,727","","B07VHZFNXP","Handy Sandy Fold Flat Travel Wagon Reusable Grocery/Laundry/Travel/Cruise/School Locker Bag and More on Wheels, Lightweight (Purple)","Handy Sandy","$64.99","","","$0.00","07/17/2019","$46.71","3.9","46","$18.28","362,617","7","FBA","2","Office Products","Standard","11.654 x 16.221 x 7.874 in","5.234 lb","https://www.amazon.com/dp/B07VHZFNXP"
"Average Sales Rank: 92,458","","B085NH217N","Cowinbest Rolling Duffle Bag with 360 Detachable Wheels Travel Bag Shopping Bag Foldable Duffle Bag Luggage Bag","Cowinbest","$39.99","90","3","$3,599","07/17/2022","$30.68","5","5","$9.31","43,635","7","FBA","1","Industrial & Scientific","Standard","11 x 14.1 x 3 in","1.451 lb","https://www.amazon.com/dp/B085NH217N"
"Average Rating Number: 4.3","","B09Z2SCYPR","Uholan Set of Two Dolly Hand Truck Splicing Cart Moving Handling Carfor Easy Storage 360 Swivel Wheels Pulling Goods Mute Portable Load Bearing 660lb","Uholan","$129.00","50","1","$6,450","04/27/2022","","4.6","41","","108,601","6","FBA","1","Industrial & Scientific","","","","https://www.amazon.com/dp/B09Z2SCYPR"
"","","B0BW5HGXJX","Folding Hand Truck Portable Dolly Cart Max 350 lbs Aluminum Foldable Dolly Cart Luggage Trolley Cart, 6 Wheels Push Cart Dolly for Moving, Small Platform Hand Cart with 2 Ropes Black","YOSHIKO","$42.99","457","13","$19,646","02/17/2023","","4","19","","11,025","6","FBA","1","Industrial & Scientific","","","","https://www.amazon.com/dp/B0BW5HGXJX"
"","","B09GPVZPJP","Hand Truck, COREFLEX Folding Hand Truck Foldable with 7 Wheels 500lbs Heavy Duty Hand Truck Dolly Adjustable Handle for Luggage, Travel, Moving, Shopping, Personal and Office","COREFLEX","$67.99","23","1","$1,564","12/27/2021","$46.71","4.5","144","$21.28","129,025","7","FBA","2","Industrial & Scientific","Oversize","13.03 x 20 x 6 in","7.91 lb","https://www.amazon.com/dp/B09GPVZPJP"
"","","B085Y49C69","Pipishell 3 Tier Metal Rolling Utility Cart, Heavy-Duty Storage Rolling Cart with 2 Lockable Wheels, Multifunctional Mesh Organization Utility Cart for Kitchen Dining Room Living Room (White)","Pipishell","$36.86","952","26","$35,091","03/15/2020","$23.10","4.7","4,854","$13.76","9,564","7","FBA","8","Office Products","Standard","12.205 x 6.299 x 16.535 in","9.185 lb","https://www.amazon.com/dp/B085Y49C69"
"","","B09DB6F9X5","Foldable Shopping Bag Collapsible Trolley Bags Reusable Grocery Bags Shopping Trolley Bag Shopping Bag for Shopping Home Kitchen Supermarket Travel(B09DB6F9X5)","Cowinbest","$21.99","116","3","$2,551","12/19/2021","$13.56","3.8","507","$8.43","41,594","7","FBA","2","Industrial & Scientific","Standard","7.047 x 16.457 x 2.52 in","1.473 lb","https://www.amazon.com/dp/B09DB6F9X5"
"","","B0CLGHTXST","Drvoon Expandable foldable duffel bag suitcase, detachable rolling wheels,carry-on large duffel bag,luggage bag,suit gym,camping,travel or business trip,Gift for wife and parents-Checkerboard(BLACK)","Drvoon","$34.99","997","65","$34,885","12/06/2023","","4.7","46","","13,576","7","FBA","1","Clothing, Shoes & Jewelry","","","","https://www.amazon.com/dp/B0CLGHTXST"
"","","B0CP5JY22L","Folding Shopping Cart for Groceries(80lbs), Multifunctional Collapsible Cart with Removable Tote Bag and Swivel Wheels, Easy One-Hand Fold, Portable Personal Shopping Cart for Laundry, Camping Gear","Giovent","$129.97","90","3","$11,697","11/28/2023","","3","2","","71,336","7","FBA","1","Office Products","","","","https://www.amazon.com/dp/B0CP5JY22L"
"","","B0BBTZ7GDD","Reusable Laundry Bag, ROLLBPROBOX Laundry Baskets On Wheels, Shopping Trolley, Lightweight Foldable Corner Storage Bins, Collapsible Rolling Laundry Hamper, Carries Up To 50 lb, Beige(Small Size)","R ROLL PROBOX","$49.99","","","$0.00","08/24/2022","","4.1","25","","1,000,773","6","FBA","2","Home & Kitchen","","","","https://www.amazon.com/dp/B0BBTZ7GDD"
"","","B0C27RL3HZ","Honshine Shopping Cart with 5 Swivel Wheels, Foldable Grocery Cart with Large Waterproof Removable Bag & Telescoping Handle, Trolley for Grocery Laundry Book Beach(Pink)","Honshine","$62.99","209","6","$13,165","04/11/2023","","4.1","243","","36,463","7","FBA","1","Office Products","","","","https://www.amazon.com/dp/B0C27RL3HZ"
"","","B0CGDH774N","VOOWO Rolling Duffle Bag with Wheels, Expandable Foldable Duffle Bag with Wheels and Handle for Travel, Rolling Luggage bag Carry on Duffel Bag, Wheeled Travel Duffle Bag, Large Weekend Bag (Purple)","VOOWO","$29.95","920","30","$27,554","10/07/2023","","4.2","49","","31,740","7","FBA","1","Clothing, Shoes & Jewelry","","","","https://www.amazon.com/dp/B0CGDH774N"
"","","B0CD6P3QRQ","Cowinbest Rolling Duffle Bag with Wheels Travel Bag Foldable Luggage Bag Shopping Bag with Wheels Trolley Bag","Cowinbest","$39.99","65","3","$2,599","08/15/2023","","4.7","10","","44,169","7","FBA","1","Industrial & Scientific","","","","https://www.amazon.com/dp/B0CD6P3QRQ"
"","","B0CMKZPW49","Upgrade Shopping Bag with Wheels Carry on Luggage Bag Reusable Shopping Bags Travel Bag Duffel Bag","Cowinbest","$29.99","15","1","$449.85","11/04/2023","","4.2","16","","150,462","","FBA","1","Kitchen & Dining","","","","https://www.amazon.com/dp/B0CMKZPW49"
"","","B0CD6Q15X6","Cowinbest Upgrade Shopping Bag with Wheels Portable Trolley Bag Grocery Cart Hand Pulling Utility Universal Wheels Bag Travel Bag Foldable Luggage Bags- Larger & Waterproof & Strong(Black-B0CD6Q15X6)","Cowinbest","$39.99","158","5","$6,318","10/13/2023","","4.1","16","","29,208","7","FBA","1","Industrial & Scientific","","","","https://www.amazon.com/dp/B0CD6Q15X6"
"","","B0BFHGDZ2Z","WORKPRO 6 Pack Extra Large Moving Bags with Zippers & Carrying Handles Backpack Straps, Heavy-Duty Storage Tote for Space Saving Moving Storage - Pink","WORKPRO","$35.99","839","24","$30,196","03/31/2023","$23.56","4.8","383","$12.43","38,936","7","FBA","4","Home & Kitchen","Standard","11.06 x 5.08 x 14.25 in","4.53 lb","https://www.amazon.com/dp/B0BFHGDZ2Z"
"","","B086WNKLTM","TICONN 6 Pack Extra Large Moving Bags with Zippers & Carrying Handles, Heavy-Duty Storage Tote for Space Saving Moving Storage","TICONN","$29.95","20,342","575","$609,243","04/07/2020","$18.73","4.7","34,125","$11.22","523","6","FBA","1","Home & Kitchen","Standard","10.5 x 5 x 13.1 in","4.109 lb","https://www.amazon.com/dp/B086WNKLTM"
"","","B0BGXX241B","MATEIN Rolling Backpack for Women, 17 Inch Travel Laptop Backpacks with Wheels, Large Carry On Business Luggage Roller Backpack, Waterproof Trolley Suitcase Overnight College Work Computer Bag, Pink","MATEIN","$89.99","","","","05/15/2023","","4.5","69","","319","7","FBA","1","Laptop Backpacks","","","","https://www.amazon.com/dp/B0BGXX241B"
"","","B0BB6M3Z74","Hanke Suitcases with Wheels Expandable Foldable Luggage Bag Suitcase Collapsible Rolling Travel Bag Duffel Bag for Men Women Lightweight Suitcases without Telescoping Handle","Hanke","$79.99","862","23","$68,951","06/07/2018","$43.85","4.3","2,560","$36.14","40,650","7","FBA","4","Clothing, Shoes & Jewelry","Oversize","10.2 x 31.4 x 17.7 in","5.38 lb","https://www.amazon.com/dp/B0BB6M3Z74"
"","","B09RBF95V5","DURASACK Heavy Duty Storage Tote Bag 22-Gallon Rugged Woven Polypropylene Moving Bag, Reusable Self-Standing Design, Holds up to 500 Pounds, Single, Blue, 16 x 16 x 19 inches","DURASACK","$13.99","971","34","$13,584","01/26/2022","$-4.65","4.7","149","$18.64","10,403","7","AMZ","1","Tools & Home Improvement","Oversize","16 x 16 x 11 in","1 lb","https://www.amazon.com/dp/B09RBF95V5"
"","","B0CNT4BB7G","VOOWO Rolling Duffle Bag with Wheels, Expandable Foldable Duffel Bag with Wheels for Travel, Rolling Luggage Carry on Duffel Bag, Wheeled Travel Duffle Bag, Large Weekend Bag for Women & Men (Black)","VOOWO","$29.95","428","13","$12,819","01/02/2024","","4.5","19","","74,725","7","FBA","1","Clothing, Shoes & Jewelry","","","","https://www.amazon.com/dp/B0CNT4BB7G"
"","","B09K7VWQXW","reisenthel carrycruiser Twist Coffee  Portable Shopping Trolley with Sturdy Aluminum Frame, Shoulder Strap and Removable mesh Inner Bag - Made of Water-Repellent Material.","reisenthel","$179.95","53","3","$9,537","01/15/2023","","4.3","18","","56,288","6","FBA","2","Patio, Lawn & Garden","","","","https://www.amazon.com/dp/B09K7VWQXW"
"","","B0BFQTH4NB","Laundry Hamper with Wheels, Bukere Large Rolling Laundry Basket with 4 Casters and 2 Handles, Collapsible Freestanding Wheeled Laundry Bag for Clothes, Laundry Room, Bathroom Grey","Bukere","$45.99","297","7","$13,659","09/18/2022","","4.5","96","","120,908","7","FBA","2","Home & Kitchen","","","","https://www.amazon.com/dp/B0BFQTH4NB"
"","","B07XPWDMWT","Wrangler 30' Wesley Rolling Duffel Bag","Wrangler","$44.00","2,554","70","$112,376","09/21/2022","$17.44","4.3","6,196","$26.56","12,416","5","AMZ","8","Clothing, Shoes & Jewelry","Oversize","18 x 7.5 x 30.5 in","5.55 lb","https://www.amazon.com/dp/B07XPWDMWT"
"","","B0CJSNFX6L","DURASACK Heavy Duty Moving Bag Storage Container Duffle Bag with Zipper, Reinforced Carry Straps and Backpack Straps, Made of Rugged Woven Polypropylene, Pack of 4, Gray","DURASACK","$21.99","209","9","$4,596","09/28/2023","","4.4","19","","103,507","7","AMZ","1","Home & Kitchen","","","","https://www.amazon.com/dp/B0CJSNFX6L"
"","","B0CLGJ2K2N","Drvoon Expandable foldable duffel bag suitcase, detachable rolling wheels,carry-on large duffel bag,luggage bag,suit gym,camping,travel or business trip,Gift for wife and parents-Checkerboard(KHAKI)","Drvoon","$34.99","948","65","$33,171","12/03/2023","","4.7","46","","13,576","7","FBA","1","Clothing, Shoes & Jewelry","","","","https://www.amazon.com/dp/B0CLGJ2K2N"
"","","B0CB8BGLDS","CAB55 Rolling Craft Bag, Rolling Tote Bag with Wheels for Women, Rolling Teacher Bag with Removable Folding Hand Trucks-Grey","CAB55","$60.99","283","10","$17,260","08/26/2023","","4.1","49","","15,984","7","FBA","2","Arts, Crafts & Sewing","","","","https://www.amazon.com/dp/B0CB8BGLDS"
"","","B0CJBHVV28","Huhumy 4 Pcs Shopping Bag with Wheels Portable Trolley Bags Folding Tote with Wheels Handles Reusable Rolling Shopping Bag Collapsible Trolley Zipper Grocery Cart for Travelling Shopping, 4 Colors","Huhumy","$65.99","15","1","$989.85","09/18/2023","","5","3","","132,173","7","FBA","1","Industrial & Scientific","","","","https://www.amazon.com/dp/B0CJBHVV28"
"","","B09Q5KHJFM","YH&GS Rolling Backpack Floral, Waterproof with Wheels for Business, College Student and Travel Commuter, Carry on Laptop Compartment, Fit 17 Inch Laptop, Wheeled Adults, 20inch","YH&GS","$115.99","","","","01/10/2022","$88.33","4.3","837","$27.66","2,516","7","FBA","1","Laptop Backpacks","Oversize","16 x 21 x 10 in","7.15 lb","https://www.amazon.com/dp/B09Q5KHJFM"
"","","B0BVR7FS84","ETRONIK Rolling Duffle Bag with Wheels, 21 Inch Flight Approved Duffle Bag for Travel with Toiletry Bag, Carry on Luggage Travel Bags for Women with Shoe Compartment, Beige","ETRONIK","$49.99","743","31","$37,143","03/16/2023","","4.5","373","","30,635","7","FBA","2","Clothing, Shoes & Jewelry","","","","https://www.amazon.com/dp/B0BVR7FS84"
"","","B0C2KQCC5W","FabSpace Moving Boxes Heavy Duty Extra Large Moving bags with Strong Zippers  HandlesCollapsible  Reusable Moving SuppliesStorage Containers for Space SavingPacking  Moving 125L,2-pack","FabSpace","$22.99","10,235","14","$235,303","10/05/2023","","4.5","210","","10,179","7","FBA","1","Industrial & Scientific","","","","https://www.amazon.com/dp/B0C2KQCC5W"
"","","B0BZ3BGH1Q","Collapsible Trolley 16 Gallon Capacity Bags Folding Shopping Bag with Wheels Foldable Shopping Cart Reusable Shopping Bags Grocery Bags Shopping Trolley Bag on Wheels (Orange)","ebenchwheel","$13.99","170","6","$2,378","03/20/2023","","2.8","44","","23,056","7","FBA","1","Industrial & Scientific","","","","https://www.amazon.com/dp/B0BZ3BGH1Q"
"","","B087P3SKTZ","M&C Music Color 16pcs Glossy Reusable Grocery Shopping Bag Tote Bag with Handle Christmas Gift Bags Bulk for Party Birthday","M&C Music Color","$15.99","300","10","$4,797","11/16/2019","$7.31","4.7","1,405","$8.68","27,696","7","FBA","1","Kitchen & Dining","Standard","12.5 x 14.9 x 2.6 in","1.349 lb","https://www.amazon.com/dp/B087P3SKTZ"
"","","B095PCN2B8","Extra Large Heavy Duty Moving Bags,Storage Bags with Handles for Packing,8 Large Totes,Waterproof Oversized Organizers,Reinforced Puncture Resistance and Strong Zipper Pulls,Alternative To Moving Box","SOFTKISS","$29.99","227","4","$6,808","10/13/2021","$13.13","4.6","297","$16.86","228,354","6","FBA","1","Home & Kitchen","Oversize","18.66 x 18.9 x 3.94 in","5.399 lb","https://www.amazon.com/dp/B095PCN2B8"
"","","B00363RSVC","Rockland Rolling Duffel Bag","Rockland","$30.49","4,380","166","$133,546","12/12/2023","$12.42","4.2","19,194","$18.07","4,032","5","AMZ","6","Clothing, Shoes & Jewelry","Oversize","13.3 x 24.45 x 5.24 in","4.59 lb","https://www.amazon.com/dp/B00363RSVC"
"","","B071YTZ86J","Lotus Trolley Bag - Reusable Shopping Bags (Set of 4), Grocery Bags with Insulated Cooler & Egg/Wine Holder, Foldable, Washable Grocery Cart Bags, Multi-use Tote Bags (Purple, Turquoise, Blue, Brown)","Lotus Trolley Bag","$47.99","972","30","$46,646","05/03/2017","$28.81","4.6","5,670","$19.18","9,014","7","FBA","1","Kitchen & Dining","Oversize","10.3 x 27 x 4.4 in","1.649 lb","https://www.amazon.com/dp/B071YTZ86J"
"","","B0CLY8LR3J","Foldable Utility Cart with Stair Climbing Wheels,Folding Portable Rolling Crate Handcart with Aluminium Alloy Telescoping Handles, Handcart for Grocery Book File Tool Art Supplies","Fanboxk","$85.99","93","4","$7,997","10/26/2023","","4.3","8","","51,494","7","FBA","1","Office Products","","","","https://www.amazon.com/dp/B0CLY8LR3J"
"","","B092QGSYPY","Vensivy Trolley Folding Shopping Bag Collapsible 2 In 1 Foldable Shopping Portable Cart","Vensivy","$16.99","30","1","$509.70","04/15/2021","$10.67","2.8","241","$6.32","200,513","7","FBA","1","Kitchen & Dining","Standard","8.31 x 15.47 x 1.85 in","0.73 lb","https://www.amazon.com/dp/B092QGSYPY"
"","","B0C8MM5BR5","Medical Bag Rolling Roller Bag Trolley Duffel Nurses EMT CNA RN Empty for First Aid Responder Home Health Care Nursing Student Roll Duffle Bag Carry on with Wheels Wheeled Work Physicians Doctor","Gatycallaty","$59.99","164","6","$9,838","06/19/2023","$35.87","3.8","42","$24.12","22,845","7","FBA","1","Industrial & Scientific","Oversize","12.6 x 12.6 x 19 in","6.75 lb","https://www.amazon.com/dp/B0C8MM5BR5"
"","","B0C9KLZ35V","Cowinbest Folding Shopping Bag with Wheels Collapsible Trolley Bag Foldable Shopping Cart Reusable Shopping Bags Grocery Bag Shopping Trolley Bag on Wheels Hand Bag(Blue-B0C9KLZ35V)","Cowinbest","$17.99","20","1","$359.80","05/11/2023","","3.7","8","","128,657","7","FBA","1","Industrial & Scientific","","","","https://www.amazon.com/dp/B0C9KLZ35V"
"","","B0BRP53443","Bodaon 1-Pack Insulated Reusable Grocery Shopping Bags, X-Large Pizza Delivery Cooler Bag for Hot/Cold Food, Gold","Bodaon","$9.99","9,091","353","$90,819","01/04/2023","$-0.15","4.5","16,757","$10.14","138","7","FBA","1","Industrial & Scientific","Oversize","9 x 13 x 16 in","5.6 oz","https://www.amazon.com/dp/B0BRP53443"
"","","B0B6Y5VR37","Pacific Coast Signature Large Rolling Shopper Tote Bag","Pacific Coast Signature","$85.00","210","7","$17,850","11/09/2018","","4.4","61","","131,968","5","AMZ","1","Clothing, Shoes & Jewelry","","","","https://www.amazon.com/dp/B0B6Y5VR37"
"","","B07V4NHZH8","Handy Sandy Fold Flat Travel Wagon Reusable Grocery/Laundry/Travel/Cruise/School Locker Bag and More on Wheels, Lightweight-Deluxe (Royal Blue)","Handy Sandy","$74.99","","","$0.00","07/15/2019","$51.00","3.9","16","$23.99","757,999","6","FBA","3","Clothing, Shoes & Jewelry","Oversize","11.378 x 15.984 x 8.032 in","5.205 lb","https://www.amazon.com/dp/B07V4NHZH8"
"","","B07VFC67VX","Inspired Living Ultra-Slim Rolling Collapsible Storage Pack-N-Roll Utility-carts, with Telescopic Handle, for Home, Garden, Shopping, Office, School use, Medium, Pink & Black","Inspired Living","$38.99","2,812","106","$109,640","01/28/2020","$21.77","4.4","2,397","$17.22","2,014","6","FBA","1","Office Products","Oversize","15.394 x 16.693 x 3.347 in","4.868 lb","https://www.amazon.com/dp/B07VFC67VX"
"","","B0CDH812DQ","Huntoshon Shopping Bag with Wheels, Portable Trolley Bags Foldable Tote Grocery Cart, Reusable and Collapsible Utility Bag, 360 Swivel Wheels, Large Capacity for Travel and Home (Green)","Huntoshon","$18.99","133","6","$2,526","08/01/2023","","4","5","","25,587","7","FBA","1","Industrial & Scientific","","","","https://www.amazon.com/dp/B0CDH812DQ"
"","","B089N9XD9R","Reusable Grocery Bags with Wheels Foldable Shopping Bags - Waterproof & Strong(Grey Line)","LOHO WONDERZ","$22.99","35","1","$804.65","06/03/2020","$14.40","3.7","430","$8.59","154,849","6","FBA","1","Kitchen & Dining","Standard","6.77 x 15.86 x 2.28 in","1.46 lb","https://www.amazon.com/dp/B089N9XD9R"
"","","B0B68KZ6RV","TIIOCTI Reusable Grocery Bags heavy duty Shopping Box Foldable Saving Space Standing Tote Bag with Long Handles 3 Pacs","TIIOCTI","$24.99","280","8","$6,997","01/17/2023","","4.6","271","","34,563","","FBA","1","Kitchen & Dining","","","","https://www.amazon.com/dp/B0B68KZ6RV"
"","","B0CN5H5BYV","Raynesys 3 in 1 Collapsible Wagon Cart with Wheels 220lbs Foldable Wagon 120L Shopping Cart for Groceries Folding Utility Wagon for Beach, Garden, Camping, Sport, Black","Raynesys","$79.99","2,100","70","$167,979","11/11/2023","","4.5","22","","2,242","7","FBA","1","Patio, Lawn & Garden","","","","https://www.amazon.com/dp/B0CN5H5BYV"
"","","B0C55B4C1S","KOMSURF Foldable Utility Wagons Heavy Duty Folding Cart, 200 lbs Capacity with Side Pockets for Garden, Shopping and Beach Outdoor Use","KOMSURF","$65.99","875","43","$57,741","06/30/2023","","4.5","185","","4,167","7","FBA","5","Patio, Lawn & Garden","","","","https://www.amazon.com/dp/B0C55B4C1S"
"","","B091C77L5Q","2 in 1 Foldable Shopping Cart,Collapsible Two-Stage Zipper Grocery Cart with Wheels Shopping Bag, Multifunction Telescopic Storage Bag for Traveling Shopping (Black)","aotekar","$16.99","96","4","$1,631","03/29/2021","","2.8","531","","37,620","7","FBA","4","Industrial & Scientific","","","","https://www.amazon.com/dp/B091C77L5Q"
"","","B0C8T655H1","HomeHacks Moving Boxes, Heavy Duty Moving Bags, Large Storage Bags with Sturdy Handles for College Move in, Totes for Storage and Camping (88L, 6-Pack, Green Blue Black)","HomeHacks","$25.99","1,213","34","$31,526","09/12/2023","","4.3","80","","3,996","7","FBA","1","Industrial & Scientific","","","","https://www.amazon.com/dp/B0C8T655H1"
"","","B094JLS858","SPACEKEEPER Folding Hand Truck, 500 LB Heavy Duty Luggage Cart, Utility Dolly Platform Cart with 6 Wheels & 2 Elastic Ropes for Luggage, Travel, Moving, Shopping, Office Use, Black","SPACEKEEPER","$47.99","5,087","195","$244,125","05/09/2021","$34.00","4.1","5,427","$13.99","385","7","FBA","7","Industrial & Scientific","Standard","13.23 x 17.68 x 2.28 in","9.129 lb","https://www.amazon.com/dp/B094JLS858"
"","","B0B6F8ZBJR","Jogtlyer Folding Hand Truck Lightweight,Foldable Dolly with 4 Rotate Wheels,110 lbs Heavy Duty Hand cart for Luggage,Dolly for Moving Travel Shopping Airport Office Use","Jogtlyer","$36.99","306","7","$11,319","07/12/2022","","4.4","280","","19,649","7","FBA","4","Industrial & Scientific","","","","https://www.amazon.com/dp/B0B6F8ZBJR"
"","","B0B1LQ7SBL","Kiffun Moving Bags Clear Heavy Duty Extra Large Tote Bag with Zippers Handles & Backpack Trap Easy Packing & Storage for Clothes Blanket 6 Pack","KIFFUN","$32.99","210","7","$6,928","09/12/2022","","4.7","212","","31,908","6","FBA","1","Office Products","","","","https://www.amazon.com/dp/B0B1LQ7SBL"
"","","B0CD5ZBH8B","Collapsible Crate+Folding Hand Truck Set -No Assembly Required-Teacher Collapsible Rolling Cart with Wheels,Shopping Carts for Groceries,Crate On Wheels and Tote Basket,Mobile Storage for File, Book","KUKTDUD","$99.99","176","5","$17,598","07/29/2023","","4.8","37","","44,731","7","FBA","1","Office Products","","","","https://www.amazon.com/dp/B0CD5ZBH8B"
"","","B0B5CXHLT8","BALEINE 6-Pack Oversized Moving Bags with Reinforced Handles, Heavy-Duty Storage Tote for Clothes, Moving Supplies (Grey with Window, 6 Pack)","BALEINE","$26.99","436","15","$11,768","06/28/2022","","4.7","327","","60,402","6","FBA","1","Home & Kitchen","","","","https://www.amazon.com/dp/B0B5CXHLT8"
"","","B08HGPQQLQ","Laundry Hamper with Heavy Duty Rolling Lockable Wheels; Durable Laundry Basket with Detachable Liner Bag; Collapsible Clothes Hamper with Metal Handle (White)","Hermina","$52.99","662","15","$35,079","09/03/2020","$32.30","4.7","998","$20.69","60,569","6","FBA","4","Home & Kitchen","Oversize","20 x 2.7 x 27 in","10.2 lb","https://www.amazon.com/dp/B08HGPQQLQ"
"","","B0B5CMR3G5","BALEINE 6-Pack Oversized Moving Bags with Reinforced Handles, Heavy-Duty Storage Tote for Clothes, Moving Supplies (Blue with Window, 6 Pack)","BALEINE","$25.99","251","11","$6,523","06/28/2022","$15.36","4.7","298","$10.63","79,960","6","FBA","1","Home & Kitchen","Standard","8.39 x 14.21 x 4.45 in","4.251 lb","https://www.amazon.com/dp/B0B5CMR3G5"
"","","B0C27BDND2","EpicTotes Extra Large Moving Bags with Study Handles & Heavy Duty Zippers, Space Saving Packing Bags for Home & Dorm (88L 6-Pack)","EpicTotes","$26.99","7,498","216","$202,371","06/18/2023","","4.2","511","","2,732","7","FBA","1","Home & Kitchen","","","","https://www.amazon.com/dp/B0C27BDND2"
"","","B0B5CK64V1","BALEINE 4-Pack Oversized Moving Bags with Reinforced Handles, Heavy-Duty Storage Tote for Clothes, Moving Supplies (Color Stripe with Window, 4-Pack)","BALEINE","$21.99","266","11","$5,849","06/28/2022","","4.6","378","","81,646","6","FBA","1","Home & Kitchen","","","","https://www.amazon.com/dp/B0B5CK64V1"