"Export time:  2/2/2024, 12:09:16 PM","","ASIN","Product Name","Brand","Price","Monthly Units Sold","Daily Units Sold","Monthly Revenue","Date First Available","Net Revenue","Star Rating","Reviews","Amazon Fees","BSR","LQS","Seller Type","Sellers","Category","Product Tier","Dimensions","Weight","Link"
"","","B0CLM3X6NW","Karceyworth 4 Pack Bed Sheet Organizers and Storage, Foldable Sheet Set Organizer, Bedsheet Storage, Bed Sheet Organizers for for Queen and King Sheets, Duvet Covers, Pillowcases","Karceyworth","$32.99","","","","10/22/2023","","4.5","23","","","7","FBA","1","","","","","https://www.amazon.com/dp/B0CLM3X6NW"
"bedsheet organizer","","B0BT73TJ6K","LINENMATE Twin/Full Size (Ivory 2-Pack) - The Original 2-Pack Linen Storage Container with Sheet-Folding Assisted Panels | Bed Sheets | Duvet Covers | Pillowcases | Towels","LINENMATE","$64.97","943","26","$61,267","01/25/2023","","4.5","174","","35,818","6","FBA","1","Home & Kitchen","","","","https://www.amazon.com/dp/B0BT73TJ6K"
"Average Monthly Sales: 1,891","","B0C9QBRQB4","SpaceAid 4 Pack Bed Sheet Organizers and Storage, Foldable Sheet Organizer for Linen Closet, Sheets Set Folder Keeper with Window XL (Queen & King Size) Organizing Bedding Container, Gray","SpaceAid","$33.98","6,400","279","$217,472","06/28/2023","","4.6","237","","1,846","6","FBA","1","Home & Kitchen","","","","https://www.amazon.com/dp/B0C9QBRQB4"
"Average Revenue: $54,635","","B0CGPF3XT5","Honehome Foldable Bed Sheet Organizer - 2 Pack Dust-Proof Sheet Storage Organizer with Zipper, Queen or King Sheets Organizer for Linen Closet - White","Honehome","$29.99","","","$0.00","09/25/2023","","5","1","","2,035,089","7","FBA","1","Home & Kitchen","","","","https://www.amazon.com/dp/B0CGPF3XT5"
"Average Price: $38.80","","B0C1BK6DCP","SUOCO Modern Fabric Storage Box, Beige, 4-1/2 in W x 15 in D x 12-3/4 in H, Fits 1 Queen/King Sheet Set or Duvet Cover Set","SUOCO","$49.99","2,402","54","$120,076","06/05/2023","$34.56","4.3","152","$15.43","16,620","7","FBA","2","Home & Kitchen","Standard","12.68 x 4.17 x 15.35 in","8.9 lb","https://www.amazon.com/dp/B0C1BK6DCP"
"Average No. of Ratings: 881","","B0B8MNZKVC","Bed Sheet Organizer and Storage Size Label Bands | Sheets Set Organizers for Linen Closet - Labeled Elastic Bedding Sheet Keepers Straps for Organizing Foldable Bedsheet Sets (King 4PCs Pack | Cream)","ECOHomes","$12.99","12,820","976","$166,532","10/28/2022","","4.6","398","","181","7","FBA","1","Home & Kitchen","","","","https://www.amazon.com/dp/B0B8MNZKVC"
"Average Sales Rank: 171,721","","B0CGNPZVG5","SpaceAid 5 Pack Bed Sheet Organizers and Storage, Foldable Sheet Organizer for Linen Closet, Sheets Set Folder Keeper with Window XL (Queen & King Size) Organizing Bedding Container, White","SpaceAid","$46.98","","","","08/25/2023","","4.7","30","","","6","FBA","1","","","","","https://www.amazon.com/dp/B0CGNPZVG5"
"Average Rating Number: 4.6","","B0CB3S75HL","Furnhome 6 Pack Bed Sheet Organizers and Storage, Sheet Organizer for Linen Closet, Foldable Sheet Set Organizer, Sheet Storage Cube for Beding Sheets, Duvet Covers and Pillowcases","Furnhome","$69.99","220","4","$15,398","07/03/2023","","4.5","69","","217,116","7","FBA","3","Home & Kitchen","","","","https://www.amazon.com/dp/B0CB3S75HL"
"","","B0CM397MB2","GODELAIF Bed Sheet Organizer and Storage, Foldable Sheet Set Organizer for Twin/Full/Queen/King Size, Linen Closet Organizers and Storage with Handle for Sheet Set Bedding Clothes Blanket","GODELAIF","$19.99","307","15","$6,137","10/29/2023","","4.8","86","","61,669","7","FBA","1","Home & Kitchen","","","","https://www.amazon.com/dp/B0CM397MB2"
"","","B0CMJBYYYK","MLGOGO Bed Sheet Organizer 8 Pcs. Set (6+2) Foldable Linen Closet Storage Containers for King/Queen Size Sheets & 6 Elastic Bands. Bedding Storage Linen Closet Organizers w/Window & Handle (Black)","MLGOGO","$43.79","300","11","$13,137","11/02/2023","","4.5","13","","81,139","6","FBA","1","Home & Kitchen","","","","https://www.amazon.com/dp/B0CMJBYYYK"
"","","B0C7Z2VPFK","YUOROS Bed Sheet Set Organizer (Queen or King Size), 2 Pack Foldable Linen Closet Organizers and Storage for Bed Sheets, Duvet Covers and Pillowcases (2 Pack, King Size)","YUOROS","$22.99","158","6","$3,632","06/13/2023","","4.6","52","","139,657","6","FBA","3","Home & Kitchen","","","","https://www.amazon.com/dp/B0C7Z2VPFK"
"","","B0CFLRHS3Z","Doosela Bed Sheet Organizers and Storage, 4 Packs Foldable Storage Box with Zipper for Queen or King Sheets, Sheet Storage Cube for Duvet Cover Set, Bedding, Blanket Storage","Doosela","$89.99","846","39","$76,132","08/13/2023","","4.7","19","","23,295","6","FBA","1","Home & Kitchen","","","","https://www.amazon.com/dp/B0CFLRHS3Z"
"","","B0CJJHLSXQ","BigPonPon 3-Pack Foldable Bed Sheets Set Organizers and Storage(King & Queen Size),Linen Fabric Closet Organizers with Window,Folding Bedding Storage Box for Bedsheets and Pillow Cube Organizer","BigPonPon","$29.77","1,825","64","$54,330","09/20/2023","$18.78","4.5","61","$10.99","13,517","7","FBA","1","Home & Kitchen","Standard","12.5 x 4.7 x 15 in","5.13 lb","https://www.amazon.com/dp/B0CJJHLSXQ"
"","","B0CJJHZS33","Bed Sheet Organizers and Storage - 4 Pack (Queen or King Size),Foldable Storage Box for Duvet Cover Set, Linen Closet Organizer for Bedding Clothes Blankets, Grey","Aokeyee","$39.59","637","24","$25,219","09/20/2023","$26.32","4.7","90","$13.27","38,653","6","FBA","1","Home & Kitchen","Standard","12.9 x 5 x 15 in","4.85 lb","https://www.amazon.com/dp/B0CJJHZS33"
"","","B0C9X6TM6T","chinensis 6 Pack Sheet organizer,Bed Sheet Storage,Folding Organizers for Bed Sheets,Sheet Storage Organizer,Sheet Set Organizer,Sheet Storage for Closet,Grey","chinensis","$69.99","422","7","$29,536","07/02/2023","","4.8","67","","127,900","7","FBA","3","Home & Kitchen","","","","https://www.amazon.com/dp/B0C9X6TM6T"
"","","B0CM3DVLCY","DIMJ Bed Sheet Organizers and Storage 6 Pack, Foldable Sheet Bedding Storage Organizer for Linen Closet, Sheet Set Organizersr (Queen & King Size) with Window Handle for Bed Sheets Duvet Covers.(Grey)","DIMJ","$55.99","579","13","$32,418","12/27/2023","","5","5","","71,164","7","FBA","1","Home & Kitchen","","","","https://www.amazon.com/dp/B0CM3DVLCY"
"","","B0CJHT4FPJ","BUFOR Sheet Organizer for Linen Closet, Foldable Bed Sheet Organizer, King Size Sheet Storage 4 Pack, Grey","BUFOR","$39.99","163","5","$6,518","09/20/2023","$26.66","4.7","4","$13.33","166,523","6","FBA","1","Home & Kitchen","Standard","13 x 4.3 x 15 in","2 lb","https://www.amazon.com/dp/B0CJHT4FPJ"
"","","B0CJ28N6W7","SNILOAW Sheets Organizer For Linen Closet, SheetCube Foldable Sheet Organizer (Queen Or King Size) Bed Sheet Organizers Closet Organizers and StorageBedding Organizer (Black, 2 Pack)","SNILOAW","$19.98","638","7","$12,747","10/12/2023","","4.7","20","","118,755","6","FBA","1","Home & Kitchen","","","","https://www.amazon.com/dp/B0CJ28N6W7"
"","","B0C9Q61MDQ","SpaceAid 6 Pack Bed Sheet Organizers and Storage, Foldable Sheet Organizer for Linen Closet, Sheets Set Folder Keeper with Window XL (Queen & King Size) Organizing Bedding Container, Black","SpaceAid","$49.98","1,057","27","$52,829","06/28/2023","","4.6","131","","34,911","6","FBA","2","Home & Kitchen","","","","https://www.amazon.com/dp/B0C9Q61MDQ"
"","","B0C9PL48DM","BIKTIC SheetCube Bed Sheet Organizers and Storage,4 Pack Sheet Folder Organizer (Queen or King Size), Linen Closet Organizer for Bedding Sheets,Duvet Covers and Pillow cases,Grey","BIKTIC","$49.99","1,602","42","$80,084","07/31/2023","","4.8","371","","21,514","7","FBA","4","Home & Kitchen","","","","https://www.amazon.com/dp/B0C9PL48DM"
"","","B0C5WL6CFL","KIMBORA Foldable Bed Sheet Organizer and Storage, 3 Pack King Size Sheet Set Organizer for Linen Closet With Clear PVC Sheet Storage for Bedding Sheets, Duvet Covers and Pillow cases","KIMBORA","$23.99","887","17","$21,279","05/21/2023","$13.06","4.3","124","$10.93","54,386","7","FBA","2","Home & Kitchen","Standard","4.5 x 13 x 15 in","1 lb","https://www.amazon.com/dp/B0C5WL6CFL"
"","","B0CPHJFXGP","HEIBOSO Bed Sheet Organizers and Storage-Linen Closet Organizers and Storage Folding Bedding Storage Foldable Sheet Cube Box Closet Home Organization Box Clothes Blankets Grey(4Pack)","HEIBOSO","$39.90","60","2","$2,394","12/22/2023","","5","8","","386,703","","FBA","1","Home & Kitchen","","","","https://www.amazon.com/dp/B0CPHJFXGP"
"","","B0C9QB47R2","SpaceAid 8 Pack Bed Sheet Organizers and Storage, Foldable Sheet Organizer for Linen Closet, Sheets Set Folder Keeper with Window XL (Queen & King Size) Organizing Bedding Container, Beige","SpaceAid","$62.98","1,274","43","$80,237","06/28/2023","","4.4","127","","21,151","6","FBA","2","Home & Kitchen","","","","https://www.amazon.com/dp/B0C9QB47R2"
"","","B0CLSG7J54","Welyspix 4 Pack Bed Sheet Set OrganizerFoldable Closet Organizers and Storage for Bed Sheets, Bed Sheet Storage Organizer for Duvet Cover Bedding Clothes Pillowcases","Welyspix","$32.99","128","4","$4,223","12/15/2023","","4.4","23","","211,708","7","FBA","1","Home & Kitchen","","","","https://www.amazon.com/dp/B0CLSG7J54"
"","","B0CFQ7RHWF","NEW NOAM 6Pcs Bed Sheet Organizers and Storage Set, 4-pack Cube Storage, Foldable Sheet Set Organizer with 2-pack Clothes Storage, Linen Closet Organizer for Bed Sheets Set or Duvet Covers, Grey","NEW NOAM","$25.99","217","7","$5,640","08/14/2023","","3.8","30","","125,866","7","FBA","1","Home & Kitchen","","","","https://www.amazon.com/dp/B0CFQ7RHWF"
"","","B0CJF6N9BT","KAKALGAME Bed Sheet Organizer for Linen Closet Organizers and Storage, 4 Pack (Queen or King Size) Foldable Sheet Storage Box for Bedding Clothes Blankets Duvet Cover Set - Grey","KAKALGAME","$35.99","198","8","$7,126","09/19/2023","","4.6","52","","115,932","6","FBA","1","Home & Kitchen","","","","https://www.amazon.com/dp/B0CJF6N9BT"
"","","B0CG3GQDMF","KDSZJDV 6 Pack Grey Linen Foldable Sheet Set Organizer, Storage Box, 4-2/3 in W x 15 in L x 12-4/5 in H","KDSZJDV","$46.98","1,145","3","$53,792","08/18/2023","","4.9","171","","278,196","7","FBA","1","Home & Kitchen","","","","https://www.amazon.com/dp/B0CG3GQDMF"
"","","B0CLCZH8FD","TRZZ Sheet Organizers and Storage, 4-Pack, Queen/King Size (Grey), Bed Sheet Organizer, Linen Closet Organizer and Storage for Bed Sheets, Duvet Covers and Pillowcases, 15' L13' W5' H","TRZZ","$49.99","516","17","$25,795","10/18/2023","","4.8","95","","55,087","6","FBA","2","Home & Kitchen","","","","https://www.amazon.com/dp/B0CLCZH8FD"
"","","B0BZYX9GTS","zjdbset 20 PiecesBed Sheet Organizer Bands Bed Sheet Keepers Closet Organization ElasticLinen Labels for Bed Sheet Sets(Queen,King,Full,Twin)","zjdbset","$15.49","2,954","105","$45,757","04/30/2023","","4.5","74","","7,418","6","FBA","3","Home & Kitchen","","","","https://www.amazon.com/dp/B0BZYX9GTS"
"","","B0C4LFRYDR","GZOOGHOME 4 Pack Bed Sheet Organizers and Storage, Sheet Folder Organizer for Linen Closet, Foldable Sheets Set Keeper XL (Queen or King Size) Organizing Bedding Container (Circle Window, Black)","GZOOGHOME","$39.99","819","21","$32,752","05/07/2023","$26.66","4.2","144","$13.33","44,184","7","FBA","2","Home & Kitchen","Standard","4.5 x 12.8 x 15 in","3.1 lb","https://www.amazon.com/dp/B0C4LFRYDR"
"","","B0CJQWBH4N","HUWAILE Sheet Organizers and Storage - 3 Pack Bed Sheet Organizers for All Sheet Sizes, Including Queen/King Size Blankets, Foldable Blanket Organizer/Sheet Storage for Linen Closet, Beige","HUWAILE","$32.99","301","5","$9,930","09/24/2023","$20.41","4.9","50","$12.58","169,005","6","FBA","1","Home & Kitchen","Standard","13 x 5.5 x 15 in","5.9 lb","https://www.amazon.com/dp/B0CJQWBH4N"
"","","B0C16JFJJN","SheetCube 4 Pack Bed Sheet Organizers and Storage, Foldable Bedding Storage Box Container with Window and Label, Linen Closet Organizer Folder for Blanket, Duvet Cover Set, Bed Sheet Set - Grey","SUOCO","$25.49","1,384","88","$35,278","06/05/2023","","4.1","553","","9,246","6","FBA","1","Home & Kitchen","","","","https://www.amazon.com/dp/B0C16JFJJN"
"","","B0BMDRTR54","20Pcs Clear Vinyl Zippered Storage BagsBlankets Storage Bags Plastic Storage Bags for Sweater Clothes Bed Sheet Organizer with Zipper for Closet Linen Sweater Bed Sheet Pillow10.5 x 10.5 x 2.4 Inch","Hlimior","$23.99","476","14","$11,419","11/14/2022","$15.25","4.4","112","$8.74","68,063","7","FBA","1","Home & Kitchen","Standard","1 x 1 x 1 in","1.7 lb","https://www.amazon.com/dp/B0BMDRTR54"
"","","B0CDLFH8PX","Feverdes SheetCube Bed Sheet Organizers and Storage 2 Pack (Queen or King Size),Foldable Bedding Organizer with Zipper,for Bed Sheets, Duvet Covers, Blankets, Pillowcases (Grey)","Feverdes","$39.99","604","7","$24,154","08/02/2023","","4.4","29","","125,613","6","FBA","1","Home & Kitchen","","","","https://www.amazon.com/dp/B0CDLFH8PX"
"","","B0CN14LHFP","BigPonPon 6 Pack Bed Sheets Organizers And Storage (King Size),Foldable Sheet Organizer With Handle For Linen Closet,Bedding Organizer Storage For Sheets, Duvet Cover (Beige","BigPonPon","$64.99","480","13","$31,195","09/20/2023","","4.5","40","","72,135","7","FBA","1","Home & Kitchen","","","","https://www.amazon.com/dp/B0CN14LHFP"
"","","B0CHLW89KK","RUseeN Sheet Organizers and Storage, Foldable Sheet Organizer for Linen Closet, Linen Closet Organizer for Bedding Clothes Blankets (4 Pack)","RUseeN","$29.99","48","2","$1,440","09/07/2023","","4.8","30","","395,809","6","FBA","1","Home & Kitchen","","","","https://www.amazon.com/dp/B0CHLW89KK"
"","","B0C9X6NRN2","Chinensis 3 Pack Sheet Organizers and Storage, Grey, Modern Style, Foldable Box, 5'W x 15'D x 13'H, Made from Eco-Friendly Cationic Fabric","chinensis","$35.99","402","8","$14,468","07/02/2023","","4.8","67","","113,550","7","FBA","2","Home & Kitchen","","","","https://www.amazon.com/dp/B0C9X6NRN2"
"","","B0CG5WQC2N","6Pcs Bed Sheet Organizer and Storage,Foldable Sheet Set Organizer With Labeled Window Handle Zipper Grey Cube Portable Storage Box for Closet Bedding Clothes Towels Blankets","BINBE","$39.99","30","","$1,200","08/20/2023","$26.36","5","1","$13.63","900,488","6","FBA","1","Home & Kitchen","Standard","2 x 2 x 2 in","7.26 lb","https://www.amazon.com/dp/B0CG5WQC2N"
"","","B0CG1BKS67","MSERCUOR Bed Sheet Organizers and Storage Morocco Style [4 Pack/20L] Larger Sheet Folder Organizer for Duvet Cover Set(Queen or King Size), Bedsheet Organizers for Bedding Clothes Blankets, Grey","MSERCUOR","$38.89","530","10","$20,612","08/18/2023","","4.8","69","","94,370","7","FBA","1","Home & Kitchen","","","","https://www.amazon.com/dp/B0CG1BKS67"
"","","B0C59N1F13","Steddi Bed Sheet Organizer Bands, Bed Sheet Storage Label Bands, Sheet Organizer Bands, Sheet Labels for Bedding, Sheet Organizers and Storage for Bed Sheets, Pillow Case, Duvet (Queen)","Steddi","$13.99","140","6","$1,959","08/01/2023","","4.4","16","","140,855","6","FBA","1","Home & Kitchen","","","","https://www.amazon.com/dp/B0C59N1F13"
"","","B0CFXX2BSH","Wesapor Foldable Bed Sheet Set Organizer, 2-Pack Sheet Set Organizer for Linen Closet,Sheet Organizer and Storage for Bedding Clothes Blankets, Bed Sheet Storage Box for Duvet Cover Set","Wesapor","$49.99","476","39","$23,795","08/16/2023","$37.35","5","4","$12.64","23,327","7","FBA","1","Home & Kitchen","Standard","1 x 1 x 1 in","1.83 lb","https://www.amazon.com/dp/B0CFXX2BSH"
"","","B0CCV4C73R","BDZBREN Bed Sheet Set Organizer,4-Pack Foldable Sheet Set Organizer with Zipper for Queen or King Sheets, Duvet Covers, and Pillowcases, Linen Closet Organizer for Bedding Clothes TowelsGrey","BDZBREN","$46.98","156","3","$7,329","07/25/2023","","4.4","36","","263,233","6","FBA","1","Home & Kitchen","","","","https://www.amazon.com/dp/B0CCV4C73R"
"","","B0CKZ4J9S8","MISSLO Bed Sheet Organizers and Storage Queen/King Size Sheet Folder 4 Pack Linen Closet Organizer with Clear Window Blanket Storage Bags for Bedsheets, Pillow Cases, Towels, Clothes","MISSLO","$16.99","323","7","$5,488","11/23/2023","$9.92","4.6","162","$7.07","125,894","6","FBA","3","Home & Kitchen","Standard","14 x 6.5 x 16 in","15.2 oz","https://www.amazon.com/dp/B0CKZ4J9S8"
"","","B0BR3H3Q44","Fixwal 3 Pack Bed Sheet Organizer, Foldable King or Queen Size Sheet Set Organizer Storage Box Containers, Linen Closet Organizer with Zipper for Bedding Sheet, Duvet Covers and Pillowcases(Grey)","Fixwal","$30.99","157","4","$4,865","12/25/2022","","4.5","136","","194,090","6","FBA","4","Home & Kitchen","","","","https://www.amazon.com/dp/B0BR3H3Q44"
"","","B0CMLF6QRH","YUZI 8-Pcs Bed Sheet Organizer Bands - Sheet Organizers and Storage Label Bands Sheet Label for Elastic Bedding Linen Closet Storage Foldable Bed Sheet Straps Set Organizer Sheet Keeper Band","Yuzi","$6.49","311","16","$2,018","01/12/2024","","4.9","14","","59,772","7","FBA","1","Home & Kitchen","","","","https://www.amazon.com/dp/B0CMLF6QRH"
"","","B0CFV9DB72","GKOKG 6 Pack Black Foldable Nylon Storage Boxes for Linen Closet, Bedding, Clothes, Blankets, Duvet Cover Set","GKOKG","$39.99","125","3","$4,999","08/15/2023","","4","14","","262,160","7","FBA","1","Home & Kitchen","","","","https://www.amazon.com/dp/B0CFV9DB72"
"","","B0CB4NSG16","DomiZen 4 Pack Linen Closet Organizers and Bed Sheet Set Foldable Collapsible Storage Boxes with Window for Queen and King Size","DomiZen","$34.99","99","1","$3,464","07/03/2023","","5","6","","648,483","6","FBA","1","Home & Kitchen","","","","https://www.amazon.com/dp/B0CB4NSG16"
"","","B0CGDC3QXW","LOTUSPIE Bed Sheet Set Organizer and Storage 2 Pack (Queen or King Size), Foldable Box for Duvet Cover Set, Closet Organizers for Bedding Clothes Blankets, Storage Containers for Bed Sheets","LOTUSPIE","$25.99","180","3","$4,678","08/22/2023","","4.2","8","","296,476","7","FBA","1","Home & Kitchen","","","","https://www.amazon.com/dp/B0CGDC3QXW"
"","","B085ZV98JM","90L Large Storage Bags, 6 Pack Clothes Storage Bins Foldable Closet Organizers Storage Containers with Durable Handle for Clothing, Blanket, Comforters, Bed Sheets, Pillows and Toys (Gray)","Budding Joy","$24.99","51,020","1,239","$1.27M","03/16/2020","$13.31","4.3","44,789","$11.68","108","6","FBA","4","Home & Kitchen","Standard","11.54 x 14.45 x 6.77 in","2.69 lb","https://www.amazon.com/dp/B085ZV98JM"
"","","B0BT74ZHXK","LINENMATE Queen/King Size (Ivory 2-Pack) - The Original 2-Pack Linen Storage Container with Sheet-Folding Assisted Panels | Bed Sheets | Duvet Covers | Pillowcases | Towels","LINENMATE","$74.97","966","26","$72,421","01/25/2023","$54.89","4.5","174","$20.08","35,818","6","FBA","5","Home & Kitchen","Standard","12 x 4 x 15 in","2.74 kg","https://www.amazon.com/dp/B0BT74ZHXK"
"","","B0CDLJCPTH","Feverdes SheetCube Bed Sheet Set Organizer 4-Pack (Queen or King Size),Foldable Storage Box,Linen Closet Organizer for Bedding Sheets, Duvet Covers,Blankets and Pillow Cases (Ivory)","Feverdes","$59.99","568","16","$34,074","08/02/2023","","4.3","58","","59,011","6","FBA","1","Home & Kitchen","","","","https://www.amazon.com/dp/B0CDLJCPTH"
"","","B0CM95TWGX","Cosyzone Bed Sheet Organizers and Storage 2 Pack (Queen or King Size), Foldable Organizer for Linen Closet, Fabric Container Boxes for Bed Sheets, Duvet Covers, Pillowcases, Blankets,and Clothes(Grey)","Cosyzone","$39.99","400","16","$15,996","10/31/2023","","5","9","","59,247","7","FBA","1","Home & Kitchen","","","","https://www.amazon.com/dp/B0CM95TWGX"
"","","B0CKPRSRKN","MISSEND Bed Sheet Organizers and Storage,4 Pack Foldable Sheet Organizer for Duvet Covers,Blankets and Pillow Case,600D Oxford Fabric Bedding Storage Box with Window,Super Large Size (16.5'L x 12.6'W)","MISSEND","$39.99","60","2","$2,399","12/17/2023","","5","1","","333,238","","FBA","1","Home & Kitchen","","","","https://www.amazon.com/dp/B0CKPRSRKN"
"","","B0CF5DJ67N","DELLAN Bed Sheet Organizer, Linen Closet Organizers and Storage, Foldable Cube Sheet Set Organizer (4 Pack)","DELLAN","$39.99","533","14","$21,315","08/08/2023","","4.6","41","","64,607","6","FBA","1","Home & Kitchen","","","","https://www.amazon.com/dp/B0CF5DJ67N"
"","","B0CFCY6G2J","YUOROS 4 Pack Foldable Bed Sheet Set Organizer (Queen or King Size), Duvet Covers and Pillowcases, Linen Closet Storage Organizer for Bedding (4 Pack, King Size)","YUOROS","$34.99","151","4","$5,283","08/10/2023","","4.9","16","","217,332","6","FBA","2","Home & Kitchen","","","","https://www.amazon.com/dp/B0CFCY6G2J"
"","","B0BVLK6VF2","MINAYI 4 Pieces Sheet Keeper Closet Organization - Bed Sheets Set Storage Organizer -Linen Labels Sheet Organizer (King)","MINAYI","$10.99","767","27","$8,429","03/04/2023","","4.9","35","","34,983","6","FBA","1","Home & Kitchen","","","","https://www.amazon.com/dp/B0BVLK6VF2"