"Export time:  1/27/2024, 12:01:12 PM","","ASIN","Product Name","Brand","Price","Monthly Units Sold","Daily Units Sold","Monthly Revenue","Date First Available","Net Revenue","Star Rating","Reviews","Amazon Fees","BSR","LQS","Seller Type","Sellers","Category","Product Tier","Dimensions","Weight","Link"
"","","B076Z5M1TV","Pinesman - Mouse Pad Notepad for Professionals, Executive's Desk Note Pad, Minimalist, Gold Foiled, Dotted Layout, 9.8' x 7.9, Eco-friendly, FSC Certified","Pinesman","$15.95","676","19","$10,782","10/28/2017","$10.49","4.8","262","$5.46","12,692","8","FBA","2","Office Products","Standard","9.84 x 0.39 x 7.87 in","8.8 oz","https://www.amazon.com/dp/B076Z5M1TV"
"aesthetic desk accessories","","B09L5NRWNF","iCasso Desk Mat, Desk Pad, XXL Large Gaming Mouse Pad + Keyboard Wrist Rest 3Pcs Memory Foam, Easy Typing Pain Relief Ultra Thick Mousepad Keyboard Mat for Computer (Weeds)","iCasso","$23.99","1,608","23","$38,576","09/10/2021","$15.25","4.7","2,645","$8.74","10,641","7","FBA","1","Office Products","Standard","3.15 x 0.01 x 17.32 in","1.59 lb","https://www.amazon.com/dp/B09L5NRWNF"
"Average Monthly Sales: 3,992","","B0CDQ4T2MG","AFIING Dual-Sided Desk Pad, Natural Cork & PU Leather Large Mouse mats for Office and Home Work, Desk Protector Non-Slip, Waterproof, Easy Clean (Light Green, 23.6' x 13.7')","AFIING","$9.99","3,897","129","$38,931","08/03/2023","$4.72","4.6","341","$5.27","1,569","7","FBA","1","Office Products","Standard","2.17 x 2.13 x 14.33 in","9.6 oz","https://www.amazon.com/dp/B0CDQ4T2MG"
"Average Revenue: $45,687","","B0BC8Q6W26","Niniubye Desk Mat, Large Mouse Pad, 32' x 12' XXL Extended Gaming Mousepad, Desktop Decor Desk Pad, Cute Men Women Office Supplies and Accessories, XL Mouse Pad for Laptop & Keyboard, White Flowers","Niniubye","$12.69","728","32","$9,238","08/28/2022","$1.85","4.6","342","$10.84","7,643","7","FBA","2","Office Products","Oversize","12 x 0.12 x 32 in","11.4 oz","https://www.amazon.com/dp/B0BC8Q6W26"
"Average Price: $14.66","","B0C8189NXN","Vanhench Gel Pens 0.5mm Aesthetic Fine Point Pen Black Cute Pens, Office Desk Accessories Japanese Stationary Home Work Essentials Nurse School Supplies, Christmas Birthday Gifts for Women Teen Girls","Vanhench","$9.99","4,361","157","$43,566","08/08/2023","$5.57","4.7","182","$4.42","1,219","8","FBA","1","Office Products","Standard","3.27 x 0.67 x 5.91 in","5 oz","https://www.amazon.com/dp/B0C8189NXN"
"Average No. of Ratings: 3,044","","B0BYNWYK8C","Aesthetic Pen Holder For Your Desk - The Perfect Modern Concrete Pencil Holder Easily Organizes All Pens and Desk Accessories - A Cute Natural Design And Must Have Pen Cup For Your Office Decor","KIBAGA","$9.99","1,481","35","$14,795","03/15/2023","$4.72","4.3","179","$5.27","7,026","7","FBA","1","Office Products","Standard","2.75 x 3.75 x 2.75 in","10.8 oz","https://www.amazon.com/dp/B0BYNWYK8C"
"Average Sales Rank: 14,980","","B0C6ZCNR4Q","INSTOME Pencil Pen Holder for Desk with 3 Drawers - All-In-One Desk Organizer - Perfect Desk Accessories for Office Use - Stylish & Convenient Desk Organizers and Accessories (Beige)","INSTOME","$16.99","212","4","$3,602","06/02/2023","$9.92","4.4","19","$7.07","51,869","6","FBA","1","Office Products","Standard","2.5 x 3 x 2.5 in","14.4 oz","https://www.amazon.com/dp/B0C6ZCNR4Q"
"Average Rating Number: 4.5","","B09P8B45DG","iCasso Keyboard Mouse Pad Set,Desk Pad + Keyboard Wrist Rest Support+Wrist Rest, Easy Typing Pain Relief, 3Pcs (35.415.7 in) Ergonomic XXL Ultra Thick Mousepad Desk Mat (Morlandi)","iCasso","$19.99","1,516","23","$30,305","09/08/2021","$11.85","4.7","2,645","$8.14","10,641","7","FBA","1","Office Products","Standard","3.15 x 0.01 x 17.32 in","1.65 lb","https://www.amazon.com/dp/B09P8B45DG"
"","","B082YFS8N3","STORi SimpleSort 10-Piece Stackable Clear Drawer Organizer Set | Multi-size Trays | Makeup Vanity Storage Bins and Office Desk Drawer Dividers | Made in USA","STORi","$20.99","2,268","79","$47,605","12/19/2019","$11.11","4.7","7,108","$9.88","10,596","7","FBA","1","Home & Kitchen","Standard","9.6 x 11.7 x 5.4 in","2.551 lb","https://www.amazon.com/dp/B082YFS8N3"
"","","B0744NP826","STORi SimpleSort 6-Piece Stackable Clear Drawer Organizer Set | Multi-size Trays | Small Makeup Vanity Storage Bins and Office Desk Drawer Dividers | Made in USA","STORi","$13.49","1,428","42","$19,264","07/20/2017","$5.68","4.8","11,297","$7.81","5,882","7","FBA","1","Office Products","Standard","6.8 x 9.6 x 4.3 in","1.349 lb","https://www.amazon.com/dp/B0744NP826"
"","","B08CXXHGY2","Welaxy Drawer organizers tray Felt storage bins office Desk Draw dividers Morandi Nordic Lifestyle Natural still life Interior Decor 8-Piece Valentine's Day gift (Glacier gray)","Welaxy","$29.99","1,296","28","$38,867","08/05/2018","$20.35","4.6","343","$9.64","9,004","7","FBA","1","Office Products","Standard","8 x 2.4 x 10.8 in","0.88 lb","https://www.amazon.com/dp/B08CXXHGY2"
"","","B07YFBYSQ4","Non-Slip Desk Pad,Mouse Pad,Waterproof PVC Leather Desk Table Protector,Ultra Thin Large Desk Blotter, Easy Clean Laptop Desk Writing Mat for Office Work/Home/Decor(Pink, 23.6' x 13.7')","YSAGi","$7.99","13,375","653","$106,866","07/21/2019","$-2.15","4.7","31,808","$10.14","126","6","FBA","1","Office Products","Oversize","13.7 x 0.5 x 23.6 in","11.3 oz","https://www.amazon.com/dp/B07YFBYSQ4"
"","","B0BXNPMXS6","ZHAIXIAONIAN Desk Pen Organizer, Pen Holder Organizer Storage, Pencil Organizer with 7 Compartments and 1 Drawer, Marker Desk Organizers and Accessories","ZHAIXIAONIAN","$16.99","396","10","$6,728","03/06/2023","","4.4","99","","24,108","7","FBA","1","Office Products","","","","https://www.amazon.com/dp/B0BXNPMXS6"
"","","B0BMTCFQV8","YSAGi Leather Desk Pad Protector, Office Desk Mat, Large Mouse Pad, Non-Slip PU Leather Desk Blotter, Laptop Desk Pad, Waterproof Desk Writing Pad for Home (23.6' x 13.8', Dark Green)","YSAGi","$9.99","47,057","1,688","$470,099","11/17/2022","$4.72","4.6","2,748","$5.27","18","7","FBA","1","Office Products","Standard","2.56 x 2.44 x 14.13 in","8.1 oz","https://www.amazon.com/dp/B0BMTCFQV8"
"","","B0BWTT3WK1","gianotter Paper Letter Tray Organizer with File Holder, 4-Tier Desk Accessories & Workspace Desk Organizers with Drawer and 2 Pen Holder for Office Supplies (Rose Gold)","gianotter","$32.99","5,530","122","$182,435","04/04/2023","","4.6","951","","1,690","6","FBA","2","Office Products","","","","https://www.amazon.com/dp/B0BWTT3WK1"
"","","B0C1YFNYFC","Cute Frog Mouse Pad Desk Pad Kawaii Green Desk Decor Mat, Large Gaming Mouse Pad for Desk Computer Keyboard Laptop, Desk Decor Home Office Accessories for Girl (31.5x15.7 in)-with Stitched Eges Pad","Mechanical Cattle","$17.99","2,081","66","$37,437","04/09/2023","$3.69","4.8","1,282","$14.30","3,526","","FBA","2","Office Products","Oversize","15.75 x 0.12 x 31.5 in","1.34 lb","https://www.amazon.com/dp/B0C1YFNYFC"
"","","B0B8H29D19","BRYTEFY Pastel Transparent Sticky Notes, Set of 4 Pads 3''x3 Clear Sticky Tabs, Translucent Page Flags Book Markers Stickers, Planner Accessories, Bible Journaling Study Office School Supplies","BRYTEFY","$8.95","1,868","54","$16,719","08/02/2022","$4.69","4.4","1,004","$4.26","4,431","6","FBA","1","Office Products","Standard","3.86 x 0.67 x 4.8 in","5.5 oz","https://www.amazon.com/dp/B0B8H29D19"
"","","B0BYS3FQFB","Vintage Mushroom Large Mouse Pad Extended Gaming Mouse Pad Waterproof Desk Mat with Stitched Edge,Non Slip Base Keyboard Mouse pad for Home Office 35.4' X 15.7'","Uiaoiais","$18.99","113","4","$2,146","03/16/2023","$11.00","4.8","50","$7.99","50,554","6","FBA","1","Office Products","Standard","2.87 x 2.05 x 16.89 in","1.26 lb","https://www.amazon.com/dp/B0BYS3FQFB"
"","","B0BXSXJ3VG","Aesthetic 2024 Desk Calendar - Minimal 2023-2024 Desktop Or Wall Calendar Runs Until December 2024 - The Perfect Large Calendar for Easy Planning","ZICOTO","$9.99","613","12","$6,124","03/07/2023","$4.72","4.7","195","$5.27","20,053","7","FBA","1","Office Products","Standard","12 x 0.3 x 15.7 in","11.3 oz","https://www.amazon.com/dp/B0BXSXJ3VG"
"","","B0C7P3WMZC","Lebenrich Rotating Pen Pencil Holder for Desk, 5 Slots Unique White Desk Pen Organizer Easthetic Desktop Supplies and Accessories for Women Girls, Pen Cup Pencil Caddy for Office Home Art Supply","Lebenrich","$9.99","925","30","$9,241","06/10/2023","","4.6","56","","8,307","7","FBA","1","Office Products","","","","https://www.amazon.com/dp/B0C7P3WMZC"
"","","B0CGYWWW99","Martha Stewart Kerry Plastic Stackable Office Desk Drawer Organizers, 6' x 3', 6 Pack, with Gold Trim","Martha Stewart","$24.63","1,170","44","$28,817","08/29/2023","$15.74","4.7","173","$8.89","5,556","6","AMZ","1","Office Products","Standard","3 x 2 x 6 in","1.8 lb","https://www.amazon.com/dp/B0CGYWWW99"
"","","B0BP1N8ZKX","Calculators, Benkaim Desk Calculator,Basic Standard Calculator,12 Digit Large LCD Display Big Button Calculator for School, Home & Business Use(Beige)","Benkaim","$14.99","498","17","$7,465","12/04/2022","","4.8","154","","14,745","6","FBA","1","Office Products","","","","https://www.amazon.com/dp/B0BP1N8ZKX"
"","","B0BYV2KF8F","YKJWW White Mouse Pads Extra Large Desk Pad, Cute Flowers Desk Pad Large Computer Mouse Pad Boho Aesthetic Office Supplies White Mousepad XXL, Mousepad Desk Decor for Women Office 31.5x15.7 in Mat","YKJWW","$18.99","1,718","56","$32,625","03/17/2023","$4.92","4.7","2,080","$14.07","4,283","7","FBA","1","Office Products","Oversize","0.12 x 15.75 x 30.5 in","1.4 lb","https://www.amazon.com/dp/B0BYV2KF8F"
"","","B09VF5YCHW","12 Pack Decorative File Folders Boho Cute File Folder, Letter Size Colored File Folders,1/3-Cut Tabs, 9.5 x 11.5 Inches, for Office, School, Home Office","Generic","$20.00","30","1","$600.00","03/12/2022","$11.86","4.7","79","$8.14","166,108","7","FBA","1","Office Products","Standard","9.49 x 11.57 x 0.83 in","1.151 lb","https://www.amazon.com/dp/B09VF5YCHW"
"","","B0CFFYDP6C","Cute Flowers Desk Mat Pressed Dried Floral Mouse Pad Neutral Beige Sage Green XXL Large Extended Gaming Mousepad Deskmat 31.5x15.75 in, Laptop Keyboard and Mouse Mat for Women Office Gamer Girl","DCJJM","$18.99","381","19","$7,235","08/08/2023","$4.54","4.9","34","$14.45","13,121","7","FBA","1","Office Products","Oversize","15.75 x 0.1 x 31.5 in","1.34 lb","https://www.amazon.com/dp/B0CFFYDP6C"
"","","B092QRPZHL","LISEN Cell Phone Stand,Angle Height Adjustable Stable Cell Phone Stand for Desk,Sturdy Aluminum Metal Phone Holder (Green)","LISEN","$12.99","16,856","643","$218,959","08/17/2022","$8.18","4.5","62,475","$4.81","94","6","FBA","1","Cell Phones & Accessories","Standard","4.57 x 6.54 x 2.99 in","0.71 lb","https://www.amazon.com/dp/B092QRPZHL"
"","","B0CJPCJ6VM","Non-Slip Desk mat, Leather Desk mat, Waterproof PU Leather Desk pad Protector, Large Mouse pad, Easy Clean Laptop Desk Writing Mat for Work/Home/Decor(31.5'x12', White Grey)","AFIING","$16.99","180","5","$3,058","09/22/2023","$10.67","4.2","30","$6.32","42,919","6","FBA","1","Office Products","Standard","2.24 x 2.2 x 12.24 in","10.2 oz","https://www.amazon.com/dp/B0CJPCJ6VM"
"","","B0C5BFBR1T","BLIEVE - Aesthetic Highlighters and Gel Pens With Soft Ink And Tip, No Bleed Dry Fast Easy to Hold, for Bible Journaling Planner Notes School Office Supplies 10 pack (Pastel)","BLIEVE","$9.99","10,728","285","$107,173","05/14/2023","$5.57","4.4","639","$4.42","515","7","FBA","1","Office Products","Standard","6.22 x 0.55 x 7.76 in","3.84 oz","https://www.amazon.com/dp/B0C5BFBR1T"
"","","B09QYW1Q12","Clear Acrylic Notepad Holder Sticky Note Holder Sticky Notepad Holder Acrylic Sticky Note Holder Acrylic Sticky Note Dispenser for Desk Accessories (1 Pack)","Yookeer","$9.99","247","5","$2,468","01/21/2022","$4.95","4.6","170","$5.04","42,829","6","FBA","1","Office Products","Standard","4.02 x 1.97 x 4.8 in","4.2 oz","https://www.amazon.com/dp/B09QYW1Q12"
"","","B0BZV6FBW2","GGIANTGO Pencil Pen Holder for Desk, Office Desk Organizer with drawer, Cute Desktop Stationery Organizer, Business Card/Pen/Pencil/Stationery Holder Storage Box","GGIANTGO","$9.99","236","7","$2,358","03/27/2023","$4.72","4.5","85","$5.27","31,590","7","FBA","1","Office Products","Standard","7.1 x 4.1 x 3.7 in","10.8 oz","https://www.amazon.com/dp/B0BZV6FBW2"
"","","B0BC3L6Z8P","LINFANC 6 Pack Cute Gel Pens, Retractable Quick Dry Gel Ink Pen, Fine Point 0.5mm Black Ink Rolling Ball Gel Pens, Smooth Writing Aesthetic Pens for Home School Office Supplies","LINFANC","$7.97","8,459","252","$67,418","08/25/2022","$3.85","4.5","1,994","$4.12","621","7","FBA","1","Office Products","Standard","0.39 x 0.59 x 5.79 in","0.564 oz","https://www.amazon.com/dp/B0BC3L6Z8P"
"","","B0949DWJCV","Crpich Acrylic Cell Phone Stand, Portable Clear Phone Stand for Desk, Compatible with Phone15 14 13 Pro Max Mini 12 11 Plus SE, Switch, Android Smartphone, Pad, Tablet, Desk Accessories","Crpich","$8.99","8,563","253","$76,981","05/19/2021","$4.73","4.7","8,871","$4.26","429","7","FBA","1","Cell Phones & Accessories","Standard","3.9 x 3.9 x 4.3 in","0.3 lb","https://www.amazon.com/dp/B0949DWJCV"
"","","B088B9S4B2","Poeland Desktop Storage Organizer Pencil Card Holder Box Container for Desk, Office Supplies, Vanity Table Tan","Poeland","$9.99","512","19","$5,115","05/07/2020","$4.72","4.6","4,018","$5.27","13,003","6","FBA","1","Office Products","Standard","4.6 x 4.6 x 5 in","0.571 lb","https://www.amazon.com/dp/B088B9S4B2"
"","","B0C4KNGYM8","Aesthetic Cute Pastel Highlighters Set: 12 Assorted Colors No Bleed Pens Bible Markers Office Essentials Desk Accessories School Study Supplies Journaling Preppy Teen Girl Women Stuff Book Kit","KOUSICOO","$4.99","5,057","143","$25,234","09/14/2023","$1.32","4.2","188","$3.67","1,373","8","FBA","1","Office Products","Standard","4.96 x 0.47 x 6.1 in","3.84 oz","https://www.amazon.com/dp/B0C4KNGYM8"
"","","B0BDLGKM5S","Aesthetic Pastel Sticky Notes Set of 528 with Tabs - Incl. Sturdy Cover to Keep Your Notes Safe - Cute School Accessories, College, Students, Teachers or Office Desk Supplies for Women","ZICOTO","$12.99","939","22","$12,198","09/07/2022","$7.97","4.2","338","$5.02","11,424","7","FBA","1","Office Products","Standard","4.7 x 0.4 x 8.4 in","7.4 oz","https://www.amazon.com/dp/B0BDLGKM5S"
"","","B0C27VMDQP","DOCMON Pencil Holder for Desk, 360 Degree Rotating Pen Holder Desk Organizer, Spinning Makeup Brush Holder, 5 Slots Pen Cup for School, Office, Home, Art Supply (Dark green)","DOCMON","$11.59","465","13","$5,389","04/11/2023","","4.7","137","","18,796","6","FBA","1","Office Products","","","","https://www.amazon.com/dp/B0C27VMDQP"
"","","B095W5SZHT","NODITO Dual-Sided Leather Desk Pad,Blotter for Laptop Computer,Mouse Pad,Writing,Drawing,Arts and Craft Mat (17'x35', Beige/Brown)","Nodito","$24.99","180","14","$4,498","09/14/2021","$9.26","4.7","194","$15.73","17,366","7","FBA","1","Office Products","Oversize","17 x 0.01 x 35 in","1.3 lb","https://www.amazon.com/dp/B095W5SZHT"
"","","B0BRMX3SWH","MDOZQ Office Desk Accessories 2pcs Monitor Memo Board Computer Message Board Office Supplies for Women Men Computer Sticky Note Holder Home Office Accessories Desktop Message Office Decor","MDOZQ","$6.98","11,037","473","$77,038","01/03/2023","$3.01","4.4","645","$3.97","225","7","FBA","4","Office Products","Standard","0.39 x 0.2 x 0.39 in","3.84 oz","https://www.amazon.com/dp/B0BRMX3SWH"
"","","B09QT1MH95","Simplified To Do List Notebook - Aesthetic Daily Planner to Easily Organize Your Tasks And Boost Productivity - Stylish Undated Planner And School or Office Supplies For Women","ZICOTO","$12.99","5,733","131","$74,472","01/19/2022","$7.97","4.7","2,029","$5.02","1,553","7","FBA","1","Office Products","Standard","6.4 x 0.6 x 8.5 in","11.7 oz","https://www.amazon.com/dp/B09QT1MH95"
"","","B09XRYBTXG","RENMTURE Dual-Sided Desk Pad, Natural Cork & PU Leather Large Mouse mats for Office and Home Work, Desk Protector Non-Slip, Waterproof, Easy Clean (Apricot, 36'x17')","RENMTURE","$18.99","2,637","57","$50,077","04/13/2022","$7.20","4.8","1,018","$11.79","4,163","6","FBA","1","Office Products","Oversize","16.93 x 0.08 x 35.43 in","15.5 oz","https://www.amazon.com/dp/B09XRYBTXG"
"","","B0C2TC9HZ7","Lamicall Headphone Stand, Sticky Headset Hanger - Adhesive Headphone Holder Hook Mount, Headset Stand Holder Clip Under Desk, Earphone Clamp for Airpods Max, HyperX, Sennheiser, Pink","Lamicall","$7.99","","","","04/17/2023","","4.7","1,810","","77","7","FBA","1","Video Games","","","","https://www.amazon.com/dp/B0C2TC9HZ7"
"","","B08BZJY7R6","White Cable Clips, Cord Organizer Cable Management, Cable Organizers USB Cable Holder Wire Organizer Cord Clips, 2 Packs Cord Holder for Desk Car Home and Office (5, 3 Slots)","INCHOR","$5.24","7,601","309","$39,829","06/28/2020","$1.53","4.6","16,253","$3.71","147","7","FBA","1","Electronics","Standard","3.82 x 0.59 x 6.73 in","1.06 oz","https://www.amazon.com/dp/B08BZJY7R6"
"","","B0BV37JV9D","MDFAYE Jewelry Dish Trinket Tray for Women, Ring Dish Holder, Unique Cloud Shape Ceramic Plate Cute Things Vanity Aesthetic Room Decor Mother's Day Birthday Christmas Warm House Gifts (White)","MDFAYE","$12.00","1,601","53","$19,212","02/06/2023","","4.8","214","","17,143","6","FBA","1","Clothing, Shoes & Jewelry","","","","https://www.amazon.com/dp/B0BV37JV9D"
"","","B091DN26MQ","Tissue Box Cover Holder, Square with Bottom Belt by Carrot's Den - PU Leather Decorative Organizer for Tabletop, Bathroom, Car, Office | Beige","Carrot's Den","$7.99","10,054","381","$80,331","03/30/2021","$3.87","4.8","2,246","$4.12","1,099","6","FBA","1","Home & Kitchen","Standard","6.9 x 8 x 0.75 in","0.249 lb","https://www.amazon.com/dp/B091DN26MQ"
"","","B0BKVTPT9C","Mr. Pen- Sticky Notes, 12 Pads, 3x3, Vintage Colors, Sticky Pads, Bulk, Colored/Colorful Sticky Notes","Mr. Pen","$8.99","23,663","630","$212,730","10/28/2022","$4.57","4.3","9,386","$4.42","135","6","FBA","1","Office Products","Standard","5.98 x 0.58 x 9.06 in","9.3 oz","https://www.amazon.com/dp/B0BKVTPT9C"
"","","B09WF7JCLD","Colorful Wireless Keyboard and Mouse Combo - 104 Key Wireless Keyboard with Number Pad for Windows PC, Notebook, Laptop (Chocolate)","LETTON","$39.99","","","","03/23/2022","$27.89","4.4","465","$12.10","177","7","FBA","1","Computer Keyboard & Mouse Combos","Oversize","5.75 x 21.46 x 1.93 in","2.619 lb","https://www.amazon.com/dp/B09WF7JCLD"
"","","B0BFQX3YFY","BlissTrends Foot Rest for Under Desk at Work-Versatile Foot Stool with Washable Cover-Comfortable Footrest with 2 Adjustable Heights for Car,Home and Office to Relieve Back,Lumbar,Knee Pain-Black","BlissTrends","$22.99","8,970","237","$206,220","11/22/2022","$13.75","4.5","4,174","$9.24","679","7","FBA","4","Office Products","Standard","11.2 x 2 x 16.9 in","1.28 lb","https://www.amazon.com/dp/B0BFQX3YFY"
"","","B0C9T12YPG","Meekakee Desk Organizer for Laptop Under Desk Cable Management Tray, Office Desk Holder Clamp-On, No Drilling Metal Desk Drawer (White)","Meekakee","$26.90","507","15","$13,638","06/29/2023","","4.7","84","","15,898","6","FBA","1","Office Products","","","","https://www.amazon.com/dp/B0C9T12YPG"
"","","B0C7FW2SGX","Deear Headphone Stand Gaming Headset Holder Universal Aluminum Metal Headphone Holder Hanger with Aluminum Supporting Bar Flexible Headrest ABS Solid Base for All Headphone,White","Deear","$8.50","","","","06/07/2023","","4.5","63","","1,989","7","FBA","1","Video Games","","","","https://www.amazon.com/dp/B0C7FW2SGX"
"","","B09CFP6PFS","Preppy Room Decor Desk Mirror, Table Decr Aesthetic Mirror, Cute Room Decor Table Mirror, Boho Mirror for Desk, Asymmetrical Cloud Mirror","Delma","$8.90","526","13","$4,681","08/11/2021","$3.65","4.4","926","$5.26","72,021","7","FBA","1","Home & Kitchen","Standard","7.874 x 9.449 x 0.787 in","0.441 lb","https://www.amazon.com/dp/B09CFP6PFS"
"","","B0BYVBM7ZG","GGIANTGO Desk Organizer with 2 Drawer, Pencil Pen Holder for Desk, Desk Supplies Organizer for Office Home Art Supplies","GGIANTGO","$9.99","130","3","$1,299","03/17/2023","","4.6","158","","62,843","7","FBA","1","Office Products","","","","https://www.amazon.com/dp/B0BYVBM7ZG"
"","","B0CN138S1B","YEECOK Sticky Notes 3x3 in, 12 Pads, Vintage Colors Self-Stick Note Pads, Sticky Pads Aesthetic, Super Sticking Power, Colorful Sticky Notes Bulk","YEECOK","$6.29","5,972","472","$37,564","12/07/2023","$2.28","4.6","204","$4.01","226","6","FBA","1","Office Products","Standard","6 x 0.5 x 14 in","12 oz","https://www.amazon.com/dp/B0CN138S1B"
"","","B09LQJBCT7","Dosmix Retro Bluetooth Speaker, Vintage Decor, Mini Wireless Bluetooth Speaker, Cute Old Fashion Style for Kitchen Desk Bedroom Office Party Outdoor Accessories for iPhone Android (Green)","Dosmix","$16.99","2,069","63","$35,152","11/13/2021","$11.86","4.3","3,252","$5.13","1,609","7","FBA","1","Electronics","Standard","3 x 4.6 x 2.2 in","0.444 lb","https://www.amazon.com/dp/B09LQJBCT7"
"","","B0B2RF12W8","EZVALO 3 in 1 Charger Station with LED Night Light, Portable Bluetooth Speaker, Wireless Charging Station for Multiple iPhone, Samsung/Huawei/Honor/Xiaomi/Oppo, Gifts for Women, Birthday Tech Gifts","EZVALO","$35.99","682","22","$24,545","08/05/2022","$24.80","4.3","606","$11.19","7,302","7","FBA","3","Cell Phones & Accessories","Standard","8.27 x 9.29 x 3.7 in","2.031 lb","https://www.amazon.com/dp/B0B2RF12W8"
"","","B09WY7KNYZ","minimaliving Pen Holder,Nordic Style Silicone Waterproof Pencil Holder for Desk Simple&Modern Minimalist Makeup Organizer Multifunctional Office Supplies for Home,Kids and School(Beige)","minimaliving","$9.99","1,919","63","$19,171","03/30/2022","$4.95","4.4","762","$5.04","3,772","6","FBA","1","Office Products","Standard","3.3 x 3.9 x 3.9 in","0.231 lb","https://www.amazon.com/dp/B09WY7KNYZ"
"","","B0BZ2ZC67F","INSTOME Desktop Organizer with Pencil Holders,360Rotating Pen Holder for Desk Organizer,9 Compartments and Makeup Brush Holders,Multifunctional Office Supplies for Home,Teachers and School","INSTOME","$14.99","185","8","$2,773","03/18/2023","","4.6","33","","27,446","6","FBA","1","Office Products","","","","https://www.amazon.com/dp/B0BZ2ZC67F"
"","","B0B6VFMT25","UNIONE Pocket & Desktop Beige Calculator with a Bright LCD, Dual Power Handheld Desktop. Color. Business, Office, High School","UNIONE","$12.90","727","20","$9,378","07/17/2022","","4.7","325","","12,131","6","FBA","2","Office Products","","","","https://www.amazon.com/dp/B0B6VFMT25"
"","","B0BV336SLW","Desk Pencil Pen Holder, 5 Slots 360Degree Rotating Pen Organizers for Desk, Desktop Storage Stationery Supplies Organizer, Cute Pencil Cup Pot for Office, School, Home, Art Supply, Dark Green","EDENMS","$13.95","2,718","66","$37,916","02/06/2023","$8.09","4.6","587","$5.86","3,536","7","FBA","1","Office Products","Standard","5.5 x 5.3 x 5.5 in","7.9 oz","https://www.amazon.com/dp/B0BV336SLW"
"","","B0CH7S6C93","Acrylic Sticky Note Holder, 3 x 3 Crystal Clear Acrylic Notepad Holder Acrylic Sticky Note Dispenser for Dorm Room and Office Desk Organizer, 1-Pack","Tecreddy","$9.99","616","23","$6,154","09/03/2023","$4.95","2.8","4","$5.04","10,849","7","FBA","1","Office Products","Standard","3.58 x 2.09 x 3.66 in","1.76 oz","https://www.amazon.com/dp/B0CH7S6C93"
"","","B0BR3B6BWB","Leather Desk Pad, Mouse Pad, Non-Slip Desk Protector Mat, Leather Desk Blotter, Computer Desk Pad, Waterproof Desk Mat for Home Office and Decor - Beige (31.515.7 Inches)","Bloss","$9.99","960","28","$9,590","12/25/2022","$4.72","4.6","275","$5.27","8,806","7","FBA","2","Office Products","Standard","1 x 1 x 15.7 in","11.4 oz","https://www.amazon.com/dp/B0BR3B6BWB"
"","","B0CJR7M79F","Der Rose 3 Packs Fake Plants Artificial Succulents Plants for Room Bathroom Home Office Desk Accessories Decor","Der Rose","$11.99","780","26","$9,352","01/02/2024","","4.2","15","","36,488","","FBA","1","Home & Kitchen","","","","https://www.amazon.com/dp/B0CJR7M79F"
"","","B08LPV1YZK","LeonBach 3 Pack Cactus Cute Pencil Holders, Cute Pen Holder Cactus Storage Containers Cactus Cute Office Decor Desk Decor Accessories, Pink & White & Green","LeonBach","$14.95","277","11","$4,141","10/22/2020","$8.94","4.4","475","$6.01","21,507","6","FBA","1","Office Products","Standard","2.95 x 4.52 x 1.85 in","7.8 oz","https://www.amazon.com/dp/B08LPV1YZK"
"","","B09QSBXBPQ","NatureTouch Sticky Notes 6 Packs, 3 x 3 Inches Adhesive Self-Stick Notes in Eye Protection Paper, Multiple Designs of Memo Pads for Reminders, Office, Home, School, Meeting, 80 Sheets/Pad","NatureTouch","$9.99","2,508","44","$25,055","01/27/2022","$5.42","4.2","573","$4.57","5,546","6","FBA","1","Office Products","Standard","6.18 x 0.63 x 9.29 in","7.4 oz","https://www.amazon.com/dp/B09QSBXBPQ"