"Export time:  2/8/2024, 3:38:38 PM","","ASIN","Product Name","Brand","Price","Monthly Units Sold","Daily Units Sold","Monthly Revenue","Date First Available","Net Revenue","Star Rating","Reviews","Amazon Fees","BSR","LQS","Seller Type","Sellers","Category","Product Tier","Dimensions","Weight","Link"
"","","B09NM5H9ZV","Vplus 100% Compostable Oval Paper Plates 12 inch 125 Pack Super Strong Disposable Paper Plates Bagasse Natural Biodegradable Eco-Friendly Sugarcane Plates for BBQ, Party, Dinner, and Picnic","Vplus","$39.99","985","40","$39,390","12/13/2021","","4.5","584","","19,978","6","FBA","3","Health & Household","","","","https://www.amazon.com/dp/B09NM5H9ZV"
"Natural Disposable","","B0B3JFK95T","Vplus 100% Compostable Oval Paper Plates 12 inch 120 Pack Super Strong Disposable Dinner Plates Natural Biodegradable Eco-Friendly Sugarcane Plates for BBQ, Party, Gathering, and Picnic","Vplus","$36.99","492","13","$18,199","06/07/2022","","4.6","255","","46,282","6","FBA","1","Health & Household","","","","https://www.amazon.com/dp/B0B3JFK95T"
"Average Monthly Sales: 1,687","","B0CGV7BVM6","FEHHTO 100% Compostable Oval Paper Plates, 12.5Inch 50Pack Disposable Heavy Duty Bagasse Platters Eco-Friendly Biodegradable Sugarcane Plates for BBQ, Party, Picnic - Natural Brown","FEHHTO","$18.99","78","4","$1,481","08/28/2023","","4.7","54","","113,379","6","FBA","1","Health & Household","","","","https://www.amazon.com/dp/B0CGV7BVM6"
"Average Revenue: $35,658","","B091CCS36H","Vplus 150 Pack Compostable Disposable Paper Plates 10 inch Super Strong 100% Bagasse Natural Biodegradable Eco-Friendly Sugarcane Plates(nature)","Vplus","$29.99","6,667","226","$199,943","03/29/2021","$17.86","4.6","1,985","$12.13","4,043","6","FBA","1","Health & Household","Standard","10.4 x 7.48 x 10.4 in","7.16 lb","https://www.amazon.com/dp/B091CCS36H"
"Average Price: $25.08","","B07MQG9H6R","100% Compostable Paper Plates, Heavy Duty Disposable Plates [125-Pack] 9 Inch Plates - Eco-Friendly, Biodegradable Sugarcane Bagasse, Natural Unbleached Brown 9' Dinner Paper Plate Disposable","Stack Man","$21.99","19,241","649","$423,110","01/09/2019","$15.77","4.7","20,325","$6.22","1,182","7","FBA","1","Health & Household","Standard","9 x 0.5 x 9 in","0.01 oz","https://www.amazon.com/dp/B07MQG9H6R"
"Average No. of Ratings: 1,468","","B0C5MGG3PC","JOYFULOCEAN Paper Plates, 125 Count Compostable Paper Plates, 7 Inch Heavy-Duty 100% Bagasse Natural Disposable Plates for Party, Biodegradable Eco-Friendly Sugarcane Fibers Party Plates","JOYFULOCEAN","$14.99","1,236","41","$18,528","06/16/2023","","4.7","113","","19,452","7","FBA","1","Health & Household","","","","https://www.amazon.com/dp/B0C5MGG3PC"
"Average Sales Rank: 80,883","","B0CM3DS2BP","Tiaiidi 200 Pack Compostable Natural Paper Bowls,8 oz Disposable Paper Bowls,Eco-Friendly Sugarcane Bowls,Heavy Duty Small Bagasse Bowls for Salad,Snack,Soup,Party Serving Treats","Tiaiidi","$19.99","1,175","54","$23,488","10/29/2023","","4.1","462","","15,650","7","FBA","1","Health & Household","","","","https://www.amazon.com/dp/B0CM3DS2BP"
"Average Rating Number: 4.5","","B09ZMSFPCW","Reli. Compostable Paper Plates, 10 Inch (130 Pack Bulk) | 3-Compartment | Brown Disposable Plates 10' | Heavy Duty Paper Plates, Sectioned | Made of Sugarcane Fibers/Bagasse - Biodegradable | Natural","Reli.","$26.99","","","$0.00","05/14/2023","","4.9","31","","345,405","6","FBA","1","Health & Household","","","","https://www.amazon.com/dp/B09ZMSFPCW"
"","","B091CBCQB1","Vplus 150 Pack Compostable Disposable Paper Plates made of 100% Bagasse Natural Biodegradable Eco-Friendly Sugarcane, Super Strong, 10 inch (white)","Vplus","$29.99","6,398","226","$191,876","03/29/2021","$17.86","4.6","1,985","$12.13","4,043","6","FBA","2","Health & Household","Standard","10.63 x 10.669 x 7.52 in","7.057 lb","https://www.amazon.com/dp/B091CBCQB1"
"","","B0CBJG3C43","Vplus 125 Pack 6 inch Paper Plates 100% Compostable Plates Heavy-Duty Disposable Small Paper Plates Bagasse Natural Biodegradable Eco-Friendly Sugarcane Plates(Nature)","Vplus","$11.47","3,307","198","$37,931","07/09/2023","","4.6","495","","4,630","6","FBA","2","Health & Household","","","","https://www.amazon.com/dp/B0CBJG3C43"
"","","B07X5265HW","Paper Bowls, 100% Compostable Disposable Soup Bowl [125-Pack] - (PFAS-Free) - (BPI Certified) - [12 oz] Heavy Duty, Eco-Friendly, Biodegradable Bagasse Hot Food Plates and Bowls - Natural Brown","Stack Man","$17.99","6,125","215","$110,189","08/26/2019","$9.50","4.7","9,025","$8.49","4,241","7","FBA","1","Health & Household","Standard","6.8 x 1.5 x 6.8 in","2.49 lb","https://www.amazon.com/dp/B07X5265HW"
"","","B0BZR41LBL","Cmkura 200 Pcs 4 oz Natural Sugarcane Biodegradable Bowls Disposable Paper Bowls Compostable Soup Bowls for Salad,Hot Soup,Pasta and Dessert","Cmkura","$17.99","398","17","$7,160","05/21/2023","","4.2","80","","39,476","6","FBA","1","Health & Household","","","","https://www.amazon.com/dp/B0BZR41LBL"
"","","B0BDRYBX1L","ECO SOUL 100% Compostable, Biodegradable, Disposable Palm Leaf Plates | Like Bamboo Plates, Eco-friendly 6' | Sturdy, Microwave & Oven Safe | Party, Wedding, Event Plates (100 Count 6', Square)","ECO SOUL","$47.49","617","19","$29,301","09/08/2022","","4.4","153","","35,375","6","FBA","1","Health & Household","","","","https://www.amazon.com/dp/B0BDRYBX1L"
"","","B091JF1CYS","Rael Disposable Underwear for Women, Organic Cotton Cover - Incontinence Pads, Postpartum Essentials, Disposable Underwear, Unscented, Maximum Coverage (Size L-XL, 8 Count)","Rael","$14.99","14,541","483","$217,970","03/31/2021","$8.22","4.6","3,511","$6.77","1,712","6","FBA","2","Health & Household","Standard","5.9 x 7.5 x 7.5 in","14.89 oz","https://www.amazon.com/dp/B091JF1CYS"
"","","B09SXHHV61","Foliumware Single Use Sal Leaf Plates (11 inch, 25/pack) | Zero Waste, Biodegradable, Backyard Compostable | For Parties, Picnics, BBQs, Weddings, Outdoor Festivals, 11inch Plates","Foliumware","$39.99","34","1","$1,360","02/19/2022","$27.56","4.5","74","$12.43","239,062","6","FBA","1","Health & Household","Standard","9.3 x 10.6 x 4.7 in","2.449 lb","https://www.amazon.com/dp/B09SXHHV61"
"","","B00X4LZMW8","Naturally Natures Bamboo Disposable Diaper Liners (2PK) 200 Sheets Gentle and Soft, Chlorine and Dye-Free, Unscented, Biodegradable Inserts (Set of 2) 200 Liners","Naturally Nature","$15.97","250","10","$3,993","05/03/2015","$10.03","4.6","1,213","$5.94","10,045","6","FBA","1","Baby","Standard","3 x 2 x 5 in","4.96 oz","https://www.amazon.com/dp/B00X4LZMW8"
"","","B0BWWC53YG","Naturally Chic Palm Leaf Plates 10 Inch & 7 Inch Square Bamboo Plates [50-Pack] - Biodegradable and Compostable Plates Set with Appetizer and Dinner Plates - Wood Disposable Plates Party Pack","Naturally Chic","$27.99","318","1","$8,901","02/25/2023","","4.6","94","","231,350","6","FBA","5","Health & Household","","","","https://www.amazon.com/dp/B0BWWC53YG"
"","","B07B5VX5DZ","Naturally Chic Palm Leaf Bowls - 5 Inch Round - Bamboo Like, Eco Friendly, Disposable, Compostable and Biodegradable Bowls for Catering, Weddings and Parties","Naturally Chic","$18.95","137","4","$2,596","07/17/2016","","4.6","577","","101,977","7","FBA","1","Health & Household","","","","https://www.amazon.com/dp/B07B5VX5DZ"
"","","B07F9VFBZJ","Little Toes Natural Disposable Swimmy Baby Diapers, Small (Pack of 12)","Products On The Go","$18.35","288","8","$5,285","07/04/2018","$11.83","4.6","96","$6.52","12,153","4","FBA","1","Baby","Standard","4 x 8.5 x 12.5 in","9.6 oz","https://www.amazon.com/dp/B07F9VFBZJ"
"","","B09ZMRX6XG","Reli. Compostable Paper Plates, 10 Inch (50 Pack) | 3-Compartment | Brown Disposable Plates 10' | Heavy Duty Paper Plates, Sectioned | Made of Sugarcane Fibers/Bagasse - Biodegradable | Natural","Reli.","$15.99","","","$0.00","05/14/2023","","4.7","32","","344,539","6","FBA","1","Health & Household","","","","https://www.amazon.com/dp/B09ZMRX6XG"
"","","B0CKQSP3GL","LSGIHFD Disposable Bamboo Cutlery Set, 100% All-Natural, 200 pieces (100 Forks, 50 Spoons, 50 Knives), Eco-Friendly Biodegradable Disposable Cutlery for Party, Camping, Weddings","LSGIHFD","$19.99","150","5","$2,998","10/06/2023","","4.7","11","","98,212","7","FBA","1","Health & Household","","","","https://www.amazon.com/dp/B0CKQSP3GL"
"","","B0B2QY8WD1","ECO SOUL 100% Compostable Plant-Based (PFAS-Free) 16oz Hot Cups with Compostable Lids | (100 Count, 16 oz Hot Cups) | Disposable Bagasse Paper Cups | Eco-friendly Cups | Sturdy, Microwave & Oven Safe","ECO SOUL","$49.99","390","13","$19,496","08/12/2022","","4.5","160","","46,787","6","FBA","1","Health & Household","","","","https://www.amazon.com/dp/B0B2QY8WD1"
"","","B09ZNW1MZY","Dame Products Body Wipes - Cleansing and Nourishing - pH-Balanced Formulated with Aloe and Cucumber Extract - Disposable and Flushable - 15 Count","Dame Products","$9.60","124","5","$1,190","08/28/2022","$5.29","4.2","44","$4.31","89,117","6","FBA","2","Health & Household","Standard","3.4 x 3 x 4.3 in","5.29 oz","https://www.amazon.com/dp/B09ZNW1MZY"
"","","B08MY3HC8X","ECO SOUL 100% Compostable Cutlery [175-Pack] Disposable Wooden Cutlery Set I 100% Natural, Sturdy, Eco-friendly, Utensils Set I Biodegradable (75 Fork,50 Spoon, 50 Knife)","ECO SOUL","$14.45","220","12","$3,179","02/20/2021","$1.06","4.2","562","$13.39","51,048","6","FBA","1","Health & Household","Oversize","10.39 x 10.47 x 8.62 in","6.991 lb","https://www.amazon.com/dp/B08MY3HC8X"
"","","B01G0UUYAY","Naturally Chic 6 Inch Small Square Palm Leaf Plates - Like Tiny Bamboo Appetizer Plates Disposable, Compostable and Biodegradable Dessert Plates for Weddings, Parties and Events - 25 pack","Naturally Chic","$11.95","382","13","$4,565","11/04/2017","$5.02","4.7","665","$6.93","48,325","6","FBA","2","Health & Household","Standard","6.098 x 6.098 x 3.598 in","1.191 lb","https://www.amazon.com/dp/B01G0UUYAY"
"","","B0BFNXCZZ7","Perfectware 100% Compostable 3 Comp Take Out Food Containers 9x9'. 25 Containers, Natural Disposable Bagasse, Eco-Friendly Biodegradable Made of Sugar Cane, Green (PW3comptbagasse-25ct)","Perfectware","$12.99","452","16","$5,871","09/16/2022","$4.61","4.4","259","$8.38","40,478","7","AMZ","1","Health & Household","Standard","4.3 x 2.5 x 8.6 in","3.05 lb","https://www.amazon.com/dp/B0BFNXCZZ7"
"","","B08F82MK6T","Paper Bowls, 100% Compostable Disposable Soup Bowl [125-Pack] - {PFAS-Free} - {BPI Certified} - [16 oz] Heavy Duty, Eco-Friendly, Biodegradable Bagasse Hot Food Plates and Bowls - Natural Brown","Stack Man","$20.99","2,436","81","$51,132","08/03/2020","$11.11","4.7","2,227","$9.88","10,875","7","FBA","3","Health & Household","Standard","7 x 1.5 x 7 in","4.41 lb","https://www.amazon.com/dp/B08F82MK6T"
"","","B09KLQP8K7","Gezond Compostable Napkins 50 Count Unbleached Recyclable Lunch Napkins 13'x13' 2-ply Eco-friendly Paper Napkins Soft And Absorbent Disposable Bamboo Napkins for Kitchen, Party, Wedding","Gezond","$7.99","180","6","$1,438","11/27/2021","","4.4","111","","81,723","6","FBA","1","Health & Household","","","","https://www.amazon.com/dp/B09KLQP8K7"
"","","B01BPN8BCO","AWOW Wipes for Adults - Natural 200 Large Body Wipes for Adults Bathing, Adult Wipes for Incontinence, Unscented Bath Wipes for Adults No Rinse, 50 Count (Pack of 4)","AWOW Professional","$29.99","133","4","$3,989","12/20/2011","$21.72","4.4","593","$8.27","108,929","6","FBA","2","Health & Household","Standard","5.5 x 7.5 x 10.5 in","9.98 oz","https://www.amazon.com/dp/B01BPN8BCO"
"","","B089KVQ2DL","Earth's Natural Alternative 100% Compostable Paper Bowls [32oz 50 Pack] Soup Bowls, Pasta Bowls, Cereal, Salad, Ice Cream, Disposable Bamboo Large Bowls, Biodegradable, Unbleached","Earth's Natural Alternative","$16.99","727","25","$12,352","06/01/2020","$8.65","4.6","1,825","$8.34","28,655","7","FBA","1","Health & Household","Standard","8 x 5.5 x 8 in","2.54 lb","https://www.amazon.com/dp/B089KVQ2DL"
"","","B0CD7WVLFL","Zhehao 380 Count Compostable Cutlery, No Plastic 140 Forks 120 Spoons 120 Knives, Large Disposable Utensils Heavy-duty Eco Friendly Flatware Combo Set for Party Wedding BBQ Picnic Camping","Zhehao","$22.99","30","1","$689.70","07/30/2023","","4.2","3","","208,673","7","FBA","1","Health & Household","","","","https://www.amazon.com/dp/B0CD7WVLFL"
"","","B099WTJCDR","Qiuttnqn 100 Pack Compostable 12oz Paper Bowls,Heavy-Duty Quality Natural Paper Bowls Disposable,Natural Plant Fiber Dinner Bowls for Snacks,Parties,Picnics,Banquets and Barbecues","Qiuttnqn","$13.99","454","12","$6,351","07/19/2021","$6.10","4.4","303","$7.89","50,024","6","FBA","1","Health & Household","Standard","5.94 x 11.77 x 5.63 in","2.291 lb","https://www.amazon.com/dp/B099WTJCDR"
"","","B07LFMWS4J","110 Count Natural Bulk Disposable Bowls - 8 oz Paper Bowls Disposable Eco-Friendly Compostable Bowls - 100% Natural Sugarcane Bagasse Fiber Biodegradable Bowls - Heavy Duty Bowls for Hot Soup, Salad","brheez","$17.99","30","1","$539.70","12/16/2018","$10.15","4.4","175","$7.84","232,449","5","FBA","1","Health & Household","Standard","3 x 3 x 8 in","2 lb","https://www.amazon.com/dp/B07LFMWS4J"
"","","B082TTFZFJ","100% Compostable Clamshell Take Out Food Containers [6x6' 50-Pack] Heavy-Duty Quality to go Containers, Natural Disposable Bagasse, Eco-Friendly Biodegradable Made of Sugar Cane Fibers","Stack Man","$15.99","625","25","$9,994","12/15/2019","$7.80","4.7","2,777","$8.19","29,322","7","FBA","1","Health & Household","Standard","6 x 3 x 6 in","2.28 lb","https://www.amazon.com/dp/B082TTFZFJ"
"","","B0C2V8TDT6","Momcozy Bamboo Fiber Disposable Nursing Pads, 100% Natural Materials and 100% Biodegradable Breast Pads, Breastfeeding Essentials for Moms, 80 Count","Momcozy","$12.99","1,050","35","$13,640","06/21/2023","","4.4","249","","3,573","7","FBA","1","Baby","","","","https://www.amazon.com/dp/B0C2V8TDT6"
"","","B09454YVH2","100% Compostable 9 Inch Heavy-Duty [125-Pack] Eco-Friendly Disposable White Bagasse Plate, Made of Natural Sugarcane Fibers - 9' Biodegradable Paper Plates by Stack Man","Stack Man","$21.99","7,542","262","$165,849","05/03/2021","$13.55","4.7","4,566","$8.44","3,452","7","FBA","2","Health & Household","Standard","9 x 0.5 x 9 in","1 lb","https://www.amazon.com/dp/B09454YVH2"
"","","B0BV27VRC5","100 Pack 2 Ply Burlap Paper Napkins Disposable Dinner Napkin Rustic Natural Brown Hand Napkin Towel for Vintage Country Tan Picnic Bathroom Farmhouse Kitchen Wedding Birthday Party, 15.75 x 12.99 Inch","Glenmal","$19.99","65","2","$1,299","03/11/2023","$11.85","4.4","21","$8.14","180,567","7","FBA","1","Health & Household","Standard","9.57 x 2.01 x 9.92 in","1.12 lb","https://www.amazon.com/dp/B0BV27VRC5"
"","","B081PDR48W","Paper Plates, 100% Compostable Heavy Duty Disposable 10 Inch Plate - [125-Pack] - {PFAS-Free} - {BPI Certified} Eco-Friendly, Biodegradable Bagasse Natural Brown 10' Dinner Plates - By Stack Man","Stack Man","$26.99","5,026","175","$135,652","11/17/2019","$17.80","4.7","2,785","$9.19","5,248","7","FBA","3","Health & Household","Standard","10 x 0.5 x 10 in","1 lb","https://www.amazon.com/dp/B081PDR48W"
"","","B0CJV1Q82S","Momcozy Bamboo Fiber Disposable Nursing Pads, 100% Natural Materials and 100% Biodegradable, Skin Contacts Only Most Natural Materials, for Sensitive Skin, Individually Packaged120 Count","Momcozy","$17.99","120","5","$2,159","02/07/2024","$9.50","1","1","$8.49","17,270","7","AMZ","1","Baby","Standard","6.93 x 5.47 x 8.03 in","1.43 lb","https://www.amazon.com/dp/B0CJV1Q82S"
"","","B07GRDPR4X","Better than Bamboo 50 8' Disposable Square Palm Leaf Plates + 100 Cutlery (50 Forks, 50 Knives) or Wood Plates. Heavy Duty, 100% Compostable & Biodegradable Eco Friendly Party Plates (8 inch)","Better than Bamboo","$31.99","629","25","$20,122","08/21/2018","$23.65","4.7","1,058","$8.34","28,936","7","FBA","3","Health & Household","Standard","8.11 x 16.14 x 3.82 in","0.04 lb","https://www.amazon.com/dp/B07GRDPR4X"
"","","B07QY23ZV3","Paper Plates, 100% Compostable Heavy Duty, Disposable 7 Inch, Small Dessert Plate - [125-Pack] - {PFAS-Free} - {BPI Certified} Eco-Friendly, Biodegradable Bagasse Natural Brown 7' Small Plates","Stack Man","$15.99","3,865","129","$61,801","04/17/2019","$8.45","4.5","7,873","$7.54","7,101","7","FBA","2","Health & Household","Standard","7 x 0.5 x 7 in","1 lb","https://www.amazon.com/dp/B07QY23ZV3"
"","","B0BZDXRG5S","Three Leaf 7 COMPARTMENT BAGASSE ROUND PLATE, 100 Ct. Heavy-Duty- Super Strong- Natural- Eco-Friendly Disposable Bagasse Plates, 100% Biodegradable 7 compartment plates","Three Leaf","$49.99","240","8","$11,998","03/22/2023","","4.3","30","","64,698","6","FBA","1","Health & Household","","","","https://www.amazon.com/dp/B0BZDXRG5S"
"","","B09ZN3M5Z1","Reli. Compostable Paper Bowls, 16 oz (25 Pack) | Brown Paper Bowls, Disposable | Eco-Friendly, Heavy Duty Soup Bowl | Biodegradable, Sugar Cane Fiber Material | Small Bagasse Bowl (Natural)(16oz)","Reli.","$7.99","66","4","$527.34","05/14/2023","","4.4","39","","102,720","6","FBA","1","Health & Household","","","","https://www.amazon.com/dp/B09ZN3M5Z1"
"","","B0BVHNSLGZ","100% Compostable Paper Bowls 16 oz Disposable 150 Pack, Made of Natural Bagasse, Biodegradable Paper Bowls Disposable Heavy Duty, Eco-Friendly Disposable Bowls Bulk for Party and Daily Diet","Sakuchi","$14.99","178","6","$2,668","02/10/2023","","4.7","154","","80,326","6","FBA","1","Health & Household","","","","https://www.amazon.com/dp/B0BVHNSLGZ"
"","","B08BX53LYC","Disposable Plant Fiber Souffle Cups 2 oz Natural Compostable Perfect for Condiments Small Portion & Samples Eco Friendly Paper Alternative - Natural","brheez","$23.99","829","42","$19,888","06/25/2020","$15.32","4.5","866","$8.67","3,154","7","FBA","2","Industrial & Scientific","Standard","10.83 x 2.44 x 13.54 in","1.12 lb","https://www.amazon.com/dp/B08BX53LYC"
"","","B0BHTTXCM5","Naturally Chic Small 6 Inch Round Palm Leaf Dessert Plates - 50 Pack - Same as Disposable Bamboo Plates for Appetizers and Cocktails - Compostable and Eco-Friendly","Naturally Chic","$19.95","256","9","$5,107","02/05/2023","","4.6","774","","64,509","6","FBA","1","Health & Household","","","","https://www.amazon.com/dp/B0BHTTXCM5"
"","","B0BS4HN5TW","100% Compostable Disposable Paper Plates [125-Pack] - (PFAS-Free) - (BPI Certified) - [9 Inch] Heavy Duty, Eco-Friendly, Biodegradable Bagasse Dinner Plates - Natural Brown 9' Plate by Plate'O'Stack","Plate 'O' Stack","$19.95","226","8","$4,509","01/09/2023","","4.7","117","","67,518","7","FBA","2","Health & Household","","","","https://www.amazon.com/dp/B0BS4HN5TW"
"","","B07YD5TC31","Gezond 250Pcs Disposable Paper Plates Set, Compostable Plate Sugarcane Utensils Eco Friendly Dinnerware Kit Includes 50 Biodegradable Plates, Forks, Knives and Spoons for Brithday Party Camping","Gezond","$26.99","1,058","34","$28,555","09/26/2019","$15.01","4.7","1,466","$11.98","22,987","6","FBA","1","Health & Household","Standard","12.2 x 16.14 x 5.71 in","4.98 lb","https://www.amazon.com/dp/B07YD5TC31"
"","","B07LFNGZFM","EcoQuality 300 Count 40oz Round Disposable Bowls with Dome Lids Natural Sugarcane Bagasse Bamboo Fibers Sturdy Compostable Eco Friendly Environmental Paper Plastic Bowl Alternative Tree Free","EcoQuality","$175.95","","","$0.00","12/16/2018","","","","","511,257","7","FBM","1","Health & Household","","","","https://www.amazon.com/dp/B07LFNGZFM"
"","","B0C9FMPQYX","ECO AURA Square Compostable Natural Palm Leaf Plates - Biodegradable, Disposable, Like Bamboo Plates - Eco Friendly Plates, Perfect for Parties, Weddings, and Events, 50 Pack - 8 Inch","ECO AURA","$25.19","90","4","$2,267","06/26/2023","","4.6","62","","102,884","6","FBA","1","Health & Household","","","","https://www.amazon.com/dp/B0C9FMPQYX"
"","","B00IRX5YJY","100% Compostable Disposable Paper Plates Bulk [9' 50 Pack], Bamboo Plates, Eco Friendly, Biodegradable, Sturdy Large Dinner Party Plates, Heavy-Duty, Unbleached by Earth's Natural Alternative","Earth's Natural Alternative","$13.99","1,279","46","$17,893","02/25/2014","$6.75","4.7","10,228","$7.24","17,663","7","FBA","3","Health & Household","Standard","9.06 x 9.17 x 2.8 in","1.739 lb","https://www.amazon.com/dp/B00IRX5YJY"
"","","B0C6B6ZL9D","Worldfront Naturals Compostable Paper Plates 9 Inches, 50 pack, Eco-Friendly & Natural Disposable Plates, Made of 100% Biodegradable Materials Eco Plates","Worldfront","$10.99","","","$164.85","05/24/2023","","","","","318,132","7","FBA","1","Health & Household","","","","https://www.amazon.com/dp/B0C6B6ZL9D"
"","","B0716DV6LD","[100 COUNT]Sugarfiber by Harvest Pack 9-inch Round Disposable Compostable Paper Plates, Heavy-Duty Natural Bagasse Biodegradable Plate, Made From Eco-Friendly Sugarcane Plant Fibers","Harvest Pack GOURMET SHOWCASE","$16.99","405","12","$6,881","02/22/2017","$8.01","4.7","1,321","$8.98","51,626","6","FBA","1","Health & Household","Standard","7.95 x 8.43 x 4.17 in","3.1 lb","https://www.amazon.com/dp/B0716DV6LD"
"","","B08HRRSB99","BANBU Bamboo Utensils Disposable- 100 PK Bamboo Forks Disposable 100% Compostable Biodegradable Renewable Natural Cutlery Fork 6.7' for Travelling Camping","Banbu","$16.99","421","15","$7,153","02/11/2021","$10.67","4.6","245","$6.32","42,575","7","FBA","1","Health & Household","Standard","7.598 x 11.378 x 0.984 in","0.741 lb","https://www.amazon.com/dp/B08HRRSB99"
"","","B0B9T49XYS","Disposable Cloth-Like Paper Napkins, 200 Pack 12' x 17' Linen-Feel Natural Color Dinner Napkins Recycled, For Wedding, Party, Kitchen Or Bathroom","NAPEREE","$28.99","120","4","$3,479","08/15/2022","","4.7","81","","112,543","6","FBA","1","Health & Household","","","","https://www.amazon.com/dp/B0B9T49XYS"
"","","B0CFKQ5M5S","LeonBach 100 Pack 16oz Natural Sugarcane Paper Bowls, Compostable Salad Bowls Biodegradable Cereal Bowl Disposable Heavy Duty Paper Bowls Bulk for Soup Snack Ice Cream Chips Popcorn","LeonBach","$14.95","157","6","$2,347","08/13/2023","","4.6","7","","79,046","7","FBA","1","Health & Household","","","","https://www.amazon.com/dp/B0CFKQ5M5S"
"","","B0CLV4T23X","VIVI SKY K Cup Filters Disposable with Lid, 100 Count Coffee Filters K Cup Paper Filters for Keurg Brewers Single Serve 1.0 and 2.0 Reusable K Cup Coffee Pods(Natural with Lid, 100)","VIVI SKY","$9.99","146","6","$1,459","10/25/2023","","4.7","22","","82,658","7","FBA","1","Health & Household","","","","https://www.amazon.com/dp/B0CLV4T23X"
"","","B0C4QB11SL","Happy Little Camper Natural Disposable Baby Diapers, Gentle on Skin, Ultra-Absorbent, Hypoallergenic, Chlorine Free, Safe for Sensitive Skin, Fragrance Free, Junior, Diapers Size 6, 102 Count","Happy Little Camper","$74.99","138","2","$10,349","05/08/2023","$49.10","4.1","571","$25.89","26,410","7","AMZ","2","Baby","Oversize","14.8 x 8.03 x 17.87 in","9.48 lb","https://www.amazon.com/dp/B0C4QB11SL"
"","","B09PBYDSPG","SUT 10-Inch Compostable Paper Plates, 100 PCS Square Biodegradable Bagasse Plates, Heavy-Duty Microwaveable Plates, Eco-Friendly Natural Disposable Plates, Made of Sugarcane Fibers, for Party, Picnic","SUT","$25.99","254","10","$6,601","02/26/2022","","4.5","256","","56,656","6","FBA","1","Health & Household","","","","https://www.amazon.com/dp/B09PBYDSPG"