"Export time:  1/27/2024, 12:59:09 PM","","ASIN","Product Name","Brand","Price","Monthly Units Sold","Daily Units Sold","Monthly Revenue","Date First Available","Net Revenue","Star Rating","Reviews","Amazon Fees","BSR","LQS","Seller Type","Sellers","Category","Product Tier","Dimensions","Weight","Link"
"","","B087B69492","Amazon Basics Mesh Desk Organizer with Sliding Drawer, Double Tray and 5 Upright Sections, Black","Amazon Basics","$27.89","","","","03/15/2021","$16.68","4.4","1,334","$11.21","3,008","6","AMZ","6","Our Brands","Standard","9.4 x 13 x 6.8 in","5.249 lb","https://www.amazon.com/dp/B087B69492"
"desktop file organizer","","B0B2F14PDF","Youbetia Rose Gold Desk organizer, Desk Organizers and Desk Accessories with File Sorters+ Drawer, Workspace Organizers Desktop Storage File Organizer with Paper Tray for Office Supplies","Youbetia","$21.99","2,010","48","$44,200","08/08/2022","$11.21","4.7","1,581","$10.78","5,029","6","FBA","1","Office Products","Standard","10.197 x 13.622 x 4.291 in","3.858 lb","https://www.amazon.com/dp/B0B2F14PDF"
"Average Monthly Sales: 1,455","","B0B434T3YX","SUPEASY Fan Shaped Desk File Organizer, 6 Compartments for Filing Paper Bills, Letters, Desk Accessories for Workspace, School, Office, Waiting Room, Classroom Storage, Black","SUPEASY","$25.99","260","8","$6,757","06/13/2022","$9.35","4.6","203","$16.64","29,880","6","FBA","2","Office Products","Oversize","10.5 x 10.5 x 13.5 in","5.5 lb","https://www.amazon.com/dp/B0B434T3YX"
"Average Revenue: $35,309","","B07M71BGQ4","SimpleHouseware Mesh Hanging File Organizer, Black","Simple Houseware","$19.87","1,061","38","$21,082","01/03/2019","$2.63","4.6","5,923","$17.24","6,449","4","FBA","4","Office Products","Oversize","12.52 x 10.24 x 15.24 in","2.53 lb","https://www.amazon.com/dp/B07M71BGQ4"
"Average Price: $25.66","","B0CF5D4Z1V","LEKETREE Desk Organizers and Accessories, 5-Tier Paper Letter Tray Organizer with File Holder, Desktop Organizer for Office Supplies, Office Desk Accessories & Workspace(Black)","LEKETREE","$24.99","3,153","86","$78,793","09/12/2023","","4.3","147","","2,615","6","FBA","1","Office Products","","","","https://www.amazon.com/dp/B0CF5D4Z1V"
"Average No. of Ratings: 2,146","","B07PYFD78Z","Mind Reader Vertical File Storage, Desktop Organizer, Workspace, Office, Metal Mesh, 12.5' L x 3.75' W x 11.5' H, Black","Mind Reader","$17.99","649","20","$11,676","03/18/2019","$8.56","4.6","115","$9.43","12,265","7","AMZ","1","Office Products","Standard","13 x 13 x 4 in","1.799 lb","https://www.amazon.com/dp/B07PYFD78Z"
"Average Sales Rank: 18,539","","B06ZYJ9MWW","3 Pack - Stackable Desk File Document Letter Tray Organizer, Black","Simple Houseware","$21.87","826","37","$18,065","04/18/2017","$12.16","4.5","4,802","$9.71","6,640","4","FBA","1","Office Products","Standard","11.1 x 3.5 x 13.8 in","2.7 lb","https://www.amazon.com/dp/B06ZYJ9MWW"
"Average Rating Number: 4.6","","B06ZZD2DRQ","Simple Houseware 6 Tier Wall Mount Document Letter Tray Organizer, Black","Simple Houseware","$22.87","260","10","$5,946","04/18/2017","$12.11","4.7","6,839","$10.76","23,201","5","FBA","1","Office Products","Standard","12.75 x 16.5 x 4.25 in","3.97 lb","https://www.amazon.com/dp/B06ZZD2DRQ"
"","","B0BP18NB3D","DALTACK 9-Tier Paper Letter Tray Desk Organizer with Handles, Mesh File Holder Organization, Paper Sorter Desk Organizer for Office Home School,Black","DALTACK","$28.99","1,367","45","$39,629","12/04/2022","","4.7","474","","5,452","6","FBA","3","Office Products","","","","https://www.amazon.com/dp/B0BP18NB3D"
"","","B07J5X56Z5","2 Pack - SimpleHouseware 5 Section Upright File Sorter Organizer, Black","Simple Houseware","$24.87","4,847","210","$120,545","01/02/2018","$14.41","4.4","7,858","$10.46","812","5","FBA","4","Office Products","Standard","8.74 x 17.13 x 3.03 in","4.341 lb","https://www.amazon.com/dp/B07J5X56Z5"
"","","B09K5927B5","Marbrasse Desk Organizer with File Holder, 5-Tier Paper Letter Tray Organizer with Drawer and 2 Pen Holder, Mesh Desktop Organizer and Storage with Magazine Holder for Office Supplies(Black)","Marbrasse","$33.99","6,681","195","$227,087","10/22/2021","$21.56","4.5","3,199","$12.43","902","7","FBA","4","Office Products","Standard","13 x 4.72 x 15.7 in","6.6 lb","https://www.amazon.com/dp/B09K5927B5"
"","","B0CN38172Y","Jucoan Bamboo Countertop File Organizer 4 Slot Vertical Wall Mounted Hanging File Holder, Desktop File Documents Magazine Organizer Stand for Home Office School Organization No Assembly Required","Jucoan","$28.99","165","5","$4,783","11/09/2023","$16.71","","","$12.28","41,955","6","FBA","1","Office Products","Standard","10.5 x 6.5 x 16.5 in","2.99 lb","https://www.amazon.com/dp/B0CN38172Y"
"","","B09XCFX6L5","Delifox Inclined Desk File Organizer, 5-Section Vertical File Folder Holder Stand Metal Rack File Sorter for Office Classroom Desktop Organization, Black","Delifox","$24.99","2,174","71","$54,328","04/06/2022","$13.61","4.8","251","$11.38","3,251","6","FBA","4","Office Products","Standard","11.5 x 7.5 x 12 in","4 lb","https://www.amazon.com/dp/B09XCFX6L5"
"","","B07RY2ZPK6","Amazon Basics Plastic Desk Organizer - Pen Cup, White","Amazon Basics","$7.36","3,761","103","$27,681","09/24/2019","$2.72","4.6","12,793","$4.64","2,085","5","AMZ","1","Office Products","Standard","3.3 x 3.9 x 3.3 in","4.2 oz","https://www.amazon.com/dp/B07RY2ZPK6"
"","","B0CFVYSC1M","Youbetia 5 Tier Paper Letter Tray Organizer with Mesh File Holder, Desk Accessories & Workspace Desktop Organizers with Drawer and Pen Holder, Office Supplies Desk Organizer (Rose Gold)","Youbetia","$32.99","1,627","60","$53,675","09/21/2023","$14.54","4.6","136","$18.45","3,967","7","FBA","1","Office Products","Oversize","9.45 x 11.25 x 16.15 in","5.58 lb","https://www.amazon.com/dp/B0CFVYSC1M"
"","","B0CPLQZPFW","Turfson Desktop Organizer, Desk Organizer And Accessories With Drawer, 4-Tier Office Supplies With File Paper Storage For Document Magazine & 2 Pen Pencil Holder Caddy Rack For School Workspace","Turfson","$32.99","60","2","$1,979","12/05/2023","","4.7","9","","89,808","7","FBA","1","Office Products","","","","https://www.amazon.com/dp/B0CPLQZPFW"
"","","B09CXBCZW7","BLU MONACO Gold Desk Accessories and Workspace, Desktop Organizer - Cute File Organizer for Desk and Drawer Storage for Office Supplies, Paper, Device and Folders - File Holder","BLU MONACO","$39.99","532","22","$21,275","11/06/2020","$26.36","4.7","1,409","$13.63","11,479","6","FBA","1","Office Products","Standard","9.6 x 7.6 x 13.4 in","4.6 lb","https://www.amazon.com/dp/B09CXBCZW7"
"","","B0BBD548CF","SUPEASY Mesh Desk Organizer with File Holder, 5-Tier Paper Letter Tray Organizer with Magazine Holder, Desktop Organizer and Storage with Drawer for Office Supplies Home or School, Black","SUPEASY","$29.99","1,204","44","$36,108","08/20/2022","$10.85","4.5","589","$19.14","5,586","6","FBA","2","Office Products","Oversize","12.01 x 11.02 x 15.94 in","4 lb","https://www.amazon.com/dp/B0BBD548CF"
"","","B093GLX3L1","Sinboun Hanging File Organizer Letter-Size File Holder Filing Box Includes 5 Hanging Folders - Metal Mesh Magazine Letter Storage Cabinets File Cart for Office Home School, No Assembly Required","Sinboun","$19.89","360","12","$7,160","04/25/2021","$10.16","4.7","402","$9.73","20,371","6","FBA","3","Office Products","Standard","5 x 9 x 13 in","1 lb","https://www.amazon.com/dp/B093GLX3L1"
"","","B078Z16F53","SimpleHouseware Expandable 5 Section Metal Upright File Sorter Organizer, Black","Simple Houseware","$16.87","5,213","210","$87,943","01/02/2018","$8.55","4.4","7,858","$8.32","812","5","FBA","4","Office Products","Standard","8.74 x 14.173 x 3.032 in","2.161 lb","https://www.amazon.com/dp/B078Z16F53"
"","","B0CPDPYBYS","SUPEASY Wood Desk Organizer, 3 Tier Paper File Organizer for Desk, Wooden Desktop Organizer, Paper Letter Literature Mail Sorter, for Office School & Home Organization, Black","SUPEASY","$29.99","99","3","$2,969","12/03/2023","","5","1","","65,647","7","FBA","1","Office Products","","","","https://www.amazon.com/dp/B0CPDPYBYS"
"","","B0CCP4CMD5","Nsdmakdt Book Stand 360 Degree, Book Holder with Phone Slot and File Organizer Space, Foldable Desktop Riser for Laptop, Recipe, Textbook - Hands-Free,Cookbook Stand, Clear Design with Page Clips","Nsdmakdt","$35.99","60","2","$2,159","07/23/2023","$24.16","4.6","33","$11.83","94,042","6","FBA","1","Office Products","Standard","5 x 5 x 5 in","3.53 lb","https://www.amazon.com/dp/B0CCP4CMD5"
"","","B0BZ4396D5","OPNICE Desk Organizers and Accessories, Desk Organizer with Drawer, 4-Tier Paper Tray Organizer with 2 Pen Holders + File Holder, Office Desk Accessories for Office Supplies(Rose Gold)","OPNICE","$26.99","4,414","264","$119,134","04/24/2023","$14.00","4.5","540","$12.99","578","6","FBA","3","Office Products","Oversize","16.13 x 9.05 x 9.44 in","1.6 oz","https://www.amazon.com/dp/B0BZ4396D5"
"","","B01K07MXYS","SimpleHouseware 3 Tier Stackable Desktop Document Letter Tray Organizer, Black","Simple Houseware","$14.97","424","14","$6,347","08/07/2016","$6.29","4.7","2,021","$8.68","17,415","5","FBA","1","Office Products","Standard","11 x 13.7 x 2 in","3.049 lb","https://www.amazon.com/dp/B01K07MXYS"
"","","B0B2W3YQ2J","Marbrasse Desk Organizer with Drawer, 4-Tier Mesh Desk File Organizer with 5 Vertical File Holders and 2 Pen Holders, Multifunction Desktop Organizer","Marbrasse","$29.99","1,872","101","$56,141","05/31/2022","$18.16","4.4","1,194","$11.83","2,143","7","FBA","2","Office Products","Standard","10.2 x 14.17 x 5.63 in","6.219 lb","https://www.amazon.com/dp/B0B2W3YQ2J"
"","","B089QSNKWV","Desktop File Organizer, Mail Organizer, 7 Compartments Office File Sorter, for Easy access to your files, Invoices, Letters and more - 4.5' Height x 8.8' Width x 5.5' Depth - Black, Eco-Friendly","Manaloom","$14.99","560","21","$8,394","06/04/2020","","4.4","571","","11,567","5","FBA","1","Office Products","","","","https://www.amazon.com/dp/B089QSNKWV"
"","","B0B5YPXLVC","Workwood File Folder Desk Organizer | Vertical Laptop Stand & Holder for MacBook Pro & iPad | Incline Mail & Letter Sorter for Desktop Storage | Fits Multiple Devices | Acacia Wood","Workwood","$21.99","240","8","$5,278","10/04/2022","","4.4","73","","28,116","6","FBA","1","Office Products","","","","https://www.amazon.com/dp/B0B5YPXLVC"
"","","B000GRA79G","Safco Products Onyx Mesh 8-Tier Vertical Desktop Organizer 3258BL, Black Powder Coat Finish, Durable Steel Mesh Construction, Space-Saving Functionality","Safco","$44.28","601","23","$26,612","01/13/2006","$24.14","4.8","5,460","$20.14","10,980","7","AMZ","49","Office Products","Oversize","10.75 x 14 x 11.75 in","6 lb","https://www.amazon.com/dp/B000GRA79G"
"","","B0BDLK7Y32","SHARKWOODS 3-Tier Paper Organizer for Desk, Wood Desktop Organizer with Adjustable Lettry Tray, Mail Sorter for Office School & Home, Black","SHARKWOODS","$29.99","874","35","$26,211","09/07/2022","","4.2","148","","7,055","6","FBA","1","Office Products","","","","https://www.amazon.com/dp/B0BDLK7Y32"
"","","B0C8ST9YR5","SANRUI Clear Desktop File Organizer, 5 Compartments Acrylic Office Document Sorter Mails Storage, Multifunction Letter Folder Racks Holders for Office,Home, School Desk Organization","SANRUI","$19.90","501","17","$9,970","06/20/2023","","4.7","54","","14,271","7","FBA","1","Office Products","","","","https://www.amazon.com/dp/B0C8ST9YR5"
"","","B0C5M83N9B","Desk Organizers and Accessories Storage, Desktop Organizer with Drawer & Double Tray & 5 File Folder Holders & Pen Holder, Mesh Desk Accessories & Workspace Organizers for Office Supplies(White)","Taiho Life","$18.99","728","17","$13,825","05/17/2023","$3.02","4.9","138","$15.97","14,205","7","FBA","1","Office Products","Oversize","12.5 x 13.6 x 9.05 in","5.24 lb","https://www.amazon.com/dp/B0C5M83N9B"
"","","B0C77Y175C","SUPEASY Desk Organizer with File Holder, 5-Tier Mesh Paper Letter Tray Organizer with Pen Holder and Drawer, Desktop Organizer and Storage with 3 Tilted File Sorter for Office Supplies, White","SUPEASY","$32.99","679","19","$22,400","06/05/2023","","4.5","40","","49,225","7","FBA","1","Home & Kitchen","","","","https://www.amazon.com/dp/B0C77Y175C"
"","","B07R7FZ6RG","Simple Trending 7 Tier Desk File Organizer, Letter Tray Paper Organizer with Pen Holder and Metal Hanging Basket, Black","Simple Trending","$33.97","1,160","34","$39,405","04/25/2019","$22.14","4.7","3,456","$11.83","7,266","6","FBA","1","Office Products","Standard","9.37 x 13.66 x 4.53 in","4.76 lb","https://www.amazon.com/dp/B07R7FZ6RG"
"","","B07B3NDQ86","Samstar Desk File Organizer, Mesh Letter File Folder Holder with 3 Paper Trays and 2 Vertical Upright Section, Black.","samstar","$22.87","918","33","$20,995","06/17/2017","$13.01","4.6","1,813","$9.86","7,551","6","FBA","1","Office Products","Standard","12.087 x 13.583 x 2.677 in","3.413 lb","https://www.amazon.com/dp/B07B3NDQ86"
"","","B09PTLBBQZ","JAFUSI 7 Tier Black Metal Mesh Desktop File Organizer with Fabric Drawer, 16.7'H x 9'W x 13.4'L","JAFUSI","$39.98","383","5","$15,312","05/12/2022","$27.25","4.4","192","$12.73","41,386","6","FBA","1","Office Products","Standard","13.74 x 17.01 x 2.13 in","4.941 lb","https://www.amazon.com/dp/B09PTLBBQZ"
"","","B08PBFKGJG","Marbrasse 6 Tier Paper Organizer Letter Tray - Mesh Desk File Organizer with Handle, Paper Sorter Organizer for Letter/A4 Office File Folder Holder - Black","Marbrasse","$21.99","9,413","415","$206,992","11/29/2020","$11.66","4.7","2,866","$10.33","282","6","FBA","2","Office Products","Standard","13.937 x 17.323 x 3.228 in","5.739 lb","https://www.amazon.com/dp/B08PBFKGJG"
"","","B08MWV6P61","Mail Organizer Countertop Kitchen - White Wood Desk Organizer Storage with Drawer - Mail Sorter Organizer or Bill Organizer for Desk - Farmhouse Desk Organizer Accessories - Mail Basket for Counter","BLU MONACO","$34.97","3,610","85","$126,242","04/13/2021","$22.69","4.6","1,224","$12.28","2,640","6","FBA","1","Office Products","Standard","8.9 x 13.86 x 5.67 in","3.481 lb","https://www.amazon.com/dp/B08MWV6P61"
"","","B09LSYKLFX","Simple Trending Mesh Desktop File Sorter Organizer, 5-Section Bookshelf for Desk Home Office, Black","Simple Trending","$17.97","2,290","89","$41,151","11/13/2021","$10.13","4.7","736","$7.84","2,504","6","FBA","1","Office Products","Standard","8.543 x 9.567 x 2.362 in","1.784 lb","https://www.amazon.com/dp/B09LSYKLFX"
"","","B09QKDY1YY","Supeasy 5 Tier Desk Organizer with Handle, Mesh Paper/File Organizer for Desk, Paper Tray Organizer for Office Supplies Black","SUPEASY","$17.98","5,704","331","$102,558","01/16/2022","$2.16","4.7","2,364","$15.82","408","6","FBA","4","Office Products","Oversize","12.5 x 13.5 x 9.5 in","1 lb","https://www.amazon.com/dp/B09QKDY1YY"
"","","B0C9P84Z1X","Marbrasse Mesh File Organizer for Desk, Desk Organizer and AccessoriesDesktop Organizer 4-Tier Mesh Desk File Organizer with 5 Sections File Bookshelf and 2 Pen Holders for Home Office Supplies","Marbrasse","$28.99","130","5","$3,769","06/28/2023","$17.31","4.1","36","$11.68","46,029","6","FBA","1","Office Products","Standard","10.87 x 5.24 x 13.98 in","6.29 lb","https://www.amazon.com/dp/B0C9P84Z1X"
"","","B08867JZ3Y","EASEPRES Desk Mail Organizer, Office Small Letter Sorter Desktop File Organizer Metal Mesh with 3 Vertical Upright Compartments, 1 Pack","EASEPRES","$9.95","1,530","51","$15,223","05/05/2020","$5.04","4.4","1,992","$4.91","4,776","6","FBA","1","Office Products","Standard","5.5 x 7 x 3 in","0.03 lb","https://www.amazon.com/dp/B08867JZ3Y"
"","","B0856Y4YZD","Mind Reader Desktop Organizer, Vertical File Storage, Letter Size, Office, Metal Mesh, 12.15' L x 9.5' W x 9.5' H, Black","Mind Reader","$25.50","122","4","$3,111","02/25/2020","$9.32","4.4","83","$16.19","58,039","7","AMZ","1","Office Products","Oversize","10.25 x 12.5 x 10 in","2.401 lb","https://www.amazon.com/dp/B0856Y4YZD"
"","","B0CDXZXWBM","Azar Displays 250099 Three Tier File and Brochure Desktop Wall Organizer Holder with Dividers brochure display stand acrylic file holder, Clear","Azar Displays","$19.90","220","7","$4,378","08/06/2023","$10.18","4.4","28","$9.72","34,043","6","FBA","3","Office Products","Standard","3.5 x 12 x 13.5 in","2.49 lb","https://www.amazon.com/dp/B0CDXZXWBM"
"","","B07VNNRRK3","Ballucci File Organizer Paper Sorter, 5 Tier Adjustable Shelves Office Desk Organizer, 13 5/8' x 9 1/4' x 12', Black","Ballucci","$33.99","694","20","$23,589","07/23/2019","$15.77","4.7","1,167","$18.22","12,080","6","FBA","1","Office Products","Oversize","9.25 x 12 x 13.8 in","8.25 lb","https://www.amazon.com/dp/B07VNNRRK3"
"","","B0995H5C1S","FITUEYES Wood Desk Paper Sorter Organizer with 4-Tier Storage, Desktop Paper File Holder Letter Tray for Home and Office, Light Wood, DO403506WO","FITUEYES","$39.99","145","5","$5,799","07/11/2021","$20.87","4.7","1,679","$19.12","47,763","6","FBA","2","Office Products","Oversize","10 x 11 x 14 in","11 lb","https://www.amazon.com/dp/B0995H5C1S"
"","","B0C2TCDL5Q","VIEERINN 5 Tier Paper Letter Tray Organizer with Handles, Mesh Desk File Organizer Metal Paper Sorter Holder, Desktop Document Shelf Tray Storage Organization for Office School Home","VIEERINN","$17.99","542","14","$9,751","07/19/2023","","4.4","180","","17,743","6","FBA","1","Office Products","","","","https://www.amazon.com/dp/B0C2TCDL5Q"
"","","B0BLTQG75Y","Spacrea Desk Organizers and Accessories - 4 Tier Letter Tray Paper Organizer with Drawer and 2 Pen Holder, Desktop File Organizer for Office Supplies(Rose Gold)","Spacrea","$27.99","1,110","37","$31,069","12/27/2022","$18.56","4.6","364","$9.43","6,702","7","FBA","1","Office Products","Standard","9.52 x 2.24 x 13 in","4.02 lb","https://www.amazon.com/dp/B0BLTQG75Y"
"","","B01N9HQM9F","Simple Houseware Mesh Desk Organizer with Sliding Drawer, Double Tray and 5 Upright Sections, Black","Simple Houseware","$24.97","4,172","174","$104,175","12/13/2016","$8.10","4.7","33,790","$16.87","1,056","6","FBA","4","Office Products","Oversize","13 x 9 x 13.25 in","1 lb","https://www.amazon.com/dp/B01N9HQM9F"
"","","B0C1NPRRKP","5 Trays Desk Paper Organizer with Drawer & Pen Holders, Paper Letter Tray Desktop Organizer Office Supplies for Home Office School Organization","GoldOrcle","$25.99","1,507","44","$39,167","04/05/2023","","4.6","492","","5,597","6","FBA","1","Office Products","","","","https://www.amazon.com/dp/B0C1NPRRKP"
"","","B0C7Q31H15","DAOUTIME 4-Tier Mesh Desk Organizer, Wooden Desk File Organizer with 5 Vertical File Holders and 2 Pen Holders, Desktop Organizer with Drawer, Desk Organizers and Accessories for Home Office","DAOUTIME","$32.99","421","14","$13,889","06/11/2023","$20.41","4.6","69","$12.58","17,551","6","FBA","1","Office Products","Standard","10.16 x 6.73 x 13.74 in","7.43 lb","https://www.amazon.com/dp/B0C7Q31H15"
"","","B0BQ686YNG","Becomrock Desk Organizers and Accessories, Office Supplies Desktop Organizer, Desk File Organizer with Sliding Drawer, Dual Tray and 5 Upright Section, File Folder Holder for Desk (White)","Becomrock","$20.99","90","3","$1,889","01/14/2023","","4.5","34","","66,548","7","FBA","1","Office Products","","","","https://www.amazon.com/dp/B0BQ686YNG"
"","","B0878VD744","PENGKE File Organizer Triangle Iron Desktop Storage Book Rack Bookshelf Copper Magazine Newspaper Holder Art Desktop Organizer Rack,Rose Gold Pack of 1","PENGKE","$15.99","360","13","$5,756","08/11/2019","$7.16","4.8","1,088","$8.83","18,859","6","FBA","1","Office Products","Standard","7.1 x 7 x 10.2 in","1.4 lb","https://www.amazon.com/dp/B0878VD744"
"","","B0B5XCS7HK","Simple Trending Mesh Desk Organizer with Sliding Drawer, Double Tray with 5 Sections File Bookshelf, Black","Simple Trending","$26.87","471","15","$12,656","07/05/2022","$8.96","4.6","420","$17.91","16,707","7","FBA","1","Office Products","Oversize","9.25 x 15.25 x 13.25 in","4 lb","https://www.amazon.com/dp/B0B5XCS7HK"
"","","B0B12HD1XR","LUCYCAZ File Organizer - Paper Tray Organizer for Desk, 4 Tier Wood Desk Organizer for Hanging File Folders Letter Size or A4 Size, Desktop File Organizer for Office School and Home, Black","LUCYCAZ","$27.47","387","14","$10,631","07/17/2022","$17.56","4.4","230","$9.91","17,753","7","FBA","1","Office Products","Standard","13 x 2 x 12 in","1 lb","https://www.amazon.com/dp/B0B12HD1XR"
"","","B0C2Y4YZK1","VETUZA Hanging File Organizer with 5 Hanging Folders for Desk, Metal Mesh File Storage Box, Desk File Holder Folder for Office&School, No Assembly Required, Black","VETUZA","$17.99","266","12","$4,785","04/18/2023","$6.16","4.5","8","$11.83","19,547","6","FBA","1","Office Products","Standard","10.2 x 5.87 x 12.68 in","0.56 kg","https://www.amazon.com/dp/B0C2Y4YZK1"
"","","B08T66348D","Tasybox Acrylic File Holder, Clear File Sorter Desk File Organizer 3 Sections Office Desktop Rack 9' x 6.5' x 6.5'","Tasybox","$21.99","449","14","$9,874","01/14/2021","$12.90","4.8","390","$9.09","16,993","7","FBA","3","Office Products","Standard","6.5 x 6.5 x 9 in","1.98 lb","https://www.amazon.com/dp/B08T66348D"
"","","B09NFVGTGR","Simple Trending Mesh Desk File Organizer, Office Supplies Desktop Storage with Sliding Drawer, Double Tray and 5 Upright Section Sorter Organizer, Black","Simple Trending","$24.57","660","18","$16,216","12/10/2021","$14.15","4.6","746","$10.42","13,473","6","FBA","1","Office Products","Standard","9.29 x 13.19 x 3.35 in","4.5 lb","https://www.amazon.com/dp/B09NFVGTGR"
"","","B01N9XASO8","1InTheOffice Metal Mesh File Organizer, Black Wire Mesh 5 Section Incline Sorter, Black Finish","1InTheOffice","$28.99","196","9","$5,682","01/29/2017","$16.71","4.6","506","$12.28","25,393","5","FBA","5","Office Products","Standard","12 x 6 x 17 in","3 lb","https://www.amazon.com/dp/B01N9XASO8"
"","","B08MWTQ5GG","BLU MONACO White Desktop Organizer with Drawer - Home Countertop Storage - Paper Wood Bill Letter Mail Organizer for Office Desk Accessories & Workspace Organizers","BLU MONACO","$35.00","829","26","$29,015","11/05/2020","$23.32","4.6","888","$11.68","9,358","6","FBA","1","Office Products","Standard","5.9 x 7.5 x 12.3 in","3.43 lb","https://www.amazon.com/dp/B08MWTQ5GG"
"","","B005XK3W34","Officemate Large Incline 8 Compartment Wire Caddy, Black, 8.5 x 10.375 x 12.625 Inches","Officemate","$15.34","784","67","$12,027","10/14/2011","$1.06","4.7","3,575","$14.28","3,465","6","AMZ","2","Office Products","Oversize","10.39 x 12.63 x 8.5 in","1.3 lb","https://www.amazon.com/dp/B005XK3W34"