"Export time:  2/1/2024, 1:43:46 PM","","ASIN","Product Name","Brand","Price","Monthly Units Sold","Daily Units Sold","Monthly Revenue","Date First Available","Net Revenue","Star Rating","Reviews","Amazon Fees","BSR","LQS","Seller Type","Sellers","Category","Product Tier","Dimensions","Weight","Link"
"","","B08CS3216Z","MyGift Wall Mounted or Tabletop Rustic Black Metal Wire and Burnt Wood Small Decorative Storage Baskets with Handles, Set of 2","MyGift","$29.99","210","7","$6,298","10/26/2020","$19.06","4.7","209","$10.93","134,338","6","FBA","1","Home & Kitchen","Standard","6.614 x 14.095 x 4.409 in","3.106 lb","https://www.amazon.com/dp/B08CS3216Z"
"wall mount basket","","B07G2QPQKR","Saratoga Home Wall Fruit Baskets For Kitchen Fruit Basket Wall Mount, Wall Fruit Baskets for Kitchen, Hanging Wall Basket, Hanging Baskets for Organizing, Onion and Potato Storage, Wired Baskets","Saratoga Home","$44.99","118","3","$5,309","08/26/2018","$30.31","4.7","3,007","$14.68","73,032","6","FBA","1","Kitchen & Dining","Standard","12.047 x 13.11 x 5.158 in","8.68 lb","https://www.amazon.com/dp/B07G2QPQKR"
"Average Monthly Sales: 471","","B08FY4SXTJ","MaraFansie Hanging Kitchen Baskets Wire Storage Basket Over the Cabinet Door Organizer, No Drilling Adhesive Basket for Cabinet Pantry Organization and Kitchen, Bathroom, Storage, 2 Pack, Black","MaraFansie","$15.99","1,486","43","$23,761","10/03/2020","$8.45","4.7","2,450","$7.54","6,257","6","FBA","3","Kitchen & Dining","Standard","4.72 x 11.02 x 4.72 in","1 lb","https://www.amazon.com/dp/B08FY4SXTJ"
"Average Revenue: $11,930","","B0BC83X7FT","MaraFansie [Extra Large] Wire Basket 2-Pack Hanging Wall Organizer Cabinet Storage Basket Wall Mounted Shelves Rustic Farmhouse Decor for Home Kitchen Bathroom, BLACK","MaraFansie","$22.99","540","20","$12,415","08/28/2022","","4.8","443","","14,172","7","FBA","1","Kitchen & Dining","","","","https://www.amazon.com/dp/B0BC83X7FT"
"Average Price: $25.43","","B0CBTL12K8","ShabbyDecor Metal Wire Basket Detachable Wood Base Storage Organizer Farmhouse Bin for Kitchen Cabinets, Bathroom, Pantry, Laundry Room, Closets Set of 2,Black Color","ShabbyDecor","$20.68","342","11","$7,073","06/07/2023","$11.94","4.8","13","$8.74","25,109","7","FBA","1","Kitchen & Dining","Standard","13 x 4 x 5.5 in","2.4 lb","https://www.amazon.com/dp/B0CBTL12K8"
"Average No. of Ratings: 1,421","","B09N34YCTQ","4-Set Extra Large Black Steel Wire Wall Mount Baskets - With Adhesive & Steel Hooks, Rustic Farmhouse Kitchen & Bathroom Storage","AOZITA","$26.99","1,517","44","$40,944","12/05/2021","$16.66","4.8","697","$10.33","6,037","7","FBA","6","Kitchen & Dining","Standard","14.7 x 5.5 x 5.5 in","1.1 lb","https://www.amazon.com/dp/B09N34YCTQ"
"Average Sales Rank: 77,251","","B09B3BRJWM","3 Set [Extra Large]Hanging Wall Wire Baskets, Farmhouse Food Storage Kitchen Pantry Laundry Closet Garage RV,Black","Joben Oligey","$24.99","1,464","51","$36,585","09/13/2021","$14.81","4.7","981","$10.18","5,111","6","FBA","2","Kitchen & Dining","Standard","5.5 x 5.5 x 14.7 in","3.83 lb","https://www.amazon.com/dp/B09B3BRJWM"
"Average Rating Number: 4.6","","B0BRXLGH4M","Wall Hanging Baskets 3 Pack, Large Floating Shelves Wire Basket of Wooden Style, Storage Organization for Bathroom Shower Bedroom Kitchen Dorm Office Garage, Room Wall Decor, Plant Hanging Rack","LIGHT DUST","$32.99","226","6","$7,456","02/14/2023","","4.7","52","","149,230","7","FBA","1","Home & Kitchen","","","","https://www.amazon.com/dp/B0BRXLGH4M"
"","","B09W2WYK4D","Hanging Kitchen Baskets Adhesive Sturdy Wire Storage Baskets with Kitchen Food Pantry Bathroom Shelf Storage No Drilling Wall Mounted,Black,2 Pack","HDYOUDO","$15.99","212","6","$3,390","03/20/2022","$7.80","4.3","248","$8.19","46,289","7","FBA","1","Kitchen & Dining","Standard","6 x 5 x 11 in","1.4 lb","https://www.amazon.com/dp/B09W2WYK4D"
"","","B09J4P5X4S","Mefirt 2pcs Fruit Basket Onion Storage Wire Baskets with Wood Lid, Stackable Wall-Mounted Tiered Kitchen Organizers and Storage for Snack, Fruit and Vegetable Storage, 11.8 x 7.9 x 8.5 Inch","Mefirt","$37.99","1,850","45","$70,282","11/19/2021","$25.26","4.7","1,268","$12.73","5,956","7","FBA","6","Kitchen & Dining","Standard","8.268 x 3.74 x 12.402 in","5.071 lb","https://www.amazon.com/dp/B09J4P5X4S"
"","","B0BR5D98YW","JUNCHU CHERRY 2 Pack Hanging Kitchen Basket, Bathroom Bath Basket, Household Goods Storage Basket, with Traceless Tape, no Drilling, for Cabinet Storage, Kitchen, Bathroom, Storage Room(2 Chrome)","JUNCHU CHERRY","$13.95","473","15","$6,598","12/26/2022","$8.09","4.3","30","$5.86","18,155","6","FBA","1","Kitchen & Dining","Standard","11 x 4.72 x 4.92 in","8.3 oz","https://www.amazon.com/dp/B0BR5D98YW"
"","","B09QGZZGPV","mDesign Open Weave Water Hyacinth Hanging Wall Storage Belly Basket for Flowers & Essentials, Decorative Boho Mounted Organizer for Pantry, Closet, Bathroom, and The Door - Natural/Tan","mDesign","$44.99","93","4","$4,184","02/26/2022","$25.12","4.8","243","$19.87","67,933","7","FBA","1","Kitchen & Dining","Oversize","13.504 x 18.11 x 6.732 in","0.948 lb","https://www.amazon.com/dp/B09QGZZGPV"
"","","B08LNDR2KT","Farmhouse Metal Wire Bin Basket with Wall Mount - Small, 4 Pack - Portable Hanging Wall Basket, Rustic Home Storage Organizer for Cabinets, Pantry, Closets, Bathroom, Kitchen,Bedroom(Black)","SheeChung","$19.79","1,324","46","$26,202","11/20/2020","$11.03","4.7","5,759","$8.76","5,767","7","FBA","1","Kitchen & Dining","Standard","11 x 3.6 x 4.3 in","2.6 lb","https://www.amazon.com/dp/B08LNDR2KT"
"","","B0C746ZYCF","Ellinia Woven Hanging Wall Basket for Storage, Water Hyacinth Wall Mount Organizer, Wicker Wall Shelves for Letters, Toilet Tank Basket, Set of 2","Ellinia","$22.99","181","5","$4,161","08/07/2023","","4.5","36","","48,893","7","FBA","1","Kitchen & Dining","","","","https://www.amazon.com/dp/B0C746ZYCF"
"","","B09P8FP1SH","VK VKLIVING Jute Onion Basket Hanging for Pantry, Potato Garlic Onion Pantry Storage Baskets, Boho Wall Baskets for Kitchen Garlic Keeper Bohemian Handwoven Wall Mount Fruit or Veggie Basket Set of 2","VK VKLIVING","$23.99","124","9","$2,975","12/26/2021","$15.25","4","343","$8.74","28,834","7","FBA","1","Kitchen & Dining","Standard","7.9 x 11.8 x 0.8 in","1 lb","https://www.amazon.com/dp/B09P8FP1SH"
"","","B0CMXQQ1BY","Chi An Home Wicker Hanging Storage Baskets, Hanging Wall Baskets Set of 2, Water Hyacinth Mail Baskets for Wall, Mounted Hanging Baskets for Organizing Kitchen, Files, Umbrellas, Accessories","Chi An Home","$29.95","270","9","$8,087","11/07/2023","$18.13","","","$11.82","30,085","7","FBA","1","Kitchen & Dining","Standard","5.9 x 13 x 11 in","2.38 lb","https://www.amazon.com/dp/B0CMXQQ1BY"
"","","B08SM89FB7","RUIPBOTE 2 Pcs Wall-Hanging Storage Bags, Desktop Organizer Basket Cotton Linen Hanging Storage Basket for Kitchen,Bderoom,Living Room","RUIPBOTE","$13.99","486","15","$6,799","01/10/2021","$8.97","4.2","267","$5.02","60,755","7","FBA","1","Home & Kitchen","Standard","0.787 x 1.969 x 0.394 in","0.044 lb","https://www.amazon.com/dp/B08SM89FB7"
"","","B0CHB26MR1","PUPPYCUTE Stackable Wire Storage Baskets for Kitchen Closet Pantry, Hanging Closet Organizers Storage Shelves Organization, Wall Mount Metal Basket Bins, Clothing Vegetable & Fruit Organizer 3 pcs","PUPPYCUTE","$34.99","390","12","$13,646","09/04/2023","$18.14","4.6","37","$16.85","22,100","7","FBA","1","Kitchen & Dining","Oversize","9 x 9.1 x 12.8 in","7.02 lb","https://www.amazon.com/dp/B0CHB26MR1"
"","","B09R2L5P11","mDesign Zig Zag Woven Hyacinth Hanging Wall Mount Storage Organizer Basket - Rustic Hangable Mounted Market Baskets for Kitchen, Bathroom, Shelf - Holds Floral, Food, and Mail - Set of 2 - Black Wash","mDesign","$31.99","180","12","$5,758","01/23/2022","$19.26","4","24","$12.73","23,671","7","FBA","1","Kitchen & Dining","Standard","12.48 x 12.95 x 6.89 in","1.519 lb","https://www.amazon.com/dp/B09R2L5P11"
"","","B01J7ZAHM4","Spectrum Diversified Vintage Wall Mount Storage Basket, X-Large (Pack of 1), Industrial Gray","Spectrum Diversified","$14.33","477","15","$6,835","07/27/2016","$5.45","4.8","7,162","$8.88","61,981","7","AMZ","1","Home & Kitchen","Standard","15.25 x 7.5 x 5.5 in","1.04 lb","https://www.amazon.com/dp/B01J7ZAHM4"
"","","B0C25DBM26","Spectrum 1000046 Basket, X-Large, Black","Spectrum","$15.30","117","6","$1,790","04/10/2023","","4.8","14","","45,793","5","AMZ","1","Kitchen & Dining","","","","https://www.amazon.com/dp/B0C25DBM26"
"","","B0828DJ2HD","KINCMAX Shower Caddies (2 Pack), Rustproof Stainless Steel, Adhesive Wall Mount Baskets with 4 Hooks (Polished Silver)","KINCMAX","$29.99","3,708","147","$111,203","02/03/2020","$19.70","4.8","28,805","$10.29","4,771","6","FBA","1","Home & Kitchen","Standard","5.8 x 13 x 5.2 in","2.449 lb","https://www.amazon.com/dp/B0828DJ2HD"
"","","B0C169F4ZT","Orimade Shower Caddy Basket Shelf Storage Rack, No Drilling Wall Mounted Adhesive Rust Proof Stainless Steel Shower Organizer with 5 Hooks for Bathroom, Black 2 Pack","Orimade","$19.19","1,673","85","$32,105","03/31/2023","","4.8","8,517","","9,693","6","FBA","1","Home & Kitchen","","","","https://www.amazon.com/dp/B0C169F4ZT"
"","","B0CDB4DKW4","2 Pack Hanging Fruit Baskets for Kitchen Fruit and Vegetable Storage, Stackable Wall Mounted Wire Basket with Bamboo Lid, Kitchen Countertop Organizer Potato Onion Produce Snack Storage","GMFINE","$36.99","","","$0.00","07/31/2023","$24.56","4.8","9","$12.43","226,273","7","FBA","1","Kitchen & Dining","Standard","10 x 3 x 6 in","5.13 lb","https://www.amazon.com/dp/B0CDB4DKW4"
"","","B01IO5E27O","Spectrum Diversified 10' x 5' x 7' Pegboard & Wall Mount Basket, 10'L x 7'W, Industrial Gray","Spectrum Diversified","$11.10","799","33","$8,869","07/21/2016","$6.00","4.7","3,332","$5.10","4,070","6","AMZ","1","Industrial & Scientific","Standard","10.25 x 7 x 5.5 in","12 oz","https://www.amazon.com/dp/B01IO5E27O"
"","","B0887HQ5LW","Blue Donuts Medium Wire Baskets for Storage Wall Mount - Stackable Wire Baskets for Organizing, Rectangular Hanging Wire Basket for Living Room, Kitchen, Pantry, Wire Fruit Basket, Black Wire Basket","Blue Donuts","$16.99","53","1","$900.47","12/31/2009","$7.71","4.5","54","$9.28","161,428","5","FBA","3","Kitchen & Dining","Standard","6.732 x 14.764 x 6.693 in","1.389 lb","https://www.amazon.com/dp/B0887HQ5LW"
"","","B082358XRR","mDesign Woven Hyacinth Hanging Wall Mount Storage Organizer Basket - Rustic Hangable Mounted Market Baskets for Kitchen, Bathroom, Shelf - Holds Floral, Food, and Mail - Set of 2 - Natural/Tan","mDesign","$31.99","219","12","$7,006","02/27/2020","$20.46","4.7","162","$11.53","23,671","7","FBA","1","Kitchen & Dining","Standard","10.5 x 12.8 x 5.1 in","2.749 lb","https://www.amazon.com/dp/B082358XRR"
"","","B09L1CVZ5Z","MOUNT DELECTABLE Magnetic Lint Bin for Laundry Room, Wall Mounted Lint Box Holder Trash Can with Lid for Dryer, Lint Basket for Laundry Room, Farmhouse Style Laundry Storage and Organization","MOUNT DELECTABLE","$26.99","124","4","$3,347","03/10/2022","$17.96","4.7","80","$9.03","40,068","7","FBA","1","Industrial & Scientific","Standard","3.7 x 10.5 x 8 in","1.47 lb","https://www.amazon.com/dp/B09L1CVZ5Z"
"","","B0834JVG4S","X-cosrack Foldable Cabinet Wall Mount Metal Wire Basket Organizer Pantry Basket with Handles - 4 Pack -12' x 9' X 6', Food Storage Mesh Bin for Kitchen Bathroom Laundry Closet Garage Patent Design","X-cosrack","$27.99","458","14","$12,819","05/23/2020","$20.25","4.6","949","$7.74","20,237","7","FBA","11","Kitchen & Dining","Standard","12 x 6 x 9 in","2.01 oz","https://www.amazon.com/dp/B0834JVG4S"
"","","B0CJX9N2KS","Tandefio 4 Pcs Slatwall Basket Multiple Sizes Metal Wire Slatwall Baskets Mounted Hanging Multifunctional Baskets Accessories for Storage Organizing and Retail Display on Slatwall Panels (Black)","Tandefio","$41.99","","","$0.00","09/26/2023","","","","","247,670","7","FBA","1","Industrial & Scientific","","","","https://www.amazon.com/dp/B0CJX9N2KS"
"","","B0C24ZY2N2","Vintage Living Cabinet & Wall Mount Basket - Large","Spectrum","$14.60","103","6","$1,504","04/10/2023","","4.2","16","","42,640","5","AMZ","1","Kitchen & Dining","","","","https://www.amazon.com/dp/B0C24ZY2N2"
"","","B07L4CG2Q3","X-cosrack Metal Wire Basket Wall Mount, 3 Tier Wall Storage Basket Organizer with Hanging Hooks Chalkboards, Rustic Kitchen Fruit Produce Bin Rack Bathroom Tower Baskets (Black)","X-cosrack","$39.99","524","18","$20,955","12/03/2018","$26.06","4.6","2,775","$13.93","15,589","6","FBA","9","Kitchen & Dining","Standard","12.24 x 13.43 x 5.28 in","8.111 lb","https://www.amazon.com/dp/B07L4CG2Q3"
"","","B07M6RGLZS","mDesign Portable Metal Farmhouse Wall Decor Angled Storage Organizer Basket Bin for Hanging in Entryway, Mudroom, Bedroom, Bathroom, Laundry Room - Wall Mount Hooks Included, Large - 2 Pack - Bronze","mDesign","$30.99","345","5","$10,692","02/21/2019","$18.41","4.7","658","$12.58","174,684","7","FBA","1","Home & Kitchen","Standard","12.5 x 16.5 x 5.9 in","2.251 lb","https://www.amazon.com/dp/B07M6RGLZS"
"","","B09JC1W613","TeoKJ Over the Door Hanging Basket, 3-Tier Woven Cotton Wall-Mounted Storage Organizer Bag Decorative Hanging Kitchen Baskets - Jute","TeoKJ","$29.99","1,626","51","$48,764","10/12/2021","$18.46","4.6","565","$11.53","2,583","7","FBA","2","Baby","Standard","8.27 x 15.63 x 5.55 in","3.04 lb","https://www.amazon.com/dp/B09JC1W613"
"","","B0C7GW7YRD","Wall Mount Wire Basket Wall Mounted Metal Basket Iron Wire Mesh Baskets Hanging Shower Fruit Vegetable Holder Organizer Kitchen Wall Basket for Bathroom Kitchen Metal Wire Baskets","OSALADI","$18.99","","","$0.00","06/07/2023","","4.6","3","","322,566","6","FBA","2","Kitchen & Dining","","","","https://www.amazon.com/dp/B0C7GW7YRD"
"","","B01J7ZAJ0E","Spectrum Diversified Mount Triple Wire 3 Storage Bins Decor & Entryway Organization, Rustic Farmhouse Wall Basket, Industrial Gray","Spectrum Diversified","$50.27","63","2","$3,167","03/11/2017","$25.81","4.7","349","$24.46","330,182","7","AMZ","5","Home & Kitchen","Oversize","10.6 x 33.3 x 8.5 in","3.699 lb","https://www.amazon.com/dp/B01J7ZAJ0E"
"","","B097BVKP9L","Wall Mounted Bin Basket with 5 Hooks 3 Label Plate Adhesive-3 Pack, Cabinet Hanging Metal Wire Basket,Rustic Farmhouse Decor, Storage Organization Shelf for Pantry Kitchen Bathroom 10.6*7.5*5.1inch","X-cosrack","$29.99","473","14","$14,185","06/15/2021","$19.06","4.5","341","$10.93","19,382","7","FBA","1","Kitchen & Dining","Standard","10.6 x 5.1 x 7.5 in","3.96 lb","https://www.amazon.com/dp/B097BVKP9L"
"","","B092QXPMZF","4 Set [Extra Large] Portable Metal Farmhouse Wall Decor Storage Organizer Basket Bin with Handles and Floating Shelves for Hanging in Entryway,Bathroom,Kitchen-Wall Mount Hooks Included (4, Black)","SheeChung","$37.99","389","10","$14,778","05/23/2021","$24.36","4.7","724","$13.63","27,364","7","FBA","1","Kitchen & Dining","Standard","10.039 x 17.362 x 6.929 in","7 lb","https://www.amazon.com/dp/B092QXPMZF"
"","","B08ZN7KXNK","KINLINK [Extra Large] Wire Baskets, Wire Storage Baskets Durable Wire Baskets for Storage Wall Mount, Hanging Wire Baskets Wall Mount Baskets for Kitchen, Bathroom, Closets, Countertop - 2 Pack, White","KINLINK","$29.99","290","5","$8,697","08/22/2021","$18.46","4.7","183","$11.53","52,233","7","FBA","2","Kitchen & Dining","Standard","7.36 x 6.57 x 15.12 in","2.51 lb","https://www.amazon.com/dp/B08ZN7KXNK"
"","","B0CP428DWG","OKZEST 2 Pack Fruit Basket with Wood Lid, Stackable Wire Baskets for Storage Pantry, Hanging Kitchen Basket for Fruit Veggie Snack Bread, Wall Mount Potato and Onion Storage Bin, Countertop Organizer","OKZEST","$29.99","100","3","$2,999","10/27/2023","","4.7","39","","76,035","7","FBA","1","Kitchen & Dining","","","","https://www.amazon.com/dp/B0CP428DWG"
"","","B09HH5ZWJD","SOQKEEN Cotton Rope Hanging Baskets for Organizing 2 Pcs Round Small Wall Basket with Handles Woven Organizer Storage Basket for Kitchen Bedroom Living Room Office(6x6, Black & White)","SOQKEEN","$18.99","40","1","$759.60","09/28/2021","$9.71","4.6","120","$9.28","128,963","7","FBA","1","Kitchen & Dining","Standard","11 x 15 x 3 in","1.001 lb","https://www.amazon.com/dp/B09HH5ZWJD"
"","","B0C1ZB91JP","OKZEST 2pcs Fruit Basket for Kitchen with Tray Top, Stackable Pantry Organizers and Storage Wire Baskets, Wall Hanging & Countertop Cabinet Organizer Bins for Fruit Onion Potato Vegetable Snack Bread","OKZEST","$29.99","92","4","$2,759","04/09/2023","$13.89","4.7","39","$16.10","64,352","7","FBA","1","Kitchen & Dining","Oversize","13 x 9.8 x 8.7 in","6.21 lb","https://www.amazon.com/dp/B0C1ZB91JP"
"","","B097N65MBH","HXSEMAYIG 3PCS [Extra Large] Hanging Wire Baskets, Wall Mount Storage Basket, Rustic Toilet Paper Holder for Storage & Organization","HXSEMAYIG","$19.99","109","2","$2,179","06/20/2021","$10.56","4.6","298","$9.43","94,970","7","FBA","1","Kitchen & Dining","Standard","16.55 x 4.33 x 6.3 in","3.45 lb","https://www.amazon.com/dp/B097N65MBH"
"","","B0881LTFM8","StorageWorks Woven Wall Baskets for Storage, Water Hyacinth Baskets for Shelf, Wall Storage for Kitchen and Bathroom, Hanging Baskets for Organizing, 2 Pack","StorageWorks","$29.99","284","11","$8,517","05/03/2020","$18.16","4.6","960","$11.83","24,381","6","FBA","1","Kitchen & Dining","Standard","8.9 x 15.24 x 6.26 in","2.359 lb","https://www.amazon.com/dp/B0881LTFM8"
"","","B01MTEYVGI","Household Essentials 1226-1 Long Basket Door Mount Cabinet Organizer | Mounts to Solid Cabinet Doors or Walls","Household Essentials","$17.87","197","5","$3,520","01/30/2017","$10.05","4.5","360","$7.82","47,217","6","AMZ","6","Kitchen & Dining","Standard","4.567 x 14.724 x 4.016 in","1.08 lb","https://www.amazon.com/dp/B01MTEYVGI"
"","","B088YH2HLZ","PAG Wall Mount Mail Organizer Double Basket Hanging Letter Sorter with 5 Key Hooks for Entryway/Kitchen/Mudroom/Home/Office, Black","PAG","$15.99","90","4","$1,439","01/08/2019","$9.07","4.4","328","$6.92","54,167","7","FBA","1","Office Products","Standard","9.09 x 3.7 x 10.91 in","16 oz","https://www.amazon.com/dp/B088YH2HLZ"
"","","B08SBK689D","X-cosrack 3 Tier Hanging Metal Wire Basket Bin Extra Large with 5 Hooks Foldable Wall Mount File Holder Sorter Magazine Mail Rack Fruit Organizer for Kitchen Bathroom Entryway Garage Office-Large Size","X-cosrack","$24.99","39","","$974.61","01/06/2021","$2.42","4.6","192","$22.57","229,608","7","FBA","1","Kitchen & Dining","Oversize","15 x 7.8 x 31 in","5.94 lb","https://www.amazon.com/dp/B08SBK689D"
"","","B0CCV8ZRTT","Hanging Fruit Basket For Kitchen - 3 Pack Boho Wall Produce Basket With 6 Strong Hooks, Woven Fruit Holder To Storage Vegetable Potato Onion, Cute Teardrop Decor for Home Wall Mount Organizing (Brown)","Liuoud","$19.99","270","9","$5,397","07/25/2023","","4.5","38","","31,138","","FBA","1","Kitchen & Dining","","","","https://www.amazon.com/dp/B0CCV8ZRTT"
"","","B0CB968B5B","Kanrichu 2pcs Middle Wall Hanging Organizer Bag, Linen Fabric Door Hanging Storage Basket with Pockets, Waterproof Bin for Kitchen, Bedroom, Office, RV Camper (Khaki)","Kanrichu","$17.99","660","22","$11,873","07/16/2022","$10.77","4.3","194","$7.22","43,318","7","FBA","1","Home & Kitchen","Standard","11 x 7.5 x 3.9 in","13.7 oz","https://www.amazon.com/dp/B0CB968B5B"
"","","B01J7ZAB3O","Spectrum Diversified Vintage Large Cabinet & Wall-Mounted Basket for Storage & Organization Rustic Farmhouse Decor, Sturdy Steel Wire Storage Bin, Industrial Gray","Spectrum Diversified","$14.99","577","10","$8,649","07/27/2016","$8.97","4.8","4,814","$6.02","90,448","6","AMZ","1","Home & Kitchen","Standard","10.25 x 7.5 x 5.5 in","11.84 oz","https://www.amazon.com/dp/B01J7ZAB3O"
"","","B09M95K6VC","mDesign Arrow Woven Hyacinth Hanging Wall Mount Storage Organizer Basket - Rustic Hangable Mounted Market Baskets for Kitchen, Bathroom, Shelf - Holds Floral, Food, and Mail - Set of 2 - Natural/Tan","mDesign","$31.99","556","17","$17,786","11/23/2021","$19.56","4.7","185","$12.43","16,403","7","FBA","1","Kitchen & Dining","Standard","12.638 x 12.835 x 6.693 in","1.565 lb","https://www.amazon.com/dp/B09M95K6VC"
"","","B01J7ZAAXA","Spectrum Diversified Vintage Cabinet & Wall Mounted, Rustic Farmhouse Wall Dcor & Organization, Small Wire Basket, Decorative Storage, Bronze","Spectrum Diversified","$8.36","270","10","$2,257","07/27/2016","$3.34","4.8","2,056","$5.02","89,072","7","FBA","4","Home & Kitchen","Standard","11.25 x 4.75 x 4.5 in","8 oz","https://www.amazon.com/dp/B01J7ZAAXA"
"","","B0C61G2ZKC","2pcs Fruit Basket Onion Storage Wire Baskets with Wood Lid, Multifunctional Stackable Wall-mounted & Countertop Tiered Kitchen Counter Organizer for Snack,Produce,Onion and Potato Storage Bins","AIAIWAN","$35.99","306","7","$11,013","03/13/2023","$23.56","4.6","90","$12.43","37,502","7","FBA","1","Kitchen & Dining","Standard","11.8 x 7.9 x 8.5 in","5.2 lb","https://www.amazon.com/dp/B0C61G2ZKC"
"","","B089NYWB9Z","Blue Donuts Set of 3 Wire Baskets for Storage Wall Mount - Stackable Wire Baskets for Organizing, Hanging Wire Basket for Living room, Bathroom, Kitchen, Pantry, Wire Fruit Basket, Black Wire Basket","Blue Donuts","$18.99","45","","$854.55","12/31/2009","$9.71","4.5","278","$9.28","243,456","7","FBA","1","Kitchen & Dining","Standard","6.5 x 5 x 13.5 in","2.72 lb","https://www.amazon.com/dp/B089NYWB9Z"
"","","B08YR23HLK","Viloth Wall Basket, 4 Set Extra Large Hanging Baskets for Organizing with Hooks, Rustic Farmhouse Decor, Wall Mount Metal Baskets for Bathroom Office Kitchen Cabinet Storage (Black)","Viloth","$26.99","77","2","$2,078","03/11/2021","$16.51","4.7","288","$10.48","94,535","6","FBA","1","Kitchen & Dining","Standard","5.7 x 5.7 x 14.6 in","1 lb","https://www.amazon.com/dp/B08YR23HLK"
"","","B01J7ZAB2U","Spectrum Diversified Vintage Cabinet & Wall Mount Basket, Small, Industrial Gray","Spectrum Diversified","$15.97","133","4","$2,124","07/27/2016","$9.80","4.8","2,959","$6.17","207,055","6","AMZ","2","Home & Kitchen","Standard","5 x 10.8 x 4.1 in","0.5 lb","https://www.amazon.com/dp/B01J7ZAB2U"
"","","B0CJVCXFGB","TGRPIOG 2 PCS Hanging Kitchen Baskets For Storage Adhesive Sturdy Small Wire Storage Baskets with Kitchen Food Pantry Bathroom Shelf Storage No Drilling Wall Mounted","TGRPIOG","$18.99","165","4","$3,133","09/25/2023","$11.00","5","1","$7.99","58,487","6","FBA","1","Kitchen & Dining","Standard","4.92 x 4.72 x 11 in","1.37 lb","https://www.amazon.com/dp/B0CJVCXFGB"
"","","B07BJYQGTT","LANTWOO Remote Control Holder Wall Mount Media Organizer Storage Box","LANTWOO","$11.99","150","5","$1,799","03/17/2018","$6.65","4.7","411","$5.34","45,643","5","FBA","1","Office Products","Standard","5 x 2.48 x 5.67 in","3.06 oz","https://www.amazon.com/dp/B07BJYQGTT"
"","","B07P5TTRCY","mDesign Plastic Wall Mount Organizer - 12' Wide Hanging Caddy for Home Storage - Angled Mountable Container Bin for Dorm, Bathroom, and Office - Phone Holder Basket - Ligne Collection - 2 Pack -Clear","mDesign","$25.99","721","20","$18,739","06/23/2019","$14.46","4.8","373","$11.53","14,247","7","FBA","1","Kitchen & Dining","Standard","11.89 x 13.46 x 6.22 in","2.449 lb","https://www.amazon.com/dp/B07P5TTRCY"
"","","B08GCL5N2Z","Wall Mounted Wire Basket Kitchen Storage Pantry Organizer Fruit Basket Varying Sizes Set of 3 Black","None Branded","$24.99","88","2","$2,199","08/19/2020","$15.45","4.5","65","$9.54","124,236","7","FBA","1","Kitchen & Dining","Standard","0.787 x 0.787 x 0.787 in","2.738 lb","https://www.amazon.com/dp/B08GCL5N2Z"
"","","B09FDY2H42","Epicano Metal Wire Basket Wall Mount,3-Tier Hanging Basket Fruit organizer with Removable Hooks Chalkboards, Rustic Fruit Vegetable Storage Bins for Kitchen Counter, Garage Or Bathroom(black)","Epicano","$39.99","15","","$599.85","09/02/2021","$26.66","4.4","74","$13.33","248,919","7","FBA","1","Kitchen & Dining","Standard","12.09 x 5.35 x 12.99 in","6.85 lb","https://www.amazon.com/dp/B09FDY2H42"
"","","B01J7ZAB2A","Spectrum Diversified Vintage Large Cabinet & Wall-Mounted Basket Organization Rustic Farmhouse Decor, Sturdy Steel Wire Storage Bin, Bronze","Spectrum Diversified","$16.91","100","3","$1,691","07/27/2016","$10.60","4.8","2,876","$6.31","238,598","7","AMZ","1","Home & Kitchen","Standard","10.25 x 7.5 x 5.5 in","11.84 oz","https://www.amazon.com/dp/B01J7ZAB2A"
"","","B0CH8877B6","Goovilla Hanging Wall Baskets (2 Ways to Use), Magnetic Spice Rack for Refrigerator 4 Pack with 2 Hooks, Plastic Spice Racks Organizer Wall Mount for Kitchen Pantry Bathroom Laundry Storage, Black","Goovilla","$28.99","274","15","$7,943","09/03/2023","$18.21","4.9","31","$10.78","18,537","7","FBA","1","Kitchen & Dining","Standard","4.92 x 6.5 x 12.4 in","3.66 lb","https://www.amazon.com/dp/B0CH8877B6"
"","","B0BR51Z837","2 Pack Hanging Kitchen Basket, Bathroom Bath Basket, Household Goods Storage Basket, with Traceless Tape, no Drilling, for Cabinet Storage, Kitchen, Bathroom, Storage Room (2 Black)","JUNCHU CHERRY","$14.95","461","15","$6,892","12/26/2022","","4.7","201","","18,155","6","FBA","1","Kitchen & Dining","","","","https://www.amazon.com/dp/B0BR51Z837"