"Export time:  1/30/2024, 5:18:07 PM","","ASIN","Product Name","Brand","Price","Monthly Units Sold","Daily Units Sold","Monthly Revenue","Date First Available","Net Revenue","Star Rating","Reviews","Amazon Fees","BSR","LQS","Seller Type","Sellers","Category","Product Tier","Dimensions","Weight","Link"
"","","B07W5KGQ6R","SONGMICS Storage Basket with Lid, 17.2 Gallon (65L) Storage Bin, Woven Blanket Storage Basket with Handles, Foldable, Removable Liner, Metal Frame, for Bedroom, Laundry Room, Brown URST56BR","SONGMICS","$55.99","2,019","60","$113,044","11/25/2019","$34.85","4.6","2,336","$21.14","14,607","6","FBA","2","Home & Kitchen","Oversize","15 x 24 x 4 in","6.151 lb","https://www.amazon.com/dp/B07W5KGQ6R"
"wicker storage basket with lid","","B08JQKFK5V","Homepeaz Set of 3 Woven Storage Basket Bin Wicker Hamper Stackable Box with Lid & Lock, Container Tote Cube Organizer for Nursery, Baby Toiletry, Diaper, Toys, Home Closet, Laundry, DVD, Book (Grey)","Homepeaz","$37.99","626","18","$23,782","09/15/2020","$24.06","4.5","1,444","$13.93","6,321","7","FBA","1","Baby","Standard","11.5 x 14.5 x 8 in","4.2 lb","https://www.amazon.com/dp/B08JQKFK5V"
"Average Monthly Sales: 813","","B01LL1C92I","StorageWorks Storage Box with Lid, Foldable Clothes Closet Organizer, Mixing of Beige, White & Ivory, Bamboo Style, Extra Large, 58.7L Huge Capacity","StorageWorks","$29.99","1,358","33","$40,726","09/03/2016","$18.76","4.7","1,259","$11.23","27,973","6","FBA","1","Home & Kitchen","Standard","12.4 x 17.4 x 2.2 in","4.7 lb","https://www.amazon.com/dp/B01LL1C92I"
"Average Revenue: $31,391","","B06XHJXN8N","StorageWorks Storage Bins with Lids, Decorative Storage Boxes with Lids and Soft Rope Handles, Mixing of Beige, White & Ivory, Large, 3-Pack","StorageWorks","$37.99","1,468","46","$55,769","06/09/2017","$24.36","4.7","4,904","$13.63","19,792","6","FBA","3","Home & Kitchen","Standard","10.25 x 8 x 14.75 in","4 lb","https://www.amazon.com/dp/B06XHJXN8N"
"Average Price: $41.18","","B0BZXTF3TC","StorageWorks Water Hyacinth Wicker Baskets for Organizing, Large Wicker Basket with Lid, Decorative Basket with Built-in Handles, Storage Baskets for Shelves, 1 Pack","StorageWorks","$38.99","695","17","$27,098","06/20/2023","$25.21","4.5","193","$13.78","56,329","6","FBA","1","Home & Kitchen","Standard","11 x 7 x 15 in","2.21 lb","https://www.amazon.com/dp/B0BZXTF3TC"
"Average No. of Ratings: 742","","B0C9ZYSWYG","OEHID Wicker Storage Baskets with Lid, Hand-Woven Rectangular Wicker Basket with Lid for Bedroom & Living Room, Nesting Rattan Basket with Lid for Shelves (Water Hyacinth, 3-Pack)","OEHID","$46.99","180","6","$8,458","07/02/2023","","4.9","19","","135,131","6","FBA","1","Home & Kitchen","","","","https://www.amazon.com/dp/B0C9ZYSWYG"
"Average Sales Rank: 210,041","","B0C22WJ9ZX","SONGMICS Storage Basket with Lid, 27.7 Gallon (105L) Storage Bin, Woven Blanket Storage Basket with Handles, Foldable, Removable Liner, Metal Frame, for Bedroom, Laundry Room, Brown URST066K01","SONGMICS","$63.99","2,069","60","$132,395","12/02/2019","","4.6","2,336","","14,607","6","FBA","1","Home & Kitchen","","","","https://www.amazon.com/dp/B0C22WJ9ZX"
"Average Rating Number: 4.5","","B093HKQ7JT","Ruosuruosu Decorative Wicker Storage Bins with Lids,Woven Seagrass Storage Baskets for Kids Toys,Shelves, Bathroom, Bedroom,Set of 3 Stackable Storage Boxes Large, Medium, Small","Ruosuruosu","$35.99","210","7","$7,558","04/25/2021","$22.96","4.5","260","$13.03","133,095","6","FBA","1","Home & Kitchen","Standard","9.764 x 14.646 x 7.362 in","2.438 lb","https://www.amazon.com/dp/B093HKQ7JT"
"","","B09CYNHF65","Greenstell Storage Basket with Lid, Handwoven Large Shelf Basket with Cotton Liner and Metal Frame, Foldable & Easy to Install, Laundry Room 65L (Natural, 22.2x13.4x13.4 inch)","GREENSTELL","$45.99","547","17","$25,157","11/25/2021","$6.21","4.6","706","$39.78","54,444","7","FBA","1","Home & Kitchen","Oversize","13.39 x 22.24 x 13.39 in","3.35 kg","https://www.amazon.com/dp/B09CYNHF65"
"","","B0C9J3D6V4","StorageWorks Wicker Storage Basket with Lid, 65L Square Wicker Baskets with lids and Removable Liner, Wicker Storage Trunk, Wicker Basket with Lid for Bedroom, Closet, Bathroom - Natural Tan","StorageWorks","$39.99","365","15","$14,596","09/11/2023","$1.49","4.3","116","$38.50","61,869","6","FBA","3","Home & Kitchen","Oversize","13.5 x 13.5 x 21.75 in","2.86 kg","https://www.amazon.com/dp/B0C9J3D6V4"
"","","B0CFQYGM6K","RT&BS Wicker Storage Basket with Lid, Handwoven Storage Basket Box - Organizer for Toys Books Fruits Stationery (M, 12.6 * 8.66 * 7.09'')","RT&BS","$26.99","","","$0.00","08/14/2023","$17.80","4","1","$9.19","845,149","7","FBA","1","Home & Kitchen","Standard","8.66 x 7.09 x 12.6 in","730 g","https://www.amazon.com/dp/B0CFQYGM6K"
"","","B08PV4PFRB","Honygebia Bamboo Decorative Storage Boxes - Set of 3 Woven Lined Storage Basket with Lids, Beige Wicker Lidded Baskets for Home Kitchen Shelf Organizer Decor","Honygebia","$36.90","289","9","$10,664","12/06/2020","$24.34","4.5","696","$12.56","100,343","6","FBA","2","Home & Kitchen","Standard","10 x 6 x 13 in","3.5 lb","https://www.amazon.com/dp/B08PV4PFRB"
"","","B0CDSJHR2Y","Homepeaz Wicker Storage Baskets with Lids, Set of 3 Decorative Storage Boxes, Woven Baskets with Lock & Handle, Closet Storage and Organizer, Nesting Storage Bins for DVD Makeup Bathroom Decor, Beige","Homepeaz","$39.99","87","4","$3,479","08/04/2023","","4.7","13","","20,218","7","FBA","1","Baby","","","","https://www.amazon.com/dp/B0CDSJHR2Y"
"","","B07RXW6J35","GRANNY SAYS Fabric Large Storage Bins with Lids, Collapsible Storage Box Closet Shelf, Decorative Baskets for Organizing Bedroom Dorm Nursery, Gray, 3-Pack","GRANNY SAYS","$28.99","1,860","61","$53,921","05/15/2019","$17.91","4.6","8,069","$11.08","14,235","6","FBA","1","Home & Kitchen","Standard","10.5 x 15 x 3 in","4.299 lb","https://www.amazon.com/dp/B07RXW6J35"
"","","B0C4TDMPV3","Chi An Home Wicker Storage Baskets with Lids, Set of 3 Lidded Hyacinth Baskets for Organizing, Woven Rectangular Baskets for Storage, Decorative Basket with Lid, Multifunctional Storage Organizer","Chi An Home","$39.95","540","","","05/15/2023","$23.03","4.4","24","$16.92","55,586","7","FBA","1","Home & Kitchen","Standard","11.02 x 7.3 x 14.17 in","2 kg","https://www.amazon.com/dp/B0C4TDMPV3"
"","","B0CGTT6BL9","Kigley 6 Pcs Seagrass Baskets with Lids Wicker Storage Basket Organizer Baskets Rectangular Basket Boxes Woven Baskets for Shelf Closet Bedroom Back to School, 6 Sizes(Yellow Brown, Classic Style)","Kigley","$57.99","197","7","$11,424","11/02/2023","","4.1","17","","123,955","7","FBA","30","Home & Kitchen","","","","https://www.amazon.com/dp/B0CGTT6BL9"
"","","B0CLXKJ1ZJ","Moosky Wicker Shelf Baskets with Lid,Natural Seagrass Storage Basket Boxes Handwoven Rectangular Baskets Bins Multipurpose Home Organizer Decor (Small)","Moosky","$14.99","175","9","$2,623","10/26/2023","","4.6","6","","105,383","6","FBA","1","Home & Kitchen","","","","https://www.amazon.com/dp/B0CLXKJ1ZJ"
"","","B08VN9J2MG","FIYAMMY Rattan Basket With Lid, Large Lidded Basket For Storage Rattan Box(15.3' L11.4'W9.5'H)","FIYAMMY","$89.59","249","9","$22,308","02/01/2021","$63.03","4.6","184","$26.56","104,568","6","FBA","1","Home & Kitchen","Oversize","11.5 x 15.25 x 9.5 in","3.6 lb","https://www.amazon.com/dp/B08VN9J2MG"
"","","B0BQ3H7PT8","Clear Storage Bin with Lid 3 Pack 【Stackable & Sturdy】Plastic Bins for Storage, Multifunctional Folding Storage Bins for Bedroom, Living Room, Study, Toy Room, 24 QT Folding Box with Magnetic door","Kmiectse","$40.99","3,980","94","$163,140","12/28/2022","$17.54","4.7","869","$23.45","8,532","7","FBA","3","Home & Kitchen","Oversize","11.02 x 8.66 x 14.96 in","4.72 kg","https://www.amazon.com/dp/B0BQ3H7PT8"
"","","B07PQT56GK","Sorbus Set of 3 Storage Baskets for Organizing with Lid, Mesh Hand-Woven Design, Linen Closet Organizers and Storage, Organizer Storage Baskets for Shelves, Variety Pack Organizers and Storage (Beige)","Sorbus","$32.99","280","8","$9,237","12/12/2018","$19.21","4.7","1,799","$13.78","113,985","7","FBA","2","Home & Kitchen","Standard","12.32 x 7.44 x 17.6 in","4 lb","https://www.amazon.com/dp/B07PQT56GK"
"","","B0BD28T6MB","Hipiwe Wicker Shelf Baskets Bin with Lid, Handwoven Seagrass Basket Storage Bins Rectangular Household Basket Boxes for Shelf Wardrobe Home Organizer, Coffee X-Small","Hipiwe","$15.99","2,358","84","$37,704","09/03/2022","","4.6","808","","9,868","7","FBA","1","Home & Kitchen","","","","https://www.amazon.com/dp/B0BD28T6MB"
"","","B09RP71PXB","Household Essentials Handwoven Paper Rope Barrel Wicker Storage Basket Side Table, Cream","Household Essentials","$111.14","144","4","$16,004","10/17/2015","$64.99","4.7","537","$46.15","193,934","6","AMZ","2","Home & Kitchen","Oversize","20 x 19 x 20 in","15 lb","https://www.amazon.com/dp/B09RP71PXB"
"","","B0C925Y8L2","RoyalHouse Woven Stackable Storage Baskets with Lid, Decorative Rope Organizer Bin - Set of 2 (2 Sizes), Beige (No Liner)","RoyalHouse","$23.99","410","10","$9,836","06/21/2023","$13.96","4.5","42","$10.03","88,180","6","FBA","3","Home & Kitchen","Standard","5.5 x 6.5 x 12.5 in","2.35 lb","https://www.amazon.com/dp/B0C925Y8L2"
"","","B0BTHKSJFG","GRANNY SAYS Storage Basket with Lid, Wicker Baskets for Storage, Set of 3 Decorative Storage Boxes, Woven Baskets for Organizing, Nesting Woven Wicker Storage Basket, Nature, 3-Pack","GRANNY SAYS","$36.99","303","12","$11,208","05/20/2023","$20.51","4.2","83","$16.48","77,259","6","FBA","1","Home & Kitchen","Standard","11.42 x 7.09 x 14.17 in","1.98 kg","https://www.amazon.com/dp/B0BTHKSJFG"
"","","B0BP7KDDYL","SONGMICS Laundry Hamper with Lid, 17.2 Gallon (65L) Synthetic Rattan Clothes Laundry Basket with Lid and Handles, Foldable, Removable Liner, Natural ULCB165N01","SONGMICS","$37.99","7,402","287","$281,202","02/28/2023","$11.95","4.6","216","$26.04","1,762","6","AMZ","4","Home & Kitchen","Oversize","13.4 x 23.6 x 13.4 in","6.64 lb","https://www.amazon.com/dp/B0BP7KDDYL"
"","","B097BK6QHW","Wicker Storage Basket with Lid, Natural Woven Rattan Seagrass Storage Box Rectangular Household Organizer Boxes Shelf Wardrobe Organizer (L)","Sobotoo","$21.99","228","6","$5,014","06/15/2021","$11.96","4.2","152","$10.03","153,224","7","FBA","1","Home & Kitchen","Standard","9.61 x 11.65 x 5.75 in","1.369 lb","https://www.amazon.com/dp/B097BK6QHW"
"","","B0BHJ27SY4","Hipiwe Black Storage Basket with Lid & Lock Plastic Woven Organizer Bins Built-in Carry Handles Household Organizer Boxes for Shelf Wardrobe Multipurpose Container for Toy Book Clothes","Hipiwe","$24.99","330","11","$8,247","10/05/2022","","4.4","65","","85,000","7","FBA","1","Home & Kitchen","","","","https://www.amazon.com/dp/B0BHJ27SY4"
"","","B0CHY3Y7JN","Suzile 2 Pcs Wicker Storage Basket with Lid 17.2 Gallon/ 65 L Large Wicker Storage Bins with Cotton Liner and Metal Frame Foldable Basket with Lid Rectangular Storage Box for Bedroom Laundry Room","Suzile","$73.99","","","$0.00","12/23/2023","","","","","815,612","7","FBA","1","Home & Kitchen","","","","https://www.amazon.com/dp/B0CHY3Y7JN"
"","","B0BB6591P4","Extra Large Storage Basket with Lid 60L, 16'Wx18'H Woven laundry basket with lid Jute Laundry Basket, Wicker Basket Blankets Pillows Storage in Living Room Baby Nursery, Jute/Black Mix with Lid","JIABOLANG","$42.98","78","4","$3,352","08/18/2022","","4.1","46","","19,135","7","FBA","3","Baby","","","","https://www.amazon.com/dp/B0BB6591P4"
"","","B0CDWRPRFS","WeeNest Baskets with Lids, Wicker Storage Baskets with Lids, Shelf Baskets for Organizing, Baskets with Lids for Organizing, Wicker Decorative Basket, Resin Wicker Set of 3, Toffee","WeeNest","$59.99","30","1","$1,800","08/06/2023","","4.9","28","","463,707","6","FBA","1","Home & Kitchen","","","","https://www.amazon.com/dp/B0CDWRPRFS"
"","","B0BDRCSP6W","LOVSTORAGE 20.5'x14.5' Large Rope Blanket Basket with Lid, Woven Storage Basket Laundry Basket Hamper Decorative Basket Bin with Handles for Living Room Bedroom","LOVSTORAGE","$31.99","810","27","$25,912","09/08/2022","","4.1","519","","34,461","7","FBA","3","Home & Kitchen","","","","https://www.amazon.com/dp/B0BDRCSP6W"
"","","B0C5DHB87C","Set of 4 Seagrass Basket with Lids Rattan Wicker Storage Basket Handwoven Decorative Storage Boxes with Lids Multipurpose Woven Basket Bins for Shelf Closet (Coffee)","Woanger","$39.99","299","9","$11,957","03/13/2023","","4.2","40","","99,358","7","FBA","1","Home & Kitchen","","","","https://www.amazon.com/dp/B0C5DHB87C"
"","","B08GKMFWM7","Hipiwe Set of 2 Flat Woven Wicker Storage Bins with Lid Natural Seagrass Basket Multipurpose Home Boxes for Shelf Organizer (Coffee)","Hipiwe","$23.98","2,213","89","$53,068","08/23/2020","$14.59","4.7","711","$9.39","9,138","7","FBA","1","Home & Kitchen","Standard","11.024 x 2.756 x 12.598 in","1.213 lb","https://www.amazon.com/dp/B08GKMFWM7"
"","","B0CJ6ST5Q3","HONCESTA Extra Large Woven Basket with Lid, 20' X 15' Wicker Blanket Storage Basket Living Room, Tall Rope Storage Baskets for Toys, Decorative Kids Toy Bin Box with Cover, Baby Laundry Basket Hamper","HONCESTA","$29.99","205","11","$6,148","09/15/2023","","4.3","37","","9,340","7","FBA","1","Baby","","","","https://www.amazon.com/dp/B0CJ6ST5Q3"
"","","B07YPZZX34","mDesign Woven Water Hyacinth Rectangle Storage Organizer Basket Bin with Topper Lid and Handles - Natural Farmhouse Holder Containers for Closet, Bedroom, Bathroom, Office - Set of 3 - Natural/Tan","mDesign","$49.99","60","2","$2,999","10/03/2019","$30.50","4.6","447","$19.49","309,604","7","FBA","1","Home & Kitchen","Oversize","9.1 x 18.3 x 8.7 in","5.201 lb","https://www.amazon.com/dp/B07YPZZX34"
"","","B0C9R6SWY8","MEGASKET Black Basket with Lid, 20' X 15' Large Wicker Baskets for Organizing, Woven Cotton Rope Baskets for Storage, Kids Room Storage Toy Box Organizer and Storage Basket, Stuffed Animals basket Bin","MEGASKET","$26.99","318","11","$8,583","06/28/2023","$-2.34","3.6","76","$29.33","9,480","7","FBA","1","Baby","Oversize","20 x 15 x 20 in","5.7 lb","https://www.amazon.com/dp/B0C9R6SWY8"
"","","B09MZG1T2J","Homepeaz Set of 3 Woven Wicker Storage Basket Box with Lid & Lock, Built-in Carry Handles, Multifunctional Storage Organiser for Nursery, Baby, Clothes, Toys, Books, Large/Medium/Small Size (Brown)","Homepeaz","$37.99","612","18","$23,250","01/11/2022","","4.5","1,444","","6,321","7","FBA","3","Baby","","","4.36 lb","https://www.amazon.com/dp/B09MZG1T2J"
"","","B0BYCY1G3L","WK&YOHFY Storage Baskets Hand-Woven Rectangular Seagrass Cube Storage Bins for Bedroom, Living Room, Nursery Room-Storage Cubes with Lids&Letter Boards,Set of 3 Pcs(Nested)","WK&YOHFY","$31.99","120","4","$3,839","03/13/2023","","4.7","19","","198,182","7","FBA","1","Home & Kitchen","","","","https://www.amazon.com/dp/B0BYCY1G3L"
"","","B0BN2VL9YH","Esoes Wicker Storage Basket Woven Rattan Storage Box With Lids Seagrass Laundry Baskets Makeup Organizer For Bathroom, Living Room, Kitchen (L+XXL)","Esoes","$28.99","163","5","$4,725","11/21/2022","$17.61","3.8","15","$11.38","166,385","6","FBA","1","Home & Kitchen","Standard","14.17 x 6.7 x 7.48 in","1.5 lb","https://www.amazon.com/dp/B0BN2VL9YH"
"","","B07JYVGV5W","KOUBOO La Jolla Rectangular Rattan Box, Honey-Brown Toilet Roll Storage Basket","Kouboo","$62.99","","","$1,890","04/08/2019","$46.51","4.6","46","$16.48","696,086","5","AMZ","1","Home & Kitchen","Standard","8.386 x 12.795 x 7.284 in","2.641 lb","https://www.amazon.com/dp/B07JYVGV5W"
"","","B0CMHXZ83C","4 Pcs Handmade Wicker Woven Storage Basket with Lids and Handles, Rectangular Wooden Rattan Organizer, Decorative Water Hyacinth Seagrass Basket for Bathroom Toilet Shelf, Laundry Room, Pantry","mzxoo","$38.68","","","$0.00","11/02/2023","$25.97","","","$12.71","1,069,376","4","FBA","1","Home & Kitchen","Standard","8.7 x 6 x 13 in","3.96 lb","https://www.amazon.com/dp/B0CMHXZ83C"
"","","B0B6VTSGV1","Hipiwe Wicker Shelf Baskets Bin with Lid Handwoven Seagrass Storage Basket Container Square Multipurpose Household Basket Boxes for Shelves and Home Organizer, Coffee Small","Hipiwe","$17.99","190","11","$3,418","07/17/2022","","4.5","58","","80,634","7","FBA","1","Home & Kitchen","","","","https://www.amazon.com/dp/B0B6VTSGV1"
"","","B0BY2M6FGB","Didaey Set of 4 Seagrass Basket with Lid Wicker Storage Basket Decorative Storage Boxes with Lids Flat Storage Bins Woven Organizer Baskets for Shelf Closet Bedroom, 4 Sizes (Brown)","Didaey","$41.99","351","12","$14,738","03/09/2023","","4.5","47","","74,022","7","FBA","1","Home & Kitchen","","","","https://www.amazon.com/dp/B0BY2M6FGB"
"","","B0CPSQ3THH","Moosky Flat Wicker Shelf Baskets with Lid, Seagrass Woven Basket Boxes for Storage Basket Bins Multipurpose Home Decor Organizer (Natural Set of 2)","Moosky","$22.99","130","3","$2,989","12/07/2023","","","","","252,174","6","FBA","1","Home & Kitchen","","","","https://www.amazon.com/dp/B0CPSQ3THH"
"","","B0CHY6XVCF","Moosky Wicker Shelf Baskets with Lid,Handwoven Seagrass Basket for Storage Basket Bins Rectangular Home Organizer Gift Boxes (Natural Small)","Moosky","$13.99","180","6","$2,518","09/12/2023","","4.7","13","","146,083","6","FBA","1","Home & Kitchen","","","","https://www.amazon.com/dp/B0CHY6XVCF"
"","","B0BNM9ZFMY","Hipiwe Wicker Shelf Baskets Bin with Lid, Set of 3 Handwoven Seagrass Basket Storage Bins Rectangular Household Basket Boxes for Shelf Closet Home Organizer (S+M+L)","Hipiwe","$27.98","206","8","$5,764","11/29/2022","$17.99","4.6","114","$9.99","111,220","6","FBA","1","Home & Kitchen","Standard","11 x 4 x 7 in","1.48 lb","https://www.amazon.com/dp/B0BNM9ZFMY"
"","","B0CH3KSYFL","2 Pieces Seagrass Baskets with Lid, Rectangular Hand Woven Wicker Bin Storage Box for Shelves Organizing, Small Rustic Home Storage Organizer Container (16.54 x 5.51 x 5.51 Inches, Khaki)","Cunhill","$35.99","193","8","$6,946","08/14/2022","$24.16","4.4","39","$11.83","112,425","7","FBA","1","Home & Kitchen","Standard","9.8 x 4.3 x 12.9 in","2.26 lb","https://www.amazon.com/dp/B0CH3KSYFL"
"","","B0B2QWH3N1","Elsjoy 2 Pack Seagrass Baskets with Lid, Wicker Storage Baskets Flat Rattan Storage Bins, Woven Organizer Baskets for Shelf, Closet, Bedroom","Elsjoy","$24.99","129","4","$3,224","05/30/2022","$14.81","4.5","124","$10.18","226,357","7","FBA","1","Home & Kitchen","Standard","11.42 x 3.07 x 12.87 in","1.32 lb","https://www.amazon.com/dp/B0B2QWH3N1"
"","","B0925K4764","Yimi's Dream Storage Basket with Lid, Cotton Rope Woven Storage Basket, Small Storage Bins, Nursery Organizers and Storage, Baby Toy Laundry Basket (White & Grey, 12D x 13.5H Inches)","Yimi's Dream","$26.99","454","13","$12,253","04/09/2021","$9.06","4.3","766","$17.93","72,196","7","FBA","1","Home & Kitchen","Oversize","12 x 13.5 x 12 in","2.44 lb","https://www.amazon.com/dp/B0925K4764"
"","","B0C77M6VB8","MOORLITER Storage Basket with Lid, 27.7 Gallon (105L) Wicker Storage Trunk with Handles, Handwoven Wicker Basket for Blanket, Removable Liner, Easy to assemble, for Living Room, Laundry Room, Grey","MOORLITER","$54.99","","","$0.00","06/05/2023","","5","6","","866,898","7","FBA","1","Home & Kitchen","","","","https://www.amazon.com/dp/B0C77M6VB8"
"","","B091HZC924","Round Rattan Boxes with Lid Hand-Woven Multi-Purpose Wicker Tray 8.6Inch Picnic Food Bread Table Storage Basket (22x13cm)","KODENG","$27.80","179","6","$4,976","03/31/2021","$19.86","4.3","94","$7.94","43,569","6","FBA","2","Kitchen & Dining","Standard","8.86 x 4.84 x 8.86 in","8.1 oz","https://www.amazon.com/dp/B091HZC924"
"","","B07WR7BX97","Goodpick Tall Laundry Hamper | Woven Jute Rope Dirty Clothes Hamper Modern Hamper Basket Large in Laundry Room, 25.6' Height","Goodpick","$33.99","719","20","$24,439","08/18/2019","$21.86","4.4","6,212","$12.13","47,545","6","FBA","3","Home & Kitchen","Standard","11 x 13.8 x 5.3 in","5.099 lb","https://www.amazon.com/dp/B07WR7BX97"
"","","B0CHRYM374","Beeveer 6 Pcs Wicker Basket with Lid 6 Sizes Large Seagrass Storage Baskets Stackable Decorative Storage Boxes Woven Rectangular Rattan Storage Bins Shelf Baskets Organizer for Closet Bedroom, Coffee","Beeveer","$44.99","30","1","$1,350","09/10/2023","$25.88","","","$19.11","531,824","7","FBA","1","Home & Kitchen","Oversize","16.34 x 4.45 x 17.4 in","4.38 lb","https://www.amazon.com/dp/B0CHRYM374"
"","","B0C4PFH5QJ","PEMAR Natural Wicker Stacking Rectangular Storage Baskets with Lids, Stackable Lidded Woven Basket Bins, Decorative Storage Box Organiser, Lidded Straw Wire Closet Storage Baskets. 3 Pack Set","PEMAR","$49.34","","","$0.00","05/08/2023","","5","1","","3,361,345","6","FBA","1","Home & Kitchen","","","","https://www.amazon.com/dp/B0C4PFH5QJ"
"","","B08MF5H21G","22'x14'x18' Rectangular Extra Large Storage Basket with Lid, Cotton Rope Storage Baskets, Laundry Hamper, Toy Bin, for Toys Blankets Storage in Living Room, Baby Nursery, All Beige","Cottonphant","$52.99","175","5","$9,273","01/15/2021","$37.71","4.4","175","$15.28","15,503","7","FBA","1","Baby","Standard","12.598 x 3.937 x 16.929 in","5.512 lb","https://www.amazon.com/dp/B08MF5H21G"
"","","B0BF19XZYY","WAYIDEAL Cotton Rope Storage Basket with Lid & Wicker basket with Lid for Toys, Books, Multi-Purpose Storage Basket for Living Room,Christmas gifts. 14x13inches(Brown)","Wayideal","$22.99","314","10","$7,219","10/16/2022","","4.3","90","","9,734","7","FBA","1","Baby","","","","https://www.amazon.com/dp/B0BF19XZYY"
"","","B0CH8X6XCK","Plastic Storage Baskets With Bamboo Lid - Plastic Storage Containers Stackable Storage bins: Storage Baskets for Organizing Shelves Drawers Desktop Closet Playroom Classroom Office, 6 Pack","Ohmlove","$36.99","1,325","39","$49,012","10/12/2023","","4.6","72","","23,328","7","FBA","1","Home & Kitchen","","","","https://www.amazon.com/dp/B0CH8X6XCK"
"","","B08BC9DVHY","StorageWorks 55L Storage Bin, Decorative Closet Storage Box with Double-Open Lid, Divider Board and 3 PU Handles, Hand Wash, Canvas, Ivory White, Extra Large","StorageWorks","$29.99","1,321","33","$39,617","06/15/2020","$18.76","4.7","1,259","$11.23","27,973","6","FBA","1","Home & Kitchen","Standard","11.89 x 17.362 x 2.756 in","3.053 lb","https://www.amazon.com/dp/B08BC9DVHY"
"","","B09Z9QP2G4","Storage Bins with Lids - 4 Packs Stackable,Collapsible Storage Bins,Plastic Storage Bins for Closet,Folding Storage Box,Dual Open Bathroom Organizer Laundry Room Organization","wookon","$176.99","838","15","$148,318","04/30/2022","$129.34","4.4","924","$47.65","62,262","7","FBA","3","Home & Kitchen","Oversize","15.8 x 22.1 x 12.9 in","18.999 lb","https://www.amazon.com/dp/B09Z9QP2G4"
"","","B09F32F4TR","Bagnizer Large 22 Quart Linen Fabric Foldable Storage Bin Cube Organizer Basket with Flip-Top Lid & Handles, Clothes Blanket Box for Home, Office, Closet, Gray, 4 Pack 14.6 x 9.5 x 9.5","Bagnizer","$29.99","3,899","126","$116,931","08/30/2021","","4.6","965","","5,829","7","FBA","5","Home & Kitchen","","","","https://www.amazon.com/dp/B09F32F4TR"