"Export time:  1/30/2024, 12:37:40 AM","","ASIN","Product Name","Brand","Price","Monthly Units Sold","Daily Units Sold","Monthly Revenue","Date First Available","Net Revenue","Star Rating","Reviews","Amazon Fees","BSR","LQS","Seller Type","Sellers","Category","Product Tier","Dimensions","Weight","Link"
"","","B09RGFMG2F","Youngever 2 Pack Plastic Tea Packet Organizers, Tea Bag Holder, Tea Bag Storage, 8.5' x 3' x 2'","Youngever","$14.99","128","2","$1,919","01/27/2022","$8.97","4.6","105","$6.02","321,084","5","FBA","1","Home & Kitchen","Standard","4.291 x 8.74 x 3.268 in","0.668 lb","https://www.amazon.com/dp/B09RGFMG2F"
"teabag holder organizer","","B08DCH2LVT","Utopia Home Tea Bag Organizer - Stackable Storage With Lid For Tea Bags - Multi-Functional Clear Kitchen Storage","Utopia Home","$26.99","5,444","201","$146,934","07/20/2020","$17.80","4.8","2,630","$9.19","3,045","6","FBA","1","Home & Kitchen","Standard","1 x 1 x 1 in","1 lb","https://www.amazon.com/dp/B08DCH2LVT"
"Average Monthly Sales: 733","","B09WN3RFQZ","    Tea Bag Organizer Storage Holder for Tea Bags Wood Tea Box Containers Tea Rack Teabag Station Stand for Cabinet Countertop Office(Patented Design)","TIOPGHAD","$39.99","1,950","47","$77,981","03/27/2022","$26.66","4.7","685","$13.33","19,124","7","FBA","2","Home & Kitchen","Standard","8.11 x 12.795 x 4.921 in","6.598 lb","https://www.amazon.com/dp/B09WN3RFQZ"
"Average Revenue: $16,544","","B0BXWBFZ7S","FUCDTEFC Tea Bag Organizer, Tea Bag Holder Box Storage Bin, Clear Tea Packet Plastic Drawer, Sugar Packet, Coffee, Condiment, Tea Spice Bag Holder for Kitchen Cabinet, Countertop, Fridge","FUCDTEFC","$9.99","1,081","32","$10,799","03/08/2023","","4.9","39","","29,204","6","FBA","1","Home & Kitchen","","","","https://www.amazon.com/dp/B0BXWBFZ7S"
"Average Price: $24.46","","B09V2TZZQQ","Tea Bag Organizer, Tea Bag Storage Holder Spinning Carousel 96 Teabags Container, Lazy Susan Coffee Creamer Sweetener Tea Caddy for Kitchen Counter Cabinet Pantry Shelf Organizer","VOGWOLTH","$26.99","560","15","$15,114","03/07/2022","$17.15","4.8","512","$9.84","62,511","6","FBA","4","Home & Kitchen","Standard","6.14 x 9.57 x 6.06 in","2.07 lb","https://www.amazon.com/dp/B09V2TZZQQ"
"Average No. of Ratings: 1,561","","B07MCYJW51","Nifty Tea Bag Spinning Carousel  6 Compartments, Up to 60 Tea Bags Storage, Spins 360-Degrees, Lazy Susan Platform, Modern Chrome Design, Home or Office Kitchen Counter Organizer","Nifty Solutions","$18.99","4,398","146","$83,518","12/20/2018","$10.35","4.8","9,070","$8.64","4,779","6","FBA","2","Home & Kitchen","Standard","7.01 x 8.23 x 6.57 in","1.191 lb","https://www.amazon.com/dp/B07MCYJW51"
"Average Sales Rank: 190,028","","B0784VKM9M","Bambüsi Tea Bag Organizer - Tea Organizer: Wooden Tea Box with 8 Compartments, Acrylic Window, and Magnetic Lid, Made of Bamboo - Keeps Tea Bags Fresh (Tea Not Included) - Great Gift Idea","Bambüsi","$26.99","1,174","26","$31,686","11/27/2017","$16.51","4.7","3,291","$10.48","35,752","7","FBA","8","Home & Kitchen","Standard","9 x 4 x 13 in","3.25 lb","https://www.amazon.com/dp/B0784VKM9M"
"Average Rating Number: 4.7","","B0BXLYZTP5","Mona Magnetic Tea Bag Organizer - Set of 6 Individual Tea Bag Holders for The Refrigerator, Counter or Kitchen Shelf. Stylish & Practical Gift for Tea Lovers (Sage)","MONA DESIGNERS","$21.99","599","19","$13,172","05/31/2023","","4.5","141","","49,491","6","FBA","1","Home & Kitchen","","","","https://www.amazon.com/dp/B0BXLYZTP5"
"","","B0BDGH797M","Sorbus Tea Bag Spinning Carousel - Tea Caddy Organizer for Countertop - Matcha Station Accessories - 2 Tier Revolving Lazy Susan for Pantry - Holds Up to 60 Large Tea Bags","Sorbus","$16.99","315","8","$5,352","09/06/2022","","4.6","148","","108,423","6","FBA","1","Home & Kitchen","","","","https://www.amazon.com/dp/B0BDGH797M"
"","","B09B11RY98","RoyalHouse Acrylic Tea Bag Holder Storage Organizer, 6 Compartment BPA Free Clear Plastic Tea Box with Lid, Multi-Purpose storage Box for Tea Bags, Office Supplies, Crafts, and Small Items.","RoyalHouse","$13.99","961","40","$13,444","07/20/2021","$6.75","4.6","479","$7.24","22,783","6","FBA","2","Home & Kitchen","Standard","6.5 x 4 x 9 in","1 lb","https://www.amazon.com/dp/B09B11RY98"
"","","B09YR2PJGN","Tea Bag Organizer, 2 Tier Tea Bags Organizer Holdr Holds 50 Teabags, Solid Wood Vertical Tea Storage, Tea Rack for Tea Bags, Countertop, Black","Bethom","$31.99","75","1","$2,399","05/29/2022","$20.46","4.7","92","$11.53","648,074","6","FBA","1","Home & Kitchen","Standard","12.559 x 12.598 x 4.37 in","2.873 lb","https://www.amazon.com/dp/B09YR2PJGN"
"","","B0BR9J86N7","SPOPSOOD Bamboo Tea Bag Organizer, 3-Tier Tea Bag Holder Storage Organizer, Stackable Tea Packet Rack/Shelf, Tea Station Stand with Acrylic Partition for Counter, Cabinet and Pantry","SPOPSOOD","$39.99","194","7","$7,758","12/28/2022","","4.7","52","","128,101","6","FBA","2","Home & Kitchen","","","","https://www.amazon.com/dp/B0BR9J86N7"
"","","B0BXY5Z22C","mDesign Divided Plastic Tea Organizer Bin with Drawer - Stackable Tea Bag Holder for Kitchen, Pantry, and Cabinet - Caddy with Small Dividers - 20 Sections - Lumiere Collection - Clear","mDesign","$31.19","90","4","$2,807","03/08/2023","","5","4","","66,891","7","FBA","1","Kitchen & Dining","","","","https://www.amazon.com/dp/B0BXY5Z22C"
"","","B0B8NW1Y41","X-cosrack Bamboo Tea Bag Organizer Storage Box 3 Tier Stackable Tea Bag Holder Tea Caddy Box Containers Tea Packet Rack Teabag Shelf for Office Kitchen Cabinet Pantry","X-cosrack","$29.99","810","27","$24,292","08/03/2022","","4.3","827","","35,176","6","FBA","1","Home & Kitchen","","","","https://www.amazon.com/dp/B0B8NW1Y41"
"","","B0BZP8CY9B","ZENFUN 2 Pack Bamboo Teabag Organizer Box, 6 Compartments Teabag Storage Container with Handle, Divided Sugar Packet Holder, Square Coffee Condiment Organizer Great for Coffee, Snacks, Small Items","ZENFUN","$19.99","30","1","$599.70","03/26/2023","","4.5","10","","521,924","7","FBA","1","Home & Kitchen","","","","https://www.amazon.com/dp/B0BZP8CY9B"
"","","B0C348DBXF","AuldHome Farmhouse Enamelware Tea Bag Holder (White); Enamelware Tea Bag Caddy Dispenser for Wrapped Individual Tea Sachets","AuldHome Design","$16.99","135","4","$2,294","04/19/2023","","4.7","38","","213,834","6","FBA","2","Home & Kitchen","","","","https://www.amazon.com/dp/B0C348DBXF"
"","","B0B79Q5HWN","Lifewit 2 Pack Plastic Stackable Tea Bag Organizer, Divided Storage Bin Box for Kitchen Cabinets, Countertops, Pantry, Hold Coffee Pods, Sugar Packets, Condiments, 8 Sections","Lifewit","$19.99","772","29","$15,432","10/23/2022","","4.6","527","","9,585","7","FBA","1","Kitchen & Dining","","","","https://www.amazon.com/dp/B0B79Q5HWN"
"","","B0CL811MRG","REDHUGO Glass Tea Bag Organizer with 8 Compartments, Handmade Large Tea Bag Storage Box for Counter Kitchen, Tea Bag Holder,Tea Storage Containers with Lid,Tea Accessories Gifts for Tea Drinkers,Gold","REDHUGO","$36.98","30","1","$1,109","10/20/2023","","5","1","","445,606","7","FBA","1","Home & Kitchen","","","","https://www.amazon.com/dp/B0CL811MRG"
"","","B07P9C3F9R","mDesign Plastic Extra Wide Storage Organizer Bin Box for Kitchen, Pantry, Cabinet, Countertop - Tea Bag, Sugar Packet, Coffee Snack, Condiment Holder, 8 Sections - Ligne Collection - Clear","mDesign","$21.99","1,470","46","$32,325","02/28/2019","$12.26","4.6","1,623","$9.73","5,780","7","FBA","2","Kitchen & Dining","Standard","10.63 x 12.008 x 3.425 in","1.845 lb","https://www.amazon.com/dp/B07P9C3F9R"
"","","B07572YYY7","Apace Living Tea Box - Luxury Wooden Tea Storage Chest from The Premier Collection - 6 Adjustable Compartment Tea Bags Organizer Container - Elegantly Handmade w/Scratch Resistant Window","Apace Living","$41.97","180","6","$7,555","08/28/2017","$27.29","4.8","1,821","$14.68","144,209","7","FBA","1","Home & Kitchen","Standard","8.3 x 10.3 x 5 in","2.551 lb","https://www.amazon.com/dp/B07572YYY7"
"","","B09WZ5P61R","Zen Earth Inspired Bamboo Tea Organizer Box Chemical Free Eco-Friendly Big, Tall, Adjustable Cubbies Natural Wooden Storage Chest (6-Slot 11' x 8.1' x 4.2' with TEA print design)","Zen Earth Inspired","$45.99","120","4","$5,519","03/30/2022","","4.7","645","","193,799","6","FBA","1","Home & Kitchen","","","","https://www.amazon.com/dp/B09WZ5P61R"
"","","B09PJ6147V","Merazi Living Sustainable Acacia Wood Tea Box - An Ideal Tea Box Organizer, Tea Storage Box, Gorgeous Wooden Tea Box and Tea Bag Organizer","Merazi Living","$39.00","45","2","$1,755","12/31/2021","$27.36","4","36","$11.64","408,110","6","FBA","1","Home & Kitchen","Standard","6.77 x 4.29 x 13.19 in","2.67 lb","https://www.amazon.com/dp/B09PJ6147V"
"","","B0C5LRMCF9","TelKeen Tea Bag Organizer Holds up to 60 Tea Bags, Tea Organizer with 3 Compartments, Adhesive Wall Mount Tea Box Strong Tea bag Holder with Hooks for Storage Cabinet and Kitchen Pantry DoorsAcrylic","TelKeen","$9.99","330","23","$3,297","04/08/2023","","4.4","39","","41,442","7","FBA","1","Home & Kitchen","","","","https://www.amazon.com/dp/B0C5LRMCF9"
"","","B0BL71NDYR","ZOOFOX Tea Bag Organizer, Bamboo Tea Bag Storage Holder with 12 Compartments for Tea Bag, Coffee, Sugar, Sweeteners, Coffee Pod, 3 Tire Stackable Tea Bag Container for Countertop, Pantry, Cabinets","ZOOFOX","$27.99","","","$0.00","11/01/2022","","3.8","11","","903,960","7","FBA","1","Home & Kitchen","","","","https://www.amazon.com/dp/B0BL71NDYR"
"","","B094RCMNS6","2 Pack Stackable Tea Bag Organizer, Vtopmart Plastic Storage Box for Kitchen Pantry Cabinets and Countertops, Holder Bags, Coffee, Sugar Packets, Small Packets","Vtopmart","$19.99","264","3","$5,277","05/11/2021","$10.26","4.8","3,210","$9.73","73,393","7","FBA","1","Kitchen & Dining","Standard","7.6 x 11.1 x 7.4 in","2.56 lb","https://www.amazon.com/dp/B094RCMNS6"
"","","B07MWGZN7B","mDesign Plastic Condiment Organizer and Tea Bag Holder - 8-Compartment Kitchen Pantry/Countertop Storage Caddy - Divided Chip, Snack, Oatmeal Packet Holder - Lumiere Collection - 2 Pack, Clear","mDesign","$23.99","1,279","36","$30,683","01/16/2019","$14.60","4.8","2,770","$9.39","7,659","7","FBA","1","Kitchen & Dining","Standard","5.83 x 13.07 x 5.43 in","2.251 lb","https://www.amazon.com/dp/B07MWGZN7B"
"","","B0BYJWDC1J","ELLDOO Tea Bags Box with Lid, Wicker Rattan Sugar Packet Holder Coffee Station Condiment Organizer Countertop Storage Desk Baskets for Pantry Coffee Bar Shelves, 8 Grids","ELLDOO","$26.99","15","","$404.85","03/14/2023","","5","6","","704,491","7","FBA","1","Home & Kitchen","","","","https://www.amazon.com/dp/B0BYJWDC1J"
"","","B0B1PPD1C7","Tea Bag/Sugar Packet Holder, Coffee Station Condiment Organizer, Seagrass Storage Basket, Wicker Rattan Divided Basket Organizer for Drawer/Shelf/Countertop","YANGQIHOME","$18.99","154","6","$2,924","05/18/2022","$13.22","4.7","87","$5.77","46,986","6","FBA","1","Kitchen & Dining","Standard","4 x 0.4 x 4 in","0.25 lb","https://www.amazon.com/dp/B0B1PPD1C7"
"","","B0CHVXXSDK","Foraineam Tea Bag Organizer Bamboo Coffee Condiment and Accessories Storage Holder, 3 Tier Teabag Shelf Coffee Pod Organizer Caddy Storage Box, Vertical Coffee Tea Packet Rack for Home, Office, Caf","Foraineam","$22.99","60","2","$1,379","12/19/2023","","5","2","","389,345","","FBA","1","Home & Kitchen","","","","https://www.amazon.com/dp/B0CHVXXSDK"
"","","B07RS4YRB8","RoyalHouse Big Natural Bamboo Tea Storage Organizer with Clear Acrylic Top Window, 12 Compartments Eco-Friendly Tea Bag Holder, Multi-Functional Storage Box","RoyalHouse","$27.99","1,757","56","$49,178","05/14/2019","$17.06","4.8","6,359","$10.93","15,975","6","FBA","3","Home & Kitchen","Standard","11.2 x 12.6 x 4.4 in","4.149 lb","https://www.amazon.com/dp/B07RS4YRB8"
"","","B08SHN4L6C","MaxGear Tea Bag Organizer Tea Bag Storage Tea Bag Holder Tea Box Clear Storage Bins for Sugar Packet, Coffee, Condiment, Spice Pouches in Kitchen, Cabinet, Countertop, Pantry, 10.4 x 3.5 x 3 inch","MaxGear","$9.99","709","23","$7,083","12/31/2020","$4.72","4.8","994","$5.27","41,022","6","FBA","4","Home & Kitchen","Standard","5.94 x 11.14 x 3.11 in","0.441 lb","https://www.amazon.com/dp/B08SHN4L6C"
"","","B08XML6ZFP","RoyalHouse Premium Wood (Hard MDF) Tea Storage Box Organizer (Brown), Eco-Friendly Multi-Functional Decorative Box, 9 Compartments For Assorted Variety Of Tea Bags and Small Items","RoyalHouse","$19.95","1,438","31","$28,688","02/25/2021","$11.17","4.4","1,357","$8.78","29,956","6","FBA","3","Home & Kitchen","Standard","5 x 8 x 6 in","3 lb","https://www.amazon.com/dp/B08XML6ZFP"
"","","B0BLXG369B","TJ.MOREE Tea Bag Organizer 3 Tier Tea Storage, Solid Wood Tea Storage Chests for Kitchen, Office, Countertop, Cabinet Pantry, Tea Bag, Coffee, Sugar Packets, Creamers Holder","TJ.MOREE","$34.99","222","5","$7,768","11/09/2022","","4.2","56","","177,293","6","FBA","5","Home & Kitchen","","","","https://www.amazon.com/dp/B0BLXG369B"
"","","B09GY7R9CN","Stackable Tea Bag Organizer with Removable Divider and Hooks Wall Mount 3 Tier Metal Wire Storage Basket Countertop Coffee Condiment Snack Holder Rack for Home Office Kitchen Cabinet Pantry Black","Aibohayi","$29.99","107","5","$3,209","09/22/2021","$18.76","4.6","157","$11.23","55,104","7","FBA","1","Kitchen & Dining","Standard","8.23 x 10.94 x 4.02 in","4.03 lb","https://www.amazon.com/dp/B09GY7R9CN"
"","","B07F7NXNNJ","mDesign Plastic Condiment Organizer and Tea Bag Holder - 8-Compartment Kitchen Pantry/Countertop Storage Caddy - Divided Chip, Snack, Oatmeal Packet Holder - Lumiere Collection - Clear","mDesign","$14.99","1,316","36","$19,727","11/07/2018","$7.60","4.8","2,770","$7.39","7,659","7","FBA","1","Kitchen & Dining","Standard","5.591 x 12.598 x 2.598 in","1.102 lb","https://www.amazon.com/dp/B07F7NXNNJ"
"","","B07M8G6K9H","Fonture Wood Tea Storage Box, Teabag Storing 9 Compartments Wooden Tea Box Hinged Glass Lid Tea Organizer-Black","Fonture","$36.99","30","1","$1,110","12/20/2018","$28.52","4.5","135","$8.47","633,877","6","FBA","1","Home & Kitchen","Standard","9.37 x 9.449 x 0.748 in","0.132 lb","https://www.amazon.com/dp/B07M8G6K9H"
"","","B0CJ8YS8K1","iDavosic.ly 3 Tier Tea Bag Organizer, Tea Bag Storage Holder Spinning Carousel with 9 Compartments, Metal Rotating Tea Bag Caddy for Kitchen Counter Cabinet, Up to 108 Tea Bags Storage","iDavosic.ly","$28.99","291","10","$8,436","11/13/2023","$18.85","3.9","13","$10.14","93,570","7","FBA","1","Home & Kitchen","Standard","7.87 x 0.1 x 11.81 in","2.68 lb","https://www.amazon.com/dp/B0CJ8YS8K1"
"","","B0868CNBV3","NHZ Tea Bag Storage and Organizer, Tea Bag Holder Black Powder Coated Stainless Steel for Tea and Coffee Box. Organize 60 Tea Bags- Tea Holder for Tea Bags 6 Compartments with 10 Bags in Each.","NHZ","$15.99","115","4","$1,839","03/22/2020","$7.80","4.6","1,116","$8.19","228,328","6","FBA","2","Home & Kitchen","Standard","7.087 x 8.189 x 6.614 in","1.109 lb","https://www.amazon.com/dp/B0868CNBV3"
"","","B0CKN5KYJ9","Farmhouse Tea Bag Holder with Lid, Ceramic Tea Bag Caddy Dispenser for Countertop,Tea Bag Organizer Storage Container Tea Bag Chest for Beverage Supplies (White)","SLJMR","$19.88","60","2","$1,193","12/21/2023","","5","3","","316,411","","FBA","1","Home & Kitchen","","","","https://www.amazon.com/dp/B0CKN5KYJ9"
"","","B09MTMSR2T","Peohud Tea Bag Organizer, Tea Bag Spinning Carousel with 6 Compartments, 360-Degrees Rotating Storage Organizer for Tea and Coffee, Up to 60 Tea Bags Storage","Peohud","$16.99","75","5","$1,274","11/30/2021","$8.65","4.2","129","$8.34","182,045","6","FBA","1","Home & Kitchen","Standard","6.732 x 9.055 x 5.906 in","1.257 lb","https://www.amazon.com/dp/B09MTMSR2T"
"","","B07B1GPCZ1","mDesign Plastic Kitchen Pantry Stackable Storage Organizer Container Station with 3 Drawers for Cabinet, Countertop, Holds Coffee, Tea, Sugar Packets, Creamers - Lumiere Collection - Black/Clear","mDesign","$18.99","4,620","151","$87,734","02/22/2018","$11.00","4.7","13,943","$7.99","1,288","7","FBA","2","Kitchen & Dining","Standard","6.902 x 10.098 x 3.299 in","1.852 lb","https://www.amazon.com/dp/B07B1GPCZ1"
"","","B0CCTXDT4J","GYOPSEFHA Tea Bag Organizer,360 Rotatable 8 Compartments Tea Bag Holder, Iron Teabags Coffee Candy Organizer, 2 Tiers Tea Bag Organizer Rack for Kitchen Counter Cabinet Tea and Coffee Box","GYOPSEFHA","$20.99","60","2","$1,259","07/25/2023","","5","2","","357,978","6","FBA","1","Home & Kitchen","","","","https://www.amazon.com/dp/B0CCTXDT4J"
"","","B07RPP2CZY","MyGift Shabby Whitewashed Solid Wood Tea Box Organizer with 4 Compartments, Teabag Storage Chest with Clear Acrylic Lid and Latch","MyGift","$22.99","134","5","$3,081","05/12/2019","$13.75","4.6","639","$9.24","183,168","6","FBA","1","Home & Kitchen","Standard","7.95 x 8.35 x 4.33 in","1.349 lb","https://www.amazon.com/dp/B07RPP2CZY"
"","","B0BJJKHW5Q","Puricon Tea Bag Organizer Storage Holder 360-Degrees Spinning Carousel, 8 Compartments TeaBags Display Rack with Lazy Susan Platform for Kitchen Home Office Coffee Bar Counter -Black","Puricon","$23.99","136","4","$3,263","10/17/2022","","4.7","172","","196,037","6","FBA","2","Home & Kitchen","","","","https://www.amazon.com/dp/B0BJJKHW5Q"
"","","B0BZBPK5Z2","ULG Coffee Pod & Tea Bag Organizer Carousel Stand, K Cup Holder, Organizes 20 K-cups for Keurig and 60 Tea Bags - Coffee Bar Accessory for Kitchen Office, Countertop or Coffee Station Storage, Black","ULG","$19.99","661","27","$13,213","03/22/2023","$11.20","4.3","133","$8.79","34,359","7","FBA","2","Home & Kitchen","Standard","9.09 x 4.65 x 9.17 in","2.83 lb","https://www.amazon.com/dp/B0BZBPK5Z2"
"","","B0C9SX788T","KMOTASUO Bamboo Tea Bag Organizer with Acrylic Coffee Pods Holder, Tea Storage Holder Box for Tea Bags Organizer, Tea Caddy Station Containers for Countertop Cabinet Office","KMOTASUO","$34.99","50","2","$1,750","08/21/2023","","4.6","17","","310,992","7","FBA","1","Home & Kitchen","","","","https://www.amazon.com/dp/B0C9SX788T"
"","","B00ZY3EY0U","mDesign Plastic Tea Bag Divided Storage Organizer Container Box with Hinge Lid for Kitchen Cabinet, Countertop, Pantry, Hold Coffee Pods, Seasoning Packets, Condiments, 8 Sections, Clear","mDesign","$17.99","2,027","67","$36,466","06/17/2015","$9.50","4.7","13,581","$8.49","3,729","7","FBA","1","Kitchen & Dining","Standard","6.8 x 10.9 x 4.1 in","1.451 lb","https://www.amazon.com/dp/B00ZY3EY0U"
"","","B07RS4YN25","AuldHome Farmhouse Tea Bag Box (White), Vintage Retro Style Enamelware Tea Storage Tin","AuldHome Design","$19.99","479","14","$9,575","05/14/2019","$11.85","4.7","978","$8.14","65,966","6","FBA","6","Home & Kitchen","Standard","5.984 x 10.197 x 3.976 in","1.684 lb","https://www.amazon.com/dp/B07RS4YN25"
"","","B0C52TCBZQ","KITEISCAT Acacia Wood Tea Bag Organizer: 12-Compartment Multi-Functional Tea Box and Storage Organizer for Tea Bags","KITEISCAT","$39.99","562","16","$22,474","05/11/2023","","4.9","125","","59,023","6","FBA","1","Home & Kitchen","","","","https://www.amazon.com/dp/B0C52TCBZQ"
"","","B0CLRZMHGL","SEVENLINE Tea Bag Holders Organizer 2-Tier Spinning Carousel Tea Holder for 112 Teabags Container Coffee Sweetener Sugar Creamer Candy Tea Bags for Counter Cabinet Pantry Shelf Storage","SEVENLINE","$21.99","30","1","$659.70","10/26/2023","","","","","543,690","7","FBA","1","Home & Kitchen","","","","https://www.amazon.com/dp/B0CLRZMHGL"
"","","B09JBK7R2P","NHZ Tea Bag Storage and Organizer, Tea Bag Holder Black Powder Coated Stainless Steel for Tea and Coffee Box. Organize 100 Tea Bags- Tea Holder For Tea Bags 8 Compartments with 12 Bags in Each.","NHZ","$20.99","150","1","$3,148","10/12/2021","$7.02","4.8","211","$13.97","637,379","6","FBA","1","Home & Kitchen","Oversize","8.228 x 9.173 x 8.11 in","2.324 lb","https://www.amazon.com/dp/B09JBK7R2P"
"","","B07SPDSS83","mDesign Plastic Tea Bag Caddy Box Storage Container Organizer Holder with 3 Drawers - for Kitchen Pantry, Cabinet, Countertop - Holds Coffee, Sugar Packets - Lumiere Collection - Charcoal Gray/Clear","mDesign","$30.99","834","35","$25,846","07/27/2019","$19.01","4.7","7,450","$11.98","7,882","7","FBA","1","Kitchen & Dining","Standard","10.08 x 11.26 x 7.68 in","3.589 lb","https://www.amazon.com/dp/B07SPDSS83"
"","","B00BNRO5UU","Oceanstar - TB1323 Oceanstar Bamboo Tea Box, 12 Inch, Natural","Oceanstar","$19.79","1,369","45","$27,093","10/31/2011","$10.39","4.7","7,222","$9.40","19,953","5","AMZ","12","Home & Kitchen","Standard","8.27 x 4.09 x 13.07 in","2.69 lb","https://www.amazon.com/dp/B00BNRO5UU"
"","","B002HRR2L4","iDesign Divided Packet and Tea Bag Organizer for Kitchen Cabinets and Countertops, The Linus Collection - 6.5' x 9.5' x 2.25' - Clear","iDesign","$9.06","960","32","$8,698","10/05/2013","$2.57","4.8","956","$6.49","8,562","7","AMZ","1","Kitchen & Dining","Standard","7.953 x 1.654 x 12.756 in","0.88 lb","https://www.amazon.com/dp/B002HRR2L4"
"","","B0CKRD71MK","LULLATTI Tea Bag Organizer | Sugar Packet Organizer with Nano Mounting Tape, Elegant Hollow Rose Pattern Iron Tea Box, Holders for Sugar Packet, Drink Packet or Tea Bags (6 Pcs)","LULLATTI","$16.99","30","1","$509.70","11/10/2023","","5","2","","162,487","7","FBA","1","Kitchen & Dining","","","","https://www.amazon.com/dp/B0CKRD71MK"
"","","B0CP1RZQL4","QILICHZ Tea Bag Organizer,Tea Organizers and Storage,3 Tier Tea Bag Holder,Wood Tea Storage,Tea Bag Organizer for Counter,Tea Caddy Tea Station for Tea Lovers","QILICHZ","$29.99","126","3","$3,779","01/07/2024","","5","1","","287,742","7","FBA","1","Home & Kitchen","","","","https://www.amazon.com/dp/B0CP1RZQL4"
"","","B0BJ12JVYZ","MyGift Shabby Chic Whitewashed Wood Tea Bag Storage Organizer Box, Tea Sachet Sugar Packet Holder and Server Rack Caddy with 3 Compartments and Cut Out Handles","MyGift","$22.99","30","1","$689.70","10/11/2022","","5","5","","525,586","6","FBA","1","Home & Kitchen","","","","https://www.amazon.com/dp/B0BJ12JVYZ"