"Export time:  2/4/2024, 6:29:37 PM","","ASIN","Product Name","Brand","Price","Monthly Units Sold","Daily Units Sold","Monthly Revenue","Date First Available","Net Revenue","Star Rating","Reviews","Amazon Fees","BSR","LQS","Seller Type","Sellers","Category","Product Tier","Dimensions","Weight","Link"
"","","B093HKQ7JT","Ruosuruosu Decorative Wicker Storage Bins with Lids,Woven Seagrass Storage Baskets for Kids Toys,Shelves, Bathroom, Bedroom,Set of 3 Stackable Storage Boxes Large, Medium, Small","Ruosuruosu","$39.99","209","7","$8,358","04/25/2021","$26.36","4.5","260","$13.63","130,846","6","FBA","1","Home & Kitchen","Standard","9.764 x 14.646 x 7.362 in","2.438 lb","https://www.amazon.com/dp/B093HKQ7JT"
"Storage Basket with Lid","","B0CGTT6BL9","Kigley 6 Pcs Seagrass Baskets with Lids Wicker Storage Basket Organizer Baskets Rectangular Basket Boxes Woven Baskets for Shelf Closet Bedroom Back to School, 6 Sizes(Yellow Brown, Classic Style)","Kigley","$56.99","173","3","$9,859","11/02/2023","","4.1","18","","282,215","7","FBA","30","Home & Kitchen","","","","https://www.amazon.com/dp/B0CGTT6BL9"
"Average Monthly Sales: 988","","B0C4TDMPV3","Chi An Home Wicker Storage Baskets with Lids, Set of 3 Lidded Hyacinth Baskets for Organizing, Woven Rectangular Baskets for Storage, Decorative Basket with Lid, Multifunctional Storage Organizer","Chi An Home","$39.95","396","11","$15,820","05/15/2023","$23.03","4.4","24","$16.92","84,369","7","FBA","1","Home & Kitchen","Standard","11.02 x 7.3 x 14.17 in","2 kg","https://www.amazon.com/dp/B0C4TDMPV3"
"Average Revenue: $30,498","","B07WPTN35Q","LEAVINSKY Nylon Woven Storage Boxes, Set of 4, Black","LEAVINSKY","$33.99","171","7","$5,812","08/25/2019","$20.66","4.8","1,130","$13.33","134,755","6","FBA","2","Home & Kitchen","Standard","11 x 16.5 x 7.3 in","4.4 lb","https://www.amazon.com/dp/B07WPTN35Q"
"Average Price: $34.53","","B09KV5KHV8","Hipiwe Wicker Shelf Baskets Bin with Lid, Handwoven Seagrass Basket Storage Bins Rectangular Household Basket Boxes for Shelf Wardrobe Home Organizer, Coffee Medium","Hipiwe","$22.99","2,228","76","$51,222","11/01/2021","","4.6","816","","11,159","7","FBA","1","Home & Kitchen","","","","https://www.amazon.com/dp/B09KV5KHV8"
"Average No. of Ratings: 1,069","","B07W9BG3GL","SONGMICS Storage Basket with Lid, 17.2 Gallon (65L) Storage Bin, Woven Blanket Storage Basket with Handles, Foldable, Removable Liner, Metal Frame, for Bedroom, Laundry Room, Natural URST56NL","SONGMICS","$55.99","1,974","60","$110,524","09/19/2019","$35.61","4.6","2,343","$20.38","14,706","6","FBA","2","Home & Kitchen","Oversize","14.56 x 3.54 x 22.83 in","5.94 lb","https://www.amazon.com/dp/B07W9BG3GL"
"Average Sales Rank: 77,096","","B0C9J3D6V4","StorageWorks Wicker Storage Basket with Lid, 65L Square Wicker Baskets with lids and Removable Liner, Wicker Storage Trunk, Wicker Basket with Lid for Bedroom, Closet, Bathroom - Natural Tan","StorageWorks","$39.99","373","18","$14,916","09/11/2023","$1.49","4.3","118","$38.50","53,142","6","FBA","2","Home & Kitchen","Oversize","13.5 x 13.5 x 21.75 in","2.86 kg","https://www.amazon.com/dp/B0C9J3D6V4"
"Average Rating Number: 4.5","","B07J4DQ2TW","PRANDOM Large Collapsible Storage Bins with Lids [3-Pack] Linen Fabric Foldable Storage Boxes Organizer Containers Organization Baskets Cube Decorative for Bedroom Closet Clothes (17.7x11.8x11.8)","PRANDOM","$37.99","3,620","117","$137,524","10/07/2018","$25.26","4.7","7,570","$12.73","6,436","6","FBA","3","Home & Kitchen","Standard","12.402 x 17.953 x 3.347 in","4.453 lb","https://www.amazon.com/dp/B07J4DQ2TW"
"","","B09N2Q84KW","GhvyenntteS Large Storage Bins with Lids (3-Pack), Storage Baskets with Lid and Label Window, Foldable Fabric Storage Boxes with 3 Handles for Home Office College Dorms (Black, 15' x 11' x 9.7')","GhvyenntteS","$34.99","1,370","65","$47,936","12/04/2021","$22.71","4.7","1,695","$12.28","13,425","7","FBA","1","Home & Kitchen","Standard","11.496 x 15.472 x 3.228 in","5.084 lb","https://www.amazon.com/dp/B09N2Q84KW"
"","","B07PNJQ6RJ","Sorbus Set of 3 Storage Baskets for Organizing with Lid, Mesh Hand-Woven Design, Linen Closet Organizers and Storage, Organizer Storage Baskets for Shelves, Variety Pack Organizers and Storage","Sorbus","$32.99","294","12","$9,699","12/12/2018","$24.50","4.7","1,799","$8.49","74,022","7","FBA","3","Home & Kitchen","Standard","12 x 7.5 x 17.5 in","0.01 oz","https://www.amazon.com/dp/B07PNJQ6RJ"
"","","B0B7P6GYR6","Rubbermaid Roughneck Clear 66 Qt/16.5 Gal Storage Containers, Pack of 4 with Latching Grey Lids, Visible Base, Sturdy and Stackable, Great for Storage and Organization","Rubbermaid","$104.99","2,221","48","$233,183","07/25/2022","$43.07","4.2","1,010","$61.92","18,823","7","AMZ","8","Home & Kitchen","Oversize","24.2 x 27.2 x 16.25 in","18.999 lb","https://www.amazon.com/dp/B0B7P6GYR6"
"","","B0BDRN81KL","LOVSTORAGE 20.5'x14.5' Large Rope Blanket Basket with Lid, Woven Storage Basket Baby Laundry Basket Hamper Decorative Nursery Toy Basket Bin with Handles for Living Room Bedroom","LOVSTORAGE","$29.99","1,048","35","$31,430","09/08/2022","","4.1","524","","26,572","7","FBA","3","Home & Kitchen","","","","https://www.amazon.com/dp/B0BDRN81KL"
"","","B0C13YZ4P3","Large Toy Storage Box with Lid, Sturdy Toys Storage Chest Bin Organizer Basket with Dividers for Kids, Boys, Girls, Nursery, Closet, Bedroom, Playroom 25'x13' x16' (Beige and White)","Gowee","$21.99","4,681","157","$102,935","03/30/2023","","4.6","220","","845","7","FBA","1","Baby","","","","https://www.amazon.com/dp/B0C13YZ4P3"
"","","B0BZXT5XVY","StorageWorks Seagrass Wicker Baskets for Organizing, Medium Wicker Basket with Lid, Decorative Basket with Built-in Handles, Towel Storage for Shelf, 1 Pack","StorageWorks","$29.99","657","24","$19,703","06/08/2023","$18.46","4.5","195","$11.53","39,552","6","FBA","1","Home & Kitchen","Standard","9 x 6.25 x 13 in","1.61 lb","https://www.amazon.com/dp/B0BZXT5XVY"
"","","B08RMXLVWC","Honygebia Grey Wicker Storage Baskets - Set of 3 Decorative Nesting Boxes with Lids, Woven Basket with Lock & Handle, Organizer for Beauty Makeup Bathroom Decor","Honygebia","$37.99","143","2","$5,433","12/28/2020","$24.36","4.5","517","$13.63","380,655","7","FBA","1","Home & Kitchen","Standard","7.28 x 11.02 x 14.17 in","4 lb","https://www.amazon.com/dp/B08RMXLVWC"
"","","B09MZGQ8XJ","Homepeaz Set of 3 Woven Wicker Basket Box with Lid & Lock, Built-in Carry Handles, Multifunctional Storage Organiser for Nursery, Baby, Clothes, Toys, Books, Large/Medium/Small Size (Natural)","Homepeaz","$37.99","633","24","$24,048","01/30/2022","$23.76","4.5","1,448","$14.23","4,999","7","FBA","2","Baby","Standard","12 x 8 x 15 in","4.36 lb","https://www.amazon.com/dp/B09MZGQ8XJ"
"","","B07YQ221CX","mDesign Natural Woven Seagrass Closet Storage Organizer Basket Bin with Removeable Lids to use in Closet, Bedroom, Bathroom, Entryway, Office - Set of 3 - Natural Finish","mDesign","$48.99","117","5","$5,732","10/03/2019","$29.28","4.6","455","$19.71","182,530","7","FBA","1","Home & Kitchen","Oversize","9.1 x 8.75 x 16.5 in","5.06 lb","https://www.amazon.com/dp/B07YQ221CX"
"","","B08L7NS6PF","HUATK 2 Pack Decorative Storage Boxes with Lids Storage Woven Baskets for Shelves, Closet Organization Bins for Office, Bedroom, Closet, Toys (Khaki)","HUATK","$25.97","150","6","$3,896","10/14/2020","$15.64","4.5","293","$10.33","144,308","6","FBA","1","Home & Kitchen","Standard","11 x 2.4 x 15.8 in","3.68 lb","https://www.amazon.com/dp/B08L7NS6PF"
"","","B09DD7YM2L","16' x 16' x 18' Extra Large Storage Basket with Lid, Cotton Rope Storage Baskets, Laundry Hamper, Toy Bin, for Toys Towels Blankets Storage in Living Room Baby Nursery, Jute/Black Mix Basket","Cottonphant","$42.99","332","14","$14,273","10/31/2020","$29.51","4.4","829","$13.48","7,733","7","FBA","1","Baby","Standard","12.598 x 3.937 x 16.535 in","4.409 lb","https://www.amazon.com/dp/B09DD7YM2L"
"","","B0C925Y8L2","RoyalHouse Woven Stackable Storage Baskets with Lid, Decorative Rope Organizer Bin - Set of 2 (2 Sizes), Beige (No Liner)","RoyalHouse","$23.99","398","11","$9,548","06/21/2023","$13.96","4.4","45","$10.03","83,279","6","FBA","3","Home & Kitchen","Standard","5.5 x 6.5 x 12.5 in","2.35 lb","https://www.amazon.com/dp/B0C925Y8L2"
"","","B0CJ6TC2DC","HONCEST Modern Large Brown/White Cotton Storage Box","HONCESTA","$29.99","240","9","$7,198","09/15/2023","","4.2","39","","96,517","7","FBA","1","Home & Kitchen","","","","https://www.amazon.com/dp/B0CJ6TC2DC"
"","","B0BYD9D85J","Set of 4 Seagrass Basket with Lids Rattan Wicker Storage Basket Handwoven Decorative Storage Boxes with Lids Multipurpose Woven Basket Bins for Shelf Closet (White)","Woanger","$38.99","279","10","$10,878","03/13/2023","","4.3","41","","93,353","7","FBA","1","Home & Kitchen","","","","https://www.amazon.com/dp/B0BYD9D85J"
"","","B09FSPWW3Y","Honygebia Bamboo Decorative Storage Boxes - Set of 3 Woven Lined Storage Basket with Lids, Retro Brown Wicker Lidded Baskets for Home Kitchen Shelf Organizer Decor","Honygebia","$38.90","240","8","$9,336","12/06/2020","$25.44","4.5","698","$13.47","115,296","6","FBA","1","Home & Kitchen","Standard","10.866 x 13.74 x 7.598 in","3.424 lb","https://www.amazon.com/dp/B09FSPWW3Y"
"","","B079J3GXDS","Sorbus Storage Bin Set, 3-Piece, Gray Fabric, Ideal for Organizing Closets, Shelves, and Underbed Storage","Sorbus","$25.99","394","20","$10,240","02/28/2018","$14.46","4.7","4,422","$11.53","47,041","7","FBA","3","Home & Kitchen","Standard","9.4 x 13.9 x 7.5 in","3.001 lb","https://www.amazon.com/dp/B079J3GXDS"
"","","B0BQLTR4F7","Plastic Storage Bins With Bamboo Lid Pantry Organization and Storage BasketsContainers Lidded Organizer Bins Small Baskets for Shelves Drawers Desktop Closet Playroom Classroom Office, 3 Pack","EOENVIVS","$23.99","701","34","$16,817","12/18/2022","","4.4","132","","27,241","6","FBA","1","Home & Kitchen","","","","https://www.amazon.com/dp/B0BQLTR4F7"
"","","B09CYNHF65","Greenstell Storage Basket with Lid, Handwoven Large Shelf Basket with Cotton Liner and Metal Frame, Foldable & Easy to Install, Laundry Room 65L (Natural, 22.2x13.4x13.4 inch)","GREENSTELL","$46.99","538","19","$25,281","11/25/2021","$7.06","4.6","708","$39.93","49,172","7","FBA","1","Home & Kitchen","Oversize","13.39 x 22.24 x 13.39 in","3.35 kg","https://www.amazon.com/dp/B09CYNHF65"
"","","B0BVWHCZ65","Lonbet - Storage Bin With Lid - 100 L - All In One Closet Organizer and Storage Solution - Storage Box Basket for Organizing - Versatile Use: Laundry Basket and Clothes Toys Bathroom Organizer","Lonbet","$24.95","2,128","79","$53,094","02/14/2023","","4.3","9,473","","10,537","6","FBA","1","Home & Kitchen","","","","https://www.amazon.com/dp/B0BVWHCZ65"
"","","B09Y8X2167","Citylife 2 PCS Storage Bins with Bamboo Lids Plastic Storage Containers for Organizing Stackable Storage Box with Handle, 15.12 x 10.67 x 5.98 inch","ITYLIFE CITYLIFE","$39.97","1,391","35","$55,598","04/18/2022","$21.23","4.4","497","$18.74","26,793","6","FBA","6","Home & Kitchen","Oversize","11.42 x 8.46 x 15.55 in","5.8 lb","https://www.amazon.com/dp/B09Y8X2167"
"","","B0C9R1M642","MEGASKET Large Basket with Lid, 20' x 20' x 15' Blanket Storage Basket for Living Room, Wicker Storage Basket with lid, Woven Cotton Rope Baskets for Storage, Big Throw Blankets Pillows Organizer Bins","MEGASKET","$29.99","180","6","$5,398","06/28/2023","","3.6","77","","143,278","7","FBA","1","Home & Kitchen","","","","https://www.amazon.com/dp/B0C9R1M642"
"","","B08KGM4GQM","Seagrass Storage Basket with Lid Rectangular Small Woven Shelf Baskets with Sections for Organize Snack Toys Tampon","DECRAFTS","$19.99","1,206","33","$24,108","05/17/2020","$13.22","4.6","1,170","$6.77","28,226","6","FBA","1","Home & Kitchen","Standard","5.12 x 4.33 x 12.99 in","10.9 oz","https://www.amazon.com/dp/B08KGM4GQM"
"","","B0C2BTK8PW","AREYZIN Storage Bins with Bamboo Lids Set of 6 Lidded Storage Container Plastic Baskets Organizer Bins for Organizing Kithen Room Bedroom Office Closet, Sturdy and Durable (Black)","AREYZIN","$36.99","864","37","$31,959","04/12/2023","","4.8","91","","25,292","6","FBA","1","Home & Kitchen","","","","https://www.amazon.com/dp/B0C2BTK8PW"
"","","B08LPHSDPT","DENJA & CO Round Baskets with Lids - Set of 2 Decorative Jute Baskets with Lids for Organizing - Natural Jute Rope Lidded Baskets with Genuine Leather Tabs - Storage Baskets with Lids","DENJA & CO","$36.97","449","13","$16,600","02/16/2021","$24.09","4.8","786","$12.88","71,215","7","FBA","1","Home & Kitchen","Standard","11.221 x 11.575 x 7.087 in","2.789 lb","https://www.amazon.com/dp/B08LPHSDPT"
"","","B09TW41Q4P","Temary Foldable Storage Bins with Lids, [2-Pack] Large Storage Baskets with Lid, Fabric Storage Bin for Organizing Home, Office (White&Khaki, 15x11x9.5inch)","Temary","$33.99","380","13","$12,916","03/03/2022","$22.16","4.4","245","$11.83","71,116","7","FBA","1","Home & Kitchen","Standard","12.205 x 16.654 x 2.835 in","4.206 lb","https://www.amazon.com/dp/B09TW41Q4P"
"","","B097BK6QHW","Wicker Storage Basket with Lid, Natural Woven Rattan Seagrass Storage Box Rectangular Household Organizer Boxes Shelf Wardrobe Organizer (L)","Sobotoo","$21.99","230","4","$5,058","06/15/2021","$11.96","4.2","152","$10.03","187,127","7","FBA","1","Home & Kitchen","Standard","9.61 x 11.65 x 5.75 in","1.369 lb","https://www.amazon.com/dp/B097BK6QHW"
"","","B0CDL8J43V","Blanket Basket with Lid, 21.7' X 21.7' X 13.8' Cotton Rope Basket, XXL Large Basket with Handle, Blanket Basket Living Room, Stuffed Toy Basket, Laundry Basket, Storage for Towels Pillows (Brown)","noonkty","$27.99","251","7","$7,025","09/29/2023","","4.7","90","","13,453","6","AMZ","3","Baby","","","","https://www.amazon.com/dp/B0CDL8J43V"
"","","B06XHJXN8N","StorageWorks Storage Bins with Lids, Decorative Storage Boxes with Lids and Soft Rope Handles, Mixing of Beige, White & Ivory, Large, 3-Pack","StorageWorks","$37.99","1,448","49","$55,010","06/09/2017","$24.36","4.7","4,909","$13.63","18,180","6","FBA","3","Home & Kitchen","Standard","10.25 x 8 x 14.75 in","4 lb","https://www.amazon.com/dp/B06XHJXN8N"
"","","B0BYCY1G3L","WK&YOHFY Storage Baskets Hand-Woven Rectangular Seagrass Cube Storage Bins for Bedroom, Living Room, Nursery Room-Storage Cubes with Lids&Letter Boards,Set of 3 Pcs(Nested)","WK&YOHFY","$31.99","150","4","$4,799","03/13/2023","","4.7","19","","187,987","7","FBA","1","Home & Kitchen","","","","https://www.amazon.com/dp/B0BYCY1G3L"
"","","B08MF5H21G","22'x14'x18' Rectangular Extra Large Storage Basket with Lid, Cotton Rope Storage Baskets, Laundry Hamper, Toy Bin, for Toys Blankets Storage in Living Room, Baby Nursery, All Beige","Cottonphant","$52.99","180","5","$9,538","01/15/2021","$37.71","4.4","176","$15.28","15,949","7","FBA","2","Baby","Standard","12.598 x 3.937 x 16.929 in","5.512 lb","https://www.amazon.com/dp/B08MF5H21G"
"","","B0BTHKQ3WZ","GRANNY SAYS Wicker Storage Baskets with Lids, Set of 3 Decorative Storage Boxes, Woven Baskets for Storage, Baskets for Organizing, Nesting Woven Basket for Shelves, Butter Milk, 3-Pack","GRANNY SAYS","$37.99","350","10","$13,297","05/20/2023","$21.36","4.2","85","$16.63","87,543","6","FBA","1","Home & Kitchen","Standard","11.42 x 7.09 x 14.17 in","2.08 kg","https://www.amazon.com/dp/B0BTHKQ3WZ"
"","","B09MKC8MC1","StorageWorks Decorative Storage Boxes, Storage Basket with Lid and Handles, Mixing of Beige, White & Ivory, Large, 2-Pack","StorageWorks","$30.99","2,391","79","$74,097","02/25/2021","$19.61","4.7","1,399","$11.38","10,642","6","FBA","1","Home & Kitchen","Standard","11.14 x 15.79 x 2.52 in","4.191 lb","https://www.amazon.com/dp/B09MKC8MC1"
"","","B097PYH4ZG","popoly Large Toy Box Chest with Lid, Collapsible Sturdy Toy Storage Organizer Boxes Bins Baskets for Kids, Boys, Girls, Nursery, Playroom, 25'x13' x16' (Linen Gray)","popoly","$19.99","11,854","338","$236,961","06/21/2021","$10.26","4.5","4,539","$9.73","344","6","FBA","1","Baby","Standard","13.11 x 16.89 x 2.13 in","4.65 lb","https://www.amazon.com/dp/B097PYH4ZG"
"","","B08D8YJH8W","VK VKLIVING Storage Baskets Nylon Woven Baskets for Shelves Bathroom Baskets Tote Organizer Bins Pantry Storage Black Baskets Stackable Storage Basket Built-in Carry Handles","VK VKLIVING","$30.80","226","10","$6,961","07/19/2020","$17.05","4.7","1,538","$13.75","88,151","7","FBA","1","Home & Kitchen","Standard","13.82 x 17.44 x 7.05 in","3.951 lb","https://www.amazon.com/dp/B08D8YJH8W"
"","","B0BCJSV2C1","ANMINY Storage Bin with Lid Storage Boxes with PU Leather Handles PP Plastic Board Decorative Foldable Lidded Cotton Linen Fabric Home Cubes Baskets Closet Organizer Container - Green, Small Size","ANMINY","$12.99","2,093","49","$27,188","08/30/2022","","4.6","288","","18,513","6","FBA","1","Home & Kitchen","","","","https://www.amazon.com/dp/B0BCJSV2C1"
"","","B0C64S1R47","Yimi's Dream Lidded Storage Basket, Medium Cotton Rope Basket with Lid, Small Round Storage Basket for Nursery, Living Room, Kids, Blanket, Toys (12''D * 13.5''H, Brown & White)","Yimi's Dream","$26.99","415","6","$11,201","05/23/2023","","4.3","768","","141,056","7","FBA","1","Home & Kitchen","","","","https://www.amazon.com/dp/B0C64S1R47"
"","","B08CDQZXYJ","4 Pack, Wicker Baskets with Lids, Nautral Seagrass Storage Baskets, Woven Rectangular Basket Bins, Rattan Storage Organizer for Shelf Honey Brown","YANGQIHOME","$40.99","326","9","$13,363","07/05/2020","$27.51","4.6","925","$13.48","100,093","6","FBA","1","Home & Kitchen","Standard","14.17 x 7.09 x 9.45 in","2.7 lb","https://www.amazon.com/dp/B08CDQZXYJ"
"","","B0912CRXBK","Yawinhe Collapsible Storage Boxes, Linen Fabric Storage Baskets Washable, with Lids and Leather Handle, for Home, Closet, White/Grey, 15.0''Lx9.8''Wx9.8''H, 1-Pack, USNK024WGL-1","Yawinhe","$12.99","1,428","39","$18,550","03/24/2021","$1.72","4.6","1,867","$11.27","23,420","6","FBA","1","Home & Kitchen","Oversize","11.8 x 11.8 x 17.7 in","15.8 oz","https://www.amazon.com/dp/B0912CRXBK"
"","","B0BQYJS8CT","GRANNY SAYS Fabric Storage Boxes, Large Storage Bins with Lids, Storage Organizer, Closet Storage Baskets for Shelves Organizing Bookcase Entryway Wardrobe, White/Gray, 2-Pack","GRANNY SAYS","$21.99","1,043","29","$22,936","12/22/2022","","4.6","951","","32,125","6","FBA","1","Home & Kitchen","","","","https://www.amazon.com/dp/B0BQYJS8CT"
"","","B0BMWB2RT8","Bamboo Decorative Storage Boxes With Lids - Nesting Rectangular Lidded Box for Organization - Stackable Basket with Cloth Liner - Organizer for Toys, Home, Office - Woven Basket - Set of 3","Bamodi","$31.99","157","7","$5,022","03/17/2023","$18.96","4.5","36","$13.03","129,890","6","FBA","1","Home & Kitchen","Standard","13.03 x 6.26 x 15.71 in","2.6 lb","https://www.amazon.com/dp/B0BMWB2RT8"
"","","B0BM6FZXY9","FIYAMMY Rattan Basket With Lid, Large Lidded Basket For Storage Rattan Box(17.8' L13.8'W7.8'H)","FIYAMMY","$99.59","257","8","$25,595","11/11/2022","","4.6","183","","113,488","6","FBA","1","Home & Kitchen","","","","https://www.amazon.com/dp/B0BM6FZXY9"
"","","B0BF19XZYY","WAYIDEAL Cotton Rope Storage Basket with Lid & Wicker basket with Lid for Toys, Books, Multi-Purpose Storage Basket for Living Room,Christmas gifts. 14x13inches(Brown)","Wayideal","$22.99","303","6","$6,966","10/16/2022","","4.3","92","","14,855","7","FBA","1","Baby","","","","https://www.amazon.com/dp/B0BF19XZYY"
"","","B0C9ZYSWYG","OEHID Wicker Storage Baskets with Lid, Hand-Woven Rectangular Wicker Basket with Lid for Bedroom & Living Room, Nesting Rattan Basket with Lid for Shelves (Water Hyacinth, 3-Pack)","OEHID","$46.99","120","4","$5,639","07/02/2023","","4.7","20","","207,828","6","FBA","1","Home & Kitchen","","","","https://www.amazon.com/dp/B0C9ZYSWYG"
"","","B09WJFVJPV","LoforHoney Home Fabric Storage Bins with Lids for Organizing, Foldable Storage Boxes with Lids for Shelves, Clothes Baskets with Cotton Rope Handles, Closet Storage Bins, Large, Beige & Gray, 2-Pack","LoforHoney Home","$22.99","1,010","33","$23,220","03/24/2022","","4.5","768","","28,486","7","FBA","1","Home & Kitchen","","","","https://www.amazon.com/dp/B09WJFVJPV"
"","","B07455DJDG","Tegance Blanket Basket with Lid, 16' D x 14' H Large Woven Rope Basket Laundry Basket Baby Toy Storage Basket Hamper Decorative Nursery Bin for Living Room Bedroom with Handles","Tegance","$30.99","204","6","$6,322","07/20/2017","$21.20","4.3","2,177","$9.79","14,110","6","FBA","1","Baby","Standard","12.01 x 0.98 x 12.01 in","2 lb","https://www.amazon.com/dp/B07455DJDG"
"","","B0BZHNY3HK","HapiLeap Plastic Storage Bins with Lid, Stackable Storage Containers for Organizing, Storage Baskets for Shelves Kitchen Bathroom Playroom Classroom Office (Small (4 PCS))","HapiLeap","$24.95","288","7","$7,186","03/23/2023","","3.9","52","","134,570","7","FBA","1","Home & Kitchen","","","","https://www.amazon.com/dp/B0BZHNY3HK"
"","","B09DL613RS","LA JOLIE MUSE Fluted Cardboard Storage Baskets with Leather-Like Lids, Sturdy Stackable Paper Boxes Decorative Tray, Chocolate Brown, Set of 3","LA JOLIE MUSE","$37.99","1,054","26","$40,041","08/24/2021","$25.26","4.7","231","$12.73","35,986","6","FBA","1","Home & Kitchen","Standard","9.69 x 5.24 x 13.98 in","2.29 lb","https://www.amazon.com/dp/B09DL613RS"
"","","B0CBTHWCFL","Decorative Storage Basket with Lid Set of 3,Woven Seagrass Storage Bins for Shelves for Organizing, Rectangular Baskets for Decoration, Picnic, Groceries and Toy Storage","FOSSORH","$36.98","176","8","$6,508","07/13/2023","$25.00","4.7","63","$11.98","117,817","7","FBA","1","Home & Kitchen","Standard","7 x 6 x 12 in","1.57 lb","https://www.amazon.com/dp/B0CBTHWCFL"
"","","B0CLXKJ1ZJ","Moosky Wicker Shelf Baskets with Lid,Natural Seagrass Storage Basket Boxes Handwoven Rectangular Baskets Bins Multipurpose Home Organizer Decor (Small)","Moosky","$14.99","182","6","$2,728","10/26/2023","","4.6","6","","143,176","6","FBA","1","Home & Kitchen","","","","https://www.amazon.com/dp/B0CLXKJ1ZJ"
"","","B07YQ1X7B6","mDesign Natural Woven Seagrass Closet Storage Organizer Basket Bin with Removeable Lids to use in Closet, Bedroom, Bathroom, Entryway, Office - Set of 3 - Black Wash Finish","mDesign","$36.74","122","5","$4,482","10/03/2019","$18.87","4.6","455","$17.87","182,530","7","FBA","1","Home & Kitchen","Oversize","16.5 x 8.7 x 9.1 in","5.06 lb","https://www.amazon.com/dp/B07YQ1X7B6"
"","","B0915XMJYX","AREYZIN Plastic Storage Baskets With Lid Organizing Container Lidded Knit Storage Organizer Bins for Shelves Drawers Desktop Closet Playroom Classroom Office, 6 Pack","AREYZIN","$26.99","2,798","88","$75,518","03/25/2021","$15.91","4.5","2,351","$11.08","9,250","6","FBA","1","Home & Kitchen","Standard","9.53 x 11.14 x 7.6 in","2.579 lb","https://www.amazon.com/dp/B0915XMJYX"
"","","B0B8CBM5MG","RVSNQ Large Storage Bins with Lids, Fabric Storage Bins with Cotton Rope Handle and Label, Foldable Storage Basket with Lid, Storage Boxes for Organizing Office, Shelf (3-Pack, Grey Quatrefoil)","RVSNQ","$27.99","194","7","$5,430","08/01/2022","","4.7","235","","125,744","7","FBA","1","Home & Kitchen","","","","https://www.amazon.com/dp/B0B8CBM5MG"
"","","B0B82HZDBB","Yawinhe Collapsible Storage Boxes with Lids Fabric Foldable Storage Bins Organizer Containers Baskets with Lid for Home Bedroom Closet Office SNK024WGS-1","Yawinhe","$11.99","1,388","39","$16,642","07/28/2022","","4.6","1,867","","23,420","6","FBA","1","Home & Kitchen","","","","https://www.amazon.com/dp/B0B82HZDBB"
"","","B09Q5YSTWB","PFFVRP Large Storage Bins with Lids, Foldable Fabric Storage Baskets with Lids, Sturdy Storage Boxes with Labels and 3 PU Handles for Closet Home Bedroom Office (26L, 3 Packs, Grey&Black)","PFFVRP","$29.69","415","12","$12,321","03/02/2022","$12.12","4.7","340","$17.57","74,789","7","FBA","1","Home & Kitchen","Oversize","11 x 9.7 x 15 in","3 lb","https://www.amazon.com/dp/B09Q5YSTWB"