"Export time:  2/1/2024, 1:38:56 PM","","ASIN","Product Name","Brand","Price","Monthly Units Sold","Daily Units Sold","Monthly Revenue","Date First Available","Net Revenue","Star Rating","Reviews","Amazon Fees","BSR","LQS","Seller Type","Sellers","Category","Product Tier","Dimensions","Weight","Link"
"","","B0CHYDMJ6G","efluky Laundry Basket with Wheels, Rolling Laundry Basket with Lid and Removable Bag, Collapsible Dirty Clothes Basket with Wheels for Laundry Room, Bedroom & Bathroom, 100L (26.4 Gallon) Black","efluky","$34.99","1,375","45","$48,111","09/12/2023","","4.4","64","","20,114","6","FBA","1","Home & Kitchen","","","","https://www.amazon.com/dp/B0CHYDMJ6G"
"laundry basket with lid and wheels","","B0BXKN9L11","SOLEDI Laundry Basket with Wheels, Laundry Hamper with Lid 90L(23.8 gal), Clothes Hamper with Bag Removable - Rolling Laundry Basket, Move Smoothly- Suitable for Apartment, Bathroom, Bedroom, Dorm","SOLEDI","$29.58","1,028","37","$30,408","06/19/2023","","4.5","167","","24,626","7","FBA","1","Home & Kitchen","","","","https://www.amazon.com/dp/B0BXKN9L11"
"Average Monthly Sales: 1,031","","B0C1Z8DS7Z","WOWLIVE Rolling Laundry Hamper with Lid,Large Laundry Basket Organizer with Wheels,Iron-Made 100L Laundry Sorter with Removable Bag,Tall Dirty Clothes Hamper Dorm Room Storage for Bedroom (Beige)","WOWLIVE","$39.99","359","10","$14,356","04/09/2023","","4.4","171","","90,366","7","FBA","2","Home & Kitchen","","","","https://www.amazon.com/dp/B0C1Z8DS7Z"
"Average Revenue: $48,947","","B0CL4M9PKK","Merkisa 60L Slim Laundry Basket with Wheels,Narrow Hampers for Laundry,Freestanding Laundry Hamper with Lid&Bamboo Handles,Collapsible & Waterproof Tall Cloth Hamper for Dorm Family(Beige)","Merkisa","$28.99","1,282","41","$37,165","10/15/2023","","4.4","118","","22,585","7","FBA","1","Home & Kitchen","","","","https://www.amazon.com/dp/B0CL4M9PKK"
"Average Price: $47.17","","B09Y5JGF65","Greenstell Laundry Hamper with Lid, 127L Large 2 sections Rolling Laundry Basket with wheels, Round Laundry Cart with Rattan Tray and Removable Bag, Metal Frame, White","GREENSTELL","$49.99","266","6","$13,297","07/12/2022","$28.99","4.6","218","$21.00","146,050","7","FBA","2","Home & Kitchen","Oversize","20.6 x 21.25 x 3.8 in","12.099 lb","https://www.amazon.com/dp/B09Y5JGF65"
"Average No. of Ratings: 736","","B08ZXZ1KZ6","GREENSTELL Laundry Hamper with Wheels&Lid, 125L Large 3 Sections Clothes Hamper with 2 Types Removable Liner Bags, 5 Mesh Laundry Bags, Handwoven Divided Laundry Basket Gray","GREENSTELL","$65.99","570","19","$37,614","03/23/2021","$23.75","4.5","1,648","$42.24","50,487","7","FBA","2","Home & Kitchen","Oversize","12.99 x 25.2 x 25.59 in","13.37 lb","https://www.amazon.com/dp/B08ZXZ1KZ6"
"Average Sales Rank: 147,392","","B0BZXZH31L","SUOERNUO Rolling Laundry Hamper with Removable Bags, Lockable Wheels and 2 Bag Sorter for Clothes Storage, Black","SUOERNUO","$31.99","938","30","$30,007","03/29/2023","","4.3","792","","30,725","6","FBA","1","Home & Kitchen","","","","https://www.amazon.com/dp/B0BZXZH31L"
"Average Rating Number: 4.3","","B0BLJJRJJN","JJSMKCH Commercial Laundry Cart with Wheels, 400L Capacity, Sturdy Steel Frame, Waterproof Oxford Cloth, 330 lbs Load, Blue","JJSMKCH","$135.99","175","4","$23,798","11/04/2022","","4.2","19","","200,193","7","FBA","1","Home & Kitchen","","","","https://www.amazon.com/dp/B0BLJJRJJN"
"","","B09DCJ19Z7","ALIMORDEN Laundry Cart with Clothes Rack, Rolling Laundry Butler with Wire Storage RackBlack","ALIMORDEN","$60.49","585","20","$35,387","08/22/2021","$36.85","4","749","$23.64","46,440","6","FBA","1","Home & Kitchen","Oversize","19.11 x 2.73 x 23.01 in","15.54 lb","https://www.amazon.com/dp/B09DCJ19Z7"
"","","B08HV6B7M8","Greenstell Laundry Hamper with Wheels, No Install Needed, 90L Divided Handwoven Hampers & 2 Removable Liner Bags, Synthetic Rattan Clothes Laundry Basket with Lid & Handles, Foldable Hampers Natural","GREENSTELL","$59.99","709","20","$42,533","09/10/2020","$36.35","4.5","1,902","$23.64","47,171","7","FBA","1","Home & Kitchen","Oversize","24.803 x 31.102 x 2.756 in","12.434 lb","https://www.amazon.com/dp/B08HV6B7M8"
"","","B001RCUN6G","Sterilite 12228003 Ultra Wheeled Hamper, White Lid & Base w/ Plastic Handle & Wheels, 3-Pack","Sterilite","$69.45","1,303","43","$90,493","08/24/2012","$28.05","4.7","5,077","$41.40","21,099","6","AMZ","7","Home & Kitchen","Oversize","13.75 x 28.38 x 21 in","5.2 lb","https://www.amazon.com/dp/B001RCUN6G"
"","","B08HV9726L","Greenstell Laundry Hamper with Wheels, No Install Needed, 110L Divided Handwoven Hampers & 2 Removable Liner Bags, Rattan Clothes Laundry Basket with Lid & Handles, Foldable Hampers Brown 22x13x26.4In","GREENSTELL","$64.99","705","20","$45,818","09/10/2020","$40.98","4.5","1,902","$24.01","47,171","7","FBA","1","Home & Kitchen","Oversize","24.803 x 2.362 x 34.252 in","14.066 lb","https://www.amazon.com/dp/B08HV9726L"
"","","B0CDB9YRCH","WOWLIVE Double Laundry Hamper with Lid,Rolling Laundry Basket Organizer with Wheels, Iron-Made Laundry Sorter with Top Shelf and 2 Removable Bags,Large Laundry Storage for Room,Black and Beige","WOWLIVE","$66.49","639","19","$42,487","07/31/2023","$4.63","4.4","272","$61.86","48,680","7","FBA","2","Home & Kitchen","Oversize","13 x 29.5 x 32.3 in","16.2 lb","https://www.amazon.com/dp/B0CDB9YRCH"
"","","B083DPWR59","GREENSTELL Laundry Hamper with lid, No Install Needed, 110L Wicker Laundry Baskets Foldable 2 Removable Liner Bags, 2 Section Clothes Hamper Handwoven Rattan Laundry Basket with Handles, Natural","GREENSTELL","$46.99","4,310","138","$202,527","01/01/2020","$24.92","4.6","9,123","$22.07","5,163","7","FBA","3","Home & Kitchen","Oversize","25.5 x 34.6 x 2.6 in","11.649 lb","https://www.amazon.com/dp/B083DPWR59"
"","","B0C2P7HP6F","SONGMICS Laundry Basket with Wheels, Rolling Laundry Hamper, 29 Gal., Round Laundry Cart with Steel Frame and Removable Bag, 4 Casters and 2 Brakes, Cream and Silver URLS002W01","SONGMICS","$59.99","2,643","86","$158,554","07/31/2023","$3.94","4.4","1,311","$56.05","9,547","6","FBA","2","Home & Kitchen","Oversize","19.7 x 28 x 19.7 in","9.24 lb","https://www.amazon.com/dp/B0C2P7HP6F"
"","","B08ZXR3PN5","Greenstell Laundry Hamper with Lid, 60L Clothes Hamper with 2 Removable Liner Bags & 2 Mesh Bags, Handwoven Synthetic Rattan Basket, Toys in Bathroom, Bedroom Natural","GREENSTELL","$39.99","2,100","70","$83,979","03/23/2021","$21.25","4.5","4,577","$18.74","12,205","7","FBA","1","Home & Kitchen","Oversize","15.197 x 24.685 x 3.78 in","7.011 lb","https://www.amazon.com/dp/B08ZXR3PN5"
"","","B0C8TLQR5H","WOWLIVE Laundry Hamper with Wheels, Handwoven Rolling Laundry Basket with Lid, Clothes Hamper with Divided Removable Liner Bag, 115L Large Capacity Laundry Sorter Laundry Room Organization, White","WOWLIVE","$62.99","408","13","$25,700","06/20/2023","$39.28","4.1","57","$23.71","70,703","7","FBA","2","Home & Kitchen","Oversize","24.1 x 3.4 x 25 in","9.78 lb","https://www.amazon.com/dp/B0C8TLQR5H"
"","","B0CGDLZDDS","Azlafu Rolling Laundry Basket with Wheels 2-Pack, 75L Tall Slim Laundry Hamper with Lid, Waterproof Dirty Clothes Hampers for Laundry, Bedroom, Bathroom, Black Hamper with Handles for Clothes and Toys","Azlafu","$46.99","240","7","$11,278","08/22/2023","","4.4","34","","122,887","6","FBA","1","Home & Kitchen","","","","https://www.amazon.com/dp/B0CGDLZDDS"
"","","B0CL4QF2PJ","Merkisa 60L Slim Laundry Basket with Wheels,Narrow Hampers for Laundry,Freestanding Laundry Hamper with Lid&Bamboo Handles,Collapsible & Waterproof Tall Cloth Hamper for Dorm Family(Grey)","Merkisa","$28.99","1,317","41","$38,180","10/15/2023","","4.4","118","","22,585","7","FBA","1","Home & Kitchen","","","","https://www.amazon.com/dp/B0CL4QF2PJ"
"","","B0C2CK2QZ8","STORAGE MANIAC Slim Laundry Hamper with Lid, 85 L Laundry Sorter with Wheels, Narrow Laundry Basket Sorter, 2 Loads Dirty Clothes Hamper, Laundry Organizer, Laundry Cart with Wheels and Lid, Grey","STORAGE MANIAC","$29.99","329","15","$9,867","04/12/2023","","4.5","43","","64,032","6","FBA","1","Home & Kitchen","","","","https://www.amazon.com/dp/B0C2CK2QZ8"
"","","B0C49PBDZ3","ASHARE Laundry Sorter 3 Section Laundry Hamper Basket with Rolling Wheels Laundry Organizer Cart for Bathroom Bedroom Nursery (White+Grey+Black)","ASHARE","$34.99","101","3","$3,534","05/03/2023","","4","17","","240,031","7","FBA","2","Home & Kitchen","","","","https://www.amazon.com/dp/B0C49PBDZ3"
"","","B09QM7RMX2","VASAGLE Laundry Hamper, Laundry Basket, Laundry Sorter with 3 Pull-Out and Removable Bags, Shelf, Metal Frame, 3 x 10 Gallons (38L), 36.4 x 13 x 28.4 Inches, Rustic Brown and Black UBLH301B01","VASAGLE","$89.99","5,073","151","$456,519","01/17/2022","$60.33","4.6","3,513","$29.66","4,587","6","FBA","6","Home & Kitchen","Oversize","15.7 x 3.9 x 38.4 in","19.6 lb","https://www.amazon.com/dp/B09QM7RMX2"
"","","B0CBN4327Y","iEGrow 60L Slim Laundry Hamper, Narrow Laundry Basket with Lid,Foldable Clothes Hamper with Bamboo Handles,Tall Thin Dirty Laundry Hamper Basket with Removable Inner Bag for Clothes Towel-Beige","iEGrow","$27.59","2,745","59","$75,735","08/20/2023","","4.1","656","","14,987","7","FBA","1","Home & Kitchen","","","","https://www.amazon.com/dp/B0CBN4327Y"
"","","B0CD2D42G3","SOLEDI 145L Laundry Basket with Wheels - Double Laundry Hamper with Wheels, Hamper 2 Section for Sorting Laundry, Rolling Laundry Basket - Smooth Wheels and Removable Bag for Easier Transportation","SOLEDI","$45.98","413","9","$18,990","11/05/2023","","4.8","24","","100,849","7","FBA","2","Home & Kitchen","","","","https://www.amazon.com/dp/B0CD2D42G3"
"","","B0B7B7B2Y3","WOWLIVE 90L Large Laundry Hamper with Lid and Wheels Rolling Collapsible Laundry Basket Handle Foldable Tall Dirty Clothes Hamper Dorm Room Storage for Bedroom Bathroom, Black","WOWLIVE","$25.99","348","9","$9,045","07/21/2022","","4.4","350","","104,282","6","FBA","1","Home & Kitchen","","","","https://www.amazon.com/dp/B0B7B7B2Y3"
"","","B0C58QJ37W","HOOBRO Slim Laundry Hamper with Lid, Rolling Laundry Sorter with Side Pockets and Handle, Laundry Basket with Wheels, Oxford Fabric Bag, Space-Saving, Rustic Brown and Black BF24XY01G1","HOOBRO","$29.99","132","7","$3,959","05/14/2023","","4","39","","125,292","7","FBA","4","Home & Kitchen","","","","https://www.amazon.com/dp/B0C58QJ37W"
"","","B0BWRNLF4G","Furnulem Laundry Basket with Wheels, Rolling Laundry Hamper with Lids, 2-section Hampers for Laundry with Top Shelf, Double Laundry Sorter Cart for Laundry Room, Bathroom, Bedroom","Furnulem","$39.95","748","27","$29,883","04/28/2022","","4.1","303","","34,269","7","FBA","2","Home & Kitchen","","","","https://www.amazon.com/dp/B0BWRNLF4G"
"","","B08BCRTRV6","SONGMICS Laundry Hamper with Wheels & 3 Removable Liner Bags, 140L Synthetic Rattan Laundry Basket with Lid, Clothes Hamper with Handles, 3-Section Hampers, Laundry Room, Natural ULCB083N01","SONGMICS","$69.99","290","6","$20,297","06/16/2020","$45.23","4.5","1,206","$24.76","137,477","6","FBA","7","Home & Kitchen","Oversize","23.2 x 3.1 x 28.7 in","13.5 lb","https://www.amazon.com/dp/B08BCRTRV6"
"","","B0BR5CP2CC","SONGMICS Laundry Hamper with Lid, 42.3 Gallon (160L), Rolling Laundry Basket with Wheels, 3-Section Synthetic Rattan Laundry Hamper, Removable Liner, Bedroom, 27.6x14.2x26 Inches, Gray ULCB365G01","SONGMICS","$89.99","1,013","42","$91,160","12/26/2022","","4.6","733","","21,554","7","FBA","1","Home & Kitchen","","","","https://www.amazon.com/dp/B0BR5CP2CC"
"","","B0BXKQ5W37","SOLEDI Laundry Basket with Wheels, Laundry Hamper with Lid 90L(23.8 gal), Clothes Hamper with Bag Removable - Rolling Laundry Basket, Move Smoothly- Suitable for Apartment, Bathroom, Bedroom, Dorm","SOLEDI","$30.98","1,034","37","$32,033","06/19/2023","","4.5","167","","24,626","7","FBA","1","Home & Kitchen","","","","https://www.amazon.com/dp/B0BXKQ5W37"
"","","B0CMTM1JXB","KIEUIENK Laundry Hamper with Lid, XL 110 L Large Clothes Basket for Laundry with Wheels, Handles Tall Laundry Bin Organizer with Removeable Bag for Laundry, Bedroom, Dark Grey","KIEUIENK","$32.99","210","7","$6,928","12/26/2023","","4.2","34","","132,074","","FBA","1","Home & Kitchen","","","","https://www.amazon.com/dp/B0CMTM1JXB"
"","","B0CCCRJ59J","Snughome Laundry Hamper with Heavy Duty Rolling Lockable Wheels, Wire Laundry Basket with Detachable Liner Bag, Clothes Hamper with Wood Lid, Metal Laundry Sorter with Leather Handle (90L)","Snughome","$44.99","448","11","$20,156","07/19/2023","","3.4","17","","85,942","7","FBA","1","Home & Kitchen","","","","https://www.amazon.com/dp/B0CCCRJ59J"
"","","B0C233ZFSB","Laundry Hamper with Lid and Wheels, 100L Large Laundry Hamper on Wheels, Collapsible Laundry Basket, Dirty Clothes Basket with Bamboo Handles for Home, Toys Storage (Beige)","Dyreps","$21.99","115","5","$2,529","04/10/2023","","3.9","62","","167,566","7","FBA","1","Home & Kitchen","","","","https://www.amazon.com/dp/B0C233ZFSB"
"","","B0BP7KDDYL","SONGMICS Laundry Hamper with Lid, 17.2 Gallon (65L) Synthetic Rattan Clothes Laundry Basket with Lid and Handles, Foldable, Removable Liner, Natural ULCB165N01","SONGMICS","$37.99","7,378","247","$280,290","02/28/2023","$11.95","4.6","217","$26.04","2,233","6","AMZ","5","Home & Kitchen","Oversize","13.4 x 23.6 x 13.4 in","6.64 lb","https://www.amazon.com/dp/B0BP7KDDYL"
"","","B0C6K96XKK","Laundry Basket with Wheels, 110L Large Laundry Hamper with Lid and Handle, VOPEAK Collapsible Laundry Baskets Dirty Clothes Hamper, Hampers for Laundry Rolling Laundry Basket for Clothes Toy (Metal)","VOPEAK","$69.99","127","1","$8,889","05/28/2023","","4.5","94","","437,829","7","FBA","1","Home & Kitchen","","","","https://www.amazon.com/dp/B0C6K96XKK"
"","","B0C2C5G5J8","100L Rolling Laundry Basket with Wheels and Handle, Laundry Hamper with Lid and Removable Bag, Foldable Laundry Hamper on Wheels, Large Tall Laundry Basket for Bedroom, Bathroom, Laundry Room(Grey)","NFSQ","$20.99","189","5","$3,967","04/12/2023","","3.8","207","","164,336","7","FBA","1","Home & Kitchen","","","","https://www.amazon.com/dp/B0C2C5G5J8"
"","","B0CMCQ95TL","Memobarco Rolling Laundry Basket with Wheels and Lid, 100L Laundry Hamper Clothes Basket with Side Pocket, Steel Frame Laundry Cart with Handle Removable Oxford Bag, Dirty Clothes Hampers for Laundry","Memobarco","$39.99","90","3","$3,599","11/01/2023","","","","","290,982","7","FBA","1","Home & Kitchen","","","","https://www.amazon.com/dp/B0CMCQ95TL"
"","","B0CHY9QNXZ","Jewem 100L Sealed Laundry Sorter Cart, Double Laundry Hamper with Wheels, Rolling Laundry Basket with Lid, Dustproof Heavy Duty Laundry Bin with 2 Removable Bags, Dirty Clothes Hamper for Laundry","Jewem","$32.99","342","5","$11,283","10/31/2023","","4.2","43","","170,181","7","FBA","1","Home & Kitchen","","","","https://www.amazon.com/dp/B0CHY9QNXZ"
"","","B0CGZVFX3T","Clothes laundry hamper with lid,110L large dirty laundry hampers with Collapsible and Removable Bag,Tall laundry basket for Corner Bedroom Toys, Gradient Grey","YUBOLUOHON","$34.90","1,059","33","$36,959","10/15/2023","","4.4","144","","27,750","7","FBA","1","Home & Kitchen","","","","https://www.amazon.com/dp/B0CGZVFX3T"
"","","B0CKGYJPK9","Tall Laundry Hamper with Lid and Wheels - Metal Laundry Basket with Shelf for Small Spaces Bedroom Aesthetic Rolling Laundry Bin Covered Removable Bag Storage Dirty Clothes Laundry Station Rustic 75L","KAI-ROAD","$39.99","377","11","$15,076","10/06/2023","","4.8","18","","83,169","6","FBA","1","Home & Kitchen","","","","https://www.amazon.com/dp/B0CKGYJPK9"
"","","B0CKM9J4PC","Hitogo Laundry Hamper with Side Shelf and High Capacity 60L Laundry Bag,Pull Out Rolling Laundry Basket with Lid & Wheels with Front Pockets and Handle Laundry Cart for Bathroom, Laundry Room - Brown","Hitogo","$47.99","60","2","$2,879","","","4.4","49","","342,618","","FBA","","Home & Kitchen","","","","https://www.amazon.com/dp/B0CKM9J4PC"
"","","B0C1WZ1YFD","Laundry Hamper with Rustic Brown Lid & Wheels; 96L Large Rolling Laundry Basket with Removable Oxford Liner Bag; Tall Freestanding Dirty Clothes Hamper with Side Pocket; Metal Frame Laundry Cart","Heeytilly","$36.99","413","11","$15,277","04/08/2023","","4.4","110","","83,275","7","FBA","1","Home & Kitchen","","","","https://www.amazon.com/dp/B0C1WZ1YFD"
"","","B0B5G5PNNR","WOWLIVE Laundry Basket with Wheels, Heavy Duty Laundry Hamper with Wood Lid, Clothes Hamper with Divided Removable Liner Bag, Large Capacity Iron-Made Laundry Sorter Laundry Room Organization (Grey)","WOWLIVE","$59.99","1,387","47","$83,206","06/29/2022","","4.5","680","","19,420","7","FBA","2","Home & Kitchen","","","","https://www.amazon.com/dp/B0B5G5PNNR"
"","","B0C9DDY8GR","Fogein Double Laundry Hamper with Lid, Laundry Basket with Wheels and Shelf,Removable 6 Hooks,Metal Frame, Pull Out and Removable Bag, Laundry Sorter 2 Section, for Laundry Room (Black and Grey,45L)","Fogein","$39.99","30","1","$1,200","08/15/2023","","4.7","4","","659,953","7","FBA","1","Home & Kitchen","","","","https://www.amazon.com/dp/B0C9DDY8GR"
"","","B0CDP3P3G3","Raybee Rolling Laundry Basket Slim Laundry Hamper with Lid Tall Large Hampers for Laundry with Bamboo Handle on Wheel Laundry Baskets Bins Organizer with Removable Bag for Dirty Clothes, Toys, Black","Raybee","$29.99","157","4","$4,708","08/03/2023","","2.7","19","","188,472","7","FBA","2","Home & Kitchen","","","","https://www.amazon.com/dp/B0CDP3P3G3"
"","","B0C1B3V4C6","ELYKEN Laundry Hamper with Lid and Wheel, Rolling Metal Wire Frame Dirty Clothes Basket for Small Bathroom, 61L Capacity Liner Bag with Handle, Heavy Duty Steel Cover Bedroom Organizer Black","ELYKEN","$25.99","130","7","$3,379","04/02/2023","","4.2","24","","131,330","7","FBA","1","Home & Kitchen","","","","https://www.amazon.com/dp/B0C1B3V4C6"
"","","B0BNJD5LHB","LIVEHOM Laundry Basket Three Laundry Hamper with Removable Bags, Fabric Handles, Large Top Shelf and Laundry Bag for Bathroom, Dorm, Laundry Room","LIVEHOM","$79.99","508","8","$40,635","11/27/2022","","4.4","126","","110,632","7","FBA","1","Home & Kitchen","","","","https://www.amazon.com/dp/B0BNJD5LHB"
"","","B08HH2N26J","Durable Laundry Hamper with Removable Liner Bag, Heavy Duty Wheels, Wood Lid and Metal Handle - Clothes Sorter and Laundry Basket in White","Hermina","$56.69","694","19","$39,343","09/04/2020","$32.03","4.5","1,125","$24.66","49,448","6","FBA","1","Home & Kitchen","Oversize","24.7 x 26.6 x 4.2 in","12.701 lb","https://www.amazon.com/dp/B08HH2N26J"
"","","B0CGMX583V","KUREEISE Laundry Hamper with Wheels, 23.8 Gal (90L) Laundry Basket with 2 Removable Liner Bags, 2 Sections Clothes Hamper with Lid and Handle, Collapsible Metal Wire Laundry Sorter for Bedroom(Black)","KUREEISE","$49.99","145","3","$7,249","11/12/2023","","4.4","18","","257,757","7","FBA","1","Home & Kitchen","","","","https://www.amazon.com/dp/B0CGMX583V"
"","","B09NNJCVF2","STORAGE MANIAC Rolling Laundry Hamper, 80L Tall Laundry Basket on Wheels, XL Dirty Clothes Hamper with Handle, Freestanding Clothes Hamper for Dorms, Bedroom, Bathroom, Living Room - With Lid Grey","STORAGE MANIAC","$32.99","","","$0.00","12/14/2021","$15.30","4","67","$17.69","873,377","7","FBA","1","Home & Kitchen","Oversize","16.61 x 19.17 x 4.8 in","3.81 lb","https://www.amazon.com/dp/B09NNJCVF2"
"","","B07ZV7WZ66","SAMMART 66L(17.4 gallon) Collapsible Plastic Garbage Bin with wheels & Removable Lid-Foldable Pop Up Container-Portable Washing Tub-Space Saving Basket,Water capacity 56L(14.8 gallon) (1, Grey)","SAMMART","$54.21","","","$1,626","10/30/2019","$30.68","4.2","18","$23.53","1,218,488","6","FBA","1","Home & Kitchen","Oversize","22.83 x 4.53 x 23.62 in","6.49 lb","https://www.amazon.com/dp/B07ZV7WZ66"
"","","B093WKVSBG","Laundry Hamper with 3 Removable Liner Bags; 132L Handwoven Rattan Laundry Basket with Lid & Heightened Feet; Clothes Hamper with Side Handles; Laundry Sorter with 3 Separate Sections (Gray)","Hermina","$70.99","2,559","72","$181,663","04/29/2021","$48.74","4.6","1,747","$22.25","11,773","7","FBA","5","Home & Kitchen","Oversize","13.78 x 1.575 x 19.685 in","7.716 lb","https://www.amazon.com/dp/B093WKVSBG"
"","","B078TCZL9N","Sterilite White Plastic Laundry Basket","Sterilite","$36.23","872","24","$31,593","04/15/2013","$-15.25","4.5","491","$51.48","38,461","3","FBM","7","Home & Kitchen","Oversize","21.06 x 14.06 x 35.98 in","18.2 lb","https://www.amazon.com/dp/B078TCZL9N"
"","","B0C3M14V25","70L Slim Laundry Hamper with Lid & Wheels, Rolling Laundry Basket with 2 Removable Liner Bags & 3 Mesh Bags, Narrow Dirty Clothes Basket, Foldable Handwoven Rattan Laundry Sorter, Brown","Hiagnete","$64.99","","","","","","4.2","9","","712,527","","FBA","","Home & Kitchen","","","","https://www.amazon.com/dp/B0C3M14V25"
"","","B0CDNX1JCZ","Tinpin Double Laundry Hamper with Lid, Laundry Basket with Wheels, 96 L Laundry Sorter, Dirty Clothes Hamper for Laundry 2 Section, Black (Upgrade)","Tinpin","$27.99","207","6","$5,794","08/03/2023","","4","109","","138,461","7","FBA","1","Home & Kitchen","","","","https://www.amazon.com/dp/B0CDNX1JCZ"
"","","B0CHJ6XYF5","StorageWorks Laundry Hamper with Wheels, 160L Large Hampers for Laundry Rolling Laundry Basket, Dirty Clothes Hamper for Hotel, Home, Closet, Dorm, Beige, 1-Pack","StorageWorks","$59.99","450","15","$26,996","","","4.7","35","","62,138","","FBA","","Home & Kitchen","","","","https://www.amazon.com/dp/B0CHJ6XYF5"
"","","B0BFCYLPBW","efluky Large Laundry Basket with Lid, 100L Tall Laundry Basket with Bamboo Handles for Clothes and Toys, Freestanding Collapsible Laundry Hamper with Inner Bag for Bedroom and Bathroom, Black","efluky","$29.99","3,706","84","$111,143","11/09/2022","","4.3","2,072","","9,863","7","FBA","2","Home & Kitchen","","","","https://www.amazon.com/dp/B0BFCYLPBW"
"","","B0BVTG3RHR","WOWLIVE 100L Laundry Hamper with Lid, Large Foldable Laundry Basket with 2 Removable Bags and Handles, Tall Collapsible Dirty Clothes Hamper for Laundry Room, Bathroom, Dorm (Black)","WOWLIVE","$28.49","1,135","33","$32,336","02/14/2023","","4.6","300","","28,362","7","FBA","2","Home & Kitchen","","","","https://www.amazon.com/dp/B0BVTG3RHR"
"","","B08WRYX55G","Mind Reader 60L Slim Laundry Hamper, Clothes Basket, Lid, Ventilated, Plastic, 17.25'L x 13.75'W x 23.5'H, Pink","Mind Reader","$34.60","2,780","102","$96,188","02/15/2021","$-0.05","4.7","229","$34.65","7,717","7","AMZ","1","Home & Kitchen","Oversize","13.9 x 31.1 x 17.4 in","24 lb","https://www.amazon.com/dp/B08WRYX55G"
"","","B0CJ9PW2SK","Laundry Hamper with Natural Bamboo Lid, 120L Durable Laundry Basket with Heavy Duty Rolling Wheels, Dirty Clothes Hamper with Removable Liner Bag and Side Pocket, Laundry Sorter with Metal Handle","Hiagnete","$44.99","30","1","$1,350","09/17/2023","","4.7","11","","426,584","7","FBA","1","Home & Kitchen","","","","https://www.amazon.com/dp/B0CJ9PW2SK"