"Export time:  1/30/2024, 5:18:35 PM","","ASIN","Product Name","Brand","Price","Monthly Units Sold","Daily Units Sold","Monthly Revenue","Date First Available","Net Revenue","Star Rating","Reviews","Amazon Fees","BSR","LQS","Seller Type","Sellers","Category","Product Tier","Dimensions","Weight","Link"
"","","B08KXKVT4K","Vtopmart 25 PCS Clear Plastic Drawer Organizers Set, 4-Size Versatile Bathroom and Vanity Drawer Organizer Trays, Storage Bins for Makeup, Bedroom, Kitchen Gadgets Utensils and Office","Vtopmart","$18.49","85,139","3,122","$1.57M","10/08/2020","$9.29","4.7","29,267","$9.20","12","7","FBA","4","Home & Kitchen","Standard","2 x 9 x 6 in","3.92 lb","https://www.amazon.com/dp/B08KXKVT4K"
"organizing containers","","B0B4G4X43M","HAIXIN Storage Bins with Lids, Collapsible Storage Bins, Wardrobe Closet Organizer, 19 Gal Stackable Toy Storage, Foldable Plastic Storage Container with Door, Crate for Book Storage (3 Pack)","HAIXIN","$199.99","8,624","254","$1.72M","07/28/2022","$106.22","4.5","3,496","$93.77","2,131","6","FBA","2","Home & Kitchen","Oversize","15 x 43 x 25 in","14 lb","https://www.amazon.com/dp/B0B4G4X43M"
"Average Monthly Sales: 7,867","","B0B1M6ML2J","WOWBOX 25 PCS Clear Plastic Drawer Organizer Set, 4 Sizes Desk Drawer Divider Organizers and Storage Bins for Makeup, Jewelry, Gadgets for Kitchen, Bedroom, Bathroom, Office","WOWBOX","$25.99","43,381","1,168","$1.13M","06/24/2022","$15.36","4.5","6,517","$10.63","123","6","FBA","7","Home & Kitchen","Standard","7.48 x 9.37 x 6.26 in","4.341 lb","https://www.amazon.com/dp/B0B1M6ML2J"
"Average Revenue: $245,493","","B0BZRMYZV1","Vtopmart 44 PCS Clear Plastic Drawer Organizers Set, 4-Size Versatile Bathroom and Vanity Organizer Trays, Non-Slip Storage Containers for Makeup, Jewelries, BedroomKitchen Utensils and Office","Vtopmart","$29.99","6,494","260","$194,755","03/27/2023","$21.95","4.8","337","$8.04","2,059","7","FBA","1","Home & Kitchen","Standard","6 x 2 x 9 in","0.47 oz","https://www.amazon.com/dp/B0BZRMYZV1"
"Average Price: $34.84","","B09ZKYQMVD","Vtopmart 4 Pack Clear Stackable Storage Drawers, 4.4'' Tall Acrylic Bathroom Makeup Organizer,Plastic Storage Bins For Vanity, Undersink, Kitchen Cabinets, Pantry, Home Organization and Storage","Vtopmart","$24.99","24,521","840","$612,780","05/04/2022","$14.21","4.6","7,279","$10.78","330","7","FBA","2","Beauty & Personal Care","Standard","8.94 x 12.2 x 7.44 in","5.091 lb","https://www.amazon.com/dp/B09ZKYQMVD"
"Average No. of Ratings: 3,615","","B08FBFFSQS","PRANDOM Extra Large Collapsible Storage Bins with Lids [5-Pack] Linen Fabric Foldable Storage Baskets Boxes Organizer Containers Cube with Cover for Bedroom Closet Office Nursery (22.8x15.75x13.8)","PRANDOM","$99.99","3,300","110","$329,967","11/22/2018","$81.28","4.7","7,555","$18.71","6,975","6","FBA","1","Home & Kitchen","Oversize","16.4 x 24.5 x 5 in","19.8 lb","https://www.amazon.com/dp/B08FBFFSQS"
"Average Sales Rank: 17,541","","B09ZQQ211T","HOONEX Storage Bins with Lids for Organizing, Pack of 2, Storage Boxes with 2 Carrying Handles and Study Heavy Cardboard, 16.5' L x 11.8' W x 7.5' H for Shoes, Books, Clothes, Olive","HOONEX","$28.98","1,360","50","$39,413","05/06/2022","","4.6","1,520","","17,803","7","FBA","2","Home & Kitchen","","","","https://www.amazon.com/dp/B09ZQQ211T"
"Average Rating Number: 4.6","","B08Q7QRPFC","StorageWorks Decorative Storage Boxes, Storage Basket with Lid and Handles, Gray and White Stripes, Large, 2-Pack","StorageWorks","$30.99","2,370","61","$73,446","12/09/2020","$19.61","4.7","1,398","$11.38","14,267","6","FBA","1","Home & Kitchen","Standard","11.181 x 15.787 x 2.756 in","4.7 lb","https://www.amazon.com/dp/B08Q7QRPFC"
"","","B092ZDHJMN","Fab totes 6 Pack Clothes Storage, Foldable Blanket Storage Bags, Storage Containers for Organizing Bedroom, Closet, Clothing, Comforter, Organization and Storage with Lids and Handle, Grey","Fab totes","$29.99","53,910","1,425","$1.62M","08/20/2021","","4.3","21,855","","79","6","FBA","6","Home & Kitchen","","","","https://www.amazon.com/dp/B092ZDHJMN"
"","","B09PMHDLW1","[ 12 Pack ] Multi-Use Clear Bins for Organizing - Fridge, Refrigerator Organizer Bins - Pantry Organization and Storage - Plastic Containers for Home, Kitchen, Freezer, SOHO Collection, Canbinet, RV","LANDNEOO","$29.99","2,163","53","$64,868","01/03/2022","$17.26","4.8","1,333","$12.73","4,877","7","FBA","5","Kitchen & Dining","Standard","10.906 x 16.969 x 7.323 in","7.952 lb","https://www.amazon.com/dp/B09PMHDLW1"
"","","B09B739XJD","GRANNY SAYS Storage Baskets with Metal Frame, Closet Shelf Organizer and Storage Bins Large, Closet Storage Baskets, Decorative Clothes Storage Bins for Organizing Shelves, Yellow White, 2-Pack","GRANNY SAYS","$19.99","2,418","65","$48,336","06/10/2022","$5.01","4.7","1,322","$14.98","13,382","6","FBA","1","Home & Kitchen","Oversize","10.24 x 8.27 x 14.57 in","2.4 lb","https://www.amazon.com/dp/B09B739XJD"
"","","B0BVLYMFXT","StorageWorks Storage Bins with Lids and Clear Window, Storage Basket for Shelves, Fabric Closet Containers and Organizers, Beige, 4-Pack","StorageWorks","$39.99","837","21","$33,472","05/16/2023","","4.8","92","","44,220","6","FBA","1","Home & Kitchen","","","","https://www.amazon.com/dp/B0BVLYMFXT"
"","","B08BQBNXSQ","ClearSpace Plastic Storage Bins  Perfect Kitchen Organization or Pantry Storage  Fridge Organizer, Pantry Organization and Storage Bins, Cabinet Organizers","ClearSpace","$39.99","14,795","465","$591,652","06/22/2020","$25.46","4.8","10,422","$14.53","207","6","FBA","14","Kitchen & Dining","Standard","11.496 x 16.024 x 7.638 in","5.311 lb","https://www.amazon.com/dp/B08BQBNXSQ"
"","","B0B1ZNVMR4","Recycled Wicker Storage Basket, Paper Rope Storage Baskets for Organizing Container Bins for Shelves Cupboards Drawer, Small Woven Basket Set of 4","PROLAND","$25.99","1,260","42","$32,747","05/22/2022","$15.66","4.5","282","$10.33","21,782","6","FBA","1","Home & Kitchen","Standard","7.76 x 4.84 x 11.81 in","1.8 lb","https://www.amazon.com/dp/B0B1ZNVMR4"
"","","B0CC49ZZ7P","AREYZIN Storage Bins with Bamboo Lids Set of 6 Lidded Storage Container Plastic Baskets Organizer Bins for Organizing Kithen Room Bedroom Office Closet, Sturdy and Durable (White)","AREYZIN","$38.99","878","33","$34,233","03/25/2021","$29.60","4.8","89","$9.39","28,177","6","FBA","1","Home & Kitchen","Standard","7.1 x 4.1 x 11.2 in","120 g","https://www.amazon.com/dp/B0CC49ZZ7P"
"","","B09GW5ZXWR","CLEARSPACE Plastic Storage Bins With lids  Perfect Kitchen Organization or Pantry Storage  Fridge Organizer, Pantry Organization and Storage Bins, Cabinet Organizers - 4 Pack","ClearSpace","$39.99","4,329","154","$173,117","04/17/2022","$26.36","4.7","1,219","$13.63","1,259","6","FBA","9","Kitchen & Dining","Standard","11.3 x 11.73 x 7.99 in","5.95 lb","https://www.amazon.com/dp/B09GW5ZXWR"
"","","B097M3XJ49","Vtopmart 4 Pack Food Storage Organizer Bins, Clear Plastic Bins for Pantry, Kitchen, Fridge, Cabinet Organization and Storage, Compartment Holder Packets, Snacks, Pouches, Spice Packets","Vtopmart","$19.99","11,742","367","$234,723","06/20/2021","$9.66","4.7","3,685","$10.33","317","6","FBA","2","Kitchen & Dining","Standard","10.75 x 12.76 x 6.18 in","3.589 lb","https://www.amazon.com/dp/B097M3XJ49"
"","","B0C4VB3YCW","ClearSpace Plastic Storage Bins with Divider  Perfect Kitchen Organization or Pantry Storage  Fridge Organizer, Pantry Organization and Storage Bins, Cabinet Organizers","ClearSpace","$34.99","741","19","$25,928","05/09/2023","","4.8","1,235","","14,356","7","FBA","3","Kitchen & Dining","","","","https://www.amazon.com/dp/B0C4VB3YCW"
"","","B07M718XB3","SimpleHouseware Refrigerator Storage Organizer, Assorted Set of 6","Simple Houseware","$21.87","979","34","$21,411","01/03/2019","$10.66","4.7","7,515","$11.21","8,020","5","FBA","2","Kitchen & Dining","Standard","13.9 x 15.3 x 5.8 in","5.699 lb","https://www.amazon.com/dp/B07M718XB3"
"","","B0C1S6L8WL","efluky Storage Baskets for Organizing, Fabric Storage Bins with Bamboo Handles, Collapsible Storage Baskets for Shelves and Closet, Black Set of 2","efluky","$24.99","1,020","41","$25,490","05/19/2023","","4.7","193","","22,628","7","FBA","1","Home & Kitchen","","","","https://www.amazon.com/dp/B0C1S6L8WL"
"","","B093WSLLYX","Airtight Food Storage Containers 25-Piece Set, Kitchen & Pantry Organization, BPA Free Plastic Storage Containers with Lids, for Cereal, Flour, Sugar, Baking Supplies, Labels & Measuring Cups","M MCIRCO","$39.99","666","23","$26,633","04/29/2021","$24.56","4.6","4,447","$15.43","12,204","7","FBA","10","Kitchen & Dining","Standard","13.425 x 17.323 x 7.835 in","10.679 lb","https://www.amazon.com/dp/B093WSLLYX"
"","","B0CHVD71FQ","14 Pack Fridge Organizer Bins, Clear Refrigerator Organizing with Lids, Stackable Refrigerator Organizer and Storage Set,BPA-Free Fruit Storage Containers for Fridge,Kitchen, Food, Produce, Vegetable","AMALEKO","$35.99","325","9","$11,697","09/11/2023","$22.66","4.7","40","$13.33","30,045","7","FBA","2","Kitchen & Dining","Standard","8.7 x 1 x 12.6 in","8.69 lb","https://www.amazon.com/dp/B0CHVD71FQ"
"","","B0BN1LTCQX","Qilinba Clear Storage Bins Stackable Plastic Containers for Organizing, 8 PACK Multi-size Organizer Bins for Freezer Pantry Cabinet Storage and Organization","Qilinba","$27.19","1,926","83","$52,368","01/09/2023","$15.18","4.8","345","$12.01","2,881","6","FBA","5","Kitchen & Dining","Standard","11.42 x 7.83 x 13.82 in","7.48 lb","https://www.amazon.com/dp/B0BN1LTCQX"
"","","B0C99BHTPY","Fruit Storage Containers for Fridge - 10-Piece Kitchen Organizers Leak Proof Produce Saver and Veggie Storage Bins Set for Refrigerator, Plastic Airtight Food Storage Containers with Lids & Handle","Winproper","$16.99","2,279","395","$38,720","08/06/2023","$6.51","4.3","217","$10.48","279","7","FBA","2","Kitchen & Dining","Standard","8.66 x 4.92 x 11.61 in","3.33 lb","https://www.amazon.com/dp/B0C99BHTPY"
"","","B0BVSR8T6M","ClearSpace Plastic Pantry Organization and Storage Bins with Removable Dividers  Perfect Kitchen Organization or Kitchen Storage  Refrigerator Organizer Bins, Cabinet Organizers (4 Pack)","ClearSpace","$39.99","5,903","197","$236,061","02/13/2023","$27.56","4.7","804","$12.43","872","7","FBA","4","Kitchen & Dining","Standard","6 x 3.5 x 10.5 in","3.76 lb","https://www.amazon.com/dp/B0BVSR8T6M"
"","","B0BC8VSWC7","Vtopmart 6 Pack Clear Stackable Storage Bins with Lids, Large Plastic Containers with Handle for Pantry Organizer and Storage,Perfect for Kitchen,Fridge,Cabinet, Closet,Bathroom Organization","Vtopmart","$29.99","10,576","339","$317,174","08/28/2022","$16.66","4.7","1,436","$13.33","365","7","FBA","2","Kitchen & Dining","Standard","13.11 x 7.95 x 15.51 in","7.65 lb","https://www.amazon.com/dp/B0BC8VSWC7"
"","","B0B9GXG2ZV","Qeirudu 24 Pcs Small Plastic Containers with Lids - Mini Plastic Craft Storage Boxes with Hinged Lids Clear Bead Organizer for Jewelry Findings and Art Supplies (4 Mixed Sizes)","Qeirudu","$15.99","352","9","$5,628","08/11/2022","","4.5","155","","16,305","6","FBA","1","Arts, Crafts & Sewing","","","","https://www.amazon.com/dp/B0B9GXG2ZV"
"","","B0B67PCFLQ","23Qt Plastic Storage Bins Organizer 3 Tier, Stackable Storage Boxes with Lids, Storage Containers for Bedroom Living Room Kitchen Study Office, Folding Storage Boxes","CTSNSLH","$32.99","9,442","314","$311,492","08/24/2022","","4.5","1,869","","1,523","7","FBA","11","Home & Kitchen","","","","https://www.amazon.com/dp/B0B67PCFLQ"
"","","B0B1M37BX9","StorMiracle 16 PCS Drawer Organizer Set, 5 Varied Size Bathroom and kitchen Drawer cabinet organizer Trays, Clear Storage Bins for Makeup, Jewelry, Utensils and Gadgets","StorMiracle","$15.99","9,107","150","$145,621","07/03/2022","$8.45","4.6","1,289","$7.54","4,631","6","FBA","4","Home & Kitchen","Standard","3 x 2 x 9 in","1.6 lb","https://www.amazon.com/dp/B0B1M37BX9"
"","","B0BMFKGVXD","Tiawudi 12 Pack Plastic Storage Bins, Multi-Use Organizer Bins, Pantry Organizer, Clear Storage Containers, Bins for Home & Kitchen","Tiawudi","$29.99","2,370","92","$71,076","11/14/2022","$17.56","4.8","319","$12.43","2,507","7","FBA","1","Kitchen & Dining","Standard","7.2 x 4.5 x 10.5 in","8.89 lb","https://www.amazon.com/dp/B0BMFKGVXD"
"","","B0B5FHSWKT","Ruboxa Clear Drawer Organizer, [25 PCS] Plastic Organizers for Home Organization and Storage, Including 4 Sizes Small Bins, Non-Slip Pads, for Bathroom, Kitchen, Vanity & Office","RUBOXA","$18.99","3,420","66","$64,946","06/28/2022","$9.41","4.7","1,724","$9.58","13,178","6","FBA","1","Home & Kitchen","Standard","11 x 1 x 1 in","4.55 lb","https://www.amazon.com/dp/B0B5FHSWKT"
"","","B0CKNNCR4F","Plastic Storage Baskets with Lid - Plastic Storage Containers Stackable Storage bins: Storage Baskets for Organizing Shelves Drawers Desktop Closet Playroom Classroom Office, 8 Pack-Gray","Ohmlove","$27.99","508","13","$14,219","11/14/2023","","4.5","35","","71,012","7","FBA","1","Home & Kitchen","","","","https://www.amazon.com/dp/B0CKNNCR4F"
"","","B0915XMJYX","AREYZIN Plastic Storage Baskets With Lid Organizing Container Lidded Knit Storage Organizer Bins for Shelves Drawers Desktop Closet Playroom Classroom Office, 6 Pack","AREYZIN","$26.99","2,952","","","03/25/2021","$15.91","4.5","2,343","$11.08","8,080","6","FBA","1","Home & Kitchen","Standard","9.53 x 11.14 x 7.6 in","2.579 lb","https://www.amazon.com/dp/B0915XMJYX"
"","","B095VZ4H2S","Felli Flip Tite Airtight Food Storage Container 5pk Set Lid 4 REGULAR Seal Stackable Plastic Canister Jar, Kitchen Counter Pantry Organizer, Spice Pasta Snack Candy Coffee Bean Gift for Women Mom","Felli","$32.99","2,221","83","$73,271","06/30/2021","$21.31","4.7","1,544","$11.68","2,888","8","FBA","1","Kitchen & Dining","Standard","4 x 13 x 13 in","2.2 lb","https://www.amazon.com/dp/B095VZ4H2S"
"","","B0B46NPJY9","Set of 8 Clear Plastic Storage Bins, 4 Large and 4 Small Stackable Storage Containers for Pantry Organization and Kitchen Storage Bins,Home Edit and Cabinet Organizers","SKTEET","$39.99","1,637","50","$65,464","06/14/2022","$21.63","4.7","359","$18.36","5,292","7","FBA","5","Kitchen & Dining","Oversize","11.57 x 12.99 x 8.66 in","8.289 lb","https://www.amazon.com/dp/B0B46NPJY9"
"","","B0B8N8WR2C","Set of 8, Stackable Clear Bins with Removable Dividers - Food Snack Organizer, Pantry Organization and Storage - Plastic Home Containers - Refrigerator, Fridge, Kitchen Cabinet Organizing Bins","LANDNEOO","$25.99","455","9","$11,825","08/03/2022","$14.76","4.7","415","$11.23","30,946","7","FBA","1","Kitchen & Dining","Standard","6.4 x 3.4 x 11.6 in","6.12 lb","https://www.amazon.com/dp/B0B8N8WR2C"
"","","B0CD7DKYNB","HoneySky 6 Pack - 8.5 Gallon Storage Bins with Lids and Wheels, Collapsible & Stackable Closet Organizers, Foldable Storage Containers Plastic Shelves for Clothes Shoe Book, White","HoneySky","$159.99","620","32","$99,194","09/20/2023","","4.8","9","","28,837","7","FBA","1","Home & Kitchen","","","","https://www.amazon.com/dp/B0CD7DKYNB"
"","","B0B6TK767D","REALINN Under Sink Organizer, Pull Out Cabinet Organizer 2 Tier Slide Out Sink Shelf Cabinet Storage Shelves, Under Sink Storage for Kitchen Bathroom Cabinet","REALINN","$34.99","43,864","1,251","$1.53M","07/17/2022","","4.4","2,957","","27","7","FBA","6","Kitchen & Dining","","","","https://www.amazon.com/dp/B0B6TK767D"
"","","B0CMTH24C4","Cordless & Rechargeable 3200mAh Electric Spin Scrubber with Detergent Container & LED Display Screen, Spin Brush Scrubber Tools with 8pcs Replaceable Brush Heads for Cleaning Tub/Tile/Floor/Bathroom","Levinist","$37.99","753","33","$28,606","11/06/2023","","5","40","","28,017","7","FBA","2","Home & Kitchen","","","","https://www.amazon.com/dp/B0CMTH24C4"
"","","B0B827HHFY","Airtight Food Storage Containers with Lids, Clear Pantry Canister Set for Kitchen Organization, Stackable Organizers for Flour, Sugar, Cereal, Rice, BPA Free Plastic 24 Pack with Different Sizes","FreshKeeper","$31.99","3,467","102","$110,909","07/28/2022","$17.01","4.7","3,357","$14.98","2,210","6","FBA","1","Kitchen & Dining","Standard","7 x 3 x 6 in","11.36 lb","https://www.amazon.com/dp/B0B827HHFY"
"","","B0C9H8QK29","Fabspace Pull-out Home Organizer, 2 Pack 2 Tier Clear Bathroom Organizer with Dividers, Multipurpose Vanity Counter Tray, Kitchen, Closet Organizers, Cabinet & Storage Container Bins","Fabspace","$23.99","3,189","94","$76,504","08/12/2023","$13.06","4.3","414","$10.93","2,442","7","FBA","1","Kitchen & Dining","Standard","7 x 10.6 x 11.8 in","4.55 lb","https://www.amazon.com/dp/B0C9H8QK29"
"","","B089LLDN39","HOOJO Refrigerator Organizer Bins - 8pcs Clear Plastic Bins For Fridge, Freezer, Kitchen Cabinet, Pantry Organization, BPA Free Fridge Organizer, 12.5' Long, Clear","HOOJO","$19.98","18,420","665","$368,032","06/02/2020","$9.95","4.7","32,215","$10.03","104","7","FBA","4","Kitchen & Dining","Standard","10.04 x 12.76 x 6.22 in","5.031 lb","https://www.amazon.com/dp/B089LLDN39"
"","","B08RSPW3B8","Stackable Refrigerator Organizer Bins, 6 Pack Clear Kitchen Organizer Container Bins with Handles and 20 PCS Plastic Bags for Pantry, Cabinets, Shelves, Drawer, Freezer - Food Safe, BPA Free 10'L","Beauty Cottage","$25.99","2,664","95","$69,237","12/30/2020","$14.16","4.6","2,627","$11.83","2,409","7","FBA","2","Kitchen & Dining","Standard","6.14 x 10.43 x 17.7 in","3.83 lb","https://www.amazon.com/dp/B08RSPW3B8"
"","","B09LCDLPJW","Tbestmax 4 Pack Qtip Holder, 10-Ounce Bathroom Organizer Accessories Storage Containers Clear Plastic Apothecary Jars with Bamboo Lids for Cotton Ball, Cotton Swab, Floss","Tbestmax","$8.99","3,186","114","$28,642","11/08/2021","$3.87","4.4","2,811","$5.12","6,689","6","FBA","1","Home & Kitchen","Standard","5.67 x 4.21 x 5.79 in","10 oz","https://www.amazon.com/dp/B09LCDLPJW"
"","","B07CT9XCJM","mDesign Small Plastic Bathroom Storage Container Bins with Handles for Organization in Closet, Cabinet, Vanity or Cupboard Shelf, Accessory Organizer - Ligne Collection - 4 Pack, Clear","mDesign","$24.99","1,860","62","$46,481","05/01/2018","$17.47","4.8","3,421","$7.52","13,955","7","FBA","1","Home & Kitchen","Standard","6 x 3 x 10 in","9.9 oz","https://www.amazon.com/dp/B07CT9XCJM"
"","","B0C1G52JJF","Fixwal Clothes Storage 4 Pack Storage Containers 48L Foldable Blanket Storage Bags for Organizing Clothing Bedroom Comforter Closet Dorm Sweater Quilts Organizer Grey","Fixwal","$11.99","1,464","61","$17,553","04/03/2023","","4.3","223","","14,346","7","FBA","1","Home & Kitchen","","","","https://www.amazon.com/dp/B0C1G52JJF"
"","","B0CMHLDZ9P","damynuo 10Pack Fridge Organizer Bins, Clear Refrigerator Organizing Containers with Refrigerator Drawers and Lids, Stackable Food and Fruit Storage Containers for Fridge Organizers and Storage","damynuo","$29.88","300","10","$8,964","12/16/2023","","4.6","25","","27,719","","FBA","1","Kitchen & Dining","","","","https://www.amazon.com/dp/B0CMHLDZ9P"
"","","B08G4RXLJ6","WYT Clear Storage Latch Box, 6 Pack Storage Organizer Bins with Latching Handle and Lids, 3.5 Quart","WYT","$23.99","2,121","22","$50,883","08/17/2020","$12.76","4.2","1,744","$11.23","41,810","6","FBA","1","Home & Kitchen","Standard","10.1 x 15.3 x 6.9 in","3.801 lb","https://www.amazon.com/dp/B08G4RXLJ6"
"","","B0C36XJ3DV","SpaceHacks 2 Pack Stackable Makeup Organizer and Storage, Acrylic OrganizersClear Plastic Storage Drawer with Handles for Vanity, Undersink, Kitchen Cabinets, Pantry","SpaceHacks","$15.99","4,875","126","$77,951","05/31/2023","$7.80","4.5","582","$8.19","4,436","6","FBA","2","Beauty & Personal Care","Standard","6 x 4.4 x 7.5 in","2.46 lb","https://www.amazon.com/dp/B0C36XJ3DV"
"","","B0C7VP4QZF","Wellent Storage Bin With Lid, Plastic Storage Bin With Wheels and Doors,Stackable Storage Box with Double-Opening Doors,Containers For Organizing,Living Room Kitchen Organizers and Storage 60QT(15","wellent","$49.99","60","2","$2,999","06/12/2023","","4.1","60","","383,739","7","FBA","2","Home & Kitchen","","","","https://www.amazon.com/dp/B0C7VP4QZF"
"","","B0BLZRQYG4","STORi Audrey Stackable Clear Bin Plastic Organizer Drawers | 2 Piece Set | Organize Cosmetics and Beauty Supplies on a Vanity | Made in USA","STORi","$27.99","9,049","246","$253,282","11/09/2022","$17.36","4.5","503","$10.63","1,997","6","FBA","1","Beauty & Personal Care","Standard","6 x 11 x 7.9 in","3.98 lb","https://www.amazon.com/dp/B0BLZRQYG4"
"","","B0BNNSX163","Sorbus Roll Out Bottle Organization Bins - 2 Sizes Pantry Under Sink Organizer with Wheels & Handles - Clear Plastic Organizing Containers for Cleaning Supplies - Kitchen Cabinet Laundry Room Storage","Sorbus","$28.99","608","37","$17,626","07/14/2022","","4.7","128","","7,261","7","FBA","3","Kitchen & Dining","","","","https://www.amazon.com/dp/B0BNNSX163"
"","","B08R9P9CJL","YIHONG Clear Pantry Storage Organizer Bins, 6 Pack Plastic Storage Containers with Handle for Kitchen,Refrigerator, Freezer,Cabinet,Closet,Bathroom Under Sink Organization","YIHONG","$24.98","10,554","331","$263,639","12/27/2021","$8.87","4.6","4,167","$16.11","380","7","FBA","2","Kitchen & Dining","Oversize","12.32 x 13.62 x 8.15 in","6.131 lb","https://www.amazon.com/dp/B08R9P9CJL"
"","","B0BVQ69QJD","WYT Clear Storage Latch Bins, 6-Pack Storage Organizer Box with Handle and Lids, 5-Litre","WYT","$23.99","5,810","171","$139,382","08/17/2020","","4.2","656","","3,864","6","FBA","1","Home & Kitchen","","","","https://www.amazon.com/dp/B0BVQ69QJD"
"","","B0BVMJ4MVK","Hudgan Plastic Storage Containers with Bamboo Lids, Medicine Cabinet Organizer Drawer Organizers Clear Bins with Lids for Organizing Pantry or Bathroom - 4.5 Inches Tall - Set Of 4","Hudgan","$29.99","399","","","03/24/2023","$19.70","4.7","99","$10.29","25,716","6","FBA","1","Kitchen & Dining","Standard","6.7 x 4.5 x 11.2 in","1 lb","https://www.amazon.com/dp/B0BVMJ4MVK"
"","","B0C8QBG139","Sorbus Cleaning Supplies Organizer - Clear Containers for Organizing Cleaning Supplies Under the Sink - Clear Bins for Organizing Kitchen and Bathroom Essentials - Clear Plastic Storage Bins (8 Pack)","Sorbus","$44.99","708","20","$31,853","06/19/2023","$30.31","4.6","99","$14.68","14,121","7","FBA","2","Kitchen & Dining","Standard","8 x 6 x 11.25 in","8.91 lb","https://www.amazon.com/dp/B0C8QBG139"
"","","B09JQ5NHLB","IRIS USA 6 Quart Large Clip Box, 4 Pack, Clear Plastic Storage Container Bins with Latching Lids, Organizing Container for Home, Office and School Supplies, Stackable, Seafoam Blue Buckles","IRIS","$26.99","6,307","229","$170,226","10/17/2021","$9.06","4.6","2,160","$17.93","716","7","AMZ","11","Office Products","Oversize","16.12 x 9.38 x 12.87 in","4.08 lb","https://www.amazon.com/dp/B09JQ5NHLB"
"","","B07PL3D818","IRIS USA 5 Quart Stackable Plastic Storage Bins with Lids and Latching Buckles, 10 Pack - Pearl, Containers with Lids and Latches, Durable Nestable Closet, Garage, Totes, Tubs Boxes Organizing","IRIS","$28.05","11,592","538","$325,156","03/06/2019","$6.54","4.4","27,422","$21.51","593","7","AMZ","9","Home & Kitchen","Oversize","15 x 17 x 12 in","8.001 lb","https://www.amazon.com/dp/B07PL3D818"