"Export time:  1/29/2024, 12:55:12 PM","","ASIN","Product Name","Brand","Price","Monthly Units Sold","Daily Units Sold","Monthly Revenue","Date First Available","Net Revenue","Star Rating","Reviews","Amazon Fees","BSR","LQS","Seller Type","Sellers","Category","Product Tier","Dimensions","Weight","Link"
"","","B07RWK4LRT","Amazon Basics Rectangular Plastic Desk Organizer, Half Accessory Tray, White","Amazon Basics","$5.75","3,978","116","$22,874","09/24/2019","$1.35","4.6","12,792","$4.40","1,809","6","AMZ","1","Office Products","Standard","5.55 x 9.88 x 1.26 in","0.24 lb","https://www.amazon.com/dp/B07RWK4LRT"
"desk organizer","","B01N9HQM9F","Simple Houseware Mesh Desk Organizer with Sliding Drawer, Double Tray and 5 Upright Sections, Black","Simple Houseware","$24.97","4,207","159","$105,049","12/13/2016","$8.10","4.7","33,798","$16.87","1,196","6","FBA","5","Office Products","Oversize","13 x 9 x 13.25 in","1 lb","https://www.amazon.com/dp/B01N9HQM9F"
"Average Monthly Sales: 3,367","","B07D5MKDQP","Simple Houseware Desk Organizer 3 Tray w/Sliding Drawer, Hanging File Holder and Pen Holder Accessory, Black","Simple Houseware","$24.97","373","15","$9,314","05/17/2018","$14.19","4.6","10,327","$10.78","16,150","6","FBA","2","Office Products","Standard","11.732 x 12.992 x 4.803 in","4.696 lb","https://www.amazon.com/dp/B07D5MKDQP"
"Average Revenue: $61,648","","B07V1Z3N7P","My Space Organizers White Desk Organizer, 9 Compartments, Office Supplies and Desk Accessories Organizer, Pen Holder, Office Decor Desktop Organizer (White)","My Space Organizers","$29.99","994","34","$29,810","07/07/2019","$19.06","4.6","873","$10.93","7,299","7","FBA","1","Office Products","Standard","7.9 x 10.8 x 5.6 in","1.7 lb","https://www.amazon.com/dp/B07V1Z3N7P"
"Average Price: $24.00","","B0BYMRJD7R","Marbrasse Pen Organizer with 2 Drawer, Multi-Functional Pencil Holder for Desk, Desk Organizers and Accessories with 5 Compartments + Drawer for Office Art Supplies (White)","Marbrasse","$9.99","12,533","470","$125,205","03/15/2023","$3.97","4.5","9,078","$6.02","228","7","FBA","1","Office Products","Standard","4.2 x 6.3 x 8.2 in","14.4 oz","https://www.amazon.com/dp/B0BYMRJD7R"
"Average No. of Ratings: 2,619","","B0BZ4396D5","OPNICE Desk Organizers and Accessories, Desk Organizer with Drawer, 4-Tier Paper Tray Organizer with 2 Pen Holders + File Holder, Office Desk Accessories for Office Supplies(Rose Gold)","OPNICE","$26.99","4,495","223","$121,320","04/24/2023","$14.00","4.5","541","$12.99","744","6","FBA","3","Office Products","Oversize","16.13 x 9.05 x 9.44 in","1.6 oz","https://www.amazon.com/dp/B0BZ4396D5"
"Average Sales Rank: 14,723","","B088NHGC48","Simple Trending 2 Tier Metal Monitor Stand Monitor riser and Computer Desk Organizer with Drawer and Pen Holder for Laptop, Computer, iMac, Black","Simple Trending","$30.57","","","","05/13/2020","$22.31","4.7","2,108","$8.26","4","6","FBA","1","Computer Monitor Stands","Standard","10.3 x 16.3 x 1.4 in","3.75 lb","https://www.amazon.com/dp/B088NHGC48"
"Average Rating Number: 4.6","","B09XCFX6L5","Delifox Inclined Desk File Organizer, 5-Section Vertical File Folder Holder Stand Metal Rack File Sorter for Office Classroom Desktop Organization, Black","Delifox","$24.99","2,119","56","$52,954","04/06/2022","$13.61","4.8","254","$11.38","4,308","6","FBA","7","Office Products","Standard","11.5 x 7.5 x 12 in","4 lb","https://www.amazon.com/dp/B09XCFX6L5"
"","","B0BN3YHMZR","VIVSOL Desk Organizer with Mesh File Holder, 4-Tier Office Supplies Desk Organizers and Accessories with Sliding Drawers & Pen Holder, Desk File Organizer and Storage for Office, School, Home, Black","VIVSOL","$34.99","727","26","$25,438","11/21/2022","$17.38","4.6","396","$17.61","9,691","7","FBA","4","Office Products","Oversize","11.22 x 11.02 x 11.2 in","4 lb","https://www.amazon.com/dp/B0BN3YHMZR"
"","","B01DP9ZDR2","UnionBasic Desk Organizer - Multifunctional Leather Desktop Pen Holder Storage Box - Business Card/Pen/Pencil/Mobile Phone/Stationery Holder (Blue)","UnionBasic","$19.99","318","12","$6,357","03/31/2016","$11.20","4.7","1,581","$8.79","19,389","7","FBA","2","Office Products","Standard","6 x 11.4 x 6 in","1.951 lb","https://www.amazon.com/dp/B01DP9ZDR2"
"","","B07XP4TPY2","Wellerly Desk Organizer, Office Supplies Pen Holder Organizers Multi-Functional Mesh Desk Organization Storage with 8 Compartments and 1 Drawer Stationery Caddy Oval for Office School Home Supply","Wellerly","$12.96","159","3","$2,061","09/08/2019","$5.88","4.8","419","$7.08","66,207","6","FBA","1","Office Products","Standard","4.6 x 8.9 x 4.5 in","1.1 lb","https://www.amazon.com/dp/B07XP4TPY2"
"","","B091T8WJQF","HOPECK Organizer Office Accessories, Multi-Functional Mesh Desk Organizer with 6 Compartments and 1 Drawer for Home, School, Workshop, kitchen (Black)","HOPECK","$11.99","590","38","$7,074","04/05/2021","$5.05","4.7","1,299","$6.94","6,415","6","FBA","2","Office Products","Standard","5.709 x 8.858 x 5.394 in","1.409 lb","https://www.amazon.com/dp/B091T8WJQF"
"","","B0BTD47CKH","Marbrasse Desk Organizer with File Holder, 5-Tier Paper Letter Tray Organizer, Mesh Desk Organizers and Accessories with Magazine Holder, Desktop Organizer and Storage for Office Supplies (Black)","Marbrasse","$26.99","723","20","$19,514","01/29/2023","","4.5","180","","12,116","7","FBA","2","Office Products","","","","https://www.amazon.com/dp/B0BTD47CKH"
"","","B0B7DYCX2F","SUPEASY Desk Organizers Metal Desk Magazine File Holder with 5 Vertical Compartments Rack File Organizer for Office Desktop, Home Workspace, Black","SUPEASY","$26.99","1,652","43","$44,587","07/22/2022","","4.4","523","","5,697","6","FBA","2","Office Products","","","","https://www.amazon.com/dp/B0B7DYCX2F"
"","","B0BP7CT6QK","DALTACK 3 Tier Letter Tray Paper Organizer with Handle, Mesh Desk File Organizer, Paper Tray Desk Organizer for School Office Home, Metal Mesh, Black","DALTACK","$19.99","360","9","$7,196","12/05/2022","","4.7","124","","27,329","6","FBA","1","Office Products","","","","https://www.amazon.com/dp/B0BP7CT6QK"
"","","B0B9Y3YL58","BOHDK Desk Organizer with Hanging File Holder, Paper Letter Tray Organizer with Drawer and Pen Holder, Mesh Desktop Organizer and Storage for Office Supplies(Black)","BOHDK","$29.99","593","24","$17,784","08/16/2022","","4.6","671","","10,365","7","FBA","1","Office Products","","","","https://www.amazon.com/dp/B0B9Y3YL58"
"","","B0C8N1VX44","LEKETREE Desk Organizers and Accessories, 3-Tier Paper Organizer with 5 Vertical File Holders, File Organizer for Desk, Desk Accessories & Workspace Organizers (Black)","LEKETREE","$23.99","2,296","87","$55,081","08/04/2023","","4.5","165","","2,585","6","FBA","1","Office Products","","","","https://www.amazon.com/dp/B0C8N1VX44"
"","","B0C7L373XM","Simple Houseware Desk Dual Monitor Stand Riser with Drawer, Rustic Brown","Simple Houseware","$37.87","","","","08/02/2023","","4.6","436","","20","6","FBA","1","Computer Monitor Stands","","","","https://www.amazon.com/dp/B0C7L373XM"
"","","B08YWWGQ6H","Simple Houseware Desk Monitor Stand Riser with Adjustable Organizer tray, Maple","Simple Houseware","$30.97","","","","03/12/2021","$16.75","4.6","3,821","$14.22","105","6","FBA","1","Computer Monitor Stands","Oversize","11 x 6 x 20.5 in","8 lb","https://www.amazon.com/dp/B08YWWGQ6H"
"","","B09NFQML72","Simple Trending-Metal Monitor Stand Riser and Computer Desk Organizer with Drawer for Laptop, Computer, iMac, Black","Simple Trending","$26.87","","","","03/28/2022","$18.53","4.6","1,493","$8.34","3","6","FBA","1","Computer Monitor Stands","Standard","10.354 x 16.26 x 3.583 in","3.766 lb","https://www.amazon.com/dp/B09NFQML72"
"","","B08TWMGK63","BEYGORM Acrylic Monitor Stand Riser, Wide 20', 2 Tier Computer with Storage, Desk Organizer Desktop Printer Laptop Storage Shelf Screen Holder Phone Holder(Clear)","BEYGORM","$49.99","","","","01/24/2021","$35.39","4.8","439","$14.60","96","6","FBA","3","Computer Monitor Stands","Oversize","8.5 x 20.4 x 6.2 in","5.45 lb","https://www.amazon.com/dp/B08TWMGK63"
"","","B09TQYBYHS","Metal Monitor Stand Riser and Computer Desk Organizer with Drawer for Laptop, Computer, iMac, Black","Ekisemio","$24.97","","","","03/01/2022","","4.7","215","","218","","FBA","1","Computer Monitor Stands","","","","https://www.amazon.com/dp/B09TQYBYHS"
"","","B0CNBZNT14","Pletpet Multi-Role Desk Organizer, Desktop Extension Drawer, 2-Tier Mesh Under Desk Drawer for Office Supplies & Home Essentials Organization, Black","Pletpet","$29.99","280","12","$8,397","11/14/2023","$13.89","4.2","3","$16.10","19,433","6","FBA","1","Office Products","Oversize","10 x 10 x 10 in","7.39 lb","https://www.amazon.com/dp/B0CNBZNT14"
"","","B0CJMDVVV2","QIYVLOS Desk Organizer with 3 Drawer, Multi-Functional Pencil Pen Holder for Desk, Desk Organizers and Storage with 5 Compartments, Desktop Organizer for Office Home Art Supplies (White)","QIYVLOS","$14.99","1,598","50","$23,954","09/21/2023","","4.6","56","","4,851","7","FBA","1","Office Products","","","","https://www.amazon.com/dp/B0CJMDVVV2"
"","","B0C6QMPX37","Marbrasse Mesh Pen Holder for Desk, Desk Organizer with Drawer, Multi-Functional Pencil Organizer, Desk Organizers and Accessories for Office Art Supplies (Black)","Marbrasse","$20.99","2,183","88","$45,821","05/30/2023","","4.4","376","","2,544","7","FBA","1","Office Products","","","","https://www.amazon.com/dp/B0C6QMPX37"
"","","B07VZNK2LY","Amazon Basics Expandable Plastic Wall Pockets, File Organizer, Stackable, Letter Size, 1-Pocket, Clear","Amazon Basics","$14.84","1,335","16","$19,811","10/02/2019","$8.84","4.5","2,050","$6.00","15,414","6","AMZ","1","Office Products","Standard","6.97 x 4.21 x 13.07 in","7 oz","https://www.amazon.com/dp/B07VZNK2LY"
"","","B0916QF2KQ","SimpleHouseware Desktop Document Tray Organizer with Sliding Drawer/Caddy/Hanging File Section, Black","Simple Houseware","$19.97","198","9","$3,954","03/25/2021","$9.94","4.7","147","$10.03","25,766","6","FBA","1","Office Products","Standard","12.52 x 13.3 x 4.49 in","5.71 lb","https://www.amazon.com/dp/B0916QF2KQ"
"","","B06ZZY3YBV","SimpleHouseware Mesh Desk Organizer with Sliding Drawer, Double Tray and 5 Stacking Sorter Sections, Black","Simple Houseware","$24.97","218","10","$5,443","04/18/2017","$13.89","4.6","10,158","$11.08","22,707","6","FBA","2","Office Products","Standard","9.4 x 6.7 x 13.4 in","4.85 lb","https://www.amazon.com/dp/B06ZZY3YBV"
"","","B0C1NFX8YG","GoldOrcle Mesh Desk File Organizer with 5 Vertical File, Multifunction Desktop Organizers and Accessories for Home Office Magazine Book Organization","GoldOrcle","$24.99","1,378","35","$34,436","04/05/2023","$13.31","3.9","19","$11.68","7,081","6","FBA","1","Office Products","Standard","12.76 x 6.42 x 13.74 in","5.74 lb","https://www.amazon.com/dp/B0C1NFX8YG"
"","","B09K5927B5","Marbrasse Desk Organizer with File Holder, 5-Tier Paper Letter Tray Organizer with Drawer and 2 Pen Holder, Mesh Desktop Organizer and Storage with Magazine Holder for Office Supplies(Black)","Marbrasse","$32.99","6,566","178","$216,612","10/22/2021","$20.56","4.5","3,208","$12.43","1,024","7","AMZ","4","Office Products","Standard","13 x 4.72 x 15.7 in","6.6 lb","https://www.amazon.com/dp/B09K5927B5"
"","","B07R7FZ6RG","Simple Trending 7 Tier Desk File Organizer, Letter Tray Paper Organizer with Pen Holder and Metal Hanging Basket, Black","Simple Trending","$33.97","1,160","33","$39,405","04/25/2019","$22.14","4.7","3,457","$11.83","7,599","6","FBA","1","Office Products","Standard","9.37 x 13.66 x 4.53 in","4.76 lb","https://www.amazon.com/dp/B07R7FZ6RG"
"","","B0CGQN3N98","KINGFOM Desk Organizer with Drawer, Multifunction Pencil Holder for Desk, Desk Organizer and Accessories 5 Comparetments for Home Office Supplies (Black)","KINGFOM","$36.99","127","8","$4,698","08/27/2023","","4.9","11","","27,868","7","FBA","1","Office Products","","","","https://www.amazon.com/dp/B0CGQN3N98"
"","","B0BYTYH54W","Becomrock Desk Organizers and Accessories, Office Supplies Desktop Organizer, Desk File Organizer with Sliding Drawer, Dual Tray and 5 Upright Section, File Folder Holder for Desk","Becomrock","$20.29","615","42","$12,478","04/22/2023","","5","14","","5,763","6","FBA","1","Office Products","","","","https://www.amazon.com/dp/B0BYTYH54W"
"","","B0BBCBDF4C","greatstar Organizer Set (Metal Mesh Pen Holder, Pen Cup, Sticky Notes) Office Supplies Organizer Desk Organizer Desktop manager set","greatstar","$9.30","30","1","$279.00","08/20/2022","","5","3","","116,276","7","FBA","1","Office Products","","","","https://www.amazon.com/dp/B0BBCBDF4C"
"","","B0CGJ44ND8","Dicunoy Wood Remote Control Holder, Rustic Desk Caddy for Pencil Holder, Vintage Desktop Organizer Box with 4 Compartments and Boho Pattern Printing for Home, Office, School","Dicunoy","$13.99","30","1","$419.70","08/23/2023","$8.20","5","5","$5.79","161,758","6","FBA","1","Office Products","Standard","10.2 x 3 x 3.1 in","3.2 oz","https://www.amazon.com/dp/B0CGJ44ND8"
"","","B0C5WZYXWS","dreampossible white Wood Desk Organizer and Accessories with Drawer, Bill Mail Organizer and File Mail Holder for Office Supplies, Desk Accessories & Workspace Organizers for Desk Organization","dreampossible","$29.99","195","11","$5,848","05/20/2023","","4.5","35","","22,508","7","FBA","1","Office Products","","","","https://www.amazon.com/dp/B0C5WZYXWS"
"","","B0C61T74ZL","Loftiage Desk Organizer with File Holder, 4-Tier Office Desk Organizers and Accessories with Sliding Drawer and 2 Pen Holders, Mesh Desktop Organizer and Storage for Office Supplies, Black","Loftiage","$21.98","208","5","$4,572","05/22/2023","$5.94","4.4","42","$16.04","45,056","7","FBA","1","Office Products","Oversize","9.45 x 9.06 x 17.13 in","5.6 lb","https://www.amazon.com/dp/B0C61T74ZL"
"","","B078Z16F53","SimpleHouseware Expandable 5 Section Metal Upright File Sorter Organizer, Black","Simple Houseware","$16.87","5,328","165","$89,883","01/02/2018","$8.55","4.4","7,867","$8.32","1,135","5","FBA","3","Office Products","Standard","8.74 x 14.173 x 3.032 in","2.161 lb","https://www.amazon.com/dp/B078Z16F53"
"","","B0CFVYSC1M","Youbetia 5 Tier Paper Letter Tray Organizer with Mesh File Holder, Desk Accessories & Workspace Desktop Organizers with Drawer and Pen Holder, Office Supplies Desk Organizer (Rose Gold)","Youbetia","$32.99","1,628","56","$53,708","09/21/2023","$14.54","4.6","137","$18.45","4,270","7","FBA","1","Office Products","Oversize","9.45 x 11.25 x 16.15 in","5.6 lb","https://www.amazon.com/dp/B0CFVYSC1M"
"","","B0B287HQN2","gianotter Desk Organizers and Accessories, Office Supplies Desk Organizer with Sliding Drawer, Double Tray and 5 Upright Section File Sorter Organizer (Rose Gold)","gianotter","$23.79","2,417","112","$57,500","08/08/2022","$13.49","4.7","2,025","$10.30","1,884","6","FBA","1","Office Products","Standard","10 x 13.74 x 4.37 in","3.66 lb","https://www.amazon.com/dp/B0B287HQN2"
"","","B0BWTT3WK1","gianotter Paper Letter Tray Organizer with File Holder, 4-Tier Desk Accessories & Workspace Desk Organizers with Drawer and 2 Pen Holder for Office Supplies (Rose Gold)","gianotter","$26.99","5,344","107","$144,235","04/04/2023","","4.6","954","","2,007","6","FBA","2","Office Products","","","","https://www.amazon.com/dp/B0BWTT3WK1"
"","","B0B2W3YQ2J","Marbrasse Desk Organizer with Drawer, 4-Tier Mesh Desk File Organizer with 5 Vertical File Holders and 2 Pen Holders, Multifunction Desktop Organizer","Marbrasse","$29.99","1,854","54","$55,601","05/31/2022","$18.16","4.4","1,199","$11.83","4,411","7","FBA","2","Office Products","Standard","10.2 x 14.17 x 5.63 in","6.219 lb","https://www.amazon.com/dp/B0B2W3YQ2J"
"","","B0CJ5L59PQ","Desk Organizer with 4 Drawer Storage, Desktop Storage Drawers for Office/School Supplies, Plastic Stationary Organizer, Makeup Organizer, Desk Storage Box Organizer for Office, School, Bathroom","ORGIDOL","$21.99","1,366","44","$30,038","09/14/2023","","4.6","111","","5,604","7","FBA","1","Office Products","","","","https://www.amazon.com/dp/B0CJ5L59PQ"
"","","B0BRK638J7","EOOUT 4-Tier Desk File Organizer, Black Desk Organizers with Drawers and Pen Holder Paper Organizer for Desk Home Office Teacher Supplies","EOOUT","$18.99","862","27","$16,369","01/02/2023","$9.11","4","116","$9.88","9,319","6","FBA","1","Office Products","Standard","11.61 x 4.41 x 13.66 in","4.75 lb","https://www.amazon.com/dp/B0BRK638J7"
"","","B0C2ZBBPY9","COMFYROOM Desk Organizer and Accessories with 6 Compartments and 2 Drawers, Plastic Makeup Organizer, Pen Holder for Desktop Storage, Desk Organization for School, Home, Office Supplies (White)","COMFYROOM","$13.99","901","24","$12,605","04/18/2023","","4.4","107","","10,233","7","FBA","1","Office Products","","","","https://www.amazon.com/dp/B0C2ZBBPY9"
"","","B0CF5D4Z1V","LEKETREE Desk Organizers and Accessories, 5-Tier Paper Letter Tray Organizer with File Holder, Desktop Organizer for Office Supplies, Office Desk Accessories & Workspace(Black)","LEKETREE","$24.99","3,139","90","$78,444","09/12/2023","","4.3","149","","2,479","6","FBA","1","Office Products","","","","https://www.amazon.com/dp/B0CF5D4Z1V"
"","","B0C495G7K9","Desk Organizers and Accessories, File Organizer with Drawer and Pen Holder, Paper Organizer Letter Tray, Office Organization with Handle for Office Supplies, Desktop Organizer, Workspace Organizers","Zikopomi","$32.99","1,546","47","$51,003","05/03/2023","$14.16","4.5","353","$18.83","5,133","7","FBA","4","Office Products","Oversize","13.77 x 11.41 x 12.2 in","5.13 lb","https://www.amazon.com/dp/B0C495G7K9"
"","","B08MWTQ5GG","BLU MONACO White Desktop Organizer with Drawer - Home Countertop Storage - Paper Wood Bill Letter Mail Organizer for Office Desk Accessories & Workspace Organizers","BLU MONACO","$35.00","845","38","$29,575","11/05/2020","$23.32","4.6","889","$11.68","6,499","6","FBA","1","Office Products","Standard","5.9 x 7.5 x 12.3 in","3.43 lb","https://www.amazon.com/dp/B08MWTQ5GG"
"","","B08MWV6P61","Mail Organizer Countertop Kitchen - White Wood Desk Organizer Storage with Drawer - Mail Sorter Organizer or Bill Organizer for Desk - Farmhouse Desk Organizer Accessories - Mail Basket for Counter","BLU MONACO","$34.97","3,626","96","$126,801","04/13/2021","$22.69","4.6","1,226","$12.28","2,281","6","FBA","1","Office Products","Standard","8.9 x 13.86 x 5.67 in","3.481 lb","https://www.amazon.com/dp/B08MWV6P61"
"","","B09QKDY1YY","Supeasy 5 Tier Desk Organizer with Handle, Mesh Paper/File Organizer for Desk, Paper Tray Organizer for Office Supplies Black","SUPEASY","$17.98","5,791","300","$104,122","01/16/2022","$2.16","4.7","2,367","$15.82","475","6","FBA","4","Office Products","Oversize","12.5 x 13.5 x 9.5 in","1 lb","https://www.amazon.com/dp/B09QKDY1YY"
"","","B0CFTG8H8D","gianotter 5-Tier Paper Letter Tray Organizer with File Holder, Desk Organizer with Drawer and Pen Holder, Mesh Desktop Storage with Magazine Holder for Office Supplies (Rose Gold)","gianotter","$32.99","553","14","$18,243","09/22/2023","","4.6","78","","17,038","6","FBA","1","Office Products","","","","https://www.amazon.com/dp/B0CFTG8H8D"
"","","B0CLQRMMNH","Pencil Pen Holder for Desk,9 Slots 360 Degree Rotating Desk Organizers,Desktop Storage Stationery Supplies Organizer, Cute Pencil Cup Pot For Office, School, Home(White)","Cayxenful","$13.99","908","17","$12,703","11/30/2023","","4.8","20","","14,690","7","FBA","1","Office Products","","","","https://www.amazon.com/dp/B0CLQRMMNH"
"","","B0BYVGTGCH","GGIANTGO Pencil Pen Holder for Desk, 9 Slots 360 Degree Rotating Desk Organizer, Cute Pen Organizers Stationery Supplies for Office Home & Art Supply (Beige)","GGIANTGO","$13.99","1,487","63","$20,803","03/17/2023","","4.8","261","","3,735","6","FBA","1","Office Products","","","","https://www.amazon.com/dp/B0BYVGTGCH"
"","","B08FM9ZD2M","Marbrasse 4-Trays Desktop File Organizer with Pen Holder | Paper Letter Tray with Drawer and 2 Pen Holder | Mesh Office Supplies Desk Organizer for Home Office (Black)","Marbrasse","$24.99","1,085","45","$27,114","08/10/2020","$14.51","4.5","2,448","$10.48","5,354","6","FBA","7","Office Products","Standard","9.646 x 4.528 x 13.583 in","4.784 lb","https://www.amazon.com/dp/B08FM9ZD2M"
"","","B08KXKVT4K","Vtopmart 25 PCS Clear Plastic Drawer Organizers Set, 4-Size Versatile Bathroom and Vanity Drawer Organizer Trays, Storage Bins for Makeup, Bedroom, Kitchen Gadgets Utensils and Office","Vtopmart","$15.29","84,768","3,122","$1.30M","10/08/2020","$6.09","4.7","29,196","$9.20","12","7","FBA","4","Home & Kitchen","Standard","2 x 9 x 6 in","3.92 lb","https://www.amazon.com/dp/B08KXKVT4K"
"","","B08BZJY7R6","White Cable Clips, Cord Organizer Cable Management, Cable Organizers USB Cable Holder Wire Organizer Cord Clips, 2 Packs Cord Holder for Desk Car Home and Office (5, 3 Slots)","INCHOR","$5.24","7,694","344","$40,317","06/28/2020","$1.53","4.6","16,265","$3.71","121","7","FBA","1","Electronics","Standard","3.82 x 0.59 x 6.73 in","1.06 oz","https://www.amazon.com/dp/B08BZJY7R6"
"","","B06ZYJ9MWW","3 Pack - Stackable Desk File Document Letter Tray Organizer, Black","Simple Houseware","$21.87","839","32","$18,349","04/18/2017","$12.16","4.5","4,802","$9.71","7,736","4","FBA","1","Office Products","Standard","11.1 x 3.5 x 13.8 in","2.7 lb","https://www.amazon.com/dp/B06ZYJ9MWW"
"","","B0C58MCR4C","Marbrasse Desk Organizer, 360-Degree Rotating Pen Holder for Desk, Desk Organizers and Accessories with 5 Compartments Pencil Organizer, Art Supply Storage Box Caddy for Office, Home White","Marbrasse","$9.99","9,649","445","$96,394","05/14/2023","","4.7","2,010","","250","7","FBA","1","Office Products","","","","https://www.amazon.com/dp/B0C58MCR4C"
"","","B0CJYD4TML","VEESUN Desk Organizer, Mesh Paper Organizer Letter Tray With Vertical File Holder For Office Organization Supplies,Black","VEESUN","$24.98","132","4","$3,297","09/26/2023","","4.8","72","","54,996","7","FBA","1","Office Products","","","","https://www.amazon.com/dp/B0CJYD4TML"
"","","B0BMTRMRNZ","gianotter 3 Tier Desk Drawer Organizer, Office Desk Organizers and Accessories with 2 Pen Holder, Desk Accessories & Workspace Organizers for Home Office Supplies (Black)","gianotter","$23.99","1,041","14","$24,974","12/24/2022","","4.6","140","","17,014","6","FBA","1","Office Products","","","","https://www.amazon.com/dp/B0BMTRMRNZ"
"","","B0CNRH8NNS","MINDEPOT 4-Tier Paper Organizer + 3-Pocket File Holder + Drawer + 2 Pen Holders, Desktop File Organizers Paper Tray for Office Accessories School Classroom Organization (Black)","MINDEPOT","$25.99","810","27","$21,052","01/03/2024","","4.5","13","","9,238","","FBA","","Office Products","","","","https://www.amazon.com/dp/B0CNRH8NNS"
"","","B08PBFKGJG","Marbrasse 6 Tier Paper Organizer Letter Tray - Mesh Desk File Organizer with Handle, Paper Sorter Organizer for Letter/A4 Office File Folder Holder - Black","Marbrasse","$21.99","9,461","328","$208,047","11/29/2020","$12.26","4.7","2,878","$9.73","414","6","FBA","3","Office Products","Standard","13.937 x 17.323 x 3.228 in","5.739 lb","https://www.amazon.com/dp/B08PBFKGJG"
"","","B0CC8H8QXX","3 Pack Under Desk Drawer Organizer, Slide Out Desk Drawer, Clear Plastic Drawer Under Desk for Office, School, Home, Hidden Desktop Organizer Pen Holder for Desk Self-Adhesive (Clear, 3 Size)","caktraie","$29.99","1,017","40","$30,500","07/18/2023","$14.27","4.2","192","$15.72","6,094","5","FBA","2","Office Products","Oversize","12.4 x 3.94 x 19.29 in","3.87 lb","https://www.amazon.com/dp/B0CC8H8QXX"
"","","B0CD9XYPB9","Simple Trending 5 Tier Mesh Desk File Organizer, Paper Letter Tray File Holder with Sliding Drawer Organizer for Office Home, Black","Simple Trending","$33.97","447","10","$15,185","07/31/2023","","4.5","33","","22,644","6","FBA","1","Office Products","","","","https://www.amazon.com/dp/B0CD9XYPB9"
"","","B0BMV1T4DK","Desk Organizer, File Organizer for Desk with 2-Tier Paper Letter Tray, Drawer and 2 Pen Holder, Mesh Desktop Organization with Magazine Holder for Office Supplies","Topwey","$24.57","3,352","98","$82,359","11/17/2022","","4.5","1,149","","2,214","7","FBA","2","Office Products","","","","https://www.amazon.com/dp/B0BMV1T4DK"
"","","B0CGMQQQ2B","Annova Desk Drawer Organizer Tray for Office Organization - Metal Mesh - Storage Tray with Dividers for Pens, Desktop Accessories, Bathroom, Kitchen, Makeup and Office Supplies (Large, Gold)","Annova","$16.97","340","15","$5,770","08/24/2023","","4.7","21","","16,471","6","FBA","1","Office Products","","","","https://www.amazon.com/dp/B0CGMQQQ2B"
"","","B01GVQB0J6","Mindspace Office Desk Organizer with 6 Compartments + Drawer | The Mesh Collection, Black","Mindspace","$9.99","790","38","$7,892","06/09/2016","$2.70","4.7","5,064","$7.29","6,500","6","FBA","1","Office Products","Standard","5.906 x 8.976 x 5.354 in","1.455 lb","https://www.amazon.com/dp/B01GVQB0J6"
"","","B0C77Y175C","SUPEASY Desk Organizer with File Holder, 5-Tier Mesh Paper Letter Tray Organizer with Pen Holder and Drawer, Desktop Organizer and Storage with 3 Tilted File Sorter for Office Supplies, White","SUPEASY","$32.99","657","12","$21,674","06/05/2023","","4.4","42","","75,887","7","FBA","1","Home & Kitchen","","","","https://www.amazon.com/dp/B0C77Y175C"
"","","B0CNTF75G6","MINDEPOT Computer Monitor Stands with Drawers, Metal Mesh Desktop Monitor Riser, Desk Storage Organizer with Drawers for PC, Laptop, Printer","MINDEPOT","$27.99","","","","01/02/2024","","4.7","4","","98","6","FBA","1","Computer Monitor Stands","","","","https://www.amazon.com/dp/B0CNTF75G6"
"","","B0CM9VBFHY","SEYHAKI Under Desk Drawer Organizer No Drilling Under Desk Storage Drawer Organizer Metal Under Desk Drawer Suitable for Home and Office(13 Inch)","SEYHAKI","$29.99","180","6","$5,398","12/30/2023","","5","19","","36,725","","FBA","3","Office Products","","","","https://www.amazon.com/dp/B0CM9VBFHY"