"Export time:  2/8/2024, 3:27:20 PM","","ASIN","Product Name","Brand","Price","Monthly Units Sold","Daily Units Sold","Monthly Revenue","Date First Available","Net Revenue","Star Rating","Reviews","Amazon Fees","BSR","LQS","Seller Type","Sellers","Category","Product Tier","Dimensions","Weight","Link"
"","","B07JGWSB8T","Amazon Basics Under Bed Fabric Storage Container Bags with Window and Handles - 2-Pack, 18 x 42 x 6 Inches, Gray","Amazon Basics","$15.75","","","","05/16/2019","$6.66","4.4","20,544","$9.09","666","6","AMZ","2","Our Brands","Standard","10.8 x 17.1 x 3.3 in","3.45 lb","https://www.amazon.com/dp/B07JGWSB8T"
"bedding storage","","B0BT73TJ6K","LINENMATE Twin/Full Size (Ivory 2-Pack) - The Original 2-Pack Linen Storage Container with Sheet-Folding Assisted Panels | Bed Sheets | Duvet Covers | Pillowcases | Towels","LINENMATE","$54.97","910","19","$50,023","01/25/2023","","4.5","176","","49,237","6","FBA","1","Home & Kitchen","","","","https://www.amazon.com/dp/B0BT73TJ6K"
"Average Monthly Sales: 5,531","","B0C9QBRQB4","SpaceAid 4 Pack Bed Sheet Organizers and Storage, Foldable Sheet Organizer for Linen Closet, Sheets Set Folder Keeper with Window XL (Queen & King Size) Organizing Bedding Container, Gray","SpaceAid","$39.98","6,704","197","$268,026","06/28/2023","","4.6","258","","3,149","6","FBA","2","Home & Kitchen","","","","https://www.amazon.com/dp/B0C9QBRQB4"
"Average Revenue: $139,657","","B085ZV98JM","90L Large Storage Bags, 6 Pack Clothes Storage Bins Foldable Closet Organizers Storage Containers with Durable Handle for Clothing, Blanket, Comforters, Bed Sheets, Pillows and Toys (Gray)","Budding Joy","$24.99","40,719","1,005","$1.02M","03/16/2020","$13.31","4.3","45,081","$11.68","170","6","FBA","4","Home & Kitchen","Standard","11.54 x 14.45 x 6.77 in","2.69 lb","https://www.amazon.com/dp/B085ZV98JM"
"Average Price: $30.00","","B07PCNGJP8","Lifewit Large Capacity Clothes Storage Bag Organizer with Reinforced Handle Thick Fabric for Comforters, Blankets, Bedding, Foldable with Sturdy Zipper, Clear Window, 3 Pack, 90L, Grey","Lifewit","$15.99","8,554","296","$136,778","03/02/2019","$7.16","4.5","75,245","$8.83","1,678","6","FBA","2","Home & Kitchen","Standard","10.63 x 13.27 x 3.94 in","1.57 lb","https://www.amazon.com/dp/B07PCNGJP8"
"Average No. of Ratings: 6,295","","B0CJJHLSXQ","BigPonPon 3-Pack Foldable Bed Sheets Set Organizers and Storage(King & Queen Size),Linen Fabric Closet Organizers with Window,Folding Bedding Storage Box for Bedsheets and Pillow Cube Organizer","BigPonPon","$29.77","1,918","109","$57,099","09/20/2023","$17.97","4.6","67","$11.80","7,081","7","FBA","1","Home & Kitchen","Standard","12.5 x 4.7 x 15 in","5.13 lb","https://www.amazon.com/dp/B0CJJHLSXQ"
"Average Sales Rank: 64,805","","B0CH8HGGZJ","StorageWorks 90L Large Closet Organizers, Storage Bins for Comforters, Bedding, Clothes Storage Bags with Dual Zipper, Clear Window Storage Containers, Beige, 1-Pack","StorageWorks","$17.99","429","15","$7,718","12/04/2023","","4.3","105","","63,930","6","FBA","1","Home & Kitchen","","","","https://www.amazon.com/dp/B0CH8HGGZJ"
"Average Rating Number: 4.5","","B099Z1T8V1","Vacuum Storage Bags, 10 Large Space Saver Bags Seal with Pump, Sealer for Clothes, Comforters, Blankets, Bedding","Roomimaster","$19.99","20,494","591","$409,675","07/20/2021","$11.20","4.3","6,655","$8.79","496","6","FBA","1","Home & Kitchen","Standard","7.2 x 3.82 x 11.1 in","2.09 lb","https://www.amazon.com/dp/B099Z1T8V1"
"","","B0CLNW1M58","Koretech 4 Pack/ 2 Pack Sheet Organizers and Storage Durable Plastic King Size, Linen Closet Organizers and Storage, Bed Sheet Organizer, Linen Storage (White, 4 Pack)","Koretech","$39.99","123","2","$4,919","10/23/2023","","4.6","11","","341,751","7","FBA","1","Home & Kitchen","","","","https://www.amazon.com/dp/B0CLNW1M58"
"","","B07FZTBHR3","SLEEPING LAMB 120L Extra Large Blanket Storage Bags Breathable Clothes Storage Containers for King Comforter Bedding Pillow Sheet, Reinforced Handles, Grey","SLEEPING LAMB","$11.99","1,483","52","$17,781","08/06/2018","$0.11","4.6","5,199","$11.88","17,291","6","FBA","2","Home & Kitchen","Oversize","16.1 x 22.3 x 20 in","3.53 oz","https://www.amazon.com/dp/B07FZTBHR3"
"","","B09TB8WFXC","HomeHacks Storage 3-Pack Clothes Organizer Storage Bags Foldable Storage Box with Large Clear Window Sturdy Handles for Closet, Dorm, Pillows, Bedding, Clothes, Stuffed Toys, Blankets, 35L, Grey","HomeHacks","$11.99","4,521","151","$54,207","04/09/2022","$4.40","4.4","1,185","$7.59","4,587","6","FBA","4","Home & Kitchen","Standard","9.84 x 9.92 x 3.82 in","0.86 lb","https://www.amazon.com/dp/B09TB8WFXC"
"","","B09KHBVQC4","Amazon Basics Fabric Underbed Storage Bag Organizer with Handles - Gray, Pack of 2","Amazon Basics","$28.49","","","","07/05/2022","$17.49","4.4","649","$11.00","3,440","6","AMZ","1","Our Brands","Standard","6.89 x 15.665 x 4.606 in","4.497 lb","https://www.amazon.com/dp/B09KHBVQC4"
"","","B0CH8FGVH9","StorageWorks 90L Large Closet Organizers, Storage Bins for Comforters, Bedding, Clothes Storage Bags with Dual Zipper, Clear Window Storage Containers, Beige, 3-Pack","StorageWorks","$39.99","450","15","$17,996","12/14/2023","","4.3","105","","63,930","","FBA","1","Home & Kitchen","","","","https://www.amazon.com/dp/B0CH8FGVH9"
"","","B07FQTBFZ5","Sorbus Storage Bins with Metal Frame - Stackable & Foldable Clothes Organizer Bags - Oxford Fabric Storage Containers with Large Clear Window & Carry Handles, Bedroom Organization for Bedding & Linen","Sorbus","$24.99","762","22","$19,042","01/21/2018","$14.81","4.7","2,328","$10.18","43,198","7","FBA","2","Home & Kitchen","Standard","2 x 16.5 x 12.5 in","3.1 lb","https://www.amazon.com/dp/B07FQTBFZ5"
"","","B0CM37V25J","GODELAIF Bed Sheet Organizer and Storage, Foldable Sheet Set Organizer for Twin/Full/Queen/King Size, Linen Closet Organizers and Storage with Handle for Sheet Set Bedding Clothes Blanket","GODELAIF","$24.99","286","6","$7,147","10/29/2023","","4.8","87","","138,740","7","FBA","1","Home & Kitchen","","","","https://www.amazon.com/dp/B0CM37V25J"
"","","B0C1BK6DCP","SheetCube Bed Sheet Organizers and Storage 6 Pack, Foldable Linen Closet Organizer with Window and Label, Bedding Folder Storage Box Container for Blanket, Duvet Cover Set, Bed Sheet Set - Beige","SUOCO","$49.99","2,261","41","$113,027","06/05/2023","$34.56","4.4","167","$15.43","22,231","7","FBA","2","Home & Kitchen","Standard","12.68 x 4.17 x 15.35 in","8.9 lb","https://www.amazon.com/dp/B0C1BK6DCP"
"","","B092ZDHJMN","Fab totes 6 Pack Clothes Storage, Foldable Blanket Storage Bags, Storage Containers for Organizing Bedroom, Closet, Clothing, Comforter, Organization and Storage with Lids and Handle, Grey","Fab totes","$29.99","47,292","1,076","$1.42M","08/20/2021","","4.3","22,198","","147","6","FBA","8","Home & Kitchen","","","","https://www.amazon.com/dp/B092ZDHJMN"
"","","B08JPVWLB8","WISELIFE Storage Bags [3 Pack/100L] Large Blanket Clothes Organization and Storage Containers for Comforters,Bedding, Foldable Organizer with Reinforced Handle, Clear Window, Sturdy Zippers,Gray","WISELIFE","$19.99","5,469","155","$109,325","11/25/2020","$10.56","4.6","10,711","$9.43","4,425","7","FBA","1","Home & Kitchen","Standard","11.614 x 11.89 x 3.976 in","1.636 lb","https://www.amazon.com/dp/B08JPVWLB8"
"","","B084RMZX96","Comforter Storage Bag - Folding Organizer bag for King/Queen Comforters, Pillows, Blankets, Bedding/Quilt, Blanket, Duvet, Mothproof Space Saver; Large Collapsible Organizers, 24'x14'x11'","Chaos Cleared","$14.99","2,659","89","$39,858","02/11/2020","$8.97","4.6","1,747","$6.02","9,120","7","FBA","1","Home & Kitchen","Standard","8 x 1 x 10 in","0.5 lb","https://www.amazon.com/dp/B084RMZX96"
"","","B0CNCJVG3K","BigPonPon 7 Pack Bed Sheet Organizers And Storage, Foldable Linen Closet Organizer With Handle For Linen Closet(King&Queen Size),Bedding Storage Boxs With Window For Bedsheets,Blanket,Duvet Covers","BigPonPon","$69.99","","","","11/14/2023","","4.7","16","","","7","FBA","1","","","","","https://www.amazon.com/dp/B0CNCJVG3K"
"","","B0CND5KBKS","Springfield Studios Stackable Bed Sheet Organizers and Storage, Each Canvas Bag holds 2 sets of Queen or King Sheet/Duvet, Upgrade your closet organizers and storage with trendy bedding storage bags","Springfield Studios","$29.99","60","2","$1,799","11/15/2023","","4.7","26","","377,262","","FBA","","Home & Kitchen","","","","https://www.amazon.com/dp/B0CND5KBKS"
"","","B0CDWPJ9S8","BIKTIC SheetCube Bed Sheet Organizers and Storage,4 Pack Sheet Folder Organizer (Queen or King Size), Linen Closet Organizer for Bedding Sheets,Duvet Covers and Pillow cases,Black","BIKTIC","$39.99","1,481","48","$59,225","08/13/2023","","4.8","372","","18,639","7","FBA","3","Home & Kitchen","","","","https://www.amazon.com/dp/B0CDWPJ9S8"
"","","B0C23KFBDN","Fixwal Extra Large Blanket Storage Bags 120L 2 Pack Comforter Storage Bags with Reinforced Handles Breathable Clothes Storage Containers for King Comforter Bedding Pillow Sheet Grey","Fixwal","$12.59","1,735","85","$21,844","04/10/2023","","4.5","425","","9,687","6","FBA","1","Home & Kitchen","","","","https://www.amazon.com/dp/B0C23KFBDN"
"","","B0CGTG9S1F","Lifewit 4 Pack Clear Clothes Storage Bags, 40L Plastic Blanket Storage Bags, Vinyl Foldable Moving Bags with Zipper, Closet Organizers and Storage Containers for Bedding, Duvet, Comforter, Toys","Lifewit","$21.99","1,500","50","$32,985","12/20/2023","","4.7","94","","18,038","","FBA","1","Home & Kitchen","","","","https://www.amazon.com/dp/B0CGTG9S1F"
"","","B08JP5Z88N","WISELIFE Storage Bags, Large Blanket Clothes Organization and Storage Containers for Bedding, Comforters, Foldable Organizer with Reinforced Handle, Clear Window,Sturdy Zippers,(Grey, 3 x 100L)","WISELIFE","$19.99","3,376","76","$67,486","11/22/2020","$9.96","4.5","15,081","$10.03","11,000","7","FBA","3","Home & Kitchen","Standard","12.126 x 15.787 x 4.095 in","1.676 lb","https://www.amazon.com/dp/B08JP5Z88N"
"","","B09Q38H2J4","Budding Joy 90L Under Bed Storage Containers, Closet Organizers and Storage Bins, Collapsible Underbed Storage Bags for Blankets, Towels, Comforter, Sweaters, Linen Sheets, Wrapping Paper","Budding Joy","$19.50","13,737","387","$267,872","01/09/2022","$9.55","4.2","6,141","$9.95","1,069","7","FBA","1","Home & Kitchen","Standard","12.874 x 14.095 x 4.567 in","2.56 lb","https://www.amazon.com/dp/B09Q38H2J4"
"","","B07KMD53WP","combocube Jumbo Zippered Storage Bag for Closet King Comforter, pillow, quilt, bedding, Clothes, Blanket Organizers with Large Clear Window & Carry Handles Space Saver","combocube","$16.99","2,285","62","$38,822","07/15/2018","$9.92","4.5","4,743","$7.07","13,995","6","FBA","1","Home & Kitchen","Standard","5 x 8 x 2 in","14.9 oz","https://www.amazon.com/dp/B07KMD53WP"
"","","B0CDLDW71R","Feverdes SheetCube Bed Sheet Set Organizer 4-Pack (Queen or King Size),Foldable Storage Box,Linen Closet Organizer for Bedding Sheets, Duvet Covers,Blankets and Pillow Cases (Grey)","Feverdes","$59.99","411","10","$24,656","08/02/2023","","4.4","50","","91,396","6","FBA","1","Home & Kitchen","","","","https://www.amazon.com/dp/B0CDLDW71R"
"","","B0C4LFRYDR","GZOOGHOME 4 Pack Bed Sheet Organizers and Storage, Sheet Folder Organizer for Linen Closet, Foldable Sheets Set Keeper XL (Queen or King Size) Organizing Bedding Container (Circle Window, Black)","GZOOGHOME","$39.99","777","18","$31,072","05/07/2023","$26.66","4.2","147","$13.33","52,967","7","FBA","2","Home & Kitchen","Standard","4.5 x 12.8 x 15 in","3.1 lb","https://www.amazon.com/dp/B0C4LFRYDR"
"","","B08NJP3J18","SGHUO Clear Zippered Storage Bag, Plastic Vinyl Clear Storage Bag for Blanket Clothes, Comforter, Bedding, Moving Bag with Zipper and Reinforced Handle (4pcs)","SGHUO","$24.99","1,142","35","$28,539","11/15/2020","$-9.74","4.6","1,494","$34.73","26,828","7","FBA","2","Home & Kitchen","Oversize","16.5 x 9.5 x 23.5 in","1.4 kg","https://www.amazon.com/dp/B08NJP3J18"
"","","B0C16JFJJN","SheetCube 4 Pack Bed Sheet Organizers and Storage, Foldable Bedding Storage Box Container with Window and Label, Linen Closet Organizer Folder for Blanket, Duvet Cover Set, Bed Sheet Set - Grey","SUOCO","$25.49","1,603","51","$40,860","06/05/2023","","4.2","573","","17,713","6","FBA","2","Home & Kitchen","","","","https://www.amazon.com/dp/B0C16JFJJN"
"","","B09XBF9J8B","Canvas Comforters Bags Closet Organizers and Storage for Quilts Clothes Organization Containers Bins with Sturdy Zipper, Clear Window 75L for Sweaters Blankets Storage Bedroom Collapsible","CHICVIE","$39.99","413","8","$16,516","04/05/2022","$27.56","4.7","131","$12.43","106,899","5","FBA","3","Home & Kitchen","Standard","9.016 x 11.929 x 4.213 in","3.631 lb","https://www.amazon.com/dp/B09XBF9J8B"
"","","B0CDRZYXG5","90L Large Storage Bags For Clothes,6 Pack Foldable Blanket Clothing Storage Bags With Lids And Handle,Grey Storage Containers Organizers Bins With Zipper For Closet, Clothing, Comforters And Blankets","VISRIE","$13.00","2,007","36","$26,091","07/31/2023","","4.3","123","","26,034","7","FBM","3","Home & Kitchen","","","","https://www.amazon.com/dp/B0CDRZYXG5"
"","","B07KQRYVFJ","Clear Zippered Storage Bags (3-Pack) Closet Organizer Vinyl Bag for Bedding, Linen, Blankets, Duvet Covers, Comforters, Clothes & Toys | Multi Purpose & Space Saver PVC Organizers","Wappa Home","$24.99","3,311","73","$82,742","12/30/2018","$15.45","4.5","3,499","$9.54","11,649","6","FBA","1","Home & Kitchen","Standard","6.85 x 9.37 x 5.67 in","2.101 lb","https://www.amazon.com/dp/B07KQRYVFJ"
"","","B09W23J1PN","Vacuum Storage Bags with Electric Air Pump, 15 Pack (3 Jumbo, 3 Large, 3 Medium, 3 Small, 3 Roll Up Bags) Space Saver Bag, Vacuum Sealer Bags for Clothes, Blanket, Duvets, Pillows, Comforters, Travel","WANALIT","$39.99","12,361","311","$494,316","05/09/2022","$27.56","4.4","4,254","$12.43","1,548","7","FBA","2","Home & Kitchen","Standard","9.291 x 12.402 x 3.819 in","2.82 lb","https://www.amazon.com/dp/B09W23J1PN"
"","","B0CM9C87K1","20 Gallon Large Clear Blanket Storage Bags for Bedding with Zipper Handles, 76L Oversized Comforter Storage Bag King Size, Folding Plastic Bedding Storage for Clothes, Bed Sheet, Pillow, Toys, 4Pack","Acnusik","$25.97","413","3","$10,726","10/31/2023","","4.6","39","","264,422","7","FBA","1","Home & Kitchen","","","","https://www.amazon.com/dp/B0CM9C87K1"
"","","B0973DGD8P","20 Pack Vacuum Storage Bags, Space Saver Bags (4 Jumbo/4 Large/4 Medium/4 Small/4 Roll) Compression for Comforters and Blankets, Sealer Clothes Storage, Hand Pump Included","Cozy Essential","$24.99","65,494","1,643","$1.64M","07/28/2021","$14.51","4.3","54,787","$10.48","57","6","FBA","3","Home & Kitchen","Standard","8.071 x 12.244 x 6.614 in","3.699 lb","https://www.amazon.com/dp/B0973DGD8P"
"","","B0C9QB47R2","SpaceAid 8 Pack Bed Sheet Organizers and Storage, Foldable Sheet Organizer for Linen Closet, Sheets Set Folder Keeper with Window XL (Queen & King Size) Organizing Bedding Container, Beige","SpaceAid","$62.98","1,278","35","$80,488","06/28/2023","","4.4","131","","26,606","6","FBA","2","Home & Kitchen","","","","https://www.amazon.com/dp/B0C9QB47R2"
"","","B0CH2XNB9C","PHINOX Bed Sheet Organizers and Storage, 4-Pack Sheet Storage Organizer for Linen Closet, Foldable Sheet Set Organizer Zippers for Queen&King Sheets","PHINOX","$33.99","240","8","$8,158","08/31/2023","","4.6","61","","117,058","7","FBA","1","Home & Kitchen","","","","https://www.amazon.com/dp/B0CH2XNB9C"
"","","B0C5WL6CFL","KIMBORA Foldable Bed Sheet Organizer and Storage, 3 Pack King Size Sheet Set Organizer for Linen Closet With Clear PVC Sheet Storage for Bedding Sheets, Duvet Covers and Pillow cases","KIMBORA","$23.99","770","15","$18,472","05/21/2023","$13.06","4.3","127","$10.93","63,828","7","FBA","2","Home & Kitchen","Standard","4.5 x 13 x 15 in","1 lb","https://www.amazon.com/dp/B0C5WL6CFL"
"","","B0B68RFYYJ","Fixwal 6 Pack Clear Clothes Storage Bags PVC Organizers with Reinforced Handle 18x15x9 Inch Transparent Vinyl Space Saver with Sturdy Zippers for Comforters, Blankets, Linen, Bedding, Duvet","Fixwal","$28.99","958","29","$27,772","07/10/2022","","4.4","1,301","","32,237","7","FBA","1","Home & Kitchen","","","","https://www.amazon.com/dp/B0B68RFYYJ"
"","","B07CG9GBS4","SUOCO 8 Jumbo Vacuum Storage Bags, Space Saver Bags with Travel Hand Pump, Compression Airtight Sealer Bags for Clothes, Bedding, Pillows, Comforters, Blankets","SUOCO","$15.98","12,171","639","$194,493","05/19/2018","$6.85","4.3","35,438","$9.13","427","6","FBA","1","Home & Kitchen","Standard","10.16 x 4.8 x 13.5 in","2.73 lb","https://www.amazon.com/dp/B07CG9GBS4"
"","","B0CDLFH8PX","Feverdes SheetCube Bed Sheet Organizers and Storage 2 Pack (Queen or King Size),Foldable Bedding Organizer with Zipper,for Bed Sheets, Duvet Covers, Blankets, Pillowcases (Grey)","Feverdes","$39.99","553","4","$22,114","08/02/2023","","4.2","38","","192,139","6","FBA","1","Home & Kitchen","","","","https://www.amazon.com/dp/B0CDLFH8PX"
"","","B078JJ3C61","Zober Under Bed Storage - Pack of 2 Under Bed Storage Containers for Clothes, Blankets, Winter Clothing, & Shoes - Under The Bed Storage with Handles, Dual Zippers, & Clear Top (Gray)","ZOBER","$13.99","7,510","165","$105,065","11/08/2016","$-9.21","4.3","22,310","$23.20","4,065","6","FBA","1","Home & Kitchen","Oversize","18 x 6 x 41.97 in","1.07 lb","https://www.amazon.com/dp/B078JJ3C61"
"","","B0C9Q61MDQ","SpaceAid 6 Pack Bed Sheet Organizers and Storage, Foldable Sheet Organizer for Linen Closet, Sheets Set Folder Keeper with Window XL (Queen & King Size) Organizing Bedding Container, Black","SpaceAid","$49.98","934","23","$46,681","06/28/2023","","4.6","136","","40,694","6","FBA","3","Home & Kitchen","","","","https://www.amazon.com/dp/B0C9Q61MDQ"
"","","B08VRGKQC4","combocube 3Pcs Jumbo Zippered Storage Bag for Closet King Comforter, pillow, quilt, bedding, Clothes, Blanket Organizers with Large Clear Window & Carry Handles Space Saver","combocube","$19.99","1,075","26","$21,489","02/01/2021","$10.56","4.5","1,375","$9.43","35,622","6","FBA","1","Home & Kitchen","Standard","7 x 5 x 15 in","1.41 lb","https://www.amazon.com/dp/B08VRGKQC4"
"","","B0CJJHZS33","Bed Sheet Organizers and Storage - 4 Pack (Queen or King Size),Foldable Storage Box for Duvet Cover Set, Linen Closet Organizer for Bedding Clothes Blankets, Grey","Aokeyee","$29.99","765","45","$22,942","09/20/2023","$18.16","4.7","95","$11.83","20,043","6","FBA","1","Home & Kitchen","Standard","12.9 x 5 x 15 in","4.85 lb","https://www.amazon.com/dp/B0CJJHZS33"
"","","B0C9PL48DM","BIKTIC SheetCube Bed Sheet Organizers and Storage,4 Pack Sheet Folder Organizer (Queen or King Size), Linen Closet Organizer for Bedding Sheets,Duvet Covers and Pillow cases,Grey","BIKTIC","$39.99","1,419","48","$56,746","07/31/2023","","4.8","372","","18,639","7","FBA","4","Home & Kitchen","","","","https://www.amazon.com/dp/B0C9PL48DM"
"","","B0CFXX2BSH","Wesapor Foldable Bed Sheet Set Organizer, 2-Pack Sheet Set Organizer for Linen Closet,Sheet Organizer and Storage for Bedding Clothes Blankets, Bed Sheet Storage Box for Duvet Cover Set","Wesapor","$49.99","402","3","$20,096","08/16/2023","$37.35","5","4","$12.64","282,301","7","FBA","1","Home & Kitchen","Standard","1 x 1 x 1 in","1.83 lb","https://www.amazon.com/dp/B0CFXX2BSH"
"","","B0CB3S75HL","Furnhome 6 Pack Bed Sheet Organizers and Storage, Sheet Organizer for Linen Closet, Foldable Sheet Set Organizer, Sheet Storage Cube for Beding Sheets, Duvet Covers and Pillowcases","Furnhome","$69.99","207","5","$14,488","07/03/2023","","4.5","70","","184,492","7","FBA","2","Home & Kitchen","","","","https://www.amazon.com/dp/B0CB3S75HL"
"","","B099MYRYG9","Ineetatu Clear Storage Bags with Zipper, 75L Extra Large Capacity - Closet, Underbed Storage Organizer for Clothes, Bedding, Comforter, Toys, Pillow & Blanket, 3 Pack","Ineetatu","$21.99","1,457","41","$32,039","07/15/2021","$12.90","4.7","819","$9.09","22,211","6","FBA","1","Home & Kitchen","Standard","9.49 x 2.56 x 13.5 in","1.87 lb","https://www.amazon.com/dp/B099MYRYG9"
"","","B09LM8KPYN","StorageRight Storage Bins,3-Pack Clothes Storage, Foldable Blanket Storage Bags, Under Bed Storage Containers for Organizing, Clothing, Bedroom, Comforter, Closet, Dorm, Quilts, Organizer,Grey","StorageRight","$16.99","4,338","79","$73,703","01/02/2022","$8.01","4.2","5,960","$8.98","10,513","6","FBA","3","Home & Kitchen","Standard","10.079 x 12.047 x 3.583 in","1.041 lb","https://www.amazon.com/dp/B09LM8KPYN"
"","","B07FV68GLK","VEAMOR Comforter Storage Bags Pack of 2,Pillow Beddings/Blanket Clothes Organizer Storage Containers with Zippers,Breathable and Moistureproof(Black,2pcs)","VEAMOR","$24.99","731","23","$18,268","06/21/2018","$15.45","4.5","1,810","$9.54","40,535","6","FBA","2","Home & Kitchen","Standard","9.8 x 3 x 13 in","0.882 lb","https://www.amazon.com/dp/B07FV68GLK"
"","","B077XFWHSV","MISSLO Water Resistant Thick Over Size Storage Bag, Folding Organizer Bag, Under Bed Storage, College Carrying Bag for Bedding Comforters, Blanket, Clothes (Grey)","MISSLO","$13.99","207","5","$2,896","02/11/2018","$6.75","4.7","1,196","$7.24","163,467","6","FBA","3","Home & Kitchen","Standard","9.84 x 10.47 x 1.26 in","1.199 lb","https://www.amazon.com/dp/B077XFWHSV"
"","","B09YM8GN8G","Clothes Storage Bags Foldable Blanket Storage Bins for Closet Organizers Storage Containers with Durable Handles Thick Fabric for Clothing Comforter Blanket Bedding Organization and Storage 6 Pack","Budding Joy","$21.99","6,263","164","$137,723","04/21/2022","$0.63","4.3","2,985","$21.36","4,082","6","FBA","3","Home & Kitchen","Oversize","13 x 12.2 x 21.7 in","2.2 lb","https://www.amazon.com/dp/B09YM8GN8G"
"","","B0CMCT6J89","WDZREE 4 Pack Bed Sheet Organizers and Storage (Queen & King Size),Foldable Storage Box for Duvet Cover Set,Linen Closet Organizer for Bedding Sheets, Blankets and Pillow Cases (L, Grey)","WDZREE","$39.99","90","3","$3,599","12/23/2023","","4.6","6","","296,353","","FBA","1","Home & Kitchen","","","","https://www.amazon.com/dp/B0CMCT6J89"
"","","B0C7Z2VPFK","YUOROS Bed Sheet Set Organizer (Queen or King Size), 2 Pack Foldable Linen Closet Organizers and Storage for Bed Sheets, Duvet Covers and Pillowcases (2 Pack, King Size)","YUOROS","$22.99","154","3","$3,540","06/13/2023","","4.6","54","","249,272","6","FBA","3","Home & Kitchen","","","","https://www.amazon.com/dp/B0C7Z2VPFK"