"Export time:  2/1/2024, 1:44:12 PM","","ASIN","Product Name","Brand","Price","Monthly Units Sold","Daily Units Sold","Monthly Revenue","Date First Available","Net Revenue","Star Rating","Reviews","Amazon Fees","BSR","LQS","Seller Type","Sellers","Category","Product Tier","Dimensions","Weight","Link"
"","","B08RJC26TQ","Elk and Friends 16 oz Mason Jar Cups with Silicone Lids + Silicone Straws | Pint Glass Jars | Smoothie Cups | Drinking Glasses | Oats Container + Food Storage | 4 Pack | Multiple Color Options","Elk and Friends","$36.99","252","11","$9,321","12/28/2020","$25.01","4.3","320","$11.98","24,762","6","FBA","1","Kitchen & Dining","Standard","8.347 x 8.819 x 6.221 in","3.779 lb","https://www.amazon.com/dp/B08RJC26TQ"
"mason jars with lids and straws","","B09WMSCX9B","16 OZ Mason Jars with Protective Silicone Sleeve, Mason Cups Drinking Glass with Straws and 8PCS Stainless Steel Lids - BPA Free (4COLOR ASST Shell)","Hyperspace","$24.99","66","1","$1,649","03/27/2022","","4.5","18","","140,020","7","FBA","1","Kitchen & Dining","","","","https://www.amazon.com/dp/B09WMSCX9B"
"Average Monthly Sales: 1,061","","B08SLRTYPM","Elk and Friends Kids & Toddler Cups | The Original Glass Mason jars 8 oz with Silicone Sleeves & Silicone Straws with Stoppers | Smoothie Cups | Spill Proof Sippy Cups for Toddlers","Elk and Friends","$34.99","4,371","155","$152,941","01/10/2021","$23.95","4.6","5,315","$11.04","1,240","7","FBA","1","Kitchen & Dining","Standard","7.49 x 7.64 x 5.4 in","2.8 lb","https://www.amazon.com/dp/B08SLRTYPM"
"Average Revenue: $25,093","","B07VQZ2R56","REGULAR Mouth Mason Jar Lids for Ball, Kerr, etc with Straw Hole/Straws/Silicone Stoppers/Rings/Clean Brush, BPA Free Colored Plastic Canning Jar Drinking Lids & Food Storage Caps 26 Pack","Qinline","$12.99","714","24","$9,275","07/25/2019","$7.97","4.7","5,531","$5.02","11,700","7","FBA","1","Kitchen & Dining","Standard","9 x 14 x 0.5 in","0.549 lb","https://www.amazon.com/dp/B07VQZ2R56"
"Average Price: $25.57","","B0BM9215FR","TANGLONG 16 oz Mason Jar with Lid and Straw, Set of 12, Clear Glass, Traditional Style, Food Storage Container","TANGLONG","$32.99","657","25","$21,674","11/13/2022","","4.7","864","","10,865","7","FBA","4","Kitchen & Dining","","","","https://www.amazon.com/dp/B0BM9215FR"
"Average No. of Ratings: 1,173","","B09QKV561Y","[ 4 Pack ] Glass Cups Set - 24oz Mason Jar Drinking Glasses w Bamboo Lids & Straws 2 Airtight Cute Reusable Boba Bottle, Iced Coffee Glasses, Travel Tumbler for Bubble Tea, smoothie, Juice","NETANY","$22.99","1,783","66","$40,991","01/16/2022","$12.51","4.5","3,063","$10.48","3,785","7","FBA","1","Kitchen & Dining","Standard","9.33 x 10.31 x 7.76 in","5.201 lb","https://www.amazon.com/dp/B09QKV561Y"
"Average Sales Rank: 55,151","","B0CJQM17RG","Sips Jar Club Set of 4 Glass Mason Jar with Handle - 20oz Mason Jars with Lids and Straws + Cleaning Brush - Mason Jar Drinking Glasses for Overnight Oats & Mason Jar Cup for Iced Coffee, Boba & More","Sips Jar Club","$23.99","326","11","$7,821","11/08/2023","","5","11","","25,703","6","FBA","1","Kitchen & Dining","","","","https://www.amazon.com/dp/B0CJQM17RG"
"Average Rating Number: 4.5","","B091562CNX","Elk and Friends Stainless Steel Cups | Mason Jar 10oz | Kids & Toddler Cups with Silicone Sleeves & Straws with Stopper | Spill proof Smoothie Cups for Kids","Elk and Friends","$34.99","6,579","193","$230,199","03/25/2021","$24.60","4.4","6,212","$10.39","901","7","FBA","1","Kitchen & Dining","Standard","7.48 x 4.528 x 7.48 in","0.882 lb","https://www.amazon.com/dp/B091562CNX"
"","","B0BPXVBB5V","DWTS DANWEITESI Mason Jar with Lid and Straw, 24oz Glass Cups-Wide Mouth Reusable Drinking Glasses,Iced Coffee Cups Glass,Vasos De Vidrio【4 Pack】","DWTS DANWEITESI","$19.97","1,106","58","$22,087","12/12/2022","","4.5","633","","4,459","7","FBA","2","Kitchen & Dining","","","","https://www.amazon.com/dp/B0BPXVBB5V"
"","","B09PGPML6F","Wide Mouth Mason Jars 16 oz. (12 Pack) - Pint Size Jars with Airtight Lids and Bands for Canning, Fermenting, Pickling, or DIY Decors and Projects Bundled with Jar Opener","Peaknip","$42.99","1,147","27","$49,310","12/29/2021","$31.40","4.8","217","$11.59","10,405","7","FBA","1","Kitchen & Dining","Standard","2.75 x 5 x 2.75 in","1 lb","https://www.amazon.com/dp/B09PGPML6F"
"","","B07FKL7G7G","VERONES Mason Jars 4 OZ, Canning Jars With Regular Lids, Ideal for Jam, Honey, Wedding Favors, Shower Favors, DIY Spice Jars, 40 PACK","VERONES","$30.99","1,154","39","$35,762","07/12/2018","$13.22","4.5","4,090","$17.77","6,952","6","FBA","7","Kitchen & Dining","Oversize","14.8 x 6.4 x 14.8 in","11.53 lb","https://www.amazon.com/dp/B07FKL7G7G"
"","","B0CBQJ8KN8","Dealusy 4 Glass Cups with Lids, Straws, and Brushes - 16 oz Drinking Cup Set with Bamboo Lids and Straws for Iced Coffee, Tumblers with Straw and Lid","Dealusy","$12.99","15,948","592","$207,165","09/08/2023","","4.6","667","","131","6","FBA","1","Kitchen & Dining","","","","https://www.amazon.com/dp/B0CBQJ8KN8"
"","","B0B2P9PV7J","Mason Jars with Handle, Glass Mugs with Straws and Bamboo Lids & Colorful Airtight Lids 4pcs Set, 16oz Drinking Glass Cups, Travel Tumbler for Iced Coffee, Smoothie, Overnight Oats Containers","VITEVER","$19.99","646","25","$12,914","05/29/2022","$10.56","4.6","724","$9.43","11,077","7","FBA","1","Kitchen & Dining","Standard","9.13 x 6.5 x 9.17 in","1 lb","https://www.amazon.com/dp/B0B2P9PV7J"
"","","B0C2Y597WN","ANOTION Glass Cups with Lids and Straws 4 Packs, 24oz Travel Coffee Mug Wide Mouth Mason Jar Iced Coffee Smoothie Cup Glass Tumbler Tea/Boba Cup Clear Cute Water Cups Drinking Jars Glasses","ANOTION","$26.99","1,287","41","$34,736","04/18/2023","","4.6","298","","6,604","7","FBA","2","Kitchen & Dining","","","","https://www.amazon.com/dp/B0C2Y597WN"
"","","B0967BXXY9","Elk and Friends Smoothie Cups For Kids & Toddler | The Original Glass Mason Jars 12 oz with Silicone Sleeves & Straws |Spill Proof|","Elk and Friends","$35.99","2,439","91","$87,780","03/10/2021","$24.80","4.4","1,343","$11.19","2,570","7","FBA","1","Kitchen & Dining","Standard","7.598 x 7.756 x 6.732 in","2.934 lb","https://www.amazon.com/dp/B0967BXXY9"
"","","B0C23LCZTH","Soligt 4 Pack Mason Jar Lids, Wide Mouth Pour Spout Flip Cap Lids for Ball Brand Mason Jars, Leak Proof Airtight for Drinking Salad Dressing & Food Storing","SOLIGT","$15.99","1,657","48","$26,495","07/13/2023","$9.82","4.6","6,832","$6.17","5,488","7","FBA","1","Kitchen & Dining","Standard","3.66 x 1.57 x 3.66 in","7.8 oz","https://www.amazon.com/dp/B0C23LCZTH"
"","","B0CL2XKP27","Mason Jars 32 oz (14pc Set) Multi-Purpose Mason Jar Pitcher | Wide Mouth Mason Jars 32 oz - Use Quart Mason Jars as Mason Jar Cups, Breast Milk Pitcher or Canning Jars 32 oz - Leakproof","B & B KREASHIONS","$26.99","180","6","$4,858","10/14/2023","","4.9","16","","46,506","7","FBA","1","Kitchen & Dining","","","","https://www.amazon.com/dp/B0CL2XKP27"
"","","B0CNP8TKX6","Brajttt Glass Jar 32oz,Set of 4 Jar with Lid,Airtight Glass Storage Jar with Wooden Lid, Glass Food Storage Containers for Kitchen Counter, Pantry, Coffee, Tea, Sugar, Cookie, Candy","Brajttt","$18.99","930","31","$17,661","11/19/2023","$9.41","5","4","$9.58","8,760","6","FBA","1","Kitchen & Dining","Standard","3 x 3 x 2 in","5.44 lb","https://www.amazon.com/dp/B0CNP8TKX6"
"","","B0CKQX96BD","Glass Cups with Lids and Straw (Set of 4), 24 oz Tumbler Cup Mason Jars Iced Coffee Cup with Bamboo Lid and Straw","Generic","$25.99","267","13","$6,939","10/08/2023","","4.7","9","","21,501","5","FBA","1","Kitchen & Dining","","","","https://www.amazon.com/dp/B0CKQX96BD"
"","","B08YKB17WQ","YSJILIDE Smoothie Cups, Glass Mason Drinking Jar, 24oz Smoothie Cups with Lid and Stainless Steel Straw, Drinking Mugs, Tea Cup Travel Mug, Ideal for Juice, Milk (Pack Of 2, Clear)","YSJILIDE","$16.99","143","4","$2,430","03/09/2021","$9.30","4.7","131","$7.69","69,035","7","FBA","1","Kitchen & Dining","Standard","7.17 x 7.52 x 3.98 in","1.85 lb","https://www.amazon.com/dp/B08YKB17WQ"
"","","B0C71LK4JV","ASANMEYO 2 Pcs Glass Cups Set - 24oz Mason Jar Drinking Glasses with Bamboo Lids & Straws & 2 Airtight Lids, Cute Reusable Boba cup, Iced Coffee Glasses, Travel Tumbler for Bubble Tea, smoothie, Juice","ASANMEYO","$14.99","160","5","$2,398","06/02/2023","","4.5","16","","49,953","7","FBA","1","Kitchen & Dining","","","","https://www.amazon.com/dp/B0C71LK4JV"
"","","B0BRMZW793","24 Pack 17 oz Plastic Mason Jars with Lid and Straws, Reusable Juice Jar with Aluminum Caps PET Clear Mason Jar for Water Milk Beverages Drink Bottles (U Shape)","Sabary","$26.99","45","1","$1,215","01/03/2023","$14.11","4.8","7","$12.88","141,794","7","FBA","2","Kitchen & Dining","Standard","12.32 x 7.72 x 16.73 in","2.7 lb","https://www.amazon.com/dp/B0BRMZW793"
"","","B0B197Q7FD","WeeSprout Glass Cups With Lids & Straws, Spill-resistant Cups for Toddlers & Kids, Triple as Toddler Cups, Baby Food Storage & Snack Jars, XL Silicone Straws, Easy-grip Sleeves, Set of four 12 oz jars","WeeSprout","$31.98","682","16","$21,810","02/09/2022","","4.2","671","","6,769","7","FBA","1","Baby","","","","https://www.amazon.com/dp/B0B197Q7FD"
"","","B07GN1P3NX","Zephyr Canyon Plastic Mason Jars with Handles, Lids and Straws | 20 oz Double Insulated Tumbler with Straw | 4 Pack Set of 4 | Wide Mouth Mason Jar Mugs | Cups for Kids and Adults","Zephyr Canyon","$28.95","466","9","$13,491","10/24/2018","$17.88","4.2","1,457","$11.07","31,525","6","FBA","1","Kitchen & Dining","Standard","8.4 x 9.8 x 7 in","2.551 lb","https://www.amazon.com/dp/B07GN1P3NX"
"","","B099DCPW1M","Elk and Friends Stainless Steel Cups | 10oz Mason Jar Cups with Silicone Sleeves & Straws | Spill-proof Smoothie Cups for Kids & Toddlers","Elk and Friends","$27.99","6,499","193","$181,907","07/13/2021","$18.65","4.4","6,212","$9.34","901","7","FBA","1","Kitchen & Dining","Standard","4.961 x 7.638 x 3.937 in","0.862 lb","https://www.amazon.com/dp/B099DCPW1M"
"","","B0CFB91YTM","GAGAMOTEYA 4 Pack Mason Jar Coffee Cups with Handle, 24oz Glass Cups with Bamboo Lids and Stainless Steel Straws, Drinking Glasses Tumbler for Iced Coffee,Smoothie,Overnight Oats","GAGAMOTEYA","$24.99","71","4","$1,774","08/13/2023","","4.7","8","","61,413","7","FBA","1","Kitchen & Dining","","","","https://www.amazon.com/dp/B0CFB91YTM"
"","","B0CCJDWNGQ","Benestanti 4 pcs Glass Cups with Bamboo Lids and Straws-16 oz Glass Tumbler with Straw and Lid & Cleaning Brush,Iced Coffee Cups with Lids Ldeal for Smoothie Beer Cocktail Whiskey Tea Juice Gift","Benestanti","$14.99","737","10","$11,048","08/06/2023","","4.6","124","","26,575","7","FBA","1","Kitchen & Dining","","","","https://www.amazon.com/dp/B0CCJDWNGQ"
"","","B09YY2PPZ4","Dicunoy Set of 8 Mason Jar with Handle and Straw, 16OZ Mason Jar Cups with Lid, Old Fashioned Drinking Glasses for Iced Coffee, Smoothies, Ice Tea, Lemonade, Party Favors","Dicunoy","$21.99","45","2","$989.55","04/26/2022","$10.76","3.9","38","$11.23","123,953","6","FBA","1","Kitchen & Dining","Standard","11.81 x 14.84 x 6.46 in","6.369 lb","https://www.amazon.com/dp/B09YY2PPZ4"
"","","B0C488JTZJ","Moretoes 4pcs 20oz Mason Jar Glass Cups with Lids and Straws, Glass Iced Coffee Cups Drinking Glasses Set Reusable Boba Bottle, Cute Travel Tumbler Cup for Jumbo Smoothie, Bubble Tea, Cold Brew, Soda,","Moretoes","$18.99","498","16","$9,457","05/03/2023","","4.4","295","","17,080","7","FBA","2","Kitchen & Dining","","","","https://www.amazon.com/dp/B0C488JTZJ"
"","","B0B826C581","ANOTION Mason Jar with Lid and Straw, 24oz Regular Mouth Mason Jars with Handle Drinking Glasses Tumbler Reusable Boba Cups Smoothie Water Bottles for Iced Coffee (Classic 2 cups Style)","ANOTION","$21.99","634","28","$13,942","07/28/2022","","4.6","410","","10,014","7","FBA","2","Kitchen & Dining","","","","https://www.amazon.com/dp/B0B826C581"
"","","B07GVGYZX3","Brimley 16oz Glass Mason Jar with Lid and Straw Set of 4 - Mason Jars with Handle for Cold Drinks - Glass Mason Jars with Metal Mason Jar Lids with Straw Hole and Stainless Steel Straws","brimley","$22.99","268","5","$6,161","03/25/2019","$13.11","4.5","2,026","$9.88","52,390","6","FBA","1","Kitchen & Dining","Standard","7.64 x 9.45 x 6.54 in","3.351 lb","https://www.amazon.com/dp/B07GVGYZX3"
"","","B08Z48Q4HQ","Reusable Wide Mouth Smoothie Cups Boba Tea Cups Bubble Tea Cups with Lids and Silver Straws Mason Jars Glass Cups (2-pack, 32 oz mason jars)","Capsule Classic","$22.85","124","3","$2,833","03/15/2021","$12.99","4.7","425","$9.86","79,103","6","FBA","1","Kitchen & Dining","Standard","8.543 x 10.039 x 5.039 in","2.542 lb","https://www.amazon.com/dp/B08Z48Q4HQ"
"","","B085PPCNDG","Reusable Wide Mouth Smoothie Cups Boba Bubble Tea Cups with Lids and Gold Straws Mason Jars Glass Cups (2-pack, 24 oz )","Capsule Classic","$26.85","114","7","$3,061","03/08/2020","","4.7","202","","36,774","6","FBA","1","Kitchen & Dining","","","2.4 lb","https://www.amazon.com/dp/B085PPCNDG"
"","","B0BB2JM6LK","Tronco Mason Jar Lids with Stainless Steel Straws, 2 Reusable Mason Jar Bamboo Lids with Straw Hole, 2 Straws and 1 Straw Brush, for Wide Mouth Mason Jar Tumbler Lids","Tronco","$9.99","123","3","$1,229","08/17/2022","","4.4","114","","84,601","7","FBA","1","Kitchen & Dining","","","","https://www.amazon.com/dp/B0BB2JM6LK"
"","","B096SBJPCZ","26 PCS Regular Mouth Mason Jar Lids with Straw Hole - 70MM Canning Lids Drinking Jar Lids Tinplate Jar Lids Silver Canning Jar Caps with Silicone Ring/Straws/Cleaning Brush for Drinking Food Storage","OAMCEG","$12.99","199","8","$2,585","06/06/2021","$7.27","4.5","559","$5.72","31,889","7","FBA","1","Kitchen & Dining","Standard","6.024 x 8.74 x 2.087 in","0.725 lb","https://www.amazon.com/dp/B096SBJPCZ"
"","","B096QWB74L","Reusable Boba Bubble Tea & Smoothie Cups - 2 Glass Wide Mouth 32oz Mason Jars with Bamboo Lids - 2 Reusable Gold Stainless Steel Boba Straws","Capsule Classic","$22.85","268","9","$6,124","06/05/2021","$13.63","4.5","642","$9.22","29,316","7","FBA","1","Kitchen & Dining","Standard","8.465 x 8.504 x 4.646 in","2.773 lb","https://www.amazon.com/dp/B096QWB74L"
"","","B0C43ZJLFT","wookgreat Mason Jars with Handle, 6 Pack 16oz Mason Jar Drinking glasses with lid and straw, Mason Jar Cups, Regular Mouth Mason Jar mugs for Iced Coffee, Smoothie, Airtight Lids for Food Storage","wookgreat","$19.99","86","3","$1,719","05/01/2023","$10.26","3.8","16","$9.73","75,629","7","FBA","1","Kitchen & Dining","Standard","1 x 1 x 1 in","4.96 lb","https://www.amazon.com/dp/B0C43ZJLFT"
"","","B0BZ8F3K3T","Pinkunn Set of 15 Mason Jar with Lid and Straw 16.9 oz Old Fashioned Mason Jar Cups Mason Jar Glasses with Handles Mason Jar Mugs Reusable Travel Tumbler for Drinking Tea Iced Coffee Smoothie Juice","Pinkunn","$21.99","34","","$747.66","03/21/2023","","3","5","","217,227","7","FBA","2","Kitchen & Dining","","","","https://www.amazon.com/dp/B0BZ8F3K3T"
"","","B096QXXR99","Reusable Boba Bubble Tea & Smoothie Cups - 2 Glass Wide Mouth 32 oz Mason Jars with Bamboo Lids - 2 Reusable Silver Stainless Steel Boba Straws","Capsule Classic","$22.85","158","5","$3,610","06/05/2021","$13.63","4.7","161","$9.22","50,333","6","FBA","1","Kitchen & Dining","Standard","8.465 x 8.504 x 4.646 in","2.71 lb","https://www.amazon.com/dp/B096QXXR99"
"","","B09K3GMLFS","Yirilan 2 Pack 24Oz Mason jar cups with lids and straws, Mason Jars with Handle, Mason Jar Drinking Glasses with Lid and Straw, Mason Jar Mugs","Yirilan","$29.99","99","3","$2,969","06/27/2022","$19.06","4.6","1,183","$10.93","87,250","8","FBA","3","Kitchen & Dining","Standard","8.35 x 8.66 x 6.46 in","2.67 lb","https://www.amazon.com/dp/B09K3GMLFS"
"","","B085P3CLMQ","Reusable Wide Mouth Smoothie Cups Boba Tea Cups Bubble Tea Cups with Lids and Silver Straws Mason Jars Glass Cups (2-pack, 24 oz mason jars)","Capsule Classic","$26.85","388","17","$10,418","03/08/2020","$17.03","4.8","737","$9.82","16,389","6","FBA","1","Kitchen & Dining","Standard","7.362 x 9.213 x 5.591 in","2.31 lb","https://www.amazon.com/dp/B085P3CLMQ"
"","","B0CFL8R9QF","Glass Cups with Bamboo Lids and Straws,24oz Tumbler With Handle,4 Pack Mason Jar with Lid and Straw-Wide Mouth Reusable Drinking Glasses,Boba Cup Smoothie Tumbler Iced Coffee Cup Travel Mug","Birity","$29.69","945","57","$28,057","09/20/2023","","4.5","192","","4,479","7","FBA","3","Kitchen & Dining","","","","https://www.amazon.com/dp/B0CFL8R9QF"
"","","B0B1HYZLXR","Ufrount Mason Jars with Handle,16 OZ Old Fashioned Drinking Jars,Clear Mason Mugs Drinking Glass Cups with Lids and Straws Set of 12 for Beverages,Mixed Drinks,Soda,Kombucha","Ufrount","$27.99","109","5","$3,051","05/16/2022","$14.96","4.5","126","$13.03","51,034","7","FBA","1","Kitchen & Dining","Standard","13.622 x 16.378 x 6.89 in","9.678 lb","https://www.amazon.com/dp/B0B1HYZLXR"
"","","B07HN77ZYX","Smith's Mason Jars 16oz/473ml 4-pc Glass Cups with lid, straw and Handles - Smoothie glasses - Good for Milkshake, Juices, Ice Coffee Ideal for Picnics DIY Drinks and Outdoor Activity","Smith's Mason Jars","$18.99","50","4","$949.50","12/20/2018","$11.62","4.6","943","$7.37","65,674","6","FBA","1","Kitchen & Dining","Standard","8.98 x 7.01 x 9.02 in","14.5 oz","https://www.amazon.com/dp/B07HN77ZYX"
"","","B072MJMPTF","Estilo Glass Mason Jars with Handles, Lid and Straw 16 oz | Drinking Glasses Cups Mug Set for Iced Coffee, Tea & Smoothie - Set of 6","Estilo","$23.99","689","22","$16,529","06/06/2017","$6.89","4.6","7,711","$17.10","12,737","7","AMZ","6","Kitchen & Dining","Oversize","15.43 x 17.56 x 6.57 in","5.091 lb","https://www.amazon.com/dp/B072MJMPTF"
"","","B0C8XZ95TC","Pinkrella Mason Drinking Jars - Glass Mugs With handle 6 pack, Mason Jars With Sealed & Straw Lids, Glass Straws, & Cleaning Brushes, Drinking Glasses, Glass Mason Jar Mugs 16 oz","Pinkrella","$26.99","20","1","$539.80","09/23/2023","","4.8","11","","172,057","7","FBA","1","Kitchen & Dining","","","","https://www.amazon.com/dp/B0C8XZ95TC"
"","","B0CHHY36FQ","MCleanPin 24OZ Glass Cups with Lids and Straws, Iced Coffee Cups with Lids,Reusable Boba Cups,Smoothies Cups,Mason Jars Cups with Lids and Straws,Drinking Glasses with Lids and Straws,4Pack","MCleanPin","$24.99","150","5","$3,748","10/08/2023","","4.6","71","","52,771","6","FBA","1","Kitchen & Dining","","","","https://www.amazon.com/dp/B0CHHY36FQ"
"","","B0CJRKWNX5","Zubebe 8 Pcs Christmas Glass Cups 20 oz Christmas Mason Jars with Lids and Straws Christmas Tumbler Drinking Glass Cup Beer Coffee Cup Can Mugs Xmas Winter Snowflake for Kids Women Men Gift","Zubebe","$42.99","","","$0.00","11/14/2023","","5","2","","476,690","6","FBA","1","Kitchen & Dining","","","","https://www.amazon.com/dp/B0CJRKWNX5"
"","","B0C6PR85QM","DAYYET Glass Cups Set - 24oz Mason Jar Drinking Glasses with Acacia Wood Lids & Straws & Airtight Lids - Wide Mouth Iced Coffee Cups Boba Bottle Tumbler for Bubble Tea, Smoothie - 2 Pack","DAYYET","$16.95","229","9","$3,882","05/30/2023","","4.2","17","","30,189","7","FBA","1","Kitchen & Dining","","","","https://www.amazon.com/dp/B0C6PR85QM"
"","","B07TRCM1YY","Regular Mouth Mason Jar Lids with Straw Hole/ Stoppers/Silicone Rings/Cleaning Brush, Rust-proof, BPA Free Plastic Canning Lids, Great for Drinking & Food Storage(26 Pack)","Qinline","$12.99","709","24","$9,210","05/13/2019","$7.97","4.7","5,531","$5.02","11,700","7","FBA","1","Kitchen & Dining","Standard","9 x 13.8 x 0.7 in","0.45 lb","https://www.amazon.com/dp/B07TRCM1YY"
"","","B0C61QZ5QM","Maxdot 20 Pcs 18.6 oz Mason Jars with Lids and Straws Wide Regular Mouth Canning Jars Bulk Airtight Big Glass Jars Clear Drink Containers with Caps Juicing Bottles for Iced Coffee Milk (Clear)","Maxdot","$44.99","53","1","$2,384","05/22/2023","$31.36","2.6","8","$13.63","157,572","7","FBA","2","Kitchen & Dining","Standard","5.31 x 3.14 x 5.31 in","4.66 lb","https://www.amazon.com/dp/B0C61QZ5QM"
"","","B08R3FMND7","[ 8 Pack ] Glass Juicing Bottles with 2 Straws & 2 Lids w Hole- 16 OZ Travel Drinking Jars, Water Cups with Black Airtight Lids, Reusable Tall Mason Jar for Juice, Boba, Smoothie, Tea, Kombucha","AOZITA","$21.99","7,973","258","$175,326","12/20/2020","$11.66","4.7","5,802","$10.33","575","7","FBA","2","Kitchen & Dining","Standard","7 x 7 x 12 in","5.399 lb","https://www.amazon.com/dp/B08R3FMND7"
"","","B09SPCJ5JS","Mason 4 Pack Reusable Boba Tea Cups, Glass Jars 24oz Wide Mouth Smoothie Cups with Bamboo Lids and Silver Straws, Drinking Glass Bubble Tea Cups for Iced Coffee Travel Bottle","Mason","$28.99","133","4","$3,856","03/29/2022","$17.91","4.6","829","$11.08","63,097","7","FBA","1","Kitchen & Dining","Standard","8.583 x 15.748 x 4.606 in","4.826 lb","https://www.amazon.com/dp/B09SPCJ5JS"
"","","B09W5K45TG","Almcmy Mason Jars 16 oz, 6 Pack Mason Jar Drinking Glasses with Lids and Straws, Mason Jar Cups for Drinking Juice Smoothies Coffee, Glass Jars with Airtight Lids for Canning, Pickling","Almcmy","$23.99","49","1","$1,176","03/21/2022","$13.66","4.9","11","$10.33","135,021","7","FBA","1","Kitchen & Dining","Standard","7.9 x 5.5 x 7.9 in","4.36 lb","https://www.amazon.com/dp/B09W5K45TG"
"","","B0C9LLFBQW","DRASTAR Mason Jar Cups with Lids and Straws, 16oz Mason Jar Drinking Glasses, Glass Cups with Acacia Wood Lids, Mason Jar Cups with Handle Set of 2","DRASTAR","$15.95","311","12","$4,960","06/27/2023","","4.5","49","","22,034","7","FBA","1","Kitchen & Dining","","","","https://www.amazon.com/dp/B0C9LLFBQW"
"","","B0B5GS62YC","ANOTION Mason Jar with Lid and Straw, 32oz Wide Mouth Boba Cup Reusable Drinking Glasses Tumbler Smoothie Water Bottles for Iced Coffee Margaritas Ice Cream Juice Cocktail Travel Office Home","ANOTION","$19.99","107","4","$2,139","06/29/2022","","4.2","161","","59,468","7","FBA","1","Kitchen & Dining","","","","https://www.amazon.com/dp/B0B5GS62YC"
"","","B09WY8443Q","Hyperspace 4Pack Glass Tumblers with Bamboo Lids and Straws, 24 OZ Wide Mouth Mason Jar Drinking Glasses Travel Bottles with Varitey of Patterns for Multi Use","Hyperspace","$29.99","136","6","$4,079","03/30/2022","$18.76","4.4","67","$11.23","41,663","7","FBA","1","Kitchen & Dining","Standard","8.28 x 16.26 x 4.37 in","4.321 lb","https://www.amazon.com/dp/B09WY8443Q"
"","","B08BKGT6H2","8 Pieces Stainless Steel Regular Mouth Mason Canning Jar Lids with Straw Hole Leak Proof, 2.7 Inch (Silver)","Mudder","$7.29","669","25","$4,877","06/19/2020","$3.28","4.2","1,015","$4.01","11,105","6","FBA","1","Kitchen & Dining","Standard","5.512 x 0.63 x 11.811 in","0.265 lb","https://www.amazon.com/dp/B08BKGT6H2"
"","","B08LTTSYXN","JARMING COLLECTIONS Reusable Freezer Safe Smoothie Cups with Lids and Straws - Mason Drinking Jar (2- 24oz)","JARMING COLLECTIONS","$22.95","182","6","$4,177","02/27/2016","$15.74","4.6","171","$7.21","45,335","7","FBA","1","Kitchen & Dining","Standard","4 x 10 x 4 in","0.625 lb","https://www.amazon.com/dp/B08LTTSYXN"
"","","B0CN4FB93F","Drinking Glasses with Bamboo Lids and Glass Straw-16oz Can Shaped Glass Cups,Beer Glasses,Iced Coffee Glasses,Ideal for Cocktail,Whiske,Soda,Bubble Tea,Juicing,Smoothies(12pcs Set+2 Cleaning Brushes","Dearwell","$32.89","541","18","$17,793","11/10/2023","","4","44","","15,848","7","FBA","2","Kitchen & Dining","","","","https://www.amazon.com/dp/B0CN4FB93F"
"","","B0BKGW2RG8","6 Pack Metal Drinking Lid with Straw Hole and Straws Compatible with Mason Jar Regular Mouth, 6 Colors, Dishwasher Safe","SusuBee","$7.99","180","6","$1,438","10/24/2022","$3.25","4","46","$4.74","45,838","6","FBA","1","Kitchen & Dining","Standard","3.15 x 2.05 x 9.29 in","0.31 lb","https://www.amazon.com/dp/B0BKGW2RG8"
"","","B0CGD5YS9R","YOUKE OLA 12 Pack Sublimation Blank White Glass Cans Sublimation Beer Glass Cups with Bamboo Lids Borosilicate Glasses Tumbler Mason Jar Cups Mug with Glass Straw for Beer, Juice, Drinks 16oz White","YOUKE OLA","$59.99","30","1","$1,800","08/22/2023","","5","1","","146,765","7","FBA","1","Kitchen & Dining","","","","https://www.amazon.com/dp/B0CGD5YS9R"
"","","B0BZ3XSMTW","8 Pack Sublimation Glass Cans Frosted Sublimation Beer Can Shaped Glass with Bamboo Lids Borosilicate Glasses Tumbler Mason Jar Cups Mug with Glass Straw for Beer, Juice, Iced Coffee, Drinks 20oz","YOUKE OLA","$59.99","47","","$2,820","03/20/2023","","4.9","10","","231,773","7","FBA","1","Kitchen & Dining","","","","https://www.amazon.com/dp/B0BZ3XSMTW"
"","","B08SQS41TT","PYD Life Blanks Mason Jar 17 OZ Wide Mouth White Stainless Steel Tumbler with Lid and Metal Straw for Cricut Mug Press Machine Sublimation Print 4 Pack","PYD Life","$39.99","165","5","$6,598","01/10/2021","$27.26","4.7","642","$12.73","32,913","6","FBA","1","Arts, Crafts & Sewing","Standard","7.559 x 9.843 x 7.52 in","2.866 lb","https://www.amazon.com/dp/B08SQS41TT"