"Export time:  2/10/2024, 2:59:14 AM","","ASIN","Product Name","Brand","Price","Monthly Units Sold","Daily Units Sold","Monthly Revenue","Date First Available","Net Revenue","Star Rating","Reviews","Amazon Fees","BSR","LQS","Seller Type","Sellers","Category","Product Tier","Dimensions","Weight","Link"
"","","B0BT73TJ6K","LINENMATE Twin/Full Size (Ivory 2-Pack) - The Original 2-Pack Linen Storage Container with Sheet-Folding Assisted Panels | Bed Sheets | Duvet Covers | Pillowcases | Towels","LINENMATE","$54.97","908","22","$49,913","01/25/2023","","4.5","176","","43,041","6","FBA","1","Home & Kitchen","","","","https://www.amazon.com/dp/B0BT73TJ6K"
"bedsheet organizer","","B0C9QBRQB4","SpaceAid 4 Pack Bed Sheet Organizers and Storage, Foldable Sheet Organizer for Linen Closet, Sheets Set Folder Keeper with Window XL (Queen & King Size) Organizing Bedding Container, Gray","SpaceAid","$39.98","6,782","178","$271,144","06/28/2023","","4.6","262","","3,634","6","FBA","1","Home & Kitchen","","","","https://www.amazon.com/dp/B0C9QBRQB4"
"Average Monthly Sales: 1,673","","B0C758Q8MY","BIKTIC Foldable Bed Sheet Set Organizer,2-Pack with Zipper for Queen or King Sheets, Duvet Covers, and Pillowcases, Linen Closet Organizer for Bedding Clothes Towels","BIKTIC","$24.99","1,579","60","$39,459","06/04/2023","","4.8","373","","14,616","7","FBA","3","Home & Kitchen","","","","https://www.amazon.com/dp/B0C758Q8MY"
"Average Revenue: $46,367","","B0CNTK5N9M","HomeCulture Upgraded 2-Pack Bed Sheet Organizer and Storage - Premium Cotton Linen Closet Organizers and Storage for Sheets, Duvet Covers, Pillow Cases - Foldable, Cream Color, (Twin-Full Size)","HomeCulture","$29.99","60","2","$1,799","11/21/2023","$13.98","4.6","11","$16.01","301,531","6","FBA","1","Home & Kitchen","Oversize","12.9 x 1.9 x 19.2 in","4.05 lb","https://www.amazon.com/dp/B0CNTK5N9M"
"Average Price: $35.45","","B0CJJHZS33","Bed Sheet Organizers and Storage - 4 Pack (Queen or King Size),Foldable Storage Box for Duvet Cover Set, Linen Closet Organizer for Bedding Clothes Blankets, Grey","Aokeyee","$29.99","800","41","$23,992","09/20/2023","$18.16","4.7","95","$11.83","22,589","6","FBA","1","Home & Kitchen","Standard","12.9 x 5 x 15 in","4.85 lb","https://www.amazon.com/dp/B0CJJHZS33"
"Average No. of Ratings: 878","","B0CJJHLSXQ","BigPonPon 3-Pack Foldable Bed Sheets Set Organizers and Storage(King & Queen Size),Linen Fabric Closet Organizers with Window,Folding Bedding Storage Box for Bedsheets and Pillow Cube Organizer","BigPonPon","$29.77","2,008","95","$59,778","09/20/2023","$17.97","4.6","75","$11.80","8,386","7","FBA","1","Home & Kitchen","Standard","12.5 x 4.7 x 15 in","5.13 lb","https://www.amazon.com/dp/B0CJJHLSXQ"
"Average Sales Rank: 168,443","","B0CND5KBKS","Springfield Studios Stackable Bed Sheet Organizers and Storage, Each Canvas Bag holds 2 sets of Queen or King Sheet/Duvet, Upgrade your closet organizers and storage with trendy bedding storage bags","Springfield Studios","$29.99","120","4","$3,599","11/15/2023","","4.6","27","","214,551","","FBA","","Home & Kitchen","","","","https://www.amazon.com/dp/B0CND5KBKS"
"Average Rating Number: 4.6","","B0C9QB47R2","SpaceAid 8 Pack Bed Sheet Organizers and Storage, Foldable Sheet Organizer for Linen Closet, Sheets Set Folder Keeper with Window XL (Queen & King Size) Organizing Bedding Container, Beige","SpaceAid","$62.98","1,261","36","$79,418","06/28/2023","","4.4","131","","25,360","6","FBA","3","Home & Kitchen","","","","https://www.amazon.com/dp/B0C9QB47R2"
"","","B0CF5DJ67N","DELLAN Bed Sheet Organizer, Linen Closet Organizers and Storage, Foldable Cube Sheet Set Organizer (4 Pack)","DELLAN","$39.99","562","12","$22,474","08/08/2023","","4.7","46","","79,265","6","FBA","1","Home & Kitchen","","","","https://www.amazon.com/dp/B0CF5DJ67N"
"","","B0CD34K1MN","Yermivie 4 Pieces Bed Sheet Organizer Bands, Sheet Organizers and Storage Label Bands, Sheet Label for Bedding, Sheets Organizer for Closet,Sheet Keepers Linen Labels Bedding Bands (4Pcs Queen)","Yermivie","$9.99","2,059","45","$20,569","08/09/2023","","4.5","44","","20,317","7","FBA","1","Home & Kitchen","","","","https://www.amazon.com/dp/B0CD34K1MN"
"","","B0C9PL48DM","BIKTIC SheetCube Bed Sheet Organizers and Storage,4 Pack Sheet Folder Organizer (Queen or King Size), Linen Closet Organizer for Bedding Sheets,Duvet Covers and Pillow cases,Grey","BIKTIC","$39.99","1,447","61","$57,866","07/31/2023","","4.8","373","","14,418","7","FBA","4","Home & Kitchen","","","","https://www.amazon.com/dp/B0C9PL48DM"
"","","B0C1BK6DCP","SheetCube Bed Sheet Organizers and Storage 6 Pack, Foldable Linen Closet Organizer with Window and Label, Bedding Folder Storage Box Container for Blanket, Duvet Cover Set, Bed Sheet Set - Beige","SUOCO","$49.99","2,273","40","$113,627","06/05/2023","$34.56","4.4","168","$15.43","22,825","7","FBA","2","Home & Kitchen","Standard","12.68 x 4.17 x 15.35 in","8.9 lb","https://www.amazon.com/dp/B0C1BK6DCP"
"","","B0B8MNZKVC","Bed Sheet Organizer and Storage Size Label Bands | Sheets Set Organizers for Linen Closet - Labeled Elastic Bedding Sheet Keepers Straps for Organizing Foldable Bedsheet Sets (King 4PCs Pack | Cream)","ECOHomes","$9.99","11,553","222","$115,414","10/28/2022","","4.6","411","","2,626","7","FBA","2","Home & Kitchen","","","","https://www.amazon.com/dp/B0B8MNZKVC"
"","","B0CLM3X6NW","Karceyworth 4 Pack Bed Sheet Organizers and Storage, Foldable Sheet Set Organizer, Bedsheet Storage, Bed Sheet Organizers for for Queen and King Sheets, Duvet Covers, Pillowcases","Karceyworth","$32.99","","","","10/22/2023","","4.5","24","","","7","FBA","1","","","","","https://www.amazon.com/dp/B0CLM3X6NW"
"","","B0CJHT4FPJ","BUFOR Sheet Organizer for Linen Closet, Foldable Bed Sheet Organizer, King Size Sheet Storage 4 Pack, Grey","BUFOR","$39.99","177","7","$7,078","09/20/2023","$26.66","4.7","5","$13.33","122,855","6","FBA","2","Home & Kitchen","Standard","13 x 4.3 x 15 in","2 lb","https://www.amazon.com/dp/B0CJHT4FPJ"
"","","B0CGNPZVG5","SpaceAid 5 Pack Bed Sheet Organizers and Storage, Foldable Sheet Organizer for Linen Closet, Sheets Set Folder Keeper with Window XL (Queen & King Size) Organizing Bedding Container, White","SpaceAid","$46.98","","","","08/25/2023","","4.7","32","","","6","FBA","1","","","","","https://www.amazon.com/dp/B0CGNPZVG5"
"","","B0CP8VY28C","Bed Sheet Organizer | Set of 2 Bed Sheet Organizers and Storage | Bed Sheet Storage Organizer for Linen Closet | Folding Board & Labels | Faux Leather handles | Foldable Bed Sheet Organizer","H Kay Home","$34.99","","","","","","5","1","","","","FBA","","","","","","https://www.amazon.com/dp/B0CP8VY28C"
"","","B0CJ28N6W7","SNILOAW Sheets Organizer For Linen Closet, SheetCube Foldable Sheet Organizer (Queen Or King Size) Bed Sheet Organizers Closet Organizers and StorageBedding Organizer (Black, 2 Pack)","SNILOAW","$19.98","475","5","$9,491","10/12/2023","","4.7","20","","169,143","6","FBA","1","Home & Kitchen","","","","https://www.amazon.com/dp/B0CJ28N6W7"
"","","B0C5WL6CFL","KIMBORA Foldable Bed Sheet Organizer and Storage, 3 Pack King Size Sheet Set Organizer for Linen Closet With Clear PVC Sheet Storage for Bedding Sheets, Duvet Covers and Pillow cases","KIMBORA","$23.99","766","26","$18,376","05/21/2023","$13.06","4.3","128","$10.93","35,624","7","FBA","2","Home & Kitchen","Standard","4.5 x 13 x 15 in","1 lb","https://www.amazon.com/dp/B0C5WL6CFL"
"","","B0BZYX9GTS","zjdbset 20 PiecesBed Sheet Organizer Bands Bed Sheet Keepers Closet Organization ElasticLinen Labels for Bed Sheet Sets(Queen,King,Full,Twin)","zjdbset","$17.99","2,216","67","$39,866","04/30/2023","","4.5","82","","12,865","6","FBA","2","Home & Kitchen","","","","https://www.amazon.com/dp/B0BZYX9GTS"
"","","B0C9D8CQ38","Furnhome 3 Pack Bed Sheet Organizers and Storage, Sheet Organizer for Linen Closet, Foldable Sheet Set Organizer, Sheet Storage Cube for Beding Sheets, Duvet Covers and Pillowcases","Furnhome","$32.99","196","4","$6,466","06/25/2023","","4.5","70","","210,493","7","FBA","1","Home & Kitchen","","","","https://www.amazon.com/dp/B0C9D8CQ38"
"","","B0CM3DVLCY","DIMJ Bed Sheet Organizers and Storage 6 Pack, Foldable Sheet Bedding Storage Organizer for Linen Closet, Sheet Set Organizersr (Queen & King Size) with Window Handle for Bed Sheets Duvet Covers.(Grey)","DIMJ","$55.99","502","8","$28,107","12/27/2023","","4.5","10","","106,852","7","FBA","1","Home & Kitchen","","","","https://www.amazon.com/dp/B0CM3DVLCY"
"","","B0CPHJFXGP","HEIBOSO Bed Sheet Organizers and Storage-Linen Closet Organizers and Storage Folding Bedding Storage Foldable Sheet Cube Box Closet Home Organization Box Clothes Blankets Grey(4Pack)","HEIBOSO","$39.90","","","$0.00","12/22/2023","","5","8","","864,545","","FBA","1","Home & Kitchen","","","","https://www.amazon.com/dp/B0CPHJFXGP"
"","","B0C9X6TM6T","chinensis 6 Pack Sheet organizer,Bed Sheet Storage,Folding Organizers for Bed Sheets,Sheet Storage Organizer,Sheet Set Organizer,Sheet Storage for Closet,Grey","chinensis","$69.99","329","2","$23,027","07/02/2023","","4.7","69","","394,853","7","FBA","3","Home & Kitchen","","","","https://www.amazon.com/dp/B0C9X6TM6T"
"","","B0CFLRHS3Z","Doosela Bed Sheet Organizers and Storage, 4 Packs Foldable Storage Box with Zipper for Queen or King Sheets, Sheet Storage Cube for Duvet Cover Set, Bedding, Blanket Storage","Doosela","$89.99","685","7","$61,643","08/13/2023","","4.7","20","","126,743","6","FBA","1","Home & Kitchen","","","","https://www.amazon.com/dp/B0CFLRHS3Z"
"","","B0C16JFJJN","SheetCube 4 Pack Bed Sheet Organizers and Storage, Foldable Bedding Storage Box Container with Window and Label, Linen Closet Organizer Folder for Blanket, Duvet Cover Set, Bed Sheet Set - Grey","SUOCO","$39.99","1,690","81","$67,583","06/05/2023","","4.2","577","","10,327","6","FBA","2","Home & Kitchen","","","","https://www.amazon.com/dp/B0C16JFJJN"
"","","B0CLCZH8FD","TRZZ Sheet Organizers and Storage, 4-Pack, Queen/King Size (Grey), Bed Sheet Organizer, Linen Closet Organizer and Storage for Bed Sheets, Duvet Covers and Pillowcases, 15' L13' W5' H","TRZZ","$39.99","485","14","$19,395","10/18/2023","","4.8","96","","68,185","6","FBA","2","Home & Kitchen","","","","https://www.amazon.com/dp/B0CLCZH8FD"
"","","B0CMJBYYYK","MLGOGO Bed Sheet Organizer 8 Pcs. Set (6+2) Foldable Linen Closet Storage Containers for King/Queen Size Sheets & 6 Elastic Bands. Bedding Storage Linen Closet Organizers w/Window & Handle (Black)","MLGOGO","$49.13","314","7","$15,427","11/02/2023","","4.7","21","","120,122","6","FBA","1","Home & Kitchen","","","","https://www.amazon.com/dp/B0CMJBYYYK"
"","","B0CFQ7RHWF","NEW NOAM 6Pcs Bed Sheet Organizers and Storage Set, 4-pack Cube Storage, Foldable Sheet Set Organizer with 2-pack Clothes Storage, Linen Closet Organizer for Bed Sheets Set or Duvet Covers, Grey","NEW NOAM","$25.99","233","5","$6,056","08/14/2023","","3.8","30","","172,918","7","FBA","1","Home & Kitchen","","","","https://www.amazon.com/dp/B0CFQ7RHWF"
"","","B0C9Q61MDQ","SpaceAid 6 Pack Bed Sheet Organizers and Storage, Foldable Sheet Organizer for Linen Closet, Sheets Set Folder Keeper with Window XL (Queen & King Size) Organizing Bedding Container, Black","SpaceAid","$49.98","926","26","$46,281","06/28/2023","","4.6","137","","36,305","6","FBA","3","Home & Kitchen","","","","https://www.amazon.com/dp/B0C9Q61MDQ"
"","","B0C4LFRYDR","GZOOGHOME 4 Pack Bed Sheet Organizers and Storage, Sheet Folder Organizer for Linen Closet, Foldable Sheets Set Keeper XL (Queen or King Size) Organizing Bedding Container (Circle Window, Black)","GZOOGHOME","$39.99","792","19","$31,672","05/07/2023","$26.66","4.2","147","$13.33","48,322","7","FBA","2","Home & Kitchen","Standard","4.5 x 12.8 x 15 in","3.1 lb","https://www.amazon.com/dp/B0C4LFRYDR"
"","","B0CJQWBH4N","HUWAILE Sheet Organizers and Storage - 3 Pack Bed Sheet Organizers for All Sheet Sizes, Including Queen/King Size Blankets, Foldable Blanket Organizer/Sheet Storage for Linen Closet, Beige","HUWAILE","$32.99","258","7","$8,511","09/24/2023","$20.41","4.9","54","$12.58","133,463","6","FBA","1","Home & Kitchen","Standard","13 x 5.5 x 15 in","5.9 lb","https://www.amazon.com/dp/B0CJQWBH4N"
"","","B0CKZ4J9S8","MISSLO Bed Sheet Organizers and Storage Queen/King Size Sheet Folder 4 Pack Linen Closet Organizer with Clear Window Blanket Storage Bags for Bedsheets, Pillow Cases, Towels, Clothes","MISSLO","$17.99","310","13","$5,577","11/23/2023","$10.77","4.6","165","$7.22","73,233","6","FBA","3","Home & Kitchen","Standard","14 x 6.5 x 16 in","15.2 oz","https://www.amazon.com/dp/B0CKZ4J9S8"
"","","B0CFV9DB72","GKOKG 6 Pack Bed Sheet Organizers and Storage - Foldable Sheet Organizer for Linen Closet, Bed Sheet Organizers, Sheet Set Organizer for Bedding Clothes Blankets, Duvet Cover Set,Black","GKOKG","$39.99","127","5","$5,079","08/15/2023","","4","14","","162,066","7","FBA","1","Home & Kitchen","","","","https://www.amazon.com/dp/B0CFV9DB72"
"","","B0CN14LHFP","BigPonPon 6 Pack Bed Sheets Organizers And Storage (King Size),Foldable Sheet Organizer With Handle For Linen Closet,Bedding Organizer Storage For Sheets, Duvet Cover (Beige","BigPonPon","$59.99","503","21","$30,175","09/20/2023","","4.5","43","","45,694","7","FBA","2","Home & Kitchen","","","","https://www.amazon.com/dp/B0CN14LHFP"
"","","B0C7QLQKBX","Bed Sheet Organizer Bands, King Queen Full Twin Size Sheet Labels for Bedding Storage 8PCs Pack, Elastic Sheet Set Organizer, Fitted Sheet Straps Bed Bands for Sheets Pillowcases Duvets, Mix 8PCs","ZUBISU","$3.99","477","24","$1,903","06/11/2023","","5","1","","39,118","7","FBA","1","Home & Kitchen","","","","https://www.amazon.com/dp/B0C7QLQKBX"
"","","B0BMDRTR54","20Pcs Clear Vinyl Zippered Storage BagsBlankets Storage Bags Plastic Storage Bags for Sweater Clothes Bed Sheet Organizer with Zipper for Closet Linen Sweater Bed Sheet Pillow10.5 x 10.5 x 2.4 Inch","Hlimior","$23.99","421","6","$10,100","11/14/2022","$15.25","4.4","116","$8.74","136,008","7","FBA","1","Home & Kitchen","Standard","1 x 1 x 1 in","1.7 lb","https://www.amazon.com/dp/B0BMDRTR54"
"","","B0CM397MB2","GODELAIF Bed Sheet Organizer and Storage, Foldable Sheet Set Organizer for Twin/Full/Queen/King Size, Linen Closet Organizers and Storage with Handle for Sheet Set Bedding Clothes Blanket","GODELAIF","$21.99","336","9","$7,389","10/29/2023","","4.8","87","","96,048","7","FBA","1","Home & Kitchen","","","","https://www.amazon.com/dp/B0CM397MB2"
"","","B0CHLW89KK","RUseeN Sheet Organizers and Storage, Foldable Sheet Organizer for Linen Closet, Linen Closet Organizer for Bedding Clothes Blankets (4 Pack)","RUseeN","$29.99","48","1","$1,440","09/07/2023","","4.8","30","","578,357","6","FBA","1","Home & Kitchen","","","","https://www.amazon.com/dp/B0CHLW89KK"
"","","B0CG1BKS67","MSERCUOR Bed Sheet Organizers and Storage Morocco Style [4 Pack/20L] Larger Sheet Folder Organizer for Duvet Cover Set(Queen or King Size), Bedsheet Organizers for Bedding Clothes Blankets, Grey","MSERCUOR","$38.89","445","4","$17,306","08/18/2023","","4.8","70","","206,495","7","FBA","2","Home & Kitchen","","","","https://www.amazon.com/dp/B0CG1BKS67"
"","","B0CDLFH8PX","Feverdes SheetCube Bed Sheet Organizers and Storage 2 Pack (Queen or King Size),Foldable Bedding Organizer with Zipper,for Bed Sheets, Duvet Covers, Blankets, Pillowcases (Grey)","Feverdes","$39.99","555","4","$22,194","08/02/2023","","4.2","38","","191,805","6","FBA","1","Home & Kitchen","","","","https://www.amazon.com/dp/B0CDLFH8PX"
"","","B0CG5WQC2N","6Pcs Bed Sheet Organizer and Storage,Foldable Sheet Set Organizer With Labeled Window Handle Zipper Grey Cube Portable Storage Box for Closet Bedding Clothes Towels Blankets","BINBE","$39.99","","","$1,200","08/20/2023","$26.36","5","1","$13.63","799,201","6","FBA","1","Home & Kitchen","Standard","2 x 2 x 2 in","7.26 lb","https://www.amazon.com/dp/B0CG5WQC2N"
"","","B0CJF6N9BT","KAKALGAME Bed Sheet Organizer for Linen Closet Organizers and Storage, 4 Pack (Queen or King Size) Foldable Sheet Storage Box for Bedding Clothes Blankets Duvet Cover Set - Grey","KAKALGAME","$35.99","191","5","$6,874","09/19/2023","","4.6","55","","158,457","6","FBA","1","Home & Kitchen","","","","https://www.amazon.com/dp/B0CJF6N9BT"
"","","B0CFXX2BSH","Wesapor Foldable Bed Sheet Set Organizer, 2-Pack Sheet Set Organizer for Linen Closet,Sheet Organizer and Storage for Bedding Clothes Blankets, Bed Sheet Storage Box for Duvet Cover Set","Wesapor","$49.99","387","6","$19,346","08/16/2023","$37.35","5","4","$12.64","155,638","7","FBA","1","Home & Kitchen","Standard","1 x 1 x 1 in","1.83 lb","https://www.amazon.com/dp/B0CFXX2BSH"
"","","B0CDLDW71R","Feverdes SheetCube Bed Sheet Set Organizer 4-Pack (Queen or King Size),Foldable Storage Box,Linen Closet Organizer for Bedding Sheets, Duvet Covers,Blankets and Pillow Cases (Grey)","Feverdes","$39.99","387","7","$15,476","08/02/2023","","4.4","50","","119,721","6","FBA","1","Home & Kitchen","","","","https://www.amazon.com/dp/B0CDLDW71R"
"","","B0CDGSTJ9F","Niagara 4 Pack Bed Sheet Organizer and Storage Label Bands - Fully Elastic Stretchable Linen Closet Organizers and Storage - Bed Sheet Organizer Bands for Bed Sheets, Duvets, Quilts, Linen (King)","Niagara Sleep Solution","$8.99","150","5","$1,349","11/24/2023","","4.7","43","","179,570","","FBA","1","Home & Kitchen","","","","https://www.amazon.com/dp/B0CDGSTJ9F"
"","","B0CLVKJ9PY","Fokyfok Bed Sheet Organizer,4-Pack Sheet Organizers and Storage, Upgraded in 3 Aspects, Queen/King Size  A Full Bed Sheets Organizer for Linen Closet,Folding Cube Linen Organizer for Sheet Set,Grey","Fokyfok","$29.99","134","4","$4,019","12/17/2023","","4.5","9","","193,831","7","FBA","1","Home & Kitchen","","","","https://www.amazon.com/dp/B0CLVKJ9PY"
"","","B0C59N1F13","Steddi Bed Sheet Organizer Bands, Bed Sheet Storage Label Bands, Sheet Organizer Bands, Sheet Labels for Bedding, Sheet Organizers and Storage for Bed Sheets, Pillow Case, Duvet (Queen)","Steddi","$13.99","128","2","$1,791","08/01/2023","","4.4","16","","340,887","6","FBA","1","Home & Kitchen","","","","https://www.amazon.com/dp/B0C59N1F13"
"","","B0CB4NSG16","DomiZen Bed Sheet Set Organizer, Foldable Bedding Organizer for Bed Sheets, Duvet Covers and Pillowcases, Closet Storage Container (Gtray4 Pack)","DomiZen","$34.99","93","2","$3,254","07/03/2023","","5","6","","403,804","6","FBA","1","Home & Kitchen","","","","https://www.amazon.com/dp/B0CB4NSG16"
"","","B0CMLF6QRH","YUZI 8-Pcs Bed Sheet Organizer Bands - Sheet Organizers and Storage Label Bands Sheet Label for Elastic Bedding Linen Closet Storage Foldable Bed Sheet Straps Set Organizer Sheet Keeper Band","Yuzi","$6.49","247","2","$1,603","01/12/2024","","4.9","14","","397,806","7","FBA","1","Home & Kitchen","","","","https://www.amazon.com/dp/B0CMLF6QRH"
"","","B0CLSG7J54","Welyspix 4 Pack Bed Sheet Set OrganizerFoldable Closet Organizers and Storage for Bed Sheets, Bed Sheet Storage Organizer for Duvet Cover Bedding Clothes Pillowcases","Welyspix","$32.99","144","7","$4,751","12/15/2023","","4.5","24","","119,718","7","FBA","1","Home & Kitchen","","","","https://www.amazon.com/dp/B0CLSG7J54"
"","","B0BR3H3Q44","Fixwal 3 Pack Bed Sheet Organizer, Foldable King or Queen Size Sheet Set Organizer Storage Box Containers, Linen Closet Organizer with Zipper for Bedding Sheet, Duvet Covers and Pillowcases(Grey)","Fixwal","$30.99","129","2","$3,998","12/25/2022","","4.5","137","","379,948","6","FBA","4","Home & Kitchen","","","","https://www.amazon.com/dp/B0BR3H3Q44"
"","","B0CDGGFP8D","KLONVS SheetCube Bed Sheet Set Organizer 4 Pack (Queen or King Size), Foldable sheet organizers and storage.Linen Closet Organizer for Bedding Clothes Blankets, Grey","KLONVS","$27.99","233","8","$6,522","10/14/2023","","4.7","60","","108,898","6","FBA","1","Home & Kitchen","","","","https://www.amazon.com/dp/B0CDGGFP8D"
"","","B0CNH26XVT","EXLIFBAG 4 Pack Sheet Organizers and Storage, Foldable Bed Sheet Organizer for Linen Closet, with Window XL (Queen & King Size) Organizing Bedding Container, Gary","EXLIFBAG","$39.99","30","1","$1,200","11/15/2023","","4.8","10","","493,969","6","FBA","1","Home & Kitchen","Standard","13.5 x 5 x 15 in","6.53 lb","https://www.amazon.com/dp/B0CNH26XVT"
"","","B0BT74ZHXK","LINENMATE Queen/King Size (Ivory 2-Pack) - The Original 2-Pack Linen Storage Container with Sheet-Folding Assisted Panels | Bed Sheets | Duvet Covers | Pillowcases | Towels","LINENMATE","$64.97","890","20","$57,823","01/25/2023","$46.39","4.5","176","$18.58","47,681","6","FBA","6","Home & Kitchen","Standard","12 x 4 x 15 in","2.74 kg","https://www.amazon.com/dp/B0BT74ZHXK"
"","","B085ZV98JM","90L Large Storage Bags, 6 Pack Clothes Storage Bins Foldable Closet Organizers Storage Containers with Durable Handle for Clothing, Blanket, Comforters, Bed Sheets, Pillows and Toys (Gray)","Budding Joy","$24.99","39,108","1,017","$977,309","03/16/2020","$13.31","4.3","45,143","$11.68","166","6","FBA","4","Home & Kitchen","Standard","11.54 x 14.45 x 6.77 in","2.69 lb","https://www.amazon.com/dp/B085ZV98JM"
"","","B0CHHBQMKB","KUNRO Four Pack Grey Color Foldable SheetCube For Queen and King Sheets, Covers and Pillows, Sheet Organizers, Blanket Storage, Under Bed Storage Container,Closet Organizers and Storage.","KUNRO","$24.99","70","3","$1,749","09/06/2023","","4.6","9","","261,026","7","FBA","1","Home & Kitchen","","","","https://www.amazon.com/dp/B0CHHBQMKB"