"Export time:  2/2/2024, 12:14:31 PM","","ASIN","Product Name","Brand","Price","Monthly Units Sold","Daily Units Sold","Monthly Revenue","Date First Available","Net Revenue","Star Rating","Reviews","Amazon Fees","BSR","LQS","Seller Type","Sellers","Category","Product Tier","Dimensions","Weight","Link"
"","","B0BT73TJ6K","LINENMATE Twin/Full Size (Ivory 2-Pack) - The Original 2-Pack Linen Storage Container with Sheet-Folding Assisted Panels | Bed Sheets | Duvet Covers | Pillowcases | Towels","LINENMATE","$64.97","943","26","$61,267","01/25/2023","","4.5","174","","35,818","6","FBA","1","Home & Kitchen","","","","https://www.amazon.com/dp/B0BT73TJ6K"
"linen organizer for sheets","","B0C9QBRQB4","SpaceAid 4 Pack Bed Sheet Organizers and Storage, Foldable Sheet Organizer for Linen Closet, Sheets Set Folder Keeper with Window XL (Queen & King Size) Organizing Bedding Container, Gray","SpaceAid","$33.98","6,400","279","$217,472","06/28/2023","","4.6","237","","1,846","6","FBA","1","Home & Kitchen","","","","https://www.amazon.com/dp/B0C9QBRQB4"
"Average Monthly Sales: 2,970","","B0CM37V25J","GODELAIF Bed Sheet Organizer and Storage, Foldable Sheet Set Organizer for Twin/Full/Queen/King Size, Linen Closet Organizers and Storage with Handle for Sheet Set Bedding Clothes Blanket","GODELAIF","$19.99","255","15","$5,097","10/29/2023","","4.8","86","","61,669","7","FBA","1","Home & Kitchen","","","","https://www.amazon.com/dp/B0CM37V25J"
"Average Revenue: $83,730","","B0CHTYLRGG","A.C.R. Brands 4 Pack Foldable Bed Sheet Organizer for Linen Closet, Sheet Organizers and Storage, Linen Closet Organizer, Sheet Set Organizer, Bed Sheet Storage Organizer for Queen/King Sheets","Generic","$32.99","168","4","$5,542","09/10/2023","$20.71","5","2","$12.28","217,238","7","FBA","1","Home & Kitchen","Standard","15 x 4.5 x 13 in","4.29 lb","https://www.amazon.com/dp/B0CHTYLRGG"
"Average Price: $34.41","","B0C1BK6DCP","SUOCO Modern Fabric Storage Box, Beige, 4-1/2 in W x 15 in D x 12-3/4 in H, Fits 1 Queen/King Sheet Set or Duvet Cover Set","SUOCO","$49.99","2,402","54","$120,076","06/05/2023","$34.56","4.3","152","$15.43","16,620","7","FBA","2","Home & Kitchen","Standard","12.68 x 4.17 x 15.35 in","8.9 lb","https://www.amazon.com/dp/B0C1BK6DCP"
"Average No. of Ratings: 1,318","","B0CJJHLSXQ","BigPonPon 3-Pack Foldable Bed Sheets Set Organizers and Storage(King & Queen Size),Linen Fabric Closet Organizers with Window,Folding Bedding Storage Box for Bedsheets and Pillow Cube Organizer","BigPonPon","$29.77","1,825","64","$54,330","09/20/2023","$18.78","4.5","61","$10.99","13,517","7","FBA","1","Home & Kitchen","Standard","12.5 x 4.7 x 15 in","5.13 lb","https://www.amazon.com/dp/B0CJJHLSXQ"
"Average Sales Rank: 134,482","","B0CJQWBH4N","HUWAILE Sheet Organizers and Storage - 3 Pack Bed Sheet Organizers for All Sheet Sizes, Including Queen/King Size Blankets, Foldable Blanket Organizer/Sheet Storage for Linen Closet, Beige","HUWAILE","$32.99","301","5","$9,930","09/24/2023","$20.41","4.9","50","$12.58","169,005","6","FBA","1","Home & Kitchen","Standard","13 x 5.5 x 15 in","5.9 lb","https://www.amazon.com/dp/B0CJQWBH4N"
"Average Rating Number: 4.6","","B0CGNPZVG5","SpaceAid 5 Pack Bed Sheet Organizers and Storage, Foldable Sheet Organizer for Linen Closet, Sheets Set Folder Keeper with Window XL (Queen & King Size) Organizing Bedding Container, White","SpaceAid","$46.98","","","","08/25/2023","","4.7","30","","","6","FBA","1","","","","","https://www.amazon.com/dp/B0CGNPZVG5"
"","","B0C4LFRYDR","GZOOGHOME 4 Pack Bed Sheet Organizers and Storage, Sheet Folder Organizer for Linen Closet, Foldable Sheets Set Keeper XL (Queen or King Size) Organizing Bedding Container (Circle Window, Black)","GZOOGHOME","$39.99","819","21","$32,752","05/07/2023","$26.66","4.2","144","$13.33","44,184","7","FBA","2","Home & Kitchen","Standard","4.5 x 12.8 x 15 in","3.1 lb","https://www.amazon.com/dp/B0C4LFRYDR"
"","","B0C7Z2VPFK","YUOROS Bed Sheet Set Organizer (Queen or King Size), 2 Pack Foldable Linen Closet Organizers and Storage for Bed Sheets, Duvet Covers and Pillowcases (2 Pack, King Size)","YUOROS","$22.99","158","6","$3,632","06/13/2023","","4.6","52","","139,657","6","FBA","3","Home & Kitchen","","","","https://www.amazon.com/dp/B0C7Z2VPFK"
"","","B0CM397MB2","GODELAIF Bed Sheet Organizer and Storage, Foldable Sheet Set Organizer for Twin/Full/Queen/King Size, Linen Closet Organizers and Storage with Handle for Sheet Set Bedding Clothes Blanket","GODELAIF","$19.99","307","15","$6,137","10/29/2023","","4.8","86","","61,669","7","FBA","1","Home & Kitchen","","","","https://www.amazon.com/dp/B0CM397MB2"
"","","B0C5WL6CFL","KIMBORA Foldable Bed Sheet Organizer and Storage, 3 Pack King Size Sheet Set Organizer for Linen Closet With Clear PVC Sheet Storage for Bedding Sheets, Duvet Covers and Pillow cases","KIMBORA","$23.99","887","17","$21,279","05/21/2023","$13.06","4.3","124","$10.93","54,386","7","FBA","2","Home & Kitchen","Standard","4.5 x 13 x 15 in","1 lb","https://www.amazon.com/dp/B0C5WL6CFL"
"","","B0BT74ZHXK","LINENMATE Queen/King Size (Ivory 2-Pack) - The Original 2-Pack Linen Storage Container with Sheet-Folding Assisted Panels | Bed Sheets | Duvet Covers | Pillowcases | Towels","LINENMATE","$74.97","966","26","$72,421","01/25/2023","$54.89","4.5","174","$20.08","35,818","6","FBA","5","Home & Kitchen","Standard","12 x 4 x 15 in","2.74 kg","https://www.amazon.com/dp/B0BT74ZHXK"
"","","B0CBLYJFM2","MuiiuM Bed Sheet Organizer and Storage 4 Pack (Queen or King Size), Linen Closet Organizer, Foldable Bedding Container for Duvet Cover Set, Clothes, Blankets and Pillow cases","MuiiuM","$37.99","134","5","$5,091","07/10/2023","","4.7","30","","166,072","6","FBA","1","Home & Kitchen","","","","https://www.amazon.com/dp/B0CBLYJFM2"
"","","B0CLCZH8FD","TRZZ Sheet Organizers and Storage, 4-Pack, Queen/King Size (Grey), Bed Sheet Organizer, Linen Closet Organizer and Storage for Bed Sheets, Duvet Covers and Pillowcases, 15' L13' W5' H","TRZZ","$49.99","516","17","$25,795","10/18/2023","","4.8","95","","55,087","6","FBA","2","Home & Kitchen","","","","https://www.amazon.com/dp/B0CLCZH8FD"
"","","B0CLSG7J54","Welyspix 4 Pack Bed Sheet Set OrganizerFoldable Closet Organizers and Storage for Bed Sheets, Bed Sheet Storage Organizer for Duvet Cover Bedding Clothes Pillowcases","Welyspix","$32.99","128","4","$4,223","12/15/2023","","4.4","23","","211,708","7","FBA","1","Home & Kitchen","","","","https://www.amazon.com/dp/B0CLSG7J54"
"","","B0CJBV3SR2","LQIQIZ Foldable Bed Sheet Organizers and Storage - 2 Pack Sheet Folder Organizer for Linen Closet, Bedding Organizer for Duvet Cover Set, Linen Closet Organizer for Bedding Blanket(King/Queen Size)","LQIQIZ","$19.99","","","$0.00","09/18/2023","","4.7","9","","1,599,702","7","FBA","1","Home & Kitchen","","","","https://www.amazon.com/dp/B0CJBV3SR2"
"","","B0C9QB47R2","SpaceAid 8 Pack Bed Sheet Organizers and Storage, Foldable Sheet Organizer for Linen Closet, Sheets Set Folder Keeper with Window XL (Queen & King Size) Organizing Bedding Container, Beige","SpaceAid","$62.98","1,274","43","$80,237","06/28/2023","","4.4","127","","21,151","6","FBA","2","Home & Kitchen","","","","https://www.amazon.com/dp/B0C9QB47R2"
"","","B0B8MNZKVC","Bed Sheet Organizer and Storage Size Label Bands | Sheets Set Organizers for Linen Closet - Labeled Elastic Bedding Sheet Keepers Straps for Organizing Foldable Bedsheet Sets (King 4PCs Pack | Cream)","ECOHomes","$12.99","12,820","976","$166,532","10/28/2022","","4.6","398","","181","7","FBA","1","Home & Kitchen","","","","https://www.amazon.com/dp/B0B8MNZKVC"
"","","B0CN14LHFP","BigPonPon 6 Pack Bed Sheets Organizers And Storage (King Size),Foldable Sheet Organizer With Handle For Linen Closet,Bedding Organizer Storage For Sheets, Duvet Cover (Beige","BigPonPon","$64.99","480","13","$31,195","09/20/2023","","4.5","40","","72,135","7","FBA","1","Home & Kitchen","","","","https://www.amazon.com/dp/B0CN14LHFP"
"","","B0C16JFJJN","SheetCube 4 Pack Bed Sheet Organizers and Storage, Foldable Bedding Storage Box Container with Window and Label, Linen Closet Organizer Folder for Blanket, Duvet Cover Set, Bed Sheet Set - Grey","SUOCO","$25.49","1,384","88","$35,278","06/05/2023","","4.1","553","","9,246","6","FBA","1","Home & Kitchen","","","","https://www.amazon.com/dp/B0C16JFJJN"
"","","B0C9X6TM6T","chinensis 6 Pack Sheet organizer,Bed Sheet Storage,Folding Organizers for Bed Sheets,Sheet Storage Organizer,Sheet Set Organizer,Sheet Storage for Closet,Grey","chinensis","$69.99","422","7","$29,536","07/02/2023","","4.8","67","","127,900","7","FBA","3","Home & Kitchen","","","","https://www.amazon.com/dp/B0C9X6TM6T"
"","","B0CDYVV6BR","SleepySorter Sheet Organizer and Storage | Bed Sheet Organizer 2 Pack | Sheet Storage | Ideal for 1 queen/king sheet set (fitted sheet, flat sheet, and 2 pillow) | Bedding Storage","Generic","$20.99","95","5","$1,994","11/02/2023","","5","5","","182,886","7","FBA","1","Home & Kitchen","","","","https://www.amazon.com/dp/B0CDYVV6BR"
"","","B0BZYX9GTS","zjdbset 20 PiecesBed Sheet Organizer Bands Bed Sheet Keepers Closet Organization ElasticLinen Labels for Bed Sheet Sets(Queen,King,Full,Twin)","zjdbset","$15.49","2,954","105","$45,757","04/30/2023","","4.5","74","","7,418","6","FBA","3","Home & Kitchen","","","","https://www.amazon.com/dp/B0BZYX9GTS"
"","","B0CJJHZS33","Bed Sheet Organizers and Storage - 4 Pack (Queen or King Size),Foldable Storage Box for Duvet Cover Set, Linen Closet Organizer for Bedding Clothes Blankets, Grey","Aokeyee","$39.59","637","24","$25,219","09/20/2023","$26.32","4.7","90","$13.27","38,653","6","FBA","1","Home & Kitchen","Standard","12.9 x 5 x 15 in","4.85 lb","https://www.amazon.com/dp/B0CJJHZS33"
"","","B0CHFBYL2X","StarAneer 2 Pack Bed Sheet Organizers and Storage; Sheets and Blanket Organizer ; Foldable Organizing Bed Sheets Linen Box with Windows XL(Queen & King Size), beige","StarAneer","$19.99","180","7","$3,598","09/23/2023","","4.7","15","","123,153","7","FBA","1","Home & Kitchen","","","","https://www.amazon.com/dp/B0CHFBYL2X"
"","","B0CDLDW71R","Feverdes SheetCube Bed Sheet Set Organizer 4-Pack (Queen or King Size),Foldable Storage Box,Linen Closet Organizer for Bedding Sheets, Duvet Covers,Blankets and Pillow Cases (Grey)","Feverdes","$59.99","537","16","$32,215","08/02/2023","","4.3","58","","59,011","6","FBA","1","Home & Kitchen","","","","https://www.amazon.com/dp/B0CDLDW71R"
"","","B0CDGSTJ9F","Niagara 4 Pack Bed Sheet Organizer and Storage Label Bands - Fully Elastic Stretchable Linen Closet Organizers and Storage - Bed Sheet Organizer Bands for Bed Sheets, Duvets, Quilts, Linen (King)","Niagara Sleep Solution","$8.99","1,480","26","$13,305","11/24/2023","","4.7","43","","36,550","","FBA","1","Home & Kitchen","","","","https://www.amazon.com/dp/B0CDGSTJ9F"
"","","B0CMJBYYYK","MLGOGO Bed Sheet Organizer 8 Pcs. Set (6+2) Foldable Linen Closet Storage Containers for King/Queen Size Sheets & 6 Elastic Bands. Bedding Storage Linen Closet Organizers w/Window & Handle (Black)","MLGOGO","$43.79","300","11","$13,137","11/02/2023","","4.5","13","","81,139","6","FBA","1","Home & Kitchen","","","","https://www.amazon.com/dp/B0CMJBYYYK"
"","","B0C9Q61MDQ","SpaceAid 6 Pack Bed Sheet Organizers and Storage, Foldable Sheet Organizer for Linen Closet, Sheets Set Folder Keeper with Window XL (Queen & King Size) Organizing Bedding Container, Black","SpaceAid","$49.98","1,057","27","$52,829","06/28/2023","","4.6","131","","34,911","6","FBA","2","Home & Kitchen","","","","https://www.amazon.com/dp/B0C9Q61MDQ"
"","","B0CJHT4FPJ","BUFOR Sheet Organizer for Linen Closet, Foldable Bed Sheet Organizer, King Size Sheet Storage 4 Pack, Grey","BUFOR","$39.99","163","5","$6,518","09/20/2023","$26.66","4.7","4","$13.33","166,523","6","FBA","1","Home & Kitchen","Standard","13 x 4.3 x 15 in","2 lb","https://www.amazon.com/dp/B0CJHT4FPJ"
"","","B07JJ6HL81","mDesign Medium Fabric Stackable Closet Storage Organizer Box with Front Window/Lid for Bedroom, Office, Mudroom Organization, Hold Clothes, Blankets, Linens, Lido Collection, 8 Pack, Gray","mDesign","$39.99","396","11","$15,836","11/15/2018","$26.66","4.4","1,748","$13.33","85,835","7","FBA","2","Home & Kitchen","Standard","12 x 12.75 x 4.75 in","7 lb","https://www.amazon.com/dp/B07JJ6HL81"
"","","B0C9PL48DM","BIKTIC SheetCube Bed Sheet Organizers and Storage,4 Pack Sheet Folder Organizer (Queen or King Size), Linen Closet Organizer for Bedding Sheets,Duvet Covers and Pillow cases,Grey","BIKTIC","$49.99","1,602","42","$80,084","07/31/2023","","4.8","371","","21,514","7","FBA","4","Home & Kitchen","","","","https://www.amazon.com/dp/B0C9PL48DM"
"","","B0BQC3SRHC","Fordonral 4 Pack Linen Storage Bins, Storage Containers for Organizing Clothing, Jeans, Toys, Books, Shelves, Closet, Wardrobe - Closet Organizers and Storage, Large Storage Boxes Baskets with Window","Fordonral","$20.98","2,196","72","$46,072","12/15/2022","$9.90","4.7","220","$11.08","11,739","6","FBA","3","Home & Kitchen","Standard","10.63 x 6.69 x 15.75 in","1 lb","https://www.amazon.com/dp/B0BQC3SRHC"
"","","B0C2HCW8V7","【Upgraded】Bed Sheet Organizer Bands 8 Pieces,Sheet Organizer for Linen Closet, Sheet Set Organizer, Sheet Keepers Closet Organization, King Twin Full Queen Sheet Straps, Elastic Bed Sheet Storage","ZUMRUKES","$11.99","426","21","$5,108","05/15/2023","","4.7","76","","44,427","6","FBA","3","Home & Kitchen","","","","https://www.amazon.com/dp/B0C2HCW8V7"
"","","B0CJ28N6W7","SNILOAW Sheets Organizer For Linen Closet, SheetCube Foldable Sheet Organizer (Queen Or King Size) Bed Sheet Organizers Closet Organizers and StorageBedding Organizer (Black, 2 Pack)","SNILOAW","$19.98","638","7","$12,747","10/12/2023","","4.7","20","","118,755","6","FBA","1","Home & Kitchen","","","","https://www.amazon.com/dp/B0CJ28N6W7"
"","","B092ZDHJMN","Fab totes 6 Pack Clothes Storage, Foldable Blanket Storage Bags, Storage Containers for Organizing Bedroom, Closet, Clothing, Comforter, Organization and Storage with Lids and Handle, Grey","Fab totes","$29.99","51,586","1,234","$1.55M","08/20/2021","","4.3","22,012","","109","6","FBA","8","Home & Kitchen","","","","https://www.amazon.com/dp/B092ZDHJMN"
"","","B0CL6BMGSD","Tearstone 4 Pack Foldable Nylon Storage Boxes in Grey for Linen Closet, Bedding, Clothes and Blankets","Tearstone","$28.99","76","2","$2,203","08/12/2023","","4.2","26","","369,711","7","FBA","1","Home & Kitchen","","","","https://www.amazon.com/dp/B0CL6BMGSD"
"","","B0CCYS6PXG","Bed Sheet Organizer - 2 Pack - Fits Queen/King Sheets, Heavy-duty Oxford Fabric, Pocket, Window and Handle on Both Sides, 5 Blank Labels for Easy Sheet Organization and Storage (Silver Grey)","FORZAROCKET","$17.95","53","","$951.35","07/26/2023","$8.53","4.4","21","$9.42","855,213","6","FBA","1","Home & Kitchen","Standard","12.6 x 2.36 x 15.75 in","4.29 lb","https://www.amazon.com/dp/B0CCYS6PXG"
"","","B085ZV98JM","90L Large Storage Bags, 6 Pack Clothes Storage Bins Foldable Closet Organizers Storage Containers with Durable Handle for Clothing, Blanket, Comforters, Bed Sheets, Pillows and Toys (Gray)","Budding Joy","$24.99","51,020","1,239","$1.27M","03/16/2020","$13.31","4.3","44,789","$11.68","108","6","FBA","4","Home & Kitchen","Standard","11.54 x 14.45 x 6.77 in","2.69 lb","https://www.amazon.com/dp/B085ZV98JM"
"","","B0C9X6NRN2","Chinensis 3 Pack Sheet Organizers and Storage, Grey, Modern Style, Foldable Box, 5'W x 15'D x 13'H, Made from Eco-Friendly Cationic Fabric","chinensis","$35.99","402","8","$14,468","07/02/2023","","4.8","67","","113,550","7","FBA","2","Home & Kitchen","","","","https://www.amazon.com/dp/B0C9X6NRN2"
"","","B0C24N63FB","ZJCAHXJ 12pcs Bed Sheet Organizers and Storage Bands for Closet Organization Linen Labels King Twin Full Queen Bedding Bands Elastic Sheet Straps","ZJCAHXJ","$12.99","337","16","$4,378","04/18/2023","","4.4","35","","56,784","7","FBA","1","Home & Kitchen","","","","https://www.amazon.com/dp/B0C24N63FB"
"","","B0C9D8CQ38","Furnhome 3 Pack Bed Sheet Organizers and Storage, Sheet Organizer for Linen Closet, Foldable Sheet Set Organizer, Sheet Storage Cube for Beding Sheets, Duvet Covers and Pillowcases","Furnhome","$32.99","219","4","$7,225","06/25/2023","","4.5","69","","214,284","7","FBA","1","Home & Kitchen","","","","https://www.amazon.com/dp/B0C9D8CQ38"
"","","B0CFGRWBG9","New England Stories 4 Pack Modern White Fabric Storage Box, Circle Window Design, 4.5 in W x 15 in D x 12.8 in H, Ideal for Linen Closet Organization","New England Stories","$34.99","185","4","$6,473","10/04/2023","","4.5","29","","226,184","7","FBA","2","Home & Kitchen","","","","https://www.amazon.com/dp/B0CFGRWBG9"
"","","B09TB8WFXC","HomeHacks Storage 3-Pack Clothes Organizer Storage Bags Foldable Storage Box with Large Clear Window Sturdy Handles for Closet, Dorm, Pillows, Bedding, Clothes, Stuffed Toys, Blankets, 35L, Grey","HomeHacks","$11.99","4,762","134","$57,096","04/09/2022","$4.40","4.4","1,169","$7.59","5,398","6","FBA","5","Home & Kitchen","Standard","9.84 x 9.92 x 3.82 in","0.86 lb","https://www.amazon.com/dp/B09TB8WFXC"
"","","B0CFXX2BSH","Wesapor Foldable Bed Sheet Set Organizer, 2-Pack Sheet Set Organizer for Linen Closet,Sheet Organizer and Storage for Bedding Clothes Blankets, Bed Sheet Storage Box for Duvet Cover Set","Wesapor","$49.99","476","39","$23,795","08/16/2023","$37.35","5","4","$12.64","23,327","7","FBA","1","Home & Kitchen","Standard","1 x 1 x 1 in","1.83 lb","https://www.amazon.com/dp/B0CFXX2BSH"
"","","B0CBJLCG78","GoMaihe Bed Sheet Organizers and Storage: 4-Pack XXL Foldable Bedsheet Set Organizer for Linen Closet Bedding Blankets Organizing - Easy Pull-out & Identification with Clear Window and Handle","GoMaihe","$35.99","233","5","$8,386","09/18/2023","$23.26","4.7","25","$12.73","170,605","7","FBA","1","Home & Kitchen","Standard","13.2 x 3.94 x 17.34 in","6.53 lb","https://www.amazon.com/dp/B0CBJLCG78"
"","","B0CCR8KN8H","FCQQYWZ Foldable Bed Sheet Organizers and Storage 2 Pack (Queen or King Size), Foldable Sheet Set Organizer for Linen Closet, Folding Organizing Cubes for Sheet, Duvet Cover, Blanket, Pillowcase,Grey","FCQQYWZ","$35.99","30","1","$1,080","07/24/2023","","4.6","20","","537,874","7","FBA","1","Home & Kitchen","","","","https://www.amazon.com/dp/B0CCR8KN8H"
"","","B0CM3DVLCY","DIMJ Bed Sheet Organizers and Storage 6 Pack, Foldable Sheet Bedding Storage Organizer for Linen Closet, Sheet Set Organizersr (Queen & King Size) with Window Handle for Bed Sheets Duvet Covers.(Grey)","DIMJ","$55.99","579","13","$32,418","12/27/2023","","5","5","","71,164","7","FBA","1","Home & Kitchen","","","","https://www.amazon.com/dp/B0CM3DVLCY"
"","","B0C69TWZVC","HSFTEC Foldable Bedding Organizer, Fabric Storage Bins for Bed Sheets, Duvet Covers and Pillowcases, Closet Organizer, Storage Container Boxes for Blankets, Clothes (2 pack(Queen or King), Grey)","HSFTEC","$19.99","278","7","$5,557","05/24/2023","","4.5","251","","125,826","7","FBA","1","Home & Kitchen","","","","https://www.amazon.com/dp/B0C69TWZVC"
"","","B0BVLK6VF2","MINAYI 4 Pieces Sheet Keeper Closet Organization - Bed Sheets Set Storage Organizer -Linen Labels Sheet Organizer (King)","MINAYI","$10.99","767","27","$8,429","03/04/2023","","4.9","35","","34,983","6","FBA","1","Home & Kitchen","","","","https://www.amazon.com/dp/B0BVLK6VF2"
"","","B0CM96STK3","Cosyzone Large Bed Sheet Organizers and Storage 4 Pack (Queen or King Size), Foldable Organizer for Linen Closet, Fabric Container Boxes for Bed Sheets, Duvet Covers, Pillowcases, Beige","Cosyzone","$28.99","480","16","$13,915","12/21/2023","","5","9","","59,247","","FBA","1","Home & Kitchen","","","","https://www.amazon.com/dp/B0CM96STK3"
"","","B0BR3H3Q44","Fixwal 3 Pack Bed Sheet Organizer, Foldable King or Queen Size Sheet Set Organizer Storage Box Containers, Linen Closet Organizer with Zipper for Bedding Sheet, Duvet Covers and Pillowcases(Grey)","Fixwal","$30.99","157","4","$4,865","12/25/2022","","4.5","136","","194,090","6","FBA","4","Home & Kitchen","","","","https://www.amazon.com/dp/B0BR3H3Q44"
"","","B0B825RMNF","CTSNSLH 4 Pack Folding Closet Organizers Storage Box, Stackable Plastic Drawer Basket for Clothing(White)","CTSNSLH","$37.99","5,387","89","$204,652","07/28/2022","","4.4","768","","9,083","7","FBA","4","Home & Kitchen","","","","https://www.amazon.com/dp/B0B825RMNF"
"","","B0C6547QCP","Pelguttee Bed Sheet Organizer and Bedding Label, Bed Sheet Label for Linen Closet Storage and Organization, Sheet Set Size Tag for Bed Sheet, Duvet Cover, Pillow Case, Bed Skirt (King 4PCs Pack)","Pelguttee","$13.99","180","6","$2,518","05/23/2023","$8.97","4.5","2","$5.02","152,741","6","FBA","1","Home & Kitchen","Standard","1.5 x 0.2 x 2 in","0.634 oz","https://www.amazon.com/dp/B0C6547QCP"
"","","B0CF5DJ67N","DELLAN Bed Sheet Organizer, Linen Closet Organizers and Storage, Foldable Cube Sheet Set Organizer (4 Pack)","DELLAN","$39.99","533","14","$21,315","08/08/2023","","4.6","41","","64,607","6","FBA","1","Home & Kitchen","","","","https://www.amazon.com/dp/B0CF5DJ67N"
"","","B0CJRLXS9H","Dobyusf Bed Sheet Organizer,Foldable Sheet Organizer and Storage for Linen Closet,Organizing Bedding Container(Queen & King Size) (4 Pack, Grey)","Dobyusf","$56.99","371","7","$21,143","09/24/2023","","4.3","18","","118,970","6","FBA","1","Home & Kitchen","","","","https://www.amazon.com/dp/B0CJRLXS9H"