"Export time:  2/17/2024, 7:42:06 PM","","ASIN","Product Name","Brand","Price","Monthly Units Sold","Daily Units Sold","Monthly Revenue","Date First Available","Net Revenue","Star Rating","Reviews","Amazon Fees","BSR","LQS","Seller Type","Sellers","Category","Product Tier","Dimensions","Weight","Link"
"","","B09QPX2RVR","ROKNE Taktical Carbon Series, Pickleball Paddle, 3K Raw Carbon Fiber, Thermoformed Foam Lined Edge, 13MM or 16MM, USAPA Approved Pickleball Racket, High Grit Texture, Max Spin","Rokne","$89.99","90","3","$8,099","01/22/2022","$72.72","4.5","271","$17.27","76,974","7","FBA","1","Sports & Outdoors","Standard","9.02 x 3.86 x 17.6 in","0.27 kg","https://www.amazon.com/dp/B09QPX2RVR"
"Pickleball Paddle","","B0C52DBW1Z","2024 Pickleball Paddle from SLK by Selkirk | Evo Power, Hybrid & Control Paddles | Fiberglass Pickleball Paddle | Carbon Fiber Pickleball Paddle with SpinFlex Surface","Selkirk Sport","$99.99","3,083","94","$308,269","05/10/2023","$81.22","4.5","376","$18.77","1,562","7","FBA","4","Sports & Outdoors","Standard","12.87 x 1.73 x 17.95 in","0.31 kg","https://www.amazon.com/dp/B0C52DBW1Z"
"Average Monthly Sales: 1,357","","B0CGY61SDF","Pickleball Paddles, USAPA Approved Fiberglass Surface Pickleball Set with Pickleball Rackets, Pickle Ball Paddle Set of 2 for Men Women","JEWELOPORIUM","$59.99","","","$0.00","08/29/2023","$44.56","5","8","$15.43","351,344","6","FBA","1","Sports & Outdoors","Standard","9 x 3 x 16 in","2.2 lb","https://www.amazon.com/dp/B0CGY61SDF"
"Average Revenue: $100,077","","B0CQYMZ3PS","Pickleball Paddles Set of 2, USAPA Approved Fiberglass Pickleball Set for Beginners & Pros","MTEN","$39.99","90","1","$3,599","12/25/2023","$26.06","4.8","97","$13.93","200,425","6","FBA","1","Sports & Outdoors","Standard","9.17 x 3.27 x 16.85 in","1 kg","https://www.amazon.com/dp/B0CQYMZ3PS"
"Average Price: $94.26","","B0CF4NSP7P","Pickleball Paddle, USA Pickleball Approved, 3K Raw Carbon Fiber Surface (CFS) High Grit & Spin, with 16MM Polypropylene Honeycomb Core, Ideal for Novice and Professional Players","CZRR","$49.49","2,132","103","$105,513","06/29/2023","$34.51","4.5","72","$14.98","1,378","7","FBA","1","Sports & Outdoors","Standard","8.62 x 1.81 x 17.48 in","0.48 kg","https://www.amazon.com/dp/B0CF4NSP7P"
"Average No. of Ratings: 654","","B0BYV7P9X7","Pickleball Paddles, USAPA Approved Fiberglass Surface Pickleball Set with 2 Pickleball Rackets,4 Pickleball Balls,1 Portable Carry Bag,Pickle Ball Paddle Set for Men Women","MTEN","$39.99","10,361","375","$414,336","03/17/2023","$26.06","4.8","2,386","$13.93","147","7","FBA","18","Sports & Outdoors","Standard","9.17 x 3.31 x 17.04 in","1.05 kg","https://www.amazon.com/dp/B0BYV7P9X7"
"Average Sales Rank: 35,512","","B0CD74H6FH","GARYE Pickleball Paddles Set of 2, USAPA Approved Carbon Fiber Pickleball Set, Lightweight Graphite Rackets 2 Pack with 6 Balls, 1 Pickleball Bag for Men and Women","GARYE","$49.99","3,414","134","$170,666","09/03/2023","$34.56","4.7","296","$15.43","922","7","FBA","3","Sports & Outdoors","Standard","9.92 x 3.31 x 16.69 in","1.03 kg","https://www.amazon.com/dp/B0CD74H6FH"
"Average Rating Number: 4.6","","B0BNTL3Q2C","VINSGUIR Pickleball Paddles, USAPA Approved Pickleball Paddles Set of 2, Lightweight Fiberglass Pickleball Set, Pickleball Paddles Set of 4 with Rackets& Carry Bag Pickleball Gifts for Beginners","VINSGUIR","$29.99","4,880","134","$146,351","12/01/2022","$17.86","4.7","963","$12.13","929","7","FBA","5","Sports & Outdoors","Standard","9.33 x 3 x 16.28 in","0.56 kg","https://www.amazon.com/dp/B0BNTL3Q2C"
"","","B0C523HPJP","2024 Pickleball Paddle from SLK by Selkirk | Evo Power, Hybrid & Control Paddles | Fiberglass Pickleball Paddle | Carbon Fiber Pickleball Paddle with SpinFlex Surface","Selkirk Sport","$99.99","3,035","94","$303,470","05/10/2023","$81.22","4.5","376","$18.77","1,562","7","FBA","3","Sports & Outdoors","Standard","10 x 1 x 17.5 in","0.3 kg","https://www.amazon.com/dp/B0C523HPJP"
"","","B0B7ZJJM8V","PCKL Pickleball Paddle Control Series and Power Series | USA Pickleball Approved | Graphite Carbon Face | Edgeless Design | Choose Blue or White Pickleball Paddle","PCKL","$89.99","106","6","$9,539","08/01/2022","$70.06","4.4","373","$19.93","36,577","6","FBA","3","Sports & Outdoors","Standard","9.25 x 1.65 x 16.45 in","0.54 kg","https://www.amazon.com/dp/B0B7ZJJM8V"
"","","B0BYTM394G","2024 Selkirk Vanguard Power Air Pickleball Paddles | Carbon Fiber Pickleball Paddle | 360 Proto Molding & Flexfoam Perimeter | The Pickleball Paddle Designed for Ultimate Power & Control","Selkirk Sport","$250.00","519","17","$129,750","03/16/2023","$208.73","4.4","114","$41.27","12,835","7","FBA","2","Sports & Outdoors","Standard","10.31 x 1.73 x 17.68 in","0.31 kg","https://www.amazon.com/dp/B0BYTM394G"
"","","B0BYTQ3KTP","2024 Selkirk SLK Halo Control & Halo Power Pickleball Paddle | Raw Carbon Fiber Pickleball Paddle with a Rev-Core Power Polymer Core | The Pickleball Paddle Designed for Ultimate Spin & Consistency","Selkirk Sport","$139.99","2,058","60","$288,099","03/16/2023","$115.22","4.6","264","$24.77","2,931","7","FBA","6","Sports & Outdoors","Standard","10.7 x 1.5 x 18 in","0.34 kg","https://www.amazon.com/dp/B0BYTQ3KTP"
"","","B0CJXTL7S3","Aquilegend Pickleball Paddles Set of 2/4, USAPA Approved Fiberglass Pickleball Set, Pickleball Paddles Gift with 2/4 Pickleball Rackets, 4 Balls, 1 Pickleball Ball Holder & 1 Carry Bag for Beginner","Aqui Legend","$12.99","560","42","$7,274","09/26/2023","$4.61","4.7","86","$8.38","4,547","7","FBA","1","Sports & Outdoors","Standard","8.58 x 1.65 x 16.69 in","0.35 kg","https://www.amazon.com/dp/B0CJXTL7S3"
"","","B09VCRKGCP","JOOLA Ben Johns Hyperion CAS Pickleball Paddle - Carbon Abrasion Surface with High Grit & Spin, Sure-Grip Elongated Handle, Pickle Ball Paddle with Polypropylene Honeycomb Core, USAPA Approved","JOOLA","$126.38","1,262","47","$159,492","03/31/2022","$106.26","4.7","648","$20.12","3,990","7","AMZ","8","Sports & Outdoors","Standard","9.72 x 2.05 x 17.72 in","0.31 kg","https://www.amazon.com/dp/B09VCRKGCP"
"","","B0CCW6VT77","GoSports GS1 Pickleball Paddle - USAPA Approved Fiberglass Pickleball Paddle, Black","GoSports","$22.26","666","10","$14,825","07/25/2023","$15.15","4.5","41","$7.11","22,433","6","AMZ","1","Sports & Outdoors","Standard","8 x 0.1 x 15.75 in","7 oz","https://www.amazon.com/dp/B0CCW6VT77"
"","","B0CQXDKSTN","Pickleball Paddles Set of 2 Carbon Fiber USAPA Approved Pickle Ball Paddle Indoor Outdoor Rackets 4 Pickleballs Racquet Gifts","ROCLUD","$45.99","240","8","$11,038","12/24/2023","$31.46","5","2","$14.53","27,595","6","FBA","1","Sports & Outdoors","Standard","9.37 x 3.27 x 16.38 in","0.76 kg","https://www.amazon.com/dp/B0CQXDKSTN"
"","","B0C5JZKGN6","F2 Sports Graphite Pickleball Paddles | Textured for Max Spin | USA Pickleball Approved Pickleball Racket | Mid-Weight 7.6-8.0 oz.|for Beginners or Pros | Best Paddle for Women & Men","F2 Sports","$84.00","15","1","$1,260","05/16/2023","$67.63","4.9","42","$16.37","166,432","6","FBA","2","Sports & Outdoors","Standard","8.46 x 1.97 x 16.06 in","0.24 kg","https://www.amazon.com/dp/B0C5JZKGN6"
"","","B08W9MY2T1","Champion Sports Rhino Pickleball Paddles: Indoor or Outdoor Pickleball Paddles in Wood, Aluminum, Fiberglass, Graphite  Multiple Styles","Champion Sports","$19.13","20","","$382.60","02/08/2021","$9.10","4.1","36","$10.03","233,864","6","AMZ","4","Sports & Outdoors","Standard","9.57 x 1.73 x 17.09 in","0.38 kg","https://www.amazon.com/dp/B08W9MY2T1"
"","","B0C39RWF7P","OMDEX V5 Pickleball Paddle Set, Carbon Fiber Pickleball Paddle USAPA Approved, Lightweight Pickleball Racket, Pickle Ball Paddle Gifts for Men Women","OMDEX","$59.99","294","9","$17,637","04/23/2023","$44.56","4.5","68","$15.43","24,646","7","FBA","1","Sports & Outdoors","Standard","8.74 x 1.69 x 16.54 in","0.46 kg","https://www.amazon.com/dp/B0C39RWF7P"
"","","B0C94ZCJPJ","OXIKEN 10/13/16 mm Pickleball Paddles 2024 USAPA Approved T700 Carbon Fiber Pickle Paddle (CFS), High Grit & Spin, Honeycomb Core, 5.5 Elongated Handle, Anti Slip Sweat Absorbing Grip with Cover Case","SS OXIKEN","$79.99","1,433","38","$114,626","06/22/2023","$58.56","4.6","120","$21.43","5,115","7","FBA","2","Sports & Outdoors","Standard","8.74 x 1.57 x 16.81 in","0.38 kg","https://www.amazon.com/dp/B0C94ZCJPJ"
"","","B01F7VC6MQ","2024 SLK by Selkirk Pickleball Paddles | Featuring a Multilayer Fiberglass and Graphite Pickleball Paddle Face | SX3 Honeycomb Core | Pickleball Rackets Designed in The USA for Traction and Stability","Selkirk Sport","$79.99","4,365","117","$349,156","05/04/2016","$57.66","4.6","2,432","$22.33","1,141","7","FBA","1","Sports & Outdoors","Standard","12.64 x 4.84 x 17.24 in","0.66 kg","https://www.amazon.com/dp/B01F7VC6MQ"
"","","B09VCS7578","JOOLA Ben Johns Hyperion CFS Pickleball Paddle - Official Ben Johns Paddle - USAPA Approved Racket for Tournament Play - Edge to Edge Sweet Spot, Durable Max Spin Surface & Elongated Handle","JOOLA","$159.83","1,070","32","$171,018","03/31/2022","$133.86","4.4","790","$25.97","6,263","6","AMZ","16","Sports & Outdoors","Standard","7.44 x 1.3 x 16.45 in","0.27 kg","https://www.amazon.com/dp/B09VCS7578"
"","","B0BPB2S4NC","Brooklyn Pickleball Co | Pickle Ball Paddle | Carbon Fiber | Honeycomb Core | Ribbed Non-Slip Cushion Grip | Single Racket | Pickle-Ball Paddles","Brooklyn Pickleball Co.","$34.97","662","22","$23,150","12/06/2022","$25.95","4.5","343","$9.02","9,871","7","FBA","1","Sports & Outdoors","Standard","9.06 x 1.26 x 15.87 in","0.21 kg","https://www.amazon.com/dp/B0BPB2S4NC"
"","","B0BX5TTP4H","HANISNA Pickleball Paddle, Carbon Fiber Graphite Pickleball Paddles with Enhance PP Honeycomb Core, Ultra Cushion Pickleball Rackets Grip, Lightweight, Grit Face, Gift Box & Paddle Cover","HANISNA","$46.95","372","12","$17,465","02/28/2023","$32.58","4.6","394","$14.37","18,664","7","FBA","1","Sports & Outdoors","Standard","10.2 x 2.1 x 17.8 in","0.57 kg","https://www.amazon.com/dp/B0BX5TTP4H"
"","","B0BYTGBRDT","2024 Selkirk SLK Halo Control & Halo Power Pickleball Paddle | Raw Carbon Fiber Pickleball Paddle with a Rev-Core Power Polymer Core | The Pickleball Paddle Designed for Ultimate Spin & Consistency","Selkirk Sport","$139.99","2,053","60","$287,399","03/16/2023","$115.22","4.6","264","$24.77","2,931","6","FBA","4","Sports & Outdoors","Standard","12.71 x 2.24 x 17.91 in","0.32 kg","https://www.amazon.com/dp/B0BYTGBRDT"
"","","B0CNXF53PN","PAKINIGO Pickleball Paddles Set of 2, USAPA Pickleball Paddle Rackets Set Fiberglass Surface16mm Thicker Honeycomb Core with 4 Balls & Carry Bag for Unisex Beginners & Pros","PAKINIGO","$39.99","","","","","","4.7","4","","227,953","","FBA","","Sports & Outdoors","","","","https://www.amazon.com/dp/B0CNXF53PN"
"","","B0CCW7VKBJ","GoSports GS PRO USAPA Approved Carbon Fiber Pickleball Paddle","GoSports","$79.99","71","1","$5,679","10/03/2023","","4.8","48","","135,807","6","AMZ","5","Sports & Outdoors","","","","https://www.amazon.com/dp/B0CCW7VKBJ"
"","","B098J4R2CS","VUFOXT Pickleball Paddles Set of 2, 99.99% Carbon Fiber, Graphite Honeycomb Core Graphite Face Cushion Comfort Grip with 4 Pickle Balls 1 Table Tennis Bag at The Batting Cages Field","VUFOXT","$49.99","5,094","122","$254,649","07/01/2021","$34.56","4.7","1,406","$15.43","1,068","7","FBA","4","Sports & Outdoors","Standard","9.88 x 3.31 x 16.69 in","0.75 kg","https://www.amazon.com/dp/B098J4R2CS"
"","","B0CFGN8LVB","Pickleball Paddles Set of 2/4, USAPA Approved Pickleball Set Pickleball Rackets 2 Pack, Fiberglass Surface Pickle-Ball Equipment, Pickleball Racquet Gifts for Beginners & Pros","Mayboom","$39.99","3,973","59","$158,880","08/11/2023","$25.76","4.9","243","$14.23","2,985","7","FBA","2","Sports & Outdoors","Standard","10.16 x 3.39 x 17.36 in","0.98 kg","https://www.amazon.com/dp/B0CFGN8LVB"
"","","B084C7CQ7C","Uteeqe Pickleball Paddles Set of 2 - Graphite Surface with High Grit & Spin, USAPA Approved Pickleball Set Pickle Ball Raquette Lightweight Polymer Honeycomb Non-Slip Grip w/ 4 Outdoor Balls & Bag","Uteeqe","$69.98","2,090","77","$146,258","01/12/2020","$51.55","4.7","2,719","$18.43","2,091","7","FBA","9","Sports & Outdoors","Standard","9.73 x 3.39 x 16.75 in","0.97 kg","https://www.amazon.com/dp/B084C7CQ7C"
"","","B0CJSGGZTD","2024 Selkirk LUXX Control Pickleball Paddle | Florek Carbon Fiber Pickleball Paddle with a Polypropylene X7 Core | The Pickle Ball Paddle Designed for Ultimate Power & Control |","Selkirk Sport","$250.00","915","36","$228,750","10/25/2023","$208.73","4.7","41","$41.27","5,501","6","FBA","1","Sports & Outdoors","Standard","12.95 x 1.65 x 17.99 in","0.3 kg","https://www.amazon.com/dp/B0CJSGGZTD"
"","","B0BQWNX6C4","Pickleball Paddles Set of 2, 2024 USAPA Approved, Carbon Fiber Surface (CHS), Polypropylene Honeycomb Core, Anti-Slip Sweat-Absorbing Grip, 4 Pickleball, Portable Carry Bag","YC DGYCASI","$31.99","3,115","144","$99,649","09/22/2022","$19.56","4.7","893","$12.43","822","7","FBA","7","Sports & Outdoors","Standard","9.31 x 3.16 x 16.58 in","0.74 kg","https://www.amazon.com/dp/B0BQWNX6C4"
"","","B09C88QVHL","JoncAye Pickleball-Paddles-Set of 4 Rackets and Balls w/case, Grip Tapes | USAPA Approved Pickle-Ball Equipment w/Accessories | Fiberglass Pickleball Racquet Set for Men, Women, Kids, Adults","JoncAye","$65.95","3,420","137","$225,549","08/09/2021","$47.23","4.8","2,057","$18.72","892","7","FBA","2","Sports & Outdoors","Standard","11.3 x 3.78 x 16.81 in","1.35 kg","https://www.amazon.com/dp/B09C88QVHL"
"","","B0C4M4X7RD","JOOLA Ben Johns Perseus Pickleball Paddle with Charged Surface Technology for Increased Power & Feel - Fully Encased Carbon Fiber Pickleball Paddle w/Larger Sweet Spot - USAPA Approved.","JOOLA","$220.57","1,341","47","$295,784","06/08/2023","$183.95","4.3","263","$36.62","3,969","7","AMZ","8","Sports & Outdoors","Standard","9.55 x 1.6 x 17.2 in","0.3 kg","https://www.amazon.com/dp/B0C4M4X7RD"
"","","B07DD146GW","HEAD Radical Elite Pickleball Paddle","HEAD","$69.95","676","21","$47,286","05/21/2018","$55.69","4.6","1,623","$14.26","10,179","5","FBA","3","Sports & Outdoors","Standard","9.8 x 2.44 x 16.85 in","0.25 kg","https://www.amazon.com/dp/B07DD146GW"
"","","B0CFXC94BS","Pickleball Paddles Set of 2 or 4, USAPA Approved Pickleball Paddles Set with 4 Pickleball Balls and Pickleball Carry Bag, Fiberglass Pickleball Paddles Rackets Set Gifts for Unisex Beginners&Pros","Mayboom","$20.98","1,986","123","$41,666","08/14/2023","$9.60","4.8","306","$11.38","1,053","7","FBA","2","Sports & Outdoors","Standard","10.04 x 3.43 x 17.04 in","1.01 kg","https://www.amazon.com/dp/B0CFXC94BS"
"","","B0BXRKN3SL","VINSGUIR Pickleball Paddle, Graphite Carbon Fiber Pickleball Paddles with Reinforced 16mm Polypropylene Honeycomb Core, Cushion Comfort Pickleball Paddle Grip, USA Pickleball Approved","VINSGUIR","$59.99","368","16","$22,076","05/14/2023","$47.22","4.5","140","$12.77","13,746","7","FBA","3","Sports & Outdoors","Standard","8.27 x 1.61 x 16.93 in","0.33 kg","https://www.amazon.com/dp/B0BXRKN3SL"
"","","B0CDP4227J","Flying H Pickleball Paddle | Carbon Fiber | Honeycomb Core | Timeless Design | USAPA Approved | Comfort Grip | Non-Slip Technology | Protective Neoprene Cover | Premium Paddle | Pickleball Racket","Generic","$49.99","59","7","$2,949","08/03/2023","$36.06","5","3","$13.93","34,578","7","FBA","1","Sports & Outdoors","Standard","8.98 x 1.57 x 16.5 in","0.44 kg","https://www.amazon.com/dp/B0CDP4227J"
"","","B0C4QZYPZJ","Havok Pro: Carbon Fiber Pickleball Paddle | Enhanced Power, Precision and Maximum Spin | Carbon Textured Surface with a Large Sweet Spot | USAPA Approved Professional Pickleball Racket","FORE","$159.00","211","9","$33,549","05/08/2023","$131.38","4.9","31","$27.62","24,508","7","FBA","1","Sports & Outdoors","Standard","9.21 x 1.65 x 16.73 in","0.27 kg","https://www.amazon.com/dp/B0C4QZYPZJ"
"","","B0BYTNXXGB","2024 Selkirk Vanguard Power Air Pickleball Paddles | Carbon Fiber Pickleball Paddle | 360 Proto Molding & Flexfoam Perimeter | The Pickleball Paddle Designed for Ultimate Power & Control","Selkirk Sport","$250.00","541","17","$135,250","03/16/2023","$208.73","4.4","114","$41.27","12,835","7","FBA","5","Sports & Outdoors","Standard","10.47 x 1.57 x 17.52 in","0.3 kg","https://www.amazon.com/dp/B0BYTNXXGB"
"","","B0CCFTTL5V","PICKLD Stylish Premium Pickleball Paddle Racket | Durable Fiberglass Surface | Honeycomb Core | Perfect Addition to a Pickleball Set | Indoor Outdoor Pickle Ball Paddle","PICKLD","$39.95","559","14","$22,332","07/19/2023","$30.19","4.5","79","$9.76","15,665","6","FBA","1","Sports & Outdoors","Standard","9.06 x 1.69 x 17.95 in","0.2 kg","https://www.amazon.com/dp/B0CCFTTL5V"
"","","B0BYMGYVTR","Vatic Pro Prism Carbon Fiber 16mm - Foam Injected Walls - Includes Paddle Cover","Vatic Pro","$99.99","2,279","74","$227,877","03/15/2023","$81.22","4.5","343","$18.77","2,184","6","FBA","1","Sports & Outdoors","Standard","8.62 x 1.89 x 17.04 in","0.34 kg","https://www.amazon.com/dp/B0BYMGYVTR"
"","","B0B5D8DRXR","XS XSPAK Carbon Fiber Pickleball Paddle - Tournament Edition - World Champion Surface Technology Options Pickleball Racket - USAPA Polypropylene Honeycomb Paddle with Cushion Comfort Grip","XS XSPAK","$99.99","567","17","$56,694","06/28/2022","$78.56","4.5","383","$21.43","13,177","6","FBA","5","Sports & Outdoors","Standard","9.17 x 1.57 x 17.01 in","0.44 kg","https://www.amazon.com/dp/B0B5D8DRXR"
"","","B0CKS2NFK6","JOOLA Simone Jardim Hyperion C2 Pickleball Paddle - Aero-Curve Hyperion Shape with Charged Surface Technology from The Ben Johns Perseus - Balanced Pickleball Racket with Pop & Power - USAPA Approved","JOOLA","$249.99","138","4","$34,499","11/07/2023","$208.72","4.7","26","$41.27","55,561","6","AMZ","3","Sports & Outdoors","Standard","8 x 1 x 17 in","0.3 kg","https://www.amazon.com/dp/B0CKS2NFK6"
"","","B09MFFQ9BF","Diadem Warrior Pickleball Paddle","Diadem Sports","$118.42","263","10","$31,144","12/09/2021","$96.67","4.5","170","$21.75","23,233","5","FBA","4","Sports & Outdoors","Standard","9.69 x 1.3 x 16.3 in","0.24 kg","https://www.amazon.com/dp/B09MFFQ9BF"
"","","B0CH23XZL3","SLK Latitude 2.0 Pickleball Paddle | G4 Graphite Pickleball Paddle Face | Rev-Core+ Technology with SpinFlex Surface | Redesigned for Performance and Control","Selkirk Sport","$63.69","991","23","$63,117","09/29/2023","$50.37","4.7","111","$13.32","9,088","7","FBA","5","Sports & Outdoors","Standard","13.03 x 1.61 x 17.91 in","0.3 kg","https://www.amazon.com/dp/B0CH23XZL3"
"","","B0CGD7593T","Composite Pickleball Paddle with Cover for Women, Graphite Carbon Fiber Polypropylene Honeycomb Core Pickle Ball Racquet Gift for Mother Wife Grandmother Girlfriend","ELKCIP","$29.99","180","6","$5,398","08/22/2023","$19.06","4.3","48","$10.93","40,825","8","FBA","1","Sports & Outdoors","Standard","8.78 x 1.57 x 16.3 in","0.41 kg","https://www.amazon.com/dp/B0CGD7593T"
"","","B0BL5J1NYG","PROKENNEX Black Ace Pro - Pickleball Paddle with Toray 700 Carbon Fiber Face - Comfort Pro Grip - USAPA Approved","PROKENNEX","$168.00","216","7","$36,288","10/31/2022","$131.58","4.4","66","$36.42","34,569","6","FBA","27","Sports & Outdoors","Oversize","10.47 x 1.61 x 18.5 in","0.44 kg","https://www.amazon.com/dp/B0BL5J1NYG"
"","","B0BHFCKZ4G","Franklin Sports Pro Pickleball Paddles - Signature Series Pro Pickleball Paddle with MaxGrit Surface - USA Pickleball (USAPA) Approved Tournament Pickleball Paddles - 13mm + 16mm Polypropylene Cores","Franklin Sports","$69.99","479","15","$33,525","10/04/2022","$55.72","4.4","253","$14.27","15,145","6","AMZ","4","Sports & Outdoors","Standard","7.8 x 0.8 x 16.4 in","0.27 kg","https://www.amazon.com/dp/B0BHFCKZ4G"
"","","B0C5RSNB7S","VINSGUIR Pickleball Paddles, USAPA Approved Pickleball Paddles Set of 2, Fiberglass Surface Pickleball Set with Pickleball Rackets, Pickleball Bags, Pickleball Ball Gifts for Women","VINSGUIR","$19.99","1,621","43","$32,404","08/18/2023","$9.36","4.6","124","$10.63","4,397","7","FBA","1","Sports & Outdoors","Standard","9.17 x 3.15 x 16.18 in","0.56 kg","https://www.amazon.com/dp/B0C5RSNB7S"
"","","B0C7RHMNJL","YC DGYCASI 16mm Pickleball Paddles Professional, 2024 USAPA Approved T700 Carbon Fiber Surface Pickle Paddle(CFS), Polypropylene Lightweight Honeycomb Core, Cushion Comfort Grip, with Cover Case Black","YC DGYCASI","$99.99","720","24","$71,993","09/22/2022","$88.72","4.6","196","$11.27","8,995","7","FBA","1","Sports & Outdoors","Standard","9.69 x 1.5 x 16.42 in","0.34 kg","https://www.amazon.com/dp/B0C7RHMNJL"
"","","B0CGVYPK2D","Engage Pursuit Pro MX 6.0 Pickleball Paddle  Elongated Shape, Raw T700 Toray Carbon Fiber Face, 16mm Control Pro Black Core, Vortex Barrier Edge Technology Limits Vibration","Engage Pickleball","$233.99","180","6","$42,118","09/11/2023","","4.1","11","","39,954","","","","Sports & Outdoors","","","","https://www.amazon.com/dp/B0CGVYPK2D"
"","","B0C889ZMSV","CRBN Power Series Pickleball Paddle - Carbon Fiber Pickleball Paddle with Foam Injected Edges for Expanded Sweet Spot","CRBN Pickleball","$229.99","492","19","$113,155","10/05/2023","$191.72","4.7","50","$38.27","11,488","","FBA","2","Sports & Outdoors","Standard","8.62 x 1.3 x 16.73 in","0.32 kg","https://www.amazon.com/dp/B0C889ZMSV"
"","","B0BFT2YGN7","JOOLA Ben Johns Hyperion CFS Swift Pickleball Paddle - USAPA Approved for Tournament Play - Carbon Fiber Pickle Ball Racket - Maximum Speed with High Grit & Spin","JOOLA","$170.97","330","9","$56,420","10/06/2022","$141.55","4.4","216","$29.42","24,903","7","AMZ","11","Sports & Outdoors","Standard","9.65 x 1.69 x 17.01 in","0.3 kg","https://www.amazon.com/dp/B0BFT2YGN7"
"","","B07GVDXW5D","niupipo Pickleball Paddles, USAPA Approved Pro Graphite Pickleball Paddle/Paddles Set, Polypropylene Honeycomb Core, Cushion 4.72In Grip, Portable Bag/Paddle Cover, Lightweight Pickleball Racket","niupipo","$42.49","1,404","71","$59,656","11/16/2018","$27.06","4.6","10,054","$15.43","2,338","7","FBA","6","Sports & Outdoors","Standard","9.8 x 3.19 x 16.5 in","0.76 kg","https://www.amazon.com/dp/B07GVDXW5D"
"","","B0CBKJPK43","Vnislovd Carbon Fiber Pickleball Paddle - T700 Thermoformed Pickleball Paddle,16mm USAPA Approved Paddles,4.13 Inch Grip,Foam Injected Walls,Elongated Pickleball Racket for Tournament Pro Player","Vnislovd","$105.99","169","8","$17,912","07/09/2023","$83.36","4.9","40","$22.63","29,135","7","FBA","1","Sports & Outdoors","Standard","9.33 x 1.73 x 16.89 in","0.49 kg","https://www.amazon.com/dp/B0CBKJPK43"
"","","B0C62Z9W8G","R-One Elongated Carbon Fiber Pickleball Paddle - 2023 Pickleball Racket with Long Handle - T700 Raw Carbon Fiber - Frosted Spin Surface - USAPA Approved by Nicol Pickleball","Nicol Pickleball","$98.00","88","4","$8,624","05/22/2023","$76.57","4.9","120","$21.43","52,542","6","FBA","1","Sports & Outdoors","Standard","9.17 x 1.93 x 17.24 in","0.76 kg","https://www.amazon.com/dp/B0C62Z9W8G"
"","","B09VCT9DMZ","JOOLA Essentials Pickleball Paddles with Reinforced Fiberglass Surface and Honeycomb Polypropylene Core","JOOLA","$120.68","752","25","$90,751","03/31/2022","$95.25","4.6","544","$25.43","8,228","6","AMZ","10","Sports & Outdoors","Standard","8.54 x 3.07 x 16.73 in","0.97 kg","https://www.amazon.com/dp/B09VCT9DMZ"
"","","B083LJX6HL","YC DGYCASI Graphite Pickleball Paddles Set of 2, 2024 USAPA Approved, Carbon Fiber Surface (CHS), Polypropylene Honeycomb Core, Anti-Slip Sweat-Absorbing Grip, 4 Pickleball, Portable Carry Bag","YC DGYCASI","$31.99","1,340","60","$42,867","01/06/2020","$19.56","4.7","1,141","$12.43","2,879","7","FBA","1","Sports & Outdoors","Standard","9.29 x 3.15 x 16.65 in","0.73 kg","https://www.amazon.com/dp/B083LJX6HL"
"","","B00CLVLQ36","ONIX Graphite Z5 Graphite Carbon Fiber Pickleball Paddles with Cushion Comfort Pickleball Paddle Grip - USA Pickleball Approved","Onix","$89.99","1,576","40","$141,824","12/02/2013","$72.72","4.6","5,153","$17.27","4,813","7","AMZ","13","Sports & Outdoors","Standard","9.8 x 1.54 x 17.4 in","0.27 kg","https://www.amazon.com/dp/B00CLVLQ36"
"","","B0BZT988J1","P-One by Nicol Pickleball Paddle - T700 Premium Japanese Carbon Fiber - USAPA Approved Pickleball Racket, Elongated Handle & Paddle Face, Upgraded Non-Slip Grip","Nicol Pickleball","$98.00","123","3","$12,054","03/27/2023","$76.57","4.8","332","$21.43","81,453","6","FBA","2","Sports & Outdoors","Standard","8.66 x 2.05 x 17.68 in","0.77 kg","https://www.amazon.com/dp/B0BZT988J1"
"","","B09VCT1DXC","Joola Vision Pickleball Paddle with Textured Carbon Grip Surface Technology for Maximum Spin and Control with Added Power - Polypropylene Honeycomb Core Pickleball Racket","JOOLA","$151.75","287","8","$43,552","03/31/2022","$125.22","4.6","351","$26.53","28,092","7","AMZ","6","Sports & Outdoors","Standard","9.76 x 1.69 x 17.56 in","0.29 kg","https://www.amazon.com/dp/B09VCT1DXC"