"Export time:  2/14/2024, 1:30:03 AM","","ASIN","Product Name","Brand","Price","Monthly Units Sold","Daily Units Sold","Monthly Revenue","Date First Available","Net Revenue","Star Rating","Reviews","Amazon Fees","BSR","LQS","Seller Type","Sellers","Category","Product Tier","Dimensions","Weight","Link"
"","","B0CLJV9B51","Mutball Silent Basketball | Size 7 (29.5') | Indoor Basketball | Quiet Basketball | Foam Basketball | Silent Basketball Dribbling Indoor | Silent Ball","Generic","$39.99","673","23","$26,913","01/23/2024","$20.12","3.5","3","$19.87","9,023","7","FBA","1","Sports & Outdoors","Oversize","9 x 9 x 9 in","0.39 kg","https://www.amazon.com/dp/B0CLJV9B51"
"silent basketball","","B0CPDLRCK6","DUOAMARE Silent Basketball Dribbling Up Indoor Basketball No Noise Quiet Hush Handle Basketball Foam Quiet Bounce Dunk Silent Swish Basketball(24cm)","DUOAMARE","$27.99","1,555","49","$43,524","12/03/2023","$17.06","3","6","$10.93","3,774","7","FBA","1","Sports & Outdoors","Standard","6.81 x 6.65 x 6.93 in","0.36 kg","https://www.amazon.com/dp/B0CPDLRCK6"
"Average Monthly Sales: 442","","B0CS2ZJPVR","HUALEI-V No.5 Silent Basketball,Bouncing Ball Uncoated High Density Foam Ball,Indoor Training Ball,Soft Flexible Lightweight Easy to Grip,Foam Basketball Dribbling Indoor Sports(8.3inch)","HUALEI-V","$26.99","210","3","$5,668","01/10/2024","$19.02","1","1","$7.97","69,538","7","FBA","1","Sports & Outdoors","Standard","9.09 x 7.68 x 11.69 in","0.22 kg","https://www.amazon.com/dp/B0CS2ZJPVR"
"Average Revenue: $13,320","","B0CKK1Q4JZ","Melon Studio Silent Basketball | Size 7 (29.5') | Indoor Basketball | Quiet Basketball | Foam Basketball | Silent Basketball Dribbling Indoor | Silent Ball","Melon Studio","$44.99","1,080","65","$48,589","10/04/2023","$24.36","4.5","8","$20.63","2,613","7","FBA","2","Sports & Outdoors","Oversize","9.2 x 8.7 x 10.4 in","0.32 kg","https://www.amazon.com/dp/B0CKK1Q4JZ"
"Average Price: $27.25","","B0CPX3M89L","Silent Basketball,Silent Basketball Dribbling Indoor,2024Foam Basketball Silent 7-24cm/9.44in Dunk Basketball Indoor Training,Silent Swish Basketball(Adult Basketball)","Generic","$31.99","2,019","88","$64,588","12/04/2023","$23.42","4","5","$8.57","1,712","7","FBA","1","Sports & Outdoors","Standard","7.05 x 3.43 x 7.2 in","0.32 kg","https://www.amazon.com/dp/B0CPX3M89L"
"Average No. of Ratings: 262","","B0CRKN7WXZ","KEHOO Silent Basketball, 2024 Latest Foam Basketball Indoor Training Ball, Silent Bouncing Basketball, Training Foam Ball, for Various Indoor Activities","KEHOO","$25.99","1,815","57","$47,172","01/04/2024","$7.45","1.7","3","$18.54","3,086","7","FBA","1","Sports & Outdoors","Oversize","9.21 x 8.94 x 11.89 in","0.22 kg","https://www.amazon.com/dp/B0CRKN7WXZ"
"Average Sales Rank: 66,413","","B0CP6F37N5","WAWAWEWA The Official Silent Basketball + (New) | Size 7 (29.5') ; Grooved Foam Ball for Quiet Dribbling and Indoor Training","WAWAWEWA","$47.99","1,415","46","$67,906","07/18/2023","$25.01","5","4","$22.98","4,061","7","FBA","1","Sports & Outdoors","Oversize","10.5 x 10.5 x 10.5 in","0.34 kg","https://www.amazon.com/dp/B0CP6F37N5"
"Average Rating Number: 3.6","","B000AXAC7I","Baden Elite","Baden","$59.99","695","22","$41,693","06/30/2003","$37.11","4.6","1,558","$22.88","9,527","5","AMZ","6","Sports & Outdoors","Oversize","9.53 x 9.45 x 9.65 in","0.59 kg","https://www.amazon.com/dp/B000AXAC7I"
"","","B0C5HXM4H7","Doloowee Basketball Hoop Indoor for Kids, Mini Basketball Hoop with 4 Balls, Basketball Toys for 3 4 5 6 7 8 9 10 11 12 Year Old Boys","Doloowee","$23.99","170","3","$4,078","07/31/2023","","4.1","125","","85,996","7","FBA","1","Toys & Games","","","","https://www.amazon.com/dp/B0C5HXM4H7"
"","","B0CJDXRLMK","AIGIMU Kids Basketball Hoop with Stand Adjustable Height 5.1ft-7ft 2-in-1 Toddler Basketball Hoop for Boys Girls Age 4 5 6 7 8 9 10 11 12 Mini Portable Basketball Goals for Indoor Outdoor Sport Game","AIGIMU","$49.99","142","7","$7,099","09/19/2023","$31.56","4.1","29","$18.43","43,175","7","FBA","3","Toys & Games","Standard","13.46 x 4.88 x 17.4 in","3.73 kg","https://www.amazon.com/dp/B0CJDXRLMK"
"","","B08935NK1T","REBOILPHASE Mamba Spirit Leather Basketball (Size 3~7)-Kids Basketball, Small Basketball, Youth Basketballs, Basketball Gift","REBOILPHASE","$26.99","206","5","$5,560","08/05/2020","$12.46","4.6","242","$14.53","47,481","6","FBA","1","Sports & Outdoors","Standard","9.45 x 4.92 x 10.2 in","0.89 kg","https://www.amazon.com/dp/B08935NK1T"
"","","B09Q2XZCTN","AboveGenius 2 Pack Outdoor Basketballs, Offical Size 7(29.5') Size 5(27.5') Rubber Basketball Balls for Men and Women","AboveGenius","$29.99","316","16","$9,477","01/09/2022","$17.56","4.6","349","$12.43","13,719","6","FBA","1","Sports & Outdoors","Standard","9.09 x 5.28 x 11.38 in","1.51 kg","https://www.amazon.com/dp/B09Q2XZCTN"
"","","B0CRR73LZJ","Silent BasketballFoam Basketball Indoor Training BallStandard Hush Handle Basketball, Quiet Basketball Dribbling Indoor, Silent Swish Basketball 24cm","Generic","$30.99","614","44","$19,028","12/12/2023","$22.57","4.5","2","$8.42","4,252","7","FBA","1","Sports & Outdoors","Standard","8.27 x 5 x 8.7 in","0.33 kg","https://www.amazon.com/dp/B0CRR73LZJ"
"","","B0CQC66XB2","Mckinu Silent Basketball 9.5 Inches: Quiet Basketball Indoor Training Ball - Soft Bouncy Low Noise Foam Basketball for Indoor Dribbleup Training","Mckinu","$32.95","469","4","$15,454","12/14/2023","$13.37","2.4","4","$19.58","55,369","7","FBA","2","Sports & Outdoors","Oversize","9.88 x 9.84 x 10.16 in","0.52 kg","https://www.amazon.com/dp/B0CQC66XB2"
"","","B0BYF8Y3HM","Gear Zone Organizer with Hand Pump | Sports Equipment Storage | Multi-Purpose | Adjustable | Space-Saving | Ball Holder | Ski and Bike Helmets | Bike Shoes | Accessories","Gear Zone","$34.99","45","2","$1,575","03/22/2023","","4.4","6","","118,829","6","FBA","1","Sports & Outdoors","","","","https://www.amazon.com/dp/B0BYF8Y3HM"
"","","B09C88GDWM","7-Inch Uncoated High Density Foam Ball - for Over 3 Years Old Kids Foam Sports Balls - Soft and Bouncy, Lightweight and Easy to Grasp Foam Silent Balls are Safe for Younger Children","Buhoet","$16.99","240","8","$4,078","06/02/2021","$11.20","4.3","227","$5.79","36,042","6","FBA","1","Toys & Games","Standard","6.81 x 6.77 x 7.28 in","0.13 kg","https://www.amazon.com/dp/B09C88GDWM"
"","","B0CBNCJ87Q","WAWAWEWA The Official Silent Basketball | Size 7 (29.5') ; Foam Ball for Quiet Dribbling and Indoor Training","WAWAWEWA","$44.99","1,286","35","$57,857","07/18/2023","$23.98","3.5","199","$21.01","5,665","6","FBA","1","Sports & Outdoors","Oversize","10 x 9 x 10 in","0.32 kg","https://www.amazon.com/dp/B0CBNCJ87Q"
"","","B0CLK9XSK4","CARTICOMTY Professional Silent Indoor Basketball, Size 7 Quiet Dribbling Training Foam Ball, Durable for Indoor Play, Noise-Absorbing Technology for Silent Practice, Perfect for Aspiring Athletes","CARTICOMTY","$39.99","332","16","$13,277","10/21/2023","$23.53","4.8","8","$16.46","13,764","6","FBA","1","Sports & Outdoors","Oversize","8.66 x 8.66 x 8.66 in","1.69 lb","https://www.amazon.com/dp/B0CLK9XSK4"
"","","B0CSVLPXZJ","Silent Basketball, Quiet Basketball Indoor, Uncoated High-Density Foam Ball, Soft, Flexible, Lightweight, and Easy to Grip for Various Indoor Activities (No. 5)","Generic","$25.99","285","10","$7,407","01/19/2024","$18.32","","","$7.67","22,101","","FBA","1","Sports & Outdoors","Standard","6.34 x 4.02 x 6.46 in","0.31 kg","https://www.amazon.com/dp/B0CSVLPXZJ"
"","","B0BYT2JRJ6","Botabee Foam Balls for Babies and Kids - Soft and Lightweight Grip Balls for Toddlers - Soft Foam Dodgeballs - Silent Ball for Classroom Indoor Play - Uncoated High Density Construction","Botabee","$13.99","235","5","$3,288","08/31/2023","$8.47","4.4","26","$5.52","58,547","6","FBA","1","Toys & Games","Standard","6.65 x 6.26 x 9.76 in","0.12 kg","https://www.amazon.com/dp/B0BYT2JRJ6"
"","","B08MZ7RFPT","i-Scream Balloon Ball - 7.9' (20 cm) Soccer Ball Size, Washable, Safe, and Soft Suede Material Cover with Balloon Inflation Pipe for Indoor and Outdoor, PE/Classroom Activities, Parties, and Games","I-SCREAMMEDIA","$12.99","242","8","$3,144","11/07/2020","$7.50","3.9","175","$5.49","27,243","7","FBA","1","Sports & Outdoors","Standard","4.09 x 1.81 x 6.06 in","0.06 kg","https://www.amazon.com/dp/B08MZ7RFPT"
"","","B0CBK1JMD6","Street Hockey Balls - Official Outdoor Roller Balls for Indoor Games, Ideal for Sports Enthusiasts","Golden Sport","$39.99","128","2","$5,119","09/19/2023","$25.76","4.6","49","$14.23","98,633","7","FBA","1","Sports & Outdoors","Standard","9.45 x 5.83 x 10.83 in","1.44 kg","https://www.amazon.com/dp/B0CBK1JMD6"
"","","B0BGQLN47X","SiQ Smart Basketball & App - Shoot Better Now - Interactive AI Outdoor/Indoor Shot Training Equipment - Practice Aid for NBA-Level Shooting for Basketball Players - Pro Leather Ball","SiQ","$149.98","178","6","$26,696","09/30/2022","$112.46","4.2","159","$37.52","40,491","7","FBA","2","Sports & Outdoors","Oversize","10 x 9.75 x 10.75 in","0.98 kg","https://www.amazon.com/dp/B0BGQLN47X"
"","","B0CTGR2M7X","Silent Basketball, 2024 The Handleshh Silent Basketball Dribbling Indoor, Hush Handle Foam Training Ball, Quiet Bounce No Noise Sound Basketball","Generic","$25.99","345","15","$8,967","01/28/2024","$18.32","","","$7.67","14,927","7","FBA","1","Sports & Outdoors","Standard","6.77 x 3.46 x 7.36 in","0.33 kg","https://www.amazon.com/dp/B0CTGR2M7X"
"","","B0CS673C6X","rytopt Indoor Basketball Silent, Quiet Dribbling Hush Handle Foam Training Ball, Uncoated High-Elasticity Foam Ball, Quiet Bounce No Noise Sound Basketball, Various Indoor & Outdoor Activities","rytopt","$19.99","270","9","$5,397","","","","","","26,764","","","","Sports & Outdoors","","","","https://www.amazon.com/dp/B0CS673C6X"
"","","B0CSXTBW69","Lamvpker Baby Basketball Silent - Hush Handle - Quiet Dribbling Ball - High-Elasticity Foam - Various Indoor & Outdoor Activities - Experience Low Noise Play (Size:NO.7)","Lamvpker","$25.99","210","7","$5,458","01/21/2024","$19.60","1","2","$6.39","32,981","5","FBA","1","Sports & Outdoors","Standard","11 x 1 x 11 in","3.2 oz","https://www.amazon.com/dp/B0CSXTBW69"
"","","B0CLRKKZTB","GBPLAIN Silent Foam Basketball Set - 18cm Mini Basketball Toys Set - Kids Sports Balls Quiet Basketball Dribbling Indoor - Soft Indoor Outdoor Basketball Games - Great Fun for Kids","GBPLAIN","$15.99","234","9","$3,742","10/24/2023","$10.05","5","2","$5.94","34,293","7","FBA","1","Toys & Games","Standard","7.09 x 7.01 x 7.09 in","0.14 kg","https://www.amazon.com/dp/B0CLRKKZTB"
"","","B0CQ2TBW6V","Ovveroche Silent Basketball, Foam Basketball Quiet Bounce Basketball Uncoated High-Density Foam Ball Low Noise Basketball Training Silent Basketball Dribbling Indoor Silent Ball","Ovveroche","$17.98","300","8","$5,394","12/11/2023","$11.06","2","1","$6.92","29,818","7","FBA","1","Sports & Outdoors","Standard","8.46 x 7.96 x 8.46 in","193 g","https://www.amazon.com/dp/B0CQ2TBW6V"
"","","B0CR36MH5Y","Silent Basketball, Indoor Silent Basketball, uncoated high-Density Foam Ball, Soft, Flexible, Light, Easy to Grip, Suitable for Various Indoor Activities (No. 5)","Generic","$30.99","611","4","$18,935","12/27/2023","$20.55","5","2","$10.44","52,262","7","FBA","1","Sports & Outdoors","Standard","7.01 x 3.7 x 7.09 in","0.35 kg","https://www.amazon.com/dp/B0CR36MH5Y"
"","","B0CSFM71RP","YIWONFU Silent Basketball, 2023 Newest Foam Basketball Indoor Training Ball,san hao","YIWONFU","$23.99","300","10","$7,197","01/15/2024","$16.85","","","$7.14","22,480","6","FBA","1","Sports & Outdoors","Standard","6 x 6 x 8 in","0.16 kg","https://www.amazon.com/dp/B0CSFM71RP"
"","","B0CBBN2ZN4","Limecute Silent Ball Basketball Indoor Training Quiet Ball Soft Foam Ball Highly Elastic in The Lab Silent Basketball","Limecute","$9.99","209","12","$2,088","08/15/2023","$2.30","4","33","$7.69","19,660","5","FBM","2","Sports & Outdoors","Standard","5.63 x 3.15 x 6.89 in","0.35 kg","https://www.amazon.com/dp/B0CBBN2ZN4"
"","","B0CQWVLL44","Silent Basketball, 2024 Newest Foam Basketball Indoor Training Ball, Uncoated High-Density Foam Ball Low Noise Basketball Training for Various Indoor Activities","Generic","$30.99","400","4","$12,396","12/25/2023","$22.57","1.9","22","$8.42","55,634","7","FBA","1","Sports & Outdoors","Standard","6.57 x 3.86 x 7.72 in","0.33 kg","https://www.amazon.com/dp/B0CQWVLL44"
"","","B0CQ3Y6HGD","Silent Basketball | Size 7 (29.5') | Indoor Basketball | Quiet Basketball | Foam Basketball | Silent Basketball Dribbling Indoor | Silent Ball","Generic","$49.99","108","","$5,399","12/12/2023","$27.85","","","$22.14","280,247","7","FBA","1","Sports & Outdoors","Oversize","10 x 10 x 10 in","0.32 kg","https://www.amazon.com/dp/B0CQ3Y6HGD"
"","","B0CRPM33K1","Silent Basketball Higher Density, Silent Foam Swish Basketball Indoor","Crasoldiers","$23.99","450","6","$10,796","01/05/2024","$16.62","4","2","$7.37","39,124","6","FBA","1","Sports & Outdoors","Standard","6 x 5 x 8.2 in","8 oz","https://www.amazon.com/dp/B0CRPM33K1"
"","","B0CTT9K72F","Silent Basketball, 2024 Quiet Basketball Indoor, Silent Basketball Dribbling Indoor, Hush Handle Silent Foam Basketball, Indoor Training Foam BalNo Noise BasketballNo. 7","Generic","$29.99","90","3","$2,699","","","","","","66,442","","FBA","","Sports & Outdoors","","","","https://www.amazon.com/dp/B0CTT9K72F"
"","","B0CJ3BYXDP","Renhe ingenuity The Handleshh Silent Basketball, Silent Basketball, Silent Basketball Dribbling Indoor, Uncoated High Density Foam Ball with Low Noise","Renhe ingenuity","$23.99","80","2","$1,919","09/13/2023","$16.85","3","22","$7.14","124,454","7","FBA","1","Sports & Outdoors","Standard","7.36 x 7.01 x 8.5 in","0.09 kg","https://www.amazon.com/dp/B0CJ3BYXDP"
"","","B0CTGLY2JS","18cm/7.09inch Orange Striped Ball, Soundless Basketball for Entertainment and Training","Generic","$14.99","60","2","$899.40","","","","","","108,436","","FBA","","Sports & Outdoors","","","","https://www.amazon.com/dp/B0CTGLY2JS"
"","","B09GS62V7R","SKLZ Pro Mini Hoop 5-Inch Foam Basketball","SKLZ","$7.99","1,971","82","$15,748","09/20/2021","$3.25","4.6","4,533","$4.74","1,901","5","AMZ","1","Sports & Outdoors","Standard","9.09 x 4.92 x 11.1 in","0.16 kg","https://www.amazon.com/dp/B09GS62V7R"
"","","B0CNXHN97B","Silent Basketball, Silent Basketball Dribbling Indoor No Noise, Size 6 (28.5') & Size 5 (27.5') & Size 3 (26.5') Standard Hush Handle Foam Basketball","Generic","$15.99","136","3","$2,175","11/23/2023","","4.1","8","","67,183","7","FBM","1","Sports & Outdoors","","","","https://www.amazon.com/dp/B0CNXHN97B"
"","","B0CP7ZBX79","SunDogo Silent Basketball Dribbling Indoor, 2024 Hush Handle Basketball, Quiet Foam Basketball Size 7 (29.5') Mute Basketball, Indoor Training Basketball Gift for Youth Athletes","SunDogo","$25.99","94","","$2,443","01/04/2024","$16.30","3","1","$9.69","299,108","7","FBA","1","Sports & Outdoors","Standard","9.7 x 2 x 9.7 in","0.84 kg","https://www.amazon.com/dp/B0CP7ZBX79"
"","","B0CTC9XMFB","Silent Basketball, Silent Basketball Dribbling Indoor No Noise, Size 7 (29.5') & Size 5 (27.5') & Size 3 (26.5') Quiet Foam Basketball Soundless","Generic","$10.99","220","6","$2,418","01/25/2024","","","","","39,152","7","FBM","1","Sports & Outdoors","","","","https://www.amazon.com/dp/B0CTC9XMFB"
"","","B0CQ48D3TN","Silent BasketballFoam Basketball Indoor Training BallStandard Hush Handle Basketball, Quiet Basketball Dribbling Indoor, Silent Swish Basketball(Diameter 18cm)","Generic","$18.99","30","1","$569.70","01/02/2024","","1","3","","180,828","","FBA","1","Sports & Outdoors","","","","https://www.amazon.com/dp/B0CQ48D3TN"
"","","B0CR9S2B6R","Silent Basketball,2024Foam Basketball Silent 3-18cm/7.1in Dunk Basketball Indoor Training,The Handleshh Silent Basketball,Hushhandle Silent Foam Basketball(Kids' basketball)","Generic","$21.99","200","","$4,398","01/01/2024","$15.15","2.5","2","$6.84","272,019","7","FBA","1","Sports & Outdoors","Standard","4.65 x 3.98 x 5.2 in","0.15 kg","https://www.amazon.com/dp/B0CR9S2B6R"
"","","B0CT2MX49L","Nuzofy Silent Basketball, Silent Basketball, 2024 New Silent Basketball Dribbling Indoor, Foam Basketball No Noise, Quiet Bounce Basketball, Handle Basketball","OVFD","$8.99","","","","01/22/2024","","","","","","7","FBM","1","","","","","https://www.amazon.com/dp/B0CT2MX49L"
"","","B0CPJND7LN","Mopogool Quiet Basketball No Noise A Silent Basketball Dribbling Indoor Soft Basketball Silent Ball No Sound Basketball Quite Silent Basketball Size 7 28.5 29.5 Quiet Bounce","Mopogool","$14.98","","","","12/04/2023","","4.3","3","","","","FBM","1","","","","","https://www.amazon.com/dp/B0CPJND7LN"
"","","B0CLGSLT1L","Silent Basketball, 2023 Newest Quiet Basketball Indoor, Foam Indoor Dribbling Training Ball, Uncoated High-Density, Mute High-Resilience Safe Soft Lightweight","Orgonite","$11.99","450","12","$5,396","10/19/2023","$6.42","4","20","$5.57","18,762","7","FBM","2","Sports & Outdoors","Standard","7.95 x 7.83 x 8.5 in","0.19 kg","https://www.amazon.com/dp/B0CLGSLT1L"
"","","B0CL3Z6Z9X","ANCAI Silent Basketball, 2023 Newest Foam Basketball Indoor Training Ball, Uncoated High-Density Foam Ball, Low Noise Basketball Foam Balls,Easy to Grip Quiet Ball for Various Indoor Activities","ANCAI","","","","","","","2.6","6","","","","","","","","","","https://www.amazon.com/dp/B0CL3Z6Z9X"
"","","B08MWW3NGY","Botabee SKLZ Pro Mini Basketball Hoop - Basketball Hoop for Kids - Indoor Hoop Basketball Set - Safe & Soft Foam - Quiet Bounce Basketball Hoop Ages - 5' Foam Mini Basketball 2 Pack","Botabee","$19.99","919","29","$18,371","11/05/2020","$13.22","4.6","1,125","$6.77","10,160","5","FBA","1","Toys & Games","Standard","5.83 x 4.96 x 10.63 in","0.19 kg","https://www.amazon.com/dp/B08MWW3NGY"
"","","B000KA2UDK","Champion Sports Coated High Density Foam Basketball, Orange","Champion Sports","$14.44","74","3","$1,069","06/30/2003","$8.50","3.5","72","$5.94","86,573","5","AMZ","7","Sports & Outdoors","Standard","8.15 x 7.68 x 9.76 in","0.29 kg","https://www.amazon.com/dp/B000KA2UDK"
"","","B0CR3NXWJW","Silent Basketball, Silent Swish Basketball, 2024 Silent Basketball Dribbling Indoor, Noise Training Foam Ball, Hush Handle Silent Foam Basketball,Low Noise No Sound Basketball","Generic","$12.00","60","2","$720.00","12/27/2023","","5","1","","91,968","7","FBM","1","Sports & Outdoors","","","","https://www.amazon.com/dp/B0CR3NXWJW"
"","","B0CTRWLXZS","Oujebveg Silent Basketball, 2024 New Quiet Basketball Indoor, Silent Basketball Dribbling Indoor, Hush Handle Silent Foam Basketball, No Noise Basketball, Indoor Training Foam Ball","Oujebveg","$8.99","30","1","$269.70","","","","","","203,486","","","","Sports & Outdoors","","","","https://www.amazon.com/dp/B0CTRWLXZS"
"","","B0CQ25B4NQ","Quiet Bounce Basketball, Silent Basketball Dribbling Indoor, Quiet Basketball, Basketball No Noise, A Silent Basketball","Generic","$15.99","90","3","$1,439","","","1","1","","87,459","","","","Sports & Outdoors","","","","https://www.amazon.com/dp/B0CQ25B4NQ"
"","","B07G3L6QQP","Skywalker Sports Orange Foam Basketball (Set of 2)","Skywalker Sports","$23.74","45","2","$1,068","07/31/2018","$16.41","4.4","295","$7.33","110,938","3","AMZ","1","Sports & Outdoors","Standard","5.79 x 5.79 x 10.43 in","0.31 kg","https://www.amazon.com/dp/B07G3L6QQP"
"","","B002OMBASS","Baden SkilCoach Shooter's Rubber Training Basketball, 28.5-Inch","Baden","$28.83","831","10","$23,958","09/06/2009","$12.53","4.7","1,408","$16.30","23,998","4","AMZ","2","Sports & Outdoors","Oversize","10.3 x 10.7 x 10.2 in","1.85 lb","https://www.amazon.com/dp/B002OMBASS"
"","","B07GXDS9PB","Ceiling Swish: Indoor Mini Basketball Hoop for Kids Toy Game - Includes Basketball Net Backboard and Two Mini Basketballs","CEILING SPORT","$29.99","1,016","31","$30,470","08/27/2018","$21.72","4.1","1,317","$8.27","9,488","7","FBA","1","Toys & Games","Standard","12.99 x 5.55 x 13.19 in","0.3 kg","https://www.amazon.com/dp/B07GXDS9PB"
"","","B0CTHC5KWP","Silent Basketball, Nuzofy Silent Basketball, 5/6/7 Silent Basketball Dribbling Indoor, Foam A Silent Basketball with Hoop","Kudias","$8.99","60","2","$539.40","","","","","","104,204","","","","Sports & Outdoors","","","","https://www.amazon.com/dp/B0CTHC5KWP"
"","","B0CQP93D5P","Silent Basketball - 29.5', 28.5', 27.5', Silent Basketball Dribbling Indoor, Quiet Bounce Basketball, Foam Basketball No Noise, with Mini Basketball Hoop","GZSO","$19.98","42","1","$839.16","12/19/2023","","2","1","","172,848","7","FBM","1","Sports & Outdoors","","","","https://www.amazon.com/dp/B0CQP93D5P"
"","","B0CR7598BW","Silent Basketball 2024 Newest Foam Basketball Indoor Training Ball,Standard Hush Handle Basketball, Silent Basketball Dribbling Indoor, Silent Foam Basketball for Indoor","Generic","$6.99","30","1","$209.70","01/03/2024","","","","","190,490","","FBM","1","Sports & Outdoors","","","","https://www.amazon.com/dp/B0CR7598BW"