"Export time:  2/5/2024, 12:44:47 AM","","ASIN","Product Name","Brand","Price","Monthly Units Sold","Daily Units Sold","Monthly Revenue","Date First Available","Net Revenue","Star Rating","Reviews","Amazon Fees","BSR","LQS","Seller Type","Sellers","Category","Product Tier","Dimensions","Weight","Link"
"","","B089F8D68H","Moncot C Shaped End Table TV Trays with Detachable Wheels, White Marble Texture Side Table, MDF Wood Top Table for Small Space Couch Sofa Bedroom Living Room (White)","Moncot","$77.99","45","1","$3,510","05/29/2020","$52.49","4.3","497","$25.50","539,039","7","FBA","1","Home & Kitchen","Oversize","16.142 x 3.937 x 26.378 in","10.362 lb","https://www.amazon.com/dp/B089F8D68H"
"small drink table","","B09X9GMLZG","AOJEZOR Accent Side / End Table, Waterproof Metal Structure, Great for Living Room, Bedroom, Indoor & Outdoor, Matte Black Tray Surface with 3 Legs, Ideal for Any Room","AOJEZOR","$37.88","5,059","140","$191,635","03/13/2022","$20.22","4.6","3,932","$17.66","5,088","7","FBA","3","Home & Kitchen","Oversize","19.3 x 2.6 x 23 in","6.6 lb","https://www.amazon.com/dp/B09X9GMLZG"
"Average Monthly Sales: 574","","B09KSVWYKV","Shamrock Home Bamboo Couch Arm Table, Clip On Tray Sofa Table for Couches. Sofa Arm Tray, Armchair Table for TV Dinners, Remotes, Drinks and Snacks - 13.75 x 9.5inch, Brown","Shamrock Home","$34.99","2,004","55","$70,120","02/07/2022","","4.7","5,127","","4,715","7","FBA","1","Kitchen & Dining","","","","https://www.amazon.com/dp/B09KSVWYKV"
"Average Revenue: $23,650","","B0C559WNJX","KMANDLU Premium Clear Acrylic Side Table Set - 2-Tier End Table, Nightstand, Coffee Table - Ideal for Small Spaces - Modern Acrylic Furniture","KMANDLU","$39.99","","","$4,450","05/12/2023","","4.3","42","","700,711","7","FBA","1","Home & Kitchen","","","","https://www.amazon.com/dp/B0C559WNJX"
"Average Price: $58.55","","B0CGD6RQV1","DREAMODERN Round Pedestal Table Black Side Table, Modern End Table Small Drink Table for Small Spaces Sofa Couch Chair Patio - Black","DREAMODERN","$39.99","331","22","$13,237","08/22/2023","","4.4","10","","41,993","6","FBA","1","Home & Kitchen","","","","https://www.amazon.com/dp/B0CGD6RQV1"
"Average No. of Ratings: 417","","B0C8NBVNM4","COVLON Pedestal Side Table, Drink Table, Small End Table, Martini Table for Living Room, Dorm, Home Office and Bedroom, Distressed Finish, Brown","COVLON","$47.97","360","12","$17,269","06/19/2023","","4.4","29","","75,904","6","FBA","1","Home & Kitchen","","","","https://www.amazon.com/dp/B0C8NBVNM4"
"Average Sales Rank: 277,285","","B08RSLPX5N","Kate and Laurel Sanzo Bohemian Side Table, 9 x 9 x 23, Gold, Decorative Pedestal End Table for Display and Storage","Kate and Laurel","$79.99","130","11","$10,399","12/30/2020","$53.73","4.8","220","$26.26","83,481","7","AMZ","4","Home & Kitchen","Oversize","10.2 x 19.6 x 9.8 in","7.1 lb","https://www.amazon.com/dp/B08RSLPX5N"
"Average Rating Number: 4.4","","B0B2QQ32RC","HMYHUM Clear Acrylic Drink Table for Small Spaces, Martini Table for Living Room, Small Drink Side Table, 3 Tiers, C Shaped, 8' L x 8' W x 26' H","HMYHUM","$45.99","69","1","$3,173","05/30/2022","$33.30","4.3","56","$12.69","495,813","6","FBA","1","Home & Kitchen","Standard","8 x 2 x 13 in","3 lb","https://www.amazon.com/dp/B0B2QQ32RC"
"","","B0BBXZTJZC","mDesign Glass Top Side/End Drink Table - Small Modern Round Accent Metal Nightstand Furniture for Living Room, Dorm, Home Office, and Bedroom - 9' Round - Soft Brass","mDesign","$52.99","630","21","$33,384","08/24/2022","","4.6","446","","45,248","7","FBA","1","Home & Kitchen","","","","https://www.amazon.com/dp/B0BBXZTJZC"
"","","B0BC4221GN","HMYHUM Acrylic Drink Table for Small Spaces, 10' L x 10' W x 21.3' H, Drink Side/End Table for Living Room, Round, Easy Assembly, Clear","HMYHUM","$39.99","333","12","$13,317","08/26/2022","","4.5","158","","73,851","6","FBA","1","Home & Kitchen","","","","https://www.amazon.com/dp/B0BC4221GN"
"","","B0BV9NCPJ7","COVLON Drink Table, Weighted Base Pedestal Table, Modern Martini Table, Small Side Table with Wooden Carved Table Top for Living Room, Bedroom, Gold and Black","COVLON","$47.97","406","13","$19,476","02/08/2023","","4.7","55","","70,370","6","FBA","1","Home & Kitchen","","","","https://www.amazon.com/dp/B0BV9NCPJ7"
"","","B0BRQVTMZJ","Kate and Laurel Alessia Modern Decorative Metal Drink Table, 8 x 8 x 22, Gold, Stunning Cast Aluminum Pedestal Plant Stand with Rough Texture and Deckled Edge, 8x8x22","Kate and Laurel","$105.34","139","4","$14,642","01/04/2023","","4.9","16","","196,071","7","AMZ","3","Home & Kitchen","","","","https://www.amazon.com/dp/B0BRQVTMZJ"
"","","B00MNFZJ2Y","Creative Co-Op Metal Martini Table","Creative Co-Op","$84.62","404","11","$34,186","10/02/2017","$52.35","4.2","284","$32.27","24,032","5","AMZ","12","Kitchen & Dining","Oversize","14.016 x 20.512 x 14.016 in","5.399 lb","https://www.amazon.com/dp/B00MNFZJ2Y"
"","","B0C33G2SNY","Fogein Set of 2 End Table with Wheels, 2-Tier Side Table, Sode Table, Side Table with Storage, Table Stand, Nightstand for Living Room Bedroom Small Space Table(Black)","Fogein","$22.99","120","4","$2,759","","","4.2","28","","222,060","","FBA","","Home & Kitchen","","","","https://www.amazon.com/dp/B0C33G2SNY"
"","","B0BYNBCHZC","Eglaf Acrylic End Table with Storage - Small Side Table for Small Spaces - Small Nightstand for Living Room, Bedroom - 15'' L x 11'' W x 23''H, Removable Fabric Drawer","Eglaf","$49.99","30","1","$1,500","03/15/2023","","4.8","5","","657,332","6","FBA","1","Home & Kitchen","","","","https://www.amazon.com/dp/B0BYNBCHZC"
"","","B0BS1SXM3B","Shamrock Home Bambo Couch Arm Table, Clip On Tray Sofa Table for Couches. Sofa Arm Tray for TV Table Dinners, Remotes, Drinks and Snacks and Small Spaces - 13x10.8in, Brown","Shamrock Home","$31.99","466","11","$14,907","01/09/2023","","4.6","1,766","","24,178","7","FBA","2","Kitchen & Dining","","","","https://www.amazon.com/dp/B0BS1SXM3B"
"","","B0BFHNSQWP","Aquiver Acrylic Drink Table for Small Space - Sofa Side Table for Drinks, Remotes, Phones - Metal Base, 7.9'' L x 7.9'' W x 20.1'' H","Aquiver","$39.99","86","5","$3,439","09/15/2022","","4.8","24","","179,744","6","FBA","1","Home & Kitchen","","","","https://www.amazon.com/dp/B0BFHNSQWP"
"","","B09Q1YSRVV","Viltisumt Small Side End Table 2022 New C Table Narrow Round Bed Sofa Couch Coffee Dinner Table for Snack Drink TV Tray, Slim Gold Rustic End Table Modern Simplicity, Metal and Wood - 24 Inch (Wood)","Viltisumt","$89.89","95","2","$8,540","01/08/2022","","3.8","51","","393,605","7","FBA","2","Home & Kitchen","","","6 lb","https://www.amazon.com/dp/B09Q1YSRVV"
"","","B09X61P893","mDesign Glass Top Side/End Drink Table - Tall Modern Round Accent Metal Nightstand Furniture for Living Room, Dorm, Home Office, and Bedroom - 9' Round - Matte Black","mDesign","$49.99","685","21","$34,243","04/03/2022","$35.16","4.6","446","$14.83","45,264","7","FBA","1","Home & Kitchen","Standard","12.91 x 13.15 x 4.45 in","6.239 lb","https://www.amazon.com/dp/B09X61P893"
"","","B08X6J8R6Z","HollyHOME Small Round Metal Waterproof End Table, Accent Indoor&Outdoor Coffee Side Table, Snack Sofa Table for Living Room, Anti-Rust Decorative Plant Stand, (D) 14.5' x (H) 25', Golden","HollyHOME","$45.99","168","3","$7,726","02/22/2021","$24.83","4.5","364","$21.16","59,384","7","FBA","1","Patio, Lawn & Garden","Oversize","17.5 x 24.5 x 4.6 in","5.099 lb","https://www.amazon.com/dp/B08X6J8R6Z"
"","","B0CDN3ZLV1","YANEVA Modern Bamboo Small Side Table, Moveable Tv Tray, Sofa Side Table Slide Under, Snack Table for Living Room, Laptop Rolling Table, C Shaped End Table for Couch and Sofa, Bed Side Table Tray","YANEVA","$98.75","30","1","$2,963","12/23/2023","","4.8","5","","503,710","6","FBA","1","Home & Kitchen","","","","https://www.amazon.com/dp/B0CDN3ZLV1"
"","","B0CMTCG7F6","Gawicpy 2-Tier End Table with Tempered Glass, Gold Metal Side Tables Sofa Side Table for Small Spaces, Glass Stand Table Modern Square End Tables for Living Room, Bedroom (1pcs, Gold)","Gawicpy","$39.99","90","3","$3,599","","","","","","234,183","","FBA","","Home & Kitchen","","","","https://www.amazon.com/dp/B0CMTCG7F6"
"","","B0C1VMWTKL","Eglaf Acrylic Narrow Side Table for Small Spaces - Slim End Table with Magazine Holder - Skinny Side Table Small Bedside Table Nightstand for Living Room Bedroom - 15.7 L x 7 W x 23.9 H","Eglaf","$79.99","30","1","$2,400","","","5","6","","530,956","","FBA","","Home & Kitchen","","","","https://www.amazon.com/dp/B0C1VMWTKL"
"","","B0CJDSP8SF","Drink Table, Round Pedestal Table with Weighted Base, Black Side Table Modern Cocktail Table Martini Table Small End Table Premium Accent Table for Sofa Couch Chair Living Room Bedroom Dorm Patio","HanStrong","$41.99","90","3","$3,779","12/24/2023","","5","1","","272,488","","FBA","1","Home & Kitchen","","","","https://www.amazon.com/dp/B0CJDSP8SF"
"","","B089ZTSD8P","Urban Lifestyle Brown Marble Collapsible Side Accent Drink Table with Gold Metal Legs 12 in x 12 in x 13.5 in","Urban Lifestyle","$36.26","288","5","$10,443","06/09/2020","$22.59","4","422","$13.67","182,786","6","AMZ","4","Home & Kitchen","Standard","3 x 13.5 x 12 in","10 lb","https://www.amazon.com/dp/B089ZTSD8P"
"","","B0CC4X57FG","eFösi Drink Table for Small Spaces, Drink Stand Martini Table, Small Drink Table, End Table for Living Room, Pedestal Side Table, Martini Table for Small Spaces, 9' L x 9' W x 24' H (Acacia, Natural)","eFösi","$39.99","83","1","$3,319","12/24/2023","","4.1","4","","478,402","7","FBA","1","Home & Kitchen","","","","https://www.amazon.com/dp/B0CC4X57FG"
"","","B0BYB3NHKN","Creative Co-Op Stacked Pedestal Cocktail Side Table, Black","Creative Co-Op","$82.18","90","3","$7,396","04/20/2023","","4.6","15","","246,914","","AMZ","1","Home & Kitchen","","","","https://www.amazon.com/dp/B0BYB3NHKN"
"","","B0C6PZP5KJ","White Round Side Table Small End Table Set of 2 Modern Accent Table Pedestal Drink Table with Marble Base for Small Spaces Living Room Bedroom Outdoor","BTY","$39.99","195","16","$7,798","05/30/2023","","3.7","13","","59,050","7","FBA","1","Home & Kitchen","","","","https://www.amazon.com/dp/B0C6PZP5KJ"
"","","B0CJTCWXX6","smusei Drink Tables for Small Spaces Pedestal Side Table with Marble Base Small Round Side Table Black Coffee Table for Sofa Couch Chair Patio, Black","smusei","$34.98","407","22","$14,237","01/27/2024","","4.4","21","","42,454","7","FBA","1","Home & Kitchen","","","","https://www.amazon.com/dp/B0CJTCWXX6"
"","","B0B5L66Z94","DCLRN Small End Table,c Table End Table for Sofa,Round Coffee Table is Suitable for Living Room and Bedroom.(Black)","DCLRN","$36.99","364","11","$13,464","06/30/2022","$19.46","4.5","178","$17.53","85,099","6","FBA","2","Home & Kitchen","Oversize","17.5 x 23.5 x 3 in","8.951 lb","https://www.amazon.com/dp/B0B5L66Z94"
"","","B09QC6QN7D","Yoobure C Shaped End/Side Table for Couch and Bed, Small Spaces, Living Room, Bedroom, Rustic Snack Table","Yoobure","$26.99","2,815","121","$75,977","04/23/2022","$15.31","4.5","1,664","$11.68","6,174","6","FBA","10","Home & Kitchen","Standard","11.811 x 17.677 x 3.347 in","7.394 lb","https://www.amazon.com/dp/B09QC6QN7D"
"","","B0CJC5YR8C","Drink Table, Metal Base Side Table for Small Spaces,Tall Modern Round End Table/Martini Table Furniture for Living Room, Dorm, Home Office, and Bedroom","SCANORDIC","$42.99","96","","$4,127","11/04/2023","","5","3","","1,135,889","6","FBA","1","Home & Kitchen","","","","https://www.amazon.com/dp/B0CJC5YR8C"
"","","B0B9CHN4G1","Powell Drink Metal Marble Top and Base Ayleen Side Table, Green and Gold","Powell","$99.99","30","1","$3,000","","","4.5","4","","659,269","","AMZ","","Home & Kitchen","","","","https://www.amazon.com/dp/B0B9CHN4G1"
"","","B09B4FJZFN","Kate and Laurel Aguilar Modern Drink Table, 8 x 8 x 23, White and Gold, Genuine Marble Accent Table for Small Spaces","Kate and Laurel","$119.99","278","17","$33,357","07/22/2021","$84.69","4.3","373","$35.30","55,699","7","AMZ","7","Home & Kitchen","Oversize","10.5 x 25.5 x 11.5 in","7.9 lb","https://www.amazon.com/dp/B09B4FJZFN"
"","","B09WZBST5D","Kate and Laurel Bellport Pedestal End Table, 10x10x22, Gray","Kate and Laurel","$110.99","","","$0.00","03/30/2022","$81.38","3.9","15","$29.61","876,953","6","AMZ","4","Home & Kitchen","Oversize","4.33 x 12.99 x 21.65 in","9.7 lb","https://www.amazon.com/dp/B09WZBST5D"
"","","B09GYVT2HX","Kate and Laurel Jaspur Modern Drink Table, 7 x 7 x 21, Bronze, Decorative Glam Accent Table for Display and Storage","Kate and Laurel","$99.99","78","2","$7,799","11/03/2021","$70.35","4.3","96","$29.64","308,989","7","AMZ","6","Home & Kitchen","Oversize","9.25 x 24 x 9.5 in","5.3 lb","https://www.amazon.com/dp/B09GYVT2HX"
"","","B08SL4XPBG","Pekokavo Sofa Arm Clip Tray, Side Table for Remote Controls/Drinks/Gamepads Holder (Black)","NDL","$17.99","430","12","$7,736","01/09/2021","$10.15","4.2","775","$7.84","78,799","6","FBA","1","Home & Kitchen","Standard","10.118 x 10.591 x 1.378 in","0.99 lb","https://www.amazon.com/dp/B08SL4XPBG"
"","","B0BN1DSGJQ","BEWISHOME Round End Table Side Table with Metal Frame, Accent Table with 3-Tier Shelves, Small Table for Living Room Couch Table Small Coffee Table Greige KTZ41G","BEWISHOME","$59.99","742","47","$44,513","01/09/2023","","4.6","319","","19,063","7","FBA","1","Home & Kitchen","","","","https://www.amazon.com/dp/B0BN1DSGJQ"
"","","B0BW99RQZL","COZYMATIC Castiglia Small Round Side Table, Accent Pedestal Coffee Table with Wood Table Top, Small Drink Table, Sofa Table for Living Room, Bedroom, and Small Space (Walnut)","COZYMATIC","$169.69","30","1","$5,091","04/09/2023","","3.9","3","","670,862","7","FBA","1","Home & Kitchen","","","","https://www.amazon.com/dp/B0BW99RQZL"
"","","B0BGVJPR6Q","Small Round Gold Side Table by Objet DArt, Rhodes, Accent, End, Pedestal, Martini, Cocktail and Drink Table for Living Room and Small Spaces, Vintage Metal Brass Style Decor, 21 Height","OBJET D'ART","$109.99","210","7","$23,098","09/28/2022","","4.3","121","","131,994","7","FBA","1","Home & Kitchen","","","","https://www.amazon.com/dp/B0BGVJPR6Q"
"","","B0BZRR6XWC","CRAFTFORCE Clear Acrylic Drink Table, Small Round Side Table for Small Spaces, 10' L x 10' W x 21.3' H, Minimalist Acrylic Side Table for Living Room, Bedroom, Bathroom, Hallway, Balcony","CRAFTFORCE","$38.99","120","4","$4,679","03/27/2023","","4","44","","222,408","6","FBA","1","Home & Kitchen","","","","https://www.amazon.com/dp/B0BZRR6XWC"
"","","B0B6378LQ6","VASAGLE C-Shaped End Table, Side Table for Sofa, Couch Table with Metal Frame, Small TV Tray Table for Living Room, Bedroom, Rustic Brown and Black","VASAGLE","$29.90","2,628","148","$78,577","07/07/2022","","4.7","928","","4,731","6","FBA","2","Home & Kitchen","","","","https://www.amazon.com/dp/B0B6378LQ6"
"","","B0B9DQ7HDH","Powell White Marble Top Drink Industrial Style Black Metal Adjustable Height Base Muriel Side Table","Powell","$109.60","","","$0.00","08/10/2022","","","","","2,098,429","6","AMZ","1","Home & Kitchen","","","","https://www.amazon.com/dp/B0B9DQ7HDH"
"","","B09QPN8B39","Kate and Laurel Sanzo Modern Pedestal Side Table, 9 x 9 x 23, Pewter, Decorative End Table With Hammered Tabletop","Kate and Laurel","$47.97","220","11","$10,553","01/26/2022","$21.26","4.7","69","$26.71","83,481","7","AMZ","1","Home & Kitchen","Oversize","9.6 x 19.5 x 10.4 in","7.25 lb","https://www.amazon.com/dp/B09QPN8B39"
"","","B08VDQN8H5","VASAGLE C-Shaped End Table, Small Side Table for Couch, Sofa Table with Metal Frame for Living Room, Bedroom, Bedside, Rustic Brown and Black","VASAGLE","$33.99","5,039","191","$171,276","06/22/2021","$20.66","4.7","3,168","$13.33","3,283","6","FBA","5","Home & Kitchen","Standard","12.992 x 17.284 x 3.15 in","9.248 lb","https://www.amazon.com/dp/B08VDQN8H5"
"","","B0BL82FWC9","Signature Design by Ashley Caramont 27'H Marble Accent Table, Black & White","Signature Design by Ashley","$119.99","45","1","$5,400","11/01/2022","","3.7","13","","461,759","6","AMZ","4","Home & Kitchen","","","","https://www.amazon.com/dp/B0BL82FWC9"
"","","B0C77BRHC6","TINSAWOOD Black Side Table, Two-Tier Round End Table, Modern Small Side Table Living Room, Bedroom & Balcony, Black End Table with Storage Shelf with Solid Wooden Legs","TINSAWOOD","$49.99","250","10","$12,498","06/06/2022","","4.3","225","","87,904","7","FBA","30","Home & Kitchen","","","","https://www.amazon.com/dp/B0C77BRHC6"
"","","B0C5JF4NL8","C-Shaped End Table, Snack Side Table for Couch, End Table for Small Space, Rustic Brown and Black C Table with Metal Frame, Sofa Side End Table, Small Table for Living Room, Bedroom, Sitting Room","Handwell","$35.99","30","1","$1,080","05/14/2023","","4.1","28","","493,847","7","FBA","3","Home & Kitchen","","","","https://www.amazon.com/dp/B0C5JF4NL8"
"","","B0CKP34B61","Bestjing Bamboo Sofa Armrest Tray - Couch Arm Tray with Detachable Couch Cup Holder Tray - Anti-Slip Foldable Sofa Table Tray - Cup Holder Tray for Drinks Cup Cellphone Remote Snacks","Bestjing","$27.99","146","18","$4,087","11/14/2023","$17.36","4.9","23","$10.63","53,232","7","FBA","1","Home & Kitchen","Standard","13.3 x 2 x 16.3 in","2.7 lb","https://www.amazon.com/dp/B0CKP34B61"
"","","B0B5LBZTD2","GYCZYCX C Shaped End Table,Round C Table,Snack Side Table for Sofa and Bed, Living Room(Black), 15D x 15W x 23H in","GYCZYCX","$39.99","333","9","$13,317","06/30/2022","$22.01","4.4","216","$17.98","98,411","6","FBA","3","Home & Kitchen","Oversize","17.5 x 23.5 x 3 in","8.699 lb","https://www.amazon.com/dp/B0B5LBZTD2"
"","","B0BV6JSKDP","QEEIG Narrow C Shaped Side Table Set of 2 Living Room Sets Slim Couch Tables Skunny Thin Small Modern 7 inch Width, White","QEEIG","$59.82","2,682","68","$160,437","06/27/2023","","4.4","346","","12,683","7","FBA","1","Home & Kitchen","","","","https://www.amazon.com/dp/B0BV6JSKDP"
"","","B0C3VPG2BV","Drink Table, Small Side Table for Small Spaces, Round Cocktail Table, Pedestal Table with 2-Tier Shelves, Wooden Martini Table (25''H)","Oakrain","$53.99","60","3","$3,239","04/26/2023","","4.1","15","","263,423","6","FBA","1","Home & Kitchen","","","","https://www.amazon.com/dp/B0C3VPG2BV"
"","","B08XPPRVVC","mDesign Triangle Metal & Glass in-Lay Accent Table - Small Side/End/Drink Table - Decorative Legs, Glass Top - Home Decor Accent Furniture for Living Room, Bedroom - Soft Brass/Glass","mDesign","$44.99","115","5","$5,174","02/27/2021","$25.88","4.1","263","$19.11","176,103","7","FBA","1","Home & Kitchen","Oversize","4.098 x 20.5 x 15.15 in","6.195 lb","https://www.amazon.com/dp/B08XPPRVVC"
"","","B0C6138J3X","PEKVIZK Acrylic End Table, Clear Side Tables for Small Space, 9.8' Round Modern Drink Table for Living Room, Bedroom, Bathroom, Office, Outdoor, Business, Sturdy and Easy to Install","PEKVIZK","$39.99","150","4","$5,999","05/22/2023","","4.4","74","","223,901","6","FBA","1","Home & Kitchen","","","","https://www.amazon.com/dp/B0C6138J3X"
"","","B0CG6H9441","Palama Square Side Table, Small Side Table for Small Spaces, Small Metal End Table, Easy Assembly Blue Bedside Table, Small Table Outoor, Single Plant Stand Indoor","Palama","$21.99","300","10","$6,597","05/21/2023","","4.7","536","","19,877","7","FBA","1","Patio, Lawn & Garden","","","","https://www.amazon.com/dp/B0CG6H9441"
"","","B0CLV72WCD","Menkxi 2 Pcs Round Martini Drink Table for Small Spaces Nightstand Living Room Bedroom Small Cocktail Table Drink Stand Side Table Pedestal End Table Vintage Metal Brass Style Decor, 5.74x5.74x25.98''","Menkxi","$82.99","101","1","$8,382","01/14/2024","","1","1","","649,985","7","FBA","1","Home & Kitchen","","","","https://www.amazon.com/dp/B0CLV72WCD"
"","","B0BKG7L8F2","Hosfais Side Table Small End Table: C-Shaped Wood Sofa Table with Metal Frame for Living Room, Bedroom, Small Spaces (Rustic Brown)","Hosfais","$39.99","1,929","71","$77,141","11/30/2022","","4.6","196","","11,975","6","FBA","2","Home & Kitchen","","","","https://www.amazon.com/dp/B0BKG7L8F2"
"","","B0BN1VSDVF","SogesHome Martini Side Table with Terrazzo Pattern Top, C-Shape Round End Table with Carry Handle, Champagne Cocktails Coffee Table, Couch Bedside Table for Living Room, Bedroom, Gold","SogesHome","$39.99","30","1","$1,200","11/20/2022","","4","14","","428,408","7","FBA","1","Home & Kitchen","","","","https://www.amazon.com/dp/B0BN1VSDVF"
"","","B0B55WHC4P","HMYHUM Acrylic Drink Table for Small Spaces, Martini Table for Living Room, Drink Side Table/End Table, Round, Clear, 11.8' L x 11.8' W x 21.3' H","HMYHUM","$79.99","30","1","$2,400","06/26/2022","","4.9","12","","448,360","6","FBA","1","Home & Kitchen","","","","https://www.amazon.com/dp/B0B55WHC4P"